period_index,event_index,period_type,period_number,attribution,away_points,clock,description,event_type,home_points,possession,type,wall_clock,pbp_source_row,has_wall_clock,event_ts_utc,period_sequence,game_clock_seconds_remaining,game_elapsed_seconds,game_elapsed_minutes,pbp_chronological_index
4,125,quarter,1,ba2cb6be-9827-46a8-8e6f-d8661307ba77,0,12:00,"Nuggets lineup change (Nikola Jokic, Christian Braun, Julian Strawther, Cameron Johnson, Jamal Murray)",lineupchange,0,,basketball_play,1770513134,488,True,2026-02-08 01:12:14+00:00,1,720.0,0.0,0.0,1
4,124,quarter,1,65f0250b-455d-43d7-b7dc-7d321bdf9abc,0,12:00,"Bulls lineup change (Jaden Ivey, Anfernee Simons, Guerschon Yabusele, Isaac Okoro, Matas Buzelis)",lineupchange,0,,basketball_play,1770513134,487,True,2026-02-08 01:12:14+00:00,1,720.0,0.0,0.0,2
4,123,quarter,1,,0,12:00,Start of 1st Quarter,startperiod,0,,basketball_play,1770513134,486,True,2026-02-08 01:12:14+00:00,1,720.0,0.0,0.0,3
4,122,quarter,1,65f0250b-455d-43d7-b7dc-7d321bdf9abc,0,12:00,Nikola Jokic vs. Matas Buzelis (Isaac Okoro gains possession),opentip,0,65f0250b-455d-43d7-b7dc-7d321bdf9abc,basketball_play,1770513136,485,True,2026-02-08 01:12:16+00:00,1,720.0,0.0,0.0,4
4,121,quarter,1,65f0250b-455d-43d7-b7dc-7d321bdf9abc,0,11:44,Guerschon Yabusele misses three point jump shot,threepointmiss,0,,basketball_play,1770513149,484,True,2026-02-08 01:12:29+00:00,1,704.0,16.0,0.26666666666666666,5
4,120,quarter,1,ba2cb6be-9827-46a8-8e6f-d8661307ba77,0,11:41,Jamal Murray defensive rebound,rebound,0,ba2cb6be-9827-46a8-8e6f-d8661307ba77,basketball_play,1770513152,483,True,2026-02-08 01:12:32+00:00,1,701.0,19.0,0.31666666666666665,6
4,119,quarter,1,ba2cb6be-9827-46a8-8e6f-d8661307ba77,3,11:30,Cameron Johnson makes three point jump shot (Jamal Murray assists),threepointmade,0,65f0250b-455d-43d7-b7dc-7d321bdf9abc,basketball_play,1770513163,482,True,2026-02-08 01:12:43+00:00,1,690.0,30.0,0.5,7
4,118,quarter,1,65f0250b-455d-43d7-b7dc-7d321bdf9abc,3,11:19,Guerschon Yabusele makes three point jump shot (Matas Buzelis assists),threepointmade,3,ba2cb6be-9827-46a8-8e6f-d8661307ba77,basketball_play,1770513173,481,True,2026-02-08 01:12:53+00:00,1,679.0,41.0,0.6833333333333333,8
4,117,quarter,1,ba2cb6be-9827-46a8-8e6f-d8661307ba77,6,10:55,Julian Strawther makes three point jump shot (Nikola Jokic assists),threepointmade,3,65f0250b-455d-43d7-b7dc-7d321bdf9abc,basketball_play,1770513197,480,True,2026-02-08 01:13:17+00:00,1,655.0,65.0,1.0833333333333333,9
4,116,quarter,1,65f0250b-455d-43d7-b7dc-7d321bdf9abc,6,10:46,Matas Buzelis makes three point jump shot (Jaden Ivey assists),threepointmade,6,ba2cb6be-9827-46a8-8e6f-d8661307ba77,basketball_play,1770513207,479,True,2026-02-08 01:13:27+00:00,1,646.0,74.0,1.2333333333333334,10
4,115,quarter,1,ba2cb6be-9827-46a8-8e6f-d8661307ba77,8,10:25,Nikola Jokic makes two point jump shot (Christian Braun assists),twopointmade,6,65f0250b-455d-43d7-b7dc-7d321bdf9abc,basketball_play,1770513228,478,True,2026-02-08 01:13:48+00:00,1,625.0,95.0,1.5833333333333333,11
4,114,quarter,1,,8,10:08,Stoppage (Out of bounds),stoppage,6,,basketball_play,1770513247,477,True,2026-02-08 01:14:07+00:00,1,608.0,112.0,1.8666666666666667,12
4,113,quarter,1,65f0250b-455d-43d7-b7dc-7d321bdf9abc,8,9:58,Guerschon Yabusele misses three point jump shot,threepointmiss,6,,basketball_play,1770513269,476,True,2026-02-08 01:14:29+00:00,1,598.0,122.0,2.033333333333333,13
4,112,quarter,1,ba2cb6be-9827-46a8-8e6f-d8661307ba77,8,9:53,Nikola Jokic defensive rebound,rebound,6,ba2cb6be-9827-46a8-8e6f-d8661307ba77,basketball_play,1770513275,475,True,2026-02-08 01:14:35+00:00,1,593.0,127.0,2.1166666666666667,14
4,111,quarter,1,ba2cb6be-9827-46a8-8e6f-d8661307ba77,10,9:46,Jamal Murray makes two point driving floating jump shot,twopointmade,6,65f0250b-455d-43d7-b7dc-7d321bdf9abc,basketball_play,1770513282,474,True,2026-02-08 01:14:42+00:00,1,586.0,134.0,2.2333333333333334,15
4,110,quarter,1,65f0250b-455d-43d7-b7dc-7d321bdf9abc,10,9:34,Guerschon Yabusele turnover (out of bounds bad pass),turnover,6,ba2cb6be-9827-46a8-8e6f-d8661307ba77,basketball_play,1770513296,473,True,2026-02-08 01:14:56+00:00,1,574.0,146.0,2.433333333333333,16
4,109,quarter,1,ba2cb6be-9827-46a8-8e6f-d8661307ba77,10,9:20,Julian Strawther misses three point jump shot,threepointmiss,6,,basketball_play,1770513314,472,True,2026-02-08 01:15:14+00:00,1,560.0,160.0,2.6666666666666665,17
4,108,quarter,1,ba2cb6be-9827-46a8-8e6f-d8661307ba77,10,9:19,Nuggets offensive rebound,rebound,6,ba2cb6be-9827-46a8-8e6f-d8661307ba77,basketball_play,1770513315,471,True,2026-02-08 01:15:15+00:00,1,559.0,161.0,2.683333333333333,18
4,107,quarter,1,65f0250b-455d-43d7-b7dc-7d321bdf9abc,10,9:19,Anfernee Simons personal foul (Loose ball) (Jamal Murray draws the foul),personalfoul,6,ba2cb6be-9827-46a8-8e6f-d8661307ba77,basketball_play,1770513324,470,True,2026-02-08 01:15:24+00:00,1,559.0,161.0,2.683333333333333,19
4,106,quarter,1,ba2cb6be-9827-46a8-8e6f-d8661307ba77,13,9:09,Jamal Murray makes three point jump shot (Nikola Jokic assists),threepointmade,6,65f0250b-455d-43d7-b7dc-7d321bdf9abc,basketball_play,1770513344,469,True,2026-02-08 01:15:44+00:00,1,549.0,171.0,2.85,20
4,105,quarter,1,65f0250b-455d-43d7-b7dc-7d321bdf9abc,13,8:57,Matas Buzelis makes two point driving layup,twopointmade,8,ba2cb6be-9827-46a8-8e6f-d8661307ba77,basketball_play,1770513357,468,True,2026-02-08 01:15:57+00:00,1,537.0,183.0,3.05,21
4,104,quarter,1,65f0250b-455d-43d7-b7dc-7d321bdf9abc,13,8:51,Matas Buzelis shooting foul (Christian Braun draws the foul),shootingfoul,8,ba2cb6be-9827-46a8-8e6f-d8661307ba77,basketball_play,1770513364,467,True,2026-02-08 01:16:04+00:00,1,531.0,189.0,3.15,22
4,103,quarter,1,ba2cb6be-9827-46a8-8e6f-d8661307ba77,13,8:51,Christian Braun misses regular free throw 1 of 2,freethrowmiss,8,ba2cb6be-9827-46a8-8e6f-d8661307ba77,basketball_play,1770513398,466,True,2026-02-08 01:16:38+00:00,1,531.0,189.0,3.15,23
4,102,quarter,1,ba2cb6be-9827-46a8-8e6f-d8661307ba77,13,8:51,Nuggets offensive rebound,rebound,8,ba2cb6be-9827-46a8-8e6f-d8661307ba77,basketball_play,1770513398,465,True,2026-02-08 01:16:38+00:00,1,531.0,189.0,3.15,24
4,101,quarter,1,ba2cb6be-9827-46a8-8e6f-d8661307ba77,13,8:51,Christian Braun misses regular free throw 2 of 2,freethrowmiss,8,,basketball_play,1770513398,464,True,2026-02-08 01:16:38+00:00,1,531.0,189.0,3.15,25
4,100,quarter,1,65f0250b-455d-43d7-b7dc-7d321bdf9abc,13,8:49,Jaden Ivey defensive rebound,rebound,8,65f0250b-455d-43d7-b7dc-7d321bdf9abc,basketball_play,1770513400,463,True,2026-02-08 01:16:40+00:00,1,529.0,191.0,3.183333333333333,26
4,99,quarter,1,65f0250b-455d-43d7-b7dc-7d321bdf9abc,13,8:41,Isaac Okoro makes two point reverse layup (Jaden Ivey assists),twopointmade,10,ba2cb6be-9827-46a8-8e6f-d8661307ba77,basketball_play,1770513422,462,True,2026-02-08 01:17:02+00:00,1,521.0,199.0,3.316666666666667,27
4,98,quarter,1,ba2cb6be-9827-46a8-8e6f-d8661307ba77,15,8:27,Julian Strawther makes two point finger roll layup (Nikola Jokic assists),twopointmade,10,65f0250b-455d-43d7-b7dc-7d321bdf9abc,basketball_play,1770513437,461,True,2026-02-08 01:17:17+00:00,1,507.0,213.0,3.55,28
4,97,quarter,1,65f0250b-455d-43d7-b7dc-7d321bdf9abc,15,8:15,Isaac Okoro misses three point jump shot,threepointmiss,10,,basketball_play,1770513448,460,True,2026-02-08 01:17:28+00:00,1,495.0,225.0,3.75,29
4,96,quarter,1,65f0250b-455d-43d7-b7dc-7d321bdf9abc,15,8:12,Anfernee Simons offensive rebound,rebound,10,65f0250b-455d-43d7-b7dc-7d321bdf9abc,basketball_play,1770513451,459,True,2026-02-08 01:17:31+00:00,1,492.0,228.0,3.8,30
4,95,quarter,1,65f0250b-455d-43d7-b7dc-7d321bdf9abc,15,8:01,Jaden Ivey misses three point turnaround jump shot,threepointmiss,10,,basketball_play,1770513463,458,True,2026-02-08 01:17:43+00:00,1,481.0,239.0,3.9833333333333334,31
4,94,quarter,1,ba2cb6be-9827-46a8-8e6f-d8661307ba77,15,7:58,Nikola Jokic defensive rebound,rebound,10,ba2cb6be-9827-46a8-8e6f-d8661307ba77,basketball_play,1770513466,457,True,2026-02-08 01:17:46+00:00,1,478.0,242.0,4.033333333333333,32
4,93,quarter,1,ba2cb6be-9827-46a8-8e6f-d8661307ba77,15,7:52,Jamal Murray turnover (lost ball) (Guerschon Yabusele steals),turnover,10,65f0250b-455d-43d7-b7dc-7d321bdf9abc,basketball_play,1770513472,456,True,2026-02-08 01:17:52+00:00,1,472.0,248.0,4.133333333333334,33
4,92,quarter,1,65f0250b-455d-43d7-b7dc-7d321bdf9abc,15,7:48,Isaac Okoro makes two point running dunk,twopointmade,12,ba2cb6be-9827-46a8-8e6f-d8661307ba77,basketball_play,1770513475,455,True,2026-02-08 01:17:55+00:00,1,468.0,252.0,4.2,34
4,91,quarter,1,ba2cb6be-9827-46a8-8e6f-d8661307ba77,17,7:37,Cameron Johnson makes two point cutting layup (Jamal Murray assists),twopointmade,12,65f0250b-455d-43d7-b7dc-7d321bdf9abc,basketball_play,1770513486,454,True,2026-02-08 01:18:06+00:00,1,457.0,263.0,4.383333333333334,35
4,90,quarter,1,65f0250b-455d-43d7-b7dc-7d321bdf9abc,17,7:25,Anfernee Simons misses three point jump shot,threepointmiss,12,,basketball_play,1770513498,453,True,2026-02-08 01:18:18+00:00,1,445.0,275.0,4.583333333333333,36
4,89,quarter,1,ba2cb6be-9827-46a8-8e6f-d8661307ba77,17,7:23,Nikola Jokic defensive rebound,rebound,12,ba2cb6be-9827-46a8-8e6f-d8661307ba77,basketball_play,1770513500,452,True,2026-02-08 01:18:20+00:00,1,443.0,277.0,4.616666666666666,37
4,88,quarter,1,ba2cb6be-9827-46a8-8e6f-d8661307ba77,17,7:17,Jamal Murray misses three point running pullup jump shot,threepointmiss,12,,basketball_play,1770513506,451,True,2026-02-08 01:18:26+00:00,1,437.0,283.0,4.716666666666667,38
4,87,quarter,1,65f0250b-455d-43d7-b7dc-7d321bdf9abc,17,7:17,Guerschon Yabusele defensive rebound,rebound,12,65f0250b-455d-43d7-b7dc-7d321bdf9abc,basketball_play,1770513506,450,True,2026-02-08 01:18:26+00:00,1,437.0,283.0,4.716666666666667,39
4,86,quarter,1,65f0250b-455d-43d7-b7dc-7d321bdf9abc,17,7:17,Bulls 60 second timeout,teamtimeout,12,,basketball_play,1770513511,449,True,2026-02-08 01:18:31+00:00,1,437.0,283.0,4.716666666666667,40
4,85,quarter,1,ba2cb6be-9827-46a8-8e6f-d8661307ba77,17,7:00,Nuggets technical foul (Defensive three second),technicalfoulnonunsportsmanlike,12,65f0250b-455d-43d7-b7dc-7d321bdf9abc,basketball_play,1770513719,448,True,2026-02-08 01:21:59+00:00,1,420.0,300.0,5.0,41
4,84,quarter,1,65f0250b-455d-43d7-b7dc-7d321bdf9abc,17,7:00,Anfernee Simons makes technical free throw 1 of 1,freethrowmade,13,,basketball_play,1770513736,447,True,2026-02-08 01:22:16+00:00,1,420.0,300.0,5.0,42
4,83,quarter,1,65f0250b-455d-43d7-b7dc-7d321bdf9abc,17,6:53,Isaac Okoro turnover (out of bounds lost ball),turnover,13,ba2cb6be-9827-46a8-8e6f-d8661307ba77,basketball_play,1770513757,446,True,2026-02-08 01:22:37+00:00,1,413.0,307.0,5.116666666666666,43
4,82,quarter,1,65f0250b-455d-43d7-b7dc-7d321bdf9abc,17,6:45,Jaden Ivey shooting foul (Christian Braun draws the foul),shootingfoul,13,ba2cb6be-9827-46a8-8e6f-d8661307ba77,basketball_play,1770513771,445,True,2026-02-08 01:22:51+00:00,1,405.0,315.0,5.25,44
4,81,quarter,1,ba2cb6be-9827-46a8-8e6f-d8661307ba77,18,6:45,Christian Braun makes regular free throw 1 of 2,freethrowmade,13,ba2cb6be-9827-46a8-8e6f-d8661307ba77,basketball_play,1770513801,444,True,2026-02-08 01:23:21+00:00,1,405.0,315.0,5.25,45
4,80,quarter,1,65f0250b-455d-43d7-b7dc-7d321bdf9abc,18,6:45,"Bulls lineup change (Jaden Ivey, Guerschon Yabusele, Isaac Okoro, Collin Sexton, Matas Buzelis)",lineupchange,13,,basketball_play,1770513819,443,True,2026-02-08 01:23:39+00:00,1,405.0,315.0,5.25,46
4,79,quarter,1,ba2cb6be-9827-46a8-8e6f-d8661307ba77,19,6:45,Christian Braun makes regular free throw 2 of 2,freethrowmade,13,65f0250b-455d-43d7-b7dc-7d321bdf9abc,basketball_play,1770513819,442,True,2026-02-08 01:23:39+00:00,1,405.0,315.0,5.25,47
4,78,quarter,1,65f0250b-455d-43d7-b7dc-7d321bdf9abc,19,6:35,Matas Buzelis makes three point jump shot (Collin Sexton assists),threepointmade,16,ba2cb6be-9827-46a8-8e6f-d8661307ba77,basketball_play,1770513831,441,True,2026-02-08 01:23:51+00:00,1,395.0,325.0,5.416666666666667,48
4,77,quarter,1,65f0250b-455d-43d7-b7dc-7d321bdf9abc,19,6:20,Collin Sexton shooting foul (Nikola Jokic draws the foul),shootingfoul,16,ba2cb6be-9827-46a8-8e6f-d8661307ba77,basketball_play,1770513849,440,True,2026-02-08 01:24:09+00:00,1,380.0,340.0,5.666666666666667,49
4,76,quarter,1,ba2cb6be-9827-46a8-8e6f-d8661307ba77,20,6:20,Nikola Jokic makes regular free throw 1 of 2,freethrowmade,16,ba2cb6be-9827-46a8-8e6f-d8661307ba77,basketball_play,1770513880,439,True,2026-02-08 01:24:40+00:00,1,380.0,340.0,5.666666666666667,50
4,75,quarter,1,ba2cb6be-9827-46a8-8e6f-d8661307ba77,20,6:20,"Nuggets lineup change (Nikola Jokic, Christian Braun, Tim Hardaway Jr., Julian Strawther, Jamal Murray)",lineupchange,16,,basketball_play,1770513880,438,True,2026-02-08 01:24:40+00:00,1,380.0,340.0,5.666666666666667,51
4,74,quarter,1,65f0250b-455d-43d7-b7dc-7d321bdf9abc,20,6:20,"Bulls lineup change (Jaden Ivey, Guerschon Yabusele, Patrick Williams, Collin Sexton, Matas Buzelis)",lineupchange,16,,basketball_play,1770513880,437,True,2026-02-08 01:24:40+00:00,1,380.0,340.0,5.666666666666667,52
4,73,quarter,1,ba2cb6be-9827-46a8-8e6f-d8661307ba77,21,6:20,Nikola Jokic makes regular free throw 2 of 2,freethrowmade,16,65f0250b-455d-43d7-b7dc-7d321bdf9abc,basketball_play,1770513904,436,True,2026-02-08 01:25:04+00:00,1,380.0,340.0,5.666666666666667,53
4,72,quarter,1,65f0250b-455d-43d7-b7dc-7d321bdf9abc,21,5:57,Guerschon Yabusele misses two point fadeaway jump shot,twopointmiss,16,,basketball_play,1770513928,435,True,2026-02-08 01:25:28+00:00,1,357.0,363.0,6.05,54
4,71,quarter,1,ba2cb6be-9827-46a8-8e6f-d8661307ba77,21,5:55,Julian Strawther defensive rebound,rebound,16,ba2cb6be-9827-46a8-8e6f-d8661307ba77,basketball_play,1770513930,434,True,2026-02-08 01:25:30+00:00,1,355.0,365.0,6.083333333333333,55
4,70,quarter,1,ba2cb6be-9827-46a8-8e6f-d8661307ba77,21,5:42,Jamal Murray misses three point jump shot,threepointmiss,16,,basketball_play,1770513943,433,True,2026-02-08 01:25:43+00:00,1,342.0,378.0,6.3,56
4,69,quarter,1,65f0250b-455d-43d7-b7dc-7d321bdf9abc,21,5:38,Matas Buzelis defensive rebound,rebound,16,65f0250b-455d-43d7-b7dc-7d321bdf9abc,basketball_play,1770513947,432,True,2026-02-08 01:25:47+00:00,1,338.0,382.0,6.366666666666666,57
4,68,quarter,1,ba2cb6be-9827-46a8-8e6f-d8661307ba77,21,5:38,Julian Strawther personal foul (Jaden Ivey draws the foul),personalfoul,16,65f0250b-455d-43d7-b7dc-7d321bdf9abc,basketball_play,1770513951,431,True,2026-02-08 01:25:51+00:00,1,338.0,382.0,6.366666666666666,58
4,67,quarter,1,ba2cb6be-9827-46a8-8e6f-d8661307ba77,21,5:38,"Nuggets lineup change (Nikola Jokic, Christian Braun, Tim Hardaway Jr., Bruce Brown, Jamal Murray)",lineupchange,16,,basketball_play,1770513961,430,True,2026-02-08 01:26:01+00:00,1,338.0,382.0,6.366666666666666,59
4,66,quarter,1,65f0250b-455d-43d7-b7dc-7d321bdf9abc,21,5:38,"Bulls lineup change (Jaden Ivey, Patrick Williams, Nick Richards, Collin Sexton, Matas Buzelis)",lineupchange,16,,basketball_play,1770513961,429,True,2026-02-08 01:26:01+00:00,1,338.0,382.0,6.366666666666666,60
4,65,quarter,1,65f0250b-455d-43d7-b7dc-7d321bdf9abc,21,5:21,Patrick Williams makes two point turnaround fadeaway jump shot,twopointmade,18,ba2cb6be-9827-46a8-8e6f-d8661307ba77,basketball_play,1770513991,428,True,2026-02-08 01:26:31+00:00,1,321.0,399.0,6.65,61
4,64,quarter,1,ba2cb6be-9827-46a8-8e6f-d8661307ba77,24,5:01,Nikola Jokic makes three point jump shot (Jamal Murray assists),threepointmade,18,65f0250b-455d-43d7-b7dc-7d321bdf9abc,basketball_play,1770514010,427,True,2026-02-08 01:26:50+00:00,1,301.0,419.0,6.983333333333333,62
4,63,quarter,1,65f0250b-455d-43d7-b7dc-7d321bdf9abc,24,4:49,Collin Sexton misses two point driving floating jump shot,twopointmiss,18,,basketball_play,1770514025,426,True,2026-02-08 01:27:05+00:00,1,289.0,431.0,7.183333333333334,63
4,62,quarter,1,65f0250b-455d-43d7-b7dc-7d321bdf9abc,24,4:49,Bulls offensive rebound,rebound,18,65f0250b-455d-43d7-b7dc-7d321bdf9abc,basketball_play,1770514025,425,True,2026-02-08 01:27:05+00:00,1,289.0,431.0,7.183333333333334,64
4,61,quarter,1,,24,4:49,Stoppage (Out of bounds),stoppage,18,,basketball_play,1770514028,424,True,2026-02-08 01:27:08+00:00,1,289.0,431.0,7.183333333333334,65
4,60,quarter,1,65f0250b-455d-43d7-b7dc-7d321bdf9abc,24,4:39,Jaden Ivey misses three point jump shot,threepointmiss,18,,basketball_play,1770514045,423,True,2026-02-08 01:27:25+00:00,1,279.0,441.0,7.35,66
4,59,quarter,1,ba2cb6be-9827-46a8-8e6f-d8661307ba77,24,4:35,Nikola Jokic defensive rebound,rebound,18,ba2cb6be-9827-46a8-8e6f-d8661307ba77,basketball_play,1770514049,422,True,2026-02-08 01:27:29+00:00,1,275.0,445.0,7.416666666666667,67
4,58,quarter,1,ba2cb6be-9827-46a8-8e6f-d8661307ba77,26,4:29,Jamal Murray makes two point running layup (Nikola Jokic assists),twopointmade,18,65f0250b-455d-43d7-b7dc-7d321bdf9abc,basketball_play,1770514054,421,True,2026-02-08 01:27:34+00:00,1,269.0,451.0,7.516666666666667,68
4,57,quarter,1,65f0250b-455d-43d7-b7dc-7d321bdf9abc,26,4:16,Patrick Williams misses three point jump shot,threepointmiss,18,,basketball_play,1770514067,420,True,2026-02-08 01:27:47+00:00,1,256.0,464.0,7.733333333333333,69
4,56,quarter,1,65f0250b-455d-43d7-b7dc-7d321bdf9abc,26,4:15,Collin Sexton offensive rebound,rebound,18,65f0250b-455d-43d7-b7dc-7d321bdf9abc,basketball_play,1770514068,419,True,2026-02-08 01:27:48+00:00,1,255.0,465.0,7.75,70
4,55,quarter,1,65f0250b-455d-43d7-b7dc-7d321bdf9abc,26,4:02,Jaden Ivey misses three point jump shot,threepointmiss,18,,basketball_play,1770514081,418,True,2026-02-08 01:28:01+00:00,1,242.0,478.0,7.966666666666667,71
4,54,quarter,1,65f0250b-455d-43d7-b7dc-7d321bdf9abc,26,3:59,Patrick Williams offensive rebound,rebound,18,65f0250b-455d-43d7-b7dc-7d321bdf9abc,basketball_play,1770514084,417,True,2026-02-08 01:28:04+00:00,1,239.0,481.0,8.016666666666667,72
4,53,quarter,1,65f0250b-455d-43d7-b7dc-7d321bdf9abc,26,3:57,Nikola Jokic blocks Matas Buzelis's two point layup,twopointmiss,18,,basketball_play,1770514087,416,True,2026-02-08 01:28:07+00:00,1,237.0,483.0,8.05,73
4,52,quarter,1,ba2cb6be-9827-46a8-8e6f-d8661307ba77,26,3:54,Nikola Jokic defensive rebound,rebound,18,ba2cb6be-9827-46a8-8e6f-d8661307ba77,basketball_play,1770514090,415,True,2026-02-08 01:28:10+00:00,1,234.0,486.0,8.1,74
4,51,quarter,1,ba2cb6be-9827-46a8-8e6f-d8661307ba77,29,3:51,Tim Hardaway Jr. makes three point running jump shot (Nikola Jokic assists),threepointmade,18,65f0250b-455d-43d7-b7dc-7d321bdf9abc,basketball_play,1770514093,414,True,2026-02-08 01:28:13+00:00,1,231.0,489.0,8.15,75
4,50,quarter,1,65f0250b-455d-43d7-b7dc-7d321bdf9abc,29,3:39,Collin Sexton makes two point driving floating bank jump shot,twopointmade,20,ba2cb6be-9827-46a8-8e6f-d8661307ba77,basketball_play,1770514107,413,True,2026-02-08 01:28:27+00:00,1,219.0,501.0,8.35,76
4,49,quarter,1,ba2cb6be-9827-46a8-8e6f-d8661307ba77,29,3:39,Bruce Brown shooting foul (Collin Sexton draws the foul),shootingfoul,20,65f0250b-455d-43d7-b7dc-7d321bdf9abc,basketball_play,1770514110,412,True,2026-02-08 01:28:30+00:00,1,219.0,501.0,8.35,77
4,48,quarter,1,ba2cb6be-9827-46a8-8e6f-d8661307ba77,29,3:39,"Nuggets lineup change (Christian Braun, Tim Hardaway Jr., Bruce Brown, Jamal Murray, Jonas Valanciunas)",lineupchange,20,,basketball_play,1770514117,411,True,2026-02-08 01:28:37+00:00,1,219.0,501.0,8.35,78
4,47,quarter,1,65f0250b-455d-43d7-b7dc-7d321bdf9abc,29,3:39,"Bulls lineup change (Rob Dillingham, Anfernee Simons, Patrick Williams, Nick Richards, Collin Sexton)",lineupchange,20,,basketball_play,1770514156,410,True,2026-02-08 01:29:16+00:00,1,219.0,501.0,8.35,79
4,46,quarter,1,65f0250b-455d-43d7-b7dc-7d321bdf9abc,29,3:39,Collin Sexton makes regular free throw 1 of 1,freethrowmade,21,,basketball_play,1770514156,409,True,2026-02-08 01:29:16+00:00,1,219.0,501.0,8.35,80
4,45,quarter,1,ba2cb6be-9827-46a8-8e6f-d8661307ba77,31,3:22,Jonas Valanciunas makes two point cutting layup (Jamal Murray assists),twopointmade,21,65f0250b-455d-43d7-b7dc-7d321bdf9abc,basketball_play,1770514172,408,True,2026-02-08 01:29:32+00:00,1,202.0,518.0,8.633333333333333,81
4,44,quarter,1,65f0250b-455d-43d7-b7dc-7d321bdf9abc,31,3:08,Patrick Williams makes three point jump shot (Collin Sexton assists),threepointmade,24,ba2cb6be-9827-46a8-8e6f-d8661307ba77,basketball_play,1770514186,407,True,2026-02-08 01:29:46+00:00,1,188.0,532.0,8.866666666666667,82
4,43,quarter,1,ba2cb6be-9827-46a8-8e6f-d8661307ba77,31,2:56,Jamal Murray turnover (bad pass) (Patrick Williams steals),turnover,24,65f0250b-455d-43d7-b7dc-7d321bdf9abc,basketball_play,1770514198,406,True,2026-02-08 01:29:58+00:00,1,176.0,544.0,9.066666666666666,83
4,42,quarter,1,65f0250b-455d-43d7-b7dc-7d321bdf9abc,31,2:51,Anfernee Simons makes three point running jump shot (Patrick Williams assists),threepointmade,27,ba2cb6be-9827-46a8-8e6f-d8661307ba77,basketball_play,1770514203,405,True,2026-02-08 01:30:03+00:00,1,171.0,549.0,9.15,84
4,41,quarter,1,ba2cb6be-9827-46a8-8e6f-d8661307ba77,31,2:51,Nuggets 60 second timeout,teamtimeout,27,,basketball_play,1770514212,404,True,2026-02-08 01:30:12+00:00,1,171.0,549.0,9.15,85
4,40,quarter,1,ba2cb6be-9827-46a8-8e6f-d8661307ba77,31,2:51,"Nuggets lineup change (Christian Braun, Jalen Pickett, Tim Hardaway Jr., Bruce Brown, Jonas Valanciunas)",lineupchange,27,,basketball_play,1770514397,403,True,2026-02-08 01:33:17+00:00,1,171.0,549.0,9.15,86
4,39,quarter,1,ba2cb6be-9827-46a8-8e6f-d8661307ba77,31,2:35,Tim Hardaway Jr. misses three point jump shot,threepointmiss,27,,basketball_play,1770514397,402,True,2026-02-08 01:33:17+00:00,1,155.0,565.0,9.416666666666666,87
4,38,quarter,1,ba2cb6be-9827-46a8-8e6f-d8661307ba77,31,2:32,Christian Braun offensive rebound,rebound,27,ba2cb6be-9827-46a8-8e6f-d8661307ba77,basketball_play,1770514400,401,True,2026-02-08 01:33:20+00:00,1,152.0,568.0,9.466666666666667,88
4,37,quarter,1,ba2cb6be-9827-46a8-8e6f-d8661307ba77,31,2:28,Bruce Brown misses three point jump shot,threepointmiss,27,,basketball_play,1770514404,400,True,2026-02-08 01:33:24+00:00,1,148.0,572.0,9.533333333333333,89
4,36,quarter,1,65f0250b-455d-43d7-b7dc-7d321bdf9abc,31,2:27,Bulls defensive rebound,rebound,27,65f0250b-455d-43d7-b7dc-7d321bdf9abc,basketball_play,1770514405,399,True,2026-02-08 01:33:25+00:00,1,147.0,573.0,9.55,90
4,35,quarter,1,,31,2:27,Stoppage (Out of bounds),stoppage,27,,basketball_play,1770514409,398,True,2026-02-08 01:33:29+00:00,1,147.0,573.0,9.55,91
4,34,quarter,1,65f0250b-455d-43d7-b7dc-7d321bdf9abc,31,2:12,Nick Richards misses two point alley-oop dunk,twopointmiss,27,,basketball_play,1770514426,397,True,2026-02-08 01:33:46+00:00,1,132.0,588.0,9.8,92
4,33,quarter,1,ba2cb6be-9827-46a8-8e6f-d8661307ba77,31,2:10,Christian Braun defensive rebound,rebound,27,ba2cb6be-9827-46a8-8e6f-d8661307ba77,basketball_play,1770514428,396,True,2026-02-08 01:33:48+00:00,1,130.0,590.0,9.833333333333334,93
4,32,quarter,1,ba2cb6be-9827-46a8-8e6f-d8661307ba77,33,2:06,Christian Braun makes two point running layup,twopointmade,27,65f0250b-455d-43d7-b7dc-7d321bdf9abc,basketball_play,1770514431,395,True,2026-02-08 01:33:51+00:00,1,126.0,594.0,9.9,94
4,31,quarter,1,65f0250b-455d-43d7-b7dc-7d321bdf9abc,33,1:56,Jonas Valanciunas blocks Collin Sexton's two point driving layup,twopointmiss,27,,basketball_play,1770514444,394,True,2026-02-08 01:34:04+00:00,1,116.0,604.0,10.066666666666666,95
4,30,quarter,1,65f0250b-455d-43d7-b7dc-7d321bdf9abc,33,1:56,Bulls offensive rebound,rebound,27,65f0250b-455d-43d7-b7dc-7d321bdf9abc,basketball_play,1770514444,393,True,2026-02-08 01:34:04+00:00,1,116.0,604.0,10.066666666666666,96
4,29,quarter,1,,33,1:56,Stoppage (Out of bounds),stoppage,27,,basketball_play,1770514452,392,True,2026-02-08 01:34:12+00:00,1,116.0,604.0,10.066666666666666,97
4,28,quarter,1,65f0250b-455d-43d7-b7dc-7d321bdf9abc,33,1:51,Collin Sexton makes two point jump shot (Anfernee Simons assists),twopointmade,29,ba2cb6be-9827-46a8-8e6f-d8661307ba77,basketball_play,1770514458,391,True,2026-02-08 01:34:18+00:00,1,111.0,609.0,10.15,98
4,27,quarter,1,ba2cb6be-9827-46a8-8e6f-d8661307ba77,33,1:33,Christian Braun misses two point jump shot,twopointmiss,29,,basketball_play,1770514477,390,True,2026-02-08 01:34:37+00:00,1,93.0,627.0,10.45,99
4,26,quarter,1,ba2cb6be-9827-46a8-8e6f-d8661307ba77,33,1:29,Jonas Valanciunas offensive rebound,rebound,29,ba2cb6be-9827-46a8-8e6f-d8661307ba77,basketball_play,1770514481,389,True,2026-02-08 01:34:41+00:00,1,89.0,631.0,10.516666666666667,100
4,25,quarter,1,ba2cb6be-9827-46a8-8e6f-d8661307ba77,33,1:27,Jonas Valanciunas misses two point turnaround hook shot,twopointmiss,29,,basketball_play,1770514483,388,True,2026-02-08 01:34:43+00:00,1,87.0,633.0,10.55,101
4,24,quarter,1,65f0250b-455d-43d7-b7dc-7d321bdf9abc,33,1:25,Rob Dillingham defensive rebound,rebound,29,65f0250b-455d-43d7-b7dc-7d321bdf9abc,basketball_play,1770514485,387,True,2026-02-08 01:34:45+00:00,1,85.0,635.0,10.583333333333334,102
4,23,quarter,1,ba2cb6be-9827-46a8-8e6f-d8661307ba77,33,1:21,Jonas Valanciunas shooting foul (Nick Richards draws the foul),shootingfoul,29,65f0250b-455d-43d7-b7dc-7d321bdf9abc,basketball_play,1770514491,386,True,2026-02-08 01:34:51+00:00,1,81.0,639.0,10.65,103
4,22,quarter,1,65f0250b-455d-43d7-b7dc-7d321bdf9abc,33,1:21,Nick Richards makes regular free throw 1 of 2,freethrowmade,30,65f0250b-455d-43d7-b7dc-7d321bdf9abc,basketball_play,1770514522,385,True,2026-02-08 01:35:22+00:00,1,81.0,639.0,10.65,104
4,21,quarter,1,65f0250b-455d-43d7-b7dc-7d321bdf9abc,33,1:21,Nick Richards makes regular free throw 2 of 2,freethrowmade,31,ba2cb6be-9827-46a8-8e6f-d8661307ba77,basketball_play,1770514546,384,True,2026-02-08 01:35:46+00:00,1,81.0,639.0,10.65,105
4,20,quarter,1,ba2cb6be-9827-46a8-8e6f-d8661307ba77,35,1:00,Jonas Valanciunas makes two point turnaround hook shot,twopointmade,31,65f0250b-455d-43d7-b7dc-7d321bdf9abc,basketball_play,1770514570,383,True,2026-02-08 01:36:10+00:00,1,60.0,660.0,11.0,106
