period_index,event_index,period_type,period_number,attribution,away_points,clock,description,event_type,home_points,possession,type,wall_clock,pbp_source_row,has_wall_clock,event_ts_utc,period_sequence,game_clock_seconds_remaining,game_elapsed_seconds,game_elapsed_minutes,pbp_chronological_index
4,127,quarter,1,ad36c3e8-4194-4e63-920f-7c50f46191a6,0,12:00,"Spurs lineup change (Stephon Castle, Victor Wembanyama, Devin Vassell, Julian Champagnie, De'Aaron Fox)",lineupchange,0,,basketball_play,1770781278,458,True,2026-02-11 03:41:18+00:00,1,720.0,0.0,0.0,1
4,126,quarter,1,2ef4d31c-0b46-4f43-a403-f44d62489034,0,12:00,"Lakers lineup change (Luke Kennard, Jaxson Hayes, Kobe Bufkin, Rui Hachimura, Jake LaRavia)",lineupchange,0,,basketball_play,1770781278,457,True,2026-02-11 03:41:18+00:00,1,720.0,0.0,0.0,2
4,125,quarter,1,,0,12:00,Start of 1st Quarter,startperiod,0,,basketball_play,1770781278,456,True,2026-02-11 03:41:18+00:00,1,720.0,0.0,0.0,3
4,124,quarter,1,ad36c3e8-4194-4e63-920f-7c50f46191a6,0,12:00,Victor Wembanyama vs. Jaxson Hayes (Julian Champagnie gains possession),opentip,0,ad36c3e8-4194-4e63-920f-7c50f46191a6,basketball_play,1770781281,455,True,2026-02-11 03:41:21+00:00,1,720.0,0.0,0.0,4
4,123,quarter,1,ad36c3e8-4194-4e63-920f-7c50f46191a6,3,11:45,Julian Champagnie makes three point jump shot (De'Aaron Fox assists),threepointmade,0,2ef4d31c-0b46-4f43-a403-f44d62489034,basketball_play,1770781292,454,True,2026-02-11 03:41:32+00:00,1,705.0,15.0,0.25,5
4,122,quarter,1,2ef4d31c-0b46-4f43-a403-f44d62489034,3,11:22,Victor Wembanyama blocks Jake LaRavia's two point driving layup,twopointmiss,0,,basketball_play,1770781319,453,True,2026-02-11 03:41:59+00:00,1,682.0,38.0,0.6333333333333333,6
4,121,quarter,1,2ef4d31c-0b46-4f43-a403-f44d62489034,3,11:22,Lakers offensive rebound,rebound,0,2ef4d31c-0b46-4f43-a403-f44d62489034,basketball_play,1770781319,452,True,2026-02-11 03:41:59+00:00,1,682.0,38.0,0.6333333333333333,7
4,120,quarter,1,,3,11:22,Stoppage (Out of bounds),stoppage,0,,basketball_play,1770781323,451,True,2026-02-11 03:42:03+00:00,1,682.0,38.0,0.6333333333333333,8
4,119,quarter,1,,3,11:21,Stoppage (Out of bounds),stoppage,0,,basketball_play,1770781340,450,True,2026-02-11 03:42:20+00:00,1,681.0,39.0,0.65,9
4,118,quarter,1,2ef4d31c-0b46-4f43-a403-f44d62489034,3,11:19,Jaxson Hayes makes two point alley-oop dunk (Kobe Bufkin assists),twopointmade,2,ad36c3e8-4194-4e63-920f-7c50f46191a6,basketball_play,1770781355,449,True,2026-02-11 03:42:35+00:00,1,679.0,41.0,0.6833333333333333,10
4,117,quarter,1,2ef4d31c-0b46-4f43-a403-f44d62489034,3,11:08,Jaxson Hayes shooting foul (Victor Wembanyama draws the foul),shootingfoul,2,ad36c3e8-4194-4e63-920f-7c50f46191a6,basketball_play,1770781366,448,True,2026-02-11 03:42:46+00:00,1,668.0,52.0,0.8666666666666667,11
4,116,quarter,1,ad36c3e8-4194-4e63-920f-7c50f46191a6,4,11:08,Victor Wembanyama makes regular free throw 1 of 2,freethrowmade,2,ad36c3e8-4194-4e63-920f-7c50f46191a6,basketball_play,1770781393,447,True,2026-02-11 03:43:13+00:00,1,668.0,52.0,0.8666666666666667,12
4,115,quarter,1,ad36c3e8-4194-4e63-920f-7c50f46191a6,4,11:08,Victor Wembanyama misses regular free throw 2 of 2,freethrowmiss,2,,basketball_play,1770781393,446,True,2026-02-11 03:43:13+00:00,1,668.0,52.0,0.8666666666666667,13
4,114,quarter,1,2ef4d31c-0b46-4f43-a403-f44d62489034,4,11:05,Jake LaRavia defensive rebound,rebound,2,2ef4d31c-0b46-4f43-a403-f44d62489034,basketball_play,1770781396,445,True,2026-02-11 03:43:16+00:00,1,665.0,55.0,0.9166666666666666,14
4,113,quarter,1,2ef4d31c-0b46-4f43-a403-f44d62489034,4,10:56,Kobe Bufkin misses three point pullup jump shot,threepointmiss,2,,basketball_play,1770781425,444,True,2026-02-11 03:43:45+00:00,1,656.0,64.0,1.0666666666666667,15
4,112,quarter,1,ad36c3e8-4194-4e63-920f-7c50f46191a6,4,10:52,Victor Wembanyama defensive rebound,rebound,2,ad36c3e8-4194-4e63-920f-7c50f46191a6,basketball_play,1770781429,443,True,2026-02-11 03:43:49+00:00,1,652.0,68.0,1.1333333333333333,16
4,111,quarter,1,ad36c3e8-4194-4e63-920f-7c50f46191a6,6,10:48,Victor Wembanyama makes two point running finger roll layup,twopointmade,2,2ef4d31c-0b46-4f43-a403-f44d62489034,basketball_play,1770781433,442,True,2026-02-11 03:43:53+00:00,1,648.0,72.0,1.2,17
4,110,quarter,1,2ef4d31c-0b46-4f43-a403-f44d62489034,6,10:35,Rui Hachimura misses two point pullup jump shot,twopointmiss,2,,basketball_play,1770781446,441,True,2026-02-11 03:44:06+00:00,1,635.0,85.0,1.4166666666666667,18
4,109,quarter,1,ad36c3e8-4194-4e63-920f-7c50f46191a6,6,10:32,Julian Champagnie defensive rebound,rebound,2,ad36c3e8-4194-4e63-920f-7c50f46191a6,basketball_play,1770781449,440,True,2026-02-11 03:44:09+00:00,1,632.0,88.0,1.4666666666666666,19
4,108,quarter,1,ad36c3e8-4194-4e63-920f-7c50f46191a6,6,10:28,Julian Champagnie misses three point running jump shot,threepointmiss,2,,basketball_play,1770781454,439,True,2026-02-11 03:44:14+00:00,1,628.0,92.0,1.5333333333333334,20
4,107,quarter,1,ad36c3e8-4194-4e63-920f-7c50f46191a6,6,10:23,De'Aaron Fox offensive rebound,rebound,2,ad36c3e8-4194-4e63-920f-7c50f46191a6,basketball_play,1770781459,438,True,2026-02-11 03:44:19+00:00,1,623.0,97.0,1.6166666666666667,21
4,106,quarter,1,ad36c3e8-4194-4e63-920f-7c50f46191a6,8,10:21,Victor Wembanyama makes two point driving dunk (De'Aaron Fox assists),twopointmade,2,2ef4d31c-0b46-4f43-a403-f44d62489034,basketball_play,1770781461,437,True,2026-02-11 03:44:21+00:00,1,621.0,99.0,1.65,22
4,105,quarter,1,2ef4d31c-0b46-4f43-a403-f44d62489034,8,10:05,Kobe Bufkin makes two point driving floating jump shot,twopointmade,4,ad36c3e8-4194-4e63-920f-7c50f46191a6,basketball_play,1770781476,436,True,2026-02-11 03:44:36+00:00,1,605.0,115.0,1.9166666666666667,23
4,104,quarter,1,ad36c3e8-4194-4e63-920f-7c50f46191a6,11,9:55,Victor Wembanyama makes three point jump shot (Stephon Castle assists),threepointmade,4,2ef4d31c-0b46-4f43-a403-f44d62489034,basketball_play,1770781486,435,True,2026-02-11 03:44:46+00:00,1,595.0,125.0,2.0833333333333335,24
4,103,quarter,1,2ef4d31c-0b46-4f43-a403-f44d62489034,11,9:30,Jake LaRavia misses two point turnaround fadeaway jump shot,twopointmiss,4,,basketball_play,1770781510,434,True,2026-02-11 03:45:10+00:00,1,570.0,150.0,2.5,25
4,102,quarter,1,ad36c3e8-4194-4e63-920f-7c50f46191a6,11,9:28,Victor Wembanyama defensive rebound,rebound,4,ad36c3e8-4194-4e63-920f-7c50f46191a6,basketball_play,1770781512,433,True,2026-02-11 03:45:12+00:00,1,568.0,152.0,2.533333333333333,26
4,101,quarter,1,2ef4d31c-0b46-4f43-a403-f44d62489034,11,9:20,Jake LaRavia personal foul (Victor Wembanyama draws the foul),personalfoul,4,ad36c3e8-4194-4e63-920f-7c50f46191a6,basketball_play,1770781526,432,True,2026-02-11 03:45:26+00:00,1,560.0,160.0,2.6666666666666665,27
4,100,quarter,1,ad36c3e8-4194-4e63-920f-7c50f46191a6,14,9:17,Victor Wembanyama makes three point jump shot (Stephon Castle assists),threepointmade,4,2ef4d31c-0b46-4f43-a403-f44d62489034,basketball_play,1770781544,431,True,2026-02-11 03:45:44+00:00,1,557.0,163.0,2.716666666666667,28
4,99,quarter,1,2ef4d31c-0b46-4f43-a403-f44d62489034,14,9:04,Luke Kennard misses three point pullup jump shot,threepointmiss,4,,basketball_play,1770781558,430,True,2026-02-11 03:45:58+00:00,1,544.0,176.0,2.933333333333333,29
4,98,quarter,1,ad36c3e8-4194-4e63-920f-7c50f46191a6,14,9:01,Victor Wembanyama defensive rebound,rebound,4,ad36c3e8-4194-4e63-920f-7c50f46191a6,basketball_play,1770781560,429,True,2026-02-11 03:46:00+00:00,1,541.0,179.0,2.9833333333333334,30
4,97,quarter,1,2ef4d31c-0b46-4f43-a403-f44d62489034,14,8:55,Jaxson Hayes shooting foul (Victor Wembanyama draws the foul),shootingfoul,4,ad36c3e8-4194-4e63-920f-7c50f46191a6,basketball_play,1770781569,428,True,2026-02-11 03:46:09+00:00,1,535.0,185.0,3.0833333333333335,31
4,96,quarter,1,ad36c3e8-4194-4e63-920f-7c50f46191a6,15,8:55,Victor Wembanyama makes regular free throw 1 of 2,freethrowmade,4,ad36c3e8-4194-4e63-920f-7c50f46191a6,basketball_play,1770781598,427,True,2026-02-11 03:46:38+00:00,1,535.0,185.0,3.0833333333333335,32
4,95,quarter,1,2ef4d31c-0b46-4f43-a403-f44d62489034,15,8:55,"Lakers lineup change (Luke Kennard, Kobe Bufkin, Rui Hachimura, Maxi Kleber, Jake LaRavia)",lineupchange,4,,basketball_play,1770781627,426,True,2026-02-11 03:47:07+00:00,1,535.0,185.0,3.0833333333333335,33
4,94,quarter,1,ad36c3e8-4194-4e63-920f-7c50f46191a6,16,8:55,Victor Wembanyama makes regular free throw 2 of 2,freethrowmade,4,2ef4d31c-0b46-4f43-a403-f44d62489034,basketball_play,1770781627,425,True,2026-02-11 03:47:07+00:00,1,535.0,185.0,3.0833333333333335,34
4,93,quarter,1,2ef4d31c-0b46-4f43-a403-f44d62489034,16,8:44,Rui Hachimura misses three point jump shot,threepointmiss,4,,basketball_play,1770781639,424,True,2026-02-11 03:47:19+00:00,1,524.0,196.0,3.2666666666666666,35
4,92,quarter,1,ad36c3e8-4194-4e63-920f-7c50f46191a6,16,8:40,Stephon Castle defensive rebound,rebound,4,ad36c3e8-4194-4e63-920f-7c50f46191a6,basketball_play,1770781643,423,True,2026-02-11 03:47:23+00:00,1,520.0,200.0,3.3333333333333335,36
4,91,quarter,1,2ef4d31c-0b46-4f43-a403-f44d62489034,16,8:37,Maxi Kleber shooting foul (Victor Wembanyama draws the foul),shootingfoul,4,ad36c3e8-4194-4e63-920f-7c50f46191a6,basketball_play,1770781648,422,True,2026-02-11 03:47:28+00:00,1,517.0,203.0,3.3833333333333333,37
4,90,quarter,1,ad36c3e8-4194-4e63-920f-7c50f46191a6,16,8:37,Victor Wembanyama misses regular free throw 1 of 2,freethrowmiss,4,ad36c3e8-4194-4e63-920f-7c50f46191a6,basketball_play,1770781677,421,True,2026-02-11 03:47:57+00:00,1,517.0,203.0,3.3833333333333333,38
4,89,quarter,1,ad36c3e8-4194-4e63-920f-7c50f46191a6,16,8:37,Spurs offensive rebound,rebound,4,ad36c3e8-4194-4e63-920f-7c50f46191a6,basketball_play,1770781677,420,True,2026-02-11 03:47:57+00:00,1,517.0,203.0,3.3833333333333333,39
4,88,quarter,1,ad36c3e8-4194-4e63-920f-7c50f46191a6,17,8:37,Victor Wembanyama makes regular free throw 2 of 2,freethrowmade,4,2ef4d31c-0b46-4f43-a403-f44d62489034,basketball_play,1770781698,419,True,2026-02-11 03:48:18+00:00,1,517.0,203.0,3.3833333333333333,40
4,87,quarter,1,ad36c3e8-4194-4e63-920f-7c50f46191a6,17,8:19,Spurs technical foul (Defensive three second),technicalfoulnonunsportsmanlike,4,2ef4d31c-0b46-4f43-a403-f44d62489034,basketball_play,1770781720,418,True,2026-02-11 03:48:40+00:00,1,499.0,221.0,3.683333333333333,41
4,86,quarter,1,2ef4d31c-0b46-4f43-a403-f44d62489034,17,8:19,Luke Kennard makes technical free throw 1 of 1,freethrowmade,5,,basketball_play,1770781737,417,True,2026-02-11 03:48:57+00:00,1,499.0,221.0,3.683333333333333,42
4,85,quarter,1,2ef4d31c-0b46-4f43-a403-f44d62489034,17,8:12,Maxi Kleber turnover (bad pass) (Victor Wembanyama steals),turnover,5,ad36c3e8-4194-4e63-920f-7c50f46191a6,basketball_play,1770781762,416,True,2026-02-11 03:49:22+00:00,1,492.0,228.0,3.8,43
4,84,quarter,1,ad36c3e8-4194-4e63-920f-7c50f46191a6,17,8:07,Julian Champagnie misses three point jump shot,threepointmiss,5,,basketball_play,1770781767,415,True,2026-02-11 03:49:27+00:00,1,487.0,233.0,3.8833333333333333,44
4,83,quarter,1,2ef4d31c-0b46-4f43-a403-f44d62489034,17,8:02,Kobe Bufkin defensive rebound,rebound,5,2ef4d31c-0b46-4f43-a403-f44d62489034,basketball_play,1770781772,414,True,2026-02-11 03:49:32+00:00,1,482.0,238.0,3.966666666666667,45
4,82,quarter,1,2ef4d31c-0b46-4f43-a403-f44d62489034,17,7:58,Kobe Bufkin makes three point running pullup jump shot,threepointmade,8,ad36c3e8-4194-4e63-920f-7c50f46191a6,basketball_play,1770781776,413,True,2026-02-11 03:49:36+00:00,1,478.0,242.0,4.033333333333333,46
4,81,quarter,1,ad36c3e8-4194-4e63-920f-7c50f46191a6,20,7:47,Victor Wembanyama makes three point jump shot (Stephon Castle assists),threepointmade,8,2ef4d31c-0b46-4f43-a403-f44d62489034,basketball_play,1770781787,412,True,2026-02-11 03:49:47+00:00,1,467.0,253.0,4.216666666666667,47
4,80,quarter,1,2ef4d31c-0b46-4f43-a403-f44d62489034,20,7:37,Jake LaRavia makes three point jump shot (Luke Kennard assists),threepointmade,11,ad36c3e8-4194-4e63-920f-7c50f46191a6,basketball_play,1770781796,411,True,2026-02-11 03:49:56+00:00,1,457.0,263.0,4.383333333333334,48
4,79,quarter,1,2ef4d31c-0b46-4f43-a403-f44d62489034,20,7:26,Rui Hachimura shooting foul (De'Aaron Fox draws the foul),shootingfoul,11,ad36c3e8-4194-4e63-920f-7c50f46191a6,basketball_play,1770781810,410,True,2026-02-11 03:50:10+00:00,1,446.0,274.0,4.566666666666666,49
4,78,quarter,1,ad36c3e8-4194-4e63-920f-7c50f46191a6,21,7:26,De'Aaron Fox makes regular free throw 1 of 2,freethrowmade,11,ad36c3e8-4194-4e63-920f-7c50f46191a6,basketball_play,1770781833,409,True,2026-02-11 03:50:33+00:00,1,446.0,274.0,4.566666666666666,50
4,77,quarter,1,ad36c3e8-4194-4e63-920f-7c50f46191a6,22,7:26,De'Aaron Fox makes regular free throw 2 of 2,freethrowmade,11,2ef4d31c-0b46-4f43-a403-f44d62489034,basketball_play,1770781852,408,True,2026-02-11 03:50:52+00:00,1,446.0,274.0,4.566666666666666,51
4,76,quarter,1,2ef4d31c-0b46-4f43-a403-f44d62489034,22,7:06,Luke Kennard makes two point jump shot,twopointmade,13,ad36c3e8-4194-4e63-920f-7c50f46191a6,basketball_play,1770781873,407,True,2026-02-11 03:51:13+00:00,1,426.0,294.0,4.9,52
4,75,quarter,1,2ef4d31c-0b46-4f43-a403-f44d62489034,22,6:53,Maxi Kleber shooting foul (Victor Wembanyama draws the foul),shootingfoul,13,ad36c3e8-4194-4e63-920f-7c50f46191a6,basketball_play,1770781888,406,True,2026-02-11 03:51:28+00:00,1,413.0,307.0,5.116666666666666,53
4,74,quarter,1,2ef4d31c-0b46-4f43-a403-f44d62489034,22,6:53,Lakers 60 second timeout,teamtimeout,13,,basketball_play,1770781898,405,True,2026-02-11 03:51:38+00:00,1,413.0,307.0,5.116666666666666,54
4,73,quarter,1,ad36c3e8-4194-4e63-920f-7c50f46191a6,22,6:53,"Spurs lineup change (Stephon Castle, Victor Wembanyama, Devin Vassell, Julian Champagnie, Keldon Johnson)",lineupchange,13,,basketball_play,1770782091,404,True,2026-02-11 03:54:51+00:00,1,413.0,307.0,5.116666666666666,55
4,72,quarter,1,ad36c3e8-4194-4e63-920f-7c50f46191a6,23,6:53,Victor Wembanyama makes regular free throw 1 of 2,freethrowmade,13,ad36c3e8-4194-4e63-920f-7c50f46191a6,basketball_play,1770782091,403,True,2026-02-11 03:54:51+00:00,1,413.0,307.0,5.116666666666666,56
4,71,quarter,1,ad36c3e8-4194-4e63-920f-7c50f46191a6,24,6:53,Victor Wembanyama makes regular free throw 2 of 2,freethrowmade,13,2ef4d31c-0b46-4f43-a403-f44d62489034,basketball_play,1770782110,402,True,2026-02-11 03:55:10+00:00,1,413.0,307.0,5.116666666666666,57
4,70,quarter,1,ad36c3e8-4194-4e63-920f-7c50f46191a6,24,6:30,Stephon Castle shooting foul (Jake LaRavia draws the foul),shootingfoul,13,2ef4d31c-0b46-4f43-a403-f44d62489034,basketball_play,1770782140,401,True,2026-02-11 03:55:40+00:00,1,390.0,330.0,5.5,58
4,69,quarter,1,2ef4d31c-0b46-4f43-a403-f44d62489034,24,6:30,Jake LaRavia makes regular free throw 1 of 2,freethrowmade,14,2ef4d31c-0b46-4f43-a403-f44d62489034,basketball_play,1770782162,400,True,2026-02-11 03:56:02+00:00,1,390.0,330.0,5.5,59
4,68,quarter,1,2ef4d31c-0b46-4f43-a403-f44d62489034,24,6:30,Jake LaRavia makes regular free throw 2 of 2,freethrowmade,15,ad36c3e8-4194-4e63-920f-7c50f46191a6,basketball_play,1770782176,399,True,2026-02-11 03:56:16+00:00,1,390.0,330.0,5.5,60
4,67,quarter,1,ad36c3e8-4194-4e63-920f-7c50f46191a6,26,6:15,Victor Wembanyama makes two point alley-oop layup (Stephon Castle assists),twopointmade,15,2ef4d31c-0b46-4f43-a403-f44d62489034,basketball_play,1770782193,398,True,2026-02-11 03:56:33+00:00,1,375.0,345.0,5.75,61
4,66,quarter,1,2ef4d31c-0b46-4f43-a403-f44d62489034,26,6:10,Kobe Bufkin misses three point jump shot,threepointmiss,15,,basketball_play,1770782200,397,True,2026-02-11 03:56:40+00:00,1,370.0,350.0,5.833333333333333,62
4,65,quarter,1,ad36c3e8-4194-4e63-920f-7c50f46191a6,26,6:08,Devin Vassell defensive rebound,rebound,15,ad36c3e8-4194-4e63-920f-7c50f46191a6,basketball_play,1770782202,396,True,2026-02-11 03:56:42+00:00,1,368.0,352.0,5.866666666666666,63
4,64,quarter,1,ad36c3e8-4194-4e63-920f-7c50f46191a6,26,5:57,Victor Wembanyama misses three point jump shot,threepointmiss,15,,basketball_play,1770782211,395,True,2026-02-11 03:56:51+00:00,1,357.0,363.0,6.05,64
4,63,quarter,1,2ef4d31c-0b46-4f43-a403-f44d62489034,26,5:54,Maxi Kleber defensive rebound,rebound,15,2ef4d31c-0b46-4f43-a403-f44d62489034,basketball_play,1770782214,394,True,2026-02-11 03:56:54+00:00,1,354.0,366.0,6.1,65
4,62,quarter,1,2ef4d31c-0b46-4f43-a403-f44d62489034,26,5:45,Jake LaRavia makes three point jump shot (Luke Kennard assists),threepointmade,18,ad36c3e8-4194-4e63-920f-7c50f46191a6,basketball_play,1770782224,393,True,2026-02-11 03:57:04+00:00,1,345.0,375.0,6.25,66
4,61,quarter,1,ad36c3e8-4194-4e63-920f-7c50f46191a6,28,5:32,Victor Wembanyama makes two point cutting dunk (Stephon Castle assists),twopointmade,18,2ef4d31c-0b46-4f43-a403-f44d62489034,basketball_play,1770782236,392,True,2026-02-11 03:57:16+00:00,1,332.0,388.0,6.466666666666667,67
4,60,quarter,1,2ef4d31c-0b46-4f43-a403-f44d62489034,28,5:17,Kobe Bufkin turnover (bad pass) (Julian Champagnie steals),turnover,18,ad36c3e8-4194-4e63-920f-7c50f46191a6,basketball_play,1770782252,391,True,2026-02-11 03:57:32+00:00,1,317.0,403.0,6.716666666666667,68
4,59,quarter,1,2ef4d31c-0b46-4f43-a403-f44d62489034,28,5:08,Jake LaRavia shooting foul (Julian Champagnie draws the foul),shootingfoul,18,ad36c3e8-4194-4e63-920f-7c50f46191a6,basketball_play,1770782262,390,True,2026-02-11 03:57:42+00:00,1,308.0,412.0,6.866666666666666,69
4,58,quarter,1,ad36c3e8-4194-4e63-920f-7c50f46191a6,29,5:08,Julian Champagnie makes regular free throw 1 of 2,freethrowmade,18,ad36c3e8-4194-4e63-920f-7c50f46191a6,basketball_play,1770782285,389,True,2026-02-11 03:58:05+00:00,1,308.0,412.0,6.866666666666666,70
4,57,quarter,1,ad36c3e8-4194-4e63-920f-7c50f46191a6,29,5:08,"Spurs lineup change (Stephon Castle, Victor Wembanyama, Dylan Harper, Julian Champagnie, Keldon Johnson)",lineupchange,18,,basketball_play,1770782286,388,True,2026-02-11 03:58:06+00:00,1,308.0,412.0,6.866666666666666,71
4,56,quarter,1,2ef4d31c-0b46-4f43-a403-f44d62489034,29,5:08,"Lakers lineup change (Luke Kennard, Jarred Vanderbilt, Nick Smith Jr., Rui Hachimura, Maxi Kleber)",lineupchange,18,,basketball_play,1770782286,387,True,2026-02-11 03:58:06+00:00,1,308.0,412.0,6.866666666666666,72
4,55,quarter,1,ad36c3e8-4194-4e63-920f-7c50f46191a6,29,5:08,Julian Champagnie misses regular free throw 2 of 2,freethrowmiss,18,,basketball_play,1770782285,386,True,2026-02-11 03:58:05+00:00,1,308.0,412.0,6.866666666666666,73
4,54,quarter,1,2ef4d31c-0b46-4f43-a403-f44d62489034,29,5:04,Rui Hachimura defensive rebound,rebound,18,2ef4d31c-0b46-4f43-a403-f44d62489034,basketball_play,1770782289,385,True,2026-02-11 03:58:09+00:00,1,304.0,416.0,6.933333333333334,74
4,53,quarter,1,2ef4d31c-0b46-4f43-a403-f44d62489034,29,4:50,Rui Hachimura makes two point stepback jump shot,twopointmade,20,ad36c3e8-4194-4e63-920f-7c50f46191a6,basketball_play,1770782325,384,True,2026-02-11 03:58:45+00:00,1,290.0,430.0,7.166666666666667,75
4,52,quarter,1,ad36c3e8-4194-4e63-920f-7c50f46191a6,31,4:38,Stephon Castle makes two point driving layup,twopointmade,20,2ef4d31c-0b46-4f43-a403-f44d62489034,basketball_play,1770782337,383,True,2026-02-11 03:58:57+00:00,1,278.0,442.0,7.366666666666666,76
4,51,quarter,1,2ef4d31c-0b46-4f43-a403-f44d62489034,31,4:21,Rui Hachimura misses two point turnaround jump shot,twopointmiss,20,,basketball_play,1770782355,382,True,2026-02-11 03:59:15+00:00,1,261.0,459.0,7.65,77
4,50,quarter,1,ad36c3e8-4194-4e63-920f-7c50f46191a6,31,4:18,Julian Champagnie defensive rebound,rebound,20,ad36c3e8-4194-4e63-920f-7c50f46191a6,basketball_play,1770782358,381,True,2026-02-11 03:59:18+00:00,1,258.0,462.0,7.7,78
4,49,quarter,1,ad36c3e8-4194-4e63-920f-7c50f46191a6,33,4:12,Victor Wembanyama makes two point turnaround fadeaway jump shot (Stephon Castle assists),twopointmade,20,2ef4d31c-0b46-4f43-a403-f44d62489034,basketball_play,1770782363,380,True,2026-02-11 03:59:23+00:00,1,252.0,468.0,7.8,79
4,48,quarter,1,2ef4d31c-0b46-4f43-a403-f44d62489034,33,4:01,Maxi Kleber offensive foul (Dylan Harper draws the foul),offensivefoul,20,ad36c3e8-4194-4e63-920f-7c50f46191a6,basketball_play,1770782379,379,True,2026-02-11 03:59:39+00:00,1,241.0,479.0,7.983333333333333,80
4,47,quarter,1,2ef4d31c-0b46-4f43-a403-f44d62489034,33,4:01,Maxi Kleber turnover (offensive foul),turnover,20,ad36c3e8-4194-4e63-920f-7c50f46191a6,basketball_play,1770782379,378,True,2026-02-11 03:59:39+00:00,1,241.0,479.0,7.983333333333333,81
4,46,quarter,1,ad36c3e8-4194-4e63-920f-7c50f46191a6,33,4:01,"Spurs lineup change (Luke Kornet, Dylan Harper, Julian Champagnie, Harrison Barnes, Keldon Johnson)",lineupchange,20,,basketball_play,1770782384,377,True,2026-02-11 03:59:44+00:00,1,241.0,479.0,7.983333333333333,82
4,45,quarter,1,2ef4d31c-0b46-4f43-a403-f44d62489034,33,4:01,"Lakers lineup change (Luke Kennard, Jarred Vanderbilt, Nick Smith Jr., Rui Hachimura, Drew Timme)",lineupchange,20,,basketball_play,1770782384,376,True,2026-02-11 03:59:44+00:00,1,241.0,479.0,7.983333333333333,83
4,44,quarter,1,ad36c3e8-4194-4e63-920f-7c50f46191a6,33,3:44,Keldon Johnson misses two point driving hook shot,twopointmiss,20,,basketball_play,1770782423,375,True,2026-02-11 04:00:23+00:00,1,224.0,496.0,8.266666666666667,84
4,43,quarter,1,2ef4d31c-0b46-4f43-a403-f44d62489034,33,3:42,Jarred Vanderbilt defensive rebound,rebound,20,2ef4d31c-0b46-4f43-a403-f44d62489034,basketball_play,1770782425,374,True,2026-02-11 04:00:25+00:00,1,222.0,498.0,8.3,85
4,42,quarter,1,2ef4d31c-0b46-4f43-a403-f44d62489034,33,3:36,Nick Smith Jr. makes two point driving floating jump shot,twopointmade,22,ad36c3e8-4194-4e63-920f-7c50f46191a6,basketball_play,1770782431,373,True,2026-02-11 04:00:31+00:00,1,216.0,504.0,8.4,86
4,41,quarter,1,ad36c3e8-4194-4e63-920f-7c50f46191a6,33,3:36,Spurs 60 second timeout,teamtimeout,22,,basketball_play,1770782439,372,True,2026-02-11 04:00:39+00:00,1,216.0,504.0,8.4,87
4,40,quarter,1,ad36c3e8-4194-4e63-920f-7c50f46191a6,35,3:20,Harrison Barnes makes two point turnaround fadeaway jump shot (Dylan Harper assists),twopointmade,22,2ef4d31c-0b46-4f43-a403-f44d62489034,basketball_play,1770782638,371,True,2026-02-11 04:03:58+00:00,1,200.0,520.0,8.666666666666666,88
4,39,quarter,1,ad36c3e8-4194-4e63-920f-7c50f46191a6,35,3:04,Julian Champagnie shooting foul (Luke Kennard draws the foul),shootingfoul,22,2ef4d31c-0b46-4f43-a403-f44d62489034,basketball_play,1770782662,370,True,2026-02-11 04:04:22+00:00,1,184.0,536.0,8.933333333333334,89
4,38,quarter,1,2ef4d31c-0b46-4f43-a403-f44d62489034,35,3:04,Luke Kennard makes regular free throw 1 of 2,freethrowmade,23,2ef4d31c-0b46-4f43-a403-f44d62489034,basketball_play,1770782680,369,True,2026-02-11 04:04:40+00:00,1,184.0,536.0,8.933333333333334,90
4,37,quarter,1,2ef4d31c-0b46-4f43-a403-f44d62489034,35,3:04,"Lakers lineup change (Dalton Knecht, Luke Kennard, Jarred Vanderbilt, Nick Smith Jr., Drew Timme)",lineupchange,23,,basketball_play,1770782695,368,True,2026-02-11 04:04:55+00:00,1,184.0,536.0,8.933333333333334,91
4,36,quarter,1,2ef4d31c-0b46-4f43-a403-f44d62489034,35,3:04,Luke Kennard makes regular free throw 2 of 2,freethrowmade,24,ad36c3e8-4194-4e63-920f-7c50f46191a6,basketball_play,1770782695,367,True,2026-02-11 04:04:55+00:00,1,184.0,536.0,8.933333333333334,92
4,35,quarter,1,ad36c3e8-4194-4e63-920f-7c50f46191a6,35,2:51,Julian Champagnie misses three point stepback jump shot,threepointmiss,24,,basketball_play,1770782709,366,True,2026-02-11 04:05:09+00:00,1,171.0,549.0,9.15,93
4,34,quarter,1,ad36c3e8-4194-4e63-920f-7c50f46191a6,35,2:49,Keldon Johnson offensive rebound,rebound,24,ad36c3e8-4194-4e63-920f-7c50f46191a6,basketball_play,1770782711,365,True,2026-02-11 04:05:11+00:00,1,169.0,551.0,9.183333333333334,94
4,33,quarter,1,ad36c3e8-4194-4e63-920f-7c50f46191a6,37,2:48,Keldon Johnson makes two point putback layup,twopointmade,24,2ef4d31c-0b46-4f43-a403-f44d62489034,basketball_play,1770782715,364,True,2026-02-11 04:05:15+00:00,1,168.0,552.0,9.2,95
4,32,quarter,1,2ef4d31c-0b46-4f43-a403-f44d62489034,37,2:33,Nick Smith Jr. misses two point fadeaway jump shot,twopointmiss,24,,basketball_play,1770782728,363,True,2026-02-11 04:05:28+00:00,1,153.0,567.0,9.45,96
4,31,quarter,1,ad36c3e8-4194-4e63-920f-7c50f46191a6,37,2:30,Luke Kornet defensive rebound,rebound,24,ad36c3e8-4194-4e63-920f-7c50f46191a6,basketball_play,1770782731,362,True,2026-02-11 04:05:31+00:00,1,150.0,570.0,9.5,97
4,30,quarter,1,ad36c3e8-4194-4e63-920f-7c50f46191a6,37,2:25,Dylan Harper turnover (lost ball) (Nick Smith Jr. steals),turnover,24,2ef4d31c-0b46-4f43-a403-f44d62489034,basketball_play,1770782736,361,True,2026-02-11 04:05:36+00:00,1,145.0,575.0,9.583333333333334,98
4,29,quarter,1,2ef4d31c-0b46-4f43-a403-f44d62489034,37,2:17,Drew Timme makes two point floating jump shot,twopointmade,26,ad36c3e8-4194-4e63-920f-7c50f46191a6,basketball_play,1770782744,360,True,2026-02-11 04:05:44+00:00,1,137.0,583.0,9.716666666666667,99
4,28,quarter,1,ad36c3e8-4194-4e63-920f-7c50f46191a6,39,2:03,Julian Champagnie makes two point cutting layup (Dylan Harper assists),twopointmade,26,2ef4d31c-0b46-4f43-a403-f44d62489034,basketball_play,1770782757,359,True,2026-02-11 04:05:57+00:00,1,123.0,597.0,9.95,100
4,27,quarter,1,2ef4d31c-0b46-4f43-a403-f44d62489034,39,1:47,Dalton Knecht makes two point pullup jump shot (Jarred Vanderbilt assists),twopointmade,28,ad36c3e8-4194-4e63-920f-7c50f46191a6,basketball_play,1770782774,358,True,2026-02-11 04:06:14+00:00,1,107.0,613.0,10.216666666666667,101
4,26,quarter,1,ad36c3e8-4194-4e63-920f-7c50f46191a6,39,1:39,Keldon Johnson misses two point driving layup,twopointmiss,28,,basketball_play,1770782782,357,True,2026-02-11 04:06:22+00:00,1,99.0,621.0,10.35,102
4,25,quarter,1,2ef4d31c-0b46-4f43-a403-f44d62489034,39,1:38,Lakers defensive rebound,rebound,28,2ef4d31c-0b46-4f43-a403-f44d62489034,basketball_play,1770782783,356,True,2026-02-11 04:06:23+00:00,1,98.0,622.0,10.366666666666667,103
4,24,quarter,1,,39,1:38,Stoppage (Out of bounds),stoppage,28,,basketball_play,1770782787,355,True,2026-02-11 04:06:27+00:00,1,98.0,622.0,10.366666666666667,104
