period_index,event_index,period_type,period_number,attribution,away_points,clock,description,event_type,home_points,possession,type,wall_clock,pbp_source_row,has_wall_clock,event_ts_utc,period_sequence,game_clock_seconds_remaining,game_elapsed_seconds,game_elapsed_minutes,pbp_chronological_index
4,121,quarter,1,1cfe70b8-4dfc-47dc-acca-b68d4a725972,0,12:00,"Grizzlies lineup change (GG Jackson, Ty Jerome, Jaylen Wells, Kyle Anderson, Cedric Coward)",lineupchange,0,,basketball_play,1770693141,468,True,2026-02-10 03:12:21+00:00,1,720.0,0.0,0.0,1
4,120,quarter,1,502c629b-4da7-40fd-92ab-20cb55411c35,0,12:00,"Warriors lineup change (Pat Spencer, Draymond Green, Gui Santos, Moses Moody, De'Anthony Melton)",lineupchange,0,,basketball_play,1770693141,467,True,2026-02-10 03:12:21+00:00,1,720.0,0.0,0.0,2
4,119,quarter,1,,0,12:00,Start of 1st Quarter,startperiod,0,,basketball_play,1770693141,466,True,2026-02-10 03:12:21+00:00,1,720.0,0.0,0.0,3
4,118,quarter,1,502c629b-4da7-40fd-92ab-20cb55411c35,0,12:00,GG Jackson vs. Draymond Green (Pat Spencer gains possession),opentip,0,502c629b-4da7-40fd-92ab-20cb55411c35,basketball_play,1770693144,465,True,2026-02-10 03:12:24+00:00,1,720.0,0.0,0.0,4
4,117,quarter,1,1cfe70b8-4dfc-47dc-acca-b68d4a725972,0,11:45,GG Jackson personal foul (Draymond Green draws the foul),personalfoul,0,502c629b-4da7-40fd-92ab-20cb55411c35,basketball_play,1770693159,464,True,2026-02-10 03:12:39+00:00,1,705.0,15.0,0.25,5
4,116,quarter,1,502c629b-4da7-40fd-92ab-20cb55411c35,0,11:40,Moses Moody turnover (out of bounds bad pass),turnover,0,1cfe70b8-4dfc-47dc-acca-b68d4a725972,basketball_play,1770693181,463,True,2026-02-10 03:13:01+00:00,1,700.0,20.0,0.3333333333333333,6
4,115,quarter,1,1cfe70b8-4dfc-47dc-acca-b68d4a725972,0,11:16,Ty Jerome misses three point pullup jump shot,threepointmiss,0,,basketball_play,1770693212,462,True,2026-02-10 03:13:32+00:00,1,676.0,44.0,0.7333333333333333,7
4,114,quarter,1,1cfe70b8-4dfc-47dc-acca-b68d4a725972,0,11:16,Grizzlies offensive rebound,rebound,0,1cfe70b8-4dfc-47dc-acca-b68d4a725972,basketball_play,1770693214,461,True,2026-02-10 03:13:34+00:00,1,676.0,44.0,0.7333333333333333,8
4,113,quarter,1,1cfe70b8-4dfc-47dc-acca-b68d4a725972,0,11:16,Grizzlies turnover (shot clock violation),turnover,0,502c629b-4da7-40fd-92ab-20cb55411c35,basketball_play,1770693215,460,True,2026-02-10 03:13:35+00:00,1,676.0,44.0,0.7333333333333333,9
4,112,quarter,1,502c629b-4da7-40fd-92ab-20cb55411c35,0,11:05,Moses Moody misses three point jump shot,threepointmiss,0,,basketball_play,1770693232,459,True,2026-02-10 03:13:52+00:00,1,665.0,55.0,0.9166666666666666,10
4,111,quarter,1,1cfe70b8-4dfc-47dc-acca-b68d4a725972,0,11:02,Kyle Anderson defensive rebound,rebound,0,1cfe70b8-4dfc-47dc-acca-b68d4a725972,basketball_play,1770693235,458,True,2026-02-10 03:13:55+00:00,1,662.0,58.0,0.9666666666666667,11
4,110,quarter,1,502c629b-4da7-40fd-92ab-20cb55411c35,0,10:47,Draymond Green shooting foul (Kyle Anderson draws the foul),shootingfoul,0,1cfe70b8-4dfc-47dc-acca-b68d4a725972,basketball_play,1770693253,457,True,2026-02-10 03:14:13+00:00,1,647.0,73.0,1.2166666666666666,12
4,109,quarter,1,1cfe70b8-4dfc-47dc-acca-b68d4a725972,1,10:47,Kyle Anderson makes regular free throw 1 of 2,freethrowmade,0,1cfe70b8-4dfc-47dc-acca-b68d4a725972,basketball_play,1770693284,456,True,2026-02-10 03:14:44+00:00,1,647.0,73.0,1.2166666666666666,13
4,108,quarter,1,1cfe70b8-4dfc-47dc-acca-b68d4a725972,2,10:47,Kyle Anderson makes regular free throw 2 of 2,freethrowmade,0,502c629b-4da7-40fd-92ab-20cb55411c35,basketball_play,1770693306,455,True,2026-02-10 03:15:06+00:00,1,647.0,73.0,1.2166666666666666,14
4,107,quarter,1,502c629b-4da7-40fd-92ab-20cb55411c35,2,10:28,Draymond Green misses three point jump shot,threepointmiss,0,,basketball_play,1770693327,454,True,2026-02-10 03:15:27+00:00,1,628.0,92.0,1.5333333333333334,15
4,106,quarter,1,1cfe70b8-4dfc-47dc-acca-b68d4a725972,2,10:26,Cedric Coward defensive rebound,rebound,0,1cfe70b8-4dfc-47dc-acca-b68d4a725972,basketball_play,1770693329,453,True,2026-02-10 03:15:29+00:00,1,626.0,94.0,1.5666666666666667,16
4,105,quarter,1,1cfe70b8-4dfc-47dc-acca-b68d4a725972,4,10:11,Cedric Coward makes two point driving layup (Ty Jerome assists),twopointmade,0,502c629b-4da7-40fd-92ab-20cb55411c35,basketball_play,1770693345,452,True,2026-02-10 03:15:45+00:00,1,611.0,109.0,1.8166666666666667,17
4,104,quarter,1,502c629b-4da7-40fd-92ab-20cb55411c35,4,10:02,Pat Spencer makes three point pullup jump shot (Gui Santos assists),threepointmade,3,1cfe70b8-4dfc-47dc-acca-b68d4a725972,basketball_play,1770693352,451,True,2026-02-10 03:15:52+00:00,1,602.0,118.0,1.9666666666666666,18
4,103,quarter,1,1cfe70b8-4dfc-47dc-acca-b68d4a725972,4,9:44,Ty Jerome turnover (lost ball) (Moses Moody steals),turnover,3,502c629b-4da7-40fd-92ab-20cb55411c35,basketball_play,1770693371,450,True,2026-02-10 03:16:11+00:00,1,584.0,136.0,2.2666666666666666,19
4,102,quarter,1,502c629b-4da7-40fd-92ab-20cb55411c35,4,9:37,Draymond Green makes two point running layup (Moses Moody assists),twopointmade,5,1cfe70b8-4dfc-47dc-acca-b68d4a725972,basketball_play,1770693377,449,True,2026-02-10 03:16:17+00:00,1,577.0,143.0,2.3833333333333333,20
4,101,quarter,1,1cfe70b8-4dfc-47dc-acca-b68d4a725972,4,9:23,Kyle Anderson turnover (bad pass) (Draymond Green steals),turnover,5,502c629b-4da7-40fd-92ab-20cb55411c35,basketball_play,1770693392,448,True,2026-02-10 03:16:32+00:00,1,563.0,157.0,2.6166666666666667,21
4,100,quarter,1,502c629b-4da7-40fd-92ab-20cb55411c35,4,9:17,De'Anthony Melton misses three point running pullup jump shot,threepointmiss,5,,basketball_play,1770693398,447,True,2026-02-10 03:16:38+00:00,1,557.0,163.0,2.716666666666667,22
4,99,quarter,1,1cfe70b8-4dfc-47dc-acca-b68d4a725972,4,9:14,Cedric Coward defensive rebound,rebound,5,1cfe70b8-4dfc-47dc-acca-b68d4a725972,basketball_play,1770693401,446,True,2026-02-10 03:16:41+00:00,1,554.0,166.0,2.7666666666666666,23
4,98,quarter,1,502c629b-4da7-40fd-92ab-20cb55411c35,4,9:14,Moses Moody personal foul (Cedric Coward draws the foul),personalfoul,5,1cfe70b8-4dfc-47dc-acca-b68d4a725972,basketball_play,1770693407,445,True,2026-02-10 03:16:47+00:00,1,554.0,166.0,2.7666666666666666,24
4,97,quarter,1,1cfe70b8-4dfc-47dc-acca-b68d4a725972,4,9:04,Jaylen Wells misses three point jump shot,threepointmiss,5,,basketball_play,1770693430,444,True,2026-02-10 03:17:10+00:00,1,544.0,176.0,2.933333333333333,25
4,96,quarter,1,1cfe70b8-4dfc-47dc-acca-b68d4a725972,4,9:04,Grizzlies offensive rebound,rebound,5,1cfe70b8-4dfc-47dc-acca-b68d4a725972,basketball_play,1770693430,443,True,2026-02-10 03:17:10+00:00,1,544.0,176.0,2.933333333333333,26
4,95,quarter,1,502c629b-4da7-40fd-92ab-20cb55411c35,4,9:02,Pat Spencer personal foul (Loose ball) (Kyle Anderson draws the foul),personalfoul,5,1cfe70b8-4dfc-47dc-acca-b68d4a725972,basketball_play,1770693436,442,True,2026-02-10 03:17:16+00:00,1,542.0,178.0,2.966666666666667,27
4,94,quarter,1,1cfe70b8-4dfc-47dc-acca-b68d4a725972,6,8:51,Ty Jerome makes two point driving floating jump shot (Cedric Coward assists),twopointmade,5,502c629b-4da7-40fd-92ab-20cb55411c35,basketball_play,1770693466,441,True,2026-02-10 03:17:46+00:00,1,531.0,189.0,3.15,28
4,93,quarter,1,502c629b-4da7-40fd-92ab-20cb55411c35,6,8:43,Gui Santos misses three point pullup jump shot,threepointmiss,5,,basketball_play,1770693474,440,True,2026-02-10 03:17:54+00:00,1,523.0,197.0,3.283333333333333,29
4,92,quarter,1,1cfe70b8-4dfc-47dc-acca-b68d4a725972,6,8:43,Kyle Anderson defensive rebound,rebound,5,1cfe70b8-4dfc-47dc-acca-b68d4a725972,basketball_play,1770693474,439,True,2026-02-10 03:17:54+00:00,1,523.0,197.0,3.283333333333333,30
4,91,quarter,1,1cfe70b8-4dfc-47dc-acca-b68d4a725972,8,8:33,Ty Jerome makes two point driving floating jump shot,twopointmade,5,502c629b-4da7-40fd-92ab-20cb55411c35,basketball_play,1770693484,438,True,2026-02-10 03:18:04+00:00,1,513.0,207.0,3.45,31
4,90,quarter,1,1cfe70b8-4dfc-47dc-acca-b68d4a725972,8,8:25,GG Jackson shooting foul (De'Anthony Melton draws the foul),shootingfoul,5,502c629b-4da7-40fd-92ab-20cb55411c35,basketball_play,1770693494,437,True,2026-02-10 03:18:14+00:00,1,505.0,215.0,3.5833333333333335,32
4,89,quarter,1,502c629b-4da7-40fd-92ab-20cb55411c35,8,8:25,De'Anthony Melton makes regular free throw 1 of 2,freethrowmade,6,502c629b-4da7-40fd-92ab-20cb55411c35,basketball_play,1770693518,436,True,2026-02-10 03:18:38+00:00,1,505.0,215.0,3.5833333333333335,33
4,88,quarter,1,1cfe70b8-4dfc-47dc-acca-b68d4a725972,8,8:25,"Grizzlies lineup change (Taylor Hendricks, Ty Jerome, Jaylen Wells, Kyle Anderson, Cedric Coward)",lineupchange,6,,basketball_play,1770693534,435,True,2026-02-10 03:18:54+00:00,1,505.0,215.0,3.5833333333333335,34
4,87,quarter,1,502c629b-4da7-40fd-92ab-20cb55411c35,8,8:25,De'Anthony Melton makes regular free throw 2 of 2,freethrowmade,7,1cfe70b8-4dfc-47dc-acca-b68d4a725972,basketball_play,1770693534,434,True,2026-02-10 03:18:54+00:00,1,505.0,215.0,3.5833333333333335,35
4,86,quarter,1,1cfe70b8-4dfc-47dc-acca-b68d4a725972,11,8:13,Ty Jerome makes three point stepback jump shot,threepointmade,7,502c629b-4da7-40fd-92ab-20cb55411c35,basketball_play,1770693547,433,True,2026-02-10 03:19:07+00:00,1,493.0,227.0,3.783333333333333,36
4,85,quarter,1,502c629b-4da7-40fd-92ab-20cb55411c35,11,8:13,De'Anthony Melton defensive goaltending violation,defensivegoaltending,7,1cfe70b8-4dfc-47dc-acca-b68d4a725972,basketball_play,1770693579,432,True,2026-02-10 03:19:39+00:00,1,493.0,227.0,3.783333333333333,37
4,84,quarter,1,502c629b-4da7-40fd-92ab-20cb55411c35,11,8:02,Kyle Anderson blocks De'Anthony Melton's two point driving layup,twopointmiss,7,,basketball_play,1770693587,431,True,2026-02-10 03:19:47+00:00,1,482.0,238.0,3.966666666666667,38
4,83,quarter,1,1cfe70b8-4dfc-47dc-acca-b68d4a725972,11,8:02,Grizzlies defensive rebound,rebound,7,1cfe70b8-4dfc-47dc-acca-b68d4a725972,basketball_play,1770693587,430,True,2026-02-10 03:19:47+00:00,1,482.0,238.0,3.966666666666667,39
4,82,quarter,1,,11,8:02,Stoppage (Out of bounds),stoppage,7,,basketball_play,1770693592,429,True,2026-02-10 03:19:52+00:00,1,482.0,238.0,3.966666666666667,40
4,81,quarter,1,1cfe70b8-4dfc-47dc-acca-b68d4a725972,11,8:02,"Grizzlies lineup change (Taylor Hendricks, Ty Jerome, Jaylen Wells, Cam Spencer, Kyle Anderson)",lineupchange,7,,basketball_play,1770693599,428,True,2026-02-10 03:19:59+00:00,1,482.0,238.0,3.966666666666667,41
4,80,quarter,1,502c629b-4da7-40fd-92ab-20cb55411c35,11,8:02,"Warriors lineup change (Pat Spencer, Draymond Green, Moses Moody, Will Richard, De'Anthony Melton)",lineupchange,7,,basketball_play,1770693599,427,True,2026-02-10 03:19:59+00:00,1,482.0,238.0,3.966666666666667,42
4,79,quarter,1,1cfe70b8-4dfc-47dc-acca-b68d4a725972,14,7:50,Taylor Hendricks makes three point jump shot (Ty Jerome assists),threepointmade,7,502c629b-4da7-40fd-92ab-20cb55411c35,basketball_play,1770693639,426,True,2026-02-10 03:20:39+00:00,1,470.0,250.0,4.166666666666667,43
4,78,quarter,1,502c629b-4da7-40fd-92ab-20cb55411c35,14,7:30,Moses Moody turnover (bad pass) (Taylor Hendricks steals),turnover,7,1cfe70b8-4dfc-47dc-acca-b68d4a725972,basketball_play,1770693659,425,True,2026-02-10 03:20:59+00:00,1,450.0,270.0,4.5,44
4,77,quarter,1,1cfe70b8-4dfc-47dc-acca-b68d4a725972,16,7:22,Taylor Hendricks makes two point cutting layup (Cam Spencer assists),twopointmade,7,502c629b-4da7-40fd-92ab-20cb55411c35,basketball_play,1770693669,424,True,2026-02-10 03:21:09+00:00,1,442.0,278.0,4.633333333333334,45
4,76,quarter,1,502c629b-4da7-40fd-92ab-20cb55411c35,16,7:22,Will Richard shooting foul (Taylor Hendricks draws the foul),shootingfoul,7,1cfe70b8-4dfc-47dc-acca-b68d4a725972,basketball_play,1770693671,423,True,2026-02-10 03:21:11+00:00,1,442.0,278.0,4.633333333333334,46
4,75,quarter,1,502c629b-4da7-40fd-92ab-20cb55411c35,16,7:22,Warriors 60 second timeout,teamtimeout,7,,basketball_play,1770693682,422,True,2026-02-10 03:21:22+00:00,1,442.0,278.0,4.633333333333334,47
4,74,quarter,1,1cfe70b8-4dfc-47dc-acca-b68d4a725972,16,7:22,"Grizzlies lineup change (Scotty Pippen Jr., Taylor Hendricks, Jaylen Wells, Cam Spencer, Kyle Anderson)",lineupchange,7,,basketball_play,1770693879,421,True,2026-02-10 03:24:39+00:00,1,442.0,278.0,4.633333333333334,48
4,73,quarter,1,1cfe70b8-4dfc-47dc-acca-b68d4a725972,17,7:22,Taylor Hendricks makes regular free throw 1 of 1,freethrowmade,7,,basketball_play,1770693879,420,True,2026-02-10 03:24:39+00:00,1,442.0,278.0,4.633333333333334,49
4,72,quarter,1,502c629b-4da7-40fd-92ab-20cb55411c35,17,7:07,Moses Moody misses three point jump shot,threepointmiss,7,,basketball_play,1770693896,419,True,2026-02-10 03:24:56+00:00,1,427.0,293.0,4.883333333333334,50
4,71,quarter,1,1cfe70b8-4dfc-47dc-acca-b68d4a725972,17,7:04,Kyle Anderson defensive rebound,rebound,7,1cfe70b8-4dfc-47dc-acca-b68d4a725972,basketball_play,1770693899,418,True,2026-02-10 03:24:59+00:00,1,424.0,296.0,4.933333333333334,51
4,70,quarter,1,1cfe70b8-4dfc-47dc-acca-b68d4a725972,17,6:56,Taylor Hendricks misses three point jump shot,threepointmiss,7,,basketball_play,1770693906,417,True,2026-02-10 03:25:06+00:00,1,416.0,304.0,5.066666666666666,52
4,69,quarter,1,1cfe70b8-4dfc-47dc-acca-b68d4a725972,17,6:54,Grizzlies offensive rebound,rebound,7,1cfe70b8-4dfc-47dc-acca-b68d4a725972,basketball_play,1770693913,416,True,2026-02-10 03:25:13+00:00,1,414.0,306.0,5.1,53
4,68,quarter,1,,17,6:54,Stoppage (Out of bounds),stoppage,7,,basketball_play,1770693914,415,True,2026-02-10 03:25:14+00:00,1,414.0,306.0,5.1,54
4,67,quarter,1,502c629b-4da7-40fd-92ab-20cb55411c35,17,6:54,"Warriors lineup change (Pat Spencer, Draymond Green, Brandin Podziemski, Al Horford, Will Richard)",lineupchange,7,,basketball_play,1770693915,414,True,2026-02-10 03:25:15+00:00,1,414.0,306.0,5.1,55
4,66,quarter,1,1cfe70b8-4dfc-47dc-acca-b68d4a725972,17,6:48,Taylor Hendricks misses three point jump shot,threepointmiss,7,,basketball_play,1770693935,413,True,2026-02-10 03:25:35+00:00,1,408.0,312.0,5.2,56
4,65,quarter,1,502c629b-4da7-40fd-92ab-20cb55411c35,17,6:45,Brandin Podziemski defensive rebound,rebound,7,502c629b-4da7-40fd-92ab-20cb55411c35,basketball_play,1770693938,412,True,2026-02-10 03:25:38+00:00,1,405.0,315.0,5.25,57
4,64,quarter,1,502c629b-4da7-40fd-92ab-20cb55411c35,17,6:36,Draymond Green makes three point jump shot (Pat Spencer assists),threepointmade,10,1cfe70b8-4dfc-47dc-acca-b68d4a725972,basketball_play,1770693948,411,True,2026-02-10 03:25:48+00:00,1,396.0,324.0,5.4,58
4,63,quarter,1,502c629b-4da7-40fd-92ab-20cb55411c35,17,6:21,Will Richard personal foul (Taylor Hendricks draws the foul),personalfoul,10,1cfe70b8-4dfc-47dc-acca-b68d4a725972,basketball_play,1770693965,410,True,2026-02-10 03:26:05+00:00,1,381.0,339.0,5.65,59
4,62,quarter,1,1cfe70b8-4dfc-47dc-acca-b68d4a725972,17,6:21,Taylor Hendricks misses regular free throw 1 of 2,freethrowmiss,10,1cfe70b8-4dfc-47dc-acca-b68d4a725972,basketball_play,1770693992,409,True,2026-02-10 03:26:32+00:00,1,381.0,339.0,5.65,60
4,61,quarter,1,1cfe70b8-4dfc-47dc-acca-b68d4a725972,17,6:21,Grizzlies offensive rebound,rebound,10,1cfe70b8-4dfc-47dc-acca-b68d4a725972,basketball_play,1770693992,408,True,2026-02-10 03:26:32+00:00,1,381.0,339.0,5.65,61
4,60,quarter,1,1cfe70b8-4dfc-47dc-acca-b68d4a725972,17,6:21,Taylor Hendricks misses regular free throw 2 of 2,freethrowmiss,10,,basketball_play,1770694004,407,True,2026-02-10 03:26:44+00:00,1,381.0,339.0,5.65,62
4,59,quarter,1,502c629b-4da7-40fd-92ab-20cb55411c35,17,6:19,Draymond Green defensive rebound,rebound,10,502c629b-4da7-40fd-92ab-20cb55411c35,basketball_play,1770694005,406,True,2026-02-10 03:26:45+00:00,1,379.0,341.0,5.683333333333334,63
4,58,quarter,1,502c629b-4da7-40fd-92ab-20cb55411c35,17,6:12,Pat Spencer makes two point driving layup (Brandin Podziemski assists),twopointmade,12,1cfe70b8-4dfc-47dc-acca-b68d4a725972,basketball_play,1770694013,405,True,2026-02-10 03:26:53+00:00,1,372.0,348.0,5.8,64
4,57,quarter,1,1cfe70b8-4dfc-47dc-acca-b68d4a725972,17,6:12,Kyle Anderson shooting foul (Pat Spencer draws the foul),shootingfoul,12,502c629b-4da7-40fd-92ab-20cb55411c35,basketball_play,1770694016,404,True,2026-02-10 03:26:56+00:00,1,372.0,348.0,5.8,65
4,56,quarter,1,1cfe70b8-4dfc-47dc-acca-b68d4a725972,17,6:12,"Grizzlies lineup change (Scotty Pippen Jr., Taylor Hendricks, Kentavious Caldwell-Pope, Cam Spencer, Jahmai Mashack)",lineupchange,12,,basketball_play,1770694028,403,True,2026-02-10 03:27:08+00:00,1,372.0,348.0,5.8,66
4,55,quarter,1,502c629b-4da7-40fd-92ab-20cb55411c35,17,6:12,Pat Spencer misses regular free throw 1 of 1,freethrowmiss,12,,basketball_play,1770694047,402,True,2026-02-10 03:27:27+00:00,1,372.0,348.0,5.8,67
4,54,quarter,1,1cfe70b8-4dfc-47dc-acca-b68d4a725972,17,6:10,Taylor Hendricks defensive rebound,rebound,12,1cfe70b8-4dfc-47dc-acca-b68d4a725972,basketball_play,1770694049,401,True,2026-02-10 03:27:29+00:00,1,370.0,350.0,5.833333333333333,68
4,53,quarter,1,1cfe70b8-4dfc-47dc-acca-b68d4a725972,17,5:47,Taylor Hendricks misses two point cutting finger roll layup,twopointmiss,12,,basketball_play,1770694072,400,True,2026-02-10 03:27:52+00:00,1,347.0,373.0,6.216666666666667,69
4,52,quarter,1,502c629b-4da7-40fd-92ab-20cb55411c35,17,5:44,Brandin Podziemski defensive rebound,rebound,12,502c629b-4da7-40fd-92ab-20cb55411c35,basketball_play,1770694075,399,True,2026-02-10 03:27:55+00:00,1,344.0,376.0,6.266666666666667,70
4,51,quarter,1,1cfe70b8-4dfc-47dc-acca-b68d4a725972,17,5:41,Taylor Hendricks personal foul (Draymond Green draws the foul),personalfoul,12,502c629b-4da7-40fd-92ab-20cb55411c35,basketball_play,1770694082,398,True,2026-02-10 03:28:02+00:00,1,341.0,379.0,6.316666666666666,71
4,50,quarter,1,502c629b-4da7-40fd-92ab-20cb55411c35,17,5:37,Pat Spencer misses three point pullup jump shot,threepointmiss,12,,basketball_play,1770694110,397,True,2026-02-10 03:28:30+00:00,1,337.0,383.0,6.383333333333334,72
4,49,quarter,1,502c629b-4da7-40fd-92ab-20cb55411c35,17,5:33,Draymond Green offensive rebound,rebound,12,502c629b-4da7-40fd-92ab-20cb55411c35,basketball_play,1770694113,396,True,2026-02-10 03:28:33+00:00,1,333.0,387.0,6.45,73
4,48,quarter,1,502c629b-4da7-40fd-92ab-20cb55411c35,17,5:32,Brandin Podziemski misses three point jump shot,threepointmiss,12,,basketball_play,1770694115,395,True,2026-02-10 03:28:35+00:00,1,332.0,388.0,6.466666666666667,74
4,47,quarter,1,1cfe70b8-4dfc-47dc-acca-b68d4a725972,17,5:28,Kentavious Caldwell-Pope defensive rebound,rebound,12,1cfe70b8-4dfc-47dc-acca-b68d4a725972,basketball_play,1770694119,394,True,2026-02-10 03:28:39+00:00,1,328.0,392.0,6.533333333333333,75
4,46,quarter,1,1cfe70b8-4dfc-47dc-acca-b68d4a725972,19,5:23,Jahmai Mashack makes two point running layup (Kentavious Caldwell-Pope assists),twopointmade,12,502c629b-4da7-40fd-92ab-20cb55411c35,basketball_play,1770694123,393,True,2026-02-10 03:28:43+00:00,1,323.0,397.0,6.616666666666666,76
4,45,quarter,1,1cfe70b8-4dfc-47dc-acca-b68d4a725972,19,5:04,Jahmai Mashack personal foul (Brandin Podziemski draws the foul),personalfoul,12,502c629b-4da7-40fd-92ab-20cb55411c35,basketball_play,1770694147,392,True,2026-02-10 03:29:07+00:00,1,304.0,416.0,6.933333333333334,77
4,44,quarter,1,502c629b-4da7-40fd-92ab-20cb55411c35,19,5:04,Brandin Podziemski makes regular free throw 1 of 2,freethrowmade,13,502c629b-4da7-40fd-92ab-20cb55411c35,basketball_play,1770694174,391,True,2026-02-10 03:29:34+00:00,1,304.0,416.0,6.933333333333334,78
4,43,quarter,1,502c629b-4da7-40fd-92ab-20cb55411c35,19,5:04,"Warriors lineup change (Brandin Podziemski, Gui Santos, Al Horford, Gary Payton II, Will Richard)",lineupchange,13,,basketball_play,1770694179,390,True,2026-02-10 03:29:39+00:00,1,304.0,416.0,6.933333333333334,79
4,42,quarter,1,502c629b-4da7-40fd-92ab-20cb55411c35,19,5:04,Brandin Podziemski misses regular free throw 2 of 2,freethrowmiss,13,,basketball_play,1770694174,389,True,2026-02-10 03:29:34+00:00,1,304.0,416.0,6.933333333333334,80
4,41,quarter,1,1cfe70b8-4dfc-47dc-acca-b68d4a725972,19,5:02,Taylor Hendricks defensive rebound,rebound,13,1cfe70b8-4dfc-47dc-acca-b68d4a725972,basketball_play,1770694176,388,True,2026-02-10 03:29:36+00:00,1,302.0,418.0,6.966666666666667,81
4,40,quarter,1,1cfe70b8-4dfc-47dc-acca-b68d4a725972,19,4:55,Cam Spencer misses three point jump shot,threepointmiss,13,,basketball_play,1770694207,387,True,2026-02-10 03:30:07+00:00,1,295.0,425.0,7.083333333333333,82
4,39,quarter,1,502c629b-4da7-40fd-92ab-20cb55411c35,19,4:51,Will Richard defensive rebound,rebound,13,502c629b-4da7-40fd-92ab-20cb55411c35,basketball_play,1770694211,386,True,2026-02-10 03:30:11+00:00,1,291.0,429.0,7.15,83
4,38,quarter,1,502c629b-4da7-40fd-92ab-20cb55411c35,19,4:39,Gui Santos makes two point driving reverse layup,twopointmade,15,1cfe70b8-4dfc-47dc-acca-b68d4a725972,basketball_play,1770694223,385,True,2026-02-10 03:30:23+00:00,1,279.0,441.0,7.35,84
4,37,quarter,1,1cfe70b8-4dfc-47dc-acca-b68d4a725972,21,4:17,Scotty Pippen Jr. makes two point bank jump shot (Cam Spencer assists),twopointmade,15,502c629b-4da7-40fd-92ab-20cb55411c35,basketball_play,1770694245,384,True,2026-02-10 03:30:45+00:00,1,257.0,463.0,7.716666666666667,85
4,36,quarter,1,502c629b-4da7-40fd-92ab-20cb55411c35,21,3:59,Gary Payton II misses two point driving floating jump shot,twopointmiss,15,,basketball_play,1770694262,383,True,2026-02-10 03:31:02+00:00,1,239.0,481.0,8.016666666666667,86
4,35,quarter,1,1cfe70b8-4dfc-47dc-acca-b68d4a725972,21,3:57,Taylor Hendricks defensive rebound,rebound,15,1cfe70b8-4dfc-47dc-acca-b68d4a725972,basketball_play,1770694264,382,True,2026-02-10 03:31:04+00:00,1,237.0,483.0,8.05,87
4,34,quarter,1,1cfe70b8-4dfc-47dc-acca-b68d4a725972,23,3:51,Scotty Pippen Jr. makes two point running reverse layup (Kentavious Caldwell-Pope assists),twopointmade,15,502c629b-4da7-40fd-92ab-20cb55411c35,basketball_play,1770694270,381,True,2026-02-10 03:31:10+00:00,1,231.0,489.0,8.15,88
4,33,quarter,1,502c629b-4da7-40fd-92ab-20cb55411c35,23,3:39,Gui Santos makes two point cutting layup (Al Horford assists),twopointmade,17,1cfe70b8-4dfc-47dc-acca-b68d4a725972,basketball_play,1770694287,380,True,2026-02-10 03:31:27+00:00,1,219.0,501.0,8.35,89
4,32,quarter,1,1cfe70b8-4dfc-47dc-acca-b68d4a725972,23,3:39,Scotty Pippen Jr. shooting foul (Gui Santos draws the foul),shootingfoul,17,502c629b-4da7-40fd-92ab-20cb55411c35,basketball_play,1770694289,379,True,2026-02-10 03:31:29+00:00,1,219.0,501.0,8.35,90
4,31,quarter,1,502c629b-4da7-40fd-92ab-20cb55411c35,23,3:39,Gui Santos makes regular free throw 1 of 1,freethrowmade,18,,basketball_play,1770694314,378,True,2026-02-10 03:31:54+00:00,1,219.0,501.0,8.35,91
4,30,quarter,1,1cfe70b8-4dfc-47dc-acca-b68d4a725972,26,3:20,Taylor Hendricks makes three point jump shot (Scotty Pippen Jr. assists),threepointmade,18,502c629b-4da7-40fd-92ab-20cb55411c35,basketball_play,1770694334,377,True,2026-02-10 03:32:14+00:00,1,200.0,520.0,8.666666666666666,92
4,29,quarter,1,502c629b-4da7-40fd-92ab-20cb55411c35,26,3:02,Scotty Pippen Jr. blocks Al Horford's two point cutting layup,twopointmiss,18,,basketball_play,1770694353,376,True,2026-02-10 03:32:33+00:00,1,182.0,538.0,8.966666666666667,93
4,28,quarter,1,502c629b-4da7-40fd-92ab-20cb55411c35,26,3:02,Al Horford offensive rebound,rebound,18,502c629b-4da7-40fd-92ab-20cb55411c35,basketball_play,1770694353,375,True,2026-02-10 03:32:33+00:00,1,182.0,538.0,8.966666666666667,94
4,27,quarter,1,502c629b-4da7-40fd-92ab-20cb55411c35,26,3:02,Al Horford makes two point putback layup,twopointmade,20,1cfe70b8-4dfc-47dc-acca-b68d4a725972,basketball_play,1770694357,374,True,2026-02-10 03:32:37+00:00,1,182.0,538.0,8.966666666666667,95
4,26,quarter,1,1cfe70b8-4dfc-47dc-acca-b68d4a725972,26,3:02,Scotty Pippen Jr. shooting foul (Al Horford draws the foul),shootingfoul,20,502c629b-4da7-40fd-92ab-20cb55411c35,basketball_play,1770694357,373,True,2026-02-10 03:32:37+00:00,1,182.0,538.0,8.966666666666667,96
4,25,quarter,1,1cfe70b8-4dfc-47dc-acca-b68d4a725972,26,3:02,"Grizzlies lineup change (Scotty Pippen Jr., Taylor Hendricks, Kentavious Caldwell-Pope, Jahmai Mashack, Cedric Coward)",lineupchange,20,,basketball_play,1770694365,372,True,2026-02-10 03:32:45+00:00,1,182.0,538.0,8.966666666666667,97
4,24,quarter,1,502c629b-4da7-40fd-92ab-20cb55411c35,26,3:02,"Warriors lineup change (Brandin Podziemski, Gui Santos, Al Horford, Moses Moody, Gary Payton II)",lineupchange,20,,basketball_play,1770694365,371,True,2026-02-10 03:32:45+00:00,1,182.0,538.0,8.966666666666667,98
4,23,quarter,1,502c629b-4da7-40fd-92ab-20cb55411c35,26,3:02,Al Horford makes regular free throw 1 of 1,freethrowmade,21,,basketball_play,1770694391,370,True,2026-02-10 03:33:11+00:00,1,182.0,538.0,8.966666666666667,99
4,22,quarter,1,1cfe70b8-4dfc-47dc-acca-b68d4a725972,26,2:46,Taylor Hendricks misses three point jump shot,threepointmiss,21,,basketball_play,1770694409,369,True,2026-02-10 03:33:29+00:00,1,166.0,554.0,9.233333333333333,100
4,21,quarter,1,502c629b-4da7-40fd-92ab-20cb55411c35,26,2:42,Al Horford defensive rebound,rebound,21,502c629b-4da7-40fd-92ab-20cb55411c35,basketball_play,1770694413,368,True,2026-02-10 03:33:33+00:00,1,162.0,558.0,9.3,101
4,20,quarter,1,502c629b-4da7-40fd-92ab-20cb55411c35,26,2:36,Gary Payton II misses two point layup,twopointmiss,21,,basketball_play,1770694419,367,True,2026-02-10 03:33:39+00:00,1,156.0,564.0,9.4,102
4,19,quarter,1,1cfe70b8-4dfc-47dc-acca-b68d4a725972,26,2:35,Jahmai Mashack defensive rebound,rebound,21,1cfe70b8-4dfc-47dc-acca-b68d4a725972,basketball_play,1770694420,366,True,2026-02-10 03:33:40+00:00,1,155.0,565.0,9.416666666666666,103
4,18,quarter,1,1cfe70b8-4dfc-47dc-acca-b68d4a725972,26,2:28,Jahmai Mashack turnover (bad pass) (Moses Moody steals),turnover,21,502c629b-4da7-40fd-92ab-20cb55411c35,basketball_play,1770694428,365,True,2026-02-10 03:33:48+00:00,1,148.0,572.0,9.533333333333333,104
4,17,quarter,1,502c629b-4da7-40fd-92ab-20cb55411c35,26,2:23,Brandin Podziemski makes three point running pullup jump shot,threepointmade,24,1cfe70b8-4dfc-47dc-acca-b68d4a725972,basketball_play,1770694432,364,True,2026-02-10 03:33:52+00:00,1,143.0,577.0,9.616666666666667,105
