period_index,event_index,period_type,period_number,attribution,away_points,clock,description,event_type,home_points,possession,type,wall_clock,pbp_source_row,has_wall_clock,event_ts_utc,period_sequence,game_clock_seconds_remaining,game_elapsed_seconds,game_elapsed_minutes,pbp_chronological_index
4,16,quarter,1,1cfe70b8-4dfc-47dc-acca-b68d4a725972,26,2:21,Grizzlies 60 second timeout,teamtimeout,24,,basketball_play,1770694439,363,True,2026-02-10 03:33:59+00:00,1,141.0,579.0,9.65,106
4,15,quarter,1,1cfe70b8-4dfc-47dc-acca-b68d4a725972,26,2:21,"Grizzlies lineup change (GG Jackson, Kentavious Caldwell-Pope, Javon Small, Jahmai Mashack, Cedric Coward)",lineupchange,24,,basketball_play,1770694608,362,True,2026-02-10 03:36:48+00:00,1,141.0,579.0,9.65,107
4,14,quarter,1,1cfe70b8-4dfc-47dc-acca-b68d4a725972,28,1:58,Jahmai Mashack makes two point driving reverse layup (GG Jackson assists),twopointmade,24,502c629b-4da7-40fd-92ab-20cb55411c35,basketball_play,1770694657,361,True,2026-02-10 03:37:37+00:00,1,118.0,602.0,10.033333333333333,108
4,13,quarter,1,502c629b-4da7-40fd-92ab-20cb55411c35,28,1:38,Gary Payton II makes two point cutting layup (Al Horford assists),twopointmade,26,1cfe70b8-4dfc-47dc-acca-b68d4a725972,basketball_play,1770694677,360,True,2026-02-10 03:37:57+00:00,1,98.0,622.0,10.366666666666667,109
4,12,quarter,1,1cfe70b8-4dfc-47dc-acca-b68d4a725972,28,1:25,GG Jackson misses three point jump shot,threepointmiss,26,,basketball_play,1770694690,359,True,2026-02-10 03:38:10+00:00,1,85.0,635.0,10.583333333333334,110
4,11,quarter,1,502c629b-4da7-40fd-92ab-20cb55411c35,28,1:21,Gui Santos defensive rebound,rebound,26,502c629b-4da7-40fd-92ab-20cb55411c35,basketball_play,1770694694,358,True,2026-02-10 03:38:14+00:00,1,81.0,639.0,10.65,111
4,10,quarter,1,502c629b-4da7-40fd-92ab-20cb55411c35,28,1:08,Brandin Podziemski makes two point driving floating bank jump shot (Gui Santos assists),twopointmade,28,1cfe70b8-4dfc-47dc-acca-b68d4a725972,basketball_play,1770694707,357,True,2026-02-10 03:38:27+00:00,1,68.0,652.0,10.866666666666667,112
4,9,quarter,1,,28,00:48.70,Stoppage (Out of bounds),stoppage,28,,basketball_play,1770694733,356,True,2026-02-10 03:38:53+00:00,1,48.7,671.3,11.188333333333333,113
4,8,quarter,1,502c629b-4da7-40fd-92ab-20cb55411c35,28,00:43.90,Gary Payton II shooting foul (Kentavious Caldwell-Pope draws the foul),shootingfoul,28,1cfe70b8-4dfc-47dc-acca-b68d4a725972,basketball_play,1770694752,355,True,2026-02-10 03:39:12+00:00,1,43.9,676.1,11.268333333333334,114
4,7,quarter,1,1cfe70b8-4dfc-47dc-acca-b68d4a725972,29,00:43.90,Kentavious Caldwell-Pope makes regular free throw 1 of 2,freethrowmade,28,1cfe70b8-4dfc-47dc-acca-b68d4a725972,basketball_play,1770694778,354,True,2026-02-10 03:39:38+00:00,1,43.9,676.1,11.268333333333334,115
4,6,quarter,1,1cfe70b8-4dfc-47dc-acca-b68d4a725972,30,00:43.90,Kentavious Caldwell-Pope makes regular free throw 2 of 2,freethrowmade,28,502c629b-4da7-40fd-92ab-20cb55411c35,basketball_play,1770694797,353,True,2026-02-10 03:39:57+00:00,1,43.9,676.1,11.268333333333334,116
4,5,quarter,1,502c629b-4da7-40fd-92ab-20cb55411c35,30,00:29.10,Al Horford makes two point driving finger roll layup (Brandin Podziemski assists),twopointmade,30,1cfe70b8-4dfc-47dc-acca-b68d4a725972,basketball_play,1770694815,352,True,2026-02-10 03:40:15+00:00,1,29.1,690.9,11.514999999999999,117
4,4,quarter,1,1cfe70b8-4dfc-47dc-acca-b68d4a725972,32,00:14.70,Jahmai Mashack makes two point cutting layup (GG Jackson assists),twopointmade,30,502c629b-4da7-40fd-92ab-20cb55411c35,basketball_play,1770694832,351,True,2026-02-10 03:40:32+00:00,1,14.7,705.3,11.754999999999999,118
4,3,quarter,1,502c629b-4da7-40fd-92ab-20cb55411c35,32,00:00.50,Brandin Podziemski makes two point turnaround bank jump shot,twopointmade,32,1cfe70b8-4dfc-47dc-acca-b68d4a725972,basketball_play,1770694854,350,True,2026-02-10 03:40:54+00:00,1,0.5,719.5,11.991666666666667,119
4,2,quarter,1,,32,00:00,Instant replay (Request: Ruling Upheld),review,32,,basketball_play,1770694858,349,True,2026-02-10 03:40:58+00:00,1,0.0,720.0,12.0,120
4,1,quarter,1,,32,00:00,End of 1st Quarter.,endperiod,32,,basketball_play,1770694858,348,True,2026-02-10 03:40:58+00:00,1,0.0,720.0,12.0,121
3,119,quarter,2,502c629b-4da7-40fd-92ab-20cb55411c35,32,12:00,"Warriors lineup change (Pat Spencer, Draymond Green, Moses Moody, Will Richard, De'Anthony Melton)",lineupchange,32,,basketball_play,1770694959,347,True,2026-02-10 03:42:39+00:00,2,720.0,720.0,12.0,122
3,118,quarter,2,,32,12:00,Start of 2nd Quarter,startperiod,32,,basketball_play,1770695033,346,True,2026-02-10 03:43:53+00:00,2,720.0,720.0,12.0,123
3,117,quarter,2,502c629b-4da7-40fd-92ab-20cb55411c35,32,11:47,Will Richard shooting foul (Kentavious Caldwell-Pope draws the foul),shootingfoul,32,1cfe70b8-4dfc-47dc-acca-b68d4a725972,basketball_play,1770695048,345,True,2026-02-10 03:44:08+00:00,2,707.0,733.0,12.216666666666667,124
3,116,quarter,2,1cfe70b8-4dfc-47dc-acca-b68d4a725972,33,11:47,Kentavious Caldwell-Pope makes regular free throw 1 of 2,freethrowmade,32,1cfe70b8-4dfc-47dc-acca-b68d4a725972,basketball_play,1770695074,344,True,2026-02-10 03:44:34+00:00,2,707.0,733.0,12.216666666666667,125
3,115,quarter,2,1cfe70b8-4dfc-47dc-acca-b68d4a725972,34,11:47,Kentavious Caldwell-Pope makes regular free throw 2 of 2,freethrowmade,32,502c629b-4da7-40fd-92ab-20cb55411c35,basketball_play,1770695096,343,True,2026-02-10 03:44:56+00:00,2,707.0,733.0,12.216666666666667,126
3,114,quarter,2,502c629b-4da7-40fd-92ab-20cb55411c35,34,11:25,Draymond Green makes three point jump shot (Moses Moody assists),threepointmade,35,1cfe70b8-4dfc-47dc-acca-b68d4a725972,basketball_play,1770695120,342,True,2026-02-10 03:45:20+00:00,2,685.0,755.0,12.583333333333334,127
3,113,quarter,2,1cfe70b8-4dfc-47dc-acca-b68d4a725972,34,11:10,Javon Small misses three point pullup jump shot,threepointmiss,35,,basketball_play,1770695135,341,True,2026-02-10 03:45:35+00:00,2,670.0,770.0,12.833333333333334,128
3,112,quarter,2,502c629b-4da7-40fd-92ab-20cb55411c35,34,11:06,De'Anthony Melton defensive rebound,rebound,35,502c629b-4da7-40fd-92ab-20cb55411c35,basketball_play,1770695139,340,True,2026-02-10 03:45:39+00:00,2,666.0,774.0,12.9,129
3,111,quarter,2,502c629b-4da7-40fd-92ab-20cb55411c35,34,10:48,De'Anthony Melton makes two point driving layup (Draymond Green assists),twopointmade,37,1cfe70b8-4dfc-47dc-acca-b68d4a725972,basketball_play,1770695157,339,True,2026-02-10 03:45:57+00:00,2,648.0,792.0,13.2,130
3,110,quarter,2,1cfe70b8-4dfc-47dc-acca-b68d4a725972,36,10:39,Javon Small makes two point driving dunk,twopointmade,37,502c629b-4da7-40fd-92ab-20cb55411c35,basketball_play,1770695166,338,True,2026-02-10 03:46:06+00:00,2,639.0,801.0,13.35,131
3,109,quarter,2,502c629b-4da7-40fd-92ab-20cb55411c35,36,10:20,De'Anthony Melton turnover (lost ball) (Jahmai Mashack steals),turnover,37,1cfe70b8-4dfc-47dc-acca-b68d4a725972,basketball_play,1770695185,337,True,2026-02-10 03:46:25+00:00,2,620.0,820.0,13.666666666666666,132
3,108,quarter,2,1cfe70b8-4dfc-47dc-acca-b68d4a725972,36,10:14,Javon Small misses two point running layup,twopointmiss,37,,basketball_play,1770695191,336,True,2026-02-10 03:46:31+00:00,2,614.0,826.0,13.766666666666667,133
3,107,quarter,2,502c629b-4da7-40fd-92ab-20cb55411c35,36,10:12,Moses Moody defensive rebound,rebound,37,502c629b-4da7-40fd-92ab-20cb55411c35,basketball_play,1770695193,335,True,2026-02-10 03:46:33+00:00,2,612.0,828.0,13.8,134
3,106,quarter,2,502c629b-4da7-40fd-92ab-20cb55411c35,36,10:05,Draymond Green turnover (out of bounds bad pass),turnover,37,1cfe70b8-4dfc-47dc-acca-b68d4a725972,basketball_play,1770695201,334,True,2026-02-10 03:46:41+00:00,2,605.0,835.0,13.916666666666666,135
3,105,quarter,2,1cfe70b8-4dfc-47dc-acca-b68d4a725972,36,10:05,"Grizzlies lineup change (Taylor Hendricks, Ty Jerome, Kentavious Caldwell-Pope, Javon Small, Jahmai Mashack)",lineupchange,37,,basketball_play,1770695207,333,True,2026-02-10 03:46:47+00:00,2,605.0,835.0,13.916666666666666,136
3,104,quarter,2,1cfe70b8-4dfc-47dc-acca-b68d4a725972,38,9:55,Kentavious Caldwell-Pope makes two point fadeaway jump shot,twopointmade,37,502c629b-4da7-40fd-92ab-20cb55411c35,basketball_play,1770695237,332,True,2026-02-10 03:47:17+00:00,2,595.0,845.0,14.083333333333334,137
3,103,quarter,2,1cfe70b8-4dfc-47dc-acca-b68d4a725972,38,9:49,Kentavious Caldwell-Pope personal foul (De'Anthony Melton draws the foul),personalfoul,37,502c629b-4da7-40fd-92ab-20cb55411c35,basketball_play,1770695246,331,True,2026-02-10 03:47:26+00:00,2,589.0,851.0,14.183333333333334,138
3,102,quarter,2,1cfe70b8-4dfc-47dc-acca-b68d4a725972,38,9:49,"Grizzlies lineup change (Taylor Hendricks, Ty Jerome, Kentavious Caldwell-Pope, Kyle Anderson, Javon Small)",lineupchange,37,,basketball_play,1770695282,330,True,2026-02-10 03:48:02+00:00,2,589.0,851.0,14.183333333333334,139
3,101,quarter,2,502c629b-4da7-40fd-92ab-20cb55411c35,38,9:37,De'Anthony Melton misses three point stepback jump shot,threepointmiss,37,,basketball_play,1770695282,329,True,2026-02-10 03:48:02+00:00,2,577.0,863.0,14.383333333333333,140
3,100,quarter,2,502c629b-4da7-40fd-92ab-20cb55411c35,38,9:34,Will Richard offensive rebound,rebound,37,502c629b-4da7-40fd-92ab-20cb55411c35,basketball_play,1770695285,328,True,2026-02-10 03:48:05+00:00,2,574.0,866.0,14.433333333333334,141
3,99,quarter,2,502c629b-4da7-40fd-92ab-20cb55411c35,38,9:33,Will Richard makes three point jump shot (Draymond Green assists),threepointmade,40,1cfe70b8-4dfc-47dc-acca-b68d4a725972,basketball_play,1770695286,327,True,2026-02-10 03:48:06+00:00,2,573.0,867.0,14.45,142
3,98,quarter,2,1cfe70b8-4dfc-47dc-acca-b68d4a725972,38,9:12,Kentavious Caldwell-Pope misses two point pullup jump shot,twopointmiss,40,,basketball_play,1770695306,326,True,2026-02-10 03:48:26+00:00,2,552.0,888.0,14.8,143
3,97,quarter,2,502c629b-4da7-40fd-92ab-20cb55411c35,38,9:12,Will Richard defensive rebound,rebound,40,502c629b-4da7-40fd-92ab-20cb55411c35,basketball_play,1770695306,325,True,2026-02-10 03:48:26+00:00,2,552.0,888.0,14.8,144
3,96,quarter,2,502c629b-4da7-40fd-92ab-20cb55411c35,38,8:53,Pat Spencer makes two point driving layup,twopointmade,42,1cfe70b8-4dfc-47dc-acca-b68d4a725972,basketball_play,1770695326,324,True,2026-02-10 03:48:46+00:00,2,533.0,907.0,15.116666666666667,145
3,95,quarter,2,1cfe70b8-4dfc-47dc-acca-b68d4a725972,40,8:43,Ty Jerome makes two point driving floating jump shot,twopointmade,42,502c629b-4da7-40fd-92ab-20cb55411c35,basketball_play,1770695337,323,True,2026-02-10 03:48:57+00:00,2,523.0,917.0,15.283333333333333,146
3,94,quarter,2,502c629b-4da7-40fd-92ab-20cb55411c35,40,8:26,Pat Spencer turnover (bad pass) (Javon Small steals),turnover,42,1cfe70b8-4dfc-47dc-acca-b68d4a725972,basketball_play,1770695353,322,True,2026-02-10 03:49:13+00:00,2,506.0,934.0,15.566666666666666,147
3,93,quarter,2,1cfe70b8-4dfc-47dc-acca-b68d4a725972,40,8:14,Taylor Hendricks misses two point driving layup,twopointmiss,42,,basketball_play,1770695365,321,True,2026-02-10 03:49:25+00:00,2,494.0,946.0,15.766666666666667,148
3,92,quarter,2,502c629b-4da7-40fd-92ab-20cb55411c35,40,8:11,De'Anthony Melton defensive rebound,rebound,42,502c629b-4da7-40fd-92ab-20cb55411c35,basketball_play,1770695368,320,True,2026-02-10 03:49:28+00:00,2,491.0,949.0,15.816666666666666,149
3,91,quarter,2,502c629b-4da7-40fd-92ab-20cb55411c35,40,8:03,De'Anthony Melton misses two point pullup jump shot,twopointmiss,42,,basketball_play,1770695376,319,True,2026-02-10 03:49:36+00:00,2,483.0,957.0,15.95,150
3,90,quarter,2,1cfe70b8-4dfc-47dc-acca-b68d4a725972,40,7:59,Ty Jerome defensive rebound,rebound,42,1cfe70b8-4dfc-47dc-acca-b68d4a725972,basketball_play,1770695380,318,True,2026-02-10 03:49:40+00:00,2,479.0,961.0,16.016666666666666,151
3,89,quarter,2,1cfe70b8-4dfc-47dc-acca-b68d4a725972,43,7:53,Ty Jerome makes three point pullup jump shot,threepointmade,42,502c629b-4da7-40fd-92ab-20cb55411c35,basketball_play,1770695386,317,True,2026-02-10 03:49:46+00:00,2,473.0,967.0,16.116666666666667,152
3,88,quarter,2,502c629b-4da7-40fd-92ab-20cb55411c35,43,7:47,Warriors 60 second timeout,teamtimeout,42,,basketball_play,1770695395,316,True,2026-02-10 03:49:55+00:00,2,467.0,973.0,16.216666666666665,153
3,87,quarter,2,1cfe70b8-4dfc-47dc-acca-b68d4a725972,43,7:47,"Grizzlies lineup change (Taylor Hendricks, Ty Jerome, Cam Spencer, Kyle Anderson, Javon Small)",lineupchange,42,,basketball_play,1770695544,315,True,2026-02-10 03:52:24+00:00,2,467.0,973.0,16.216666666666665,154
3,86,quarter,2,502c629b-4da7-40fd-92ab-20cb55411c35,43,7:47,"Warriors lineup change (Brandin Podziemski, Gui Santos, Al Horford, Gary Payton II, De'Anthony Melton)",lineupchange,42,,basketball_play,1770695544,314,True,2026-02-10 03:52:24+00:00,2,467.0,973.0,16.216666666666665,155
3,85,quarter,2,502c629b-4da7-40fd-92ab-20cb55411c35,43,7:40,Brandin Podziemski misses three point jump shot,threepointmiss,42,,basketball_play,1770695589,313,True,2026-02-10 03:53:09+00:00,2,460.0,980.0,16.333333333333332,156
3,84,quarter,2,1cfe70b8-4dfc-47dc-acca-b68d4a725972,43,7:37,Ty Jerome defensive rebound,rebound,42,1cfe70b8-4dfc-47dc-acca-b68d4a725972,basketball_play,1770695592,312,True,2026-02-10 03:53:12+00:00,2,457.0,983.0,16.383333333333333,157
3,83,quarter,2,1cfe70b8-4dfc-47dc-acca-b68d4a725972,45,7:26,Kyle Anderson makes two point layup (Ty Jerome assists),twopointmade,42,502c629b-4da7-40fd-92ab-20cb55411c35,basketball_play,1770695604,311,True,2026-02-10 03:53:24+00:00,2,446.0,994.0,16.566666666666666,158
3,82,quarter,2,,45,7:17,Stoppage (Out of bounds),stoppage,42,,basketball_play,1770695628,310,True,2026-02-10 03:53:48+00:00,2,437.0,1003.0,16.716666666666665,159
3,81,quarter,2,1cfe70b8-4dfc-47dc-acca-b68d4a725972,45,7:17,"Grizzlies lineup change (Taylor Hendricks, Ty Jerome, Jaylen Wells, Cam Spencer, Kyle Anderson)",lineupchange,42,,basketball_play,1770695669,309,True,2026-02-10 03:54:29+00:00,2,437.0,1003.0,16.716666666666665,160
3,80,quarter,2,1cfe70b8-4dfc-47dc-acca-b68d4a725972,45,7:02,Taylor Hendricks shooting foul (De'Anthony Melton draws the foul),shootingfoul,42,502c629b-4da7-40fd-92ab-20cb55411c35,basketball_play,1770695669,308,True,2026-02-10 03:54:29+00:00,2,422.0,1018.0,16.966666666666665,161
3,79,quarter,2,502c629b-4da7-40fd-92ab-20cb55411c35,45,7:02,De'Anthony Melton makes regular free throw 1 of 2,freethrowmade,43,502c629b-4da7-40fd-92ab-20cb55411c35,basketball_play,1770695688,307,True,2026-02-10 03:54:48+00:00,2,422.0,1018.0,16.966666666666665,162
3,78,quarter,2,502c629b-4da7-40fd-92ab-20cb55411c35,45,7:02,De'Anthony Melton makes regular free throw 2 of 2,freethrowmade,44,1cfe70b8-4dfc-47dc-acca-b68d4a725972,basketball_play,1770695708,306,True,2026-02-10 03:55:08+00:00,2,422.0,1018.0,16.966666666666665,163
3,77,quarter,2,1cfe70b8-4dfc-47dc-acca-b68d4a725972,47,6:51,Taylor Hendricks makes two point cutting layup (Ty Jerome assists),twopointmade,44,502c629b-4da7-40fd-92ab-20cb55411c35,basketball_play,1770695725,305,True,2026-02-10 03:55:25+00:00,2,411.0,1029.0,17.15,164
3,76,quarter,2,502c629b-4da7-40fd-92ab-20cb55411c35,47,6:51,Gui Santos shooting foul (Taylor Hendricks draws the foul),shootingfoul,44,1cfe70b8-4dfc-47dc-acca-b68d4a725972,basketball_play,1770695727,304,True,2026-02-10 03:55:27+00:00,2,411.0,1029.0,17.15,165
3,75,quarter,2,1cfe70b8-4dfc-47dc-acca-b68d4a725972,48,6:51,Taylor Hendricks makes regular free throw 1 of 1,freethrowmade,44,,basketball_play,1770695751,303,True,2026-02-10 03:55:51+00:00,2,411.0,1029.0,17.15,166
3,74,quarter,2,502c629b-4da7-40fd-92ab-20cb55411c35,48,6:28,Al Horford makes two point driving layup,twopointmade,46,1cfe70b8-4dfc-47dc-acca-b68d4a725972,basketball_play,1770695774,302,True,2026-02-10 03:56:14+00:00,2,388.0,1052.0,17.533333333333335,167
3,73,quarter,2,1cfe70b8-4dfc-47dc-acca-b68d4a725972,48,6:18,Ty Jerome misses three point pullup jump shot,threepointmiss,46,,basketball_play,1770695784,301,True,2026-02-10 03:56:24+00:00,2,378.0,1062.0,17.7,168
3,72,quarter,2,502c629b-4da7-40fd-92ab-20cb55411c35,48,6:15,Gui Santos defensive rebound,rebound,46,502c629b-4da7-40fd-92ab-20cb55411c35,basketball_play,1770695787,300,True,2026-02-10 03:56:27+00:00,2,375.0,1065.0,17.75,169
3,71,quarter,2,502c629b-4da7-40fd-92ab-20cb55411c35,48,5:59,Gary Payton II turnover (bad pass) (Taylor Hendricks steals),turnover,46,1cfe70b8-4dfc-47dc-acca-b68d4a725972,basketball_play,1770695804,299,True,2026-02-10 03:56:44+00:00,2,359.0,1081.0,18.016666666666666,170
3,70,quarter,2,502c629b-4da7-40fd-92ab-20cb55411c35,48,5:54,Gary Payton II personal foul (Ty Jerome draws the foul),personalfoul,46,1cfe70b8-4dfc-47dc-acca-b68d4a725972,basketball_play,1770695813,298,True,2026-02-10 03:56:53+00:00,2,354.0,1086.0,18.1,171
3,69,quarter,2,502c629b-4da7-40fd-92ab-20cb55411c35,48,5:54,"Warriors lineup change (Pat Spencer, Brandin Podziemski, Gui Santos, Al Horford, Gary Payton II)",lineupchange,46,,basketball_play,1770695857,297,True,2026-02-10 03:57:37+00:00,2,354.0,1086.0,18.1,172
3,68,quarter,2,1cfe70b8-4dfc-47dc-acca-b68d4a725972,50,5:37,Ty Jerome makes two point driving floating jump shot,twopointmade,46,502c629b-4da7-40fd-92ab-20cb55411c35,basketball_play,1770695857,296,True,2026-02-10 03:57:37+00:00,2,337.0,1103.0,18.383333333333333,173
3,67,quarter,2,502c629b-4da7-40fd-92ab-20cb55411c35,50,5:24,Al Horford misses three point jump shot,threepointmiss,46,,basketball_play,1770695870,295,True,2026-02-10 03:57:50+00:00,2,324.0,1116.0,18.6,174
3,66,quarter,2,1cfe70b8-4dfc-47dc-acca-b68d4a725972,50,5:20,Taylor Hendricks defensive rebound,rebound,46,1cfe70b8-4dfc-47dc-acca-b68d4a725972,basketball_play,1770695874,294,True,2026-02-10 03:57:54+00:00,2,320.0,1120.0,18.666666666666668,175
3,65,quarter,2,1cfe70b8-4dfc-47dc-acca-b68d4a725972,52,5:05,Kyle Anderson makes two point turnaround fadeaway jump shot,twopointmade,46,502c629b-4da7-40fd-92ab-20cb55411c35,basketball_play,1770695888,293,True,2026-02-10 03:58:08+00:00,2,305.0,1135.0,18.916666666666668,176
3,64,quarter,2,502c629b-4da7-40fd-92ab-20cb55411c35,52,4:48,Gary Payton II makes three point pullup jump shot (Al Horford assists),threepointmade,49,1cfe70b8-4dfc-47dc-acca-b68d4a725972,basketball_play,1770695905,292,True,2026-02-10 03:58:25+00:00,2,288.0,1152.0,19.2,177
3,63,quarter,2,1cfe70b8-4dfc-47dc-acca-b68d4a725972,52,4:41,Kyle Anderson turnover (out of bounds bad pass),turnover,49,502c629b-4da7-40fd-92ab-20cb55411c35,basketball_play,1770695917,291,True,2026-02-10 03:58:37+00:00,2,281.0,1159.0,19.316666666666666,178
3,62,quarter,2,1cfe70b8-4dfc-47dc-acca-b68d4a725972,52,4:41,"Grizzlies lineup change (Scotty Pippen Jr., Taylor Hendricks, Jaylen Wells, Cam Spencer, Kyle Anderson)",lineupchange,49,,basketball_play,1770695956,290,True,2026-02-10 03:59:16+00:00,2,281.0,1159.0,19.316666666666666,179
3,61,quarter,2,502c629b-4da7-40fd-92ab-20cb55411c35,52,4:27,Gui Santos makes two point dunk (Pat Spencer assists),twopointmade,51,1cfe70b8-4dfc-47dc-acca-b68d4a725972,basketball_play,1770695956,289,True,2026-02-10 03:59:16+00:00,2,267.0,1173.0,19.55,180
3,60,quarter,2,1cfe70b8-4dfc-47dc-acca-b68d4a725972,52,4:16,Cam Spencer misses two point driving layup,twopointmiss,51,,basketball_play,1770695968,288,True,2026-02-10 03:59:28+00:00,2,256.0,1184.0,19.733333333333334,181
3,59,quarter,2,502c629b-4da7-40fd-92ab-20cb55411c35,52,4:13,Al Horford defensive rebound,rebound,51,502c629b-4da7-40fd-92ab-20cb55411c35,basketball_play,1770695971,287,True,2026-02-10 03:59:31+00:00,2,253.0,1187.0,19.783333333333335,182
3,58,quarter,2,502c629b-4da7-40fd-92ab-20cb55411c35,52,4:08,Al Horford misses three point jump shot,threepointmiss,51,,basketball_play,1770695976,286,True,2026-02-10 03:59:36+00:00,2,248.0,1192.0,19.866666666666667,183
3,57,quarter,2,502c629b-4da7-40fd-92ab-20cb55411c35,52,4:04,Gary Payton II offensive rebound,rebound,51,502c629b-4da7-40fd-92ab-20cb55411c35,basketball_play,1770695979,285,True,2026-02-10 03:59:39+00:00,2,244.0,1196.0,19.933333333333334,184
3,56,quarter,2,502c629b-4da7-40fd-92ab-20cb55411c35,52,3:53,Gui Santos misses two point driving layup,twopointmiss,51,,basketball_play,1770695990,284,True,2026-02-10 03:59:50+00:00,2,233.0,1207.0,20.116666666666667,185
3,55,quarter,2,1cfe70b8-4dfc-47dc-acca-b68d4a725972,52,3:51,Cam Spencer defensive rebound,rebound,51,1cfe70b8-4dfc-47dc-acca-b68d4a725972,basketball_play,1770695992,283,True,2026-02-10 03:59:52+00:00,2,231.0,1209.0,20.15,186
3,54,quarter,2,1cfe70b8-4dfc-47dc-acca-b68d4a725972,52,3:46,Jaylen Wells misses three point jump shot,threepointmiss,51,,basketball_play,1770695997,282,True,2026-02-10 03:59:57+00:00,2,226.0,1214.0,20.233333333333334,187
3,53,quarter,2,502c629b-4da7-40fd-92ab-20cb55411c35,52,3:46,Gary Payton II defensive rebound,rebound,51,502c629b-4da7-40fd-92ab-20cb55411c35,basketball_play,1770695997,281,True,2026-02-10 03:59:57+00:00,2,226.0,1214.0,20.233333333333334,188
3,52,quarter,2,502c629b-4da7-40fd-92ab-20cb55411c35,52,3:31,Pat Spencer misses three point jump shot,threepointmiss,51,,basketball_play,1770696014,280,True,2026-02-10 04:00:14+00:00,2,211.0,1229.0,20.483333333333334,189
3,51,quarter,2,502c629b-4da7-40fd-92ab-20cb55411c35,52,3:30,Gary Payton II offensive rebound,rebound,51,502c629b-4da7-40fd-92ab-20cb55411c35,basketball_play,1770696015,279,True,2026-02-10 04:00:15+00:00,2,210.0,1230.0,20.5,190
3,50,quarter,2,502c629b-4da7-40fd-92ab-20cb55411c35,52,3:29,Gary Payton II misses two point tip layup,twopointmiss,51,,basketball_play,1770696016,278,True,2026-02-10 04:00:16+00:00,2,209.0,1231.0,20.516666666666666,191
3,49,quarter,2,502c629b-4da7-40fd-92ab-20cb55411c35,52,3:28,Gary Payton II offensive rebound,rebound,51,502c629b-4da7-40fd-92ab-20cb55411c35,basketball_play,1770696017,277,True,2026-02-10 04:00:17+00:00,2,208.0,1232.0,20.533333333333335,192
3,48,quarter,2,502c629b-4da7-40fd-92ab-20cb55411c35,52,3:27,Gary Payton II misses two point putback layup,twopointmiss,51,,basketball_play,1770696018,276,True,2026-02-10 04:00:18+00:00,2,207.0,1233.0,20.55,193
3,47,quarter,2,1cfe70b8-4dfc-47dc-acca-b68d4a725972,52,3:26,Taylor Hendricks defensive rebound,rebound,51,1cfe70b8-4dfc-47dc-acca-b68d4a725972,basketball_play,1770696019,275,True,2026-02-10 04:00:19+00:00,2,206.0,1234.0,20.566666666666666,194
3,46,quarter,2,1cfe70b8-4dfc-47dc-acca-b68d4a725972,52,3:20,Jaylen Wells misses two point running reverse layup,twopointmiss,51,,basketball_play,1770696023,274,True,2026-02-10 04:00:23+00:00,2,200.0,1240.0,20.666666666666668,195
3,45,quarter,2,1cfe70b8-4dfc-47dc-acca-b68d4a725972,52,3:18,Jaylen Wells offensive rebound,rebound,51,1cfe70b8-4dfc-47dc-acca-b68d4a725972,basketball_play,1770696026,273,True,2026-02-10 04:00:26+00:00,2,198.0,1242.0,20.7,196
3,44,quarter,2,1cfe70b8-4dfc-47dc-acca-b68d4a725972,54,3:18,Jaylen Wells makes two point putback layup,twopointmade,51,502c629b-4da7-40fd-92ab-20cb55411c35,basketball_play,1770696026,272,True,2026-02-10 04:00:26+00:00,2,198.0,1242.0,20.7,197
3,43,quarter,2,502c629b-4da7-40fd-92ab-20cb55411c35,54,2:58,Pat Spencer makes two point cutting layup (Al Horford assists),twopointmade,53,1cfe70b8-4dfc-47dc-acca-b68d4a725972,basketball_play,1770696046,271,True,2026-02-10 04:00:46+00:00,2,178.0,1262.0,21.033333333333335,198
3,42,quarter,2,1cfe70b8-4dfc-47dc-acca-b68d4a725972,54,2:58,Cam Spencer shooting foul (Pat Spencer draws the foul),shootingfoul,53,502c629b-4da7-40fd-92ab-20cb55411c35,basketball_play,1770696048,270,True,2026-02-10 04:00:48+00:00,2,178.0,1262.0,21.033333333333335,199
3,41,quarter,2,1cfe70b8-4dfc-47dc-acca-b68d4a725972,54,2:58,Grizzlies 60 second timeout,teamtimeout,53,,basketball_play,1770696063,269,True,2026-02-10 04:01:03+00:00,2,178.0,1262.0,21.033333333333335,200
3,40,quarter,2,1cfe70b8-4dfc-47dc-acca-b68d4a725972,54,2:58,"Grizzlies lineup change (Scotty Pippen Jr., GG Jackson, Jaylen Wells, Jahmai Mashack, Cedric Coward)",lineupchange,53,,basketball_play,1770696207,268,True,2026-02-10 04:03:27+00:00,2,178.0,1262.0,21.033333333333335,201
3,39,quarter,2,502c629b-4da7-40fd-92ab-20cb55411c35,54,2:58,"Warriors lineup change (Pat Spencer, Draymond Green, Brandin Podziemski, Moses Moody, Gary Payton II)",lineupchange,53,,basketball_play,1770696207,267,True,2026-02-10 04:03:27+00:00,2,178.0,1262.0,21.033333333333335,202
3,38,quarter,2,502c629b-4da7-40fd-92ab-20cb55411c35,54,2:58,Pat Spencer misses regular free throw 1 of 1,freethrowmiss,53,,basketball_play,1770696242,266,True,2026-02-10 04:04:02+00:00,2,178.0,1262.0,21.033333333333335,203
3,37,quarter,2,1cfe70b8-4dfc-47dc-acca-b68d4a725972,54,2:56,Cedric Coward defensive rebound,rebound,53,1cfe70b8-4dfc-47dc-acca-b68d4a725972,basketball_play,1770696244,265,True,2026-02-10 04:04:04+00:00,2,176.0,1264.0,21.066666666666666,204
3,36,quarter,2,1cfe70b8-4dfc-47dc-acca-b68d4a725972,54,2:36,Cedric Coward misses three point jump shot,threepointmiss,53,,basketball_play,1770696263,264,True,2026-02-10 04:04:23+00:00,2,156.0,1284.0,21.4,205
3,35,quarter,2,502c629b-4da7-40fd-92ab-20cb55411c35,54,2:33,Pat Spencer defensive rebound,rebound,53,502c629b-4da7-40fd-92ab-20cb55411c35,basketball_play,1770696266,263,True,2026-02-10 04:04:26+00:00,2,153.0,1287.0,21.45,206
3,34,quarter,2,502c629b-4da7-40fd-92ab-20cb55411c35,54,2:18,Pat Spencer misses two point driving floating jump shot,twopointmiss,53,,basketball_play,1770696284,262,True,2026-02-10 04:04:44+00:00,2,138.0,1302.0,21.7,207
3,33,quarter,2,502c629b-4da7-40fd-92ab-20cb55411c35,54,2:17,Pat Spencer offensive rebound,rebound,53,502c629b-4da7-40fd-92ab-20cb55411c35,basketball_play,1770696285,261,True,2026-02-10 04:04:45+00:00,2,137.0,1303.0,21.716666666666665,208
3,32,quarter,2,502c629b-4da7-40fd-92ab-20cb55411c35,54,2:15,Pat Spencer makes two point tip layup,twopointmade,55,1cfe70b8-4dfc-47dc-acca-b68d4a725972,basketball_play,1770696287,260,True,2026-02-10 04:04:47+00:00,2,135.0,1305.0,21.75,209
3,31,quarter,2,1cfe70b8-4dfc-47dc-acca-b68d4a725972,57,2:01,Scotty Pippen Jr. makes three point pullup jump shot,threepointmade,55,502c629b-4da7-40fd-92ab-20cb55411c35,basketball_play,1770696298,259,True,2026-02-10 04:04:58+00:00,2,121.0,1319.0,21.983333333333334,210
