period_index,event_index,period_type,period_number,attribution,away_points,clock,description,event_type,home_points,possession,type,wall_clock,pbp_source_row,has_wall_clock,event_ts_utc,period_sequence,game_clock_seconds_remaining,game_elapsed_seconds,game_elapsed_minutes,pbp_chronological_index
2,48,quarter,3,1cfe70b8-4dfc-47dc-acca-b68d4a725972,84,4:36,Kentavious Caldwell-Pope misses regular free throw 2 of 3,freethrowmiss,72,1cfe70b8-4dfc-47dc-acca-b68d4a725972,basketball_play,1770698762,154,True,2026-02-10 04:46:02+00:00,3,276.0,1884.0,31.4,315
2,47,quarter,3,1cfe70b8-4dfc-47dc-acca-b68d4a725972,84,4:36,Grizzlies offensive rebound,rebound,72,1cfe70b8-4dfc-47dc-acca-b68d4a725972,basketball_play,1770698762,153,True,2026-02-10 04:46:02+00:00,3,276.0,1884.0,31.4,316
2,46,quarter,3,502c629b-4da7-40fd-92ab-20cb55411c35,84,4:36,"Warriors lineup change (Brandin Podziemski, Al Horford, Gary Payton II, Will Richard, De'Anthony Melton)",lineupchange,72,,basketball_play,1770698777,152,True,2026-02-10 04:46:17+00:00,3,276.0,1884.0,31.4,317
2,45,quarter,3,1cfe70b8-4dfc-47dc-acca-b68d4a725972,85,4:36,Kentavious Caldwell-Pope makes regular free throw 3 of 3,freethrowmade,72,502c629b-4da7-40fd-92ab-20cb55411c35,basketball_play,1770698777,151,True,2026-02-10 04:46:17+00:00,3,276.0,1884.0,31.4,318
2,44,quarter,3,502c629b-4da7-40fd-92ab-20cb55411c35,85,4:23,Will Richard turnover (lost ball) (Kentavious Caldwell-Pope steals),turnover,72,1cfe70b8-4dfc-47dc-acca-b68d4a725972,basketball_play,1770698792,150,True,2026-02-10 04:46:32+00:00,3,263.0,1897.0,31.616666666666667,319
2,43,quarter,3,1cfe70b8-4dfc-47dc-acca-b68d4a725972,85,4:19,Kentavious Caldwell-Pope turnover (lost ball) (Gary Payton II steals),turnover,72,502c629b-4da7-40fd-92ab-20cb55411c35,basketball_play,1770698795,149,True,2026-02-10 04:46:35+00:00,3,259.0,1901.0,31.683333333333334,320
2,42,quarter,3,502c629b-4da7-40fd-92ab-20cb55411c35,85,4:13,Will Richard turnover (bad pass) (Jahmai Mashack steals),turnover,72,1cfe70b8-4dfc-47dc-acca-b68d4a725972,basketball_play,1770698804,148,True,2026-02-10 04:46:44+00:00,3,253.0,1907.0,31.783333333333335,321
2,41,quarter,3,1cfe70b8-4dfc-47dc-acca-b68d4a725972,85,4:11,Jahmai Mashack turnover (out of bounds lost ball),turnover,72,502c629b-4da7-40fd-92ab-20cb55411c35,basketball_play,1770698807,147,True,2026-02-10 04:46:47+00:00,3,251.0,1909.0,31.816666666666666,322
2,40,quarter,3,,85,3:58,Stoppage (Out of bounds),stoppage,72,,basketball_play,1770698836,146,True,2026-02-10 04:47:16+00:00,3,238.0,1922.0,32.03333333333333,323
2,39,quarter,3,502c629b-4da7-40fd-92ab-20cb55411c35,85,3:51,Brandin Podziemski misses two point driving floating bank jump shot,twopointmiss,72,,basketball_play,1770698856,145,True,2026-02-10 04:47:36+00:00,3,231.0,1929.0,32.15,324
2,38,quarter,3,1cfe70b8-4dfc-47dc-acca-b68d4a725972,85,3:47,Taylor Hendricks defensive rebound,rebound,72,1cfe70b8-4dfc-47dc-acca-b68d4a725972,basketball_play,1770698860,144,True,2026-02-10 04:47:40+00:00,3,227.0,1933.0,32.21666666666667,325
2,37,quarter,3,1cfe70b8-4dfc-47dc-acca-b68d4a725972,87,3:42,Jahmai Mashack makes two point driving layup (Cam Spencer assists),twopointmade,72,502c629b-4da7-40fd-92ab-20cb55411c35,basketball_play,1770698865,143,True,2026-02-10 04:47:45+00:00,3,222.0,1938.0,32.3,326
2,36,quarter,3,502c629b-4da7-40fd-92ab-20cb55411c35,87,3:28,Brandin Podziemski makes two point driving layup,twopointmade,74,1cfe70b8-4dfc-47dc-acca-b68d4a725972,basketball_play,1770698878,142,True,2026-02-10 04:47:58+00:00,3,208.0,1952.0,32.53333333333333,327
2,35,quarter,3,1cfe70b8-4dfc-47dc-acca-b68d4a725972,87,3:09,Kentavious Caldwell-Pope misses two point driving finger roll layup,twopointmiss,74,,basketball_play,1770698898,141,True,2026-02-10 04:48:18+00:00,3,189.0,1971.0,32.85,328
2,34,quarter,3,502c629b-4da7-40fd-92ab-20cb55411c35,87,3:06,Will Richard defensive rebound,rebound,74,502c629b-4da7-40fd-92ab-20cb55411c35,basketball_play,1770698901,140,True,2026-02-10 04:48:21+00:00,3,186.0,1974.0,32.9,329
2,33,quarter,3,502c629b-4da7-40fd-92ab-20cb55411c35,87,2:51,De'Anthony Melton misses two point cutting layup,twopointmiss,74,,basketball_play,1770698916,139,True,2026-02-10 04:48:36+00:00,3,171.0,1989.0,33.15,330
2,32,quarter,3,1cfe70b8-4dfc-47dc-acca-b68d4a725972,87,2:47,Taylor Hendricks defensive rebound,rebound,74,1cfe70b8-4dfc-47dc-acca-b68d4a725972,basketball_play,1770698920,138,True,2026-02-10 04:48:40+00:00,3,167.0,1993.0,33.21666666666667,331
2,31,quarter,3,1cfe70b8-4dfc-47dc-acca-b68d4a725972,87,2:47,Javon Small misses two point running layup,twopointmiss,74,,basketball_play,1770698922,137,True,2026-02-10 04:48:42+00:00,3,167.0,1993.0,33.21666666666667,332
2,30,quarter,3,1cfe70b8-4dfc-47dc-acca-b68d4a725972,87,2:46,Javon Small offensive rebound,rebound,74,1cfe70b8-4dfc-47dc-acca-b68d4a725972,basketball_play,1770698923,136,True,2026-02-10 04:48:43+00:00,3,166.0,1994.0,33.233333333333334,333
2,29,quarter,3,1cfe70b8-4dfc-47dc-acca-b68d4a725972,87,2:45,Javon Small misses two point tip layup,twopointmiss,74,,basketball_play,1770698923,135,True,2026-02-10 04:48:43+00:00,3,165.0,1995.0,33.25,334
2,28,quarter,3,1cfe70b8-4dfc-47dc-acca-b68d4a725972,87,2:45,Javon Small offensive rebound,rebound,74,1cfe70b8-4dfc-47dc-acca-b68d4a725972,basketball_play,1770698923,134,True,2026-02-10 04:48:43+00:00,3,165.0,1995.0,33.25,335
2,27,quarter,3,1cfe70b8-4dfc-47dc-acca-b68d4a725972,87,2:43,Gary Payton II blocks Javon Small's two point tip layup,twopointmiss,74,,basketball_play,1770698925,133,True,2026-02-10 04:48:45+00:00,3,163.0,1997.0,33.28333333333333,336
2,26,quarter,3,502c629b-4da7-40fd-92ab-20cb55411c35,87,2:42,Al Horford defensive rebound,rebound,74,502c629b-4da7-40fd-92ab-20cb55411c35,basketball_play,1770698926,132,True,2026-02-10 04:48:46+00:00,3,162.0,1998.0,33.3,337
2,25,quarter,3,502c629b-4da7-40fd-92ab-20cb55411c35,87,2:36,Brandin Podziemski misses two point running layup,twopointmiss,74,,basketball_play,1770698930,131,True,2026-02-10 04:48:50+00:00,3,156.0,2004.0,33.4,338
2,24,quarter,3,1cfe70b8-4dfc-47dc-acca-b68d4a725972,87,2:33,Taylor Hendricks defensive rebound,rebound,74,1cfe70b8-4dfc-47dc-acca-b68d4a725972,basketball_play,1770698933,130,True,2026-02-10 04:48:53+00:00,3,153.0,2007.0,33.45,339
2,23,quarter,3,1cfe70b8-4dfc-47dc-acca-b68d4a725972,90,2:17,Jahmai Mashack makes three point jump shot (Cam Spencer assists),threepointmade,74,502c629b-4da7-40fd-92ab-20cb55411c35,basketball_play,1770698949,129,True,2026-02-10 04:49:09+00:00,3,137.0,2023.0,33.71666666666667,340
2,22,quarter,3,502c629b-4da7-40fd-92ab-20cb55411c35,90,1:53,Brandin Podziemski makes two point driving layup,twopointmade,76,1cfe70b8-4dfc-47dc-acca-b68d4a725972,basketball_play,1770698974,128,True,2026-02-10 04:49:34+00:00,3,113.0,2047.0,34.11666666666667,341
2,21,quarter,3,1cfe70b8-4dfc-47dc-acca-b68d4a725972,93,1:33,Javon Small makes three point stepback jump shot,threepointmade,76,502c629b-4da7-40fd-92ab-20cb55411c35,basketball_play,1770698994,127,True,2026-02-10 04:49:54+00:00,3,93.0,2067.0,34.45,342
2,20,quarter,3,502c629b-4da7-40fd-92ab-20cb55411c35,93,1:10,Al Horford makes two point turnaround bank hook shot (De'Anthony Melton assists),twopointmade,78,1cfe70b8-4dfc-47dc-acca-b68d4a725972,basketball_play,1770699017,126,True,2026-02-10 04:50:17+00:00,3,70.0,2090.0,34.833333333333336,343
2,19,quarter,3,1cfe70b8-4dfc-47dc-acca-b68d4a725972,93,00:50.40,Cam Spencer turnover (lost ball) (Gary Payton II steals),turnover,78,502c629b-4da7-40fd-92ab-20cb55411c35,basketball_play,1770699037,125,True,2026-02-10 04:50:37+00:00,3,50.4,2109.6,35.16,344
2,18,quarter,3,502c629b-4da7-40fd-92ab-20cb55411c35,93,00:47.90,De'Anthony Melton makes two point running dunk (Gary Payton II assists),twopointmade,80,1cfe70b8-4dfc-47dc-acca-b68d4a725972,basketball_play,1770699040,124,True,2026-02-10 04:50:40+00:00,3,47.9,2112.1,35.20166666666667,345
2,17,quarter,3,1cfe70b8-4dfc-47dc-acca-b68d4a725972,93,00:42.60,Kentavious Caldwell-Pope misses two point driving floating jump shot,twopointmiss,80,,basketball_play,1770699054,123,True,2026-02-10 04:50:54+00:00,3,42.6,2117.4,35.29,346
2,16,quarter,3,1cfe70b8-4dfc-47dc-acca-b68d4a725972,93,00:41.60,Taylor Hendricks offensive rebound,rebound,80,1cfe70b8-4dfc-47dc-acca-b68d4a725972,basketball_play,1770699055,122,True,2026-02-10 04:50:55+00:00,3,41.6,2118.4,35.306666666666665,347
2,15,quarter,3,1cfe70b8-4dfc-47dc-acca-b68d4a725972,95,00:38.50,Cam Spencer makes two point jump shot (Taylor Hendricks assists),twopointmade,80,502c629b-4da7-40fd-92ab-20cb55411c35,basketball_play,1770699057,121,True,2026-02-10 04:50:57+00:00,3,38.5,2121.5,35.358333333333334,348
2,14,quarter,3,1cfe70b8-4dfc-47dc-acca-b68d4a725972,95,00:29.60,Jahmai Mashack personal foul (Brandin Podziemski draws the foul),personalfoul,80,502c629b-4da7-40fd-92ab-20cb55411c35,basketball_play,1770699071,120,True,2026-02-10 04:51:11+00:00,3,29.6,2130.4,35.50666666666667,349
2,13,quarter,3,1cfe70b8-4dfc-47dc-acca-b68d4a725972,95,00:29.60,Grizzlies 60 second timeout,teamtimeout,80,,basketball_play,1770699086,119,True,2026-02-10 04:51:26+00:00,3,29.6,2130.4,35.50666666666667,350
2,12,quarter,3,1cfe70b8-4dfc-47dc-acca-b68d4a725972,95,00:29,"Grizzlies lineup change (GG Jackson, Kentavious Caldwell-Pope, Cam Spencer, Javon Small, Jahmai Mashack)",lineupchange,80,,basketball_play,1770699228,118,True,2026-02-10 04:53:48+00:00,3,29.0,2131.0,35.516666666666666,351
2,11,quarter,3,502c629b-4da7-40fd-92ab-20cb55411c35,95,00:29,"Warriors lineup change (Brandin Podziemski, Gui Santos, Al Horford, Moses Moody, De'Anthony Melton)",lineupchange,80,,basketball_play,1770699228,117,True,2026-02-10 04:53:48+00:00,3,29.0,2131.0,35.516666666666666,352
2,10,quarter,3,1cfe70b8-4dfc-47dc-acca-b68d4a725972,95,00:28.30,GG Jackson shooting foul (Moses Moody draws the foul),shootingfoul,80,502c629b-4da7-40fd-92ab-20cb55411c35,basketball_play,1770699275,116,True,2026-02-10 04:54:35+00:00,3,28.3,2131.7,35.52833333333333,353
2,9,quarter,3,502c629b-4da7-40fd-92ab-20cb55411c35,95,00:28.30,Moses Moody makes regular free throw 1 of 3,freethrowmade,81,502c629b-4da7-40fd-92ab-20cb55411c35,basketball_play,1770699304,115,True,2026-02-10 04:55:04+00:00,3,28.3,2131.7,35.52833333333333,354
2,8,quarter,3,502c629b-4da7-40fd-92ab-20cb55411c35,95,00:28.30,Moses Moody makes regular free throw 2 of 3,freethrowmade,82,502c629b-4da7-40fd-92ab-20cb55411c35,basketball_play,1770699317,114,True,2026-02-10 04:55:17+00:00,3,28.3,2131.7,35.52833333333333,355
2,6,quarter,3,502c629b-4da7-40fd-92ab-20cb55411c35,95,00:28.30,Moses Moody makes regular free throw 3 of 3,freethrowmade,83,1cfe70b8-4dfc-47dc-acca-b68d4a725972,basketball_play,1770699331,112,True,2026-02-10 04:55:31+00:00,3,28.3,2131.7,35.52833333333333,356
2,7,quarter,3,502c629b-4da7-40fd-92ab-20cb55411c35,95,00:28,"Warriors lineup change (Brandin Podziemski, Gui Santos, Al Horford, Moses Moody, Gary Payton II)",lineupchange,82,,basketball_play,1770699331,113,True,2026-02-10 04:55:31+00:00,3,28.0,2132.0,35.53333333333333,357
2,5,quarter,3,1cfe70b8-4dfc-47dc-acca-b68d4a725972,98,00:09.30,GG Jackson makes three point jump shot (Javon Small assists),threepointmade,83,502c629b-4da7-40fd-92ab-20cb55411c35,basketball_play,1770699351,111,True,2026-02-10 04:55:51+00:00,3,9.3,2150.7,35.845,358
2,4,quarter,3,502c629b-4da7-40fd-92ab-20cb55411c35,98,00:02.20,Gui Santos makes two point driving finger roll layup (Brandin Podziemski assists),twopointmade,85,1cfe70b8-4dfc-47dc-acca-b68d4a725972,basketball_play,1770699363,110,True,2026-02-10 04:56:03+00:00,3,2.2,2157.8,35.96333333333334,359
2,3,quarter,3,1cfe70b8-4dfc-47dc-acca-b68d4a725972,98,00:00.70,Grizzlies misses heave shot,heave,85,,basketball_play,1770699368,109,True,2026-02-10 04:56:08+00:00,3,0.7,2159.3,35.98833333333334,360
2,2,quarter,3,1cfe70b8-4dfc-47dc-acca-b68d4a725972,98,00:00.10,Grizzlies offensive rebound,rebound,85,1cfe70b8-4dfc-47dc-acca-b68d4a725972,basketball_play,1770699368,108,True,2026-02-10 04:56:08+00:00,3,0.1,2159.9,35.998333333333335,361
2,1,quarter,3,,98,00:00,End of 3rd Quarter.,endperiod,85,,basketball_play,1770699374,107,True,2026-02-10 04:56:14+00:00,3,0.0,2160.0,36.0,362
1,107,quarter,4,1cfe70b8-4dfc-47dc-acca-b68d4a725972,98,12:00,"Grizzlies lineup change (Scotty Pippen Jr., GG Jackson, Ty Jerome, Kentavious Caldwell-Pope, Jahmai Mashack)",lineupchange,85,,basketball_play,1770699511,106,True,2026-02-10 04:58:31+00:00,4,720.0,2160.0,36.0,363
1,106,quarter,4,502c629b-4da7-40fd-92ab-20cb55411c35,98,12:00,"Warriors lineup change (Pat Spencer, Quinten Post, Draymond Green, Brandin Podziemski, Moses Moody)",lineupchange,85,,basketball_play,1770699511,105,True,2026-02-10 04:58:31+00:00,4,720.0,2160.0,36.0,364
1,105,quarter,4,,98,12:00,Start of 4th Quarter,startperiod,85,,basketball_play,1770699525,104,True,2026-02-10 04:58:45+00:00,4,720.0,2160.0,36.0,365
1,104,quarter,4,502c629b-4da7-40fd-92ab-20cb55411c35,98,11:39,Brandin Podziemski makes two point cutting layup (Quinten Post assists),twopointmade,87,1cfe70b8-4dfc-47dc-acca-b68d4a725972,basketball_play,1770699545,103,True,2026-02-10 04:59:05+00:00,4,699.0,2181.0,36.35,366
1,103,quarter,4,1cfe70b8-4dfc-47dc-acca-b68d4a725972,100,11:24,Jahmai Mashack makes two point cutting layup (Scotty Pippen Jr. assists),twopointmade,87,502c629b-4da7-40fd-92ab-20cb55411c35,basketball_play,1770699560,102,True,2026-02-10 04:59:20+00:00,4,684.0,2196.0,36.6,367
1,102,quarter,4,1cfe70b8-4dfc-47dc-acca-b68d4a725972,100,11:10,Scotty Pippen Jr. personal foul (Brandin Podziemski draws the foul),personalfoul,87,502c629b-4da7-40fd-92ab-20cb55411c35,basketball_play,1770699579,101,True,2026-02-10 04:59:39+00:00,4,670.0,2210.0,36.833333333333336,368
1,101,quarter,4,502c629b-4da7-40fd-92ab-20cb55411c35,100,11:03,Brandin Podziemski misses three point stepback jump shot,threepointmiss,87,,basketball_play,1770699607,100,True,2026-02-10 05:00:07+00:00,4,663.0,2217.0,36.95,369
1,100,quarter,4,1cfe70b8-4dfc-47dc-acca-b68d4a725972,100,10:59,GG Jackson defensive rebound,rebound,87,1cfe70b8-4dfc-47dc-acca-b68d4a725972,basketball_play,1770699611,99,True,2026-02-10 05:00:11+00:00,4,659.0,2221.0,37.016666666666666,370
1,99,quarter,4,1cfe70b8-4dfc-47dc-acca-b68d4a725972,102,10:53,GG Jackson makes two point running layup,twopointmade,87,502c629b-4da7-40fd-92ab-20cb55411c35,basketball_play,1770699617,98,True,2026-02-10 05:00:17+00:00,4,653.0,2227.0,37.11666666666667,371
1,98,quarter,4,502c629b-4da7-40fd-92ab-20cb55411c35,102,10:33,Draymond Green makes three point jump shot (Brandin Podziemski assists),threepointmade,90,1cfe70b8-4dfc-47dc-acca-b68d4a725972,basketball_play,1770699636,97,True,2026-02-10 05:00:36+00:00,4,633.0,2247.0,37.45,372
1,97,quarter,4,,102,10:16,Stoppage (Out of bounds),stoppage,90,,basketball_play,1770699655,96,True,2026-02-10 05:00:55+00:00,4,616.0,2264.0,37.733333333333334,373
1,96,quarter,4,1cfe70b8-4dfc-47dc-acca-b68d4a725972,102,10:16,"Grizzlies lineup change (Scotty Pippen Jr., GG Jackson, Ty Jerome, Kentavious Caldwell-Pope, Kyle Anderson)",lineupchange,90,,basketball_play,1770699683,95,True,2026-02-10 05:01:23+00:00,4,616.0,2264.0,37.733333333333334,374
1,95,quarter,4,1cfe70b8-4dfc-47dc-acca-b68d4a725972,102,10:08,Ty Jerome misses two point driving layup,twopointmiss,90,,basketball_play,1770699683,94,True,2026-02-10 05:01:23+00:00,4,608.0,2272.0,37.86666666666667,375
1,94,quarter,4,502c629b-4da7-40fd-92ab-20cb55411c35,102,10:06,Brandin Podziemski defensive rebound,rebound,90,502c629b-4da7-40fd-92ab-20cb55411c35,basketball_play,1770699685,93,True,2026-02-10 05:01:25+00:00,4,606.0,2274.0,37.9,376
1,93,quarter,4,502c629b-4da7-40fd-92ab-20cb55411c35,102,9:56,Draymond Green turnover (bad pass) (Scotty Pippen Jr. steals),turnover,90,1cfe70b8-4dfc-47dc-acca-b68d4a725972,basketball_play,1770699695,92,True,2026-02-10 05:01:35+00:00,4,596.0,2284.0,38.06666666666667,377
1,92,quarter,4,1cfe70b8-4dfc-47dc-acca-b68d4a725972,104,9:51,Ty Jerome makes two point running layup (Scotty Pippen Jr. assists),twopointmade,90,502c629b-4da7-40fd-92ab-20cb55411c35,basketball_play,1770699700,91,True,2026-02-10 05:01:40+00:00,4,591.0,2289.0,38.15,378
1,91,quarter,4,502c629b-4da7-40fd-92ab-20cb55411c35,104,9:30,Moses Moody makes three point jump shot (Pat Spencer assists),threepointmade,93,1cfe70b8-4dfc-47dc-acca-b68d4a725972,basketball_play,1770699720,90,True,2026-02-10 05:02:00+00:00,4,570.0,2310.0,38.5,379
1,90,quarter,4,1cfe70b8-4dfc-47dc-acca-b68d4a725972,106,9:16,Scotty Pippen Jr. makes two point turnaround fadeaway jump shot,twopointmade,93,502c629b-4da7-40fd-92ab-20cb55411c35,basketball_play,1770699734,89,True,2026-02-10 05:02:14+00:00,4,556.0,2324.0,38.733333333333334,380
1,89,quarter,4,1cfe70b8-4dfc-47dc-acca-b68d4a725972,106,9:06,Scotty Pippen Jr. personal foul (Pat Spencer draws the foul),personalfoul,93,502c629b-4da7-40fd-92ab-20cb55411c35,basketball_play,1770699747,88,True,2026-02-10 05:02:27+00:00,4,546.0,2334.0,38.9,381
1,88,quarter,4,502c629b-4da7-40fd-92ab-20cb55411c35,106,9:01,Brandin Podziemski makes two point cutting layup (Pat Spencer assists),twopointmade,95,1cfe70b8-4dfc-47dc-acca-b68d4a725972,basketball_play,1770699770,87,True,2026-02-10 05:02:50+00:00,4,541.0,2339.0,38.983333333333334,382
1,87,quarter,4,1cfe70b8-4dfc-47dc-acca-b68d4a725972,106,8:42,Kyle Anderson turnover (traveling),turnover,95,502c629b-4da7-40fd-92ab-20cb55411c35,basketball_play,1770699791,86,True,2026-02-10 05:03:11+00:00,4,522.0,2358.0,39.3,383
1,86,quarter,4,502c629b-4da7-40fd-92ab-20cb55411c35,106,8:42,"Warriors lineup change (Pat Spencer, Quinten Post, Draymond Green, Brandin Podziemski, Gui Santos)",lineupchange,95,,basketball_play,1770699818,85,True,2026-02-10 05:03:38+00:00,4,522.0,2358.0,39.3,384
1,85,quarter,4,502c629b-4da7-40fd-92ab-20cb55411c35,106,8:27,Draymond Green turnover (bad pass) (Ty Jerome steals),turnover,95,1cfe70b8-4dfc-47dc-acca-b68d4a725972,basketball_play,1770699818,84,True,2026-02-10 05:03:38+00:00,4,507.0,2373.0,39.55,385
1,84,quarter,4,1cfe70b8-4dfc-47dc-acca-b68d4a725972,108,8:23,Kentavious Caldwell-Pope makes two point running alley-oop layup (Ty Jerome assists),twopointmade,95,502c629b-4da7-40fd-92ab-20cb55411c35,basketball_play,1770699823,83,True,2026-02-10 05:03:43+00:00,4,503.0,2377.0,39.61666666666667,386
1,83,quarter,4,502c629b-4da7-40fd-92ab-20cb55411c35,108,8:23,Warriors 60 second timeout,teamtimeout,95,,basketball_play,1770699827,82,True,2026-02-10 05:03:47+00:00,4,503.0,2377.0,39.61666666666667,387
1,82,quarter,4,502c629b-4da7-40fd-92ab-20cb55411c35,108,8:23,"Warriors lineup change (Pat Spencer, Quinten Post, Brandin Podziemski, Gui Santos, Al Horford)",lineupchange,95,,basketball_play,1770700019,81,True,2026-02-10 05:06:59+00:00,4,503.0,2377.0,39.61666666666667,388
1,81,quarter,4,502c629b-4da7-40fd-92ab-20cb55411c35,108,8:10,Brandin Podziemski turnover (traveling),turnover,95,1cfe70b8-4dfc-47dc-acca-b68d4a725972,basketball_play,1770700019,80,True,2026-02-10 05:06:59+00:00,4,490.0,2390.0,39.833333333333336,389
1,80,quarter,4,1cfe70b8-4dfc-47dc-acca-b68d4a725972,108,7:57,Scotty Pippen Jr. turnover (bad pass) (Gui Santos steals),turnover,95,502c629b-4da7-40fd-92ab-20cb55411c35,basketball_play,1770700040,79,True,2026-02-10 05:07:20+00:00,4,477.0,2403.0,40.05,390
1,79,quarter,4,502c629b-4da7-40fd-92ab-20cb55411c35,108,7:37,Pat Spencer makes two point cutting layup (Quinten Post assists),twopointmade,97,1cfe70b8-4dfc-47dc-acca-b68d4a725972,basketball_play,1770700060,78,True,2026-02-10 05:07:40+00:00,4,457.0,2423.0,40.38333333333333,391
1,78,quarter,4,1cfe70b8-4dfc-47dc-acca-b68d4a725972,108,7:31,Ty Jerome misses three point jump shot,threepointmiss,97,,basketball_play,1770700065,77,True,2026-02-10 05:07:45+00:00,4,451.0,2429.0,40.483333333333334,392
1,77,quarter,4,502c629b-4da7-40fd-92ab-20cb55411c35,108,7:29,Al Horford defensive rebound,rebound,97,502c629b-4da7-40fd-92ab-20cb55411c35,basketball_play,1770700067,76,True,2026-02-10 05:07:47+00:00,4,449.0,2431.0,40.516666666666666,393
1,76,quarter,4,502c629b-4da7-40fd-92ab-20cb55411c35,108,7:26,Quinten Post offensive foul (Scotty Pippen Jr. draws the foul),offensivefoul,97,1cfe70b8-4dfc-47dc-acca-b68d4a725972,basketball_play,1770700079,75,True,2026-02-10 05:07:59+00:00,4,446.0,2434.0,40.56666666666667,394
1,75,quarter,4,502c629b-4da7-40fd-92ab-20cb55411c35,108,7:26,Quinten Post turnover (offensive foul),turnover,97,1cfe70b8-4dfc-47dc-acca-b68d4a725972,basketball_play,1770700079,74,True,2026-02-10 05:07:59+00:00,4,446.0,2434.0,40.56666666666667,395
1,74,quarter,4,1cfe70b8-4dfc-47dc-acca-b68d4a725972,108,7:14,Ty Jerome misses three point pullup jump shot,threepointmiss,97,,basketball_play,1770700104,73,True,2026-02-10 05:08:24+00:00,4,434.0,2446.0,40.766666666666666,396
1,73,quarter,4,502c629b-4da7-40fd-92ab-20cb55411c35,108,7:12,Gui Santos defensive rebound,rebound,97,502c629b-4da7-40fd-92ab-20cb55411c35,basketball_play,1770700106,72,True,2026-02-10 05:08:26+00:00,4,432.0,2448.0,40.8,397
1,72,quarter,4,502c629b-4da7-40fd-92ab-20cb55411c35,108,7:05,Gui Santos turnover (bad pass) (GG Jackson steals),turnover,97,1cfe70b8-4dfc-47dc-acca-b68d4a725972,basketball_play,1770700112,71,True,2026-02-10 05:08:32+00:00,4,425.0,2455.0,40.916666666666664,398
1,71,quarter,4,1cfe70b8-4dfc-47dc-acca-b68d4a725972,108,7:02,GG Jackson offensive foul (Charge) (Brandin Podziemski draws the foul),offensivefoul,97,502c629b-4da7-40fd-92ab-20cb55411c35,basketball_play,1770700124,70,True,2026-02-10 05:08:44+00:00,4,422.0,2458.0,40.96666666666667,399
1,70,quarter,4,1cfe70b8-4dfc-47dc-acca-b68d4a725972,108,7:02,GG Jackson turnover (offensive foul),turnover,97,502c629b-4da7-40fd-92ab-20cb55411c35,basketball_play,1770700124,69,True,2026-02-10 05:08:44+00:00,4,422.0,2458.0,40.96666666666667,400
1,69,quarter,4,502c629b-4da7-40fd-92ab-20cb55411c35,108,7:02,Warriors 60 second timeout,teamtimeout,97,,basketball_play,1770700144,68,True,2026-02-10 05:09:04+00:00,4,422.0,2458.0,40.96666666666667,401
1,68,quarter,4,,108,7:02,Instant replay (Challenge: Ruling Overturned),review,97,,basketball_play,1770700145,67,True,2026-02-10 05:09:05+00:00,4,422.0,2458.0,40.96666666666667,402
1,67,quarter,4,1cfe70b8-4dfc-47dc-acca-b68d4a725972,108,7:02,"Grizzlies lineup change (Scotty Pippen Jr., Taylor Hendricks, Ty Jerome, Jaylen Wells, Kyle Anderson)",lineupchange,97,,basketball_play,1770700235,66,True,2026-02-10 05:10:35+00:00,4,422.0,2458.0,40.96666666666667,403
1,66,quarter,4,502c629b-4da7-40fd-92ab-20cb55411c35,108,7:02,"Warriors lineup change (Pat Spencer, Gui Santos, Al Horford, Gary Payton II, De'Anthony Melton)",lineupchange,97,,basketball_play,1770700235,65,True,2026-02-10 05:10:35+00:00,4,422.0,2458.0,40.96666666666667,404
1,65,quarter,4,502c629b-4da7-40fd-92ab-20cb55411c35,108,6:41,Kyle Anderson blocks De'Anthony Melton's two point driving layup,twopointmiss,97,,basketball_play,1770700335,64,True,2026-02-10 05:12:15+00:00,4,401.0,2479.0,41.31666666666667,405
1,64,quarter,4,502c629b-4da7-40fd-92ab-20cb55411c35,108,6:41,Warriors offensive rebound,rebound,97,502c629b-4da7-40fd-92ab-20cb55411c35,basketball_play,1770700335,63,True,2026-02-10 05:12:15+00:00,4,401.0,2479.0,41.31666666666667,406
1,63,quarter,4,,108,6:41,Stoppage (Out of bounds),stoppage,97,,basketball_play,1770700341,62,True,2026-02-10 05:12:21+00:00,4,401.0,2479.0,41.31666666666667,407
1,62,quarter,4,1cfe70b8-4dfc-47dc-acca-b68d4a725972,108,6:41,"Grizzlies lineup change (Scotty Pippen Jr., Taylor Hendricks, Jaylen Wells, Cam Spencer, Kyle Anderson)",lineupchange,97,,basketball_play,1770700359,61,True,2026-02-10 05:12:39+00:00,4,401.0,2479.0,41.31666666666667,408
1,61,quarter,4,502c629b-4da7-40fd-92ab-20cb55411c35,108,6:38,Pat Spencer makes two point pullup jump shot (Gary Payton II assists),twopointmade,99,1cfe70b8-4dfc-47dc-acca-b68d4a725972,basketball_play,1770700359,60,True,2026-02-10 05:12:39+00:00,4,398.0,2482.0,41.36666666666667,409
1,60,quarter,4,1cfe70b8-4dfc-47dc-acca-b68d4a725972,108,6:16,Taylor Hendricks misses three point jump shot,threepointmiss,99,,basketball_play,1770700380,59,True,2026-02-10 05:13:00+00:00,4,376.0,2504.0,41.733333333333334,410
1,59,quarter,4,502c629b-4da7-40fd-92ab-20cb55411c35,108,6:14,Gui Santos defensive rebound,rebound,99,502c629b-4da7-40fd-92ab-20cb55411c35,basketball_play,1770700382,58,True,2026-02-10 05:13:02+00:00,4,374.0,2506.0,41.766666666666666,411
1,58,quarter,4,502c629b-4da7-40fd-92ab-20cb55411c35,108,6:06,Gui Santos turnover (traveling),turnover,99,1cfe70b8-4dfc-47dc-acca-b68d4a725972,basketball_play,1770700394,57,True,2026-02-10 05:13:14+00:00,4,366.0,2514.0,41.9,412
1,57,quarter,4,1cfe70b8-4dfc-47dc-acca-b68d4a725972,108,6:06,"Grizzlies lineup change (Taylor Hendricks, Jaylen Wells, Cam Spencer, Kyle Anderson, Javon Small)",lineupchange,99,,basketball_play,1770700465,56,True,2026-02-10 05:14:25+00:00,4,366.0,2514.0,41.9,413
1,56,quarter,4,1cfe70b8-4dfc-47dc-acca-b68d4a725972,108,5:51,Taylor Hendricks misses two point driving reverse layup,twopointmiss,99,,basketball_play,1770700465,55,True,2026-02-10 05:14:25+00:00,4,351.0,2529.0,42.15,414
1,55,quarter,4,502c629b-4da7-40fd-92ab-20cb55411c35,108,5:50,Al Horford defensive rebound,rebound,99,502c629b-4da7-40fd-92ab-20cb55411c35,basketball_play,1770700466,54,True,2026-02-10 05:14:26+00:00,4,350.0,2530.0,42.166666666666664,415
1,54,quarter,4,502c629b-4da7-40fd-92ab-20cb55411c35,108,5:37,De'Anthony Melton misses two point turnaround hook shot,twopointmiss,99,,basketball_play,1770700478,53,True,2026-02-10 05:14:38+00:00,4,337.0,2543.0,42.38333333333333,416
1,53,quarter,4,502c629b-4da7-40fd-92ab-20cb55411c35,108,5:34,Gui Santos offensive rebound,rebound,99,502c629b-4da7-40fd-92ab-20cb55411c35,basketball_play,1770700481,52,True,2026-02-10 05:14:41+00:00,4,334.0,2546.0,42.43333333333333,417
1,52,quarter,4,502c629b-4da7-40fd-92ab-20cb55411c35,108,5:34,Gui Santos makes two point tip layup,twopointmade,101,1cfe70b8-4dfc-47dc-acca-b68d4a725972,basketball_play,1770700481,51,True,2026-02-10 05:14:41+00:00,4,334.0,2546.0,42.43333333333333,418
