period_index,event_index,period_type,period_number,attribution,away_points,clock,description,event_type,home_points,possession,type,wall_clock,pbp_source_row,has_wall_clock,event_ts_utc,period_sequence,game_clock_seconds_remaining,game_elapsed_seconds,game_elapsed_minutes,pbp_chronological_index
2,23,quarter,3,7cc1eb26-46ee-44b7-94ad-248ee3b0fbd3,85,1:50,Drake Powell misses two point pullup jump shot,twopointmiss,85,,basketball_play,1771798517,137,True,2026-02-22 22:15:17+00:00,3,110.0,2050.0,34.166666666666664,318
2,22,quarter,3,7cc1eb26-46ee-44b7-94ad-248ee3b0fbd3,85,1:49,Day'Ron Sharpe offensive rebound,rebound,85,7cc1eb26-46ee-44b7-94ad-248ee3b0fbd3,basketball_play,1771798518,136,True,2026-02-22 22:15:18+00:00,3,109.0,2051.0,34.18333333333333,319
2,21,quarter,3,7cc1eb26-46ee-44b7-94ad-248ee3b0fbd3,85,1:48,Day'Ron Sharpe misses two point putback layup,twopointmiss,85,,basketball_play,1771798522,135,True,2026-02-22 22:15:22+00:00,3,108.0,2052.0,34.2,320
2,20,quarter,3,e0729403-9c95-4ee2-b5d4-f704d8322570,85,1:47,Nickeil Alexander-Walker defensive rebound,rebound,85,e0729403-9c95-4ee2-b5d4-f704d8322570,basketball_play,1771798523,134,True,2026-02-22 22:15:23+00:00,3,107.0,2053.0,34.21666666666667,321
2,19,quarter,3,e0729403-9c95-4ee2-b5d4-f704d8322570,85,1:39,Jock Landale makes two point turnaround hook shot (Nickeil Alexander-Walker assists),twopointmade,87,7cc1eb26-46ee-44b7-94ad-248ee3b0fbd3,basketball_play,1771798529,133,True,2026-02-22 22:15:29+00:00,3,99.0,2061.0,34.35,322
2,18,quarter,3,7cc1eb26-46ee-44b7-94ad-248ee3b0fbd3,85,1:23,Drake Powell misses three point jump shot,threepointmiss,87,,basketball_play,1771798545,132,True,2026-02-22 22:15:45+00:00,3,83.0,2077.0,34.61666666666667,323
2,17,quarter,3,e0729403-9c95-4ee2-b5d4-f704d8322570,85,1:20,CJ McCollum defensive rebound,rebound,87,e0729403-9c95-4ee2-b5d4-f704d8322570,basketball_play,1771798548,131,True,2026-02-22 22:15:48+00:00,3,80.0,2080.0,34.666666666666664,324
2,16,quarter,3,e0729403-9c95-4ee2-b5d4-f704d8322570,85,1:07,CJ McCollum makes two point stepback jump shot,twopointmade,89,7cc1eb26-46ee-44b7-94ad-248ee3b0fbd3,basketball_play,1771798560,130,True,2026-02-22 22:16:00+00:00,3,67.0,2093.0,34.88333333333333,325
2,15,quarter,3,7cc1eb26-46ee-44b7-94ad-248ee3b0fbd3,85,00:57.20,Nets 60 second timeout,teamtimeout,89,,basketball_play,1771798576,129,True,2026-02-22 22:16:16+00:00,3,57.2,2102.8,35.04666666666667,326
2,14,quarter,3,7cc1eb26-46ee-44b7-94ad-248ee3b0fbd3,85,00:57,"Nets lineup change (Day'Ron Sharpe, Danny Wolf, Nolan Traore, Ochai Agbaji, Terance Mann)",lineupchange,89,,basketball_play,1771798689,128,True,2026-02-22 22:18:09+00:00,3,57.0,2103.0,35.05,327
2,13,quarter,3,7cc1eb26-46ee-44b7-94ad-248ee3b0fbd3,85,00:40.60,Danny Wolf turnover (lost ball) (Nickeil Alexander-Walker steals),turnover,89,e0729403-9c95-4ee2-b5d4-f704d8322570,basketball_play,1771798689,127,True,2026-02-22 22:18:09+00:00,3,40.6,2119.4,35.32333333333334,328
2,12,quarter,3,e0729403-9c95-4ee2-b5d4-f704d8322570,85,00:37.10,Danny Wolf blocks Zaccharie Risacher's two point running layup,twopointmiss,89,,basketball_play,1771798693,126,True,2026-02-22 22:18:13+00:00,3,37.1,2122.9,35.38166666666667,329
2,11,quarter,3,e0729403-9c95-4ee2-b5d4-f704d8322570,85,00:36.10,Hawks offensive rebound,rebound,89,e0729403-9c95-4ee2-b5d4-f704d8322570,basketball_play,1771798694,125,True,2026-02-22 22:18:14+00:00,3,36.1,2123.9,35.39833333333333,330
2,10,quarter,3,,85,00:36.10,Stoppage (Out of bounds),stoppage,89,,basketball_play,1771798698,124,True,2026-02-22 22:18:18+00:00,3,36.1,2123.9,35.39833333333333,331
2,9,quarter,3,e0729403-9c95-4ee2-b5d4-f704d8322570,85,00:31.10,Nickeil Alexander-Walker misses three point pullup jump shot,threepointmiss,89,,basketball_play,1771798719,123,True,2026-02-22 22:18:39+00:00,3,31.1,2128.9,35.48166666666667,332
2,8,quarter,3,e0729403-9c95-4ee2-b5d4-f704d8322570,85,00:26.80,Zaccharie Risacher offensive rebound,rebound,89,e0729403-9c95-4ee2-b5d4-f704d8322570,basketball_play,1771798724,122,True,2026-02-22 22:18:44+00:00,3,26.8,2133.2,35.55333333333333,333
2,7,quarter,3,e0729403-9c95-4ee2-b5d4-f704d8322570,85,00:25.40,Zaccharie Risacher turnover (bad pass) (Nolan Traore steals),turnover,89,7cc1eb26-46ee-44b7-94ad-248ee3b0fbd3,basketball_play,1771798725,121,True,2026-02-22 22:18:45+00:00,3,25.4,2134.6,35.57666666666667,334
2,6,quarter,3,7cc1eb26-46ee-44b7-94ad-248ee3b0fbd3,85,00:05.70,Nolan Traore misses two point driving floating jump shot,twopointmiss,89,,basketball_play,1771798745,120,True,2026-02-22 22:19:05+00:00,3,5.7,2154.3,35.905,335
2,5,quarter,3,7cc1eb26-46ee-44b7-94ad-248ee3b0fbd3,85,00:05.20,Day'Ron Sharpe offensive rebound,rebound,89,7cc1eb26-46ee-44b7-94ad-248ee3b0fbd3,basketball_play,1771798748,119,True,2026-02-22 22:19:08+00:00,3,5.2,2154.8,35.913333333333334,336
2,4,quarter,3,7cc1eb26-46ee-44b7-94ad-248ee3b0fbd3,87,00:05.20,Day'Ron Sharpe makes two point tip layup,twopointmade,89,e0729403-9c95-4ee2-b5d4-f704d8322570,basketball_play,1771798748,118,True,2026-02-22 22:19:08+00:00,3,5.2,2154.8,35.913333333333334,337
2,3,quarter,3,7cc1eb26-46ee-44b7-94ad-248ee3b0fbd3,87,00:03.40,Ochai Agbaji personal foul (Take) (CJ McCollum draws the foul),personalfoul,89,e0729403-9c95-4ee2-b5d4-f704d8322570,basketball_play,1771798753,117,True,2026-02-22 22:19:13+00:00,3,3.4,2156.6,35.943333333333335,338
2,2,quarter,3,7cc1eb26-46ee-44b7-94ad-248ee3b0fbd3,87,00:03,"Nets lineup change (Danny Wolf, Noah Clowney, Nolan Traore, Ochai Agbaji, Terance Mann)",lineupchange,89,,basketball_play,1771798783,116,True,2026-02-22 22:19:43+00:00,3,3.0,2157.0,35.95,339
2,1,quarter,3,,87,00:00,End of 3rd Quarter.,endperiod,89,,basketball_play,1771798783,115,True,2026-02-22 22:19:43+00:00,3,0.0,2160.0,36.0,340
1,115,quarter,4,7cc1eb26-46ee-44b7-94ad-248ee3b0fbd3,87,12:00,"Nets lineup change (Day'Ron Sharpe, Danny Wolf, Nolan Traore, Ochai Agbaji, Terance Mann)",lineupchange,89,,basketball_play,1771798817,114,True,2026-02-22 22:20:17+00:00,4,720.0,2160.0,36.0,341
1,114,quarter,4,e0729403-9c95-4ee2-b5d4-f704d8322570,87,12:00,"Hawks lineup change (Nickeil Alexander-Walker, Mouhamed Gueye, Jock Landale, CJ McCollum, Corey Kispert)",lineupchange,89,,basketball_play,1771798817,113,True,2026-02-22 22:20:17+00:00,4,720.0,2160.0,36.0,342
1,113,quarter,4,,87,12:00,Start of 4th Quarter,startperiod,89,,basketball_play,1771798951,112,True,2026-02-22 22:22:31+00:00,4,720.0,2160.0,36.0,343
1,112,quarter,4,7cc1eb26-46ee-44b7-94ad-248ee3b0fbd3,90,11:42,Danny Wolf makes three point jump shot (Day'Ron Sharpe assists),threepointmade,89,e0729403-9c95-4ee2-b5d4-f704d8322570,basketball_play,1771798968,111,True,2026-02-22 22:22:48+00:00,4,702.0,2178.0,36.3,344
1,111,quarter,4,e0729403-9c95-4ee2-b5d4-f704d8322570,90,11:20,CJ McCollum turnover (bad pass),turnover,89,7cc1eb26-46ee-44b7-94ad-248ee3b0fbd3,basketball_play,1771798994,110,True,2026-02-22 22:23:14+00:00,4,680.0,2200.0,36.666666666666664,345
1,110,quarter,4,e0729403-9c95-4ee2-b5d4-f704d8322570,90,11:20,Corey Kispert personal foul (Loose ball) (Ochai Agbaji draws the foul),personalfoul,89,7cc1eb26-46ee-44b7-94ad-248ee3b0fbd3,basketball_play,1771799001,109,True,2026-02-22 22:23:21+00:00,4,680.0,2200.0,36.666666666666664,346
1,109,quarter,4,7cc1eb26-46ee-44b7-94ad-248ee3b0fbd3,93,11:04,Ochai Agbaji makes three point jump shot (Danny Wolf assists),threepointmade,89,e0729403-9c95-4ee2-b5d4-f704d8322570,basketball_play,1771799024,108,True,2026-02-22 22:23:44+00:00,4,664.0,2216.0,36.93333333333333,347
1,108,quarter,4,7cc1eb26-46ee-44b7-94ad-248ee3b0fbd3,93,10:48,Terance Mann personal foul (Nickeil Alexander-Walker draws the foul),personalfoul,89,e0729403-9c95-4ee2-b5d4-f704d8322570,basketball_play,1771799043,107,True,2026-02-22 22:24:03+00:00,4,648.0,2232.0,37.2,348
1,107,quarter,4,e0729403-9c95-4ee2-b5d4-f704d8322570,93,10:48,"Hawks lineup change (Nickeil Alexander-Walker, Jock Landale, CJ McCollum, Jalen Johnson, Corey Kispert)",lineupchange,89,,basketball_play,1771799072,106,True,2026-02-22 22:24:32+00:00,4,648.0,2232.0,37.2,349
1,106,quarter,4,e0729403-9c95-4ee2-b5d4-f704d8322570,93,10:38,Jock Landale misses two point floating jump shot,twopointmiss,89,,basketball_play,1771799072,105,True,2026-02-22 22:24:32+00:00,4,638.0,2242.0,37.36666666666667,350
1,105,quarter,4,e0729403-9c95-4ee2-b5d4-f704d8322570,93,10:35,Nickeil Alexander-Walker offensive rebound,rebound,89,e0729403-9c95-4ee2-b5d4-f704d8322570,basketball_play,1771799075,104,True,2026-02-22 22:24:35+00:00,4,635.0,2245.0,37.416666666666664,351
1,104,quarter,4,e0729403-9c95-4ee2-b5d4-f704d8322570,93,10:30,Nickeil Alexander-Walker misses three point stepback jump shot,threepointmiss,89,,basketball_play,1771799080,103,True,2026-02-22 22:24:40+00:00,4,630.0,2250.0,37.5,352
1,103,quarter,4,7cc1eb26-46ee-44b7-94ad-248ee3b0fbd3,93,10:27,Day'Ron Sharpe defensive rebound,rebound,89,7cc1eb26-46ee-44b7-94ad-248ee3b0fbd3,basketball_play,1771799083,102,True,2026-02-22 22:24:43+00:00,4,627.0,2253.0,37.55,353
1,102,quarter,4,7cc1eb26-46ee-44b7-94ad-248ee3b0fbd3,93,10:21,Nolan Traore misses two point driving layup,twopointmiss,89,,basketball_play,1771799090,101,True,2026-02-22 22:24:50+00:00,4,621.0,2259.0,37.65,354
1,101,quarter,4,7cc1eb26-46ee-44b7-94ad-248ee3b0fbd3,93,10:20,Day'Ron Sharpe offensive rebound,rebound,89,7cc1eb26-46ee-44b7-94ad-248ee3b0fbd3,basketball_play,1771799091,100,True,2026-02-22 22:24:51+00:00,4,620.0,2260.0,37.666666666666664,355
1,100,quarter,4,7cc1eb26-46ee-44b7-94ad-248ee3b0fbd3,95,10:20,Day'Ron Sharpe makes two point tip layup,twopointmade,89,e0729403-9c95-4ee2-b5d4-f704d8322570,basketball_play,1771799094,99,True,2026-02-22 22:24:54+00:00,4,620.0,2260.0,37.666666666666664,356
1,99,quarter,4,e0729403-9c95-4ee2-b5d4-f704d8322570,95,10:20,Hawks 60 second timeout,teamtimeout,89,,basketball_play,1771799096,98,True,2026-02-22 22:24:56+00:00,4,620.0,2260.0,37.666666666666664,357
1,98,quarter,4,e0729403-9c95-4ee2-b5d4-f704d8322570,95,10:00,Jalen Johnson makes two point driving layup,twopointmade,91,7cc1eb26-46ee-44b7-94ad-248ee3b0fbd3,basketball_play,1771799289,97,True,2026-02-22 22:28:09+00:00,4,600.0,2280.0,38.0,358
1,97,quarter,4,7cc1eb26-46ee-44b7-94ad-248ee3b0fbd3,98,9:32,Terance Mann makes three point jump shot (Ochai Agbaji assists),threepointmade,91,e0729403-9c95-4ee2-b5d4-f704d8322570,basketball_play,1771799316,96,True,2026-02-22 22:28:36+00:00,4,572.0,2308.0,38.46666666666667,359
1,96,quarter,4,e0729403-9c95-4ee2-b5d4-f704d8322570,98,9:20,CJ McCollum misses two point pullup jump shot,twopointmiss,91,,basketball_play,1771799328,95,True,2026-02-22 22:28:48+00:00,4,560.0,2320.0,38.666666666666664,360
1,95,quarter,4,e0729403-9c95-4ee2-b5d4-f704d8322570,98,9:18,CJ McCollum offensive rebound,rebound,91,e0729403-9c95-4ee2-b5d4-f704d8322570,basketball_play,1771799331,94,True,2026-02-22 22:28:51+00:00,4,558.0,2322.0,38.7,361
1,94,quarter,4,e0729403-9c95-4ee2-b5d4-f704d8322570,98,9:16,Jock Landale turnover (out of bounds bad pass),turnover,91,7cc1eb26-46ee-44b7-94ad-248ee3b0fbd3,basketball_play,1771799334,93,True,2026-02-22 22:28:54+00:00,4,556.0,2324.0,38.733333333333334,362
1,93,quarter,4,e0729403-9c95-4ee2-b5d4-f704d8322570,98,9:16,"Hawks lineup change (Nickeil Alexander-Walker, CJ McCollum, Jalen Johnson, Onyeka Okongwu, Corey Kispert)",lineupchange,91,,basketball_play,1771799368,92,True,2026-02-22 22:29:28+00:00,4,556.0,2324.0,38.733333333333334,363
1,92,quarter,4,7cc1eb26-46ee-44b7-94ad-248ee3b0fbd3,98,9:02,Day'Ron Sharpe misses two point alley-oop dunk,twopointmiss,91,,basketball_play,1771799368,91,True,2026-02-22 22:29:28+00:00,4,542.0,2338.0,38.96666666666667,364
1,91,quarter,4,e0729403-9c95-4ee2-b5d4-f704d8322570,98,8:59,Jalen Johnson defensive rebound,rebound,91,e0729403-9c95-4ee2-b5d4-f704d8322570,basketball_play,1771799371,90,True,2026-02-22 22:29:31+00:00,4,539.0,2341.0,39.016666666666666,365
1,90,quarter,4,,98,8:48,Stoppage (Out of bounds),stoppage,91,,basketball_play,1771799384,89,True,2026-02-22 22:29:44+00:00,4,528.0,2352.0,39.2,366
1,89,quarter,4,e0729403-9c95-4ee2-b5d4-f704d8322570,98,8:48,"Hawks lineup change (Dyson Daniels, Gabe Vincent, Jalen Johnson, Onyeka Okongwu, Corey Kispert)",lineupchange,91,,basketball_play,1771799387,88,True,2026-02-22 22:29:47+00:00,4,528.0,2352.0,39.2,367
1,88,quarter,4,e0729403-9c95-4ee2-b5d4-f704d8322570,98,8:39,Gabe Vincent misses three point stepback jump shot,threepointmiss,91,,basketball_play,1771799430,87,True,2026-02-22 22:30:30+00:00,4,519.0,2361.0,39.35,368
1,87,quarter,4,e0729403-9c95-4ee2-b5d4-f704d8322570,98,8:38,Hawks offensive rebound,rebound,91,e0729403-9c95-4ee2-b5d4-f704d8322570,basketball_play,1771799431,86,True,2026-02-22 22:30:31+00:00,4,518.0,2362.0,39.36666666666667,369
1,86,quarter,4,e0729403-9c95-4ee2-b5d4-f704d8322570,98,8:38,Hawks turnover (shot clock violation),turnover,91,7cc1eb26-46ee-44b7-94ad-248ee3b0fbd3,basketball_play,1771799435,85,True,2026-02-22 22:30:35+00:00,4,518.0,2362.0,39.36666666666667,370
1,85,quarter,4,e0729403-9c95-4ee2-b5d4-f704d8322570,98,8:27,Onyeka Okongwu shooting foul (Nolan Traore draws the foul),shootingfoul,91,7cc1eb26-46ee-44b7-94ad-248ee3b0fbd3,basketball_play,1771799456,84,True,2026-02-22 22:30:56+00:00,4,507.0,2373.0,39.55,371
1,84,quarter,4,7cc1eb26-46ee-44b7-94ad-248ee3b0fbd3,99,8:27,Nolan Traore makes regular free throw 1 of 2,freethrowmade,91,7cc1eb26-46ee-44b7-94ad-248ee3b0fbd3,basketball_play,1771799485,83,True,2026-02-22 22:31:25+00:00,4,507.0,2373.0,39.55,372
1,83,quarter,4,7cc1eb26-46ee-44b7-94ad-248ee3b0fbd3,99,8:27,Nolan Traore misses regular free throw 2 of 2,freethrowmiss,91,,basketball_play,1771799485,82,True,2026-02-22 22:31:25+00:00,4,507.0,2373.0,39.55,373
1,82,quarter,4,e0729403-9c95-4ee2-b5d4-f704d8322570,99,8:25,Jalen Johnson defensive rebound,rebound,91,e0729403-9c95-4ee2-b5d4-f704d8322570,basketball_play,1771799487,81,True,2026-02-22 22:31:27+00:00,4,505.0,2375.0,39.583333333333336,374
1,81,quarter,4,e0729403-9c95-4ee2-b5d4-f704d8322570,99,8:12,Jalen Johnson turnover (bad pass) (Day'Ron Sharpe steals),turnover,91,7cc1eb26-46ee-44b7-94ad-248ee3b0fbd3,basketball_play,1771799518,80,True,2026-02-22 22:31:58+00:00,4,492.0,2388.0,39.8,375
1,80,quarter,4,7cc1eb26-46ee-44b7-94ad-248ee3b0fbd3,102,8:01,Terance Mann makes three point jump shot (Danny Wolf assists),threepointmade,91,e0729403-9c95-4ee2-b5d4-f704d8322570,basketball_play,1771799528,79,True,2026-02-22 22:32:08+00:00,4,481.0,2399.0,39.983333333333334,376
1,79,quarter,4,e0729403-9c95-4ee2-b5d4-f704d8322570,102,8:00,Hawks 60 second timeout,teamtimeout,91,,basketball_play,1771799534,78,True,2026-02-22 22:32:14+00:00,4,480.0,2400.0,40.0,377
1,78,quarter,4,7cc1eb26-46ee-44b7-94ad-248ee3b0fbd3,102,8:00,"Nets lineup change (Day'Ron Sharpe, Danny Wolf, Ochai Agbaji, Drake Powell, Terance Mann)",lineupchange,91,,basketball_play,1771799726,77,True,2026-02-22 22:35:26+00:00,4,480.0,2400.0,40.0,378
1,77,quarter,4,e0729403-9c95-4ee2-b5d4-f704d8322570,102,7:42,Dyson Daniels misses three point jump shot,threepointmiss,91,,basketball_play,1771799726,76,True,2026-02-22 22:35:26+00:00,4,462.0,2418.0,40.3,379
1,76,quarter,4,7cc1eb26-46ee-44b7-94ad-248ee3b0fbd3,102,7:40,Ochai Agbaji defensive rebound,rebound,91,7cc1eb26-46ee-44b7-94ad-248ee3b0fbd3,basketball_play,1771799728,75,True,2026-02-22 22:35:28+00:00,4,460.0,2420.0,40.333333333333336,380
1,75,quarter,4,7cc1eb26-46ee-44b7-94ad-248ee3b0fbd3,102,7:17,Danny Wolf misses three point jump shot,threepointmiss,91,,basketball_play,1771799751,74,True,2026-02-22 22:35:51+00:00,4,437.0,2443.0,40.71666666666667,381
1,74,quarter,4,7cc1eb26-46ee-44b7-94ad-248ee3b0fbd3,102,7:15,Drake Powell offensive rebound,rebound,91,7cc1eb26-46ee-44b7-94ad-248ee3b0fbd3,basketball_play,1771799753,73,True,2026-02-22 22:35:53+00:00,4,435.0,2445.0,40.75,382
1,73,quarter,4,7cc1eb26-46ee-44b7-94ad-248ee3b0fbd3,102,7:13,Terance Mann misses three point jump shot,threepointmiss,91,,basketball_play,1771799756,72,True,2026-02-22 22:35:56+00:00,4,433.0,2447.0,40.78333333333333,383
1,72,quarter,4,7cc1eb26-46ee-44b7-94ad-248ee3b0fbd3,102,7:11,Nets offensive rebound,rebound,91,7cc1eb26-46ee-44b7-94ad-248ee3b0fbd3,basketball_play,1771799758,71,True,2026-02-22 22:35:58+00:00,4,431.0,2449.0,40.81666666666667,384
1,71,quarter,4,e0729403-9c95-4ee2-b5d4-f704d8322570,102,7:11,Jalen Johnson personal foul (Loose ball) (Day'Ron Sharpe draws the foul),personalfoul,91,7cc1eb26-46ee-44b7-94ad-248ee3b0fbd3,basketball_play,1771799763,70,True,2026-02-22 22:36:03+00:00,4,431.0,2449.0,40.81666666666667,385
1,70,quarter,4,7cc1eb26-46ee-44b7-94ad-248ee3b0fbd3,102,7:11,"Nets lineup change (Ochai Agbaji, Nic Claxton, Michael Porter Jr., Drake Powell, Terance Mann)",lineupchange,91,,basketball_play,1771799771,69,True,2026-02-22 22:36:11+00:00,4,431.0,2449.0,40.81666666666667,386
1,69,quarter,4,e0729403-9c95-4ee2-b5d4-f704d8322570,102,7:11,"Hawks lineup change (Dyson Daniels, Nickeil Alexander-Walker, Gabe Vincent, Jalen Johnson, Onyeka Okongwu)",lineupchange,91,,basketball_play,1771799771,68,True,2026-02-22 22:36:11+00:00,4,431.0,2449.0,40.81666666666667,387
1,68,quarter,4,7cc1eb26-46ee-44b7-94ad-248ee3b0fbd3,102,6:58,Ochai Agbaji misses three point jump shot,threepointmiss,91,,basketball_play,1771799804,67,True,2026-02-22 22:36:44+00:00,4,418.0,2462.0,41.03333333333333,388
1,67,quarter,4,e0729403-9c95-4ee2-b5d4-f704d8322570,102,6:56,Jalen Johnson defensive rebound,rebound,91,e0729403-9c95-4ee2-b5d4-f704d8322570,basketball_play,1771799806,66,True,2026-02-22 22:36:46+00:00,4,416.0,2464.0,41.06666666666667,389
1,66,quarter,4,e0729403-9c95-4ee2-b5d4-f704d8322570,102,6:44,Gabe Vincent makes three point jump shot (Nickeil Alexander-Walker assists),threepointmade,94,7cc1eb26-46ee-44b7-94ad-248ee3b0fbd3,basketball_play,1771799819,65,True,2026-02-22 22:36:59+00:00,4,404.0,2476.0,41.266666666666666,390
1,65,quarter,4,7cc1eb26-46ee-44b7-94ad-248ee3b0fbd3,102,6:25,Onyeka Okongwu blocks Nic Claxton's two point driving layup,twopointmiss,94,,basketball_play,1771799839,64,True,2026-02-22 22:37:19+00:00,4,385.0,2495.0,41.583333333333336,391
1,64,quarter,4,7cc1eb26-46ee-44b7-94ad-248ee3b0fbd3,102,6:24,Nets offensive rebound,rebound,94,7cc1eb26-46ee-44b7-94ad-248ee3b0fbd3,basketball_play,1771799840,63,True,2026-02-22 22:37:20+00:00,4,384.0,2496.0,41.6,392
1,63,quarter,4,,102,6:24,Stoppage (Out of bounds),stoppage,94,,basketball_play,1771799844,62,True,2026-02-22 22:37:24+00:00,4,384.0,2496.0,41.6,393
1,62,quarter,4,7cc1eb26-46ee-44b7-94ad-248ee3b0fbd3,102,6:24,"Nets lineup change (Noah Clowney, Nic Claxton, Michael Porter Jr., Drake Powell, Egor Demin)",lineupchange,94,,basketball_play,1771799850,61,True,2026-02-22 22:37:30+00:00,4,384.0,2496.0,41.6,394
1,61,quarter,4,e0729403-9c95-4ee2-b5d4-f704d8322570,102,6:24,"Hawks lineup change (Dyson Daniels, Nickeil Alexander-Walker, CJ McCollum, Jalen Johnson, Onyeka Okongwu)",lineupchange,94,,basketball_play,1771799850,60,True,2026-02-22 22:37:30+00:00,4,384.0,2496.0,41.6,395
1,60,quarter,4,7cc1eb26-46ee-44b7-94ad-248ee3b0fbd3,102,6:21,Michael Porter Jr. misses three point jump shot,threepointmiss,94,,basketball_play,1771799870,59,True,2026-02-22 22:37:50+00:00,4,381.0,2499.0,41.65,396
1,59,quarter,4,e0729403-9c95-4ee2-b5d4-f704d8322570,102,6:19,Jalen Johnson defensive rebound,rebound,94,e0729403-9c95-4ee2-b5d4-f704d8322570,basketball_play,1771799872,58,True,2026-02-22 22:37:52+00:00,4,379.0,2501.0,41.68333333333333,397
1,58,quarter,4,7cc1eb26-46ee-44b7-94ad-248ee3b0fbd3,102,6:16,Drake Powell shooting foul (Dyson Daniels draws the foul),shootingfoul,94,e0729403-9c95-4ee2-b5d4-f704d8322570,basketball_play,1771799876,57,True,2026-02-22 22:37:56+00:00,4,376.0,2504.0,41.733333333333334,398
1,57,quarter,4,e0729403-9c95-4ee2-b5d4-f704d8322570,102,6:16,Dyson Daniels makes regular free throw 1 of 2,freethrowmade,95,e0729403-9c95-4ee2-b5d4-f704d8322570,basketball_play,1771799910,56,True,2026-02-22 22:38:30+00:00,4,376.0,2504.0,41.733333333333334,399
1,56,quarter,4,e0729403-9c95-4ee2-b5d4-f704d8322570,102,6:16,Dyson Daniels misses regular free throw 2 of 2,freethrowmiss,95,,basketball_play,1771799910,55,True,2026-02-22 22:38:30+00:00,4,376.0,2504.0,41.733333333333334,400
1,55,quarter,4,7cc1eb26-46ee-44b7-94ad-248ee3b0fbd3,102,6:13,Nic Claxton defensive rebound,rebound,95,7cc1eb26-46ee-44b7-94ad-248ee3b0fbd3,basketball_play,1771799913,54,True,2026-02-22 22:38:33+00:00,4,373.0,2507.0,41.78333333333333,401
1,54,quarter,4,7cc1eb26-46ee-44b7-94ad-248ee3b0fbd3,102,5:59,Nic Claxton turnover (bad pass) (CJ McCollum steals),turnover,95,e0729403-9c95-4ee2-b5d4-f704d8322570,basketball_play,1771799945,53,True,2026-02-22 22:39:05+00:00,4,359.0,2521.0,42.016666666666666,402
1,53,quarter,4,e0729403-9c95-4ee2-b5d4-f704d8322570,102,5:54,Jalen Johnson misses three point running jump shot,threepointmiss,95,,basketball_play,1771799950,52,True,2026-02-22 22:39:10+00:00,4,354.0,2526.0,42.1,403
1,52,quarter,4,7cc1eb26-46ee-44b7-94ad-248ee3b0fbd3,102,5:50,Nic Claxton defensive rebound,rebound,95,7cc1eb26-46ee-44b7-94ad-248ee3b0fbd3,basketball_play,1771799954,51,True,2026-02-22 22:39:14+00:00,4,350.0,2530.0,42.166666666666664,404
1,51,quarter,4,7cc1eb26-46ee-44b7-94ad-248ee3b0fbd3,102,5:37,Egor Demin turnover (bad pass) (Dyson Daniels steals),turnover,95,e0729403-9c95-4ee2-b5d4-f704d8322570,basketball_play,1771799967,50,True,2026-02-22 22:39:27+00:00,4,337.0,2543.0,42.38333333333333,405
1,50,quarter,4,e0729403-9c95-4ee2-b5d4-f704d8322570,102,5:33,Jalen Johnson makes two point running dunk (Nickeil Alexander-Walker assists),twopointmade,97,7cc1eb26-46ee-44b7-94ad-248ee3b0fbd3,basketball_play,1771799971,49,True,2026-02-22 22:39:31+00:00,4,333.0,2547.0,42.45,406
1,49,quarter,4,7cc1eb26-46ee-44b7-94ad-248ee3b0fbd3,102,5:33,Nets 60 second timeout,teamtimeout,97,,basketball_play,1771799976,48,True,2026-02-22 22:39:36+00:00,4,333.0,2547.0,42.45,407
1,48,quarter,4,7cc1eb26-46ee-44b7-94ad-248ee3b0fbd3,102,5:33,"Nets lineup change (Noah Clowney, Nolan Traore, Nic Claxton, Michael Porter Jr., Egor Demin)",lineupchange,97,,basketball_play,1771800083,47,True,2026-02-22 22:41:23+00:00,4,333.0,2547.0,42.45,408
1,47,quarter,4,7cc1eb26-46ee-44b7-94ad-248ee3b0fbd3,104,5:19,Nic Claxton makes two point driving hook shot,twopointmade,97,e0729403-9c95-4ee2-b5d4-f704d8322570,basketball_play,1771800083,46,True,2026-02-22 22:41:23+00:00,4,319.0,2561.0,42.68333333333333,409
1,46,quarter,4,e0729403-9c95-4ee2-b5d4-f704d8322570,104,5:05,CJ McCollum makes three point jump shot (Jalen Johnson assists),threepointmade,100,7cc1eb26-46ee-44b7-94ad-248ee3b0fbd3,basketball_play,1771800099,45,True,2026-02-22 22:41:39+00:00,4,305.0,2575.0,42.916666666666664,410
1,45,quarter,4,7cc1eb26-46ee-44b7-94ad-248ee3b0fbd3,104,4:40,Egor Demin misses three point jump shot,threepointmiss,100,,basketball_play,1771800122,44,True,2026-02-22 22:42:02+00:00,4,280.0,2600.0,43.333333333333336,411
1,44,quarter,4,e0729403-9c95-4ee2-b5d4-f704d8322570,104,4:38,Jalen Johnson defensive rebound,rebound,100,e0729403-9c95-4ee2-b5d4-f704d8322570,basketball_play,1771800124,43,True,2026-02-22 22:42:04+00:00,4,278.0,2602.0,43.36666666666667,412
1,43,quarter,4,e0729403-9c95-4ee2-b5d4-f704d8322570,104,4:32,CJ McCollum misses three point jump shot,threepointmiss,100,,basketball_play,1771800132,42,True,2026-02-22 22:42:12+00:00,4,272.0,2608.0,43.46666666666667,413
1,42,quarter,4,7cc1eb26-46ee-44b7-94ad-248ee3b0fbd3,104,4:28,Michael Porter Jr. defensive rebound,rebound,100,7cc1eb26-46ee-44b7-94ad-248ee3b0fbd3,basketball_play,1771800136,41,True,2026-02-22 22:42:16+00:00,4,268.0,2612.0,43.53333333333333,414
1,41,quarter,4,7cc1eb26-46ee-44b7-94ad-248ee3b0fbd3,104,4:20,Nolan Traore turnover (out of bounds lost ball),turnover,100,e0729403-9c95-4ee2-b5d4-f704d8322570,basketball_play,1771800146,40,True,2026-02-22 22:42:26+00:00,4,260.0,2620.0,43.666666666666664,415
1,40,quarter,4,e0729403-9c95-4ee2-b5d4-f704d8322570,104,4:01,Jalen Johnson misses two point driving floating jump shot,twopointmiss,100,,basketball_play,1771800174,39,True,2026-02-22 22:42:54+00:00,4,241.0,2639.0,43.983333333333334,416
1,39,quarter,4,7cc1eb26-46ee-44b7-94ad-248ee3b0fbd3,104,3:57,Nic Claxton defensive rebound,rebound,100,7cc1eb26-46ee-44b7-94ad-248ee3b0fbd3,basketball_play,1771800178,38,True,2026-02-22 22:42:58+00:00,4,237.0,2643.0,44.05,417
1,38,quarter,4,7cc1eb26-46ee-44b7-94ad-248ee3b0fbd3,104,3:43,Egor Demin misses three point pullup jump shot,threepointmiss,100,,basketball_play,1771800192,37,True,2026-02-22 22:43:12+00:00,4,223.0,2657.0,44.28333333333333,418
1,37,quarter,4,e0729403-9c95-4ee2-b5d4-f704d8322570,104,3:41,Onyeka Okongwu defensive rebound,rebound,100,e0729403-9c95-4ee2-b5d4-f704d8322570,basketball_play,1771800194,36,True,2026-02-22 22:43:14+00:00,4,221.0,2659.0,44.31666666666667,419
1,36,quarter,4,7cc1eb26-46ee-44b7-94ad-248ee3b0fbd3,104,3:37,Nic Claxton personal foul (Dyson Daniels draws the foul),personalfoul,100,e0729403-9c95-4ee2-b5d4-f704d8322570,basketball_play,1771800201,35,True,2026-02-22 22:43:21+00:00,4,217.0,2663.0,44.38333333333333,420
1,35,quarter,4,e0729403-9c95-4ee2-b5d4-f704d8322570,104,3:27,Jalen Johnson makes two point pullup jump shot,twopointmade,102,7cc1eb26-46ee-44b7-94ad-248ee3b0fbd3,basketball_play,1771800230,34,True,2026-02-22 22:43:50+00:00,4,207.0,2673.0,44.55,421
1,34,quarter,4,7cc1eb26-46ee-44b7-94ad-248ee3b0fbd3,104,3:11,Nolan Traore misses two point driving floating bank jump shot,twopointmiss,102,,basketball_play,1771800247,33,True,2026-02-22 22:44:07+00:00,4,191.0,2689.0,44.81666666666667,422
1,33,quarter,4,7cc1eb26-46ee-44b7-94ad-248ee3b0fbd3,104,3:10,Nets offensive rebound,rebound,102,7cc1eb26-46ee-44b7-94ad-248ee3b0fbd3,basketball_play,1771800248,32,True,2026-02-22 22:44:08+00:00,4,190.0,2690.0,44.833333333333336,423
1,32,quarter,4,,104,3:10,Stoppage (Out of bounds),stoppage,102,,basketball_play,1771800253,31,True,2026-02-22 22:44:13+00:00,4,190.0,2690.0,44.833333333333336,424
