period_index,event_index,period_type,period_number,attribution,away_points,clock,description,event_type,home_points,possession,type,wall_clock,pbp_source_row,has_wall_clock,event_ts_utc,period_sequence,game_clock_seconds_remaining,game_elapsed_seconds,game_elapsed_minutes,pbp_chronological_index
4,118,quarter,1,7cc1eb26-46ee-44b7-94ad-248ee3b0fbd3,0,12:00,"Nets lineup change (Noah Clowney, Nolan Traore, Nic Claxton, Michael Porter Jr., Egor Demin)",lineupchange,0,,basketball_play,1771792834,454,True,2026-02-22 20:40:34+00:00,1,720.0,0.0,0.0,1
4,117,quarter,1,e0729403-9c95-4ee2-b5d4-f704d8322570,0,12:00,"Hawks lineup change (Dyson Daniels, Nickeil Alexander-Walker, CJ McCollum, Jalen Johnson, Onyeka Okongwu)",lineupchange,0,,basketball_play,1771792834,453,True,2026-02-22 20:40:34+00:00,1,720.0,0.0,0.0,2
4,116,quarter,1,,0,12:00,Start of 1st Quarter,startperiod,0,,basketball_play,1771792834,452,True,2026-02-22 20:40:34+00:00,1,720.0,0.0,0.0,3
4,115,quarter,1,7cc1eb26-46ee-44b7-94ad-248ee3b0fbd3,0,12:00,Nic Claxton vs. Onyeka Okongwu (Nolan Traore gains possession),opentip,0,7cc1eb26-46ee-44b7-94ad-248ee3b0fbd3,basketball_play,1771792838,451,True,2026-02-22 20:40:38+00:00,1,720.0,0.0,0.0,4
4,114,quarter,1,7cc1eb26-46ee-44b7-94ad-248ee3b0fbd3,0,11:45,Noah Clowney misses two point floating jump shot,twopointmiss,0,,basketball_play,1771792848,450,True,2026-02-22 20:40:48+00:00,1,705.0,15.0,0.25,5
4,113,quarter,1,e0729403-9c95-4ee2-b5d4-f704d8322570,0,11:42,Onyeka Okongwu defensive rebound,rebound,0,e0729403-9c95-4ee2-b5d4-f704d8322570,basketball_play,1771792851,449,True,2026-02-22 20:40:51+00:00,1,702.0,18.0,0.3,6
4,112,quarter,1,e0729403-9c95-4ee2-b5d4-f704d8322570,0,11:30,Jalen Johnson misses two point floating jump shot,twopointmiss,0,,basketball_play,1771792863,448,True,2026-02-22 20:41:03+00:00,1,690.0,30.0,0.5,7
4,111,quarter,1,7cc1eb26-46ee-44b7-94ad-248ee3b0fbd3,0,11:27,Nic Claxton defensive rebound,rebound,0,7cc1eb26-46ee-44b7-94ad-248ee3b0fbd3,basketball_play,1771792866,447,True,2026-02-22 20:41:06+00:00,1,687.0,33.0,0.55,8
4,110,quarter,1,7cc1eb26-46ee-44b7-94ad-248ee3b0fbd3,0,11:19,Noah Clowney misses three point jump shot,threepointmiss,0,,basketball_play,1771792874,446,True,2026-02-22 20:41:14+00:00,1,679.0,41.0,0.6833333333333333,9
4,109,quarter,1,e0729403-9c95-4ee2-b5d4-f704d8322570,0,11:15,Onyeka Okongwu defensive rebound,rebound,0,e0729403-9c95-4ee2-b5d4-f704d8322570,basketball_play,1771792878,445,True,2026-02-22 20:41:18+00:00,1,675.0,45.0,0.75,10
4,108,quarter,1,e0729403-9c95-4ee2-b5d4-f704d8322570,0,11:08,Onyeka Okongwu misses three point jump shot,threepointmiss,0,,basketball_play,1771792885,444,True,2026-02-22 20:41:25+00:00,1,668.0,52.0,0.8666666666666667,11
4,107,quarter,1,7cc1eb26-46ee-44b7-94ad-248ee3b0fbd3,0,11:05,Michael Porter Jr. defensive rebound,rebound,0,7cc1eb26-46ee-44b7-94ad-248ee3b0fbd3,basketball_play,1771792888,443,True,2026-02-22 20:41:28+00:00,1,665.0,55.0,0.9166666666666666,12
4,106,quarter,1,7cc1eb26-46ee-44b7-94ad-248ee3b0fbd3,0,10:52,Michael Porter Jr. misses two point turnaround fadeaway jump shot,twopointmiss,0,,basketball_play,1771792901,442,True,2026-02-22 20:41:41+00:00,1,652.0,68.0,1.1333333333333333,13
4,105,quarter,1,e0729403-9c95-4ee2-b5d4-f704d8322570,0,10:47,Onyeka Okongwu defensive rebound,rebound,0,e0729403-9c95-4ee2-b5d4-f704d8322570,basketball_play,1771792906,441,True,2026-02-22 20:41:46+00:00,1,647.0,73.0,1.2166666666666666,14
4,104,quarter,1,e0729403-9c95-4ee2-b5d4-f704d8322570,0,10:41,Jalen Johnson makes two point driving floating jump shot,twopointmade,2,7cc1eb26-46ee-44b7-94ad-248ee3b0fbd3,basketball_play,1771792912,440,True,2026-02-22 20:41:52+00:00,1,641.0,79.0,1.3166666666666667,15
4,103,quarter,1,7cc1eb26-46ee-44b7-94ad-248ee3b0fbd3,2,10:27,Michael Porter Jr. makes two point layup (Nic Claxton assists),twopointmade,2,e0729403-9c95-4ee2-b5d4-f704d8322570,basketball_play,1771792926,439,True,2026-02-22 20:42:06+00:00,1,627.0,93.0,1.55,16
4,102,quarter,1,e0729403-9c95-4ee2-b5d4-f704d8322570,2,10:14,Onyeka Okongwu turnover (bad pass) (Noah Clowney steals),turnover,2,7cc1eb26-46ee-44b7-94ad-248ee3b0fbd3,basketball_play,1771792939,438,True,2026-02-22 20:42:19+00:00,1,614.0,106.0,1.7666666666666666,17
4,101,quarter,1,7cc1eb26-46ee-44b7-94ad-248ee3b0fbd3,2,10:09,Onyeka Okongwu blocks Egor Demin's two point running layup,twopointmiss,2,,basketball_play,1771792944,437,True,2026-02-22 20:42:24+00:00,1,609.0,111.0,1.85,18
4,100,quarter,1,e0729403-9c95-4ee2-b5d4-f704d8322570,2,10:08,Dyson Daniels defensive rebound,rebound,2,e0729403-9c95-4ee2-b5d4-f704d8322570,basketball_play,1771792945,436,True,2026-02-22 20:42:25+00:00,1,608.0,112.0,1.8666666666666667,19
4,99,quarter,1,e0729403-9c95-4ee2-b5d4-f704d8322570,2,10:03,Dyson Daniels makes two point running layup,twopointmade,4,7cc1eb26-46ee-44b7-94ad-248ee3b0fbd3,basketball_play,1771792950,435,True,2026-02-22 20:42:30+00:00,1,603.0,117.0,1.95,20
4,98,quarter,1,7cc1eb26-46ee-44b7-94ad-248ee3b0fbd3,4,9:47,Nic Claxton makes two point cutting dunk (Michael Porter Jr. assists),twopointmade,4,e0729403-9c95-4ee2-b5d4-f704d8322570,basketball_play,1771792967,434,True,2026-02-22 20:42:47+00:00,1,587.0,133.0,2.216666666666667,21
4,97,quarter,1,e0729403-9c95-4ee2-b5d4-f704d8322570,4,9:39,CJ McCollum makes two point pullup jump shot,twopointmade,6,7cc1eb26-46ee-44b7-94ad-248ee3b0fbd3,basketball_play,1771792975,433,True,2026-02-22 20:42:55+00:00,1,579.0,141.0,2.35,22
4,96,quarter,1,7cc1eb26-46ee-44b7-94ad-248ee3b0fbd3,4,9:18,Nolan Traore turnover (out of bounds lost ball),turnover,6,e0729403-9c95-4ee2-b5d4-f704d8322570,basketball_play,1771792998,432,True,2026-02-22 20:43:18+00:00,1,558.0,162.0,2.7,23
4,95,quarter,1,e0729403-9c95-4ee2-b5d4-f704d8322570,4,9:04,Jalen Johnson makes two point driving layup (Onyeka Okongwu assists),twopointmade,8,7cc1eb26-46ee-44b7-94ad-248ee3b0fbd3,basketball_play,1771793022,431,True,2026-02-22 20:43:42+00:00,1,544.0,176.0,2.933333333333333,24
4,94,quarter,1,7cc1eb26-46ee-44b7-94ad-248ee3b0fbd3,4,8:48,Michael Porter Jr. misses three point jump shot,threepointmiss,8,,basketball_play,1771793037,430,True,2026-02-22 20:43:57+00:00,1,528.0,192.0,3.2,25
4,93,quarter,1,e0729403-9c95-4ee2-b5d4-f704d8322570,4,8:45,Jalen Johnson defensive rebound,rebound,8,e0729403-9c95-4ee2-b5d4-f704d8322570,basketball_play,1771793040,429,True,2026-02-22 20:44:00+00:00,1,525.0,195.0,3.25,26
4,92,quarter,1,e0729403-9c95-4ee2-b5d4-f704d8322570,4,8:35,CJ McCollum misses three point jump shot,threepointmiss,8,,basketball_play,1771793051,428,True,2026-02-22 20:44:11+00:00,1,515.0,205.0,3.4166666666666665,27
4,91,quarter,1,e0729403-9c95-4ee2-b5d4-f704d8322570,4,8:32,Onyeka Okongwu offensive rebound,rebound,8,e0729403-9c95-4ee2-b5d4-f704d8322570,basketball_play,1771793054,427,True,2026-02-22 20:44:14+00:00,1,512.0,208.0,3.466666666666667,28
4,90,quarter,1,e0729403-9c95-4ee2-b5d4-f704d8322570,4,8:25,Jalen Johnson misses two point driving layup,twopointmiss,8,,basketball_play,1771793062,426,True,2026-02-22 20:44:22+00:00,1,505.0,215.0,3.5833333333333335,29
4,89,quarter,1,e0729403-9c95-4ee2-b5d4-f704d8322570,4,8:24,Jalen Johnson offensive rebound,rebound,8,e0729403-9c95-4ee2-b5d4-f704d8322570,basketball_play,1771793063,425,True,2026-02-22 20:44:23+00:00,1,504.0,216.0,3.6,30
4,88,quarter,1,e0729403-9c95-4ee2-b5d4-f704d8322570,4,8:21,Jalen Johnson misses two point tip layup,twopointmiss,8,,basketball_play,1771793066,424,True,2026-02-22 20:44:26+00:00,1,501.0,219.0,3.65,31
4,87,quarter,1,e0729403-9c95-4ee2-b5d4-f704d8322570,4,8:20,Dyson Daniels offensive rebound,rebound,8,e0729403-9c95-4ee2-b5d4-f704d8322570,basketball_play,1771793067,423,True,2026-02-22 20:44:27+00:00,1,500.0,220.0,3.6666666666666665,32
4,86,quarter,1,e0729403-9c95-4ee2-b5d4-f704d8322570,4,8:16,CJ McCollum misses two point driving layup,twopointmiss,8,,basketball_play,1771793070,422,True,2026-02-22 20:44:30+00:00,1,496.0,224.0,3.7333333333333334,33
4,85,quarter,1,7cc1eb26-46ee-44b7-94ad-248ee3b0fbd3,4,8:14,Noah Clowney defensive rebound,rebound,8,7cc1eb26-46ee-44b7-94ad-248ee3b0fbd3,basketball_play,1771793072,421,True,2026-02-22 20:44:32+00:00,1,494.0,226.0,3.7666666666666666,34
4,84,quarter,1,7cc1eb26-46ee-44b7-94ad-248ee3b0fbd3,6,8:08,Nolan Traore makes two point driving floating jump shot (Noah Clowney assists),twopointmade,8,e0729403-9c95-4ee2-b5d4-f704d8322570,basketball_play,1771793079,420,True,2026-02-22 20:44:39+00:00,1,488.0,232.0,3.8666666666666667,35
4,83,quarter,1,7cc1eb26-46ee-44b7-94ad-248ee3b0fbd3,6,8:00,Michael Porter Jr. shooting foul (Nickeil Alexander-Walker draws the foul),shootingfoul,8,e0729403-9c95-4ee2-b5d4-f704d8322570,basketball_play,1771793086,419,True,2026-02-22 20:44:46+00:00,1,480.0,240.0,4.0,36
4,82,quarter,1,e0729403-9c95-4ee2-b5d4-f704d8322570,6,8:00,Nickeil Alexander-Walker makes regular free throw 1 of 2,freethrowmade,9,e0729403-9c95-4ee2-b5d4-f704d8322570,basketball_play,1771793122,418,True,2026-02-22 20:45:22+00:00,1,480.0,240.0,4.0,37
4,81,quarter,1,e0729403-9c95-4ee2-b5d4-f704d8322570,6,8:00,Nickeil Alexander-Walker makes regular free throw 2 of 2,freethrowmade,10,7cc1eb26-46ee-44b7-94ad-248ee3b0fbd3,basketball_play,1771793138,417,True,2026-02-22 20:45:38+00:00,1,480.0,240.0,4.0,38
4,80,quarter,1,7cc1eb26-46ee-44b7-94ad-248ee3b0fbd3,6,7:45,Michael Porter Jr. misses two point turnaround jump shot,twopointmiss,10,,basketball_play,1771793157,416,True,2026-02-22 20:45:57+00:00,1,465.0,255.0,4.25,39
4,79,quarter,1,e0729403-9c95-4ee2-b5d4-f704d8322570,6,7:43,Onyeka Okongwu defensive rebound,rebound,10,e0729403-9c95-4ee2-b5d4-f704d8322570,basketball_play,1771793159,415,True,2026-02-22 20:45:59+00:00,1,463.0,257.0,4.283333333333333,40
4,78,quarter,1,e0729403-9c95-4ee2-b5d4-f704d8322570,6,7:28,Nickeil Alexander-Walker makes three point pullup jump shot (Dyson Daniels assists),threepointmade,13,7cc1eb26-46ee-44b7-94ad-248ee3b0fbd3,basketball_play,1771793175,414,True,2026-02-22 20:46:15+00:00,1,448.0,272.0,4.533333333333333,41
4,77,quarter,1,7cc1eb26-46ee-44b7-94ad-248ee3b0fbd3,6,7:26,Nets 60 second timeout,teamtimeout,13,,basketball_play,1771793181,413,True,2026-02-22 20:46:21+00:00,1,446.0,274.0,4.566666666666666,42
4,76,quarter,1,e0729403-9c95-4ee2-b5d4-f704d8322570,6,7:26,"Hawks lineup change (Dyson Daniels, Gabe Vincent, Jalen Johnson, Onyeka Okongwu, Zaccharie Risacher)",lineupchange,13,,basketball_play,1771793291,412,True,2026-02-22 20:48:11+00:00,1,446.0,274.0,4.566666666666666,43
4,75,quarter,1,7cc1eb26-46ee-44b7-94ad-248ee3b0fbd3,8,7:10,Nic Claxton makes two point driving layup (Nolan Traore assists),twopointmade,13,e0729403-9c95-4ee2-b5d4-f704d8322570,basketball_play,1771793375,411,True,2026-02-22 20:49:35+00:00,1,430.0,290.0,4.833333333333333,44
4,74,quarter,1,e0729403-9c95-4ee2-b5d4-f704d8322570,8,7:10,Dyson Daniels shooting foul (Nic Claxton draws the foul),shootingfoul,13,7cc1eb26-46ee-44b7-94ad-248ee3b0fbd3,basketball_play,1771793380,410,True,2026-02-22 20:49:40+00:00,1,430.0,290.0,4.833333333333333,45
4,73,quarter,1,7cc1eb26-46ee-44b7-94ad-248ee3b0fbd3,8,7:10,Nic Claxton misses regular free throw 1 of 1,freethrowmiss,13,,basketball_play,1771793405,409,True,2026-02-22 20:50:05+00:00,1,430.0,290.0,4.833333333333333,46
4,72,quarter,1,e0729403-9c95-4ee2-b5d4-f704d8322570,8,7:07,Jalen Johnson defensive rebound,rebound,13,e0729403-9c95-4ee2-b5d4-f704d8322570,basketball_play,1771793408,408,True,2026-02-22 20:50:08+00:00,1,427.0,293.0,4.883333333333334,47
4,71,quarter,1,e0729403-9c95-4ee2-b5d4-f704d8322570,8,6:54,Dyson Daniels misses two point turnaround hook shot,twopointmiss,13,,basketball_play,1771793420,407,True,2026-02-22 20:50:20+00:00,1,414.0,306.0,5.1,48
4,70,quarter,1,7cc1eb26-46ee-44b7-94ad-248ee3b0fbd3,8,6:52,Noah Clowney defensive rebound,rebound,13,7cc1eb26-46ee-44b7-94ad-248ee3b0fbd3,basketball_play,1771793422,406,True,2026-02-22 20:50:22+00:00,1,412.0,308.0,5.133333333333334,49
4,69,quarter,1,7cc1eb26-46ee-44b7-94ad-248ee3b0fbd3,11,6:41,Noah Clowney makes three point jump shot (Egor Demin assists),threepointmade,13,e0729403-9c95-4ee2-b5d4-f704d8322570,basketball_play,1771793434,405,True,2026-02-22 20:50:34+00:00,1,401.0,319.0,5.316666666666666,50
4,68,quarter,1,e0729403-9c95-4ee2-b5d4-f704d8322570,11,6:28,Zaccharie Risacher makes three point jump shot (Jalen Johnson assists),threepointmade,16,7cc1eb26-46ee-44b7-94ad-248ee3b0fbd3,basketball_play,1771793446,404,True,2026-02-22 20:50:46+00:00,1,388.0,332.0,5.533333333333333,51
4,67,quarter,1,7cc1eb26-46ee-44b7-94ad-248ee3b0fbd3,13,6:07,Egor Demin makes two point stepback jump shot (Nolan Traore assists),twopointmade,16,e0729403-9c95-4ee2-b5d4-f704d8322570,basketball_play,1771793467,403,True,2026-02-22 20:51:07+00:00,1,367.0,353.0,5.883333333333334,52
4,66,quarter,1,e0729403-9c95-4ee2-b5d4-f704d8322570,13,5:49,Zaccharie Risacher makes two point driving floating jump shot (Dyson Daniels assists),twopointmade,18,7cc1eb26-46ee-44b7-94ad-248ee3b0fbd3,basketball_play,1771793485,402,True,2026-02-22 20:51:25+00:00,1,349.0,371.0,6.183333333333334,53
4,65,quarter,1,7cc1eb26-46ee-44b7-94ad-248ee3b0fbd3,13,5:35,Nolan Traore misses two point turnaround jump shot,twopointmiss,18,,basketball_play,1771793499,401,True,2026-02-22 20:51:39+00:00,1,335.0,385.0,6.416666666666667,54
4,64,quarter,1,e0729403-9c95-4ee2-b5d4-f704d8322570,13,5:32,Gabe Vincent defensive rebound,rebound,18,e0729403-9c95-4ee2-b5d4-f704d8322570,basketball_play,1771793502,400,True,2026-02-22 20:51:42+00:00,1,332.0,388.0,6.466666666666667,55
4,63,quarter,1,e0729403-9c95-4ee2-b5d4-f704d8322570,13,5:23,Gabe Vincent turnover (bad pass) (Egor Demin steals),turnover,18,7cc1eb26-46ee-44b7-94ad-248ee3b0fbd3,basketball_play,1771793511,399,True,2026-02-22 20:51:51+00:00,1,323.0,397.0,6.616666666666666,56
4,62,quarter,1,7cc1eb26-46ee-44b7-94ad-248ee3b0fbd3,13,5:17,Michael Porter Jr. misses three point running jump shot,threepointmiss,18,,basketball_play,1771793517,398,True,2026-02-22 20:51:57+00:00,1,317.0,403.0,6.716666666666667,57
4,61,quarter,1,7cc1eb26-46ee-44b7-94ad-248ee3b0fbd3,13,5:15,Nets offensive rebound,rebound,18,7cc1eb26-46ee-44b7-94ad-248ee3b0fbd3,basketball_play,1771793519,397,True,2026-02-22 20:51:59+00:00,1,315.0,405.0,6.75,58
4,60,quarter,1,,13,5:15,Stoppage (Out of bounds),stoppage,18,,basketball_play,1771793524,396,True,2026-02-22 20:52:04+00:00,1,315.0,405.0,6.75,59
4,59,quarter,1,7cc1eb26-46ee-44b7-94ad-248ee3b0fbd3,13,5:15,"Nets lineup change (Day'Ron Sharpe, Noah Clowney, Nolan Traore, Michael Porter Jr., Egor Demin)",lineupchange,18,,basketball_play,1771793526,395,True,2026-02-22 20:52:06+00:00,1,315.0,405.0,6.75,60
4,58,quarter,1,e0729403-9c95-4ee2-b5d4-f704d8322570,13,5:15,"Hawks lineup change (Dyson Daniels, Jock Landale, Gabe Vincent, Jalen Johnson, Zaccharie Risacher)",lineupchange,18,,basketball_play,1771793526,394,True,2026-02-22 20:52:06+00:00,1,315.0,405.0,6.75,61
4,57,quarter,1,e0729403-9c95-4ee2-b5d4-f704d8322570,13,5:14,Jalen Johnson shooting foul (Egor Demin draws the foul),shootingfoul,18,7cc1eb26-46ee-44b7-94ad-248ee3b0fbd3,basketball_play,1771793547,393,True,2026-02-22 20:52:27+00:00,1,314.0,406.0,6.766666666666667,62
4,56,quarter,1,7cc1eb26-46ee-44b7-94ad-248ee3b0fbd3,14,5:14,Egor Demin makes regular free throw 1 of 2,freethrowmade,18,7cc1eb26-46ee-44b7-94ad-248ee3b0fbd3,basketball_play,1771793573,392,True,2026-02-22 20:52:53+00:00,1,314.0,406.0,6.766666666666667,63
4,55,quarter,1,7cc1eb26-46ee-44b7-94ad-248ee3b0fbd3,14,5:14,Egor Demin misses regular free throw 2 of 2,freethrowmiss,18,,basketball_play,1771793573,391,True,2026-02-22 20:52:53+00:00,1,314.0,406.0,6.766666666666667,64
4,54,quarter,1,7cc1eb26-46ee-44b7-94ad-248ee3b0fbd3,14,5:13,Michael Porter Jr. offensive rebound,rebound,18,7cc1eb26-46ee-44b7-94ad-248ee3b0fbd3,basketball_play,1771793574,390,True,2026-02-22 20:52:54+00:00,1,313.0,407.0,6.783333333333333,65
4,53,quarter,1,7cc1eb26-46ee-44b7-94ad-248ee3b0fbd3,16,5:12,Michael Porter Jr. makes two point tip layup,twopointmade,18,e0729403-9c95-4ee2-b5d4-f704d8322570,basketball_play,1771793590,389,True,2026-02-22 20:53:10+00:00,1,312.0,408.0,6.8,66
4,52,quarter,1,e0729403-9c95-4ee2-b5d4-f704d8322570,16,4:59,Jalen Johnson turnover (bad pass) (Nolan Traore steals),turnover,18,7cc1eb26-46ee-44b7-94ad-248ee3b0fbd3,basketball_play,1771793600,388,True,2026-02-22 20:53:20+00:00,1,299.0,421.0,7.016666666666667,67
4,51,quarter,1,7cc1eb26-46ee-44b7-94ad-248ee3b0fbd3,18,4:56,Michael Porter Jr. makes two point running dunk (Nolan Traore assists),twopointmade,18,e0729403-9c95-4ee2-b5d4-f704d8322570,basketball_play,1771793604,387,True,2026-02-22 20:53:24+00:00,1,296.0,424.0,7.066666666666666,68
4,50,quarter,1,e0729403-9c95-4ee2-b5d4-f704d8322570,18,4:43,Jalen Johnson misses two point cutting dunk,twopointmiss,18,,basketball_play,1771793616,386,True,2026-02-22 20:53:36+00:00,1,283.0,437.0,7.283333333333333,69
4,49,quarter,1,7cc1eb26-46ee-44b7-94ad-248ee3b0fbd3,18,4:40,Day'Ron Sharpe defensive rebound,rebound,18,7cc1eb26-46ee-44b7-94ad-248ee3b0fbd3,basketball_play,1771793619,385,True,2026-02-22 20:53:39+00:00,1,280.0,440.0,7.333333333333333,70
4,48,quarter,1,7cc1eb26-46ee-44b7-94ad-248ee3b0fbd3,18,4:32,Noah Clowney misses three point jump shot,threepointmiss,18,,basketball_play,1771793627,384,True,2026-02-22 20:53:47+00:00,1,272.0,448.0,7.466666666666667,71
4,47,quarter,1,e0729403-9c95-4ee2-b5d4-f704d8322570,18,4:30,Jalen Johnson defensive rebound,rebound,18,e0729403-9c95-4ee2-b5d4-f704d8322570,basketball_play,1771793629,383,True,2026-02-22 20:53:49+00:00,1,270.0,450.0,7.5,72
4,46,quarter,1,,18,4:25,Stoppage (Out of bounds),stoppage,18,,basketball_play,1771793643,382,True,2026-02-22 20:54:03+00:00,1,265.0,455.0,7.583333333333333,73
4,45,quarter,1,7cc1eb26-46ee-44b7-94ad-248ee3b0fbd3,18,4:25,"Nets lineup change (Day'Ron Sharpe, Noah Clowney, Michael Porter Jr., Drake Powell, Terance Mann)",lineupchange,18,,basketball_play,1771793646,381,True,2026-02-22 20:54:06+00:00,1,265.0,455.0,7.583333333333333,74
4,44,quarter,1,e0729403-9c95-4ee2-b5d4-f704d8322570,18,4:13,Jock Landale makes three point jump shot (Dyson Daniels assists),threepointmade,21,7cc1eb26-46ee-44b7-94ad-248ee3b0fbd3,basketball_play,1771793668,380,True,2026-02-22 20:54:28+00:00,1,253.0,467.0,7.783333333333333,75
4,43,quarter,1,7cc1eb26-46ee-44b7-94ad-248ee3b0fbd3,20,4:01,Michael Porter Jr. makes two point layup (Day'Ron Sharpe assists),twopointmade,21,e0729403-9c95-4ee2-b5d4-f704d8322570,basketball_play,1771793682,379,True,2026-02-22 20:54:42+00:00,1,241.0,479.0,7.983333333333333,76
4,42,quarter,1,e0729403-9c95-4ee2-b5d4-f704d8322570,20,4:01,Zaccharie Risacher shooting foul (Michael Porter Jr. draws the foul),shootingfoul,21,7cc1eb26-46ee-44b7-94ad-248ee3b0fbd3,basketball_play,1771793685,378,True,2026-02-22 20:54:45+00:00,1,241.0,479.0,7.983333333333333,77
4,41,quarter,1,7cc1eb26-46ee-44b7-94ad-248ee3b0fbd3,20,4:01,"Nets lineup change (Day'Ron Sharpe, Danny Wolf, Michael Porter Jr., Drake Powell, Terance Mann)",lineupchange,21,,basketball_play,1771793708,377,True,2026-02-22 20:55:08+00:00,1,241.0,479.0,7.983333333333333,78
4,40,quarter,1,7cc1eb26-46ee-44b7-94ad-248ee3b0fbd3,21,4:01,Michael Porter Jr. makes regular free throw 1 of 1,freethrowmade,21,,basketball_play,1771793708,376,True,2026-02-22 20:55:08+00:00,1,241.0,479.0,7.983333333333333,79
4,39,quarter,1,e0729403-9c95-4ee2-b5d4-f704d8322570,21,3:48,Jock Landale makes three point jump shot (Gabe Vincent assists),threepointmade,24,7cc1eb26-46ee-44b7-94ad-248ee3b0fbd3,basketball_play,1771793721,375,True,2026-02-22 20:55:21+00:00,1,228.0,492.0,8.2,80
4,38,quarter,1,7cc1eb26-46ee-44b7-94ad-248ee3b0fbd3,23,3:23,Day'Ron Sharpe makes two point driving floating jump shot,twopointmade,24,e0729403-9c95-4ee2-b5d4-f704d8322570,basketball_play,1771793747,374,True,2026-02-22 20:55:47+00:00,1,203.0,517.0,8.616666666666667,81
4,37,quarter,1,e0729403-9c95-4ee2-b5d4-f704d8322570,23,3:05,Jalen Johnson misses two point driving floating bank jump shot,twopointmiss,24,,basketball_play,1771793765,373,True,2026-02-22 20:56:05+00:00,1,185.0,535.0,8.916666666666666,82
4,36,quarter,1,7cc1eb26-46ee-44b7-94ad-248ee3b0fbd3,23,3:00,Danny Wolf defensive rebound,rebound,24,7cc1eb26-46ee-44b7-94ad-248ee3b0fbd3,basketball_play,1771793770,372,True,2026-02-22 20:56:10+00:00,1,180.0,540.0,9.0,83
4,35,quarter,1,7cc1eb26-46ee-44b7-94ad-248ee3b0fbd3,25,2:55,Danny Wolf makes two point layup,twopointmade,24,e0729403-9c95-4ee2-b5d4-f704d8322570,basketball_play,1771793775,371,True,2026-02-22 20:56:15+00:00,1,175.0,545.0,9.083333333333334,84
4,34,quarter,1,e0729403-9c95-4ee2-b5d4-f704d8322570,25,2:55,Hawks 60 second timeout,teamtimeout,24,,basketball_play,1771793780,370,True,2026-02-22 20:56:20+00:00,1,175.0,545.0,9.083333333333334,85
4,33,quarter,1,7cc1eb26-46ee-44b7-94ad-248ee3b0fbd3,25,2:55,"Nets lineup change (Day'Ron Sharpe, Danny Wolf, Ochai Agbaji, Drake Powell, Terance Mann)",lineupchange,24,,basketball_play,1771793925,369,True,2026-02-22 20:58:45+00:00,1,175.0,545.0,9.083333333333334,86
4,32,quarter,1,e0729403-9c95-4ee2-b5d4-f704d8322570,25,2:55,"Hawks lineup change (Nickeil Alexander-Walker, Mouhamed Gueye, Jock Landale, CJ McCollum, Zaccharie Risacher)",lineupchange,24,,basketball_play,1771793925,368,True,2026-02-22 20:58:45+00:00,1,175.0,545.0,9.083333333333334,87
4,31,quarter,1,e0729403-9c95-4ee2-b5d4-f704d8322570,25,2:37,Ochai Agbaji blocks Jock Landale's two point cutting layup,twopointmiss,24,,basketball_play,1771793977,367,True,2026-02-22 20:59:37+00:00,1,157.0,563.0,9.383333333333333,88
4,30,quarter,1,e0729403-9c95-4ee2-b5d4-f704d8322570,25,2:36,Hawks offensive rebound,rebound,24,e0729403-9c95-4ee2-b5d4-f704d8322570,basketball_play,1771793978,366,True,2026-02-22 20:59:38+00:00,1,156.0,564.0,9.4,89
4,29,quarter,1,,25,2:36,Stoppage (Out of bounds),stoppage,24,,basketball_play,1771793982,365,True,2026-02-22 20:59:42+00:00,1,156.0,564.0,9.4,90
4,28,quarter,1,e0729403-9c95-4ee2-b5d4-f704d8322570,25,2:32,CJ McCollum misses two point driving floating jump shot,twopointmiss,24,,basketball_play,1771793998,364,True,2026-02-22 20:59:58+00:00,1,152.0,568.0,9.466666666666667,91
4,27,quarter,1,7cc1eb26-46ee-44b7-94ad-248ee3b0fbd3,25,2:31,Nets defensive rebound,rebound,24,7cc1eb26-46ee-44b7-94ad-248ee3b0fbd3,basketball_play,1771793999,363,True,2026-02-22 20:59:59+00:00,1,151.0,569.0,9.483333333333333,92
4,26,quarter,1,,25,2:31,Stoppage (Out of bounds),stoppage,24,,basketball_play,1771794002,362,True,2026-02-22 21:00:02+00:00,1,151.0,569.0,9.483333333333333,93
4,25,quarter,1,7cc1eb26-46ee-44b7-94ad-248ee3b0fbd3,25,2:15,Jock Landale blocks Drake Powell's two point driving layup,twopointmiss,24,,basketball_play,1771794019,361,True,2026-02-22 21:00:19+00:00,1,135.0,585.0,9.75,94
4,24,quarter,1,e0729403-9c95-4ee2-b5d4-f704d8322570,25,2:12,CJ McCollum defensive rebound,rebound,24,e0729403-9c95-4ee2-b5d4-f704d8322570,basketball_play,1771794022,360,True,2026-02-22 21:00:22+00:00,1,132.0,588.0,9.8,95
4,23,quarter,1,7cc1eb26-46ee-44b7-94ad-248ee3b0fbd3,25,2:12,Danny Wolf shooting foul (Nickeil Alexander-Walker draws the foul),shootingfoul,24,e0729403-9c95-4ee2-b5d4-f704d8322570,basketball_play,1771794026,359,True,2026-02-22 21:00:26+00:00,1,132.0,588.0,9.8,96
4,22,quarter,1,e0729403-9c95-4ee2-b5d4-f704d8322570,25,2:12,Nickeil Alexander-Walker makes regular free throw 1 of 2,freethrowmade,25,e0729403-9c95-4ee2-b5d4-f704d8322570,basketball_play,1771794050,358,True,2026-02-22 21:00:50+00:00,1,132.0,588.0,9.8,97
4,21,quarter,1,e0729403-9c95-4ee2-b5d4-f704d8322570,25,2:12,Nickeil Alexander-Walker makes regular free throw 2 of 2,freethrowmade,26,7cc1eb26-46ee-44b7-94ad-248ee3b0fbd3,basketball_play,1771794063,357,True,2026-02-22 21:01:03+00:00,1,132.0,588.0,9.8,98
4,20,quarter,1,7cc1eb26-46ee-44b7-94ad-248ee3b0fbd3,25,1:52,Terance Mann turnover (bad pass) (Mouhamed Gueye steals),turnover,26,e0729403-9c95-4ee2-b5d4-f704d8322570,basketball_play,1771794084,356,True,2026-02-22 21:01:24+00:00,1,112.0,608.0,10.133333333333333,99
4,19,quarter,1,7cc1eb26-46ee-44b7-94ad-248ee3b0fbd3,25,1:49,Danny Wolf shooting foul (Jock Landale draws the foul),shootingfoul,26,e0729403-9c95-4ee2-b5d4-f704d8322570,basketball_play,1771794088,355,True,2026-02-22 21:01:28+00:00,1,109.0,611.0,10.183333333333334,100
4,18,quarter,1,e0729403-9c95-4ee2-b5d4-f704d8322570,25,1:49,Jock Landale makes regular free throw 1 of 2,freethrowmade,27,e0729403-9c95-4ee2-b5d4-f704d8322570,basketball_play,1771794115,354,True,2026-02-22 21:01:55+00:00,1,109.0,611.0,10.183333333333334,101
4,17,quarter,1,e0729403-9c95-4ee2-b5d4-f704d8322570,25,1:49,Jock Landale makes regular free throw 2 of 2,freethrowmade,28,7cc1eb26-46ee-44b7-94ad-248ee3b0fbd3,basketball_play,1771794128,353,True,2026-02-22 21:02:08+00:00,1,109.0,611.0,10.183333333333334,102
4,16,quarter,1,7cc1eb26-46ee-44b7-94ad-248ee3b0fbd3,25,1:36,Day'Ron Sharpe turnover (lost ball) (Nickeil Alexander-Walker steals),turnover,28,e0729403-9c95-4ee2-b5d4-f704d8322570,basketball_play,1771794142,352,True,2026-02-22 21:02:22+00:00,1,96.0,624.0,10.4,103
4,15,quarter,1,e0729403-9c95-4ee2-b5d4-f704d8322570,25,1:27,Zaccharie Risacher makes two point cutting finger roll layup (Nickeil Alexander-Walker assists),twopointmade,30,7cc1eb26-46ee-44b7-94ad-248ee3b0fbd3,basketball_play,1771794151,351,True,2026-02-22 21:02:31+00:00,1,87.0,633.0,10.55,104
4,14,quarter,1,7cc1eb26-46ee-44b7-94ad-248ee3b0fbd3,28,1:16,Ochai Agbaji makes three point jump shot (Drake Powell assists),threepointmade,30,e0729403-9c95-4ee2-b5d4-f704d8322570,basketball_play,1771794162,350,True,2026-02-22 21:02:42+00:00,1,76.0,644.0,10.733333333333333,105
4,13,quarter,1,e0729403-9c95-4ee2-b5d4-f704d8322570,28,00:57.70,Zaccharie Risacher misses three point jump shot,threepointmiss,30,,basketball_play,1771794180,349,True,2026-02-22 21:03:00+00:00,1,57.7,662.3,11.038333333333332,106
