period_index,event_index,period_type,period_number,attribution,away_points,clock,description,event_type,home_points,possession,type,wall_clock,pbp_source_row,has_wall_clock,event_ts_utc,period_sequence,game_clock_seconds_remaining,game_elapsed_seconds,game_elapsed_minutes,pbp_chronological_index
4,4,quarter,1,daca4413-0ea1-4db2-a815-f05c181ef0a6,26,00:13.10,Kris Dunn makes two point driving layup (Bennedict Mathurin assists),twopointmade,25,00c3e69d-d9b9-4ac3-bf79-19707fe43637,basketball_play,1771814093,372,True,2026-02-23 02:34:53+00:00,1,13.1,706.9,11.781666666666666,105
4,3,quarter,1,00c3e69d-d9b9-4ac3-bf79-19707fe43637,29,00:00.40,Desmond Bane makes three point stepback jump shot (Jevon Carter assists),threepointmade,25,daca4413-0ea1-4db2-a815-f05c181ef0a6,basketball_play,1771814108,371,True,2026-02-23 02:35:08+00:00,1,0.4,719.6,11.993333333333334,106
4,2,quarter,1,,29,00:00,Instant replay (Request: Stands),review,25,,basketball_play,1771814115,370,True,2026-02-23 02:35:15+00:00,1,0.0,720.0,12.0,107
4,1,quarter,1,,29,00:00,End of 1st Quarter.,endperiod,25,,basketball_play,1771814124,369,True,2026-02-23 02:35:24+00:00,1,0.0,720.0,12.0,108
3,139,quarter,2,00c3e69d-d9b9-4ac3-bf79-19707fe43637,29,12:00,"Magic lineup change (Moritz Wagner, Wendell Carter Jr., Desmond Bane, Jevon Carter, Jase Richardson)",lineupchange,25,,basketball_play,1771814300,368,True,2026-02-23 02:38:20+00:00,2,720.0,720.0,12.0,109
3,138,quarter,2,,29,12:00,Start of 2nd Quarter,startperiod,25,,basketball_play,1771814300,367,True,2026-02-23 02:38:20+00:00,2,720.0,720.0,12.0,110
3,1,quarter,2,00c3e69d-d9b9-4ac3-bf79-19707fe43637,57,12:00,Paolo Banchero technical foul,technicalfoul,53,daca4413-0ea1-4db2-a815-f05c181ef0a6,basketball_play,1771817117,230,True,2026-02-23 03:25:17+00:00,2,720.0,720.0,12.0,111
3,137,quarter,2,00c3e69d-d9b9-4ac3-bf79-19707fe43637,29,11:48,Wendell Carter Jr. turnover (bad pass) (Kris Dunn steals),turnover,25,daca4413-0ea1-4db2-a815-f05c181ef0a6,basketball_play,1771814311,366,True,2026-02-23 02:38:31+00:00,2,708.0,732.0,12.2,112
3,136,quarter,2,daca4413-0ea1-4db2-a815-f05c181ef0a6,29,11:43,Bennedict Mathurin turnover (lost ball) (Jevon Carter steals),turnover,25,00c3e69d-d9b9-4ac3-bf79-19707fe43637,basketball_play,1771814316,365,True,2026-02-23 02:38:36+00:00,2,703.0,737.0,12.283333333333333,113
3,135,quarter,2,daca4413-0ea1-4db2-a815-f05c181ef0a6,29,11:41,Bennedict Mathurin flagrant 1 (Desmond Bane draws the foul),flagrantone,25,00c3e69d-d9b9-4ac3-bf79-19707fe43637,basketball_play,1771814320,364,True,2026-02-23 02:38:40+00:00,2,701.0,739.0,12.316666666666666,114
3,134,quarter,2,,29,11:41,Instant replay (Request: Ruling Overturned),review,25,,basketball_play,1771814345,363,True,2026-02-23 02:39:05+00:00,2,701.0,739.0,12.316666666666666,115
3,133,quarter,2,00c3e69d-d9b9-4ac3-bf79-19707fe43637,29,11:41,"Magic lineup change (Moritz Wagner, Wendell Carter Jr., Desmond Bane, Jase Richardson, Anthony Black)",lineupchange,25,,basketball_play,1771814450,362,True,2026-02-23 02:40:50+00:00,2,701.0,739.0,12.316666666666666,116
3,132,quarter,2,00c3e69d-d9b9-4ac3-bf79-19707fe43637,29,11:41,Desmond Bane misses flagrant free throw 1 of 2,freethrowmiss,25,00c3e69d-d9b9-4ac3-bf79-19707fe43637,basketball_play,1771814450,361,True,2026-02-23 02:40:50+00:00,2,701.0,739.0,12.316666666666666,117
3,131,quarter,2,00c3e69d-d9b9-4ac3-bf79-19707fe43637,29,11:41,Magic offensive rebound,rebound,25,00c3e69d-d9b9-4ac3-bf79-19707fe43637,basketball_play,1771814450,360,True,2026-02-23 02:40:50+00:00,2,701.0,739.0,12.316666666666666,118
3,130,quarter,2,00c3e69d-d9b9-4ac3-bf79-19707fe43637,30,11:41,Desmond Bane makes flagrant free throw 2 of 2,freethrowmade,25,daca4413-0ea1-4db2-a815-f05c181ef0a6,basketball_play,1771814450,359,True,2026-02-23 02:40:50+00:00,2,701.0,739.0,12.316666666666666,119
3,129,quarter,2,00c3e69d-d9b9-4ac3-bf79-19707fe43637,33,11:35,Desmond Bane makes three point jump shot (Wendell Carter Jr. assists),threepointmade,25,daca4413-0ea1-4db2-a815-f05c181ef0a6,basketball_play,1771814478,358,True,2026-02-23 02:41:18+00:00,2,695.0,745.0,12.416666666666666,120
3,128,quarter,2,daca4413-0ea1-4db2-a815-f05c181ef0a6,33,11:09,Yanic Konan Niederhauser misses three point jump shot,threepointmiss,25,,basketball_play,1771814504,357,True,2026-02-23 02:41:44+00:00,2,669.0,771.0,12.85,121
3,127,quarter,2,daca4413-0ea1-4db2-a815-f05c181ef0a6,33,11:09,Kris Dunn offensive rebound,rebound,25,daca4413-0ea1-4db2-a815-f05c181ef0a6,basketball_play,1771814504,356,True,2026-02-23 02:41:44+00:00,2,669.0,771.0,12.85,122
3,126,quarter,2,daca4413-0ea1-4db2-a815-f05c181ef0a6,33,11:09,Kris Dunn makes two point putback layup,twopointmade,27,00c3e69d-d9b9-4ac3-bf79-19707fe43637,basketball_play,1771814509,355,True,2026-02-23 02:41:49+00:00,2,669.0,771.0,12.85,123
3,125,quarter,2,00c3e69d-d9b9-4ac3-bf79-19707fe43637,33,11:09,Desmond Bane shooting foul (Kris Dunn draws the foul),shootingfoul,27,daca4413-0ea1-4db2-a815-f05c181ef0a6,basketball_play,1771814511,354,True,2026-02-23 02:41:51+00:00,2,669.0,771.0,12.85,124
3,124,quarter,2,daca4413-0ea1-4db2-a815-f05c181ef0a6,33,11:09,Kris Dunn misses regular free throw 1 of 1,freethrowmiss,27,,basketball_play,1771814549,353,True,2026-02-23 02:42:29+00:00,2,669.0,771.0,12.85,125
3,123,quarter,2,00c3e69d-d9b9-4ac3-bf79-19707fe43637,33,11:08,Moritz Wagner defensive rebound,rebound,27,00c3e69d-d9b9-4ac3-bf79-19707fe43637,basketball_play,1771814550,352,True,2026-02-23 02:42:30+00:00,2,668.0,772.0,12.866666666666667,126
3,122,quarter,2,00c3e69d-d9b9-4ac3-bf79-19707fe43637,33,10:51,Moritz Wagner turnover (lost ball) (Nicolas Batum steals),turnover,27,daca4413-0ea1-4db2-a815-f05c181ef0a6,basketball_play,1771814566,351,True,2026-02-23 02:42:46+00:00,2,651.0,789.0,13.15,127
3,121,quarter,2,daca4413-0ea1-4db2-a815-f05c181ef0a6,33,10:47,Bennedict Mathurin makes two point running alley-oop layup (Jordan Miller assists),twopointmade,29,00c3e69d-d9b9-4ac3-bf79-19707fe43637,basketball_play,1771814571,350,True,2026-02-23 02:42:51+00:00,2,647.0,793.0,13.216666666666667,128
3,120,quarter,2,00c3e69d-d9b9-4ac3-bf79-19707fe43637,33,10:32,Anthony Black misses three point stepback jump shot,threepointmiss,29,,basketball_play,1771814586,349,True,2026-02-23 02:43:06+00:00,2,632.0,808.0,13.466666666666667,129
3,119,quarter,2,daca4413-0ea1-4db2-a815-f05c181ef0a6,33,10:28,Nicolas Batum defensive rebound,rebound,29,daca4413-0ea1-4db2-a815-f05c181ef0a6,basketball_play,1771814590,348,True,2026-02-23 02:43:10+00:00,2,628.0,812.0,13.533333333333333,130
3,118,quarter,2,daca4413-0ea1-4db2-a815-f05c181ef0a6,33,10:21,Nicolas Batum misses three point jump shot,threepointmiss,29,,basketball_play,1771814597,347,True,2026-02-23 02:43:17+00:00,2,621.0,819.0,13.65,131
3,117,quarter,2,00c3e69d-d9b9-4ac3-bf79-19707fe43637,33,10:18,Jase Richardson defensive rebound,rebound,29,00c3e69d-d9b9-4ac3-bf79-19707fe43637,basketball_play,1771814600,346,True,2026-02-23 02:43:20+00:00,2,618.0,822.0,13.7,132
3,116,quarter,2,00c3e69d-d9b9-4ac3-bf79-19707fe43637,36,10:11,Desmond Bane makes three point jump shot (Jase Richardson assists),threepointmade,29,daca4413-0ea1-4db2-a815-f05c181ef0a6,basketball_play,1771814606,345,True,2026-02-23 02:43:26+00:00,2,611.0,829.0,13.816666666666666,133
3,115,quarter,2,daca4413-0ea1-4db2-a815-f05c181ef0a6,36,9:47,Bennedict Mathurin makes two point driving layup (Nicolas Batum assists),twopointmade,31,00c3e69d-d9b9-4ac3-bf79-19707fe43637,basketball_play,1771814635,344,True,2026-02-23 02:43:55+00:00,2,587.0,853.0,14.216666666666667,134
3,114,quarter,2,00c3e69d-d9b9-4ac3-bf79-19707fe43637,36,9:47,Anthony Black shooting foul (Bennedict Mathurin draws the foul),shootingfoul,31,daca4413-0ea1-4db2-a815-f05c181ef0a6,basketball_play,1771814638,343,True,2026-02-23 02:43:58+00:00,2,587.0,853.0,14.216666666666667,135
3,113,quarter,2,daca4413-0ea1-4db2-a815-f05c181ef0a6,36,9:47,"Clippers lineup change (Kawhi Leonard, Yanic Konan Niederhauser, Jordan Miller, Nicolas Batum, Bennedict Mathurin)",lineupchange,31,,basketball_play,1771814670,342,True,2026-02-23 02:44:30+00:00,2,587.0,853.0,14.216666666666667,136
3,112,quarter,2,daca4413-0ea1-4db2-a815-f05c181ef0a6,36,9:47,Bennedict Mathurin makes regular free throw 1 of 1,freethrowmade,32,,basketball_play,1771814670,341,True,2026-02-23 02:44:30+00:00,2,587.0,853.0,14.216666666666667,137
3,111,quarter,2,daca4413-0ea1-4db2-a815-f05c181ef0a6,36,9:39,Yanic Konan Niederhauser personal foul (Wendell Carter Jr. draws the foul),personalfoul,32,00c3e69d-d9b9-4ac3-bf79-19707fe43637,basketball_play,1771814684,340,True,2026-02-23 02:44:44+00:00,2,579.0,861.0,14.35,138
3,110,quarter,2,00c3e69d-d9b9-4ac3-bf79-19707fe43637,36,9:39,"Magic lineup change (Wendell Carter Jr., Desmond Bane, Paolo Banchero, Jase Richardson, Anthony Black)",lineupchange,32,,basketball_play,1771814716,339,True,2026-02-23 02:45:16+00:00,2,579.0,861.0,14.35,139
3,109,quarter,2,00c3e69d-d9b9-4ac3-bf79-19707fe43637,36,9:30,Desmond Bane misses three point pullup jump shot,threepointmiss,32,,basketball_play,1771814716,338,True,2026-02-23 02:45:16+00:00,2,570.0,870.0,14.5,140
3,108,quarter,2,daca4413-0ea1-4db2-a815-f05c181ef0a6,36,9:27,Kawhi Leonard defensive rebound,rebound,32,daca4413-0ea1-4db2-a815-f05c181ef0a6,basketball_play,1771814719,337,True,2026-02-23 02:45:19+00:00,2,567.0,873.0,14.55,141
3,107,quarter,2,daca4413-0ea1-4db2-a815-f05c181ef0a6,36,9:21,Nicolas Batum misses three point pullup jump shot,threepointmiss,32,,basketball_play,1771814725,336,True,2026-02-23 02:45:25+00:00,2,561.0,879.0,14.65,142
3,106,quarter,2,00c3e69d-d9b9-4ac3-bf79-19707fe43637,36,9:18,Desmond Bane defensive rebound,rebound,32,00c3e69d-d9b9-4ac3-bf79-19707fe43637,basketball_play,1771814728,335,True,2026-02-23 02:45:28+00:00,2,558.0,882.0,14.7,143
3,105,quarter,2,00c3e69d-d9b9-4ac3-bf79-19707fe43637,36,9:13,Desmond Bane misses two point running pullup jump shot,twopointmiss,32,,basketball_play,1771814733,334,True,2026-02-23 02:45:33+00:00,2,553.0,887.0,14.783333333333333,144
3,104,quarter,2,00c3e69d-d9b9-4ac3-bf79-19707fe43637,36,9:13,Desmond Bane offensive rebound,rebound,32,00c3e69d-d9b9-4ac3-bf79-19707fe43637,basketball_play,1771814733,333,True,2026-02-23 02:45:33+00:00,2,553.0,887.0,14.783333333333333,145
3,103,quarter,2,00c3e69d-d9b9-4ac3-bf79-19707fe43637,36,9:05,Paolo Banchero misses two point driving layup,twopointmiss,32,,basketball_play,1771814740,332,True,2026-02-23 02:45:40+00:00,2,545.0,895.0,14.916666666666666,146
3,102,quarter,2,00c3e69d-d9b9-4ac3-bf79-19707fe43637,36,9:03,Wendell Carter Jr. offensive rebound,rebound,32,00c3e69d-d9b9-4ac3-bf79-19707fe43637,basketball_play,1771814744,331,True,2026-02-23 02:45:44+00:00,2,543.0,897.0,14.95,147
3,101,quarter,2,00c3e69d-d9b9-4ac3-bf79-19707fe43637,36,9:02,Nicolas Batum blocks Wendell Carter Jr.'s two point putback layup,twopointmiss,32,,basketball_play,1771814745,330,True,2026-02-23 02:45:45+00:00,2,542.0,898.0,14.966666666666667,148
3,100,quarter,2,00c3e69d-d9b9-4ac3-bf79-19707fe43637,36,8:58,Desmond Bane offensive rebound,rebound,32,00c3e69d-d9b9-4ac3-bf79-19707fe43637,basketball_play,1771814749,329,True,2026-02-23 02:45:49+00:00,2,538.0,902.0,15.033333333333333,149
3,99,quarter,2,00c3e69d-d9b9-4ac3-bf79-19707fe43637,36,8:54,Desmond Bane misses two point stepback jump shot,twopointmiss,32,,basketball_play,1771814752,328,True,2026-02-23 02:45:52+00:00,2,534.0,906.0,15.1,150
3,98,quarter,2,daca4413-0ea1-4db2-a815-f05c181ef0a6,36,8:49,Yanic Konan Niederhauser defensive rebound,rebound,32,daca4413-0ea1-4db2-a815-f05c181ef0a6,basketball_play,1771814757,327,True,2026-02-23 02:45:57+00:00,2,529.0,911.0,15.183333333333334,151
3,97,quarter,2,daca4413-0ea1-4db2-a815-f05c181ef0a6,36,8:39,Kawhi Leonard makes two point driving reverse layup,twopointmade,34,00c3e69d-d9b9-4ac3-bf79-19707fe43637,basketball_play,1771814767,326,True,2026-02-23 02:46:07+00:00,2,519.0,921.0,15.35,152
3,96,quarter,2,00c3e69d-d9b9-4ac3-bf79-19707fe43637,38,8:17,Paolo Banchero makes two point driving layup,twopointmade,34,daca4413-0ea1-4db2-a815-f05c181ef0a6,basketball_play,1771814789,325,True,2026-02-23 02:46:29+00:00,2,497.0,943.0,15.716666666666667,153
3,95,quarter,2,daca4413-0ea1-4db2-a815-f05c181ef0a6,38,8:05,Bennedict Mathurin misses two point pullup jump shot,twopointmiss,34,,basketball_play,1771814801,324,True,2026-02-23 02:46:41+00:00,2,485.0,955.0,15.916666666666666,154
3,94,quarter,2,daca4413-0ea1-4db2-a815-f05c181ef0a6,38,8:04,Bennedict Mathurin offensive rebound,rebound,34,daca4413-0ea1-4db2-a815-f05c181ef0a6,basketball_play,1771814802,323,True,2026-02-23 02:46:42+00:00,2,484.0,956.0,15.933333333333334,155
3,93,quarter,2,00c3e69d-d9b9-4ac3-bf79-19707fe43637,38,7:58,Jase Richardson shooting foul (Jordan Miller draws the foul),shootingfoul,34,daca4413-0ea1-4db2-a815-f05c181ef0a6,basketball_play,1771814811,322,True,2026-02-23 02:46:51+00:00,2,478.0,962.0,16.033333333333335,156
3,92,quarter,2,daca4413-0ea1-4db2-a815-f05c181ef0a6,38,7:58,Jordan Miller makes regular free throw 1 of 2,freethrowmade,35,daca4413-0ea1-4db2-a815-f05c181ef0a6,basketball_play,1771814838,321,True,2026-02-23 02:47:18+00:00,2,478.0,962.0,16.033333333333335,157
3,91,quarter,2,00c3e69d-d9b9-4ac3-bf79-19707fe43637,38,7:58,"Magic lineup change (Wendell Carter Jr., Desmond Bane, Tristan da Silva, Paolo Banchero, Anthony Black)",lineupchange,35,,basketball_play,1771814839,320,True,2026-02-23 02:47:19+00:00,2,478.0,962.0,16.033333333333335,158
3,90,quarter,2,daca4413-0ea1-4db2-a815-f05c181ef0a6,38,7:58,"Clippers lineup change (Derrick Jones Jr., Kawhi Leonard, Brook Lopez, Jordan Miller, Bennedict Mathurin)",lineupchange,35,,basketball_play,1771814839,319,True,2026-02-23 02:47:19+00:00,2,478.0,962.0,16.033333333333335,159
3,89,quarter,2,daca4413-0ea1-4db2-a815-f05c181ef0a6,38,7:58,Jordan Miller makes regular free throw 2 of 2,freethrowmade,36,00c3e69d-d9b9-4ac3-bf79-19707fe43637,basketball_play,1771814867,318,True,2026-02-23 02:47:47+00:00,2,478.0,962.0,16.033333333333335,160
3,88,quarter,2,00c3e69d-d9b9-4ac3-bf79-19707fe43637,38,7:42,Jordan Miller blocks Wendell Carter Jr.'s two point cutting layup,twopointmiss,36,,basketball_play,1771814883,317,True,2026-02-23 02:48:03+00:00,2,462.0,978.0,16.3,161
3,87,quarter,2,00c3e69d-d9b9-4ac3-bf79-19707fe43637,38,7:41,Wendell Carter Jr. offensive rebound,rebound,36,00c3e69d-d9b9-4ac3-bf79-19707fe43637,basketball_play,1771814884,316,True,2026-02-23 02:48:04+00:00,2,461.0,979.0,16.316666666666666,162
3,86,quarter,2,00c3e69d-d9b9-4ac3-bf79-19707fe43637,40,7:41,Wendell Carter Jr. makes two point putback layup,twopointmade,36,daca4413-0ea1-4db2-a815-f05c181ef0a6,basketball_play,1771814888,315,True,2026-02-23 02:48:08+00:00,2,461.0,979.0,16.316666666666666,163
3,85,quarter,2,daca4413-0ea1-4db2-a815-f05c181ef0a6,40,7:41,Jordan Miller shooting foul (Wendell Carter Jr. draws the foul),shootingfoul,36,00c3e69d-d9b9-4ac3-bf79-19707fe43637,basketball_play,1771814891,314,True,2026-02-23 02:48:11+00:00,2,461.0,979.0,16.316666666666666,164
3,84,quarter,2,00c3e69d-d9b9-4ac3-bf79-19707fe43637,41,7:41,Wendell Carter Jr. makes regular free throw 1 of 1,freethrowmade,36,,basketball_play,1771814918,313,True,2026-02-23 02:48:38+00:00,2,461.0,979.0,16.316666666666666,165
3,83,quarter,2,daca4413-0ea1-4db2-a815-f05c181ef0a6,41,7:26,Derrick Jones Jr. misses three point jump shot,threepointmiss,36,,basketball_play,1771814935,312,True,2026-02-23 02:48:55+00:00,2,446.0,994.0,16.566666666666666,166
3,82,quarter,2,00c3e69d-d9b9-4ac3-bf79-19707fe43637,41,7:23,Paolo Banchero defensive rebound,rebound,36,00c3e69d-d9b9-4ac3-bf79-19707fe43637,basketball_play,1771814938,311,True,2026-02-23 02:48:58+00:00,2,443.0,997.0,16.616666666666667,167
3,81,quarter,2,00c3e69d-d9b9-4ac3-bf79-19707fe43637,41,7:16,Wendell Carter Jr. misses three point jump shot,threepointmiss,36,,basketball_play,1771814944,310,True,2026-02-23 02:49:04+00:00,2,436.0,1004.0,16.733333333333334,168
3,80,quarter,2,daca4413-0ea1-4db2-a815-f05c181ef0a6,41,7:13,Bennedict Mathurin defensive rebound,rebound,36,daca4413-0ea1-4db2-a815-f05c181ef0a6,basketball_play,1771814947,309,True,2026-02-23 02:49:07+00:00,2,433.0,1007.0,16.783333333333335,169
3,79,quarter,2,daca4413-0ea1-4db2-a815-f05c181ef0a6,41,7:10,Kawhi Leonard misses three point running jump shot,threepointmiss,36,,basketball_play,1771814951,308,True,2026-02-23 02:49:11+00:00,2,430.0,1010.0,16.833333333333332,170
3,78,quarter,2,00c3e69d-d9b9-4ac3-bf79-19707fe43637,41,7:06,Anthony Black defensive rebound,rebound,36,00c3e69d-d9b9-4ac3-bf79-19707fe43637,basketball_play,1771814955,307,True,2026-02-23 02:49:15+00:00,2,426.0,1014.0,16.9,171
3,77,quarter,2,00c3e69d-d9b9-4ac3-bf79-19707fe43637,41,7:00,Paolo Banchero misses two point running layup,twopointmiss,36,,basketball_play,1771814960,306,True,2026-02-23 02:49:20+00:00,2,420.0,1020.0,17.0,172
3,76,quarter,2,daca4413-0ea1-4db2-a815-f05c181ef0a6,41,6:58,Kawhi Leonard defensive rebound,rebound,36,daca4413-0ea1-4db2-a815-f05c181ef0a6,basketball_play,1771814962,305,True,2026-02-23 02:49:22+00:00,2,418.0,1022.0,17.033333333333335,173
3,75,quarter,2,00c3e69d-d9b9-4ac3-bf79-19707fe43637,41,6:56,Anthony Black personal foul (Derrick Jones Jr. draws the foul),personalfoul,36,daca4413-0ea1-4db2-a815-f05c181ef0a6,basketball_play,1771814967,304,True,2026-02-23 02:49:27+00:00,2,416.0,1024.0,17.066666666666666,174
3,74,quarter,2,daca4413-0ea1-4db2-a815-f05c181ef0a6,41,6:56,Clippers 60 second timeout,teamtimeout,36,,basketball_play,1771814974,303,True,2026-02-23 02:49:34+00:00,2,416.0,1024.0,17.066666666666666,175
3,73,quarter,2,00c3e69d-d9b9-4ac3-bf79-19707fe43637,41,6:56,"Magic lineup change (Wendell Carter Jr., Tristan da Silva, Paolo Banchero, Jett Howard, Anthony Black)",lineupchange,36,,basketball_play,1771815169,302,True,2026-02-23 02:52:49+00:00,2,416.0,1024.0,17.066666666666666,176
3,72,quarter,2,daca4413-0ea1-4db2-a815-f05c181ef0a6,41,6:45,Bennedict Mathurin makes two point pullup jump shot,twopointmade,38,00c3e69d-d9b9-4ac3-bf79-19707fe43637,basketball_play,1771815169,301,True,2026-02-23 02:52:49+00:00,2,405.0,1035.0,17.25,177
3,71,quarter,2,daca4413-0ea1-4db2-a815-f05c181ef0a6,41,6:28,Clippers technical foul (Defensive three second),technicalfoulnonunsportsmanlike,38,00c3e69d-d9b9-4ac3-bf79-19707fe43637,basketball_play,1771815192,300,True,2026-02-23 02:53:12+00:00,2,388.0,1052.0,17.533333333333335,178
3,70,quarter,2,00c3e69d-d9b9-4ac3-bf79-19707fe43637,42,6:28,Paolo Banchero makes technical free throw 1 of 1,freethrowmade,38,,basketball_play,1771815213,299,True,2026-02-23 02:53:33+00:00,2,388.0,1052.0,17.533333333333335,179
3,69,quarter,2,,42,6:28,Stoppage (Out of bounds),stoppage,38,,basketball_play,1771815230,298,True,2026-02-23 02:53:50+00:00,2,388.0,1052.0,17.533333333333335,180
3,68,quarter,2,00c3e69d-d9b9-4ac3-bf79-19707fe43637,44,6:19,Paolo Banchero makes two point fadeaway jump shot,twopointmade,38,daca4413-0ea1-4db2-a815-f05c181ef0a6,basketball_play,1771815243,297,True,2026-02-23 02:54:03+00:00,2,379.0,1061.0,17.683333333333334,181
3,67,quarter,2,daca4413-0ea1-4db2-a815-f05c181ef0a6,44,5:57,Derrick Jones Jr. makes two point driving floating jump shot (Bennedict Mathurin assists),twopointmade,40,00c3e69d-d9b9-4ac3-bf79-19707fe43637,basketball_play,1771815265,296,True,2026-02-23 02:54:25+00:00,2,357.0,1083.0,18.05,182
3,66,quarter,2,00c3e69d-d9b9-4ac3-bf79-19707fe43637,44,5:42,Jett Howard turnover (bad pass) (Kawhi Leonard steals),turnover,40,daca4413-0ea1-4db2-a815-f05c181ef0a6,basketball_play,1771815280,295,True,2026-02-23 02:54:40+00:00,2,342.0,1098.0,18.3,183
3,65,quarter,2,daca4413-0ea1-4db2-a815-f05c181ef0a6,44,5:38,Kawhi Leonard makes two point running dunk (Bennedict Mathurin assists),twopointmade,42,00c3e69d-d9b9-4ac3-bf79-19707fe43637,basketball_play,1771815284,294,True,2026-02-23 02:54:44+00:00,2,338.0,1102.0,18.366666666666667,184
3,64,quarter,2,00c3e69d-d9b9-4ac3-bf79-19707fe43637,46,5:24,Paolo Banchero makes two point pullup jump shot,twopointmade,42,daca4413-0ea1-4db2-a815-f05c181ef0a6,basketball_play,1771815298,293,True,2026-02-23 02:54:58+00:00,2,324.0,1116.0,18.6,185
3,63,quarter,2,daca4413-0ea1-4db2-a815-f05c181ef0a6,46,5:17,Jordan Miller makes two point driving layup (Derrick Jones Jr. assists),twopointmade,44,00c3e69d-d9b9-4ac3-bf79-19707fe43637,basketball_play,1771815306,292,True,2026-02-23 02:55:06+00:00,2,317.0,1123.0,18.716666666666665,186
3,62,quarter,2,00c3e69d-d9b9-4ac3-bf79-19707fe43637,46,5:02,Jett Howard misses three point jump shot,threepointmiss,44,,basketball_play,1771815320,291,True,2026-02-23 02:55:20+00:00,2,302.0,1138.0,18.966666666666665,187
3,61,quarter,2,daca4413-0ea1-4db2-a815-f05c181ef0a6,46,5:02,Clippers defensive rebound,rebound,44,daca4413-0ea1-4db2-a815-f05c181ef0a6,basketball_play,1771815320,290,True,2026-02-23 02:55:20+00:00,2,302.0,1138.0,18.966666666666665,188
3,60,quarter,2,,46,5:02,Stoppage (Out of bounds),stoppage,44,,basketball_play,1771815327,289,True,2026-02-23 02:55:27+00:00,2,302.0,1138.0,18.966666666666665,189
3,59,quarter,2,daca4413-0ea1-4db2-a815-f05c181ef0a6,46,4:46,Kawhi Leonard misses two point turnaround fadeaway jump shot,twopointmiss,44,,basketball_play,1771815349,288,True,2026-02-23 02:55:49+00:00,2,286.0,1154.0,19.233333333333334,190
3,58,quarter,2,00c3e69d-d9b9-4ac3-bf79-19707fe43637,46,4:44,Paolo Banchero defensive rebound,rebound,44,00c3e69d-d9b9-4ac3-bf79-19707fe43637,basketball_play,1771815351,287,True,2026-02-23 02:55:51+00:00,2,284.0,1156.0,19.266666666666666,191
3,57,quarter,2,00c3e69d-d9b9-4ac3-bf79-19707fe43637,49,4:37,Anthony Black makes three point jump shot (Paolo Banchero assists),threepointmade,44,daca4413-0ea1-4db2-a815-f05c181ef0a6,basketball_play,1771815359,286,True,2026-02-23 02:55:59+00:00,2,277.0,1163.0,19.383333333333333,192
3,56,quarter,2,daca4413-0ea1-4db2-a815-f05c181ef0a6,49,4:23,Kawhi Leonard misses two point floating jump shot,twopointmiss,44,,basketball_play,1771815371,285,True,2026-02-23 02:56:11+00:00,2,263.0,1177.0,19.616666666666667,193
3,55,quarter,2,00c3e69d-d9b9-4ac3-bf79-19707fe43637,49,4:21,Tristan da Silva defensive rebound,rebound,44,00c3e69d-d9b9-4ac3-bf79-19707fe43637,basketball_play,1771815373,284,True,2026-02-23 02:56:13+00:00,2,261.0,1179.0,19.65,194
3,54,quarter,2,00c3e69d-d9b9-4ac3-bf79-19707fe43637,49,4:14,Anthony Black misses three point pullup jump shot,threepointmiss,44,,basketball_play,1771815381,283,True,2026-02-23 02:56:21+00:00,2,254.0,1186.0,19.766666666666666,195
3,53,quarter,2,daca4413-0ea1-4db2-a815-f05c181ef0a6,49,4:11,Bennedict Mathurin defensive rebound,rebound,44,daca4413-0ea1-4db2-a815-f05c181ef0a6,basketball_play,1771815384,282,True,2026-02-23 02:56:24+00:00,2,251.0,1189.0,19.816666666666666,196
3,52,quarter,2,daca4413-0ea1-4db2-a815-f05c181ef0a6,49,3:59,Kawhi Leonard makes two point turnaround bank jump shot,twopointmade,46,00c3e69d-d9b9-4ac3-bf79-19707fe43637,basketball_play,1771815398,281,True,2026-02-23 02:56:38+00:00,2,239.0,1201.0,20.016666666666666,197
3,51,quarter,2,00c3e69d-d9b9-4ac3-bf79-19707fe43637,49,3:59,Tristan da Silva shooting foul (Kawhi Leonard draws the foul),shootingfoul,46,daca4413-0ea1-4db2-a815-f05c181ef0a6,basketball_play,1771815405,280,True,2026-02-23 02:56:45+00:00,2,239.0,1201.0,20.016666666666666,198
3,50,quarter,2,00c3e69d-d9b9-4ac3-bf79-19707fe43637,49,3:59,"Magic lineup change (Tristan da Silva, Paolo Banchero, Jett Howard, Anthony Black, Jonathan Isaac)",lineupchange,46,,basketball_play,1771815411,279,True,2026-02-23 02:56:51+00:00,2,239.0,1201.0,20.016666666666666,199
3,49,quarter,2,daca4413-0ea1-4db2-a815-f05c181ef0a6,49,3:59,"Clippers lineup change (Derrick Jones Jr., Kawhi Leonard, Brook Lopez, Jordan Miller, Kris Dunn)",lineupchange,46,,basketball_play,1771815411,278,True,2026-02-23 02:56:51+00:00,2,239.0,1201.0,20.016666666666666,200
3,48,quarter,2,daca4413-0ea1-4db2-a815-f05c181ef0a6,49,3:59,Kawhi Leonard misses regular free throw 1 of 1,freethrowmiss,46,,basketball_play,1771815432,277,True,2026-02-23 02:57:12+00:00,2,239.0,1201.0,20.016666666666666,201
3,47,quarter,2,00c3e69d-d9b9-4ac3-bf79-19707fe43637,49,3:56,Jonathan Isaac defensive rebound,rebound,46,00c3e69d-d9b9-4ac3-bf79-19707fe43637,basketball_play,1771815435,276,True,2026-02-23 02:57:15+00:00,2,236.0,1204.0,20.066666666666666,202
3,46,quarter,2,daca4413-0ea1-4db2-a815-f05c181ef0a6,49,3:45,Brook Lopez shooting foul (Tristan da Silva draws the foul),shootingfoul,46,00c3e69d-d9b9-4ac3-bf79-19707fe43637,basketball_play,1771815448,275,True,2026-02-23 02:57:28+00:00,2,225.0,1215.0,20.25,203
3,45,quarter,2,00c3e69d-d9b9-4ac3-bf79-19707fe43637,50,3:45,Tristan da Silva makes regular free throw 1 of 2,freethrowmade,46,00c3e69d-d9b9-4ac3-bf79-19707fe43637,basketball_play,1771815481,274,True,2026-02-23 02:58:01+00:00,2,225.0,1215.0,20.25,204
3,44,quarter,2,daca4413-0ea1-4db2-a815-f05c181ef0a6,50,3:45,"Clippers lineup change (Derrick Jones Jr., Brook Lopez, Jordan Miller, Kobe Sanders, Kris Dunn)",lineupchange,46,,basketball_play,1771815509,273,True,2026-02-23 02:58:29+00:00,2,225.0,1215.0,20.25,205
3,43,quarter,2,00c3e69d-d9b9-4ac3-bf79-19707fe43637,51,3:45,Tristan da Silva makes regular free throw 2 of 2,freethrowmade,46,daca4413-0ea1-4db2-a815-f05c181ef0a6,basketball_play,1771815509,272,True,2026-02-23 02:58:29+00:00,2,225.0,1215.0,20.25,206
3,42,quarter,2,daca4413-0ea1-4db2-a815-f05c181ef0a6,51,3:33,Jonathan Isaac blocks Jordan Miller's two point driving floating jump shot,twopointmiss,46,,basketball_play,1771815523,271,True,2026-02-23 02:58:43+00:00,2,213.0,1227.0,20.45,207
3,41,quarter,2,00c3e69d-d9b9-4ac3-bf79-19707fe43637,51,3:30,Paolo Banchero defensive rebound,rebound,46,00c3e69d-d9b9-4ac3-bf79-19707fe43637,basketball_play,1771815526,270,True,2026-02-23 02:58:46+00:00,2,210.0,1230.0,20.5,208
3,40,quarter,2,,51,3:16,Stoppage (Out of bounds),stoppage,46,,basketball_play,1771815542,269,True,2026-02-23 02:59:02+00:00,2,196.0,1244.0,20.733333333333334,209
