period_index,event_index,period_type,period_number,attribution,away_points,clock,description,event_type,home_points,possession,type,wall_clock,pbp_source_row,has_wall_clock,event_ts_utc,period_sequence,game_clock_seconds_remaining,game_elapsed_seconds,game_elapsed_minutes,pbp_chronological_index
4,18,quarter,1,a8625e4b-4ae6-4062-a7c1-0b6e1f4ae211,29,00:55.50,Amen Thompson defensive rebound,rebound,28,a8625e4b-4ae6-4062-a7c1-0b6e1f4ae211,basketball_play,1774139801,358,True,2026-03-22 00:36:41+00:00,1,55.5,664.5,11.075,107
4,17,quarter,1,a17e4a68-2999-4f60-b67e-3e80aa9e198b,29,00:45,Bam Adebayo personal foul (Jabari Smith Jr. draws the foul),personalfoul,28,a8625e4b-4ae6-4062-a7c1-0b6e1f4ae211,basketball_play,1774139815,357,True,2026-03-22 00:36:55+00:00,1,45.0,675.0,11.25,108
4,16,quarter,1,a8625e4b-4ae6-4062-a7c1-0b6e1f4ae211,29,00:45,Jabari Smith Jr. makes regular free throw 1 of 2,freethrowmade,29,a8625e4b-4ae6-4062-a7c1-0b6e1f4ae211,basketball_play,1774139847,356,True,2026-03-22 00:37:27+00:00,1,45.0,675.0,11.25,109
4,15,quarter,1,a17e4a68-2999-4f60-b67e-3e80aa9e198b,29,00:45,"Heat lineup change (Pelle Larsson, Bam Adebayo, Kasparas Jakucionis, Simone Fontecchio, Dru Smith)",lineupchange,29,,basketball_play,1774139877,355,True,2026-03-22 00:37:57+00:00,1,45.0,675.0,11.25,110
4,14,quarter,1,a8625e4b-4ae6-4062-a7c1-0b6e1f4ae211,29,00:45,Jabari Smith Jr. makes regular free throw 2 of 2,freethrowmade,30,a17e4a68-2999-4f60-b67e-3e80aa9e198b,basketball_play,1774139877,354,True,2026-03-22 00:37:57+00:00,1,45.0,675.0,11.25,111
4,13,quarter,1,a8625e4b-4ae6-4062-a7c1-0b6e1f4ae211,29,00:39.10,Rockets challenge timeout,challengetimeout,30,,basketball_play,1774139903,353,True,2026-03-22 00:38:23+00:00,1,39.1,680.9,11.348333333333333,112
4,12,quarter,1,,29,00:39.10,Instant replay (Challenge: Ruling Overturned),review,30,,basketball_play,1774139905,352,True,2026-03-22 00:38:25+00:00,1,39.1,680.9,11.348333333333333,113
4,11,quarter,1,a17e4a68-2999-4f60-b67e-3e80aa9e198b,29,00:39.10,Jabari Smith Jr. blocks Pelle Larsson's two point driving finger roll layup,twopointmiss,30,,basketball_play,1774139968,351,True,2026-03-22 00:39:28+00:00,1,39.1,680.9,11.348333333333333,114
4,10,quarter,1,a17e4a68-2999-4f60-b67e-3e80aa9e198b,29,00:39.10,Heat offensive rebound,rebound,30,a17e4a68-2999-4f60-b67e-3e80aa9e198b,basketball_play,1774139968,350,True,2026-03-22 00:39:28+00:00,1,39.1,680.9,11.348333333333333,115
4,9,quarter,1,a17e4a68-2999-4f60-b67e-3e80aa9e198b,29,00:39.10,Jump ball. Bam Adebayo vs. Jabari Smith Jr. (Dru Smith gains possession),jumpball,30,a17e4a68-2999-4f60-b67e-3e80aa9e198b,basketball_play,1774140010,349,True,2026-03-22 00:40:10+00:00,1,39.1,680.9,11.348333333333333,116
4,8,quarter,1,,29,00:23.30,Stoppage (Out of bounds),stoppage,30,,basketball_play,1774140024,348,True,2026-03-22 00:40:24+00:00,1,23.3,696.7,11.611666666666668,117
4,7,quarter,1,a17e4a68-2999-4f60-b67e-3e80aa9e198b,29,00:20.40,Simone Fontecchio misses three point jump shot,threepointmiss,30,,basketball_play,1774140039,347,True,2026-03-22 00:40:39+00:00,1,20.4,699.6,11.66,118
4,6,quarter,1,a8625e4b-4ae6-4062-a7c1-0b6e1f4ae211,29,00:18.40,Amen Thompson defensive rebound,rebound,30,a8625e4b-4ae6-4062-a7c1-0b6e1f4ae211,basketball_play,1774140041,346,True,2026-03-22 00:40:41+00:00,1,18.4,701.6,11.693333333333333,119
4,5,quarter,1,a8625e4b-4ae6-4062-a7c1-0b6e1f4ae211,29,00:02.30,Dru Smith blocks Kevin Durant's two point pullup jump shot,twopointmiss,30,,basketball_play,1774140057,345,True,2026-03-22 00:40:57+00:00,1,2.3,717.7,11.961666666666668,120
4,4,quarter,1,a8625e4b-4ae6-4062-a7c1-0b6e1f4ae211,29,00:02.30,Amen Thompson offensive rebound,rebound,30,a8625e4b-4ae6-4062-a7c1-0b6e1f4ae211,basketball_play,1774140057,344,True,2026-03-22 00:40:57+00:00,1,2.3,717.7,11.961666666666668,121
4,3,quarter,1,a8625e4b-4ae6-4062-a7c1-0b6e1f4ae211,29,00:00,Reed Sheppard makes two point driving floating jump shot (Amen Thompson assists),twopointmade,32,a17e4a68-2999-4f60-b67e-3e80aa9e198b,basketball_play,1774140062,343,True,2026-03-22 00:41:02+00:00,1,0.0,720.0,12.0,122
4,2,quarter,1,,29,00:00,Instant replay (Request: Ruling Upheld),review,32,,basketball_play,1774140081,342,True,2026-03-22 00:41:21+00:00,1,0.0,720.0,12.0,123
4,1,quarter,1,,29,00:00,End of 1st Quarter.,endperiod,32,,basketball_play,1774140116,341,True,2026-03-22 00:41:56+00:00,1,0.0,720.0,12.0,124
3,125,quarter,2,a17e4a68-2999-4f60-b67e-3e80aa9e198b,29,12:00,"Heat lineup change (Nikola Jovic, Pelle Larsson, Bam Adebayo, Kasparas Jakucionis, Dru Smith)",lineupchange,32,,basketball_play,1774140171,340,True,2026-03-22 00:42:51+00:00,2,720.0,720.0,12.0,125
3,124,quarter,2,a8625e4b-4ae6-4062-a7c1-0b6e1f4ae211,29,12:00,"Rockets lineup change (Dorian Finney-Smith, Amen Thompson, Alperen Sengun, Jabari Smith Jr., Aaron Holiday)",lineupchange,32,,basketball_play,1774140171,339,True,2026-03-22 00:42:51+00:00,2,720.0,720.0,12.0,126
3,123,quarter,2,,29,12:00,Start of 2nd Quarter,startperiod,32,,basketball_play,1774140230,338,True,2026-03-22 00:43:50+00:00,2,720.0,720.0,12.0,127
3,122,quarter,2,a8625e4b-4ae6-4062-a7c1-0b6e1f4ae211,29,11:45,Jabari Smith Jr. misses three point jump shot,threepointmiss,32,,basketball_play,1774140244,337,True,2026-03-22 00:44:04+00:00,2,705.0,735.0,12.25,128
3,121,quarter,2,a8625e4b-4ae6-4062-a7c1-0b6e1f4ae211,29,11:42,Dorian Finney-Smith offensive rebound,rebound,32,a8625e4b-4ae6-4062-a7c1-0b6e1f4ae211,basketball_play,1774140247,336,True,2026-03-22 00:44:07+00:00,2,702.0,738.0,12.3,129
3,120,quarter,2,a17e4a68-2999-4f60-b67e-3e80aa9e198b,29,11:36,Nikola Jovic kicked ball violation,kickball,32,a8625e4b-4ae6-4062-a7c1-0b6e1f4ae211,basketball_play,1774140255,335,True,2026-03-22 00:44:15+00:00,2,696.0,744.0,12.4,130
3,119,quarter,2,a8625e4b-4ae6-4062-a7c1-0b6e1f4ae211,29,11:28,Amen Thompson misses two point jump shot,twopointmiss,32,,basketball_play,1774140278,334,True,2026-03-22 00:44:38+00:00,2,688.0,752.0,12.533333333333333,131
3,118,quarter,2,a17e4a68-2999-4f60-b67e-3e80aa9e198b,29,11:28,Bam Adebayo defensive rebound,rebound,32,a17e4a68-2999-4f60-b67e-3e80aa9e198b,basketball_play,1774140278,333,True,2026-03-22 00:44:38+00:00,2,688.0,752.0,12.533333333333333,132
3,117,quarter,2,a17e4a68-2999-4f60-b67e-3e80aa9e198b,32,11:19,Pelle Larsson makes three point jump shot (Dru Smith assists),threepointmade,32,a8625e4b-4ae6-4062-a7c1-0b6e1f4ae211,basketball_play,1774140287,332,True,2026-03-22 00:44:47+00:00,2,679.0,761.0,12.683333333333334,133
3,116,quarter,2,a8625e4b-4ae6-4062-a7c1-0b6e1f4ae211,32,11:01,Dorian Finney-Smith misses three point jump shot,threepointmiss,32,,basketball_play,1774140305,331,True,2026-03-22 00:45:05+00:00,2,661.0,779.0,12.983333333333333,134
3,115,quarter,2,a17e4a68-2999-4f60-b67e-3e80aa9e198b,32,11:00,Bam Adebayo defensive rebound,rebound,32,a17e4a68-2999-4f60-b67e-3e80aa9e198b,basketball_play,1774140306,330,True,2026-03-22 00:45:06+00:00,2,660.0,780.0,13.0,135
3,114,quarter,2,a17e4a68-2999-4f60-b67e-3e80aa9e198b,32,10:53,Nikola Jovic misses two point running layup,twopointmiss,32,,basketball_play,1774140313,329,True,2026-03-22 00:45:13+00:00,2,653.0,787.0,13.116666666666667,136
3,113,quarter,2,a8625e4b-4ae6-4062-a7c1-0b6e1f4ae211,32,10:53,Alperen Sengun defensive rebound,rebound,32,a8625e4b-4ae6-4062-a7c1-0b6e1f4ae211,basketball_play,1774140313,328,True,2026-03-22 00:45:13+00:00,2,653.0,787.0,13.116666666666667,137
3,112,quarter,2,a8625e4b-4ae6-4062-a7c1-0b6e1f4ae211,32,10:33,Amen Thompson makes three point jump shot (Jabari Smith Jr. assists),threepointmade,35,a17e4a68-2999-4f60-b67e-3e80aa9e198b,basketball_play,1774140334,327,True,2026-03-22 00:45:34+00:00,2,633.0,807.0,13.45,138
3,111,quarter,2,a17e4a68-2999-4f60-b67e-3e80aa9e198b,32,10:20,Nikola Jovic misses three point jump shot,threepointmiss,35,,basketball_play,1774140346,326,True,2026-03-22 00:45:46+00:00,2,620.0,820.0,13.666666666666666,139
3,110,quarter,2,a8625e4b-4ae6-4062-a7c1-0b6e1f4ae211,32,10:19,Alperen Sengun defensive rebound,rebound,35,a8625e4b-4ae6-4062-a7c1-0b6e1f4ae211,basketball_play,1774140347,325,True,2026-03-22 00:45:47+00:00,2,619.0,821.0,13.683333333333334,140
3,109,quarter,2,a8625e4b-4ae6-4062-a7c1-0b6e1f4ae211,32,10:10,Amen Thompson makes two point driving floating jump shot,twopointmade,37,a17e4a68-2999-4f60-b67e-3e80aa9e198b,basketball_play,1774140358,324,True,2026-03-22 00:45:58+00:00,2,610.0,830.0,13.833333333333334,141
3,108,quarter,2,a17e4a68-2999-4f60-b67e-3e80aa9e198b,32,10:10,Pelle Larsson shooting foul (Amen Thompson draws the foul),shootingfoul,37,a8625e4b-4ae6-4062-a7c1-0b6e1f4ae211,basketball_play,1774140361,323,True,2026-03-22 00:46:01+00:00,2,610.0,830.0,13.833333333333334,142
3,107,quarter,2,a8625e4b-4ae6-4062-a7c1-0b6e1f4ae211,32,10:10,Amen Thompson makes regular free throw 1 of 1,freethrowmade,38,,basketball_play,1774140389,322,True,2026-03-22 00:46:29+00:00,2,610.0,830.0,13.833333333333334,143
3,106,quarter,2,a17e4a68-2999-4f60-b67e-3e80aa9e198b,32,9:57,Amen Thompson blocks Bam Adebayo's two point driving layup,twopointmiss,38,,basketball_play,1774140405,321,True,2026-03-22 00:46:45+00:00,2,597.0,843.0,14.05,144
3,105,quarter,2,a8625e4b-4ae6-4062-a7c1-0b6e1f4ae211,32,9:54,Alperen Sengun defensive rebound,rebound,38,a8625e4b-4ae6-4062-a7c1-0b6e1f4ae211,basketball_play,1774140408,320,True,2026-03-22 00:46:48+00:00,2,594.0,846.0,14.1,145
3,104,quarter,2,a8625e4b-4ae6-4062-a7c1-0b6e1f4ae211,32,9:52,Jabari Smith Jr. misses two point running jump shot,twopointmiss,38,,basketball_play,1774140411,319,True,2026-03-22 00:46:51+00:00,2,592.0,848.0,14.133333333333333,146
3,103,quarter,2,a17e4a68-2999-4f60-b67e-3e80aa9e198b,32,9:48,Bam Adebayo defensive rebound,rebound,38,a17e4a68-2999-4f60-b67e-3e80aa9e198b,basketball_play,1774140415,318,True,2026-03-22 00:46:55+00:00,2,588.0,852.0,14.2,147
3,102,quarter,2,a17e4a68-2999-4f60-b67e-3e80aa9e198b,35,9:41,Bam Adebayo makes three point jump shot (Kasparas Jakucionis assists),threepointmade,38,a8625e4b-4ae6-4062-a7c1-0b6e1f4ae211,basketball_play,1774140420,317,True,2026-03-22 00:47:00+00:00,2,581.0,859.0,14.316666666666666,148
3,101,quarter,2,,35,9:40,Stoppage (Other),stoppage,38,,basketball_play,1774140429,316,True,2026-03-22 00:47:09+00:00,2,580.0,860.0,14.333333333333334,149
3,100,quarter,2,a8625e4b-4ae6-4062-a7c1-0b6e1f4ae211,35,9:26,Jabari Smith Jr. misses three point jump shot,threepointmiss,38,,basketball_play,1774140447,315,True,2026-03-22 00:47:27+00:00,2,566.0,874.0,14.566666666666666,150
3,99,quarter,2,a17e4a68-2999-4f60-b67e-3e80aa9e198b,35,9:25,Nikola Jovic defensive rebound,rebound,38,a17e4a68-2999-4f60-b67e-3e80aa9e198b,basketball_play,1774140448,314,True,2026-03-22 00:47:28+00:00,2,565.0,875.0,14.583333333333334,151
3,98,quarter,2,a17e4a68-2999-4f60-b67e-3e80aa9e198b,35,9:15,Dru Smith misses three point jump shot,threepointmiss,38,,basketball_play,1774140458,313,True,2026-03-22 00:47:38+00:00,2,555.0,885.0,14.75,152
3,97,quarter,2,a17e4a68-2999-4f60-b67e-3e80aa9e198b,35,9:14,Heat offensive rebound,rebound,38,a17e4a68-2999-4f60-b67e-3e80aa9e198b,basketball_play,1774140459,312,True,2026-03-22 00:47:39+00:00,2,554.0,886.0,14.766666666666667,153
3,96,quarter,2,a8625e4b-4ae6-4062-a7c1-0b6e1f4ae211,35,9:14,Dorian Finney-Smith personal foul (Loose ball) (Kasparas Jakucionis draws the foul),personalfoul,38,a17e4a68-2999-4f60-b67e-3e80aa9e198b,basketball_play,1774140467,311,True,2026-03-22 00:47:47+00:00,2,554.0,886.0,14.766666666666667,154
3,95,quarter,2,a17e4a68-2999-4f60-b67e-3e80aa9e198b,35,9:14,"Heat lineup change (Nikola Jovic, Pelle Larsson, Davion Mitchell, Bam Adebayo, Kasparas Jakucionis)",lineupchange,38,,basketball_play,1774140476,310,True,2026-03-22 00:47:56+00:00,2,554.0,886.0,14.766666666666667,155
3,94,quarter,2,a8625e4b-4ae6-4062-a7c1-0b6e1f4ae211,35,9:14,"Rockets lineup change (Amen Thompson, Alperen Sengun, Jabari Smith Jr., Aaron Holiday, Tari Eason)",lineupchange,38,,basketball_play,1774140476,309,True,2026-03-22 00:47:56+00:00,2,554.0,886.0,14.766666666666667,156
3,93,quarter,2,a17e4a68-2999-4f60-b67e-3e80aa9e198b,35,9:07,Nikola Jovic misses two point driving layup,twopointmiss,38,,basketball_play,1774140501,308,True,2026-03-22 00:48:21+00:00,2,547.0,893.0,14.883333333333333,157
3,92,quarter,2,a8625e4b-4ae6-4062-a7c1-0b6e1f4ae211,35,9:05,Tari Eason defensive rebound,rebound,38,a8625e4b-4ae6-4062-a7c1-0b6e1f4ae211,basketball_play,1774140503,307,True,2026-03-22 00:48:23+00:00,2,545.0,895.0,14.916666666666666,158
3,91,quarter,2,a8625e4b-4ae6-4062-a7c1-0b6e1f4ae211,35,8:44,Alperen Sengun makes two point turnaround hook shot,twopointmade,40,a17e4a68-2999-4f60-b67e-3e80aa9e198b,basketball_play,1774140524,306,True,2026-03-22 00:48:44+00:00,2,524.0,916.0,15.266666666666667,159
3,90,quarter,2,a17e4a68-2999-4f60-b67e-3e80aa9e198b,37,8:29,Bam Adebayo makes two point fadeaway jump shot,twopointmade,40,a8625e4b-4ae6-4062-a7c1-0b6e1f4ae211,basketball_play,1774140539,305,True,2026-03-22 00:48:59+00:00,2,509.0,931.0,15.516666666666667,160
3,89,quarter,2,a17e4a68-2999-4f60-b67e-3e80aa9e198b,37,8:18,Nikola Jovic shooting foul (Jabari Smith Jr. draws the foul),shootingfoul,40,a8625e4b-4ae6-4062-a7c1-0b6e1f4ae211,basketball_play,1774140552,304,True,2026-03-22 00:49:12+00:00,2,498.0,942.0,15.7,161
3,88,quarter,2,a8625e4b-4ae6-4062-a7c1-0b6e1f4ae211,37,8:18,Jabari Smith Jr. makes regular free throw 1 of 2,freethrowmade,41,a8625e4b-4ae6-4062-a7c1-0b6e1f4ae211,basketball_play,1774140583,303,True,2026-03-22 00:49:43+00:00,2,498.0,942.0,15.7,162
3,87,quarter,2,a17e4a68-2999-4f60-b67e-3e80aa9e198b,37,8:18,"Heat lineup change (Pelle Larsson, Davion Mitchell, Bam Adebayo, Kasparas Jakucionis, Simone Fontecchio)",lineupchange,41,,basketball_play,1774140609,302,True,2026-03-22 00:50:09+00:00,2,498.0,942.0,15.7,163
3,86,quarter,2,a8625e4b-4ae6-4062-a7c1-0b6e1f4ae211,37,8:18,Jabari Smith Jr. misses regular free throw 2 of 2,freethrowmiss,41,,basketball_play,1774140583,301,True,2026-03-22 00:49:43+00:00,2,498.0,942.0,15.7,164
3,85,quarter,2,a17e4a68-2999-4f60-b67e-3e80aa9e198b,37,8:18,Bam Adebayo defensive rebound,rebound,41,a17e4a68-2999-4f60-b67e-3e80aa9e198b,basketball_play,1774140583,300,True,2026-03-22 00:49:43+00:00,2,498.0,942.0,15.7,165
3,84,quarter,2,a17e4a68-2999-4f60-b67e-3e80aa9e198b,39,8:03,Pelle Larsson makes two point driving dunk (Simone Fontecchio assists),twopointmade,41,a8625e4b-4ae6-4062-a7c1-0b6e1f4ae211,basketball_play,1774140622,299,True,2026-03-22 00:50:22+00:00,2,483.0,957.0,15.95,166
3,83,quarter,2,a17e4a68-2999-4f60-b67e-3e80aa9e198b,39,7:53,Bam Adebayo kicked ball violation,kickball,41,a8625e4b-4ae6-4062-a7c1-0b6e1f4ae211,basketball_play,1774140635,298,True,2026-03-22 00:50:35+00:00,2,473.0,967.0,16.116666666666667,167
3,82,quarter,2,a17e4a68-2999-4f60-b67e-3e80aa9e198b,39,7:53,"Heat lineup change (Pelle Larsson, Davion Mitchell, Bam Adebayo, Tyler Herro, Simone Fontecchio)",lineupchange,41,,basketball_play,1774140641,297,True,2026-03-22 00:50:41+00:00,2,473.0,967.0,16.116666666666667,168
3,81,quarter,2,a8625e4b-4ae6-4062-a7c1-0b6e1f4ae211,39,7:53,"Rockets lineup change (Amen Thompson, Alperen Sengun, Reed Sheppard, Jabari Smith Jr., Tari Eason)",lineupchange,41,,basketball_play,1774140641,296,True,2026-03-22 00:50:41+00:00,2,473.0,967.0,16.116666666666667,169
3,80,quarter,2,a8625e4b-4ae6-4062-a7c1-0b6e1f4ae211,39,7:43,Tari Eason misses two point driving floating jump shot,twopointmiss,41,,basketball_play,1774140669,295,True,2026-03-22 00:51:09+00:00,2,463.0,977.0,16.283333333333335,170
3,79,quarter,2,a17e4a68-2999-4f60-b67e-3e80aa9e198b,39,7:41,Bam Adebayo defensive rebound,rebound,41,a17e4a68-2999-4f60-b67e-3e80aa9e198b,basketball_play,1774140671,294,True,2026-03-22 00:51:11+00:00,2,461.0,979.0,16.316666666666666,171
3,78,quarter,2,a8625e4b-4ae6-4062-a7c1-0b6e1f4ae211,39,7:34,Alperen Sengun shooting foul (Tyler Herro draws the foul),shootingfoul,41,a17e4a68-2999-4f60-b67e-3e80aa9e198b,basketball_play,1774140680,293,True,2026-03-22 00:51:20+00:00,2,454.0,986.0,16.433333333333334,172
3,77,quarter,2,a17e4a68-2999-4f60-b67e-3e80aa9e198b,40,7:34,Tyler Herro makes regular free throw 1 of 2,freethrowmade,41,a17e4a68-2999-4f60-b67e-3e80aa9e198b,basketball_play,1774140712,292,True,2026-03-22 00:51:52+00:00,2,454.0,986.0,16.433333333333334,173
3,76,quarter,2,a17e4a68-2999-4f60-b67e-3e80aa9e198b,40,7:34,"Heat lineup change (Myron Gardner, Davion Mitchell, Bam Adebayo, Tyler Herro, Simone Fontecchio)",lineupchange,41,,basketball_play,1774140735,291,True,2026-03-22 00:52:15+00:00,2,454.0,986.0,16.433333333333334,174
3,75,quarter,2,a17e4a68-2999-4f60-b67e-3e80aa9e198b,41,7:34,Tyler Herro makes regular free throw 2 of 2,freethrowmade,41,a8625e4b-4ae6-4062-a7c1-0b6e1f4ae211,basketball_play,1774140735,290,True,2026-03-22 00:52:15+00:00,2,454.0,986.0,16.433333333333334,175
3,74,quarter,2,a8625e4b-4ae6-4062-a7c1-0b6e1f4ae211,41,7:16,Alperen Sengun makes two point driving floating bank jump shot,twopointmade,43,a17e4a68-2999-4f60-b67e-3e80aa9e198b,basketball_play,1774140754,289,True,2026-03-22 00:52:34+00:00,2,436.0,1004.0,16.733333333333334,176
3,73,quarter,2,a17e4a68-2999-4f60-b67e-3e80aa9e198b,41,7:04,Bam Adebayo misses two point turnaround fadeaway jump shot,twopointmiss,43,,basketball_play,1774140765,288,True,2026-03-22 00:52:45+00:00,2,424.0,1016.0,16.933333333333334,177
3,72,quarter,2,a8625e4b-4ae6-4062-a7c1-0b6e1f4ae211,41,7:03,Alperen Sengun defensive rebound,rebound,43,a8625e4b-4ae6-4062-a7c1-0b6e1f4ae211,basketball_play,1774140766,287,True,2026-03-22 00:52:46+00:00,2,423.0,1017.0,16.95,178
3,71,quarter,2,a17e4a68-2999-4f60-b67e-3e80aa9e198b,41,6:50,Simone Fontecchio personal foul (Alperen Sengun draws the foul),personalfoul,43,a8625e4b-4ae6-4062-a7c1-0b6e1f4ae211,basketball_play,1774140783,286,True,2026-03-22 00:53:03+00:00,2,410.0,1030.0,17.166666666666668,179
3,70,quarter,2,a8625e4b-4ae6-4062-a7c1-0b6e1f4ae211,41,6:50,Rockets 60 second timeout,teamtimeout,43,,basketball_play,1774140797,285,True,2026-03-22 00:53:17+00:00,2,410.0,1030.0,17.166666666666668,180
3,69,quarter,2,a8625e4b-4ae6-4062-a7c1-0b6e1f4ae211,41,6:50,"Rockets lineup change (Kevin Durant, Alperen Sengun, Reed Sheppard, Jabari Smith Jr., Tari Eason)",lineupchange,43,,basketball_play,1774140982,284,True,2026-03-22 00:56:22+00:00,2,410.0,1030.0,17.166666666666668,181
3,68,quarter,2,a8625e4b-4ae6-4062-a7c1-0b6e1f4ae211,41,6:38,Tari Eason misses two point jump shot,twopointmiss,43,,basketball_play,1774140982,283,True,2026-03-22 00:56:22+00:00,2,398.0,1042.0,17.366666666666667,182
3,67,quarter,2,a17e4a68-2999-4f60-b67e-3e80aa9e198b,41,6:36,Tyler Herro defensive rebound,rebound,43,a17e4a68-2999-4f60-b67e-3e80aa9e198b,basketball_play,1774140984,282,True,2026-03-22 00:56:24+00:00,2,396.0,1044.0,17.4,183
3,66,quarter,2,a17e4a68-2999-4f60-b67e-3e80aa9e198b,41,6:24,Tyler Herro misses two point driving floating jump shot,twopointmiss,43,,basketball_play,1774140995,281,True,2026-03-22 00:56:35+00:00,2,384.0,1056.0,17.6,184
3,65,quarter,2,a8625e4b-4ae6-4062-a7c1-0b6e1f4ae211,41,6:23,Alperen Sengun defensive rebound,rebound,43,a8625e4b-4ae6-4062-a7c1-0b6e1f4ae211,basketball_play,1774140996,280,True,2026-03-22 00:56:36+00:00,2,383.0,1057.0,17.616666666666667,185
3,64,quarter,2,a17e4a68-2999-4f60-b67e-3e80aa9e198b,41,6:03,Myron Gardner shooting foul (Reed Sheppard draws the foul),shootingfoul,43,a8625e4b-4ae6-4062-a7c1-0b6e1f4ae211,basketball_play,1774141018,279,True,2026-03-22 00:56:58+00:00,2,363.0,1077.0,17.95,186
3,63,quarter,2,a8625e4b-4ae6-4062-a7c1-0b6e1f4ae211,41,6:03,Reed Sheppard makes regular free throw 1 of 2,freethrowmade,44,a8625e4b-4ae6-4062-a7c1-0b6e1f4ae211,basketball_play,1774141042,278,True,2026-03-22 00:57:22+00:00,2,363.0,1077.0,17.95,187
3,62,quarter,2,a8625e4b-4ae6-4062-a7c1-0b6e1f4ae211,41,6:03,"Rockets lineup change (Kevin Durant, Dorian Finney-Smith, Reed Sheppard, Jabari Smith Jr., Tari Eason)",lineupchange,44,,basketball_play,1774141070,277,True,2026-03-22 00:57:50+00:00,2,363.0,1077.0,17.95,188
3,61,quarter,2,a8625e4b-4ae6-4062-a7c1-0b6e1f4ae211,41,6:03,Reed Sheppard makes regular free throw 2 of 2,freethrowmade,45,a17e4a68-2999-4f60-b67e-3e80aa9e198b,basketball_play,1774141070,276,True,2026-03-22 00:57:50+00:00,2,363.0,1077.0,17.95,189
3,60,quarter,2,a17e4a68-2999-4f60-b67e-3e80aa9e198b,41,5:45,Tyler Herro misses two point pullup jump shot,twopointmiss,45,,basketball_play,1774141090,275,True,2026-03-22 00:58:10+00:00,2,345.0,1095.0,18.25,190
3,59,quarter,2,a17e4a68-2999-4f60-b67e-3e80aa9e198b,41,5:42,Bam Adebayo offensive rebound,rebound,45,a17e4a68-2999-4f60-b67e-3e80aa9e198b,basketball_play,1774141093,274,True,2026-03-22 00:58:13+00:00,2,342.0,1098.0,18.3,191
3,58,quarter,2,a17e4a68-2999-4f60-b67e-3e80aa9e198b,43,5:41,Bam Adebayo makes two point driving dunk,twopointmade,45,a8625e4b-4ae6-4062-a7c1-0b6e1f4ae211,basketball_play,1774141094,273,True,2026-03-22 00:58:14+00:00,2,341.0,1099.0,18.316666666666666,192
3,57,quarter,2,a17e4a68-2999-4f60-b67e-3e80aa9e198b,43,5:26,Myron Gardner personal foul (Dorian Finney-Smith draws the foul),personalfoul,45,a8625e4b-4ae6-4062-a7c1-0b6e1f4ae211,basketball_play,1774141112,272,True,2026-03-22 00:58:32+00:00,2,326.0,1114.0,18.566666666666666,193
3,56,quarter,2,a8625e4b-4ae6-4062-a7c1-0b6e1f4ae211,43,5:26,Dorian Finney-Smith makes regular free throw 1 of 2,freethrowmade,46,a8625e4b-4ae6-4062-a7c1-0b6e1f4ae211,basketball_play,1774141143,271,True,2026-03-22 00:59:03+00:00,2,326.0,1114.0,18.566666666666666,194
3,55,quarter,2,a17e4a68-2999-4f60-b67e-3e80aa9e198b,43,5:26,"Heat lineup change (Pelle Larsson, Davion Mitchell, Bam Adebayo, Tyler Herro, Simone Fontecchio)",lineupchange,46,,basketball_play,1774141166,270,True,2026-03-22 00:59:26+00:00,2,326.0,1114.0,18.566666666666666,195
3,54,quarter,2,a8625e4b-4ae6-4062-a7c1-0b6e1f4ae211,43,5:26,Dorian Finney-Smith misses regular free throw 2 of 2,freethrowmiss,46,,basketball_play,1774141143,269,True,2026-03-22 00:59:03+00:00,2,326.0,1114.0,18.566666666666666,196
3,53,quarter,2,a17e4a68-2999-4f60-b67e-3e80aa9e198b,43,5:26,Bam Adebayo defensive rebound,rebound,46,a17e4a68-2999-4f60-b67e-3e80aa9e198b,basketball_play,1774141143,268,True,2026-03-22 00:59:03+00:00,2,326.0,1114.0,18.566666666666666,197
3,52,quarter,2,a17e4a68-2999-4f60-b67e-3e80aa9e198b,45,5:16,Davion Mitchell makes two point driving layup,twopointmade,46,a8625e4b-4ae6-4062-a7c1-0b6e1f4ae211,basketball_play,1774141175,267,True,2026-03-22 00:59:35+00:00,2,316.0,1124.0,18.733333333333334,198
3,51,quarter,2,a8625e4b-4ae6-4062-a7c1-0b6e1f4ae211,45,4:56,Kevin Durant makes two point pullup jump shot (Dorian Finney-Smith assists),twopointmade,48,a17e4a68-2999-4f60-b67e-3e80aa9e198b,basketball_play,1774141195,266,True,2026-03-22 00:59:55+00:00,2,296.0,1144.0,19.066666666666666,199
3,50,quarter,2,a17e4a68-2999-4f60-b67e-3e80aa9e198b,45,4:47,Pelle Larsson misses two point driving layup,twopointmiss,48,,basketball_play,1774141205,265,True,2026-03-22 01:00:05+00:00,2,287.0,1153.0,19.216666666666665,200
3,49,quarter,2,a17e4a68-2999-4f60-b67e-3e80aa9e198b,45,4:47,Heat offensive rebound,rebound,48,a17e4a68-2999-4f60-b67e-3e80aa9e198b,basketball_play,1774141207,264,True,2026-03-22 01:00:07+00:00,2,287.0,1153.0,19.216666666666665,201
3,48,quarter,2,,45,4:47,Stoppage (Out of bounds),stoppage,48,,basketball_play,1774141208,263,True,2026-03-22 01:00:08+00:00,2,287.0,1153.0,19.216666666666665,202
3,47,quarter,2,a8625e4b-4ae6-4062-a7c1-0b6e1f4ae211,45,4:47,"Rockets lineup change (Kevin Durant, Dorian Finney-Smith, Amen Thompson, Reed Sheppard, Tari Eason)",lineupchange,48,,basketball_play,1774141228,262,True,2026-03-22 01:00:28+00:00,2,287.0,1153.0,19.216666666666665,203
3,46,quarter,2,a8625e4b-4ae6-4062-a7c1-0b6e1f4ae211,45,4:46,Amen Thompson shooting foul (Pelle Larsson draws the foul),shootingfoul,48,a17e4a68-2999-4f60-b67e-3e80aa9e198b,basketball_play,1774141228,261,True,2026-03-22 01:00:28+00:00,2,286.0,1154.0,19.233333333333334,204
3,45,quarter,2,a17e4a68-2999-4f60-b67e-3e80aa9e198b,46,4:46,Pelle Larsson makes regular free throw 1 of 2,freethrowmade,48,a17e4a68-2999-4f60-b67e-3e80aa9e198b,basketball_play,1774141255,260,True,2026-03-22 01:00:55+00:00,2,286.0,1154.0,19.233333333333334,205
3,44,quarter,2,a17e4a68-2999-4f60-b67e-3e80aa9e198b,46,4:46,Pelle Larsson misses regular free throw 2 of 2,freethrowmiss,48,,basketball_play,1774141255,259,True,2026-03-22 01:00:55+00:00,2,286.0,1154.0,19.233333333333334,206
3,43,quarter,2,a8625e4b-4ae6-4062-a7c1-0b6e1f4ae211,46,4:46,Tari Eason defensive rebound,rebound,48,a8625e4b-4ae6-4062-a7c1-0b6e1f4ae211,basketball_play,1774141255,258,True,2026-03-22 01:00:55+00:00,2,286.0,1154.0,19.233333333333334,207
3,42,quarter,2,a17e4a68-2999-4f60-b67e-3e80aa9e198b,46,4:30,Pelle Larsson personal foul (Kevin Durant draws the foul),personalfoul,48,a8625e4b-4ae6-4062-a7c1-0b6e1f4ae211,basketball_play,1774141294,257,True,2026-03-22 01:01:34+00:00,2,270.0,1170.0,19.5,208
3,41,quarter,2,a8625e4b-4ae6-4062-a7c1-0b6e1f4ae211,46,4:30,Kevin Durant makes regular free throw 1 of 2,freethrowmade,49,a8625e4b-4ae6-4062-a7c1-0b6e1f4ae211,basketball_play,1774141330,256,True,2026-03-22 01:02:10+00:00,2,270.0,1170.0,19.5,209
3,40,quarter,2,a17e4a68-2999-4f60-b67e-3e80aa9e198b,46,4:30,"Heat lineup change (Myron Gardner, Davion Mitchell, Bam Adebayo, Tyler Herro, Simone Fontecchio)",lineupchange,49,,basketball_play,1774141352,255,True,2026-03-22 01:02:32+00:00,2,270.0,1170.0,19.5,210
3,39,quarter,2,a8625e4b-4ae6-4062-a7c1-0b6e1f4ae211,46,4:30,Kevin Durant makes regular free throw 2 of 2,freethrowmade,50,a17e4a68-2999-4f60-b67e-3e80aa9e198b,basketball_play,1774141352,254,True,2026-03-22 01:02:32+00:00,2,270.0,1170.0,19.5,211
3,38,quarter,2,,46,4:18,Stoppage (Out of bounds),stoppage,50,,basketball_play,1774141375,253,True,2026-03-22 01:02:55+00:00,2,258.0,1182.0,19.7,212
