period_index,event_index,period_type,period_number,attribution,away_points,clock,description,event_type,home_points,possession,type,wall_clock,pbp_source_row,has_wall_clock,event_ts_utc,period_sequence,game_clock_seconds_remaining,game_elapsed_seconds,game_elapsed_minutes,pbp_chronological_index
3,37,quarter,2,a17e4a68-2999-4f60-b67e-3e80aa9e198b,48,4:15,Bam Adebayo makes two point cutting layup (Davion Mitchell assists),twopointmade,50,a8625e4b-4ae6-4062-a7c1-0b6e1f4ae211,basketball_play,1774141387,252,True,2026-03-22 01:03:07+00:00,2,255.0,1185.0,19.75,213
3,36,quarter,2,a8625e4b-4ae6-4062-a7c1-0b6e1f4ae211,48,3:58,Reed Sheppard makes two point driving floating jump shot (Kevin Durant assists),twopointmade,52,a17e4a68-2999-4f60-b67e-3e80aa9e198b,basketball_play,1774141404,251,True,2026-03-22 01:03:24+00:00,2,238.0,1202.0,20.033333333333335,214
3,35,quarter,2,a17e4a68-2999-4f60-b67e-3e80aa9e198b,48,3:49,Simone Fontecchio misses three point jump shot,threepointmiss,52,,basketball_play,1774141413,250,True,2026-03-22 01:03:33+00:00,2,229.0,1211.0,20.183333333333334,215
3,34,quarter,2,a8625e4b-4ae6-4062-a7c1-0b6e1f4ae211,48,3:47,Amen Thompson defensive rebound,rebound,52,a8625e4b-4ae6-4062-a7c1-0b6e1f4ae211,basketball_play,1774141415,249,True,2026-03-22 01:03:35+00:00,2,227.0,1213.0,20.216666666666665,216
3,33,quarter,2,a8625e4b-4ae6-4062-a7c1-0b6e1f4ae211,48,3:39,Reed Sheppard makes three point jump shot (Kevin Durant assists),threepointmade,55,a17e4a68-2999-4f60-b67e-3e80aa9e198b,basketball_play,1774141423,248,True,2026-03-22 01:03:43+00:00,2,219.0,1221.0,20.35,217
3,32,quarter,2,a17e4a68-2999-4f60-b67e-3e80aa9e198b,48,3:38,Heat 60 second timeout,teamtimeout,55,,basketball_play,1774141431,247,True,2026-03-22 01:03:51+00:00,2,218.0,1222.0,20.366666666666667,218
3,31,quarter,2,,48,3:29,Stoppage (Out of bounds),stoppage,55,,basketball_play,1774141638,246,True,2026-03-22 01:07:18+00:00,2,209.0,1231.0,20.516666666666666,219
3,30,quarter,2,a17e4a68-2999-4f60-b67e-3e80aa9e198b,50,3:18,Bam Adebayo makes two point driving finger roll layup (Davion Mitchell assists),twopointmade,55,a8625e4b-4ae6-4062-a7c1-0b6e1f4ae211,basketball_play,1774141660,245,True,2026-03-22 01:07:40+00:00,2,198.0,1242.0,20.7,220
3,29,quarter,2,a8625e4b-4ae6-4062-a7c1-0b6e1f4ae211,50,3:18,Dorian Finney-Smith shooting foul (Bam Adebayo draws the foul),shootingfoul,55,a17e4a68-2999-4f60-b67e-3e80aa9e198b,basketball_play,1774141662,244,True,2026-03-22 01:07:42+00:00,2,198.0,1242.0,20.7,221
3,28,quarter,2,a17e4a68-2999-4f60-b67e-3e80aa9e198b,51,3:18,Bam Adebayo makes regular free throw 1 of 1,freethrowmade,55,,basketball_play,1774141687,243,True,2026-03-22 01:08:07+00:00,2,198.0,1242.0,20.7,222
3,27,quarter,2,a8625e4b-4ae6-4062-a7c1-0b6e1f4ae211,51,3:09,Tari Eason turnover (traveling),turnover,55,a17e4a68-2999-4f60-b67e-3e80aa9e198b,basketball_play,1774141701,242,True,2026-03-22 01:08:21+00:00,2,189.0,1251.0,20.85,223
3,26,quarter,2,a8625e4b-4ae6-4062-a7c1-0b6e1f4ae211,51,3:09,"Rockets lineup change (Kevin Durant, Amen Thompson, Alperen Sengun, Reed Sheppard, Jabari Smith Jr.)",lineupchange,55,,basketball_play,1774141705,241,True,2026-03-22 01:08:25+00:00,2,189.0,1251.0,20.85,224
3,25,quarter,2,a17e4a68-2999-4f60-b67e-3e80aa9e198b,51,2:53,Tyler Herro misses three point jump shot,threepointmiss,55,,basketball_play,1774141733,240,True,2026-03-22 01:08:53+00:00,2,173.0,1267.0,21.116666666666667,225
3,24,quarter,2,a17e4a68-2999-4f60-b67e-3e80aa9e198b,51,2:52,Bam Adebayo offensive rebound,rebound,55,a17e4a68-2999-4f60-b67e-3e80aa9e198b,basketball_play,1774141734,239,True,2026-03-22 01:08:54+00:00,2,172.0,1268.0,21.133333333333333,226
3,23,quarter,2,a17e4a68-2999-4f60-b67e-3e80aa9e198b,53,2:52,Bam Adebayo makes two point tip dunk,twopointmade,55,a8625e4b-4ae6-4062-a7c1-0b6e1f4ae211,basketball_play,1774141737,238,True,2026-03-22 01:08:57+00:00,2,172.0,1268.0,21.133333333333333,227
3,22,quarter,2,a8625e4b-4ae6-4062-a7c1-0b6e1f4ae211,53,2:31,Jabari Smith Jr. makes two point driving dunk (Reed Sheppard assists),twopointmade,57,a17e4a68-2999-4f60-b67e-3e80aa9e198b,basketball_play,1774141753,237,True,2026-03-22 01:09:13+00:00,2,151.0,1289.0,21.483333333333334,228
3,21,quarter,2,a17e4a68-2999-4f60-b67e-3e80aa9e198b,55,2:20,Bam Adebayo makes two point stepback jump shot (Tyler Herro assists),twopointmade,57,a8625e4b-4ae6-4062-a7c1-0b6e1f4ae211,basketball_play,1774141764,236,True,2026-03-22 01:09:24+00:00,2,140.0,1300.0,21.666666666666668,229
3,20,quarter,2,a8625e4b-4ae6-4062-a7c1-0b6e1f4ae211,55,2:05,Reed Sheppard misses three point jump shot,threepointmiss,57,,basketball_play,1774141782,235,True,2026-03-22 01:09:42+00:00,2,125.0,1315.0,21.916666666666668,230
3,19,quarter,2,a8625e4b-4ae6-4062-a7c1-0b6e1f4ae211,55,2:05,Rockets offensive rebound,rebound,57,a8625e4b-4ae6-4062-a7c1-0b6e1f4ae211,basketball_play,1774141782,234,True,2026-03-22 01:09:42+00:00,2,125.0,1315.0,21.916666666666668,231
3,18,quarter,2,a17e4a68-2999-4f60-b67e-3e80aa9e198b,55,2:05,Myron Gardner personal foul (Loose ball) (Alperen Sengun draws the foul),personalfoul,57,a8625e4b-4ae6-4062-a7c1-0b6e1f4ae211,basketball_play,1774141788,233,True,2026-03-22 01:09:48+00:00,2,125.0,1315.0,21.916666666666668,232
3,17,quarter,2,a8625e4b-4ae6-4062-a7c1-0b6e1f4ae211,55,2:05,Alperen Sengun makes regular free throw 1 of 2,freethrowmade,58,a8625e4b-4ae6-4062-a7c1-0b6e1f4ae211,basketball_play,1774141809,232,True,2026-03-22 01:10:09+00:00,2,125.0,1315.0,21.916666666666668,233
3,16,quarter,2,a17e4a68-2999-4f60-b67e-3e80aa9e198b,55,2:05,"Heat lineup change (Davion Mitchell, Bam Adebayo, Tyler Herro, Kasparas Jakucionis, Simone Fontecchio)",lineupchange,58,,basketball_play,1774141828,231,True,2026-03-22 01:10:28+00:00,2,125.0,1315.0,21.916666666666668,234
3,15,quarter,2,a8625e4b-4ae6-4062-a7c1-0b6e1f4ae211,55,2:05,Alperen Sengun misses regular free throw 2 of 2,freethrowmiss,58,,basketball_play,1774141809,230,True,2026-03-22 01:10:09+00:00,2,125.0,1315.0,21.916666666666668,235
3,14,quarter,2,a8625e4b-4ae6-4062-a7c1-0b6e1f4ae211,55,2:05,Alperen Sengun offensive rebound,rebound,58,a8625e4b-4ae6-4062-a7c1-0b6e1f4ae211,basketball_play,1774141809,229,True,2026-03-22 01:10:09+00:00,2,125.0,1315.0,21.916666666666668,236
3,13,quarter,2,a8625e4b-4ae6-4062-a7c1-0b6e1f4ae211,55,1:54,Alperen Sengun makes two point turnaround hook shot (Reed Sheppard assists),twopointmade,60,a17e4a68-2999-4f60-b67e-3e80aa9e198b,basketball_play,1774141837,228,True,2026-03-22 01:10:37+00:00,2,114.0,1326.0,22.1,237
3,12,quarter,2,a17e4a68-2999-4f60-b67e-3e80aa9e198b,57,1:37,Tyler Herro makes two point driving finger roll layup,twopointmade,60,a8625e4b-4ae6-4062-a7c1-0b6e1f4ae211,basketball_play,1774141854,227,True,2026-03-22 01:10:54+00:00,2,97.0,1343.0,22.383333333333333,238
3,11,quarter,2,a8625e4b-4ae6-4062-a7c1-0b6e1f4ae211,57,1:21,Jabari Smith Jr. makes two point turnaround fadeaway jump shot (Reed Sheppard assists),twopointmade,62,a17e4a68-2999-4f60-b67e-3e80aa9e198b,basketball_play,1774141869,226,True,2026-03-22 01:11:09+00:00,2,81.0,1359.0,22.65,239
3,10,quarter,2,a17e4a68-2999-4f60-b67e-3e80aa9e198b,60,1:03,Davion Mitchell makes three point jump shot (Kasparas Jakucionis assists),threepointmade,62,a8625e4b-4ae6-4062-a7c1-0b6e1f4ae211,basketball_play,1774141887,225,True,2026-03-22 01:11:27+00:00,2,63.0,1377.0,22.95,240
3,9,quarter,2,a8625e4b-4ae6-4062-a7c1-0b6e1f4ae211,60,00:43.20,Alperen Sengun misses two point floating jump shot,twopointmiss,62,,basketball_play,1774141908,224,True,2026-03-22 01:11:48+00:00,2,43.2,1396.8,23.279999999999998,241
3,8,quarter,2,a17e4a68-2999-4f60-b67e-3e80aa9e198b,60,00:43.20,Bam Adebayo defensive rebound,rebound,62,a17e4a68-2999-4f60-b67e-3e80aa9e198b,basketball_play,1774141908,223,True,2026-03-22 01:11:48+00:00,2,43.2,1396.8,23.279999999999998,242
3,7,quarter,2,a17e4a68-2999-4f60-b67e-3e80aa9e198b,60,00:32.50,Bam Adebayo misses three point pullup jump shot,threepointmiss,62,,basketball_play,1774141919,222,True,2026-03-22 01:11:59+00:00,2,32.5,1407.5,23.458333333333332,243
3,6,quarter,2,a17e4a68-2999-4f60-b67e-3e80aa9e198b,60,00:27.10,Kasparas Jakucionis offensive rebound,rebound,62,a17e4a68-2999-4f60-b67e-3e80aa9e198b,basketball_play,1774141925,221,True,2026-03-22 01:12:05+00:00,2,27.1,1412.9,23.548333333333336,244
3,5,quarter,2,a17e4a68-2999-4f60-b67e-3e80aa9e198b,63,00:23.80,Davion Mitchell makes three point jump shot (Kasparas Jakucionis assists),threepointmade,62,a8625e4b-4ae6-4062-a7c1-0b6e1f4ae211,basketball_play,1774141928,220,True,2026-03-22 01:12:08+00:00,2,23.8,1416.2,23.603333333333335,245
3,4,quarter,2,a8625e4b-4ae6-4062-a7c1-0b6e1f4ae211,63,00:03.80,Amen Thompson makes two point alley-oop layup (Reed Sheppard assists),twopointmade,64,a17e4a68-2999-4f60-b67e-3e80aa9e198b,basketball_play,1774141952,219,True,2026-03-22 01:12:32+00:00,2,3.8,1436.2,23.936666666666667,246
3,3,quarter,2,,63,00:00.90,Stoppage (Out of bounds),stoppage,64,,basketball_play,1774141959,218,True,2026-03-22 01:12:39+00:00,2,0.9,1439.1,23.985,247
3,2,quarter,2,a8625e4b-4ae6-4062-a7c1-0b6e1f4ae211,63,00:00.90,"Rockets lineup change (Kevin Durant, Dorian Finney-Smith, Amen Thompson, Reed Sheppard, Jabari Smith Jr.)",lineupchange,64,,basketball_play,1774141998,217,True,2026-03-22 01:13:18+00:00,2,0.9,1439.1,23.985,248
3,1,quarter,2,,63,00:00,End of 1st Half.,endperiod,64,,basketball_play,1774141998,216,True,2026-03-22 01:13:18+00:00,2,0.0,1440.0,24.0,249
2,101,quarter,3,a17e4a68-2999-4f60-b67e-3e80aa9e198b,63,12:00,"Heat lineup change (Pelle Larsson, Davion Mitchell, Bam Adebayo, Tyler Herro, Simone Fontecchio)",lineupchange,64,,basketball_play,1774142854,215,True,2026-03-22 01:27:34+00:00,3,720.0,1440.0,24.0,250
2,100,quarter,3,a8625e4b-4ae6-4062-a7c1-0b6e1f4ae211,63,12:00,"Rockets lineup change (Kevin Durant, Amen Thompson, Alperen Sengun, Reed Sheppard, Jabari Smith Jr.)",lineupchange,64,,basketball_play,1774142854,214,True,2026-03-22 01:27:34+00:00,3,720.0,1440.0,24.0,251
2,99,quarter,3,,63,12:00,Start of 3rd Quarter,startperiod,64,,basketball_play,1774142923,213,True,2026-03-22 01:28:43+00:00,3,720.0,1440.0,24.0,252
2,98,quarter,3,,63,11:41,Stoppage (Out of bounds),stoppage,64,,basketball_play,1774142944,212,True,2026-03-22 01:29:04+00:00,3,701.0,1459.0,24.316666666666666,253
2,97,quarter,3,a8625e4b-4ae6-4062-a7c1-0b6e1f4ae211,63,11:37,Alperen Sengun misses two point turnaround fadeaway jump shot,twopointmiss,64,,basketball_play,1774142960,211,True,2026-03-22 01:29:20+00:00,3,697.0,1463.0,24.383333333333333,254
2,96,quarter,3,a17e4a68-2999-4f60-b67e-3e80aa9e198b,63,11:34,Tyler Herro defensive rebound,rebound,64,a17e4a68-2999-4f60-b67e-3e80aa9e198b,basketball_play,1774142963,210,True,2026-03-22 01:29:23+00:00,3,694.0,1466.0,24.433333333333334,255
2,95,quarter,3,a17e4a68-2999-4f60-b67e-3e80aa9e198b,65,11:28,Tyler Herro makes two point running pullup jump shot (Davion Mitchell assists),twopointmade,64,a8625e4b-4ae6-4062-a7c1-0b6e1f4ae211,basketball_play,1774142968,209,True,2026-03-22 01:29:28+00:00,3,688.0,1472.0,24.533333333333335,256
2,94,quarter,3,a8625e4b-4ae6-4062-a7c1-0b6e1f4ae211,65,11:18,Kevin Durant makes three point jump shot (Reed Sheppard assists),threepointmade,67,a17e4a68-2999-4f60-b67e-3e80aa9e198b,basketball_play,1774142978,208,True,2026-03-22 01:29:38+00:00,3,678.0,1482.0,24.7,257
2,93,quarter,3,a17e4a68-2999-4f60-b67e-3e80aa9e198b,65,11:02,Pelle Larsson misses three point jump shot,threepointmiss,67,,basketball_play,1774142994,207,True,2026-03-22 01:29:54+00:00,3,662.0,1498.0,24.966666666666665,258
2,92,quarter,3,a8625e4b-4ae6-4062-a7c1-0b6e1f4ae211,65,10:59,Amen Thompson defensive rebound,rebound,67,a8625e4b-4ae6-4062-a7c1-0b6e1f4ae211,basketball_play,1774142997,206,True,2026-03-22 01:29:57+00:00,3,659.0,1501.0,25.016666666666666,259
2,91,quarter,3,a8625e4b-4ae6-4062-a7c1-0b6e1f4ae211,65,10:54,Amen Thompson turnover (out of bounds bad pass),turnover,67,a17e4a68-2999-4f60-b67e-3e80aa9e198b,basketball_play,1774143005,205,True,2026-03-22 01:30:05+00:00,3,654.0,1506.0,25.1,260
2,90,quarter,3,a17e4a68-2999-4f60-b67e-3e80aa9e198b,68,10:37,Bam Adebayo makes three point jump shot (Pelle Larsson assists),threepointmade,67,a8625e4b-4ae6-4062-a7c1-0b6e1f4ae211,basketball_play,1774143029,204,True,2026-03-22 01:30:29+00:00,3,637.0,1523.0,25.383333333333333,261
2,89,quarter,3,a8625e4b-4ae6-4062-a7c1-0b6e1f4ae211,68,10:25,Alperen Sengun makes two point cutting layup (Reed Sheppard assists),twopointmade,69,a17e4a68-2999-4f60-b67e-3e80aa9e198b,basketball_play,1774143041,203,True,2026-03-22 01:30:41+00:00,3,625.0,1535.0,25.583333333333332,262
2,88,quarter,3,a17e4a68-2999-4f60-b67e-3e80aa9e198b,70,10:13,Davion Mitchell makes two point driving finger roll layup,twopointmade,69,a8625e4b-4ae6-4062-a7c1-0b6e1f4ae211,basketball_play,1774143053,202,True,2026-03-22 01:30:53+00:00,3,613.0,1547.0,25.783333333333335,263
2,87,quarter,3,a8625e4b-4ae6-4062-a7c1-0b6e1f4ae211,70,10:01,Kevin Durant makes three point jump shot (Reed Sheppard assists),threepointmade,72,a17e4a68-2999-4f60-b67e-3e80aa9e198b,basketball_play,1774143065,201,True,2026-03-22 01:31:05+00:00,3,601.0,1559.0,25.983333333333334,264
2,86,quarter,3,a17e4a68-2999-4f60-b67e-3e80aa9e198b,70,9:49,Bam Adebayo misses two point driving hook shot,twopointmiss,72,,basketball_play,1774143077,200,True,2026-03-22 01:31:17+00:00,3,589.0,1571.0,26.183333333333334,265
2,85,quarter,3,a8625e4b-4ae6-4062-a7c1-0b6e1f4ae211,70,9:47,Jabari Smith Jr. defensive rebound,rebound,72,a8625e4b-4ae6-4062-a7c1-0b6e1f4ae211,basketball_play,1774143079,199,True,2026-03-22 01:31:19+00:00,3,587.0,1573.0,26.216666666666665,266
2,84,quarter,3,a17e4a68-2999-4f60-b67e-3e80aa9e198b,70,9:40,Bam Adebayo personal foul (Alperen Sengun draws the foul),personalfoul,72,a8625e4b-4ae6-4062-a7c1-0b6e1f4ae211,basketball_play,1774143092,198,True,2026-03-22 01:31:32+00:00,3,580.0,1580.0,26.333333333333332,267
2,83,quarter,3,a8625e4b-4ae6-4062-a7c1-0b6e1f4ae211,70,9:32,Kevin Durant misses three point jump shot,threepointmiss,72,,basketball_play,1774143117,197,True,2026-03-22 01:31:57+00:00,3,572.0,1588.0,26.466666666666665,268
2,82,quarter,3,a17e4a68-2999-4f60-b67e-3e80aa9e198b,70,9:31,Bam Adebayo defensive rebound,rebound,72,a17e4a68-2999-4f60-b67e-3e80aa9e198b,basketball_play,1774143118,196,True,2026-03-22 01:31:58+00:00,3,571.0,1589.0,26.483333333333334,269
2,81,quarter,3,a17e4a68-2999-4f60-b67e-3e80aa9e198b,70,9:25,Davion Mitchell misses two point running layup,twopointmiss,72,,basketball_play,1774143124,195,True,2026-03-22 01:32:04+00:00,3,565.0,1595.0,26.583333333333332,270
2,80,quarter,3,a8625e4b-4ae6-4062-a7c1-0b6e1f4ae211,70,9:22,Alperen Sengun defensive rebound,rebound,72,a8625e4b-4ae6-4062-a7c1-0b6e1f4ae211,basketball_play,1774143126,194,True,2026-03-22 01:32:06+00:00,3,562.0,1598.0,26.633333333333333,271
2,79,quarter,3,a8625e4b-4ae6-4062-a7c1-0b6e1f4ae211,70,9:19,Amen Thompson makes two point running dunk (Alperen Sengun assists),twopointmade,74,a17e4a68-2999-4f60-b67e-3e80aa9e198b,basketball_play,1774143130,193,True,2026-03-22 01:32:10+00:00,3,559.0,1601.0,26.683333333333334,272
2,78,quarter,3,a17e4a68-2999-4f60-b67e-3e80aa9e198b,72,9:03,Tyler Herro makes two point driving finger roll layup,twopointmade,74,a8625e4b-4ae6-4062-a7c1-0b6e1f4ae211,basketball_play,1774143146,192,True,2026-03-22 01:32:26+00:00,3,543.0,1617.0,26.95,273
2,77,quarter,3,a8625e4b-4ae6-4062-a7c1-0b6e1f4ae211,72,8:45,Alperen Sengun makes two point driving dunk (Reed Sheppard assists),twopointmade,76,a17e4a68-2999-4f60-b67e-3e80aa9e198b,basketball_play,1774143163,191,True,2026-03-22 01:32:43+00:00,3,525.0,1635.0,27.25,274
2,76,quarter,3,a17e4a68-2999-4f60-b67e-3e80aa9e198b,74,8:35,Pelle Larsson makes two point turnaround hook shot,twopointmade,76,a8625e4b-4ae6-4062-a7c1-0b6e1f4ae211,basketball_play,1774143176,190,True,2026-03-22 01:32:56+00:00,3,515.0,1645.0,27.416666666666668,275
2,75,quarter,3,a8625e4b-4ae6-4062-a7c1-0b6e1f4ae211,74,8:35,Reed Sheppard shooting foul (Pelle Larsson draws the foul),shootingfoul,76,a17e4a68-2999-4f60-b67e-3e80aa9e198b,basketball_play,1774143178,189,True,2026-03-22 01:32:58+00:00,3,515.0,1645.0,27.416666666666668,276
2,74,quarter,3,a17e4a68-2999-4f60-b67e-3e80aa9e198b,75,8:35,Pelle Larsson makes regular free throw 1 of 1,freethrowmade,76,,basketball_play,1774143206,188,True,2026-03-22 01:33:26+00:00,3,515.0,1645.0,27.416666666666668,277
2,73,quarter,3,a8625e4b-4ae6-4062-a7c1-0b6e1f4ae211,75,8:14,Alperen Sengun turnover (out of bounds bad pass),turnover,76,a17e4a68-2999-4f60-b67e-3e80aa9e198b,basketball_play,1774143233,187,True,2026-03-22 01:33:53+00:00,3,494.0,1666.0,27.766666666666666,278
2,72,quarter,3,a17e4a68-2999-4f60-b67e-3e80aa9e198b,78,8:05,Tyler Herro makes three point pullup jump shot,threepointmade,76,a8625e4b-4ae6-4062-a7c1-0b6e1f4ae211,basketball_play,1774143249,186,True,2026-03-22 01:34:09+00:00,3,485.0,1675.0,27.916666666666668,279
2,71,quarter,3,a8625e4b-4ae6-4062-a7c1-0b6e1f4ae211,78,7:49,Kevin Durant makes two point jump shot (Amen Thompson assists),twopointmade,78,a17e4a68-2999-4f60-b67e-3e80aa9e198b,basketball_play,1774143265,185,True,2026-03-22 01:34:25+00:00,3,469.0,1691.0,28.183333333333334,280
2,70,quarter,3,,78,7:45,Stoppage (Equipment malfunction),stoppage,78,,basketball_play,1774143278,184,True,2026-03-22 01:34:38+00:00,3,465.0,1695.0,28.25,281
2,69,quarter,3,a17e4a68-2999-4f60-b67e-3e80aa9e198b,80,7:33,Pelle Larsson makes two point driving floating jump shot (Tyler Herro assists),twopointmade,78,a8625e4b-4ae6-4062-a7c1-0b6e1f4ae211,basketball_play,1774143301,183,True,2026-03-22 01:35:01+00:00,3,453.0,1707.0,28.45,282
2,68,quarter,3,a8625e4b-4ae6-4062-a7c1-0b6e1f4ae211,80,7:18,Kevin Durant misses three point fadeaway jump shot,threepointmiss,78,,basketball_play,1774143315,182,True,2026-03-22 01:35:15+00:00,3,438.0,1722.0,28.7,283
2,67,quarter,3,a8625e4b-4ae6-4062-a7c1-0b6e1f4ae211,80,7:18,Alperen Sengun offensive rebound,rebound,78,a8625e4b-4ae6-4062-a7c1-0b6e1f4ae211,basketball_play,1774143315,181,True,2026-03-22 01:35:15+00:00,3,438.0,1722.0,28.7,284
2,66,quarter,3,a8625e4b-4ae6-4062-a7c1-0b6e1f4ae211,80,7:16,Alperen Sengun makes two point putback layup,twopointmade,80,a17e4a68-2999-4f60-b67e-3e80aa9e198b,basketball_play,1774143317,180,True,2026-03-22 01:35:17+00:00,3,436.0,1724.0,28.733333333333334,285
2,65,quarter,3,a17e4a68-2999-4f60-b67e-3e80aa9e198b,83,7:11,Simone Fontecchio makes three point jump shot (Tyler Herro assists),threepointmade,80,a8625e4b-4ae6-4062-a7c1-0b6e1f4ae211,basketball_play,1774143322,179,True,2026-03-22 01:35:22+00:00,3,431.0,1729.0,28.816666666666666,286
2,64,quarter,3,a8625e4b-4ae6-4062-a7c1-0b6e1f4ae211,83,7:09,Rockets 60 second timeout,teamtimeout,80,,basketball_play,1774143335,178,True,2026-03-22 01:35:35+00:00,3,429.0,1731.0,28.85,287
2,63,quarter,3,a17e4a68-2999-4f60-b67e-3e80aa9e198b,83,7:09,"Heat lineup change (Myron Gardner, Pelle Larsson, Bam Adebayo, Tyler Herro, Simone Fontecchio)",lineupchange,80,,basketball_play,1774143447,177,True,2026-03-22 01:37:27+00:00,3,429.0,1731.0,28.85,288
2,62,quarter,3,a8625e4b-4ae6-4062-a7c1-0b6e1f4ae211,83,7:09,"Rockets lineup change (Kevin Durant, Jae'Sean Tate, Reed Sheppard, Jabari Smith Jr., Tari Eason)",lineupchange,80,,basketball_play,1774143447,176,True,2026-03-22 01:37:27+00:00,3,429.0,1731.0,28.85,289
2,61,quarter,3,a8625e4b-4ae6-4062-a7c1-0b6e1f4ae211,83,6:50,Tari Eason misses two point jump shot,twopointmiss,80,,basketball_play,1774143537,175,True,2026-03-22 01:38:57+00:00,3,410.0,1750.0,29.166666666666668,290
2,60,quarter,3,a17e4a68-2999-4f60-b67e-3e80aa9e198b,83,6:50,Bam Adebayo defensive rebound,rebound,80,a17e4a68-2999-4f60-b67e-3e80aa9e198b,basketball_play,1774143537,174,True,2026-03-22 01:38:57+00:00,3,410.0,1750.0,29.166666666666668,291
2,59,quarter,3,a17e4a68-2999-4f60-b67e-3e80aa9e198b,83,6:35,Pelle Larsson misses two point driving floating jump shot,twopointmiss,80,,basketball_play,1774143553,173,True,2026-03-22 01:39:13+00:00,3,395.0,1765.0,29.416666666666668,292
2,58,quarter,3,a8625e4b-4ae6-4062-a7c1-0b6e1f4ae211,83,6:34,Kevin Durant defensive rebound,rebound,80,a8625e4b-4ae6-4062-a7c1-0b6e1f4ae211,basketball_play,1774143554,172,True,2026-03-22 01:39:14+00:00,3,394.0,1766.0,29.433333333333334,293
2,57,quarter,3,a17e4a68-2999-4f60-b67e-3e80aa9e198b,83,6:20,Pelle Larsson personal foul (Jabari Smith Jr. draws the foul),personalfoul,80,a8625e4b-4ae6-4062-a7c1-0b6e1f4ae211,basketball_play,1774143570,171,True,2026-03-22 01:39:30+00:00,3,380.0,1780.0,29.666666666666668,294
2,56,quarter,3,a17e4a68-2999-4f60-b67e-3e80aa9e198b,83,6:20,"Heat lineup change (Myron Gardner, Davion Mitchell, Bam Adebayo, Tyler Herro, Simone Fontecchio)",lineupchange,80,,basketball_play,1774143612,170,True,2026-03-22 01:40:12+00:00,3,380.0,1780.0,29.666666666666668,295
2,55,quarter,3,a8625e4b-4ae6-4062-a7c1-0b6e1f4ae211,83,6:13,Tari Eason makes three point pullup jump shot,threepointmade,83,a17e4a68-2999-4f60-b67e-3e80aa9e198b,basketball_play,1774143612,169,True,2026-03-22 01:40:12+00:00,3,373.0,1787.0,29.783333333333335,296
2,54,quarter,3,a17e4a68-2999-4f60-b67e-3e80aa9e198b,83,5:59,Davion Mitchell misses three point jump shot,threepointmiss,83,,basketball_play,1774143635,168,True,2026-03-22 01:40:35+00:00,3,359.0,1801.0,30.016666666666666,297
2,53,quarter,3,a8625e4b-4ae6-4062-a7c1-0b6e1f4ae211,83,5:56,Jabari Smith Jr. defensive rebound,rebound,83,a8625e4b-4ae6-4062-a7c1-0b6e1f4ae211,basketball_play,1774143638,167,True,2026-03-22 01:40:38+00:00,3,356.0,1804.0,30.066666666666666,298
2,52,quarter,3,a8625e4b-4ae6-4062-a7c1-0b6e1f4ae211,83,5:42,Tari Eason makes two point driving layup (Jabari Smith Jr. assists),twopointmade,85,a17e4a68-2999-4f60-b67e-3e80aa9e198b,basketball_play,1774143643,166,True,2026-03-22 01:40:43+00:00,3,342.0,1818.0,30.3,299
2,51,quarter,3,a17e4a68-2999-4f60-b67e-3e80aa9e198b,83,5:21,Myron Gardner turnover (out of bounds lost ball),turnover,85,a8625e4b-4ae6-4062-a7c1-0b6e1f4ae211,basketball_play,1774143667,165,True,2026-03-22 01:41:07+00:00,3,321.0,1839.0,30.65,300
2,50,quarter,3,a8625e4b-4ae6-4062-a7c1-0b6e1f4ae211,83,5:02,Kevin Durant misses two point pullup jump shot,twopointmiss,85,,basketball_play,1774143695,164,True,2026-03-22 01:41:35+00:00,3,302.0,1858.0,30.966666666666665,301
2,49,quarter,3,a17e4a68-2999-4f60-b67e-3e80aa9e198b,83,5:00,Bam Adebayo defensive rebound,rebound,85,a17e4a68-2999-4f60-b67e-3e80aa9e198b,basketball_play,1774143697,163,True,2026-03-22 01:41:37+00:00,3,300.0,1860.0,31.0,302
2,48,quarter,3,a17e4a68-2999-4f60-b67e-3e80aa9e198b,83,4:48,Tyler Herro misses two point pullup jump shot,twopointmiss,85,,basketball_play,1774143709,162,True,2026-03-22 01:41:49+00:00,3,288.0,1872.0,31.2,303
2,47,quarter,3,a17e4a68-2999-4f60-b67e-3e80aa9e198b,83,4:46,Myron Gardner offensive rebound,rebound,85,a17e4a68-2999-4f60-b67e-3e80aa9e198b,basketball_play,1774143711,161,True,2026-03-22 01:41:51+00:00,3,286.0,1874.0,31.233333333333334,304
2,46,quarter,3,a8625e4b-4ae6-4062-a7c1-0b6e1f4ae211,83,4:45,Jae'Sean Tate personal foul (Myron Gardner draws the foul),personalfoul,85,a17e4a68-2999-4f60-b67e-3e80aa9e198b,basketball_play,1774143715,160,True,2026-03-22 01:41:55+00:00,3,285.0,1875.0,31.25,305
2,45,quarter,3,a17e4a68-2999-4f60-b67e-3e80aa9e198b,83,4:38,Davion Mitchell misses three point pullup jump shot,threepointmiss,85,,basketball_play,1774143739,159,True,2026-03-22 01:42:19+00:00,3,278.0,1882.0,31.366666666666667,306
2,44,quarter,3,a17e4a68-2999-4f60-b67e-3e80aa9e198b,83,4:36,Bam Adebayo offensive rebound,rebound,85,a17e4a68-2999-4f60-b67e-3e80aa9e198b,basketball_play,1774143741,158,True,2026-03-22 01:42:21+00:00,3,276.0,1884.0,31.4,307
2,43,quarter,3,a8625e4b-4ae6-4062-a7c1-0b6e1f4ae211,83,4:32,Jae'Sean Tate personal foul (Tyler Herro draws the foul),personalfoul,85,a17e4a68-2999-4f60-b67e-3e80aa9e198b,basketball_play,1774143747,157,True,2026-03-22 01:42:27+00:00,3,272.0,1888.0,31.466666666666665,308
2,42,quarter,3,a8625e4b-4ae6-4062-a7c1-0b6e1f4ae211,83,4:32,Tari Eason personal foul (Tyler Herro draws the foul),personalfoul,85,a17e4a68-2999-4f60-b67e-3e80aa9e198b,basketball_play,1774143771,156,True,2026-03-22 01:42:51+00:00,3,272.0,1888.0,31.466666666666665,309
2,41,quarter,3,a17e4a68-2999-4f60-b67e-3e80aa9e198b,85,4:18,Tyler Herro makes two point floating jump shot (Myron Gardner assists),twopointmade,85,a8625e4b-4ae6-4062-a7c1-0b6e1f4ae211,basketball_play,1774143796,155,True,2026-03-22 01:43:16+00:00,3,258.0,1902.0,31.7,310
2,40,quarter,3,a8625e4b-4ae6-4062-a7c1-0b6e1f4ae211,85,4:06,Tari Eason misses three point jump shot,threepointmiss,85,,basketball_play,1774143807,154,True,2026-03-22 01:43:27+00:00,3,246.0,1914.0,31.9,311
2,39,quarter,3,a17e4a68-2999-4f60-b67e-3e80aa9e198b,85,4:06,Myron Gardner defensive rebound,rebound,85,a17e4a68-2999-4f60-b67e-3e80aa9e198b,basketball_play,1774143807,153,True,2026-03-22 01:43:27+00:00,3,246.0,1914.0,31.9,312
2,38,quarter,3,a17e4a68-2999-4f60-b67e-3e80aa9e198b,85,3:58,Davion Mitchell misses three point running jump shot,threepointmiss,85,,basketball_play,1774143815,152,True,2026-03-22 01:43:35+00:00,3,238.0,1922.0,32.03333333333333,313
2,37,quarter,3,a17e4a68-2999-4f60-b67e-3e80aa9e198b,85,3:54,Bam Adebayo offensive rebound,rebound,85,a17e4a68-2999-4f60-b67e-3e80aa9e198b,basketball_play,1774143819,151,True,2026-03-22 01:43:39+00:00,3,234.0,1926.0,32.1,314
2,36,quarter,3,a17e4a68-2999-4f60-b67e-3e80aa9e198b,85,3:54,Bam Adebayo misses two point tip layup,twopointmiss,85,,basketball_play,1774143818,150,True,2026-03-22 01:43:38+00:00,3,234.0,1926.0,32.1,315
2,35,quarter,3,a8625e4b-4ae6-4062-a7c1-0b6e1f4ae211,85,3:53,Reed Sheppard defensive rebound,rebound,85,a8625e4b-4ae6-4062-a7c1-0b6e1f4ae211,basketball_play,1774143820,149,True,2026-03-22 01:43:40+00:00,3,233.0,1927.0,32.11666666666667,316
2,34,quarter,3,a8625e4b-4ae6-4062-a7c1-0b6e1f4ae211,85,3:38,Jabari Smith Jr. misses three point jump shot,threepointmiss,85,,basketball_play,1774143836,148,True,2026-03-22 01:43:56+00:00,3,218.0,1942.0,32.36666666666667,317
