period_index,event_index,period_type,period_number,attribution,away_points,clock,description,event_type,home_points,possession,type,wall_clock,pbp_source_row,has_wall_clock,event_ts_utc,period_sequence,game_clock_seconds_remaining,game_elapsed_seconds,game_elapsed_minutes,pbp_chronological_index
4,124,quarter,1,a17e4a68-2999-4f60-b67e-3e80aa9e198b,0,12:00,"Heat lineup change (Pelle Larsson, Davion Mitchell, Bam Adebayo, Tyler Herro, Simone Fontecchio)",lineupchange,0,,basketball_play,1774138291,464,True,2026-03-22 00:11:31+00:00,1,720.0,0.0,0.0,1
4,123,quarter,1,a8625e4b-4ae6-4062-a7c1-0b6e1f4ae211,0,12:00,"Rockets lineup change (Kevin Durant, Amen Thompson, Alperen Sengun, Reed Sheppard, Jabari Smith Jr.)",lineupchange,0,,basketball_play,1774138291,463,True,2026-03-22 00:11:31+00:00,1,720.0,0.0,0.0,2
4,122,quarter,1,,0,12:00,Start of 1st Quarter,startperiod,0,,basketball_play,1774138291,462,True,2026-03-22 00:11:31+00:00,1,720.0,0.0,0.0,3
4,121,quarter,1,a17e4a68-2999-4f60-b67e-3e80aa9e198b,0,12:00,Bam Adebayo vs. Alperen Sengun (Davion Mitchell gains possession),opentip,0,a17e4a68-2999-4f60-b67e-3e80aa9e198b,basketball_play,1774138293,461,True,2026-03-22 00:11:33+00:00,1,720.0,0.0,0.0,4
4,120,quarter,1,a17e4a68-2999-4f60-b67e-3e80aa9e198b,0,11:40,Bam Adebayo misses two point turnaround fadeaway jump shot,twopointmiss,0,,basketball_play,1774138310,460,True,2026-03-22 00:11:50+00:00,1,700.0,20.0,0.3333333333333333,5
4,119,quarter,1,a8625e4b-4ae6-4062-a7c1-0b6e1f4ae211,0,11:40,Kevin Durant defensive rebound,rebound,0,a8625e4b-4ae6-4062-a7c1-0b6e1f4ae211,basketball_play,1774138310,459,True,2026-03-22 00:11:50+00:00,1,700.0,20.0,0.3333333333333333,6
4,118,quarter,1,a8625e4b-4ae6-4062-a7c1-0b6e1f4ae211,0,11:31,Amen Thompson makes two point cutting layup (Alperen Sengun assists),twopointmade,2,a17e4a68-2999-4f60-b67e-3e80aa9e198b,basketball_play,1774138322,458,True,2026-03-22 00:12:02+00:00,1,691.0,29.0,0.48333333333333334,7
4,117,quarter,1,a17e4a68-2999-4f60-b67e-3e80aa9e198b,0,11:31,Davion Mitchell shooting foul (Amen Thompson draws the foul),shootingfoul,2,a8625e4b-4ae6-4062-a7c1-0b6e1f4ae211,basketball_play,1774138324,457,True,2026-03-22 00:12:04+00:00,1,691.0,29.0,0.48333333333333334,8
4,116,quarter,1,a8625e4b-4ae6-4062-a7c1-0b6e1f4ae211,0,11:31,Amen Thompson makes regular free throw 1 of 1,freethrowmade,3,,basketball_play,1774138350,456,True,2026-03-22 00:12:30+00:00,1,691.0,29.0,0.48333333333333334,9
4,115,quarter,1,a17e4a68-2999-4f60-b67e-3e80aa9e198b,0,11:22,Davion Mitchell turnover (lost ball) (Reed Sheppard steals),turnover,3,a8625e4b-4ae6-4062-a7c1-0b6e1f4ae211,basketball_play,1774138359,455,True,2026-03-22 00:12:39+00:00,1,682.0,38.0,0.6333333333333333,10
4,114,quarter,1,a8625e4b-4ae6-4062-a7c1-0b6e1f4ae211,0,11:05,Reed Sheppard makes three point jump shot (Amen Thompson assists),threepointmade,6,a17e4a68-2999-4f60-b67e-3e80aa9e198b,basketball_play,1774138377,454,True,2026-03-22 00:12:57+00:00,1,665.0,55.0,0.9166666666666666,11
4,113,quarter,1,a17e4a68-2999-4f60-b67e-3e80aa9e198b,0,10:51,Bam Adebayo turnover (out of bounds bad pass),turnover,6,a8625e4b-4ae6-4062-a7c1-0b6e1f4ae211,basketball_play,1774138390,453,True,2026-03-22 00:13:10+00:00,1,651.0,69.0,1.15,12
4,112,quarter,1,a8625e4b-4ae6-4062-a7c1-0b6e1f4ae211,0,10:42,Alperen Sengun makes two point pullup jump shot,twopointmade,8,a17e4a68-2999-4f60-b67e-3e80aa9e198b,basketball_play,1774138414,452,True,2026-03-22 00:13:34+00:00,1,642.0,78.0,1.3,13
4,111,quarter,1,a17e4a68-2999-4f60-b67e-3e80aa9e198b,3,10:28,Simone Fontecchio makes three point jump shot (Bam Adebayo assists),threepointmade,8,a8625e4b-4ae6-4062-a7c1-0b6e1f4ae211,basketball_play,1774138429,451,True,2026-03-22 00:13:49+00:00,1,628.0,92.0,1.5333333333333334,14
4,110,quarter,1,a8625e4b-4ae6-4062-a7c1-0b6e1f4ae211,3,10:09,Amen Thompson misses two point pullup jump shot,twopointmiss,8,,basketball_play,1774138447,450,True,2026-03-22 00:14:07+00:00,1,609.0,111.0,1.85,15
4,109,quarter,1,a17e4a68-2999-4f60-b67e-3e80aa9e198b,3,10:09,Simone Fontecchio defensive rebound,rebound,8,a17e4a68-2999-4f60-b67e-3e80aa9e198b,basketball_play,1774138447,449,True,2026-03-22 00:14:07+00:00,1,609.0,111.0,1.85,16
4,108,quarter,1,a17e4a68-2999-4f60-b67e-3e80aa9e198b,5,10:03,Simone Fontecchio makes two point running dunk (Davion Mitchell assists),twopointmade,8,a8625e4b-4ae6-4062-a7c1-0b6e1f4ae211,basketball_play,1774138454,448,True,2026-03-22 00:14:14+00:00,1,603.0,117.0,1.95,17
4,107,quarter,1,a17e4a68-2999-4f60-b67e-3e80aa9e198b,5,9:44,Pelle Larsson personal foul (Alperen Sengun draws the foul),personalfoul,8,a8625e4b-4ae6-4062-a7c1-0b6e1f4ae211,basketball_play,1774138475,447,True,2026-03-22 00:14:35+00:00,1,584.0,136.0,2.2666666666666666,18
4,106,quarter,1,a8625e4b-4ae6-4062-a7c1-0b6e1f4ae211,5,9:36,Amen Thompson misses two point alley-oop dunk,twopointmiss,8,,basketball_play,1774138505,446,True,2026-03-22 00:15:05+00:00,1,576.0,144.0,2.4,19
4,105,quarter,1,a17e4a68-2999-4f60-b67e-3e80aa9e198b,5,9:34,Simone Fontecchio defensive rebound,rebound,8,a17e4a68-2999-4f60-b67e-3e80aa9e198b,basketball_play,1774138507,445,True,2026-03-22 00:15:07+00:00,1,574.0,146.0,2.433333333333333,20
4,104,quarter,1,a17e4a68-2999-4f60-b67e-3e80aa9e198b,5,9:30,Tyler Herro misses three point running jump shot,threepointmiss,8,,basketball_play,1774138511,444,True,2026-03-22 00:15:11+00:00,1,570.0,150.0,2.5,21
4,103,quarter,1,a17e4a68-2999-4f60-b67e-3e80aa9e198b,5,9:26,Bam Adebayo offensive rebound,rebound,8,a17e4a68-2999-4f60-b67e-3e80aa9e198b,basketball_play,1774138515,443,True,2026-03-22 00:15:15+00:00,1,566.0,154.0,2.566666666666667,22
4,102,quarter,1,a17e4a68-2999-4f60-b67e-3e80aa9e198b,7,9:25,Bam Adebayo makes two point putback layup,twopointmade,8,a8625e4b-4ae6-4062-a7c1-0b6e1f4ae211,basketball_play,1774138516,442,True,2026-03-22 00:15:16+00:00,1,565.0,155.0,2.5833333333333335,23
4,101,quarter,1,a8625e4b-4ae6-4062-a7c1-0b6e1f4ae211,7,9:18,Jabari Smith Jr. turnover (lost ball) (Davion Mitchell steals),turnover,8,a17e4a68-2999-4f60-b67e-3e80aa9e198b,basketball_play,1774138523,441,True,2026-03-22 00:15:23+00:00,1,558.0,162.0,2.7,24
4,100,quarter,1,a17e4a68-2999-4f60-b67e-3e80aa9e198b,9,9:14,Tyler Herro makes two point running finger roll layup,twopointmade,8,a8625e4b-4ae6-4062-a7c1-0b6e1f4ae211,basketball_play,1774138529,440,True,2026-03-22 00:15:29+00:00,1,554.0,166.0,2.7666666666666666,25
4,99,quarter,1,a8625e4b-4ae6-4062-a7c1-0b6e1f4ae211,9,9:14,Jabari Smith Jr. shooting foul (Tyler Herro draws the foul),shootingfoul,8,a17e4a68-2999-4f60-b67e-3e80aa9e198b,basketball_play,1774138532,439,True,2026-03-22 00:15:32+00:00,1,554.0,166.0,2.7666666666666666,26
4,98,quarter,1,a17e4a68-2999-4f60-b67e-3e80aa9e198b,10,9:14,Tyler Herro makes regular free throw 1 of 1,freethrowmade,8,,basketball_play,1774138562,438,True,2026-03-22 00:16:02+00:00,1,554.0,166.0,2.7666666666666666,27
4,97,quarter,1,a8625e4b-4ae6-4062-a7c1-0b6e1f4ae211,10,9:00,Reed Sheppard misses three point jump shot,threepointmiss,8,,basketball_play,1774138579,437,True,2026-03-22 00:16:19+00:00,1,540.0,180.0,3.0,28
4,96,quarter,1,a17e4a68-2999-4f60-b67e-3e80aa9e198b,10,8:59,Simone Fontecchio defensive rebound,rebound,8,a17e4a68-2999-4f60-b67e-3e80aa9e198b,basketball_play,1774138580,436,True,2026-03-22 00:16:20+00:00,1,539.0,181.0,3.0166666666666666,29
4,95,quarter,1,a17e4a68-2999-4f60-b67e-3e80aa9e198b,10,8:51,Tyler Herro misses three point jump shot,threepointmiss,8,,basketball_play,1774138589,435,True,2026-03-22 00:16:29+00:00,1,531.0,189.0,3.15,30
4,94,quarter,1,a17e4a68-2999-4f60-b67e-3e80aa9e198b,10,8:50,Pelle Larsson offensive rebound,rebound,8,a17e4a68-2999-4f60-b67e-3e80aa9e198b,basketball_play,1774138590,434,True,2026-03-22 00:16:30+00:00,1,530.0,190.0,3.1666666666666665,31
4,93,quarter,1,a17e4a68-2999-4f60-b67e-3e80aa9e198b,10,8:39,Bam Adebayo misses three point jump shot,threepointmiss,8,,basketball_play,1774138601,433,True,2026-03-22 00:16:41+00:00,1,519.0,201.0,3.35,32
4,92,quarter,1,a17e4a68-2999-4f60-b67e-3e80aa9e198b,10,8:37,Pelle Larsson offensive rebound,rebound,8,a17e4a68-2999-4f60-b67e-3e80aa9e198b,basketball_play,1774138603,432,True,2026-03-22 00:16:43+00:00,1,517.0,203.0,3.3833333333333333,33
4,91,quarter,1,a17e4a68-2999-4f60-b67e-3e80aa9e198b,12,8:29,Tyler Herro makes two point driving finger roll layup,twopointmade,8,a8625e4b-4ae6-4062-a7c1-0b6e1f4ae211,basketball_play,1774138611,431,True,2026-03-22 00:16:51+00:00,1,509.0,211.0,3.5166666666666666,34
4,90,quarter,1,a8625e4b-4ae6-4062-a7c1-0b6e1f4ae211,12,8:12,Amen Thompson makes two point layup (Jabari Smith Jr. assists),twopointmade,10,a17e4a68-2999-4f60-b67e-3e80aa9e198b,basketball_play,1774138629,430,True,2026-03-22 00:17:09+00:00,1,492.0,228.0,3.8,35
4,89,quarter,1,a17e4a68-2999-4f60-b67e-3e80aa9e198b,12,8:12,Bam Adebayo shooting foul (Amen Thompson draws the foul),shootingfoul,10,a8625e4b-4ae6-4062-a7c1-0b6e1f4ae211,basketball_play,1774138631,429,True,2026-03-22 00:17:11+00:00,1,492.0,228.0,3.8,36
4,88,quarter,1,a8625e4b-4ae6-4062-a7c1-0b6e1f4ae211,12,8:12,"Rockets lineup change (Kevin Durant, Amen Thompson, Alperen Sengun, Jabari Smith Jr., Tari Eason)",lineupchange,10,,basketball_play,1774138672,428,True,2026-03-22 00:17:52+00:00,1,492.0,228.0,3.8,37
4,87,quarter,1,a8625e4b-4ae6-4062-a7c1-0b6e1f4ae211,12,8:12,Amen Thompson makes regular free throw 1 of 1,freethrowmade,11,,basketball_play,1774138672,427,True,2026-03-22 00:17:52+00:00,1,492.0,228.0,3.8,38
4,86,quarter,1,a8625e4b-4ae6-4062-a7c1-0b6e1f4ae211,12,8:07,Alperen Sengun shooting foul (Pelle Larsson draws the foul),shootingfoul,11,a17e4a68-2999-4f60-b67e-3e80aa9e198b,basketball_play,1774138685,426,True,2026-03-22 00:18:05+00:00,1,487.0,233.0,3.8833333333333333,39
4,85,quarter,1,a17e4a68-2999-4f60-b67e-3e80aa9e198b,12,8:07,Pelle Larsson misses regular free throw 1 of 2,freethrowmiss,11,a17e4a68-2999-4f60-b67e-3e80aa9e198b,basketball_play,1774138717,425,True,2026-03-22 00:18:37+00:00,1,487.0,233.0,3.8833333333333333,40
4,84,quarter,1,a17e4a68-2999-4f60-b67e-3e80aa9e198b,12,8:07,Heat offensive rebound,rebound,11,a17e4a68-2999-4f60-b67e-3e80aa9e198b,basketball_play,1774138717,424,True,2026-03-22 00:18:37+00:00,1,487.0,233.0,3.8833333333333333,41
4,83,quarter,1,a17e4a68-2999-4f60-b67e-3e80aa9e198b,13,8:07,Pelle Larsson makes regular free throw 2 of 2,freethrowmade,11,a8625e4b-4ae6-4062-a7c1-0b6e1f4ae211,basketball_play,1774138732,423,True,2026-03-22 00:18:52+00:00,1,487.0,233.0,3.8833333333333333,42
4,82,quarter,1,a8625e4b-4ae6-4062-a7c1-0b6e1f4ae211,13,7:56,Jabari Smith Jr. misses three point jump shot,threepointmiss,11,,basketball_play,1774138746,422,True,2026-03-22 00:19:06+00:00,1,476.0,244.0,4.066666666666666,43
4,81,quarter,1,a17e4a68-2999-4f60-b67e-3e80aa9e198b,13,7:54,Bam Adebayo defensive rebound,rebound,11,a17e4a68-2999-4f60-b67e-3e80aa9e198b,basketball_play,1774138748,421,True,2026-03-22 00:19:08+00:00,1,474.0,246.0,4.1,44
4,80,quarter,1,a17e4a68-2999-4f60-b67e-3e80aa9e198b,15,7:34,Tyler Herro makes two point driving finger roll layup,twopointmade,11,a8625e4b-4ae6-4062-a7c1-0b6e1f4ae211,basketball_play,1774138769,420,True,2026-03-22 00:19:29+00:00,1,454.0,266.0,4.433333333333334,45
4,79,quarter,1,a8625e4b-4ae6-4062-a7c1-0b6e1f4ae211,15,7:12,Amen Thompson misses two point pullup jump shot,twopointmiss,11,,basketball_play,1774138790,419,True,2026-03-22 00:19:50+00:00,1,432.0,288.0,4.8,46
4,78,quarter,1,a17e4a68-2999-4f60-b67e-3e80aa9e198b,15,7:12,Bam Adebayo defensive rebound,rebound,11,a17e4a68-2999-4f60-b67e-3e80aa9e198b,basketball_play,1774138790,418,True,2026-03-22 00:19:50+00:00,1,432.0,288.0,4.8,47
4,77,quarter,1,a17e4a68-2999-4f60-b67e-3e80aa9e198b,18,7:05,Pelle Larsson makes three point pullup jump shot (Bam Adebayo assists),threepointmade,11,a8625e4b-4ae6-4062-a7c1-0b6e1f4ae211,basketball_play,1774138798,417,True,2026-03-22 00:19:58+00:00,1,425.0,295.0,4.916666666666667,48
4,76,quarter,1,a8625e4b-4ae6-4062-a7c1-0b6e1f4ae211,18,6:43,Alperen Sengun misses two point driving floating bank jump shot,twopointmiss,11,,basketball_play,1774138819,416,True,2026-03-22 00:20:19+00:00,1,403.0,317.0,5.283333333333333,49
4,75,quarter,1,a8625e4b-4ae6-4062-a7c1-0b6e1f4ae211,18,6:41,Amen Thompson offensive rebound,rebound,11,a8625e4b-4ae6-4062-a7c1-0b6e1f4ae211,basketball_play,1774138821,415,True,2026-03-22 00:20:21+00:00,1,401.0,319.0,5.316666666666666,50
4,74,quarter,1,a8625e4b-4ae6-4062-a7c1-0b6e1f4ae211,18,6:40,Amen Thompson turnover (bad pass) (Tyler Herro steals),turnover,11,a17e4a68-2999-4f60-b67e-3e80aa9e198b,basketball_play,1774138823,414,True,2026-03-22 00:20:23+00:00,1,400.0,320.0,5.333333333333333,51
4,73,quarter,1,a17e4a68-2999-4f60-b67e-3e80aa9e198b,18,6:35,Davion Mitchell misses three point running jump shot,threepointmiss,11,,basketball_play,1774138828,413,True,2026-03-22 00:20:28+00:00,1,395.0,325.0,5.416666666666667,52
4,72,quarter,1,a8625e4b-4ae6-4062-a7c1-0b6e1f4ae211,18,6:33,Rockets defensive rebound,rebound,11,a8625e4b-4ae6-4062-a7c1-0b6e1f4ae211,basketball_play,1774138830,412,True,2026-03-22 00:20:30+00:00,1,393.0,327.0,5.45,53
4,71,quarter,1,a8625e4b-4ae6-4062-a7c1-0b6e1f4ae211,18,6:33,Rockets 60 second timeout,teamtimeout,11,,basketball_play,1774138843,411,True,2026-03-22 00:20:43+00:00,1,393.0,327.0,5.45,54
4,70,quarter,1,a8625e4b-4ae6-4062-a7c1-0b6e1f4ae211,18,6:33,"Rockets lineup change (Kevin Durant, Alperen Sengun, Reed Sheppard, Jabari Smith Jr., Tari Eason)",lineupchange,11,,basketball_play,1774139040,410,True,2026-03-22 00:24:00+00:00,1,393.0,327.0,5.45,55
4,69,quarter,1,a8625e4b-4ae6-4062-a7c1-0b6e1f4ae211,18,6:11,Jabari Smith Jr. misses three point jump shot,threepointmiss,11,,basketball_play,1774139040,409,True,2026-03-22 00:24:00+00:00,1,371.0,349.0,5.816666666666666,56
4,68,quarter,1,a8625e4b-4ae6-4062-a7c1-0b6e1f4ae211,18,6:09,Alperen Sengun offensive rebound,rebound,11,a8625e4b-4ae6-4062-a7c1-0b6e1f4ae211,basketball_play,1774139042,408,True,2026-03-22 00:24:02+00:00,1,369.0,351.0,5.85,57
4,67,quarter,1,a8625e4b-4ae6-4062-a7c1-0b6e1f4ae211,18,6:05,Kevin Durant misses three point pullup jump shot,threepointmiss,11,,basketball_play,1774139046,407,True,2026-03-22 00:24:06+00:00,1,365.0,355.0,5.916666666666667,58
4,66,quarter,1,a17e4a68-2999-4f60-b67e-3e80aa9e198b,18,6:03,Bam Adebayo defensive rebound,rebound,11,a17e4a68-2999-4f60-b67e-3e80aa9e198b,basketball_play,1774139048,406,True,2026-03-22 00:24:08+00:00,1,363.0,357.0,5.95,59
4,65,quarter,1,a17e4a68-2999-4f60-b67e-3e80aa9e198b,18,5:48,Davion Mitchell misses three point jump shot,threepointmiss,11,,basketball_play,1774139063,405,True,2026-03-22 00:24:23+00:00,1,348.0,372.0,6.2,60
4,64,quarter,1,a17e4a68-2999-4f60-b67e-3e80aa9e198b,18,5:45,Pelle Larsson offensive rebound,rebound,11,a17e4a68-2999-4f60-b67e-3e80aa9e198b,basketball_play,1774139066,404,True,2026-03-22 00:24:26+00:00,1,345.0,375.0,6.25,61
4,63,quarter,1,a17e4a68-2999-4f60-b67e-3e80aa9e198b,21,5:43,Simone Fontecchio makes three point jump shot (Pelle Larsson assists),threepointmade,11,a8625e4b-4ae6-4062-a7c1-0b6e1f4ae211,basketball_play,1774139068,403,True,2026-03-22 00:24:28+00:00,1,343.0,377.0,6.283333333333333,62
4,62,quarter,1,a8625e4b-4ae6-4062-a7c1-0b6e1f4ae211,21,5:21,Kevin Durant turnover (bad pass) (Bam Adebayo steals),turnover,11,a17e4a68-2999-4f60-b67e-3e80aa9e198b,basketball_play,1774139090,402,True,2026-03-22 00:24:50+00:00,1,321.0,399.0,6.65,63
4,61,quarter,1,a17e4a68-2999-4f60-b67e-3e80aa9e198b,23,5:18,Bam Adebayo makes two point running dunk (Pelle Larsson assists),twopointmade,11,a8625e4b-4ae6-4062-a7c1-0b6e1f4ae211,basketball_play,1774139093,401,True,2026-03-22 00:24:53+00:00,1,318.0,402.0,6.7,64
4,60,quarter,1,a8625e4b-4ae6-4062-a7c1-0b6e1f4ae211,23,5:18,Rockets 60 second timeout,teamtimeout,11,,basketball_play,1774139098,400,True,2026-03-22 00:24:58+00:00,1,318.0,402.0,6.7,65
4,59,quarter,1,a17e4a68-2999-4f60-b67e-3e80aa9e198b,23,5:18,"Heat lineup change (Myron Gardner, Davion Mitchell, Tyler Herro, Simone Fontecchio, Kel'el Ware)",lineupchange,11,,basketball_play,1774139243,399,True,2026-03-22 00:27:23+00:00,1,318.0,402.0,6.7,66
4,58,quarter,1,a8625e4b-4ae6-4062-a7c1-0b6e1f4ae211,23,5:18,"Rockets lineup change (Kevin Durant, Dorian Finney-Smith, Reed Sheppard, Jabari Smith Jr., Tari Eason)",lineupchange,11,,basketball_play,1774139243,398,True,2026-03-22 00:27:23+00:00,1,318.0,402.0,6.7,67
4,57,quarter,1,,23,5:01,Stoppage (Out of bounds),stoppage,11,,basketball_play,1774139291,397,True,2026-03-22 00:28:11+00:00,1,301.0,419.0,6.983333333333333,68
4,56,quarter,1,a8625e4b-4ae6-4062-a7c1-0b6e1f4ae211,23,4:56,Reed Sheppard misses two point driving floating jump shot,twopointmiss,11,,basketball_play,1774139310,396,True,2026-03-22 00:28:30+00:00,1,296.0,424.0,7.066666666666666,69
4,55,quarter,1,a17e4a68-2999-4f60-b67e-3e80aa9e198b,23,4:56,Kel'el Ware defensive rebound,rebound,11,a17e4a68-2999-4f60-b67e-3e80aa9e198b,basketball_play,1774139310,395,True,2026-03-22 00:28:30+00:00,1,296.0,424.0,7.066666666666666,70
4,54,quarter,1,a17e4a68-2999-4f60-b67e-3e80aa9e198b,23,4:41,Kel'el Ware turnover (lost ball) (Reed Sheppard steals),turnover,11,a8625e4b-4ae6-4062-a7c1-0b6e1f4ae211,basketball_play,1774139325,394,True,2026-03-22 00:28:45+00:00,1,281.0,439.0,7.316666666666666,71
4,53,quarter,1,a8625e4b-4ae6-4062-a7c1-0b6e1f4ae211,23,4:33,Tari Eason misses three point jump shot,threepointmiss,11,,basketball_play,1774139334,393,True,2026-03-22 00:28:54+00:00,1,273.0,447.0,7.45,72
4,52,quarter,1,a17e4a68-2999-4f60-b67e-3e80aa9e198b,23,4:33,Tyler Herro defensive rebound,rebound,11,a17e4a68-2999-4f60-b67e-3e80aa9e198b,basketball_play,1774139334,392,True,2026-03-22 00:28:54+00:00,1,273.0,447.0,7.45,73
4,51,quarter,1,a17e4a68-2999-4f60-b67e-3e80aa9e198b,23,4:27,Davion Mitchell misses three point running jump shot,threepointmiss,11,,basketball_play,1774139341,391,True,2026-03-22 00:29:01+00:00,1,267.0,453.0,7.55,74
4,50,quarter,1,a8625e4b-4ae6-4062-a7c1-0b6e1f4ae211,23,4:22,Jabari Smith Jr. defensive rebound,rebound,11,a8625e4b-4ae6-4062-a7c1-0b6e1f4ae211,basketball_play,1774139346,390,True,2026-03-22 00:29:06+00:00,1,262.0,458.0,7.633333333333334,75
4,49,quarter,1,a17e4a68-2999-4f60-b67e-3e80aa9e198b,23,4:20,Davion Mitchell shooting foul (Tari Eason draws the foul),shootingfoul,11,a8625e4b-4ae6-4062-a7c1-0b6e1f4ae211,basketball_play,1774139357,389,True,2026-03-22 00:29:17+00:00,1,260.0,460.0,7.666666666666667,76
4,48,quarter,1,a8625e4b-4ae6-4062-a7c1-0b6e1f4ae211,23,4:20,Tari Eason makes regular free throw 1 of 2,freethrowmade,12,a8625e4b-4ae6-4062-a7c1-0b6e1f4ae211,basketball_play,1774139382,388,True,2026-03-22 00:29:42+00:00,1,260.0,460.0,7.666666666666667,77
4,47,quarter,1,a17e4a68-2999-4f60-b67e-3e80aa9e198b,23,4:20,"Heat lineup change (Myron Gardner, Tyler Herro, Simone Fontecchio, Kel'el Ware, Dru Smith)",lineupchange,12,,basketball_play,1774139382,387,True,2026-03-22 00:29:42+00:00,1,260.0,460.0,7.666666666666667,78
4,46,quarter,1,a8625e4b-4ae6-4062-a7c1-0b6e1f4ae211,23,4:20,"Rockets lineup change (Kevin Durant, Dorian Finney-Smith, Amen Thompson, Reed Sheppard, Tari Eason)",lineupchange,12,,basketball_play,1774139382,386,True,2026-03-22 00:29:42+00:00,1,260.0,460.0,7.666666666666667,79
4,45,quarter,1,a8625e4b-4ae6-4062-a7c1-0b6e1f4ae211,23,4:20,Tari Eason makes regular free throw 2 of 2,freethrowmade,13,a17e4a68-2999-4f60-b67e-3e80aa9e198b,basketball_play,1774139406,385,True,2026-03-22 00:30:06+00:00,1,260.0,460.0,7.666666666666667,80
4,44,quarter,1,a17e4a68-2999-4f60-b67e-3e80aa9e198b,23,4:10,Simone Fontecchio misses three point jump shot,threepointmiss,13,,basketball_play,1774139417,384,True,2026-03-22 00:30:17+00:00,1,250.0,470.0,7.833333333333333,81
4,43,quarter,1,a8625e4b-4ae6-4062-a7c1-0b6e1f4ae211,23,4:09,Amen Thompson defensive rebound,rebound,13,a8625e4b-4ae6-4062-a7c1-0b6e1f4ae211,basketball_play,1774139418,383,True,2026-03-22 00:30:18+00:00,1,249.0,471.0,7.85,82
4,42,quarter,1,a8625e4b-4ae6-4062-a7c1-0b6e1f4ae211,23,4:00,Amen Thompson makes two point driving layup,twopointmade,15,a17e4a68-2999-4f60-b67e-3e80aa9e198b,basketball_play,1774139427,382,True,2026-03-22 00:30:27+00:00,1,240.0,480.0,8.0,83
4,41,quarter,1,,23,3:46,Stoppage (Out of bounds),stoppage,15,,basketball_play,1774139443,381,True,2026-03-22 00:30:43+00:00,1,226.0,494.0,8.233333333333333,84
4,40,quarter,1,a17e4a68-2999-4f60-b67e-3e80aa9e198b,23,3:40,Tyler Herro misses three point jump shot,threepointmiss,15,,basketball_play,1774139459,380,True,2026-03-22 00:30:59+00:00,1,220.0,500.0,8.333333333333334,85
4,39,quarter,1,a8625e4b-4ae6-4062-a7c1-0b6e1f4ae211,23,3:38,Amen Thompson defensive rebound,rebound,15,a8625e4b-4ae6-4062-a7c1-0b6e1f4ae211,basketball_play,1774139461,379,True,2026-03-22 00:31:01+00:00,1,218.0,502.0,8.366666666666667,86
4,38,quarter,1,a8625e4b-4ae6-4062-a7c1-0b6e1f4ae211,23,3:34,Kevin Durant makes two point running dunk (Amen Thompson assists),twopointmade,17,a17e4a68-2999-4f60-b67e-3e80aa9e198b,basketball_play,1774139466,378,True,2026-03-22 00:31:06+00:00,1,214.0,506.0,8.433333333333334,87
4,37,quarter,1,a17e4a68-2999-4f60-b67e-3e80aa9e198b,25,3:24,Simone Fontecchio makes two point layup (Dru Smith assists),twopointmade,17,a8625e4b-4ae6-4062-a7c1-0b6e1f4ae211,basketball_play,1774139475,377,True,2026-03-22 00:31:15+00:00,1,204.0,516.0,8.6,88
4,36,quarter,1,a8625e4b-4ae6-4062-a7c1-0b6e1f4ae211,25,3:07,Kevin Durant makes three point jump shot (Reed Sheppard assists),threepointmade,20,a17e4a68-2999-4f60-b67e-3e80aa9e198b,basketball_play,1774139493,376,True,2026-03-22 00:31:33+00:00,1,187.0,533.0,8.883333333333333,89
4,35,quarter,1,a17e4a68-2999-4f60-b67e-3e80aa9e198b,27,2:52,Myron Gardner makes two point driving floating jump shot (Simone Fontecchio assists),twopointmade,20,a8625e4b-4ae6-4062-a7c1-0b6e1f4ae211,basketball_play,1774139508,375,True,2026-03-22 00:31:48+00:00,1,172.0,548.0,9.133333333333333,90
4,34,quarter,1,a8625e4b-4ae6-4062-a7c1-0b6e1f4ae211,27,2:42,Reed Sheppard makes three point pullup jump shot,threepointmade,23,a17e4a68-2999-4f60-b67e-3e80aa9e198b,basketball_play,1774139518,374,True,2026-03-22 00:31:58+00:00,1,162.0,558.0,9.3,91
4,33,quarter,1,a17e4a68-2999-4f60-b67e-3e80aa9e198b,29,2:30,Dru Smith makes two point driving floating jump shot (Myron Gardner assists),twopointmade,23,a8625e4b-4ae6-4062-a7c1-0b6e1f4ae211,basketball_play,1774139530,373,True,2026-03-22 00:32:10+00:00,1,150.0,570.0,9.5,92
4,32,quarter,1,a17e4a68-2999-4f60-b67e-3e80aa9e198b,29,2:19,Kel'el Ware kicked ball violation,kickball,23,a8625e4b-4ae6-4062-a7c1-0b6e1f4ae211,basketball_play,1774139543,372,True,2026-03-22 00:32:23+00:00,1,139.0,581.0,9.683333333333334,93
4,31,quarter,1,a17e4a68-2999-4f60-b67e-3e80aa9e198b,29,2:19,"Heat lineup change (Myron Gardner, Bam Adebayo, Kasparas Jakucionis, Kel'el Ware, Dru Smith)",lineupchange,23,,basketball_play,1774139551,371,True,2026-03-22 00:32:31+00:00,1,139.0,581.0,9.683333333333334,94
4,30,quarter,1,a8625e4b-4ae6-4062-a7c1-0b6e1f4ae211,29,2:12,Tari Eason turnover (traveling),turnover,23,a17e4a68-2999-4f60-b67e-3e80aa9e198b,basketball_play,1774139570,370,True,2026-03-22 00:32:50+00:00,1,132.0,588.0,9.8,95
4,29,quarter,1,a17e4a68-2999-4f60-b67e-3e80aa9e198b,29,1:58,Kel'el Ware turnover (bad pass) (Reed Sheppard steals),turnover,23,a8625e4b-4ae6-4062-a7c1-0b6e1f4ae211,basketball_play,1774139593,369,True,2026-03-22 00:33:13+00:00,1,118.0,602.0,10.033333333333333,96
4,28,quarter,1,a8625e4b-4ae6-4062-a7c1-0b6e1f4ae211,29,1:48,Reed Sheppard makes three point jump shot (Dorian Finney-Smith assists),threepointmade,26,a17e4a68-2999-4f60-b67e-3e80aa9e198b,basketball_play,1774139602,368,True,2026-03-22 00:33:22+00:00,1,108.0,612.0,10.2,97
4,27,quarter,1,a17e4a68-2999-4f60-b67e-3e80aa9e198b,29,1:45,Heat 60 second timeout,teamtimeout,26,,basketball_play,1774139611,367,True,2026-03-22 00:33:31+00:00,1,105.0,615.0,10.25,98
4,26,quarter,1,a17e4a68-2999-4f60-b67e-3e80aa9e198b,29,1:45,"Heat lineup change (Pelle Larsson, Bam Adebayo, Kasparas Jakucionis, Kel'el Ware, Dru Smith)",lineupchange,26,,basketball_play,1774139696,366,True,2026-03-22 00:34:56+00:00,1,105.0,615.0,10.25,99
4,25,quarter,1,a8625e4b-4ae6-4062-a7c1-0b6e1f4ae211,29,1:45,"Rockets lineup change (Kevin Durant, Dorian Finney-Smith, Amen Thompson, Reed Sheppard, Jabari Smith Jr.)",lineupchange,26,,basketball_play,1774139696,365,True,2026-03-22 00:34:56+00:00,1,105.0,615.0,10.25,100
4,24,quarter,1,a17e4a68-2999-4f60-b67e-3e80aa9e198b,29,1:32,Pelle Larsson misses two point driving floating jump shot,twopointmiss,26,,basketball_play,1774139716,364,True,2026-03-22 00:35:16+00:00,1,92.0,628.0,10.466666666666667,101
4,23,quarter,1,a8625e4b-4ae6-4062-a7c1-0b6e1f4ae211,29,1:30,Amen Thompson defensive rebound,rebound,26,a8625e4b-4ae6-4062-a7c1-0b6e1f4ae211,basketball_play,1774139718,363,True,2026-03-22 00:35:18+00:00,1,90.0,630.0,10.5,102
4,22,quarter,1,a17e4a68-2999-4f60-b67e-3e80aa9e198b,29,1:14,Dru Smith shooting foul (Kevin Durant draws the foul),shootingfoul,26,a8625e4b-4ae6-4062-a7c1-0b6e1f4ae211,basketball_play,1774139735,362,True,2026-03-22 00:35:35+00:00,1,74.0,646.0,10.766666666666667,103
4,21,quarter,1,a8625e4b-4ae6-4062-a7c1-0b6e1f4ae211,29,1:14,Kevin Durant makes regular free throw 1 of 2,freethrowmade,27,a8625e4b-4ae6-4062-a7c1-0b6e1f4ae211,basketball_play,1774139762,361,True,2026-03-22 00:36:02+00:00,1,74.0,646.0,10.766666666666667,104
4,20,quarter,1,a8625e4b-4ae6-4062-a7c1-0b6e1f4ae211,29,1:14,Kevin Durant makes regular free throw 2 of 2,freethrowmade,28,a17e4a68-2999-4f60-b67e-3e80aa9e198b,basketball_play,1774139781,360,True,2026-03-22 00:36:21+00:00,1,74.0,646.0,10.766666666666667,105
4,19,quarter,1,a17e4a68-2999-4f60-b67e-3e80aa9e198b,29,00:59.90,Kasparas Jakucionis misses three point pullup jump shot,threepointmiss,28,,basketball_play,1774139796,359,True,2026-03-22 00:36:36+00:00,1,59.9,660.1,11.001666666666667,106
