period_index,event_index,period_type,period_number,attribution,away_points,clock,description,event_type,home_points,possession,type,wall_clock,pbp_source_row,has_wall_clock,event_ts_utc,period_sequence,game_clock_seconds_remaining,game_elapsed_seconds,game_elapsed_minutes,pbp_chronological_index
3,25,quarter,2,502c629b-4da7-40fd-92ab-20cb55411c35,68,2:11,Warriors 60 second timeout,teamtimeout,45,,basketball_play,1772069413,253,True,2026-02-26 01:30:13+00:00,2,131.0,1309.0,21.816666666666666,211
3,24,quarter,2,502c629b-4da7-40fd-92ab-20cb55411c35,68,2:11,"Warriors lineup change (Moses Moody, Gui Santos, Pat Spencer, Brandin Podziemski, Al Horford)",lineupchange,45,,basketball_play,1772069416,252,True,2026-02-26 01:30:16+00:00,2,131.0,1309.0,21.816666666666666,212
3,23,quarter,2,1cfe70b8-4dfc-47dc-acca-b68d4a725972,68,2:11,"Grizzlies lineup change (Javon Small, Walter Clayton Jr., GG Jackson, Taylor Hendricks, Jaylen Wells)",lineupchange,45,,basketball_play,1772069416,251,True,2026-02-26 01:30:16+00:00,2,131.0,1309.0,21.816666666666666,213
3,22,quarter,2,1cfe70b8-4dfc-47dc-acca-b68d4a725972,68,2:11,Walter Clayton Jr. misses regular free throw 2 of 2,freethrowmiss,45,,basketball_play,1772069401,250,True,2026-02-26 01:30:01+00:00,2,131.0,1309.0,21.816666666666666,214
3,21,quarter,2,502c629b-4da7-40fd-92ab-20cb55411c35,68,2:09,Moses Moody defensive rebound,rebound,45,502c629b-4da7-40fd-92ab-20cb55411c35,basketball_play,1772069403,249,True,2026-02-26 01:30:03+00:00,2,129.0,1311.0,21.85,215
3,20,quarter,2,502c629b-4da7-40fd-92ab-20cb55411c35,68,1:56,Moses Moody misses three point jump shot,threepointmiss,45,,basketball_play,1772069524,248,True,2026-02-26 01:32:04+00:00,2,116.0,1324.0,22.066666666666666,216
3,19,quarter,2,1cfe70b8-4dfc-47dc-acca-b68d4a725972,68,1:53,Javon Small defensive rebound,rebound,45,1cfe70b8-4dfc-47dc-acca-b68d4a725972,basketball_play,1772069527,247,True,2026-02-26 01:32:07+00:00,2,113.0,1327.0,22.116666666666667,217
3,18,quarter,2,1cfe70b8-4dfc-47dc-acca-b68d4a725972,68,1:40,Gui Santos blocks Taylor Hendricks's three point jump shot,threepointmiss,45,,basketball_play,1772069540,246,True,2026-02-26 01:32:20+00:00,2,100.0,1340.0,22.333333333333332,218
3,17,quarter,2,1cfe70b8-4dfc-47dc-acca-b68d4a725972,68,1:36,GG Jackson offensive rebound,rebound,45,1cfe70b8-4dfc-47dc-acca-b68d4a725972,basketball_play,1772069544,245,True,2026-02-26 01:32:24+00:00,2,96.0,1344.0,22.4,219
3,16,quarter,2,1cfe70b8-4dfc-47dc-acca-b68d4a725972,68,1:32,GG Jackson makes three point jump shot (Javon Small assists),threepointmade,48,502c629b-4da7-40fd-92ab-20cb55411c35,basketball_play,1772069548,244,True,2026-02-26 01:32:28+00:00,2,92.0,1348.0,22.466666666666665,220
3,15,quarter,2,502c629b-4da7-40fd-92ab-20cb55411c35,68,1:16,Brandin Podziemski turnover (bad pass) (Taylor Hendricks steals),turnover,48,1cfe70b8-4dfc-47dc-acca-b68d4a725972,basketball_play,1772069565,243,True,2026-02-26 01:32:45+00:00,2,76.0,1364.0,22.733333333333334,221
3,14,quarter,2,1cfe70b8-4dfc-47dc-acca-b68d4a725972,68,1:11,GG Jackson makes two point running alley-oop dunk (Taylor Hendricks assists),twopointmade,50,502c629b-4da7-40fd-92ab-20cb55411c35,basketball_play,1772069570,242,True,2026-02-26 01:32:50+00:00,2,71.0,1369.0,22.816666666666666,222
3,13,quarter,2,502c629b-4da7-40fd-92ab-20cb55411c35,71,00:53.70,Moses Moody makes three point jump shot (Gui Santos assists),threepointmade,50,1cfe70b8-4dfc-47dc-acca-b68d4a725972,basketball_play,1772069589,241,True,2026-02-26 01:33:09+00:00,2,53.7,1386.3,23.105,223
3,12,quarter,2,1cfe70b8-4dfc-47dc-acca-b68d4a725972,71,00:46.70,GG Jackson misses three point jump shot,threepointmiss,50,,basketball_play,1772069599,240,True,2026-02-26 01:33:19+00:00,2,46.7,1393.3,23.221666666666668,224
3,11,quarter,2,502c629b-4da7-40fd-92ab-20cb55411c35,71,00:44.10,Al Horford defensive rebound,rebound,50,502c629b-4da7-40fd-92ab-20cb55411c35,basketball_play,1772069602,239,True,2026-02-26 01:33:22+00:00,2,44.1,1395.9,23.265,225
3,10,quarter,2,1cfe70b8-4dfc-47dc-acca-b68d4a725972,71,00:31.40,Walter Clayton Jr. shooting foul (Moses Moody draws the foul),shootingfoul,50,502c629b-4da7-40fd-92ab-20cb55411c35,basketball_play,1772069616,238,True,2026-02-26 01:33:36+00:00,2,31.4,1408.6,23.476666666666667,226
3,9,quarter,2,502c629b-4da7-40fd-92ab-20cb55411c35,72,00:31.40,Moses Moody makes regular free throw 1 of 3,freethrowmade,50,502c629b-4da7-40fd-92ab-20cb55411c35,basketball_play,1772069643,237,True,2026-02-26 01:34:03+00:00,2,31.4,1408.6,23.476666666666667,227
3,8,quarter,2,502c629b-4da7-40fd-92ab-20cb55411c35,73,00:31.40,Moses Moody makes regular free throw 2 of 3,freethrowmade,50,502c629b-4da7-40fd-92ab-20cb55411c35,basketball_play,1772069665,236,True,2026-02-26 01:34:25+00:00,2,31.4,1408.6,23.476666666666667,228
3,7,quarter,2,502c629b-4da7-40fd-92ab-20cb55411c35,73,00:31.40,"Warriors lineup change (Gary Payton II, Moses Moody, Gui Santos, Al Horford, Will Richard)",lineupchange,50,,basketball_play,1772069665,235,True,2026-02-26 01:34:25+00:00,2,31.4,1408.6,23.476666666666667,229
3,6,quarter,2,1cfe70b8-4dfc-47dc-acca-b68d4a725972,73,00:31.40,"Grizzlies lineup change (Javon Small, Ty Jerome, GG Jackson, Taylor Hendricks, Jaylen Wells)",lineupchange,50,,basketball_play,1772069665,234,True,2026-02-26 01:34:25+00:00,2,31.4,1408.6,23.476666666666667,230
3,5,quarter,2,502c629b-4da7-40fd-92ab-20cb55411c35,74,00:31.40,Moses Moody makes regular free throw 3 of 3,freethrowmade,50,1cfe70b8-4dfc-47dc-acca-b68d4a725972,basketball_play,1772069683,233,True,2026-02-26 01:34:43+00:00,2,31.4,1408.6,23.476666666666667,231
3,4,quarter,2,1cfe70b8-4dfc-47dc-acca-b68d4a725972,74,00:15.70,Ty Jerome makes three point stepback jump shot,threepointmade,53,502c629b-4da7-40fd-92ab-20cb55411c35,basketball_play,1772069702,232,True,2026-02-26 01:35:02+00:00,2,15.7,1424.3,23.738333333333333,232
3,3,quarter,2,502c629b-4da7-40fd-92ab-20cb55411c35,74,00:02,Will Richard misses three point jump shot,threepointmiss,53,,basketball_play,1772069719,231,True,2026-02-26 01:35:19+00:00,2,2.0,1438.0,23.966666666666665,233
3,2,quarter,2,1cfe70b8-4dfc-47dc-acca-b68d4a725972,74,00:02,GG Jackson defensive rebound,rebound,53,1cfe70b8-4dfc-47dc-acca-b68d4a725972,basketball_play,1772069719,230,True,2026-02-26 01:35:19+00:00,2,2.0,1438.0,23.966666666666665,234
3,1,quarter,2,,74,00:00,End of 1st Half.,endperiod,53,,basketball_play,1772069723,229,True,2026-02-26 01:35:23+00:00,2,0.0,1440.0,24.0,235
2,110,quarter,3,502c629b-4da7-40fd-92ab-20cb55411c35,74,12:00,"Warriors lineup change (Moses Moody, Gui Santos, Brandin Podziemski, Al Horford, Will Richard)",lineupchange,53,,basketball_play,1772070667,228,True,2026-02-26 01:51:07+00:00,3,720.0,1440.0,24.0,236
2,109,quarter,3,1cfe70b8-4dfc-47dc-acca-b68d4a725972,74,12:00,"Grizzlies lineup change (Javon Small, Olivier-Maxence Prosper, Ty Jerome, GG Jackson, Jaylen Wells)",lineupchange,53,,basketball_play,1772070667,227,True,2026-02-26 01:51:07+00:00,3,720.0,1440.0,24.0,237
2,108,quarter,3,,74,12:00,Start of 3rd Quarter,startperiod,53,,basketball_play,1772070707,226,True,2026-02-26 01:51:47+00:00,3,720.0,1440.0,24.0,238
2,107,quarter,3,1cfe70b8-4dfc-47dc-acca-b68d4a725972,74,12:00,Grizzlies delay of game violation,delay,53,502c629b-4da7-40fd-92ab-20cb55411c35,basketball_play,1772070709,225,True,2026-02-26 01:51:49+00:00,3,720.0,1440.0,24.0,239
2,106,quarter,3,1cfe70b8-4dfc-47dc-acca-b68d4a725972,74,11:50,GG Jackson makes three point stepback jump shot (Ty Jerome assists),threepointmade,56,502c629b-4da7-40fd-92ab-20cb55411c35,basketball_play,1772070717,224,True,2026-02-26 01:51:57+00:00,3,710.0,1450.0,24.166666666666668,240
2,105,quarter,3,502c629b-4da7-40fd-92ab-20cb55411c35,74,11:22,GG Jackson blocks Brandin Podziemski's two point driving floating jump shot,twopointmiss,56,,basketball_play,1772070746,223,True,2026-02-26 01:52:26+00:00,3,682.0,1478.0,24.633333333333333,241
2,104,quarter,3,1cfe70b8-4dfc-47dc-acca-b68d4a725972,74,11:20,Javon Small defensive rebound,rebound,56,1cfe70b8-4dfc-47dc-acca-b68d4a725972,basketball_play,1772070748,222,True,2026-02-26 01:52:28+00:00,3,680.0,1480.0,24.666666666666668,242
2,103,quarter,3,1cfe70b8-4dfc-47dc-acca-b68d4a725972,74,11:09,GG Jackson misses three point jump shot,threepointmiss,56,,basketball_play,1772070756,221,True,2026-02-26 01:52:36+00:00,3,669.0,1491.0,24.85,243
2,102,quarter,3,502c629b-4da7-40fd-92ab-20cb55411c35,74,11:06,Brandin Podziemski defensive rebound,rebound,56,502c629b-4da7-40fd-92ab-20cb55411c35,basketball_play,1772070759,220,True,2026-02-26 01:52:39+00:00,3,666.0,1494.0,24.9,244
2,101,quarter,3,502c629b-4da7-40fd-92ab-20cb55411c35,74,10:52,Will Richard misses two point cutting finger roll layup,twopointmiss,56,,basketball_play,1772070774,219,True,2026-02-26 01:52:54+00:00,3,652.0,1508.0,25.133333333333333,245
2,100,quarter,3,1cfe70b8-4dfc-47dc-acca-b68d4a725972,74,10:50,Jaylen Wells defensive rebound,rebound,56,1cfe70b8-4dfc-47dc-acca-b68d4a725972,basketball_play,1772070776,218,True,2026-02-26 01:52:56+00:00,3,650.0,1510.0,25.166666666666668,246
2,99,quarter,3,502c629b-4da7-40fd-92ab-20cb55411c35,74,10:41,Moses Moody personal foul (Jaylen Wells draws the foul),personalfoul,56,1cfe70b8-4dfc-47dc-acca-b68d4a725972,basketball_play,1772070788,217,True,2026-02-26 01:53:08+00:00,3,641.0,1519.0,25.316666666666666,247
2,98,quarter,3,1cfe70b8-4dfc-47dc-acca-b68d4a725972,74,10:34,Ty Jerome makes two point driving floating jump shot,twopointmade,58,502c629b-4da7-40fd-92ab-20cb55411c35,basketball_play,1772070816,216,True,2026-02-26 01:53:36+00:00,3,634.0,1526.0,25.433333333333334,248
2,97,quarter,3,502c629b-4da7-40fd-92ab-20cb55411c35,76,10:10,Will Richard makes two point stepback jump shot (Al Horford assists),twopointmade,58,1cfe70b8-4dfc-47dc-acca-b68d4a725972,basketball_play,1772070840,215,True,2026-02-26 01:54:00+00:00,3,610.0,1550.0,25.833333333333332,249
2,96,quarter,3,1cfe70b8-4dfc-47dc-acca-b68d4a725972,76,9:58,Ty Jerome misses two point turnaround jump shot,twopointmiss,58,,basketball_play,1772070852,214,True,2026-02-26 01:54:12+00:00,3,598.0,1562.0,26.033333333333335,250
2,95,quarter,3,502c629b-4da7-40fd-92ab-20cb55411c35,76,9:54,Gui Santos defensive rebound,rebound,58,502c629b-4da7-40fd-92ab-20cb55411c35,basketball_play,1772070856,213,True,2026-02-26 01:54:16+00:00,3,594.0,1566.0,26.1,251
2,94,quarter,3,502c629b-4da7-40fd-92ab-20cb55411c35,76,9:44,Will Richard misses three point jump shot,threepointmiss,58,,basketball_play,1772070865,212,True,2026-02-26 01:54:25+00:00,3,584.0,1576.0,26.266666666666666,252
2,93,quarter,3,1cfe70b8-4dfc-47dc-acca-b68d4a725972,76,9:41,GG Jackson defensive rebound,rebound,58,1cfe70b8-4dfc-47dc-acca-b68d4a725972,basketball_play,1772070868,211,True,2026-02-26 01:54:28+00:00,3,581.0,1579.0,26.316666666666666,253
2,92,quarter,3,1cfe70b8-4dfc-47dc-acca-b68d4a725972,76,9:36,Olivier-Maxence Prosper misses three point running jump shot,threepointmiss,58,,basketball_play,1772070874,210,True,2026-02-26 01:54:34+00:00,3,576.0,1584.0,26.4,254
2,91,quarter,3,1cfe70b8-4dfc-47dc-acca-b68d4a725972,76,9:33,GG Jackson offensive rebound,rebound,58,1cfe70b8-4dfc-47dc-acca-b68d4a725972,basketball_play,1772070878,209,True,2026-02-26 01:54:38+00:00,3,573.0,1587.0,26.45,255
2,90,quarter,3,1cfe70b8-4dfc-47dc-acca-b68d4a725972,76,9:27,GG Jackson makes two point driving finger roll layup (Ty Jerome assists),twopointmade,60,502c629b-4da7-40fd-92ab-20cb55411c35,basketball_play,1772070883,208,True,2026-02-26 01:54:43+00:00,3,567.0,1593.0,26.55,256
2,89,quarter,3,502c629b-4da7-40fd-92ab-20cb55411c35,76,9:10,Brandin Podziemski misses three point jump shot,threepointmiss,60,,basketball_play,1772070900,207,True,2026-02-26 01:55:00+00:00,3,550.0,1610.0,26.833333333333332,257
2,88,quarter,3,1cfe70b8-4dfc-47dc-acca-b68d4a725972,76,9:06,Ty Jerome defensive rebound,rebound,60,1cfe70b8-4dfc-47dc-acca-b68d4a725972,basketball_play,1772070904,206,True,2026-02-26 01:55:04+00:00,3,546.0,1614.0,26.9,258
2,87,quarter,3,1cfe70b8-4dfc-47dc-acca-b68d4a725972,76,9:04,Ty Jerome turnover (bad pass) (Moses Moody steals),turnover,60,502c629b-4da7-40fd-92ab-20cb55411c35,basketball_play,1772070906,205,True,2026-02-26 01:55:06+00:00,3,544.0,1616.0,26.933333333333334,259
2,86,quarter,3,502c629b-4da7-40fd-92ab-20cb55411c35,79,8:48,Brandin Podziemski makes three point jump shot (Will Richard assists),threepointmade,60,1cfe70b8-4dfc-47dc-acca-b68d4a725972,basketball_play,1772070922,204,True,2026-02-26 01:55:22+00:00,3,528.0,1632.0,27.2,260
2,85,quarter,3,1cfe70b8-4dfc-47dc-acca-b68d4a725972,79,8:32,Javon Small makes three point jump shot (GG Jackson assists),threepointmade,63,502c629b-4da7-40fd-92ab-20cb55411c35,basketball_play,1772070938,203,True,2026-02-26 01:55:38+00:00,3,512.0,1648.0,27.466666666666665,261
2,84,quarter,3,502c629b-4da7-40fd-92ab-20cb55411c35,82,8:11,Moses Moody makes three point jump shot (Will Richard assists),threepointmade,63,1cfe70b8-4dfc-47dc-acca-b68d4a725972,basketball_play,1772070959,202,True,2026-02-26 01:55:59+00:00,3,491.0,1669.0,27.816666666666666,262
2,83,quarter,3,1cfe70b8-4dfc-47dc-acca-b68d4a725972,82,7:55,Javon Small makes three point jump shot (Jaylen Wells assists),threepointmade,66,502c629b-4da7-40fd-92ab-20cb55411c35,basketball_play,1772070975,201,True,2026-02-26 01:56:15+00:00,3,475.0,1685.0,28.083333333333332,263
2,82,quarter,3,502c629b-4da7-40fd-92ab-20cb55411c35,82,7:54,Warriors 60 second timeout,teamtimeout,66,,basketball_play,1772070982,200,True,2026-02-26 01:56:22+00:00,3,474.0,1686.0,28.1,264
2,81,quarter,3,502c629b-4da7-40fd-92ab-20cb55411c35,82,7:54,"Warriors lineup change (Gary Payton II, Moses Moody, Pat Spencer, Brandin Podziemski, Al Horford)",lineupchange,66,,basketball_play,1772071141,199,True,2026-02-26 01:59:01+00:00,3,474.0,1686.0,28.1,265
2,80,quarter,3,1cfe70b8-4dfc-47dc-acca-b68d4a725972,82,7:54,"Grizzlies lineup change (Javon Small, Ty Jerome, Taylor Hendricks, Jaylen Wells, Rayan Rupert)",lineupchange,66,,basketball_play,1772071141,198,True,2026-02-26 01:59:01+00:00,3,474.0,1686.0,28.1,266
2,79,quarter,3,502c629b-4da7-40fd-92ab-20cb55411c35,82,7:34,Moses Moody misses three point stepback jump shot,threepointmiss,66,,basketball_play,1772071190,197,True,2026-02-26 01:59:50+00:00,3,454.0,1706.0,28.433333333333334,267
2,78,quarter,3,1cfe70b8-4dfc-47dc-acca-b68d4a725972,82,7:31,Javon Small defensive rebound,rebound,66,1cfe70b8-4dfc-47dc-acca-b68d4a725972,basketball_play,1772071193,196,True,2026-02-26 01:59:53+00:00,3,451.0,1709.0,28.483333333333334,268
2,77,quarter,3,1cfe70b8-4dfc-47dc-acca-b68d4a725972,82,7:26,Taylor Hendricks makes two point running pullup jump shot (Javon Small assists),twopointmade,68,502c629b-4da7-40fd-92ab-20cb55411c35,basketball_play,1772071199,195,True,2026-02-26 01:59:59+00:00,3,446.0,1714.0,28.566666666666666,269
2,76,quarter,3,502c629b-4da7-40fd-92ab-20cb55411c35,82,7:04,Moses Moody offensive foul (Jaylen Wells draws the foul),offensivefoul,68,1cfe70b8-4dfc-47dc-acca-b68d4a725972,basketball_play,1772071222,194,True,2026-02-26 02:00:22+00:00,3,424.0,1736.0,28.933333333333334,270
2,75,quarter,3,502c629b-4da7-40fd-92ab-20cb55411c35,82,7:04,Moses Moody turnover (offensive foul),turnover,68,1cfe70b8-4dfc-47dc-acca-b68d4a725972,basketball_play,1772071222,193,True,2026-02-26 02:00:22+00:00,3,424.0,1736.0,28.933333333333334,271
2,74,quarter,3,1cfe70b8-4dfc-47dc-acca-b68d4a725972,82,7:04,"Grizzlies lineup change (Scotty Pippen Jr., Walter Clayton Jr., Taylor Hendricks, Jaylen Wells, Rayan Rupert)",lineupchange,68,,basketball_play,1772071229,192,True,2026-02-26 02:00:29+00:00,3,424.0,1736.0,28.933333333333334,272
2,73,quarter,3,1cfe70b8-4dfc-47dc-acca-b68d4a725972,82,6:43,Taylor Hendricks misses three point jump shot,threepointmiss,68,,basketball_play,1772071263,191,True,2026-02-26 02:01:03+00:00,3,403.0,1757.0,29.283333333333335,273
2,72,quarter,3,502c629b-4da7-40fd-92ab-20cb55411c35,82,6:40,Al Horford defensive rebound,rebound,68,502c629b-4da7-40fd-92ab-20cb55411c35,basketball_play,1772071266,190,True,2026-02-26 02:01:06+00:00,3,400.0,1760.0,29.333333333333332,274
2,71,quarter,3,502c629b-4da7-40fd-92ab-20cb55411c35,82,6:28,Gary Payton II misses three point jump shot,threepointmiss,68,,basketball_play,1772071278,189,True,2026-02-26 02:01:18+00:00,3,388.0,1772.0,29.533333333333335,275
2,70,quarter,3,502c629b-4da7-40fd-92ab-20cb55411c35,82,6:26,Brandin Podziemski offensive rebound,rebound,68,502c629b-4da7-40fd-92ab-20cb55411c35,basketball_play,1772071280,188,True,2026-02-26 02:01:20+00:00,3,386.0,1774.0,29.566666666666666,276
2,69,quarter,3,502c629b-4da7-40fd-92ab-20cb55411c35,82,6:13,Warriors turnover (shot clock violation),turnover,68,1cfe70b8-4dfc-47dc-acca-b68d4a725972,basketball_play,1772071296,187,True,2026-02-26 02:01:36+00:00,3,373.0,1787.0,29.783333333333335,277
2,68,quarter,3,502c629b-4da7-40fd-92ab-20cb55411c35,82,6:13,"Warriors lineup change (Gary Payton II, Moses Moody, Quinten Post, Pat Spencer, Brandin Podziemski)",lineupchange,68,,basketball_play,1772071326,186,True,2026-02-26 02:02:06+00:00,3,373.0,1787.0,29.783333333333335,278
2,67,quarter,3,1cfe70b8-4dfc-47dc-acca-b68d4a725972,82,5:57,Rayan Rupert misses three point jump shot,threepointmiss,68,,basketball_play,1772071326,185,True,2026-02-26 02:02:06+00:00,3,357.0,1803.0,30.05,279
2,66,quarter,3,502c629b-4da7-40fd-92ab-20cb55411c35,82,5:53,Quinten Post defensive rebound,rebound,68,502c629b-4da7-40fd-92ab-20cb55411c35,basketball_play,1772071330,184,True,2026-02-26 02:02:10+00:00,3,353.0,1807.0,30.116666666666667,280
2,65,quarter,3,502c629b-4da7-40fd-92ab-20cb55411c35,82,5:40,Pat Spencer misses two point pullup jump shot,twopointmiss,68,,basketball_play,1772071342,183,True,2026-02-26 02:02:22+00:00,3,340.0,1820.0,30.333333333333332,281
2,64,quarter,3,1cfe70b8-4dfc-47dc-acca-b68d4a725972,82,5:37,Rayan Rupert defensive rebound,rebound,68,1cfe70b8-4dfc-47dc-acca-b68d4a725972,basketball_play,1772071345,182,True,2026-02-26 02:02:25+00:00,3,337.0,1823.0,30.383333333333333,282
2,63,quarter,3,502c629b-4da7-40fd-92ab-20cb55411c35,82,5:31,Quinten Post personal foul (Scotty Pippen Jr. draws the foul),personalfoul,68,1cfe70b8-4dfc-47dc-acca-b68d4a725972,basketball_play,1772071355,181,True,2026-02-26 02:02:35+00:00,3,331.0,1829.0,30.483333333333334,283
2,62,quarter,3,502c629b-4da7-40fd-92ab-20cb55411c35,82,5:31,"Warriors lineup change (Gary Payton II, Quinten Post, Gui Santos, Pat Spencer, Will Richard)",lineupchange,68,,basketball_play,1772071362,180,True,2026-02-26 02:02:42+00:00,3,331.0,1829.0,30.483333333333334,284
2,61,quarter,3,1cfe70b8-4dfc-47dc-acca-b68d4a725972,82,5:25,Walter Clayton Jr. misses two point pullup jump shot,twopointmiss,68,,basketball_play,1772071381,179,True,2026-02-26 02:03:01+00:00,3,325.0,1835.0,30.583333333333332,285
2,60,quarter,3,1cfe70b8-4dfc-47dc-acca-b68d4a725972,82,5:21,Taylor Hendricks offensive rebound,rebound,68,1cfe70b8-4dfc-47dc-acca-b68d4a725972,basketball_play,1772071385,178,True,2026-02-26 02:03:05+00:00,3,321.0,1839.0,30.65,286
2,59,quarter,3,1cfe70b8-4dfc-47dc-acca-b68d4a725972,82,5:20,Jaylen Wells makes two point floating jump shot (Taylor Hendricks assists),twopointmade,70,502c629b-4da7-40fd-92ab-20cb55411c35,basketball_play,1772071386,177,True,2026-02-26 02:03:06+00:00,3,320.0,1840.0,30.666666666666668,287
2,58,quarter,3,502c629b-4da7-40fd-92ab-20cb55411c35,84,5:02,Gui Santos makes two point cutting finger roll layup (Will Richard assists),twopointmade,70,1cfe70b8-4dfc-47dc-acca-b68d4a725972,basketball_play,1772071404,176,True,2026-02-26 02:03:24+00:00,3,302.0,1858.0,30.966666666666665,288
2,57,quarter,3,1cfe70b8-4dfc-47dc-acca-b68d4a725972,84,4:53,Scotty Pippen Jr. turnover (bad pass) (Gui Santos steals),turnover,70,502c629b-4da7-40fd-92ab-20cb55411c35,basketball_play,1772071413,175,True,2026-02-26 02:03:33+00:00,3,293.0,1867.0,31.116666666666667,289
2,56,quarter,3,502c629b-4da7-40fd-92ab-20cb55411c35,86,4:49,Gary Payton II makes two point running reverse layup (Will Richard assists),twopointmade,70,1cfe70b8-4dfc-47dc-acca-b68d4a725972,basketball_play,1772071417,174,True,2026-02-26 02:03:37+00:00,3,289.0,1871.0,31.183333333333334,290
2,55,quarter,3,1cfe70b8-4dfc-47dc-acca-b68d4a725972,86,4:49,Grizzlies 60 second timeout,teamtimeout,70,,basketball_play,1772071423,173,True,2026-02-26 02:03:43+00:00,3,289.0,1871.0,31.183333333333334,291
2,54,quarter,3,1cfe70b8-4dfc-47dc-acca-b68d4a725972,86,4:49,"Grizzlies lineup change (Cam Spencer, Scotty Pippen Jr., Walter Clayton Jr., Taylor Hendricks, Rayan Rupert)",lineupchange,70,,basketball_play,1772071610,172,True,2026-02-26 02:06:50+00:00,3,289.0,1871.0,31.183333333333334,292
2,53,quarter,3,1cfe70b8-4dfc-47dc-acca-b68d4a725972,86,4:31,Scotty Pippen Jr. misses three point jump shot,threepointmiss,70,,basketball_play,1772071610,171,True,2026-02-26 02:06:50+00:00,3,271.0,1889.0,31.483333333333334,293
2,52,quarter,3,502c629b-4da7-40fd-92ab-20cb55411c35,86,4:28,Quinten Post defensive rebound,rebound,70,502c629b-4da7-40fd-92ab-20cb55411c35,basketball_play,1772071613,170,True,2026-02-26 02:06:53+00:00,3,268.0,1892.0,31.533333333333335,294
2,51,quarter,3,502c629b-4da7-40fd-92ab-20cb55411c35,86,4:07,Quinten Post misses three point jump shot,threepointmiss,70,,basketball_play,1772071634,169,True,2026-02-26 02:07:14+00:00,3,247.0,1913.0,31.883333333333333,295
2,50,quarter,3,1cfe70b8-4dfc-47dc-acca-b68d4a725972,86,4:02,Scotty Pippen Jr. defensive rebound,rebound,70,1cfe70b8-4dfc-47dc-acca-b68d4a725972,basketball_play,1772071639,168,True,2026-02-26 02:07:19+00:00,3,242.0,1918.0,31.966666666666665,296
2,49,quarter,3,1cfe70b8-4dfc-47dc-acca-b68d4a725972,86,3:58,Rayan Rupert misses two point running layup,twopointmiss,70,,basketball_play,1772071643,167,True,2026-02-26 02:07:23+00:00,3,238.0,1922.0,32.03333333333333,297
2,48,quarter,3,502c629b-4da7-40fd-92ab-20cb55411c35,86,3:54,Will Richard defensive rebound,rebound,70,502c629b-4da7-40fd-92ab-20cb55411c35,basketball_play,1772071647,166,True,2026-02-26 02:07:27+00:00,3,234.0,1926.0,32.1,298
2,47,quarter,3,502c629b-4da7-40fd-92ab-20cb55411c35,86,3:49,Gui Santos misses three point jump shot,threepointmiss,70,,basketball_play,1772071652,165,True,2026-02-26 02:07:32+00:00,3,229.0,1931.0,32.18333333333333,299
2,46,quarter,3,502c629b-4da7-40fd-92ab-20cb55411c35,86,3:45,Will Richard offensive rebound,rebound,70,502c629b-4da7-40fd-92ab-20cb55411c35,basketball_play,1772071656,164,True,2026-02-26 02:07:36+00:00,3,225.0,1935.0,32.25,300
2,45,quarter,3,502c629b-4da7-40fd-92ab-20cb55411c35,88,3:41,Gui Santos makes two point cutting layup (Gary Payton II assists),twopointmade,70,1cfe70b8-4dfc-47dc-acca-b68d4a725972,basketball_play,1772071660,163,True,2026-02-26 02:07:40+00:00,3,221.0,1939.0,32.31666666666667,301
2,44,quarter,3,1cfe70b8-4dfc-47dc-acca-b68d4a725972,88,3:22,Quinten Post blocks Walter Clayton Jr.'s two point driving dunk,twopointmiss,70,,basketball_play,1772071679,162,True,2026-02-26 02:07:59+00:00,3,202.0,1958.0,32.63333333333333,302
2,43,quarter,3,1cfe70b8-4dfc-47dc-acca-b68d4a725972,88,3:18,Rayan Rupert offensive rebound,rebound,70,1cfe70b8-4dfc-47dc-acca-b68d4a725972,basketball_play,1772071683,161,True,2026-02-26 02:08:03+00:00,3,198.0,1962.0,32.7,303
2,42,quarter,3,1cfe70b8-4dfc-47dc-acca-b68d4a725972,88,3:17,Cam Spencer misses three point jump shot,threepointmiss,70,,basketball_play,1772071684,160,True,2026-02-26 02:08:04+00:00,3,197.0,1963.0,32.71666666666667,304
2,41,quarter,3,502c629b-4da7-40fd-92ab-20cb55411c35,88,3:14,Quinten Post defensive rebound,rebound,70,502c629b-4da7-40fd-92ab-20cb55411c35,basketball_play,1772071687,159,True,2026-02-26 02:08:07+00:00,3,194.0,1966.0,32.766666666666666,305
2,40,quarter,3,502c629b-4da7-40fd-92ab-20cb55411c35,88,3:05,Gary Payton II turnover (bad pass) (Taylor Hendricks steals),turnover,70,1cfe70b8-4dfc-47dc-acca-b68d4a725972,basketball_play,1772071697,158,True,2026-02-26 02:08:17+00:00,3,185.0,1975.0,32.916666666666664,306
2,39,quarter,3,1cfe70b8-4dfc-47dc-acca-b68d4a725972,88,3:00,Scotty Pippen Jr. makes two point running finger roll layup (Taylor Hendricks assists),twopointmade,72,502c629b-4da7-40fd-92ab-20cb55411c35,basketball_play,1772071701,157,True,2026-02-26 02:08:21+00:00,3,180.0,1980.0,33.0,307
2,38,quarter,3,502c629b-4da7-40fd-92ab-20cb55411c35,88,2:40,Pat Spencer misses three point pullup jump shot,threepointmiss,72,,basketball_play,1772071721,156,True,2026-02-26 02:08:41+00:00,3,160.0,2000.0,33.333333333333336,308
2,37,quarter,3,502c629b-4da7-40fd-92ab-20cb55411c35,88,2:38,Will Richard offensive rebound,rebound,72,502c629b-4da7-40fd-92ab-20cb55411c35,basketball_play,1772071723,155,True,2026-02-26 02:08:43+00:00,3,158.0,2002.0,33.36666666666667,309
2,36,quarter,3,502c629b-4da7-40fd-92ab-20cb55411c35,90,2:36,Gui Santos makes two point dunk (Will Richard assists),twopointmade,72,1cfe70b8-4dfc-47dc-acca-b68d4a725972,basketball_play,1772071725,154,True,2026-02-26 02:08:45+00:00,3,156.0,2004.0,33.4,310
2,35,quarter,3,1cfe70b8-4dfc-47dc-acca-b68d4a725972,90,2:22,Cam Spencer turnover (lost ball) (Will Richard steals),turnover,72,502c629b-4da7-40fd-92ab-20cb55411c35,basketball_play,1772071739,153,True,2026-02-26 02:08:59+00:00,3,142.0,2018.0,33.63333333333333,311
2,34,quarter,3,502c629b-4da7-40fd-92ab-20cb55411c35,92,2:18,Will Richard makes two point running dunk (Pat Spencer assists),twopointmade,72,1cfe70b8-4dfc-47dc-acca-b68d4a725972,basketball_play,1772071743,152,True,2026-02-26 02:09:03+00:00,3,138.0,2022.0,33.7,312
2,33,quarter,3,1cfe70b8-4dfc-47dc-acca-b68d4a725972,92,2:02,Rayan Rupert misses three point jump shot,threepointmiss,72,,basketball_play,1772071759,151,True,2026-02-26 02:09:19+00:00,3,122.0,2038.0,33.96666666666667,313
2,32,quarter,3,502c629b-4da7-40fd-92ab-20cb55411c35,92,1:59,Quinten Post defensive rebound,rebound,72,502c629b-4da7-40fd-92ab-20cb55411c35,basketball_play,1772071762,150,True,2026-02-26 02:09:22+00:00,3,119.0,2041.0,34.016666666666666,314
