period_index,event_index,period_type,period_number,attribution,away_points,clock,description,event_type,home_points,possession,type,wall_clock,pbp_source_row,has_wall_clock,event_ts_utc,period_sequence,game_clock_seconds_remaining,game_elapsed_seconds,game_elapsed_minutes,pbp_chronological_index
4,9,quarter,1,1cfe70b8-4dfc-47dc-acca-b68d4a725972,34,00:12.20,Olivier-Maxence Prosper misses two point driving layup,twopointmiss,28,,basketball_play,1772067877,359,True,2026-02-26 01:04:37+00:00,1,12.2,707.8,11.796666666666665,105
4,8,quarter,1,502c629b-4da7-40fd-92ab-20cb55411c35,34,00:09.90,Will Richard defensive rebound,rebound,28,502c629b-4da7-40fd-92ab-20cb55411c35,basketball_play,1772067879,358,True,2026-02-26 01:04:39+00:00,1,9.9,710.1,11.835,106
4,7,quarter,1,502c629b-4da7-40fd-92ab-20cb55411c35,34,00:04.80,Al Horford misses three point jump shot,threepointmiss,28,,basketball_play,1772067885,357,True,2026-02-26 01:04:45+00:00,1,4.8,715.2,11.92,107
4,6,quarter,1,1cfe70b8-4dfc-47dc-acca-b68d4a725972,34,00:03.10,Grizzlies defensive rebound,rebound,28,1cfe70b8-4dfc-47dc-acca-b68d4a725972,basketball_play,1772067886,356,True,2026-02-26 01:04:46+00:00,1,3.1,716.9,11.948333333333332,108
4,5,quarter,1,,34,00:03.10,Stoppage (Out of bounds),stoppage,28,,basketball_play,1772067890,355,True,2026-02-26 01:04:50+00:00,1,3.1,716.9,11.948333333333332,109
4,4,quarter,1,502c629b-4da7-40fd-92ab-20cb55411c35,34,00:03.10,"Warriors lineup change (Gary Payton II, Moses Moody, Malevy Leons, Al Horford, Will Richard)",lineupchange,28,,basketball_play,1772067910,354,True,2026-02-26 01:05:10+00:00,1,3.1,716.9,11.948333333333332,110
4,3,quarter,1,1cfe70b8-4dfc-47dc-acca-b68d4a725972,34,00:00.50,GG Jackson makes three point pullup bank jump shot (Cam Spencer assists),threepointmade,31,502c629b-4da7-40fd-92ab-20cb55411c35,basketball_play,1772067910,353,True,2026-02-26 01:05:10+00:00,1,0.5,719.5,11.991666666666667,111
4,2,quarter,1,,34,00:00,Instant replay (Request: Ruling Upheld),review,31,,basketball_play,1772067927,352,True,2026-02-26 01:05:27+00:00,1,0.0,720.0,12.0,112
4,1,quarter,1,,34,00:00,End of 1st Quarter.,endperiod,31,,basketball_play,1772067925,351,True,2026-02-26 01:05:25+00:00,1,0.0,720.0,12.0,113
3,122,quarter,2,502c629b-4da7-40fd-92ab-20cb55411c35,34,12:00,"Warriors lineup change (Gary Payton II, Moses Moody, Pat Spencer, Brandin Podziemski, Al Horford)",lineupchange,31,,basketball_play,1772067954,350,True,2026-02-26 01:05:54+00:00,2,720.0,720.0,12.0,114
3,121,quarter,2,1cfe70b8-4dfc-47dc-acca-b68d4a725972,34,12:00,"Grizzlies lineup change (Javon Small, Cam Spencer, Olivier-Maxence Prosper, Ty Jerome, GG Jackson)",lineupchange,31,,basketball_play,1772067954,349,True,2026-02-26 01:05:54+00:00,2,720.0,720.0,12.0,115
3,120,quarter,2,,34,12:00,Start of 2nd Quarter,startperiod,31,,basketball_play,1772068083,348,True,2026-02-26 01:08:03+00:00,2,720.0,720.0,12.0,116
3,119,quarter,2,1cfe70b8-4dfc-47dc-acca-b68d4a725972,34,11:52,GG Jackson turnover (traveling),turnover,31,502c629b-4da7-40fd-92ab-20cb55411c35,basketball_play,1772068092,347,True,2026-02-26 01:08:12+00:00,2,712.0,728.0,12.133333333333333,117
3,118,quarter,2,502c629b-4da7-40fd-92ab-20cb55411c35,37,11:35,Moses Moody makes three point jump shot (Brandin Podziemski assists),threepointmade,31,1cfe70b8-4dfc-47dc-acca-b68d4a725972,basketball_play,1772068116,346,True,2026-02-26 01:08:36+00:00,2,695.0,745.0,12.416666666666666,118
3,117,quarter,2,502c629b-4da7-40fd-92ab-20cb55411c35,37,11:12,Pat Spencer shooting foul (Ty Jerome draws the foul),shootingfoul,31,1cfe70b8-4dfc-47dc-acca-b68d4a725972,basketball_play,1772068149,345,True,2026-02-26 01:09:09+00:00,2,672.0,768.0,12.8,119
3,116,quarter,2,1cfe70b8-4dfc-47dc-acca-b68d4a725972,37,11:12,Ty Jerome makes regular free throw 1 of 2,freethrowmade,32,1cfe70b8-4dfc-47dc-acca-b68d4a725972,basketball_play,1772068170,344,True,2026-02-26 01:09:30+00:00,2,672.0,768.0,12.8,120
3,115,quarter,2,1cfe70b8-4dfc-47dc-acca-b68d4a725972,37,11:12,Ty Jerome makes regular free throw 2 of 2,freethrowmade,33,502c629b-4da7-40fd-92ab-20cb55411c35,basketball_play,1772068185,343,True,2026-02-26 01:09:45+00:00,2,672.0,768.0,12.8,121
3,114,quarter,2,502c629b-4da7-40fd-92ab-20cb55411c35,37,10:48,Olivier-Maxence Prosper blocks Brandin Podziemski's two point driving layup,twopointmiss,33,,basketball_play,1772068193,342,True,2026-02-26 01:09:53+00:00,2,648.0,792.0,13.2,122
3,113,quarter,2,502c629b-4da7-40fd-92ab-20cb55411c35,37,10:48,Warriors offensive rebound,rebound,33,502c629b-4da7-40fd-92ab-20cb55411c35,basketball_play,1772068193,341,True,2026-02-26 01:09:53+00:00,2,648.0,792.0,13.2,123
3,112,quarter,2,1cfe70b8-4dfc-47dc-acca-b68d4a725972,37,10:48,Cam Spencer personal foul (Loose ball) (Gary Payton II draws the foul),personalfoul,33,502c629b-4da7-40fd-92ab-20cb55411c35,basketball_play,1772068216,340,True,2026-02-26 01:10:16+00:00,2,648.0,792.0,13.2,124
3,111,quarter,2,502c629b-4da7-40fd-92ab-20cb55411c35,37,10:40,Gary Payton II misses three point jump shot,threepointmiss,33,,basketball_play,1772068240,339,True,2026-02-26 01:10:40+00:00,2,640.0,800.0,13.333333333333334,125
3,110,quarter,2,1cfe70b8-4dfc-47dc-acca-b68d4a725972,37,10:36,Ty Jerome defensive rebound,rebound,33,1cfe70b8-4dfc-47dc-acca-b68d4a725972,basketball_play,1772068244,338,True,2026-02-26 01:10:44+00:00,2,636.0,804.0,13.4,126
3,109,quarter,2,1cfe70b8-4dfc-47dc-acca-b68d4a725972,37,10:29,Ty Jerome misses two point turnaround jump shot,twopointmiss,33,,basketball_play,1772068250,337,True,2026-02-26 01:10:50+00:00,2,629.0,811.0,13.516666666666667,127
3,108,quarter,2,502c629b-4da7-40fd-92ab-20cb55411c35,37,10:27,Brandin Podziemski defensive rebound,rebound,33,502c629b-4da7-40fd-92ab-20cb55411c35,basketball_play,1772068252,336,True,2026-02-26 01:10:52+00:00,2,627.0,813.0,13.55,128
3,107,quarter,2,502c629b-4da7-40fd-92ab-20cb55411c35,39,10:18,Gary Payton II makes two point cutting dunk (Al Horford assists),twopointmade,33,1cfe70b8-4dfc-47dc-acca-b68d4a725972,basketball_play,1772068262,335,True,2026-02-26 01:11:02+00:00,2,618.0,822.0,13.7,129
3,106,quarter,2,1cfe70b8-4dfc-47dc-acca-b68d4a725972,39,10:01,Ty Jerome misses three point stepback jump shot,threepointmiss,33,,basketball_play,1772068279,334,True,2026-02-26 01:11:19+00:00,2,601.0,839.0,13.983333333333333,130
3,105,quarter,2,502c629b-4da7-40fd-92ab-20cb55411c35,39,9:58,Al Horford defensive rebound,rebound,33,502c629b-4da7-40fd-92ab-20cb55411c35,basketball_play,1772068282,333,True,2026-02-26 01:11:22+00:00,2,598.0,842.0,14.033333333333333,131
3,104,quarter,2,502c629b-4da7-40fd-92ab-20cb55411c35,42,9:51,Al Horford makes three point jump shot (Brandin Podziemski assists),threepointmade,33,1cfe70b8-4dfc-47dc-acca-b68d4a725972,basketball_play,1772068289,332,True,2026-02-26 01:11:29+00:00,2,591.0,849.0,14.15,132
3,103,quarter,2,1cfe70b8-4dfc-47dc-acca-b68d4a725972,42,9:39,Al Horford blocks Javon Small's three point jump shot,threepointmiss,33,,basketball_play,1772068301,331,True,2026-02-26 01:11:41+00:00,2,579.0,861.0,14.35,133
3,102,quarter,2,502c629b-4da7-40fd-92ab-20cb55411c35,42,9:36,Gary Payton II defensive rebound,rebound,33,502c629b-4da7-40fd-92ab-20cb55411c35,basketball_play,1772068304,330,True,2026-02-26 01:11:44+00:00,2,576.0,864.0,14.4,134
3,101,quarter,2,,42,9:35,Stoppage (Out of bounds),stoppage,33,,basketball_play,1772068312,329,True,2026-02-26 01:11:52+00:00,2,575.0,865.0,14.416666666666666,135
3,100,quarter,2,1cfe70b8-4dfc-47dc-acca-b68d4a725972,42,9:14,Olivier-Maxence Prosper shooting foul (Brandin Podziemski draws the foul),shootingfoul,33,502c629b-4da7-40fd-92ab-20cb55411c35,basketball_play,1772068337,328,True,2026-02-26 01:12:17+00:00,2,554.0,886.0,14.766666666666667,136
3,99,quarter,2,1cfe70b8-4dfc-47dc-acca-b68d4a725972,42,9:14,Grizzlies 60 second timeout,teamtimeout,33,,basketball_play,1772068352,327,True,2026-02-26 01:12:32+00:00,2,554.0,886.0,14.766666666666667,137
3,98,quarter,2,502c629b-4da7-40fd-92ab-20cb55411c35,42,9:14,"Warriors lineup change (Pat Spencer, Brandin Podziemski, Malevy Leons, Al Horford, Will Richard)",lineupchange,33,,basketball_play,1772068507,326,True,2026-02-26 01:15:07+00:00,2,554.0,886.0,14.766666666666667,138
3,97,quarter,2,502c629b-4da7-40fd-92ab-20cb55411c35,43,9:14,Brandin Podziemski makes regular free throw 1 of 2,freethrowmade,33,502c629b-4da7-40fd-92ab-20cb55411c35,basketball_play,1772068550,325,True,2026-02-26 01:15:50+00:00,2,554.0,886.0,14.766666666666667,139
3,96,quarter,2,502c629b-4da7-40fd-92ab-20cb55411c35,44,9:14,Brandin Podziemski makes regular free throw 2 of 2,freethrowmade,33,1cfe70b8-4dfc-47dc-acca-b68d4a725972,basketball_play,1772068564,324,True,2026-02-26 01:16:04+00:00,2,554.0,886.0,14.766666666666667,140
3,95,quarter,2,1cfe70b8-4dfc-47dc-acca-b68d4a725972,44,9:05,Javon Small makes two point driving reverse layup (Ty Jerome assists),twopointmade,35,502c629b-4da7-40fd-92ab-20cb55411c35,basketball_play,1772068575,323,True,2026-02-26 01:16:15+00:00,2,545.0,895.0,14.916666666666666,141
3,94,quarter,2,502c629b-4da7-40fd-92ab-20cb55411c35,44,8:44,Will Richard misses three point jump shot,threepointmiss,35,,basketball_play,1772068596,322,True,2026-02-26 01:16:36+00:00,2,524.0,916.0,15.266666666666667,142
3,93,quarter,2,1cfe70b8-4dfc-47dc-acca-b68d4a725972,44,8:40,Olivier-Maxence Prosper defensive rebound,rebound,35,1cfe70b8-4dfc-47dc-acca-b68d4a725972,basketball_play,1772068600,321,True,2026-02-26 01:16:40+00:00,2,520.0,920.0,15.333333333333334,143
3,92,quarter,2,1cfe70b8-4dfc-47dc-acca-b68d4a725972,44,8:32,GG Jackson misses three point jump shot,threepointmiss,35,,basketball_play,1772068608,320,True,2026-02-26 01:16:48+00:00,2,512.0,928.0,15.466666666666667,144
3,91,quarter,2,502c629b-4da7-40fd-92ab-20cb55411c35,44,8:29,Brandin Podziemski defensive rebound,rebound,35,502c629b-4da7-40fd-92ab-20cb55411c35,basketball_play,1772068611,319,True,2026-02-26 01:16:51+00:00,2,509.0,931.0,15.516666666666667,145
3,90,quarter,2,502c629b-4da7-40fd-92ab-20cb55411c35,44,8:08,Will Richard misses three point jump shot,threepointmiss,35,,basketball_play,1772068632,318,True,2026-02-26 01:17:12+00:00,2,488.0,952.0,15.866666666666667,146
3,89,quarter,2,1cfe70b8-4dfc-47dc-acca-b68d4a725972,44,8:04,Cam Spencer defensive rebound,rebound,35,1cfe70b8-4dfc-47dc-acca-b68d4a725972,basketball_play,1772068636,317,True,2026-02-26 01:17:16+00:00,2,484.0,956.0,15.933333333333334,147
3,88,quarter,2,1cfe70b8-4dfc-47dc-acca-b68d4a725972,44,7:46,Malevy Leons blocks Olivier-Maxence Prosper's two point driving floating jump shot,twopointmiss,35,,basketball_play,1772068655,316,True,2026-02-26 01:17:35+00:00,2,466.0,974.0,16.233333333333334,148
3,87,quarter,2,502c629b-4da7-40fd-92ab-20cb55411c35,44,7:42,Brandin Podziemski defensive rebound,rebound,35,502c629b-4da7-40fd-92ab-20cb55411c35,basketball_play,1772068659,315,True,2026-02-26 01:17:39+00:00,2,462.0,978.0,16.3,149
3,86,quarter,2,502c629b-4da7-40fd-92ab-20cb55411c35,47,7:37,Al Horford makes three point jump shot (Brandin Podziemski assists),threepointmade,35,1cfe70b8-4dfc-47dc-acca-b68d4a725972,basketball_play,1772068664,314,True,2026-02-26 01:17:44+00:00,2,457.0,983.0,16.383333333333333,150
3,85,quarter,2,1cfe70b8-4dfc-47dc-acca-b68d4a725972,47,7:19,Cam Spencer makes two point cutting finger roll layup (Olivier-Maxence Prosper assists),twopointmade,37,502c629b-4da7-40fd-92ab-20cb55411c35,basketball_play,1772068682,313,True,2026-02-26 01:18:02+00:00,2,439.0,1001.0,16.683333333333334,151
3,84,quarter,2,502c629b-4da7-40fd-92ab-20cb55411c35,47,7:10,GG Jackson blocks Al Horford's two point turnaround hook shot,twopointmiss,37,,basketball_play,1772068691,312,True,2026-02-26 01:18:11+00:00,2,430.0,1010.0,16.833333333333332,152
3,83,quarter,2,502c629b-4da7-40fd-92ab-20cb55411c35,47,7:08,Malevy Leons offensive rebound,rebound,37,502c629b-4da7-40fd-92ab-20cb55411c35,basketball_play,1772068693,311,True,2026-02-26 01:18:13+00:00,2,428.0,1012.0,16.866666666666667,153
3,82,quarter,2,502c629b-4da7-40fd-92ab-20cb55411c35,49,7:08,Will Richard makes two point reverse layup (Malevy Leons assists),twopointmade,37,1cfe70b8-4dfc-47dc-acca-b68d4a725972,basketball_play,1772068696,310,True,2026-02-26 01:18:16+00:00,2,428.0,1012.0,16.866666666666667,154
3,81,quarter,2,1cfe70b8-4dfc-47dc-acca-b68d4a725972,49,7:08,Cam Spencer shooting foul (Will Richard draws the foul),shootingfoul,37,502c629b-4da7-40fd-92ab-20cb55411c35,basketball_play,1772068702,309,True,2026-02-26 01:18:22+00:00,2,428.0,1012.0,16.866666666666667,155
3,80,quarter,2,502c629b-4da7-40fd-92ab-20cb55411c35,49,7:08,"Warriors lineup change (Quinten Post, Gui Santos, Pat Spencer, Malevy Leons, Will Richard)",lineupchange,37,,basketball_play,1772068708,308,True,2026-02-26 01:18:28+00:00,2,428.0,1012.0,16.866666666666667,156
3,79,quarter,2,1cfe70b8-4dfc-47dc-acca-b68d4a725972,49,7:08,"Grizzlies lineup change (Cam Spencer, Scotty Pippen Jr., Ty Jerome, GG Jackson, Taylor Hendricks)",lineupchange,37,,basketball_play,1772068708,307,True,2026-02-26 01:18:28+00:00,2,428.0,1012.0,16.866666666666667,157
3,78,quarter,2,502c629b-4da7-40fd-92ab-20cb55411c35,50,7:08,Will Richard makes regular free throw 1 of 1,freethrowmade,37,,basketball_play,1772068729,306,True,2026-02-26 01:18:49+00:00,2,428.0,1012.0,16.866666666666667,158
3,77,quarter,2,1cfe70b8-4dfc-47dc-acca-b68d4a725972,50,6:58,GG Jackson misses two point driving floating bank jump shot,twopointmiss,37,,basketball_play,1772068738,305,True,2026-02-26 01:18:58+00:00,2,418.0,1022.0,17.033333333333335,159
3,76,quarter,2,1cfe70b8-4dfc-47dc-acca-b68d4a725972,50,6:54,GG Jackson offensive rebound,rebound,37,1cfe70b8-4dfc-47dc-acca-b68d4a725972,basketball_play,1772068742,304,True,2026-02-26 01:19:02+00:00,2,414.0,1026.0,17.1,160
3,75,quarter,2,1cfe70b8-4dfc-47dc-acca-b68d4a725972,50,6:54,GG Jackson makes two point tip layup,twopointmade,39,502c629b-4da7-40fd-92ab-20cb55411c35,basketball_play,1772068742,303,True,2026-02-26 01:19:02+00:00,2,414.0,1026.0,17.1,161
3,74,quarter,2,502c629b-4da7-40fd-92ab-20cb55411c35,50,6:35,Will Richard turnover (bad pass) (Ty Jerome steals),turnover,39,1cfe70b8-4dfc-47dc-acca-b68d4a725972,basketball_play,1772068760,302,True,2026-02-26 01:19:20+00:00,2,395.0,1045.0,17.416666666666668,162
3,73,quarter,2,1cfe70b8-4dfc-47dc-acca-b68d4a725972,50,6:26,Cam Spencer turnover (bad pass) (Quinten Post steals),turnover,39,502c629b-4da7-40fd-92ab-20cb55411c35,basketball_play,1772068769,301,True,2026-02-26 01:19:29+00:00,2,386.0,1054.0,17.566666666666666,163
3,72,quarter,2,502c629b-4da7-40fd-92ab-20cb55411c35,53,6:13,Quinten Post makes three point jump shot (Pat Spencer assists),threepointmade,39,1cfe70b8-4dfc-47dc-acca-b68d4a725972,basketball_play,1772068783,300,True,2026-02-26 01:19:43+00:00,2,373.0,1067.0,17.783333333333335,164
3,71,quarter,2,1cfe70b8-4dfc-47dc-acca-b68d4a725972,53,6:13,Scotty Pippen Jr. shooting foul (Quinten Post draws the foul),shootingfoul,39,502c629b-4da7-40fd-92ab-20cb55411c35,basketball_play,1772068788,299,True,2026-02-26 01:19:48+00:00,2,373.0,1067.0,17.783333333333335,165
3,70,quarter,2,1cfe70b8-4dfc-47dc-acca-b68d4a725972,53,6:13,"Grizzlies lineup change (Scotty Pippen Jr., Walter Clayton Jr., Taylor Hendricks, Jaylen Wells, Rayan Rupert)",lineupchange,39,,basketball_play,1772068796,298,True,2026-02-26 01:19:56+00:00,2,373.0,1067.0,17.783333333333335,166
3,69,quarter,2,502c629b-4da7-40fd-92ab-20cb55411c35,53,6:13,Quinten Post misses regular free throw 1 of 1,freethrowmiss,39,,basketball_play,1772068813,297,True,2026-02-26 01:20:13+00:00,2,373.0,1067.0,17.783333333333335,167
3,68,quarter,2,502c629b-4da7-40fd-92ab-20cb55411c35,53,6:11,Warriors offensive rebound,rebound,39,502c629b-4da7-40fd-92ab-20cb55411c35,basketball_play,1772068815,296,True,2026-02-26 01:20:15+00:00,2,371.0,1069.0,17.816666666666666,168
3,67,quarter,2,,53,6:11,Stoppage (Out of bounds),stoppage,39,,basketball_play,1772068818,295,True,2026-02-26 01:20:18+00:00,2,371.0,1069.0,17.816666666666666,169
3,66,quarter,2,502c629b-4da7-40fd-92ab-20cb55411c35,56,6:09,Malevy Leons makes three point jump shot (Pat Spencer assists),threepointmade,39,1cfe70b8-4dfc-47dc-acca-b68d4a725972,basketball_play,1772068835,294,True,2026-02-26 01:20:35+00:00,2,369.0,1071.0,17.85,170
3,65,quarter,2,502c629b-4da7-40fd-92ab-20cb55411c35,56,5:56,Pat Spencer personal foul (Walter Clayton Jr. draws the foul),personalfoul,39,1cfe70b8-4dfc-47dc-acca-b68d4a725972,basketball_play,1772068851,293,True,2026-02-26 01:20:51+00:00,2,356.0,1084.0,18.066666666666666,171
3,64,quarter,2,1cfe70b8-4dfc-47dc-acca-b68d4a725972,56,5:44,Quinten Post blocks Walter Clayton Jr.'s two point driving floating jump shot,twopointmiss,39,,basketball_play,1772068884,292,True,2026-02-26 01:21:24+00:00,2,344.0,1096.0,18.266666666666666,172
3,63,quarter,2,502c629b-4da7-40fd-92ab-20cb55411c35,56,5:40,Malevy Leons defensive rebound,rebound,39,502c629b-4da7-40fd-92ab-20cb55411c35,basketball_play,1772068888,291,True,2026-02-26 01:21:28+00:00,2,340.0,1100.0,18.333333333333332,173
3,62,quarter,2,502c629b-4da7-40fd-92ab-20cb55411c35,56,5:31,Pat Spencer misses two point driving floating jump shot,twopointmiss,39,,basketball_play,1772068896,290,True,2026-02-26 01:21:36+00:00,2,331.0,1109.0,18.483333333333334,174
3,61,quarter,2,502c629b-4da7-40fd-92ab-20cb55411c35,56,5:27,Malevy Leons offensive rebound,rebound,39,502c629b-4da7-40fd-92ab-20cb55411c35,basketball_play,1772068900,289,True,2026-02-26 01:21:40+00:00,2,327.0,1113.0,18.55,175
3,60,quarter,2,502c629b-4da7-40fd-92ab-20cb55411c35,56,5:27,Malevy Leons misses two point tip layup,twopointmiss,39,,basketball_play,1772068900,288,True,2026-02-26 01:21:40+00:00,2,327.0,1113.0,18.55,176
3,59,quarter,2,1cfe70b8-4dfc-47dc-acca-b68d4a725972,56,5:27,Taylor Hendricks defensive rebound,rebound,39,1cfe70b8-4dfc-47dc-acca-b68d4a725972,basketball_play,1772068900,287,True,2026-02-26 01:21:40+00:00,2,327.0,1113.0,18.55,177
3,58,quarter,2,1cfe70b8-4dfc-47dc-acca-b68d4a725972,56,5:16,Scotty Pippen Jr. turnover (bad pass) (Malevy Leons steals),turnover,39,502c629b-4da7-40fd-92ab-20cb55411c35,basketball_play,1772068911,286,True,2026-02-26 01:21:51+00:00,2,316.0,1124.0,18.733333333333334,178
3,57,quarter,2,502c629b-4da7-40fd-92ab-20cb55411c35,56,5:10,Quinten Post misses three point running jump shot,threepointmiss,39,,basketball_play,1772068918,285,True,2026-02-26 01:21:58+00:00,2,310.0,1130.0,18.833333333333332,179
3,56,quarter,2,502c629b-4da7-40fd-92ab-20cb55411c35,56,5:06,Malevy Leons offensive rebound,rebound,39,502c629b-4da7-40fd-92ab-20cb55411c35,basketball_play,1772068921,284,True,2026-02-26 01:22:01+00:00,2,306.0,1134.0,18.9,180
3,55,quarter,2,502c629b-4da7-40fd-92ab-20cb55411c35,59,5:04,Pat Spencer makes three point jump shot (Malevy Leons assists),threepointmade,39,1cfe70b8-4dfc-47dc-acca-b68d4a725972,basketball_play,1772068924,283,True,2026-02-26 01:22:04+00:00,2,304.0,1136.0,18.933333333333334,181
3,54,quarter,2,,59,4:55,Stoppage (Out of bounds),stoppage,39,,basketball_play,1772068935,282,True,2026-02-26 01:22:15+00:00,2,295.0,1145.0,19.083333333333332,182
3,53,quarter,2,502c629b-4da7-40fd-92ab-20cb55411c35,59,4:55,"Warriors lineup change (Gary Payton II, Moses Moody, Quinten Post, Gui Santos, Pat Spencer)",lineupchange,39,,basketball_play,1772068936,281,True,2026-02-26 01:22:16+00:00,2,295.0,1145.0,19.083333333333332,183
3,52,quarter,2,1cfe70b8-4dfc-47dc-acca-b68d4a725972,59,4:48,Jaylen Wells turnover (bad pass) (Gary Payton II steals),turnover,39,502c629b-4da7-40fd-92ab-20cb55411c35,basketball_play,1772068957,280,True,2026-02-26 01:22:37+00:00,2,288.0,1152.0,19.2,184
3,51,quarter,2,502c629b-4da7-40fd-92ab-20cb55411c35,61,4:46,Gary Payton II makes two point running reverse dunk,twopointmade,39,1cfe70b8-4dfc-47dc-acca-b68d4a725972,basketball_play,1772068960,279,True,2026-02-26 01:22:40+00:00,2,286.0,1154.0,19.233333333333334,185
3,50,quarter,2,1cfe70b8-4dfc-47dc-acca-b68d4a725972,61,4:46,Grizzlies 60 second timeout,teamtimeout,39,,basketball_play,1772068965,278,True,2026-02-26 01:22:45+00:00,2,286.0,1154.0,19.233333333333334,186
3,49,quarter,2,502c629b-4da7-40fd-92ab-20cb55411c35,61,4:46,"Warriors lineup change (Gary Payton II, Moses Moody, Quinten Post, Gui Santos, Brandin Podziemski)",lineupchange,39,,basketball_play,1772069145,277,True,2026-02-26 01:25:45+00:00,2,286.0,1154.0,19.233333333333334,187
3,48,quarter,2,1cfe70b8-4dfc-47dc-acca-b68d4a725972,61,4:36,Walter Clayton Jr. misses three point jump shot,threepointmiss,39,,basketball_play,1772069145,276,True,2026-02-26 01:25:45+00:00,2,276.0,1164.0,19.4,188
3,47,quarter,2,502c629b-4da7-40fd-92ab-20cb55411c35,61,4:33,Warriors defensive rebound,rebound,39,502c629b-4da7-40fd-92ab-20cb55411c35,basketball_play,1772069148,275,True,2026-02-26 01:25:48+00:00,2,273.0,1167.0,19.45,189
3,46,quarter,2,,61,4:33,Stoppage (Out of bounds),stoppage,39,,basketball_play,1772069149,274,True,2026-02-26 01:25:49+00:00,2,273.0,1167.0,19.45,190
3,45,quarter,2,,61,4:16,Stoppage (Out of bounds),stoppage,39,,basketball_play,1772069173,273,True,2026-02-26 01:26:13+00:00,2,256.0,1184.0,19.733333333333334,191
3,44,quarter,2,502c629b-4da7-40fd-92ab-20cb55411c35,61,4:11,Brandin Podziemski misses three point pullup jump shot,threepointmiss,39,,basketball_play,1772069190,272,True,2026-02-26 01:26:30+00:00,2,251.0,1189.0,19.816666666666666,192
3,43,quarter,2,502c629b-4da7-40fd-92ab-20cb55411c35,61,4:11,Warriors offensive rebound,rebound,39,502c629b-4da7-40fd-92ab-20cb55411c35,basketball_play,1772069190,271,True,2026-02-26 01:26:30+00:00,2,251.0,1189.0,19.816666666666666,193
3,42,quarter,2,1cfe70b8-4dfc-47dc-acca-b68d4a725972,61,4:11,Rayan Rupert personal foul (Loose ball) (Quinten Post draws the foul),personalfoul,39,502c629b-4da7-40fd-92ab-20cb55411c35,basketball_play,1772069194,270,True,2026-02-26 01:26:34+00:00,2,251.0,1189.0,19.816666666666666,194
3,41,quarter,2,502c629b-4da7-40fd-92ab-20cb55411c35,62,4:11,Quinten Post makes regular free throw 1 of 2,freethrowmade,39,502c629b-4da7-40fd-92ab-20cb55411c35,basketball_play,1772069213,269,True,2026-02-26 01:26:53+00:00,2,251.0,1189.0,19.816666666666666,195
3,40,quarter,2,502c629b-4da7-40fd-92ab-20cb55411c35,63,4:11,Quinten Post makes regular free throw 2 of 2,freethrowmade,39,1cfe70b8-4dfc-47dc-acca-b68d4a725972,basketball_play,1772069229,268,True,2026-02-26 01:27:09+00:00,2,251.0,1189.0,19.816666666666666,196
3,39,quarter,2,,63,4:08,Stoppage (Out of bounds),stoppage,39,,basketball_play,1772069238,267,True,2026-02-26 01:27:18+00:00,2,248.0,1192.0,19.866666666666667,197
3,38,quarter,2,1cfe70b8-4dfc-47dc-acca-b68d4a725972,63,3:59,Taylor Hendricks makes two point driving finger roll layup (Scotty Pippen Jr. assists),twopointmade,41,502c629b-4da7-40fd-92ab-20cb55411c35,basketball_play,1772069258,266,True,2026-02-26 01:27:38+00:00,2,239.0,1201.0,20.016666666666666,198
3,37,quarter,2,502c629b-4da7-40fd-92ab-20cb55411c35,65,3:44,Brandin Podziemski makes two point driving finger roll layup,twopointmade,41,1cfe70b8-4dfc-47dc-acca-b68d4a725972,basketball_play,1772069274,265,True,2026-02-26 01:27:54+00:00,2,224.0,1216.0,20.266666666666666,199
3,36,quarter,2,1cfe70b8-4dfc-47dc-acca-b68d4a725972,65,3:31,Rayan Rupert makes three point jump shot (Jaylen Wells assists),threepointmade,44,502c629b-4da7-40fd-92ab-20cb55411c35,basketball_play,1772069287,264,True,2026-02-26 01:28:07+00:00,2,211.0,1229.0,20.483333333333334,200
3,35,quarter,2,502c629b-4da7-40fd-92ab-20cb55411c35,65,3:17,Quinten Post turnover (bad pass) (Jaylen Wells steals),turnover,44,1cfe70b8-4dfc-47dc-acca-b68d4a725972,basketball_play,1772069300,263,True,2026-02-26 01:28:20+00:00,2,197.0,1243.0,20.716666666666665,201
3,34,quarter,2,1cfe70b8-4dfc-47dc-acca-b68d4a725972,65,3:08,Scotty Pippen Jr. misses two point driving layup,twopointmiss,44,,basketball_play,1772069310,262,True,2026-02-26 01:28:30+00:00,2,188.0,1252.0,20.866666666666667,202
3,33,quarter,2,502c629b-4da7-40fd-92ab-20cb55411c35,65,3:03,Quinten Post defensive rebound,rebound,44,502c629b-4da7-40fd-92ab-20cb55411c35,basketball_play,1772069315,261,True,2026-02-26 01:28:35+00:00,2,183.0,1257.0,20.95,203
3,32,quarter,2,502c629b-4da7-40fd-92ab-20cb55411c35,65,2:53,Quinten Post misses two point turnaround hook shot,twopointmiss,44,,basketball_play,1772069324,260,True,2026-02-26 01:28:44+00:00,2,173.0,1267.0,21.116666666666667,204
3,31,quarter,2,1cfe70b8-4dfc-47dc-acca-b68d4a725972,65,2:50,Taylor Hendricks defensive rebound,rebound,44,1cfe70b8-4dfc-47dc-acca-b68d4a725972,basketball_play,1772069327,259,True,2026-02-26 01:28:47+00:00,2,170.0,1270.0,21.166666666666668,205
3,30,quarter,2,1cfe70b8-4dfc-47dc-acca-b68d4a725972,65,2:34,Walter Clayton Jr. misses two point driving layup,twopointmiss,44,,basketball_play,1772069344,258,True,2026-02-26 01:29:04+00:00,2,154.0,1286.0,21.433333333333334,206
3,29,quarter,2,502c629b-4da7-40fd-92ab-20cb55411c35,65,2:32,Brandin Podziemski defensive rebound,rebound,44,502c629b-4da7-40fd-92ab-20cb55411c35,basketball_play,1772069346,257,True,2026-02-26 01:29:06+00:00,2,152.0,1288.0,21.466666666666665,207
3,28,quarter,2,502c629b-4da7-40fd-92ab-20cb55411c35,68,2:28,Gui Santos makes three point running jump shot (Brandin Podziemski assists),threepointmade,44,1cfe70b8-4dfc-47dc-acca-b68d4a725972,basketball_play,1772069350,256,True,2026-02-26 01:29:10+00:00,2,148.0,1292.0,21.533333333333335,208
3,27,quarter,2,502c629b-4da7-40fd-92ab-20cb55411c35,68,2:11,Gary Payton II shooting foul (Walter Clayton Jr. draws the foul),shootingfoul,44,1cfe70b8-4dfc-47dc-acca-b68d4a725972,basketball_play,1772069367,255,True,2026-02-26 01:29:27+00:00,2,131.0,1309.0,21.816666666666666,209
3,26,quarter,2,1cfe70b8-4dfc-47dc-acca-b68d4a725972,68,2:11,Walter Clayton Jr. makes regular free throw 1 of 2,freethrowmade,45,1cfe70b8-4dfc-47dc-acca-b68d4a725972,basketball_play,1772069401,254,True,2026-02-26 01:30:01+00:00,2,131.0,1309.0,21.816666666666666,210
