period_index,event_index,period_type,period_number,attribution,away_points,clock,description,event_type,home_points,possession,type,wall_clock,pbp_source_row,has_wall_clock,event_ts_utc,period_sequence,game_clock_seconds_remaining,game_elapsed_seconds,game_elapsed_minutes,pbp_chronological_index
4,118,quarter,1,1cfe70b8-4dfc-47dc-acca-b68d4a725972,0,12:00,"Grizzlies lineup change (Scotty Pippen Jr., GG Jackson, Olivier-Maxence Prosper, Walter Clayton Jr., Jaylen Wells)",lineupchange,0,,basketball_play,1772403036,447,True,2026-03-01 22:10:36+00:00,1,720.0,0.0,0.0,1
4,117,quarter,1,d059bab2-9fb5-42dd-8038-5a12474300ce,0,12:00,"Pacers lineup change (Jay Huff, Kam Jones, Obi Toppin, Ben Sheppard, Jarace Walker)",lineupchange,0,,basketball_play,1772403036,446,True,2026-03-01 22:10:36+00:00,1,720.0,0.0,0.0,2
4,116,quarter,1,,0,12:00,Start of 1st Quarter,startperiod,0,,basketball_play,1772403036,445,True,2026-03-01 22:10:36+00:00,1,720.0,0.0,0.0,3
4,115,quarter,1,d059bab2-9fb5-42dd-8038-5a12474300ce,0,12:00,Olivier-Maxence Prosper vs. Jay Huff (Jarace Walker gains possession),opentip,0,d059bab2-9fb5-42dd-8038-5a12474300ce,basketball_play,1772403038,444,True,2026-03-01 22:10:38+00:00,1,720.0,0.0,0.0,4
4,114,quarter,1,d059bab2-9fb5-42dd-8038-5a12474300ce,0,11:39,GG Jackson blocks Obi Toppin's two point driving floating jump shot,twopointmiss,0,,basketball_play,1772403056,443,True,2026-03-01 22:10:56+00:00,1,699.0,21.0,0.35,5
4,113,quarter,1,d059bab2-9fb5-42dd-8038-5a12474300ce,0,11:38,Pacers offensive rebound,rebound,0,d059bab2-9fb5-42dd-8038-5a12474300ce,basketball_play,1772403057,442,True,2026-03-01 22:10:57+00:00,1,698.0,22.0,0.36666666666666664,6
4,112,quarter,1,,0,11:38,Stoppage (Out of bounds),stoppage,0,,basketball_play,1772403081,441,True,2026-03-01 22:11:21+00:00,1,698.0,22.0,0.36666666666666664,7
4,111,quarter,1,d059bab2-9fb5-42dd-8038-5a12474300ce,0,11:36,Obi Toppin makes two point jump shot (Kam Jones assists),twopointmade,2,1cfe70b8-4dfc-47dc-acca-b68d4a725972,basketball_play,1772403126,440,True,2026-03-01 22:12:06+00:00,1,696.0,24.0,0.4,8
4,110,quarter,1,1cfe70b8-4dfc-47dc-acca-b68d4a725972,0,11:17,Walter Clayton Jr. turnover (lost ball) (Obi Toppin steals),turnover,2,d059bab2-9fb5-42dd-8038-5a12474300ce,basketball_play,1772403145,439,True,2026-03-01 22:12:25+00:00,1,677.0,43.0,0.7166666666666667,9
4,109,quarter,1,d059bab2-9fb5-42dd-8038-5a12474300ce,0,11:14,Jarace Walker makes two point running finger roll layup (Obi Toppin assists),twopointmade,4,1cfe70b8-4dfc-47dc-acca-b68d4a725972,basketball_play,1772403148,438,True,2026-03-01 22:12:28+00:00,1,674.0,46.0,0.7666666666666667,10
4,108,quarter,1,1cfe70b8-4dfc-47dc-acca-b68d4a725972,3,11:03,Jaylen Wells makes three point jump shot (Scotty Pippen Jr. assists),threepointmade,4,d059bab2-9fb5-42dd-8038-5a12474300ce,basketball_play,1772403159,437,True,2026-03-01 22:12:39+00:00,1,663.0,57.0,0.95,11
4,107,quarter,1,d059bab2-9fb5-42dd-8038-5a12474300ce,3,10:53,Jarace Walker turnover (lost ball) (Walter Clayton Jr. steals),turnover,4,1cfe70b8-4dfc-47dc-acca-b68d4a725972,basketball_play,1772403169,436,True,2026-03-01 22:12:49+00:00,1,653.0,67.0,1.1166666666666667,12
4,106,quarter,1,1cfe70b8-4dfc-47dc-acca-b68d4a725972,5,10:49,Scotty Pippen Jr. makes two point running finger roll layup (Walter Clayton Jr. assists),twopointmade,4,d059bab2-9fb5-42dd-8038-5a12474300ce,basketball_play,1772403173,435,True,2026-03-01 22:12:53+00:00,1,649.0,71.0,1.1833333333333333,13
4,105,quarter,1,1cfe70b8-4dfc-47dc-acca-b68d4a725972,5,10:34,Scotty Pippen Jr. shooting foul (Obi Toppin draws the foul),shootingfoul,4,d059bab2-9fb5-42dd-8038-5a12474300ce,basketball_play,1772403189,434,True,2026-03-01 22:13:09+00:00,1,634.0,86.0,1.4333333333333333,14
4,104,quarter,1,d059bab2-9fb5-42dd-8038-5a12474300ce,5,10:34,Obi Toppin makes regular free throw 1 of 2,freethrowmade,5,d059bab2-9fb5-42dd-8038-5a12474300ce,basketball_play,1772403214,433,True,2026-03-01 22:13:34+00:00,1,634.0,86.0,1.4333333333333333,15
4,103,quarter,1,d059bab2-9fb5-42dd-8038-5a12474300ce,5,10:34,Obi Toppin makes regular free throw 2 of 2,freethrowmade,6,1cfe70b8-4dfc-47dc-acca-b68d4a725972,basketball_play,1772403229,432,True,2026-03-01 22:13:49+00:00,1,634.0,86.0,1.4333333333333333,16
4,102,quarter,1,1cfe70b8-4dfc-47dc-acca-b68d4a725972,5,10:17,Jaylen Wells turnover (bad pass) (Ben Sheppard steals),turnover,6,d059bab2-9fb5-42dd-8038-5a12474300ce,basketball_play,1772403248,431,True,2026-03-01 22:14:08+00:00,1,617.0,103.0,1.7166666666666666,17
4,101,quarter,1,d059bab2-9fb5-42dd-8038-5a12474300ce,5,10:12,Kam Jones makes two point running reverse layup (Jarace Walker assists),twopointmade,8,1cfe70b8-4dfc-47dc-acca-b68d4a725972,basketball_play,1772403253,430,True,2026-03-01 22:14:13+00:00,1,612.0,108.0,1.8,18
4,100,quarter,1,1cfe70b8-4dfc-47dc-acca-b68d4a725972,7,9:58,Jaylen Wells makes two point driving layup (Walter Clayton Jr. assists),twopointmade,8,d059bab2-9fb5-42dd-8038-5a12474300ce,basketball_play,1772403267,429,True,2026-03-01 22:14:27+00:00,1,598.0,122.0,2.033333333333333,19
4,99,quarter,1,d059bab2-9fb5-42dd-8038-5a12474300ce,7,9:49,Kam Jones misses two point driving floating bank jump shot,twopointmiss,8,,basketball_play,1772403276,428,True,2026-03-01 22:14:36+00:00,1,589.0,131.0,2.183333333333333,20
4,98,quarter,1,d059bab2-9fb5-42dd-8038-5a12474300ce,7,9:47,Jay Huff offensive rebound,rebound,8,d059bab2-9fb5-42dd-8038-5a12474300ce,basketball_play,1772403278,427,True,2026-03-01 22:14:38+00:00,1,587.0,133.0,2.216666666666667,21
4,97,quarter,1,d059bab2-9fb5-42dd-8038-5a12474300ce,7,9:41,Kam Jones misses three point jump shot,threepointmiss,8,,basketball_play,1772403285,426,True,2026-03-01 22:14:45+00:00,1,581.0,139.0,2.316666666666667,22
4,96,quarter,1,1cfe70b8-4dfc-47dc-acca-b68d4a725972,7,9:38,Jaylen Wells defensive rebound,rebound,8,1cfe70b8-4dfc-47dc-acca-b68d4a725972,basketball_play,1772403288,425,True,2026-03-01 22:14:48+00:00,1,578.0,142.0,2.3666666666666667,23
4,95,quarter,1,1cfe70b8-4dfc-47dc-acca-b68d4a725972,10,9:30,GG Jackson makes three point jump shot (Jaylen Wells assists),threepointmade,8,d059bab2-9fb5-42dd-8038-5a12474300ce,basketball_play,1772403296,424,True,2026-03-01 22:14:56+00:00,1,570.0,150.0,2.5,24
4,94,quarter,1,d059bab2-9fb5-42dd-8038-5a12474300ce,10,9:16,Ben Sheppard turnover (lost ball) (Walter Clayton Jr. steals),turnover,8,1cfe70b8-4dfc-47dc-acca-b68d4a725972,basketball_play,1772403309,423,True,2026-03-01 22:15:09+00:00,1,556.0,164.0,2.7333333333333334,25
4,93,quarter,1,1cfe70b8-4dfc-47dc-acca-b68d4a725972,12,9:12,Olivier-Maxence Prosper makes two point running alley-oop layup (Walter Clayton Jr. assists),twopointmade,8,d059bab2-9fb5-42dd-8038-5a12474300ce,basketball_play,1772403313,422,True,2026-03-01 22:15:13+00:00,1,552.0,168.0,2.8,26
4,92,quarter,1,d059bab2-9fb5-42dd-8038-5a12474300ce,12,8:59,Jay Huff makes two point alley-oop dunk (Obi Toppin assists),twopointmade,10,1cfe70b8-4dfc-47dc-acca-b68d4a725972,basketball_play,1772403326,421,True,2026-03-01 22:15:26+00:00,1,539.0,181.0,3.0166666666666666,27
4,91,quarter,1,1cfe70b8-4dfc-47dc-acca-b68d4a725972,12,8:35,Walter Clayton Jr. misses three point jump shot,threepointmiss,10,,basketball_play,1772403349,420,True,2026-03-01 22:15:49+00:00,1,515.0,205.0,3.4166666666666665,28
4,90,quarter,1,1cfe70b8-4dfc-47dc-acca-b68d4a725972,12,8:32,Grizzlies offensive rebound,rebound,10,1cfe70b8-4dfc-47dc-acca-b68d4a725972,basketball_play,1772403352,419,True,2026-03-01 22:15:52+00:00,1,512.0,208.0,3.466666666666667,29
4,89,quarter,1,,12,8:32,Stoppage (Out of bounds),stoppage,10,,basketball_play,1772403356,418,True,2026-03-01 22:15:56+00:00,1,512.0,208.0,3.466666666666667,30
4,88,quarter,1,1cfe70b8-4dfc-47dc-acca-b68d4a725972,12,8:32,"Grizzlies lineup change (Scotty Pippen Jr., Olivier-Maxence Prosper, Walter Clayton Jr., Jaylen Wells, Rayan Rupert)",lineupchange,10,,basketball_play,1772403375,417,True,2026-03-01 22:16:15+00:00,1,512.0,208.0,3.466666666666667,31
4,87,quarter,1,1cfe70b8-4dfc-47dc-acca-b68d4a725972,12,8:25,Jaylen Wells misses three point jump shot,threepointmiss,10,,basketball_play,1772403375,416,True,2026-03-01 22:16:15+00:00,1,505.0,215.0,3.5833333333333335,32
4,86,quarter,1,d059bab2-9fb5-42dd-8038-5a12474300ce,12,8:22,Obi Toppin defensive rebound,rebound,10,d059bab2-9fb5-42dd-8038-5a12474300ce,basketball_play,1772403378,415,True,2026-03-01 22:16:18+00:00,1,502.0,218.0,3.6333333333333333,33
4,85,quarter,1,d059bab2-9fb5-42dd-8038-5a12474300ce,12,8:14,Jay Huff makes three point jump shot (Kam Jones assists),threepointmade,13,1cfe70b8-4dfc-47dc-acca-b68d4a725972,basketball_play,1772403386,414,True,2026-03-01 22:16:26+00:00,1,494.0,226.0,3.7666666666666666,34
4,84,quarter,1,1cfe70b8-4dfc-47dc-acca-b68d4a725972,12,8:01,Scotty Pippen Jr. misses two point driving floating jump shot,twopointmiss,13,,basketball_play,1772403398,413,True,2026-03-01 22:16:38+00:00,1,481.0,239.0,3.9833333333333334,35
4,83,quarter,1,d059bab2-9fb5-42dd-8038-5a12474300ce,12,7:59,Jay Huff defensive rebound,rebound,13,d059bab2-9fb5-42dd-8038-5a12474300ce,basketball_play,1772403400,412,True,2026-03-01 22:16:40+00:00,1,479.0,241.0,4.016666666666667,36
4,82,quarter,1,d059bab2-9fb5-42dd-8038-5a12474300ce,12,7:51,Jarace Walker makes two point driving floating jump shot (Obi Toppin assists),twopointmade,15,1cfe70b8-4dfc-47dc-acca-b68d4a725972,basketball_play,1772403408,411,True,2026-03-01 22:16:48+00:00,1,471.0,249.0,4.15,37
4,81,quarter,1,1cfe70b8-4dfc-47dc-acca-b68d4a725972,12,7:50,Grizzlies 60 second timeout,teamtimeout,15,,basketball_play,1772403414,410,True,2026-03-01 22:16:54+00:00,1,470.0,250.0,4.166666666666667,38
4,80,quarter,1,1cfe70b8-4dfc-47dc-acca-b68d4a725972,12,7:50,"Grizzlies lineup change (Scotty Pippen Jr., Olivier-Maxence Prosper, Javon Small, Jaylen Wells, Rayan Rupert)",lineupchange,15,,basketball_play,1772403610,409,True,2026-03-01 22:20:10+00:00,1,470.0,250.0,4.166666666666667,39
4,79,quarter,1,d059bab2-9fb5-42dd-8038-5a12474300ce,12,7:40,Pacers technical foul (Defensive three second),technicalfoulnonunsportsmanlike,15,1cfe70b8-4dfc-47dc-acca-b68d4a725972,basketball_play,1772403610,408,True,2026-03-01 22:20:10+00:00,1,460.0,260.0,4.333333333333333,40
4,78,quarter,1,1cfe70b8-4dfc-47dc-acca-b68d4a725972,13,7:40,Scotty Pippen Jr. makes technical free throw 1 of 1,freethrowmade,15,,basketball_play,1772403627,407,True,2026-03-01 22:20:27+00:00,1,460.0,260.0,4.333333333333333,41
4,77,quarter,1,1cfe70b8-4dfc-47dc-acca-b68d4a725972,13,7:36,Javon Small misses two point driving floating jump shot,twopointmiss,15,,basketball_play,1772403642,406,True,2026-03-01 22:20:42+00:00,1,456.0,264.0,4.4,42
4,76,quarter,1,1cfe70b8-4dfc-47dc-acca-b68d4a725972,13,7:35,Olivier-Maxence Prosper offensive rebound,rebound,15,1cfe70b8-4dfc-47dc-acca-b68d4a725972,basketball_play,1772403643,405,True,2026-03-01 22:20:43+00:00,1,455.0,265.0,4.416666666666667,43
4,75,quarter,1,1cfe70b8-4dfc-47dc-acca-b68d4a725972,15,7:34,Olivier-Maxence Prosper makes two point tip layup,twopointmade,15,d059bab2-9fb5-42dd-8038-5a12474300ce,basketball_play,1772403647,404,True,2026-03-01 22:20:47+00:00,1,454.0,266.0,4.433333333333334,44
4,74,quarter,1,d059bab2-9fb5-42dd-8038-5a12474300ce,15,7:10,Jarace Walker makes two point pullup jump shot,twopointmade,17,1cfe70b8-4dfc-47dc-acca-b68d4a725972,basketball_play,1772403668,403,True,2026-03-01 22:21:08+00:00,1,430.0,290.0,4.833333333333333,45
4,73,quarter,1,1cfe70b8-4dfc-47dc-acca-b68d4a725972,15,6:56,Olivier-Maxence Prosper misses three point jump shot,threepointmiss,17,,basketball_play,1772403683,402,True,2026-03-01 22:21:23+00:00,1,416.0,304.0,5.066666666666666,46
4,72,quarter,1,d059bab2-9fb5-42dd-8038-5a12474300ce,15,6:54,Obi Toppin defensive rebound,rebound,17,d059bab2-9fb5-42dd-8038-5a12474300ce,basketball_play,1772403685,401,True,2026-03-01 22:21:25+00:00,1,414.0,306.0,5.1,47
4,71,quarter,1,d059bab2-9fb5-42dd-8038-5a12474300ce,15,6:49,Pacers 60 second timeout,teamtimeout,17,,basketball_play,1772403693,400,True,2026-03-01 22:21:33+00:00,1,409.0,311.0,5.183333333333334,48
4,70,quarter,1,1cfe70b8-4dfc-47dc-acca-b68d4a725972,15,6:49,"Grizzlies lineup change (Javon Small, Jahmai Mashack, Jaylen Wells, Taylor Hendricks, Rayan Rupert)",lineupchange,17,,basketball_play,1772403815,399,True,2026-03-01 22:23:35+00:00,1,409.0,311.0,5.183333333333334,49
4,69,quarter,1,d059bab2-9fb5-42dd-8038-5a12474300ce,15,6:49,"Pacers lineup change (Taelon Peter, Micah Potter, Kam Jones, Quenton Jackson, Kobe Brown)",lineupchange,17,,basketball_play,1772403815,398,True,2026-03-01 22:23:35+00:00,1,409.0,311.0,5.183333333333334,50
4,68,quarter,1,1cfe70b8-4dfc-47dc-acca-b68d4a725972,15,6:43,Javon Small shooting foul (Kam Jones draws the foul),shootingfoul,17,d059bab2-9fb5-42dd-8038-5a12474300ce,basketball_play,1772403879,397,True,2026-03-01 22:24:39+00:00,1,403.0,317.0,5.283333333333333,51
4,67,quarter,1,d059bab2-9fb5-42dd-8038-5a12474300ce,15,6:43,Kam Jones makes regular free throw 1 of 2,freethrowmade,18,d059bab2-9fb5-42dd-8038-5a12474300ce,basketball_play,1772403897,396,True,2026-03-01 22:24:57+00:00,1,403.0,317.0,5.283333333333333,52
4,66,quarter,1,d059bab2-9fb5-42dd-8038-5a12474300ce,15,6:43,Kam Jones makes regular free throw 2 of 2,freethrowmade,19,1cfe70b8-4dfc-47dc-acca-b68d4a725972,basketball_play,1772403912,395,True,2026-03-01 22:25:12+00:00,1,403.0,317.0,5.283333333333333,53
4,65,quarter,1,1cfe70b8-4dfc-47dc-acca-b68d4a725972,15,6:28,Jahmai Mashack misses two point driving floating jump shot,twopointmiss,19,,basketball_play,1772403929,394,True,2026-03-01 22:25:29+00:00,1,388.0,332.0,5.533333333333333,54
4,64,quarter,1,1cfe70b8-4dfc-47dc-acca-b68d4a725972,15,6:26,Taylor Hendricks offensive rebound,rebound,19,1cfe70b8-4dfc-47dc-acca-b68d4a725972,basketball_play,1772403931,393,True,2026-03-01 22:25:31+00:00,1,386.0,334.0,5.566666666666666,55
4,63,quarter,1,1cfe70b8-4dfc-47dc-acca-b68d4a725972,15,6:25,Micah Potter blocks Taylor Hendricks's two point tip layup,twopointmiss,19,,basketball_play,1772403933,392,True,2026-03-01 22:25:33+00:00,1,385.0,335.0,5.583333333333333,56
4,62,quarter,1,1cfe70b8-4dfc-47dc-acca-b68d4a725972,15,6:24,Jaylen Wells offensive rebound,rebound,19,1cfe70b8-4dfc-47dc-acca-b68d4a725972,basketball_play,1772403934,391,True,2026-03-01 22:25:34+00:00,1,384.0,336.0,5.6,57
4,61,quarter,1,1cfe70b8-4dfc-47dc-acca-b68d4a725972,17,6:22,Jaylen Wells makes two point driving layup,twopointmade,19,d059bab2-9fb5-42dd-8038-5a12474300ce,basketball_play,1772403934,390,True,2026-03-01 22:25:34+00:00,1,382.0,338.0,5.633333333333334,58
4,60,quarter,1,d059bab2-9fb5-42dd-8038-5a12474300ce,17,6:16,Quenton Jackson turnover (out of bounds lost ball),turnover,19,1cfe70b8-4dfc-47dc-acca-b68d4a725972,basketball_play,1772403943,389,True,2026-03-01 22:25:43+00:00,1,376.0,344.0,5.733333333333333,59
4,59,quarter,1,1cfe70b8-4dfc-47dc-acca-b68d4a725972,19,5:56,Jaylen Wells makes two point driving layup,twopointmade,19,d059bab2-9fb5-42dd-8038-5a12474300ce,basketball_play,1772403970,388,True,2026-03-01 22:26:10+00:00,1,356.0,364.0,6.066666666666666,60
4,58,quarter,1,1cfe70b8-4dfc-47dc-acca-b68d4a725972,19,5:48,Taylor Hendricks personal foul (Quenton Jackson draws the foul),personalfoul,19,d059bab2-9fb5-42dd-8038-5a12474300ce,basketball_play,1772403980,387,True,2026-03-01 22:26:20+00:00,1,348.0,372.0,6.2,61
4,57,quarter,1,1cfe70b8-4dfc-47dc-acca-b68d4a725972,19,5:48,"Grizzlies lineup change (Javon Small, Cam Spencer, Jahmai Mashack, Taylor Hendricks, Rayan Rupert)",lineupchange,19,,basketball_play,1772404011,386,True,2026-03-01 22:26:51+00:00,1,348.0,372.0,6.2,62
4,56,quarter,1,d059bab2-9fb5-42dd-8038-5a12474300ce,19,5:41,Quenton Jackson misses two point driving layup,twopointmiss,19,,basketball_play,1772404011,385,True,2026-03-01 22:26:51+00:00,1,341.0,379.0,6.316666666666666,63
4,55,quarter,1,d059bab2-9fb5-42dd-8038-5a12474300ce,19,5:39,Micah Potter offensive rebound,rebound,19,d059bab2-9fb5-42dd-8038-5a12474300ce,basketball_play,1772404013,384,True,2026-03-01 22:26:53+00:00,1,339.0,381.0,6.35,64
4,54,quarter,1,d059bab2-9fb5-42dd-8038-5a12474300ce,19,5:39,Micah Potter makes two point tip layup,twopointmade,21,1cfe70b8-4dfc-47dc-acca-b68d4a725972,basketball_play,1772404013,383,True,2026-03-01 22:26:53+00:00,1,339.0,381.0,6.35,65
4,53,quarter,1,1cfe70b8-4dfc-47dc-acca-b68d4a725972,22,5:28,Javon Small makes three point stepback jump shot,threepointmade,21,d059bab2-9fb5-42dd-8038-5a12474300ce,basketball_play,1772404024,382,True,2026-03-01 22:27:04+00:00,1,328.0,392.0,6.533333333333333,66
4,52,quarter,1,d059bab2-9fb5-42dd-8038-5a12474300ce,22,5:14,Taelon Peter makes three point jump shot (Kam Jones assists),threepointmade,24,1cfe70b8-4dfc-47dc-acca-b68d4a725972,basketball_play,1772404038,381,True,2026-03-01 22:27:18+00:00,1,314.0,406.0,6.766666666666667,67
4,51,quarter,1,1cfe70b8-4dfc-47dc-acca-b68d4a725972,25,4:59,Taylor Hendricks makes three point jump shot (Cam Spencer assists),threepointmade,24,d059bab2-9fb5-42dd-8038-5a12474300ce,basketball_play,1772404053,380,True,2026-03-01 22:27:33+00:00,1,299.0,421.0,7.016666666666667,68
4,50,quarter,1,d059bab2-9fb5-42dd-8038-5a12474300ce,25,4:34,Kam Jones misses three point jump shot,threepointmiss,24,,basketball_play,1772404077,379,True,2026-03-01 22:27:57+00:00,1,274.0,446.0,7.433333333333334,69
4,49,quarter,1,1cfe70b8-4dfc-47dc-acca-b68d4a725972,25,4:32,Cam Spencer defensive rebound,rebound,24,1cfe70b8-4dfc-47dc-acca-b68d4a725972,basketball_play,1772404079,378,True,2026-03-01 22:27:59+00:00,1,272.0,448.0,7.466666666666667,70
4,48,quarter,1,1cfe70b8-4dfc-47dc-acca-b68d4a725972,27,4:21,Taylor Hendricks makes two point driving dunk (Javon Small assists),twopointmade,24,d059bab2-9fb5-42dd-8038-5a12474300ce,basketball_play,1772404091,377,True,2026-03-01 22:28:11+00:00,1,261.0,459.0,7.65,71
4,47,quarter,1,d059bab2-9fb5-42dd-8038-5a12474300ce,27,4:01,Taelon Peter misses three point jump shot,threepointmiss,24,,basketball_play,1772404111,376,True,2026-03-01 22:28:31+00:00,1,241.0,479.0,7.983333333333333,72
4,46,quarter,1,1cfe70b8-4dfc-47dc-acca-b68d4a725972,27,3:59,Taylor Hendricks defensive rebound,rebound,24,1cfe70b8-4dfc-47dc-acca-b68d4a725972,basketball_play,1772404113,375,True,2026-03-01 22:28:33+00:00,1,239.0,481.0,8.016666666666667,73
4,45,quarter,1,1cfe70b8-4dfc-47dc-acca-b68d4a725972,27,3:49,Javon Small misses three point stepback jump shot,threepointmiss,24,,basketball_play,1772404123,374,True,2026-03-01 22:28:43+00:00,1,229.0,491.0,8.183333333333334,74
4,44,quarter,1,d059bab2-9fb5-42dd-8038-5a12474300ce,27,3:47,Pacers defensive rebound,rebound,24,d059bab2-9fb5-42dd-8038-5a12474300ce,basketball_play,1772404125,373,True,2026-03-01 22:28:45+00:00,1,227.0,493.0,8.216666666666667,75
4,43,quarter,1,,27,3:47,Stoppage (Out of bounds),stoppage,24,,basketball_play,1772404127,372,True,2026-03-01 22:28:47+00:00,1,227.0,493.0,8.216666666666667,76
4,42,quarter,1,d059bab2-9fb5-42dd-8038-5a12474300ce,27,3:47,"Pacers lineup change (Taelon Peter, Micah Potter, Quenton Jackson, Kobe Brown, T.J. McConnell)",lineupchange,24,,basketball_play,1772404160,371,True,2026-03-01 22:29:20+00:00,1,227.0,493.0,8.216666666666667,77
4,41,quarter,1,d059bab2-9fb5-42dd-8038-5a12474300ce,27,3:28,Micah Potter makes three point jump shot (T.J. McConnell assists),threepointmade,27,1cfe70b8-4dfc-47dc-acca-b68d4a725972,basketball_play,1772404160,370,True,2026-03-01 22:29:20+00:00,1,208.0,512.0,8.533333333333333,78
4,40,quarter,1,1cfe70b8-4dfc-47dc-acca-b68d4a725972,30,3:06,Taylor Hendricks makes three point jump shot (Javon Small assists),threepointmade,27,d059bab2-9fb5-42dd-8038-5a12474300ce,basketball_play,1772404182,369,True,2026-03-01 22:29:42+00:00,1,186.0,534.0,8.9,79
4,39,quarter,1,d059bab2-9fb5-42dd-8038-5a12474300ce,30,2:48,T.J. McConnell misses two point driving finger roll layup,twopointmiss,27,,basketball_play,1772404200,368,True,2026-03-01 22:30:00+00:00,1,168.0,552.0,9.2,80
4,38,quarter,1,d059bab2-9fb5-42dd-8038-5a12474300ce,30,2:47,Pacers offensive rebound,rebound,27,d059bab2-9fb5-42dd-8038-5a12474300ce,basketball_play,1772404201,367,True,2026-03-01 22:30:01+00:00,1,167.0,553.0,9.216666666666667,81
4,37,quarter,1,1cfe70b8-4dfc-47dc-acca-b68d4a725972,30,2:47,Javon Small personal foul (Loose ball) (Micah Potter draws the foul),personalfoul,27,d059bab2-9fb5-42dd-8038-5a12474300ce,basketball_play,1772404206,366,True,2026-03-01 22:30:06+00:00,1,167.0,553.0,9.216666666666667,82
4,36,quarter,1,1cfe70b8-4dfc-47dc-acca-b68d4a725972,30,2:47,"Grizzlies lineup change (Walter Clayton Jr., Cam Spencer, Jahmai Mashack, Taylor Hendricks, Rayan Rupert)",lineupchange,27,,basketball_play,1772404247,365,True,2026-03-01 22:30:47+00:00,1,167.0,553.0,9.216666666666667,83
4,35,quarter,1,d059bab2-9fb5-42dd-8038-5a12474300ce,30,2:40,Quenton Jackson misses three point stepback jump shot,threepointmiss,27,,basketball_play,1772404247,364,True,2026-03-01 22:30:47+00:00,1,160.0,560.0,9.333333333333334,84
4,34,quarter,1,1cfe70b8-4dfc-47dc-acca-b68d4a725972,30,2:38,Cam Spencer defensive rebound,rebound,27,1cfe70b8-4dfc-47dc-acca-b68d4a725972,basketball_play,1772404249,363,True,2026-03-01 22:30:49+00:00,1,158.0,562.0,9.366666666666667,85
4,33,quarter,1,1cfe70b8-4dfc-47dc-acca-b68d4a725972,30,2:27,Jahmai Mashack misses three point jump shot,threepointmiss,27,,basketball_play,1772404259,362,True,2026-03-01 22:30:59+00:00,1,147.0,573.0,9.55,86
4,32,quarter,1,d059bab2-9fb5-42dd-8038-5a12474300ce,30,2:25,Quenton Jackson defensive rebound,rebound,27,d059bab2-9fb5-42dd-8038-5a12474300ce,basketball_play,1772404261,361,True,2026-03-01 22:31:01+00:00,1,145.0,575.0,9.583333333333334,87
4,31,quarter,1,d059bab2-9fb5-42dd-8038-5a12474300ce,30,2:21,Jahmai Mashack blocks Quenton Jackson's two point running layup,twopointmiss,27,,basketball_play,1772404266,360,True,2026-03-01 22:31:06+00:00,1,141.0,579.0,9.65,88
4,30,quarter,1,1cfe70b8-4dfc-47dc-acca-b68d4a725972,30,2:18,Taylor Hendricks defensive rebound,rebound,27,1cfe70b8-4dfc-47dc-acca-b68d4a725972,basketball_play,1772404269,359,True,2026-03-01 22:31:09+00:00,1,138.0,582.0,9.7,89
4,29,quarter,1,,30,2:17,Stoppage (Out of bounds),stoppage,27,,basketball_play,1772404277,358,True,2026-03-01 22:31:17+00:00,1,137.0,583.0,9.716666666666667,90
4,28,quarter,1,1cfe70b8-4dfc-47dc-acca-b68d4a725972,30,2:07,Walter Clayton Jr. misses three point jump shot,threepointmiss,27,,basketball_play,1772404295,357,True,2026-03-01 22:31:35+00:00,1,127.0,593.0,9.883333333333333,91
4,27,quarter,1,d059bab2-9fb5-42dd-8038-5a12474300ce,30,2:02,Quenton Jackson defensive rebound,rebound,27,d059bab2-9fb5-42dd-8038-5a12474300ce,basketball_play,1772404300,356,True,2026-03-01 22:31:40+00:00,1,122.0,598.0,9.966666666666667,92
4,26,quarter,1,d059bab2-9fb5-42dd-8038-5a12474300ce,30,1:55,Micah Potter misses two point driving finger roll layup,twopointmiss,27,,basketball_play,1772404307,355,True,2026-03-01 22:31:47+00:00,1,115.0,605.0,10.083333333333334,93
4,25,quarter,1,1cfe70b8-4dfc-47dc-acca-b68d4a725972,30,1:53,Grizzlies defensive rebound,rebound,27,1cfe70b8-4dfc-47dc-acca-b68d4a725972,basketball_play,1772404309,354,True,2026-03-01 22:31:49+00:00,1,113.0,607.0,10.116666666666667,94
4,24,quarter,1,,30,1:53,Stoppage (Out of bounds),stoppage,27,,basketball_play,1772404312,353,True,2026-03-01 22:31:52+00:00,1,113.0,607.0,10.116666666666667,95
4,23,quarter,1,1cfe70b8-4dfc-47dc-acca-b68d4a725972,30,1:53,"Grizzlies lineup change (GG Jackson, Walter Clayton Jr., Cam Spencer, Taylor Hendricks, Rayan Rupert)",lineupchange,27,,basketball_play,1772404346,352,True,2026-03-01 22:32:26+00:00,1,113.0,607.0,10.116666666666667,96
4,22,quarter,1,1cfe70b8-4dfc-47dc-acca-b68d4a725972,32,1:36,GG Jackson makes two point driving layup (Cam Spencer assists),twopointmade,27,d059bab2-9fb5-42dd-8038-5a12474300ce,basketball_play,1772404346,351,True,2026-03-01 22:32:26+00:00,1,96.0,624.0,10.4,97
4,21,quarter,1,d059bab2-9fb5-42dd-8038-5a12474300ce,32,1:24,Kobe Brown makes three point jump shot (Quenton Jackson assists),threepointmade,30,1cfe70b8-4dfc-47dc-acca-b68d4a725972,basketball_play,1772404357,350,True,2026-03-01 22:32:37+00:00,1,84.0,636.0,10.6,98
4,20,quarter,1,d059bab2-9fb5-42dd-8038-5a12474300ce,32,1:15,Quenton Jackson personal foul (Take) (Cam Spencer draws the foul),personalfoul,30,1cfe70b8-4dfc-47dc-acca-b68d4a725972,basketball_play,1772404368,349,True,2026-03-01 22:32:48+00:00,1,75.0,645.0,10.75,99
4,19,quarter,1,d059bab2-9fb5-42dd-8038-5a12474300ce,32,1:15,"Pacers lineup change (Micah Potter, Obi Toppin, Quenton Jackson, Kobe Brown, T.J. McConnell)",lineupchange,30,,basketball_play,1772404395,348,True,2026-03-01 22:33:15+00:00,1,75.0,645.0,10.75,100
4,18,quarter,1,1cfe70b8-4dfc-47dc-acca-b68d4a725972,32,1:08,Cam Spencer misses three point pullup jump shot,threepointmiss,30,,basketball_play,1772404395,347,True,2026-03-01 22:33:15+00:00,1,68.0,652.0,10.866666666666667,101
4,17,quarter,1,d059bab2-9fb5-42dd-8038-5a12474300ce,32,1:04,Obi Toppin defensive rebound,rebound,30,d059bab2-9fb5-42dd-8038-5a12474300ce,basketball_play,1772404399,346,True,2026-03-01 22:33:19+00:00,1,64.0,656.0,10.933333333333334,102
4,16,quarter,1,d059bab2-9fb5-42dd-8038-5a12474300ce,32,00:59.90,T.J. McConnell makes two point running finger roll layup,twopointmade,32,1cfe70b8-4dfc-47dc-acca-b68d4a725972,basketball_play,1772404403,345,True,2026-03-01 22:33:23+00:00,1,59.9,660.1,11.001666666666667,103
4,15,quarter,1,1cfe70b8-4dfc-47dc-acca-b68d4a725972,32,00:49.40,Taylor Hendricks misses three point jump shot,threepointmiss,32,,basketball_play,1772404416,344,True,2026-03-01 22:33:36+00:00,1,49.4,670.6,11.176666666666668,104
4,14,quarter,1,d059bab2-9fb5-42dd-8038-5a12474300ce,32,00:46.40,Obi Toppin defensive rebound,rebound,32,d059bab2-9fb5-42dd-8038-5a12474300ce,basketball_play,1772404419,343,True,2026-03-01 22:33:39+00:00,1,46.4,673.6,11.226666666666667,105
