period_index,event_index,period_type,period_number,attribution,away_points,clock,description,event_type,home_points,possession,type,wall_clock,pbp_source_row,has_wall_clock,event_ts_utc,period_sequence,game_clock_seconds_remaining,game_elapsed_seconds,game_elapsed_minutes,pbp_chronological_index
4,13,quarter,1,1cfe70b8-4dfc-47dc-acca-b68d4a725972,32,00:33.10,Walter Clayton Jr. shooting foul (Kobe Brown draws the foul),shootingfoul,32,d059bab2-9fb5-42dd-8038-5a12474300ce,basketball_play,1772404434,342,True,2026-03-01 22:33:54+00:00,1,33.1,686.9,11.448333333333332,106
4,12,quarter,1,d059bab2-9fb5-42dd-8038-5a12474300ce,32,00:33.10,Kobe Brown makes regular free throw 1 of 2,freethrowmade,33,d059bab2-9fb5-42dd-8038-5a12474300ce,basketball_play,1772404458,341,True,2026-03-01 22:34:18+00:00,1,33.1,686.9,11.448333333333332,107
4,11,quarter,1,d059bab2-9fb5-42dd-8038-5a12474300ce,32,00:33.10,Kobe Brown makes regular free throw 2 of 2,freethrowmade,34,1cfe70b8-4dfc-47dc-acca-b68d4a725972,basketball_play,1772404473,340,True,2026-03-01 22:34:33+00:00,1,33.1,686.9,11.448333333333332,108
4,10,quarter,1,d059bab2-9fb5-42dd-8038-5a12474300ce,32,00:28.70,Kobe Brown shooting foul (Walter Clayton Jr. draws the foul),shootingfoul,34,1cfe70b8-4dfc-47dc-acca-b68d4a725972,basketball_play,1772404483,339,True,2026-03-01 22:34:43+00:00,1,28.7,691.3,11.521666666666667,109
4,9,quarter,1,1cfe70b8-4dfc-47dc-acca-b68d4a725972,33,00:28.70,Walter Clayton Jr. makes regular free throw 1 of 2,freethrowmade,34,1cfe70b8-4dfc-47dc-acca-b68d4a725972,basketball_play,1772404505,338,True,2026-03-01 22:35:05+00:00,1,28.7,691.3,11.521666666666667,110
4,8,quarter,1,d059bab2-9fb5-42dd-8038-5a12474300ce,33,00:28.70,"Pacers lineup change (Taelon Peter, Jay Huff, Obi Toppin, Kobe Brown, T.J. McConnell)",lineupchange,34,,basketball_play,1772404506,337,True,2026-03-01 22:35:06+00:00,1,28.7,691.3,11.521666666666667,111
4,7,quarter,1,1cfe70b8-4dfc-47dc-acca-b68d4a725972,34,00:28.70,Walter Clayton Jr. makes regular free throw 2 of 2,freethrowmade,34,d059bab2-9fb5-42dd-8038-5a12474300ce,basketball_play,1772404530,336,True,2026-03-01 22:35:30+00:00,1,28.7,691.3,11.521666666666667,112
4,6,quarter,1,d059bab2-9fb5-42dd-8038-5a12474300ce,34,00:10.30,Obi Toppin misses three point pullup jump shot,threepointmiss,34,,basketball_play,1772404551,335,True,2026-03-01 22:35:51+00:00,1,10.3,709.7,11.828333333333335,113
4,5,quarter,1,1cfe70b8-4dfc-47dc-acca-b68d4a725972,34,00:07,GG Jackson defensive rebound,rebound,34,1cfe70b8-4dfc-47dc-acca-b68d4a725972,basketball_play,1772404554,334,True,2026-03-01 22:35:54+00:00,1,7.0,713.0,11.883333333333333,114
4,4,quarter,1,1cfe70b8-4dfc-47dc-acca-b68d4a725972,34,00:02.70,Rayan Rupert turnover (lost ball) (Obi Toppin steals),turnover,34,d059bab2-9fb5-42dd-8038-5a12474300ce,basketball_play,1772404558,333,True,2026-03-01 22:35:58+00:00,1,2.7,717.3,11.955,115
4,3,quarter,1,d059bab2-9fb5-42dd-8038-5a12474300ce,34,00:00.30,Kobe Brown misses two point running pullup jump shot,twopointmiss,34,,basketball_play,1772404561,332,True,2026-03-01 22:36:01+00:00,1,0.3,719.7,11.995000000000001,116
4,2,quarter,1,d059bab2-9fb5-42dd-8038-5a12474300ce,34,00:00.10,Pacers offensive rebound,rebound,34,d059bab2-9fb5-42dd-8038-5a12474300ce,basketball_play,1772404561,331,True,2026-03-01 22:36:01+00:00,1,0.1,719.9,11.998333333333333,117
4,1,quarter,1,,34,00:00,End of 1st Quarter.,endperiod,34,,basketball_play,1772404564,330,True,2026-03-01 22:36:04+00:00,1,0.0,720.0,12.0,118
3,118,quarter,2,1cfe70b8-4dfc-47dc-acca-b68d4a725972,34,12:00,"Grizzlies lineup change (GG Jackson, Olivier-Maxence Prosper, Walter Clayton Jr., Cam Spencer, Jaylen Wells)",lineupchange,34,,basketball_play,1772404689,329,True,2026-03-01 22:38:09+00:00,2,720.0,720.0,12.0,119
3,117,quarter,2,d059bab2-9fb5-42dd-8038-5a12474300ce,34,12:00,"Pacers lineup change (Taelon Peter, Jay Huff, Obi Toppin, Ben Sheppard, T.J. McConnell)",lineupchange,34,,basketball_play,1772404689,328,True,2026-03-01 22:38:09+00:00,2,720.0,720.0,12.0,120
3,116,quarter,2,,34,12:00,Start of 2nd Quarter,startperiod,34,,basketball_play,1772404727,327,True,2026-03-01 22:38:47+00:00,2,720.0,720.0,12.0,121
3,115,quarter,2,1cfe70b8-4dfc-47dc-acca-b68d4a725972,34,11:37,Walter Clayton Jr. misses two point floating jump shot,twopointmiss,34,,basketball_play,1772404749,326,True,2026-03-01 22:39:09+00:00,2,697.0,743.0,12.383333333333333,122
3,114,quarter,2,d059bab2-9fb5-42dd-8038-5a12474300ce,34,11:35,Jay Huff defensive rebound,rebound,34,d059bab2-9fb5-42dd-8038-5a12474300ce,basketball_play,1772404751,325,True,2026-03-01 22:39:11+00:00,2,695.0,745.0,12.416666666666666,123
3,113,quarter,2,d059bab2-9fb5-42dd-8038-5a12474300ce,34,11:25,Ben Sheppard makes three point jump shot (Obi Toppin assists),threepointmade,37,1cfe70b8-4dfc-47dc-acca-b68d4a725972,basketball_play,1772404761,324,True,2026-03-01 22:39:21+00:00,2,685.0,755.0,12.583333333333334,124
3,112,quarter,2,1cfe70b8-4dfc-47dc-acca-b68d4a725972,36,11:20,Jaylen Wells makes two point driving finger roll layup (Walter Clayton Jr. assists),twopointmade,37,d059bab2-9fb5-42dd-8038-5a12474300ce,basketball_play,1772404766,323,True,2026-03-01 22:39:26+00:00,2,680.0,760.0,12.666666666666666,125
3,111,quarter,2,d059bab2-9fb5-42dd-8038-5a12474300ce,36,10:59,T.J. McConnell makes two point pullup jump shot,twopointmade,39,1cfe70b8-4dfc-47dc-acca-b68d4a725972,basketball_play,1772404787,322,True,2026-03-01 22:39:47+00:00,2,659.0,781.0,13.016666666666667,126
3,110,quarter,2,1cfe70b8-4dfc-47dc-acca-b68d4a725972,38,10:40,Olivier-Maxence Prosper makes two point driving finger roll layup (Walter Clayton Jr. assists),twopointmade,39,d059bab2-9fb5-42dd-8038-5a12474300ce,basketball_play,1772404806,321,True,2026-03-01 22:40:06+00:00,2,640.0,800.0,13.333333333333334,127
3,109,quarter,2,d059bab2-9fb5-42dd-8038-5a12474300ce,38,10:23,Jay Huff makes three point jump shot (T.J. McConnell assists),threepointmade,42,1cfe70b8-4dfc-47dc-acca-b68d4a725972,basketball_play,1772404823,320,True,2026-03-01 22:40:23+00:00,2,623.0,817.0,13.616666666666667,128
3,108,quarter,2,1cfe70b8-4dfc-47dc-acca-b68d4a725972,38,10:04,Taelon Peter blocks GG Jackson's two point driving layup,twopointmiss,42,,basketball_play,1772404842,319,True,2026-03-01 22:40:42+00:00,2,604.0,836.0,13.933333333333334,129
3,107,quarter,2,1cfe70b8-4dfc-47dc-acca-b68d4a725972,38,10:01,GG Jackson offensive rebound,rebound,42,1cfe70b8-4dfc-47dc-acca-b68d4a725972,basketball_play,1772404845,318,True,2026-03-01 22:40:45+00:00,2,601.0,839.0,13.983333333333333,130
3,106,quarter,2,1cfe70b8-4dfc-47dc-acca-b68d4a725972,38,10:01,Jay Huff blocks GG Jackson's two point putback dunk,twopointmiss,42,,basketball_play,1772404845,317,True,2026-03-01 22:40:45+00:00,2,601.0,839.0,13.983333333333333,131
3,105,quarter,2,1cfe70b8-4dfc-47dc-acca-b68d4a725972,38,9:59,GG Jackson offensive rebound,rebound,42,1cfe70b8-4dfc-47dc-acca-b68d4a725972,basketball_play,1772404847,316,True,2026-03-01 22:40:47+00:00,2,599.0,841.0,14.016666666666667,132
3,104,quarter,2,1cfe70b8-4dfc-47dc-acca-b68d4a725972,40,9:57,Jaylen Wells makes two point driving floating jump shot (GG Jackson assists),twopointmade,42,d059bab2-9fb5-42dd-8038-5a12474300ce,basketball_play,1772404849,315,True,2026-03-01 22:40:49+00:00,2,597.0,843.0,14.05,133
3,103,quarter,2,d059bab2-9fb5-42dd-8038-5a12474300ce,40,9:41,Taelon Peter makes three point jump shot (Obi Toppin assists),threepointmade,45,1cfe70b8-4dfc-47dc-acca-b68d4a725972,basketball_play,1772404865,314,True,2026-03-01 22:41:05+00:00,2,581.0,859.0,14.316666666666666,134
3,102,quarter,2,1cfe70b8-4dfc-47dc-acca-b68d4a725972,43,9:23,Cam Spencer makes three point pullup jump shot (Olivier-Maxence Prosper assists),threepointmade,45,d059bab2-9fb5-42dd-8038-5a12474300ce,basketball_play,1772404883,313,True,2026-03-01 22:41:23+00:00,2,563.0,877.0,14.616666666666667,135
3,101,quarter,2,d059bab2-9fb5-42dd-8038-5a12474300ce,43,9:09,Taelon Peter misses three point jump shot,threepointmiss,45,,basketball_play,1772404896,312,True,2026-03-01 22:41:36+00:00,2,549.0,891.0,14.85,136
3,100,quarter,2,1cfe70b8-4dfc-47dc-acca-b68d4a725972,43,9:04,Walter Clayton Jr. defensive rebound,rebound,45,1cfe70b8-4dfc-47dc-acca-b68d4a725972,basketball_play,1772404901,311,True,2026-03-01 22:41:41+00:00,2,544.0,896.0,14.933333333333334,137
3,99,quarter,2,1cfe70b8-4dfc-47dc-acca-b68d4a725972,46,9:00,Cam Spencer makes three point running pullup jump shot (Walter Clayton Jr. assists),threepointmade,45,d059bab2-9fb5-42dd-8038-5a12474300ce,basketball_play,1772404906,310,True,2026-03-01 22:41:46+00:00,2,540.0,900.0,15.0,138
3,98,quarter,2,d059bab2-9fb5-42dd-8038-5a12474300ce,46,8:43,T.J. McConnell makes two point pullup jump shot,twopointmade,47,1cfe70b8-4dfc-47dc-acca-b68d4a725972,basketball_play,1772404923,309,True,2026-03-01 22:42:03+00:00,2,523.0,917.0,15.283333333333333,139
3,97,quarter,2,1cfe70b8-4dfc-47dc-acca-b68d4a725972,46,8:42,Grizzlies 60 second timeout,teamtimeout,47,,basketball_play,1772404928,308,True,2026-03-01 22:42:08+00:00,2,522.0,918.0,15.3,140
3,96,quarter,2,1cfe70b8-4dfc-47dc-acca-b68d4a725972,46,8:42,"Grizzlies lineup change (Scotty Pippen Jr., GG Jackson, Olivier-Maxence Prosper, Cam Spencer, Jaylen Wells)",lineupchange,47,,basketball_play,1772405032,307,True,2026-03-01 22:43:52+00:00,2,522.0,918.0,15.3,141
3,95,quarter,2,d059bab2-9fb5-42dd-8038-5a12474300ce,46,8:42,"Pacers lineup change (Jay Huff, Obi Toppin, Ben Sheppard, Quenton Jackson, Jarace Walker)",lineupchange,47,,basketball_play,1772405032,306,True,2026-03-01 22:43:52+00:00,2,522.0,918.0,15.3,142
3,94,quarter,2,1cfe70b8-4dfc-47dc-acca-b68d4a725972,48,8:26,GG Jackson makes two point cutting dunk (Cam Spencer assists),twopointmade,47,d059bab2-9fb5-42dd-8038-5a12474300ce,basketball_play,1772405120,305,True,2026-03-01 22:45:20+00:00,2,506.0,934.0,15.566666666666666,143
3,93,quarter,2,d059bab2-9fb5-42dd-8038-5a12474300ce,48,8:10,Jay Huff turnover (bad pass) (Jaylen Wells steals),turnover,47,1cfe70b8-4dfc-47dc-acca-b68d4a725972,basketball_play,1772405136,304,True,2026-03-01 22:45:36+00:00,2,490.0,950.0,15.833333333333334,144
3,92,quarter,2,1cfe70b8-4dfc-47dc-acca-b68d4a725972,48,7:57,Scotty Pippen Jr. misses two point driving finger roll layup,twopointmiss,47,,basketball_play,1772405148,303,True,2026-03-01 22:45:48+00:00,2,477.0,963.0,16.05,145
3,91,quarter,2,d059bab2-9fb5-42dd-8038-5a12474300ce,48,7:55,Quenton Jackson defensive rebound,rebound,47,d059bab2-9fb5-42dd-8038-5a12474300ce,basketball_play,1772405150,302,True,2026-03-01 22:45:50+00:00,2,475.0,965.0,16.083333333333332,146
3,90,quarter,2,d059bab2-9fb5-42dd-8038-5a12474300ce,48,7:44,Jay Huff turnover (lost ball) (Jaylen Wells steals),turnover,47,1cfe70b8-4dfc-47dc-acca-b68d4a725972,basketball_play,1772405162,301,True,2026-03-01 22:46:02+00:00,2,464.0,976.0,16.266666666666666,147
3,89,quarter,2,1cfe70b8-4dfc-47dc-acca-b68d4a725972,48,7:37,GG Jackson misses three point jump shot,threepointmiss,47,,basketball_play,1772405169,300,True,2026-03-01 22:46:09+00:00,2,457.0,983.0,16.383333333333333,148
3,88,quarter,2,d059bab2-9fb5-42dd-8038-5a12474300ce,48,7:35,Ben Sheppard defensive rebound,rebound,47,d059bab2-9fb5-42dd-8038-5a12474300ce,basketball_play,1772405171,299,True,2026-03-01 22:46:11+00:00,2,455.0,985.0,16.416666666666668,149
3,87,quarter,2,d059bab2-9fb5-42dd-8038-5a12474300ce,48,7:24,Ben Sheppard makes three point jump shot (Quenton Jackson assists),threepointmade,50,1cfe70b8-4dfc-47dc-acca-b68d4a725972,basketball_play,1772405182,298,True,2026-03-01 22:46:22+00:00,2,444.0,996.0,16.6,150
3,86,quarter,2,d059bab2-9fb5-42dd-8038-5a12474300ce,48,7:16,Quenton Jackson personal foul (Take) (Scotty Pippen Jr. draws the foul),personalfoul,50,1cfe70b8-4dfc-47dc-acca-b68d4a725972,basketball_play,1772405191,297,True,2026-03-01 22:46:31+00:00,2,436.0,1004.0,16.733333333333334,151
3,85,quarter,2,1cfe70b8-4dfc-47dc-acca-b68d4a725972,48,7:16,"Grizzlies lineup change (Scotty Pippen Jr., GG Jackson, Jaylen Wells, Taylor Hendricks, Rayan Rupert)",lineupchange,50,,basketball_play,1772405196,296,True,2026-03-01 22:46:36+00:00,2,436.0,1004.0,16.733333333333334,152
3,84,quarter,2,d059bab2-9fb5-42dd-8038-5a12474300ce,48,7:16,"Pacers lineup change (Jay Huff, Ben Sheppard, Quenton Jackson, Kobe Brown, Jarace Walker)",lineupchange,50,,basketball_play,1772405196,295,True,2026-03-01 22:46:36+00:00,2,436.0,1004.0,16.733333333333334,153
3,83,quarter,2,1cfe70b8-4dfc-47dc-acca-b68d4a725972,48,7:14,Taylor Hendricks offensive foul (Quenton Jackson draws the foul),offensivefoul,50,d059bab2-9fb5-42dd-8038-5a12474300ce,basketball_play,1772405223,294,True,2026-03-01 22:47:03+00:00,2,434.0,1006.0,16.766666666666666,154
3,82,quarter,2,1cfe70b8-4dfc-47dc-acca-b68d4a725972,48,7:14,Taylor Hendricks turnover (offensive foul),turnover,50,d059bab2-9fb5-42dd-8038-5a12474300ce,basketball_play,1772405223,293,True,2026-03-01 22:47:03+00:00,2,434.0,1006.0,16.766666666666666,155
3,81,quarter,2,d059bab2-9fb5-42dd-8038-5a12474300ce,48,7:02,Ben Sheppard misses three point jump shot,threepointmiss,50,,basketball_play,1772405252,292,True,2026-03-01 22:47:32+00:00,2,422.0,1018.0,16.966666666666665,156
3,80,quarter,2,1cfe70b8-4dfc-47dc-acca-b68d4a725972,48,6:59,GG Jackson defensive rebound,rebound,50,1cfe70b8-4dfc-47dc-acca-b68d4a725972,basketball_play,1772405255,291,True,2026-03-01 22:47:35+00:00,2,419.0,1021.0,17.016666666666666,157
3,79,quarter,2,1cfe70b8-4dfc-47dc-acca-b68d4a725972,50,6:55,GG Jackson makes two point running finger roll layup,twopointmade,50,d059bab2-9fb5-42dd-8038-5a12474300ce,basketball_play,1772405259,290,True,2026-03-01 22:47:39+00:00,2,415.0,1025.0,17.083333333333332,158
3,78,quarter,2,d059bab2-9fb5-42dd-8038-5a12474300ce,50,6:47,GG Jackson blocks Kobe Brown's two point driving layup,twopointmiss,50,,basketball_play,1772405268,289,True,2026-03-01 22:47:48+00:00,2,407.0,1033.0,17.216666666666665,159
3,77,quarter,2,d059bab2-9fb5-42dd-8038-5a12474300ce,50,6:46,Pacers offensive rebound,rebound,50,d059bab2-9fb5-42dd-8038-5a12474300ce,basketball_play,1772405269,288,True,2026-03-01 22:47:49+00:00,2,406.0,1034.0,17.233333333333334,160
3,76,quarter,2,,50,6:46,Stoppage (Out of bounds),stoppage,50,,basketball_play,1772405272,287,True,2026-03-01 22:47:52+00:00,2,406.0,1034.0,17.233333333333334,161
3,75,quarter,2,d059bab2-9fb5-42dd-8038-5a12474300ce,50,6:39,Quenton Jackson makes two point driving dunk (Kobe Brown assists),twopointmade,52,1cfe70b8-4dfc-47dc-acca-b68d4a725972,basketball_play,1772405298,286,True,2026-03-01 22:48:18+00:00,2,399.0,1041.0,17.35,162
3,74,quarter,2,1cfe70b8-4dfc-47dc-acca-b68d4a725972,50,6:39,Taylor Hendricks shooting foul (Quenton Jackson draws the foul),shootingfoul,52,d059bab2-9fb5-42dd-8038-5a12474300ce,basketball_play,1772405302,285,True,2026-03-01 22:48:22+00:00,2,399.0,1041.0,17.35,163
3,73,quarter,2,d059bab2-9fb5-42dd-8038-5a12474300ce,50,6:39,"Pacers lineup change (Taelon Peter, Jay Huff, Quenton Jackson, Kobe Brown, Jarace Walker)",lineupchange,52,,basketball_play,1772405331,284,True,2026-03-01 22:48:51+00:00,2,399.0,1041.0,17.35,164
3,72,quarter,2,d059bab2-9fb5-42dd-8038-5a12474300ce,50,6:39,Quenton Jackson misses regular free throw 1 of 1,freethrowmiss,52,,basketball_play,1772405331,283,True,2026-03-01 22:48:51+00:00,2,399.0,1041.0,17.35,165
3,71,quarter,2,1cfe70b8-4dfc-47dc-acca-b68d4a725972,50,6:38,GG Jackson defensive rebound,rebound,52,1cfe70b8-4dfc-47dc-acca-b68d4a725972,basketball_play,1772405332,282,True,2026-03-01 22:48:52+00:00,2,398.0,1042.0,17.366666666666667,166
3,70,quarter,2,1cfe70b8-4dfc-47dc-acca-b68d4a725972,52,6:25,Jaylen Wells makes two point jump shot (Scotty Pippen Jr. assists),twopointmade,52,d059bab2-9fb5-42dd-8038-5a12474300ce,basketball_play,1772405344,281,True,2026-03-01 22:49:04+00:00,2,385.0,1055.0,17.583333333333332,167
3,69,quarter,2,d059bab2-9fb5-42dd-8038-5a12474300ce,52,6:03,Taelon Peter misses three point jump shot,threepointmiss,52,,basketball_play,1772405366,280,True,2026-03-01 22:49:26+00:00,2,363.0,1077.0,17.95,168
3,68,quarter,2,1cfe70b8-4dfc-47dc-acca-b68d4a725972,52,6:01,Taylor Hendricks defensive rebound,rebound,52,1cfe70b8-4dfc-47dc-acca-b68d4a725972,basketball_play,1772405368,279,True,2026-03-01 22:49:28+00:00,2,361.0,1079.0,17.983333333333334,169
3,67,quarter,2,1cfe70b8-4dfc-47dc-acca-b68d4a725972,52,5:55,Scotty Pippen Jr. misses three point running pullup jump shot,threepointmiss,52,,basketball_play,1772405374,278,True,2026-03-01 22:49:34+00:00,2,355.0,1085.0,18.083333333333332,170
3,66,quarter,2,1cfe70b8-4dfc-47dc-acca-b68d4a725972,52,5:53,GG Jackson offensive rebound,rebound,52,1cfe70b8-4dfc-47dc-acca-b68d4a725972,basketball_play,1772405377,277,True,2026-03-01 22:49:37+00:00,2,353.0,1087.0,18.116666666666667,171
3,65,quarter,2,1cfe70b8-4dfc-47dc-acca-b68d4a725972,52,5:46,Scotty Pippen Jr. misses two point driving layup,twopointmiss,52,,basketball_play,1772405386,276,True,2026-03-01 22:49:46+00:00,2,346.0,1094.0,18.233333333333334,172
3,64,quarter,2,1cfe70b8-4dfc-47dc-acca-b68d4a725972,52,5:45,Scotty Pippen Jr. offensive rebound,rebound,52,1cfe70b8-4dfc-47dc-acca-b68d4a725972,basketball_play,1772405387,275,True,2026-03-01 22:49:47+00:00,2,345.0,1095.0,18.25,173
3,63,quarter,2,1cfe70b8-4dfc-47dc-acca-b68d4a725972,52,5:44,Scotty Pippen Jr. misses two point tip layup,twopointmiss,52,,basketball_play,1772405389,274,True,2026-03-01 22:49:49+00:00,2,344.0,1096.0,18.266666666666666,174
3,62,quarter,2,1cfe70b8-4dfc-47dc-acca-b68d4a725972,52,5:43,Scotty Pippen Jr. offensive rebound,rebound,52,1cfe70b8-4dfc-47dc-acca-b68d4a725972,basketball_play,1772405390,273,True,2026-03-01 22:49:50+00:00,2,343.0,1097.0,18.283333333333335,175
3,61,quarter,2,1cfe70b8-4dfc-47dc-acca-b68d4a725972,52,5:42,Quenton Jackson blocks Scotty Pippen Jr.'s two point putback layup,twopointmiss,52,,basketball_play,1772405392,272,True,2026-03-01 22:49:52+00:00,2,342.0,1098.0,18.3,176
3,60,quarter,2,1cfe70b8-4dfc-47dc-acca-b68d4a725972,52,5:41,Jaylen Wells offensive rebound,rebound,52,1cfe70b8-4dfc-47dc-acca-b68d4a725972,basketball_play,1772405393,271,True,2026-03-01 22:49:53+00:00,2,341.0,1099.0,18.316666666666666,177
3,59,quarter,2,1cfe70b8-4dfc-47dc-acca-b68d4a725972,52,5:34,Rayan Rupert misses three point jump shot,threepointmiss,52,,basketball_play,1772405395,270,True,2026-03-01 22:49:55+00:00,2,334.0,1106.0,18.433333333333334,178
3,58,quarter,2,d059bab2-9fb5-42dd-8038-5a12474300ce,52,5:32,Pacers defensive rebound,rebound,52,d059bab2-9fb5-42dd-8038-5a12474300ce,basketball_play,1772405397,269,True,2026-03-01 22:49:57+00:00,2,332.0,1108.0,18.466666666666665,179
3,57,quarter,2,1cfe70b8-4dfc-47dc-acca-b68d4a725972,52,5:32,Jaylen Wells personal foul (Loose ball) (Kobe Brown draws the foul),personalfoul,52,d059bab2-9fb5-42dd-8038-5a12474300ce,basketball_play,1772405401,268,True,2026-03-01 22:50:01+00:00,2,332.0,1108.0,18.466666666666665,180
3,56,quarter,2,d059bab2-9fb5-42dd-8038-5a12474300ce,52,5:32,Pacers 60 second timeout,teamtimeout,52,,basketball_play,1772405417,267,True,2026-03-01 22:50:17+00:00,2,332.0,1108.0,18.466666666666665,181
3,55,quarter,2,,52,5:32,Instant replay (Challenge: Ruling Overturned),review,52,,basketball_play,1772405420,266,True,2026-03-01 22:50:20+00:00,2,332.0,1108.0,18.466666666666665,182
3,54,quarter,2,1cfe70b8-4dfc-47dc-acca-b68d4a725972,52,5:32,"Grizzlies lineup change (Scotty Pippen Jr., Walter Clayton Jr., Javon Small, Taylor Hendricks, Rayan Rupert)",lineupchange,52,,basketball_play,1772405573,265,True,2026-03-01 22:52:53+00:00,2,332.0,1108.0,18.466666666666665,183
3,53,quarter,2,d059bab2-9fb5-42dd-8038-5a12474300ce,52,5:32,"Pacers lineup change (Taelon Peter, Micah Potter, Kam Jones, Kobe Brown, Jarace Walker)",lineupchange,52,,basketball_play,1772405573,264,True,2026-03-01 22:52:53+00:00,2,332.0,1108.0,18.466666666666665,184
3,52,quarter,2,d059bab2-9fb5-42dd-8038-5a12474300ce,52,5:16,Kam Jones makes two point driving floating bank jump shot,twopointmade,54,1cfe70b8-4dfc-47dc-acca-b68d4a725972,basketball_play,1772405631,263,True,2026-03-01 22:53:51+00:00,2,316.0,1124.0,18.733333333333334,185
3,51,quarter,2,1cfe70b8-4dfc-47dc-acca-b68d4a725972,54,4:58,Scotty Pippen Jr. makes two point pullup jump shot,twopointmade,54,d059bab2-9fb5-42dd-8038-5a12474300ce,basketball_play,1772405648,262,True,2026-03-01 22:54:08+00:00,2,298.0,1142.0,19.033333333333335,186
3,50,quarter,2,d059bab2-9fb5-42dd-8038-5a12474300ce,54,4:48,Walter Clayton Jr. blocks Jarace Walker's two point driving floating jump shot,twopointmiss,54,,basketball_play,1772405658,261,True,2026-03-01 22:54:18+00:00,2,288.0,1152.0,19.2,187
3,49,quarter,2,1cfe70b8-4dfc-47dc-acca-b68d4a725972,54,4:47,Javon Small defensive rebound,rebound,54,1cfe70b8-4dfc-47dc-acca-b68d4a725972,basketball_play,1772405659,260,True,2026-03-01 22:54:19+00:00,2,287.0,1153.0,19.216666666666665,188
3,48,quarter,2,1cfe70b8-4dfc-47dc-acca-b68d4a725972,54,4:40,Javon Small misses three point jump shot,threepointmiss,54,,basketball_play,1772405667,259,True,2026-03-01 22:54:27+00:00,2,280.0,1160.0,19.333333333333332,189
3,47,quarter,2,d059bab2-9fb5-42dd-8038-5a12474300ce,54,4:38,Micah Potter defensive rebound,rebound,54,d059bab2-9fb5-42dd-8038-5a12474300ce,basketball_play,1772405669,258,True,2026-03-01 22:54:29+00:00,2,278.0,1162.0,19.366666666666667,190
3,46,quarter,2,d059bab2-9fb5-42dd-8038-5a12474300ce,54,4:27,Jarace Walker turnover (lost ball) (Walter Clayton Jr. steals),turnover,54,1cfe70b8-4dfc-47dc-acca-b68d4a725972,basketball_play,1772405680,257,True,2026-03-01 22:54:40+00:00,2,267.0,1173.0,19.55,191
3,45,quarter,2,1cfe70b8-4dfc-47dc-acca-b68d4a725972,54,4:23,Kobe Brown blocks Scotty Pippen Jr.'s two point running layup,twopointmiss,54,,basketball_play,1772405684,256,True,2026-03-01 22:54:44+00:00,2,263.0,1177.0,19.616666666666667,192
3,44,quarter,2,d059bab2-9fb5-42dd-8038-5a12474300ce,54,4:21,Pacers defensive rebound,rebound,54,d059bab2-9fb5-42dd-8038-5a12474300ce,basketball_play,1772405686,255,True,2026-03-01 22:54:46+00:00,2,261.0,1179.0,19.65,193
3,43,quarter,2,,54,4:21,Stoppage (Out of bounds),stoppage,54,,basketball_play,1772405689,254,True,2026-03-01 22:54:49+00:00,2,261.0,1179.0,19.65,194
3,42,quarter,2,d059bab2-9fb5-42dd-8038-5a12474300ce,54,4:08,Kam Jones makes two point driving finger roll layup,twopointmade,56,1cfe70b8-4dfc-47dc-acca-b68d4a725972,basketball_play,1772405714,253,True,2026-03-01 22:55:14+00:00,2,248.0,1192.0,19.866666666666667,195
3,41,quarter,2,1cfe70b8-4dfc-47dc-acca-b68d4a725972,56,3:53,Scotty Pippen Jr. makes two point driving floating jump shot,twopointmade,56,d059bab2-9fb5-42dd-8038-5a12474300ce,basketball_play,1772405733,252,True,2026-03-01 22:55:33+00:00,2,233.0,1207.0,20.116666666666667,196
3,40,quarter,2,d059bab2-9fb5-42dd-8038-5a12474300ce,56,3:53,Micah Potter shooting foul (Scotty Pippen Jr. draws the foul),shootingfoul,56,1cfe70b8-4dfc-47dc-acca-b68d4a725972,basketball_play,1772405734,251,True,2026-03-01 22:55:34+00:00,2,233.0,1207.0,20.116666666666667,197
3,39,quarter,2,1cfe70b8-4dfc-47dc-acca-b68d4a725972,57,3:53,Scotty Pippen Jr. makes regular free throw 1 of 1,freethrowmade,56,,basketball_play,1772405760,250,True,2026-03-01 22:56:00+00:00,2,233.0,1207.0,20.116666666666667,198
3,38,quarter,2,d059bab2-9fb5-42dd-8038-5a12474300ce,57,3:41,Taelon Peter turnover (bad pass) (Javon Small steals),turnover,56,1cfe70b8-4dfc-47dc-acca-b68d4a725972,basketball_play,1772405774,249,True,2026-03-01 22:56:14+00:00,2,221.0,1219.0,20.316666666666666,199
3,37,quarter,2,1cfe70b8-4dfc-47dc-acca-b68d4a725972,60,3:28,Taylor Hendricks makes three point jump shot (Scotty Pippen Jr. assists),threepointmade,56,d059bab2-9fb5-42dd-8038-5a12474300ce,basketball_play,1772405788,248,True,2026-03-01 22:56:28+00:00,2,208.0,1232.0,20.533333333333335,200
3,36,quarter,2,d059bab2-9fb5-42dd-8038-5a12474300ce,60,3:08,Kobe Brown turnover (out of bounds lost ball),turnover,56,1cfe70b8-4dfc-47dc-acca-b68d4a725972,basketball_play,1772405811,247,True,2026-03-01 22:56:51+00:00,2,188.0,1252.0,20.866666666666667,201
3,35,quarter,2,1cfe70b8-4dfc-47dc-acca-b68d4a725972,60,3:08,"Grizzlies lineup change (Walter Clayton Jr., Javon Small, Jahmai Mashack, Taylor Hendricks, Rayan Rupert)",lineupchange,56,,basketball_play,1772405845,246,True,2026-03-01 22:57:25+00:00,2,188.0,1252.0,20.866666666666667,202
3,34,quarter,2,1cfe70b8-4dfc-47dc-acca-b68d4a725972,60,2:56,Jahmai Mashack turnover (traveling),turnover,56,d059bab2-9fb5-42dd-8038-5a12474300ce,basketball_play,1772405845,245,True,2026-03-01 22:57:25+00:00,2,176.0,1264.0,21.066666666666666,203
3,33,quarter,2,d059bab2-9fb5-42dd-8038-5a12474300ce,60,2:47,Jarace Walker misses three point jump shot,threepointmiss,56,,basketball_play,1772405865,244,True,2026-03-01 22:57:45+00:00,2,167.0,1273.0,21.216666666666665,204
3,32,quarter,2,d059bab2-9fb5-42dd-8038-5a12474300ce,60,2:44,Kobe Brown offensive rebound,rebound,56,d059bab2-9fb5-42dd-8038-5a12474300ce,basketball_play,1772405869,243,True,2026-03-01 22:57:49+00:00,2,164.0,1276.0,21.266666666666666,205
3,31,quarter,2,1cfe70b8-4dfc-47dc-acca-b68d4a725972,60,2:37,Rayan Rupert shooting foul (Jarace Walker draws the foul),shootingfoul,56,d059bab2-9fb5-42dd-8038-5a12474300ce,basketball_play,1772405878,242,True,2026-03-01 22:57:58+00:00,2,157.0,1283.0,21.383333333333333,206
3,30,quarter,2,d059bab2-9fb5-42dd-8038-5a12474300ce,60,2:37,Jarace Walker misses regular free throw 1 of 2,freethrowmiss,56,d059bab2-9fb5-42dd-8038-5a12474300ce,basketball_play,1772405909,241,True,2026-03-01 22:58:29+00:00,2,157.0,1283.0,21.383333333333333,207
3,29,quarter,2,d059bab2-9fb5-42dd-8038-5a12474300ce,60,2:37,Pacers offensive rebound,rebound,56,d059bab2-9fb5-42dd-8038-5a12474300ce,basketball_play,1772405909,240,True,2026-03-01 22:58:29+00:00,2,157.0,1283.0,21.383333333333333,208
3,28,quarter,2,d059bab2-9fb5-42dd-8038-5a12474300ce,60,2:37,Jarace Walker makes regular free throw 2 of 2,freethrowmade,57,1cfe70b8-4dfc-47dc-acca-b68d4a725972,basketball_play,1772405925,239,True,2026-03-01 22:58:45+00:00,2,157.0,1283.0,21.383333333333333,209
