period_index,event_index,period_type,period_number,attribution,away_points,clock,description,event_type,home_points,possession,type,wall_clock,pbp_source_row,has_wall_clock,event_ts_utc,period_sequence,game_clock_seconds_remaining,game_elapsed_seconds,game_elapsed_minutes,pbp_chronological_index
4,137,quarter,1,65569528-1888-40aa-9d62-2b0e8142a9b4,0,12:00,"Pistons lineup change (Tobias Harris, Ausar Thompson, Jalen Duren, Cade Cunningham, Duncan Robinson)",lineupchange,0,,basketball_play,1772759444,502,True,2026-03-06 01:10:44+00:00,1,720.0,0.0,0.0,1
4,136,quarter,1,ad36c3e8-4194-4e63-920f-7c50f46191a6,0,12:00,"Spurs lineup change (Devin Vassell, De'Aaron Fox, Julian Champagnie, Stephon Castle, Victor Wembanyama)",lineupchange,0,,basketball_play,1772759444,501,True,2026-03-06 01:10:44+00:00,1,720.0,0.0,0.0,2
4,135,quarter,1,,0,12:00,Start of 1st Quarter,startperiod,0,,basketball_play,1772759444,500,True,2026-03-06 01:10:44+00:00,1,720.0,0.0,0.0,3
4,134,quarter,1,ad36c3e8-4194-4e63-920f-7c50f46191a6,0,12:00,Jalen Duren vs. Victor Wembanyama (Julian Champagnie gains possession),opentip,0,ad36c3e8-4194-4e63-920f-7c50f46191a6,basketball_play,1772759447,499,True,2026-03-06 01:10:47+00:00,1,720.0,0.0,0.0,4
4,133,quarter,1,ad36c3e8-4194-4e63-920f-7c50f46191a6,0,11:35,Ausar Thompson blocks Victor Wembanyama's two point driving layup,twopointmiss,0,,basketball_play,1772759470,498,True,2026-03-06 01:11:10+00:00,1,695.0,25.0,0.4166666666666667,5
4,132,quarter,1,ad36c3e8-4194-4e63-920f-7c50f46191a6,0,11:35,Spurs offensive rebound,rebound,0,ad36c3e8-4194-4e63-920f-7c50f46191a6,basketball_play,1772759470,497,True,2026-03-06 01:11:10+00:00,1,695.0,25.0,0.4166666666666667,6
4,131,quarter,1,,0,11:35,Stoppage (Out of bounds),stoppage,0,,basketball_play,1772759479,496,True,2026-03-06 01:11:19+00:00,1,695.0,25.0,0.4166666666666667,7
4,130,quarter,1,ad36c3e8-4194-4e63-920f-7c50f46191a6,0,11:31,Victor Wembanyama makes three point jump shot (Stephon Castle assists),threepointmade,3,65569528-1888-40aa-9d62-2b0e8142a9b4,basketball_play,1772759488,495,True,2026-03-06 01:11:28+00:00,1,691.0,29.0,0.48333333333333334,8
4,129,quarter,1,65569528-1888-40aa-9d62-2b0e8142a9b4,0,11:09,Duncan Robinson misses three point jump shot,threepointmiss,3,,basketball_play,1772759510,494,True,2026-03-06 01:11:50+00:00,1,669.0,51.0,0.85,9
4,128,quarter,1,ad36c3e8-4194-4e63-920f-7c50f46191a6,0,11:06,Julian Champagnie defensive rebound,rebound,3,ad36c3e8-4194-4e63-920f-7c50f46191a6,basketball_play,1772759513,493,True,2026-03-06 01:11:53+00:00,1,666.0,54.0,0.9,10
4,127,quarter,1,ad36c3e8-4194-4e63-920f-7c50f46191a6,0,10:55,De'Aaron Fox makes two point pullup jump shot,twopointmade,5,65569528-1888-40aa-9d62-2b0e8142a9b4,basketball_play,1772759525,492,True,2026-03-06 01:12:05+00:00,1,655.0,65.0,1.0833333333333333,11
4,126,quarter,1,65569528-1888-40aa-9d62-2b0e8142a9b4,2,10:39,Jalen Duren makes two point driving layup (Cade Cunningham assists),twopointmade,5,ad36c3e8-4194-4e63-920f-7c50f46191a6,basketball_play,1772759541,491,True,2026-03-06 01:12:21+00:00,1,639.0,81.0,1.35,12
4,125,quarter,1,ad36c3e8-4194-4e63-920f-7c50f46191a6,2,10:25,Victor Wembanyama makes two point turnaround jump shot (Julian Champagnie assists),twopointmade,7,65569528-1888-40aa-9d62-2b0e8142a9b4,basketball_play,1772759554,490,True,2026-03-06 01:12:34+00:00,1,625.0,95.0,1.5833333333333333,13
4,124,quarter,1,65569528-1888-40aa-9d62-2b0e8142a9b4,2,10:08,Jalen Duren misses two point jump shot,twopointmiss,7,,basketball_play,1772759571,489,True,2026-03-06 01:12:51+00:00,1,608.0,112.0,1.8666666666666667,14
4,123,quarter,1,ad36c3e8-4194-4e63-920f-7c50f46191a6,2,10:06,Devin Vassell defensive rebound,rebound,7,ad36c3e8-4194-4e63-920f-7c50f46191a6,basketball_play,1772759573,488,True,2026-03-06 01:12:53+00:00,1,606.0,114.0,1.9,15
4,122,quarter,1,ad36c3e8-4194-4e63-920f-7c50f46191a6,2,9:57,Julian Champagnie misses three point jump shot,threepointmiss,7,,basketball_play,1772759583,487,True,2026-03-06 01:13:03+00:00,1,597.0,123.0,2.05,16
4,121,quarter,1,65569528-1888-40aa-9d62-2b0e8142a9b4,2,9:55,Jalen Duren defensive rebound,rebound,7,65569528-1888-40aa-9d62-2b0e8142a9b4,basketball_play,1772759585,486,True,2026-03-06 01:13:05+00:00,1,595.0,125.0,2.0833333333333335,17
4,120,quarter,1,65569528-1888-40aa-9d62-2b0e8142a9b4,2,9:54,Ausar Thompson turnover (out of bounds lost ball),turnover,7,ad36c3e8-4194-4e63-920f-7c50f46191a6,basketball_play,1772759590,485,True,2026-03-06 01:13:10+00:00,1,594.0,126.0,2.1,18
4,119,quarter,1,65569528-1888-40aa-9d62-2b0e8142a9b4,2,9:54,Pistons 60 second timeout,teamtimeout,7,,basketball_play,1772759610,484,True,2026-03-06 01:13:30+00:00,1,594.0,126.0,2.1,19
4,118,quarter,1,65569528-1888-40aa-9d62-2b0e8142a9b4,2,9:54,"Pistons lineup change (Tobias Harris, Jalen Duren, Cade Cunningham, Ronald Holland II, Duncan Robinson)",lineupchange,7,,basketball_play,1772759797,483,True,2026-03-06 01:16:37+00:00,1,594.0,126.0,2.1,20
4,117,quarter,1,ad36c3e8-4194-4e63-920f-7c50f46191a6,2,9:42,De'Aaron Fox makes three point jump shot (Stephon Castle assists),threepointmade,10,65569528-1888-40aa-9d62-2b0e8142a9b4,basketball_play,1772759797,482,True,2026-03-06 01:16:37+00:00,1,582.0,138.0,2.3,21
4,116,quarter,1,65569528-1888-40aa-9d62-2b0e8142a9b4,5,9:18,Duncan Robinson makes three point jump shot (Cade Cunningham assists),threepointmade,10,ad36c3e8-4194-4e63-920f-7c50f46191a6,basketball_play,1772759822,481,True,2026-03-06 01:17:02+00:00,1,558.0,162.0,2.7,22
4,115,quarter,1,ad36c3e8-4194-4e63-920f-7c50f46191a6,5,9:09,De'Aaron Fox makes two point driving layup (Stephon Castle assists),twopointmade,12,65569528-1888-40aa-9d62-2b0e8142a9b4,basketball_play,1772759831,480,True,2026-03-06 01:17:11+00:00,1,549.0,171.0,2.85,23
4,114,quarter,1,65569528-1888-40aa-9d62-2b0e8142a9b4,5,8:56,Cade Cunningham misses two point pullup jump shot,twopointmiss,12,,basketball_play,1772759844,479,True,2026-03-06 01:17:24+00:00,1,536.0,184.0,3.066666666666667,24
4,113,quarter,1,65569528-1888-40aa-9d62-2b0e8142a9b4,5,8:53,Ronald Holland II offensive rebound,rebound,12,65569528-1888-40aa-9d62-2b0e8142a9b4,basketball_play,1772759845,478,True,2026-03-06 01:17:25+00:00,1,533.0,187.0,3.1166666666666667,25
4,112,quarter,1,65569528-1888-40aa-9d62-2b0e8142a9b4,5,8:50,Cade Cunningham misses three point jump shot,threepointmiss,12,,basketball_play,1772759849,477,True,2026-03-06 01:17:29+00:00,1,530.0,190.0,3.1666666666666665,26
4,111,quarter,1,65569528-1888-40aa-9d62-2b0e8142a9b4,5,8:47,Ronald Holland II offensive rebound,rebound,12,65569528-1888-40aa-9d62-2b0e8142a9b4,basketball_play,1772759852,476,True,2026-03-06 01:17:32+00:00,1,527.0,193.0,3.216666666666667,27
4,110,quarter,1,65569528-1888-40aa-9d62-2b0e8142a9b4,7,8:47,Ronald Holland II makes two point tip layup,twopointmade,12,ad36c3e8-4194-4e63-920f-7c50f46191a6,basketball_play,1772759852,475,True,2026-03-06 01:17:32+00:00,1,527.0,193.0,3.216666666666667,28
4,109,quarter,1,ad36c3e8-4194-4e63-920f-7c50f46191a6,7,8:38,Devin Vassell makes three point jump shot (De'Aaron Fox assists),threepointmade,15,65569528-1888-40aa-9d62-2b0e8142a9b4,basketball_play,1772759861,474,True,2026-03-06 01:17:41+00:00,1,518.0,202.0,3.3666666666666667,29
4,108,quarter,1,65569528-1888-40aa-9d62-2b0e8142a9b4,9,8:24,Cade Cunningham makes two point pullup jump shot (Jalen Duren assists),twopointmade,15,ad36c3e8-4194-4e63-920f-7c50f46191a6,basketball_play,1772759875,473,True,2026-03-06 01:17:55+00:00,1,504.0,216.0,3.6,30
4,107,quarter,1,ad36c3e8-4194-4e63-920f-7c50f46191a6,9,8:14,Devin Vassell misses three point jump shot,threepointmiss,15,,basketball_play,1772759885,472,True,2026-03-06 01:18:05+00:00,1,494.0,226.0,3.7666666666666666,31
4,106,quarter,1,65569528-1888-40aa-9d62-2b0e8142a9b4,9,8:11,Jalen Duren defensive rebound,rebound,15,65569528-1888-40aa-9d62-2b0e8142a9b4,basketball_play,1772759888,471,True,2026-03-06 01:18:08+00:00,1,491.0,229.0,3.816666666666667,32
4,105,quarter,1,ad36c3e8-4194-4e63-920f-7c50f46191a6,9,8:08,Stephon Castle shooting foul (Tobias Harris draws the foul),shootingfoul,15,65569528-1888-40aa-9d62-2b0e8142a9b4,basketball_play,1772759894,470,True,2026-03-06 01:18:14+00:00,1,488.0,232.0,3.8666666666666667,33
4,104,quarter,1,65569528-1888-40aa-9d62-2b0e8142a9b4,10,8:08,Tobias Harris makes regular free throw 1 of 2,freethrowmade,15,65569528-1888-40aa-9d62-2b0e8142a9b4,basketball_play,1772759926,469,True,2026-03-06 01:18:46+00:00,1,488.0,232.0,3.8666666666666667,34
4,103,quarter,1,65569528-1888-40aa-9d62-2b0e8142a9b4,11,8:08,Tobias Harris makes regular free throw 2 of 2,freethrowmade,15,ad36c3e8-4194-4e63-920f-7c50f46191a6,basketball_play,1772759941,468,True,2026-03-06 01:19:01+00:00,1,488.0,232.0,3.8666666666666667,35
4,102,quarter,1,ad36c3e8-4194-4e63-920f-7c50f46191a6,11,7:55,Stephon Castle misses two point pullup bank jump shot,twopointmiss,15,,basketball_play,1772759955,467,True,2026-03-06 01:19:15+00:00,1,475.0,245.0,4.083333333333333,36
4,101,quarter,1,65569528-1888-40aa-9d62-2b0e8142a9b4,11,7:53,Jalen Duren defensive rebound,rebound,15,65569528-1888-40aa-9d62-2b0e8142a9b4,basketball_play,1772759957,466,True,2026-03-06 01:19:17+00:00,1,473.0,247.0,4.116666666666666,37
4,100,quarter,1,65569528-1888-40aa-9d62-2b0e8142a9b4,11,7:45,Victor Wembanyama blocks Cade Cunningham's two point driving layup,twopointmiss,15,,basketball_play,1772759964,465,True,2026-03-06 01:19:24+00:00,1,465.0,255.0,4.25,38
4,99,quarter,1,65569528-1888-40aa-9d62-2b0e8142a9b4,11,7:43,Jalen Duren offensive rebound,rebound,15,65569528-1888-40aa-9d62-2b0e8142a9b4,basketball_play,1772759966,464,True,2026-03-06 01:19:26+00:00,1,463.0,257.0,4.283333333333333,39
4,98,quarter,1,65569528-1888-40aa-9d62-2b0e8142a9b4,11,7:43,Jalen Duren misses two point putback layup,twopointmiss,15,,basketball_play,1772759969,463,True,2026-03-06 01:19:29+00:00,1,463.0,257.0,4.283333333333333,40
4,97,quarter,1,ad36c3e8-4194-4e63-920f-7c50f46191a6,11,7:42,Julian Champagnie defensive rebound,rebound,15,ad36c3e8-4194-4e63-920f-7c50f46191a6,basketball_play,1772759970,462,True,2026-03-06 01:19:30+00:00,1,462.0,258.0,4.3,41
4,96,quarter,1,,11,7:35,Stoppage (Out of bounds),stoppage,15,,basketball_play,1772759979,461,True,2026-03-06 01:19:39+00:00,1,455.0,265.0,4.416666666666667,42
4,95,quarter,1,ad36c3e8-4194-4e63-920f-7c50f46191a6,11,7:32,Devin Vassell turnover (out of bounds lost ball),turnover,15,65569528-1888-40aa-9d62-2b0e8142a9b4,basketball_play,1772759998,460,True,2026-03-06 01:19:58+00:00,1,452.0,268.0,4.466666666666667,43
4,94,quarter,1,,11,7:15,Stoppage (Out of bounds),stoppage,15,,basketball_play,1772760026,459,True,2026-03-06 01:20:26+00:00,1,435.0,285.0,4.75,44
4,93,quarter,1,65569528-1888-40aa-9d62-2b0e8142a9b4,11,7:12,Duncan Robinson misses three point pullup jump shot,threepointmiss,15,,basketball_play,1772760039,458,True,2026-03-06 01:20:39+00:00,1,432.0,288.0,4.8,45
4,92,quarter,1,ad36c3e8-4194-4e63-920f-7c50f46191a6,11,7:10,Victor Wembanyama defensive rebound,rebound,15,ad36c3e8-4194-4e63-920f-7c50f46191a6,basketball_play,1772760041,457,True,2026-03-06 01:20:41+00:00,1,430.0,290.0,4.833333333333333,46
4,91,quarter,1,65569528-1888-40aa-9d62-2b0e8142a9b4,11,7:02,Jalen Duren shooting foul (Victor Wembanyama draws the foul),shootingfoul,15,ad36c3e8-4194-4e63-920f-7c50f46191a6,basketball_play,1772760050,456,True,2026-03-06 01:20:50+00:00,1,422.0,298.0,4.966666666666667,47
4,90,quarter,1,ad36c3e8-4194-4e63-920f-7c50f46191a6,11,7:02,Victor Wembanyama makes regular free throw 1 of 2,freethrowmade,16,ad36c3e8-4194-4e63-920f-7c50f46191a6,basketball_play,1772760079,455,True,2026-03-06 01:21:19+00:00,1,422.0,298.0,4.966666666666667,48
4,89,quarter,1,ad36c3e8-4194-4e63-920f-7c50f46191a6,11,7:02,"Spurs lineup change (Devin Vassell, Julian Champagnie, Stephon Castle, Dylan Harper, Victor Wembanyama)",lineupchange,16,,basketball_play,1772760104,454,True,2026-03-06 01:21:44+00:00,1,422.0,298.0,4.966666666666667,49
4,88,quarter,1,ad36c3e8-4194-4e63-920f-7c50f46191a6,11,7:02,Victor Wembanyama makes regular free throw 2 of 2,freethrowmade,17,65569528-1888-40aa-9d62-2b0e8142a9b4,basketball_play,1772760104,453,True,2026-03-06 01:21:44+00:00,1,422.0,298.0,4.966666666666667,50
4,87,quarter,1,65569528-1888-40aa-9d62-2b0e8142a9b4,11,6:46,Jalen Duren misses two point driving floating bank jump shot,twopointmiss,17,,basketball_play,1772760122,452,True,2026-03-06 01:22:02+00:00,1,406.0,314.0,5.233333333333333,51
4,86,quarter,1,65569528-1888-40aa-9d62-2b0e8142a9b4,11,6:44,Ronald Holland II offensive rebound,rebound,17,65569528-1888-40aa-9d62-2b0e8142a9b4,basketball_play,1772760123,451,True,2026-03-06 01:22:03+00:00,1,404.0,316.0,5.266666666666667,52
4,85,quarter,1,65569528-1888-40aa-9d62-2b0e8142a9b4,13,6:43,Ronald Holland II makes two point putback layup,twopointmade,17,ad36c3e8-4194-4e63-920f-7c50f46191a6,basketball_play,1772760127,450,True,2026-03-06 01:22:07+00:00,1,403.0,317.0,5.283333333333333,53
4,84,quarter,1,ad36c3e8-4194-4e63-920f-7c50f46191a6,13,6:43,Victor Wembanyama defensive goaltending violation,defensivegoaltending,17,65569528-1888-40aa-9d62-2b0e8142a9b4,basketball_play,1772760134,449,True,2026-03-06 01:22:14+00:00,1,403.0,317.0,5.283333333333333,54
4,83,quarter,1,ad36c3e8-4194-4e63-920f-7c50f46191a6,13,6:26,Stephon Castle makes two point driving finger roll layup,twopointmade,19,65569528-1888-40aa-9d62-2b0e8142a9b4,basketball_play,1772760150,448,True,2026-03-06 01:22:30+00:00,1,386.0,334.0,5.566666666666666,55
4,82,quarter,1,65569528-1888-40aa-9d62-2b0e8142a9b4,15,6:12,Jalen Duren makes two point layup (Tobias Harris assists),twopointmade,19,ad36c3e8-4194-4e63-920f-7c50f46191a6,basketball_play,1772760165,447,True,2026-03-06 01:22:45+00:00,1,372.0,348.0,5.8,56
4,81,quarter,1,65569528-1888-40aa-9d62-2b0e8142a9b4,15,6:02,Jalen Duren personal foul (Victor Wembanyama draws the foul),personalfoul,19,ad36c3e8-4194-4e63-920f-7c50f46191a6,basketball_play,1772760178,446,True,2026-03-06 01:22:58+00:00,1,362.0,358.0,5.966666666666667,57
4,80,quarter,1,65569528-1888-40aa-9d62-2b0e8142a9b4,15,6:02,"Pistons lineup change (Caris LeVert, Cade Cunningham, Ronald Holland II, Duncan Robinson, Isaiah Stewart)",lineupchange,19,,basketball_play,1772760192,445,True,2026-03-06 01:23:12+00:00,1,362.0,358.0,5.966666666666667,58
4,79,quarter,1,ad36c3e8-4194-4e63-920f-7c50f46191a6,15,5:51,Victor Wembanyama makes two point turnaround jump shot (Stephon Castle assists),twopointmade,21,65569528-1888-40aa-9d62-2b0e8142a9b4,basketball_play,1772760221,444,True,2026-03-06 01:23:41+00:00,1,351.0,369.0,6.15,59
4,78,quarter,1,65569528-1888-40aa-9d62-2b0e8142a9b4,15,5:43,Stephon Castle blocks Cade Cunningham's three point pullup jump shot,threepointmiss,21,,basketball_play,1772760230,443,True,2026-03-06 01:23:50+00:00,1,343.0,377.0,6.283333333333333,60
4,77,quarter,1,65569528-1888-40aa-9d62-2b0e8142a9b4,15,5:43,Pistons offensive rebound,rebound,21,65569528-1888-40aa-9d62-2b0e8142a9b4,basketball_play,1772760230,442,True,2026-03-06 01:23:50+00:00,1,343.0,377.0,6.283333333333333,61
4,76,quarter,1,,15,5:43,Stoppage (Out of bounds),stoppage,21,,basketball_play,1772760239,441,True,2026-03-06 01:23:59+00:00,1,343.0,377.0,6.283333333333333,62
4,75,quarter,1,ad36c3e8-4194-4e63-920f-7c50f46191a6,15,5:43,"Spurs lineup change (Devin Vassell, Keldon Johnson, Stephon Castle, Dylan Harper, Victor Wembanyama)",lineupchange,21,,basketball_play,1772760257,440,True,2026-03-06 01:24:17+00:00,1,343.0,377.0,6.283333333333333,63
4,74,quarter,1,65569528-1888-40aa-9d62-2b0e8142a9b4,15,5:38,Isaiah Stewart misses three point jump shot,threepointmiss,21,,basketball_play,1772760257,439,True,2026-03-06 01:24:17+00:00,1,338.0,382.0,6.366666666666666,64
4,73,quarter,1,ad36c3e8-4194-4e63-920f-7c50f46191a6,15,5:35,Dylan Harper defensive rebound,rebound,21,ad36c3e8-4194-4e63-920f-7c50f46191a6,basketball_play,1772760260,438,True,2026-03-06 01:24:20+00:00,1,335.0,385.0,6.416666666666667,65
4,72,quarter,1,ad36c3e8-4194-4e63-920f-7c50f46191a6,15,5:33,Devin Vassell misses three point running pullup jump shot,threepointmiss,21,,basketball_play,1772760263,437,True,2026-03-06 01:24:23+00:00,1,333.0,387.0,6.45,66
4,71,quarter,1,ad36c3e8-4194-4e63-920f-7c50f46191a6,15,5:30,Devin Vassell offensive rebound,rebound,21,ad36c3e8-4194-4e63-920f-7c50f46191a6,basketball_play,1772760265,436,True,2026-03-06 01:24:25+00:00,1,330.0,390.0,6.5,67
4,70,quarter,1,ad36c3e8-4194-4e63-920f-7c50f46191a6,15,5:27,Dylan Harper makes three point jump shot (Stephon Castle assists),threepointmade,24,65569528-1888-40aa-9d62-2b0e8142a9b4,basketball_play,1772760268,435,True,2026-03-06 01:24:28+00:00,1,327.0,393.0,6.55,68
4,69,quarter,1,65569528-1888-40aa-9d62-2b0e8142a9b4,15,5:16,Victor Wembanyama blocks Cade Cunningham's two point driving layup,twopointmiss,24,,basketball_play,1772760282,434,True,2026-03-06 01:24:42+00:00,1,316.0,404.0,6.733333333333333,69
4,68,quarter,1,65569528-1888-40aa-9d62-2b0e8142a9b4,15,5:16,Isaiah Stewart offensive rebound,rebound,24,65569528-1888-40aa-9d62-2b0e8142a9b4,basketball_play,1772760282,433,True,2026-03-06 01:24:42+00:00,1,316.0,404.0,6.733333333333333,70
4,67,quarter,1,ad36c3e8-4194-4e63-920f-7c50f46191a6,15,5:16,Stephon Castle shooting foul (Isaiah Stewart draws the foul),shootingfoul,24,65569528-1888-40aa-9d62-2b0e8142a9b4,basketball_play,1772760288,432,True,2026-03-06 01:24:48+00:00,1,316.0,404.0,6.733333333333333,71
4,66,quarter,1,65569528-1888-40aa-9d62-2b0e8142a9b4,16,5:16,Isaiah Stewart makes regular free throw 1 of 2,freethrowmade,24,65569528-1888-40aa-9d62-2b0e8142a9b4,basketball_play,1772760313,431,True,2026-03-06 01:25:13+00:00,1,316.0,404.0,6.733333333333333,72
4,65,quarter,1,ad36c3e8-4194-4e63-920f-7c50f46191a6,16,5:16,"Spurs lineup change (Devin Vassell, Keldon Johnson, Dylan Harper, Victor Wembanyama, Carter Bryant)",lineupchange,24,,basketball_play,1772760353,430,True,2026-03-06 01:25:53+00:00,1,316.0,404.0,6.733333333333333,73
4,64,quarter,1,65569528-1888-40aa-9d62-2b0e8142a9b4,17,5:16,Isaiah Stewart makes regular free throw 2 of 2,freethrowmade,24,ad36c3e8-4194-4e63-920f-7c50f46191a6,basketball_play,1772760353,429,True,2026-03-06 01:25:53+00:00,1,316.0,404.0,6.733333333333333,74
4,63,quarter,1,ad36c3e8-4194-4e63-920f-7c50f46191a6,17,5:06,Dylan Harper turnover (bad pass) (Duncan Robinson steals),turnover,24,65569528-1888-40aa-9d62-2b0e8142a9b4,basketball_play,1772760367,428,True,2026-03-06 01:26:07+00:00,1,306.0,414.0,6.9,75
4,62,quarter,1,ad36c3e8-4194-4e63-920f-7c50f46191a6,17,5:05,Dylan Harper shooting foul (Ronald Holland II draws the foul),shootingfoul,24,65569528-1888-40aa-9d62-2b0e8142a9b4,basketball_play,1772760375,427,True,2026-03-06 01:26:15+00:00,1,305.0,415.0,6.916666666666667,76
4,61,quarter,1,65569528-1888-40aa-9d62-2b0e8142a9b4,18,5:05,Ronald Holland II makes regular free throw 1 of 2,freethrowmade,24,65569528-1888-40aa-9d62-2b0e8142a9b4,basketball_play,1772760403,426,True,2026-03-06 01:26:43+00:00,1,305.0,415.0,6.916666666666667,77
4,60,quarter,1,ad36c3e8-4194-4e63-920f-7c50f46191a6,18,5:05,"Spurs lineup change (De'Aaron Fox, Keldon Johnson, Dylan Harper, Victor Wembanyama, Carter Bryant)",lineupchange,24,,basketball_play,1772760421,425,True,2026-03-06 01:27:01+00:00,1,305.0,415.0,6.916666666666667,78
4,59,quarter,1,65569528-1888-40aa-9d62-2b0e8142a9b4,19,5:05,Ronald Holland II makes regular free throw 2 of 2,freethrowmade,24,ad36c3e8-4194-4e63-920f-7c50f46191a6,basketball_play,1772760403,424,True,2026-03-06 01:26:43+00:00,1,305.0,415.0,6.916666666666667,79
4,58,quarter,1,ad36c3e8-4194-4e63-920f-7c50f46191a6,19,4:53,Victor Wembanyama makes three point jump shot (Keldon Johnson assists),threepointmade,27,65569528-1888-40aa-9d62-2b0e8142a9b4,basketball_play,1772760435,423,True,2026-03-06 01:27:15+00:00,1,293.0,427.0,7.116666666666666,80
4,57,quarter,1,,19,4:48,Stoppage (Other),stoppage,27,,basketball_play,1772760449,422,True,2026-03-06 01:27:29+00:00,1,288.0,432.0,7.2,81
4,56,quarter,1,65569528-1888-40aa-9d62-2b0e8142a9b4,19,4:32,Ronald Holland II misses three point jump shot,threepointmiss,27,,basketball_play,1772760463,421,True,2026-03-06 01:27:43+00:00,1,272.0,448.0,7.466666666666667,82
4,55,quarter,1,ad36c3e8-4194-4e63-920f-7c50f46191a6,19,4:28,De'Aaron Fox defensive rebound,rebound,27,ad36c3e8-4194-4e63-920f-7c50f46191a6,basketball_play,1772760467,420,True,2026-03-06 01:27:47+00:00,1,268.0,452.0,7.533333333333333,83
4,54,quarter,1,ad36c3e8-4194-4e63-920f-7c50f46191a6,19,4:19,De'Aaron Fox makes three point pullup jump shot,threepointmade,30,65569528-1888-40aa-9d62-2b0e8142a9b4,basketball_play,1772760476,419,True,2026-03-06 01:27:56+00:00,1,259.0,461.0,7.683333333333334,84
4,53,quarter,1,65569528-1888-40aa-9d62-2b0e8142a9b4,19,4:19,Pistons 60 second timeout,teamtimeout,30,,basketball_play,1772760487,418,True,2026-03-06 01:28:07+00:00,1,259.0,461.0,7.683333333333334,85
4,52,quarter,1,65569528-1888-40aa-9d62-2b0e8142a9b4,19,4:19,"Pistons lineup change (Caris LeVert, Cade Cunningham, Ronald Holland II, Isaiah Stewart, Daniss Jenkins)",lineupchange,30,,basketball_play,1772760627,417,True,2026-03-06 01:30:27+00:00,1,259.0,461.0,7.683333333333334,86
4,51,quarter,1,65569528-1888-40aa-9d62-2b0e8142a9b4,19,4:02,Daniss Jenkins misses two point turnaround fadeaway jump shot,twopointmiss,30,,basketball_play,1772760675,416,True,2026-03-06 01:31:15+00:00,1,242.0,478.0,7.966666666666667,87
4,50,quarter,1,ad36c3e8-4194-4e63-920f-7c50f46191a6,19,3:59,Keldon Johnson defensive rebound,rebound,30,ad36c3e8-4194-4e63-920f-7c50f46191a6,basketball_play,1772760678,415,True,2026-03-06 01:31:18+00:00,1,239.0,481.0,8.016666666666667,88
4,49,quarter,1,ad36c3e8-4194-4e63-920f-7c50f46191a6,19,3:54,Dylan Harper turnover (out of bounds lost ball),turnover,30,65569528-1888-40aa-9d62-2b0e8142a9b4,basketball_play,1772760685,414,True,2026-03-06 01:31:25+00:00,1,234.0,486.0,8.1,89
4,48,quarter,1,65569528-1888-40aa-9d62-2b0e8142a9b4,19,3:36,Daniss Jenkins misses three point jump shot,threepointmiss,30,,basketball_play,1772760707,413,True,2026-03-06 01:31:47+00:00,1,216.0,504.0,8.4,90
4,47,quarter,1,ad36c3e8-4194-4e63-920f-7c50f46191a6,19,3:32,Victor Wembanyama defensive rebound,rebound,30,ad36c3e8-4194-4e63-920f-7c50f46191a6,basketball_play,1772760711,412,True,2026-03-06 01:31:51+00:00,1,212.0,508.0,8.466666666666667,91
4,46,quarter,1,65569528-1888-40aa-9d62-2b0e8142a9b4,19,3:26,Ronald Holland II shooting foul (De'Aaron Fox draws the foul),shootingfoul,30,ad36c3e8-4194-4e63-920f-7c50f46191a6,basketball_play,1772760718,411,True,2026-03-06 01:31:58+00:00,1,206.0,514.0,8.566666666666666,92
4,45,quarter,1,ad36c3e8-4194-4e63-920f-7c50f46191a6,19,3:26,De'Aaron Fox misses regular free throw 1 of 2,freethrowmiss,30,ad36c3e8-4194-4e63-920f-7c50f46191a6,basketball_play,1772760741,410,True,2026-03-06 01:32:21+00:00,1,206.0,514.0,8.566666666666666,93
4,44,quarter,1,ad36c3e8-4194-4e63-920f-7c50f46191a6,19,3:26,Spurs offensive rebound,rebound,30,ad36c3e8-4194-4e63-920f-7c50f46191a6,basketball_play,1772760741,409,True,2026-03-06 01:32:21+00:00,1,206.0,514.0,8.566666666666666,94
4,43,quarter,1,ad36c3e8-4194-4e63-920f-7c50f46191a6,19,3:26,De'Aaron Fox makes regular free throw 2 of 2,freethrowmade,31,65569528-1888-40aa-9d62-2b0e8142a9b4,basketball_play,1772760761,408,True,2026-03-06 01:32:41+00:00,1,206.0,514.0,8.566666666666666,95
4,42,quarter,1,65569528-1888-40aa-9d62-2b0e8142a9b4,19,3:07,Cade Cunningham misses two point stepback jump shot,twopointmiss,31,,basketball_play,1772760781,407,True,2026-03-06 01:33:01+00:00,1,187.0,533.0,8.883333333333333,96
4,41,quarter,1,ad36c3e8-4194-4e63-920f-7c50f46191a6,19,3:05,Victor Wembanyama defensive rebound,rebound,31,ad36c3e8-4194-4e63-920f-7c50f46191a6,basketball_play,1772760783,406,True,2026-03-06 01:33:03+00:00,1,185.0,535.0,8.916666666666666,97
4,40,quarter,1,ad36c3e8-4194-4e63-920f-7c50f46191a6,19,2:49,Victor Wembanyama misses three point jump shot,threepointmiss,31,,basketball_play,1772760799,405,True,2026-03-06 01:33:19+00:00,1,169.0,551.0,9.183333333333334,98
4,39,quarter,1,65569528-1888-40aa-9d62-2b0e8142a9b4,19,2:47,Ronald Holland II defensive rebound,rebound,31,65569528-1888-40aa-9d62-2b0e8142a9b4,basketball_play,1772760801,404,True,2026-03-06 01:33:21+00:00,1,167.0,553.0,9.216666666666667,99
4,38,quarter,1,65569528-1888-40aa-9d62-2b0e8142a9b4,19,2:42,Victor Wembanyama blocks Caris LeVert's two point running layup,twopointmiss,31,,basketball_play,1772760806,403,True,2026-03-06 01:33:26+00:00,1,162.0,558.0,9.3,100
4,37,quarter,1,65569528-1888-40aa-9d62-2b0e8142a9b4,19,2:40,Ronald Holland II offensive rebound,rebound,31,65569528-1888-40aa-9d62-2b0e8142a9b4,basketball_play,1772760808,402,True,2026-03-06 01:33:28+00:00,1,160.0,560.0,9.333333333333334,101
4,36,quarter,1,65569528-1888-40aa-9d62-2b0e8142a9b4,19,2:40,Ronald Holland II misses two point putback layup,twopointmiss,31,,basketball_play,1772760810,401,True,2026-03-06 01:33:30+00:00,1,160.0,560.0,9.333333333333334,102
4,35,quarter,1,65569528-1888-40aa-9d62-2b0e8142a9b4,19,2:40,Pistons offensive rebound,rebound,31,65569528-1888-40aa-9d62-2b0e8142a9b4,basketball_play,1772760816,400,True,2026-03-06 01:33:36+00:00,1,160.0,560.0,9.333333333333334,103
4,34,quarter,1,,19,2:40,Stoppage (Out of bounds),stoppage,31,,basketball_play,1772760820,399,True,2026-03-06 01:33:40+00:00,1,160.0,560.0,9.333333333333334,104
4,33,quarter,1,65569528-1888-40aa-9d62-2b0e8142a9b4,19,2:40,"Pistons lineup change (Caris LeVert, Tobias Harris, Ronald Holland II, Isaiah Stewart, Daniss Jenkins)",lineupchange,31,,basketball_play,1772760825,398,True,2026-03-06 01:33:45+00:00,1,160.0,560.0,9.333333333333334,105
4,32,quarter,1,ad36c3e8-4194-4e63-920f-7c50f46191a6,19,2:40,"Spurs lineup change (De'Aaron Fox, Keldon Johnson, Dylan Harper, Luke Kornet, Carter Bryant)",lineupchange,31,,basketball_play,1772760825,397,True,2026-03-06 01:33:45+00:00,1,160.0,560.0,9.333333333333334,106
