period_index,event_index,period_type,period_number,attribution,away_points,clock,description,event_type,home_points,possession,type,wall_clock,pbp_source_row,has_wall_clock,event_ts_utc,period_sequence,game_clock_seconds_remaining,game_elapsed_seconds,game_elapsed_minutes,pbp_chronological_index
4,31,quarter,1,ad36c3e8-4194-4e63-920f-7c50f46191a6,19,2:28,Carter Bryant personal foul (Caris LeVert draws the foul),personalfoul,31,65569528-1888-40aa-9d62-2b0e8142a9b4,basketball_play,1772760861,396,True,2026-03-06 01:34:21+00:00,1,148.0,572.0,9.533333333333333,107
4,30,quarter,1,65569528-1888-40aa-9d62-2b0e8142a9b4,19,2:28,"Pistons lineup change (Caris LeVert, Tobias Harris, Marcus Sasser, Isaiah Stewart, Daniss Jenkins)",lineupchange,31,,basketball_play,1772760888,395,True,2026-03-06 01:34:48+00:00,1,148.0,572.0,9.533333333333333,108
4,29,quarter,1,65569528-1888-40aa-9d62-2b0e8142a9b4,19,2:18,Daniss Jenkins misses two point driving finger roll layup,twopointmiss,31,,basketball_play,1772760888,394,True,2026-03-06 01:34:48+00:00,1,138.0,582.0,9.7,109
4,28,quarter,1,65569528-1888-40aa-9d62-2b0e8142a9b4,19,2:16,Isaiah Stewart offensive rebound,rebound,31,65569528-1888-40aa-9d62-2b0e8142a9b4,basketball_play,1772760890,393,True,2026-03-06 01:34:50+00:00,1,136.0,584.0,9.733333333333333,110
4,27,quarter,1,65569528-1888-40aa-9d62-2b0e8142a9b4,21,2:10,Isaiah Stewart makes two point layup (Caris LeVert assists),twopointmade,31,ad36c3e8-4194-4e63-920f-7c50f46191a6,basketball_play,1772760897,392,True,2026-03-06 01:34:57+00:00,1,130.0,590.0,9.833333333333334,111
4,26,quarter,1,ad36c3e8-4194-4e63-920f-7c50f46191a6,21,1:58,Dylan Harper turnover (lost ball) (Isaiah Stewart steals),turnover,31,65569528-1888-40aa-9d62-2b0e8142a9b4,basketball_play,1772760912,391,True,2026-03-06 01:35:12+00:00,1,118.0,602.0,10.033333333333333,112
4,25,quarter,1,65569528-1888-40aa-9d62-2b0e8142a9b4,21,1:52,Carter Bryant blocks Daniss Jenkins's two point running dunk,twopointmiss,31,,basketball_play,1772760914,390,True,2026-03-06 01:35:14+00:00,1,112.0,608.0,10.133333333333333,113
4,24,quarter,1,ad36c3e8-4194-4e63-920f-7c50f46191a6,21,1:52,Keldon Johnson defensive rebound,rebound,31,ad36c3e8-4194-4e63-920f-7c50f46191a6,basketball_play,1772760914,389,True,2026-03-06 01:35:14+00:00,1,112.0,608.0,10.133333333333333,114
4,23,quarter,1,ad36c3e8-4194-4e63-920f-7c50f46191a6,21,1:47,De'Aaron Fox misses three point running pullup jump shot,threepointmiss,31,,basketball_play,1772760920,388,True,2026-03-06 01:35:20+00:00,1,107.0,613.0,10.216666666666667,115
4,22,quarter,1,ad36c3e8-4194-4e63-920f-7c50f46191a6,21,1:44,De'Aaron Fox offensive rebound,rebound,31,ad36c3e8-4194-4e63-920f-7c50f46191a6,basketball_play,1772760923,387,True,2026-03-06 01:35:23+00:00,1,104.0,616.0,10.266666666666667,116
4,21,quarter,1,ad36c3e8-4194-4e63-920f-7c50f46191a6,21,1:36,De'Aaron Fox misses three point jump shot,threepointmiss,31,,basketball_play,1772760931,386,True,2026-03-06 01:35:31+00:00,1,96.0,624.0,10.4,117
4,20,quarter,1,ad36c3e8-4194-4e63-920f-7c50f46191a6,21,1:34,Carter Bryant offensive rebound,rebound,31,ad36c3e8-4194-4e63-920f-7c50f46191a6,basketball_play,1772760933,385,True,2026-03-06 01:35:33+00:00,1,94.0,626.0,10.433333333333334,118
4,19,quarter,1,ad36c3e8-4194-4e63-920f-7c50f46191a6,21,1:28,Keldon Johnson misses two point driving floating jump shot,twopointmiss,31,,basketball_play,1772760939,384,True,2026-03-06 01:35:39+00:00,1,88.0,632.0,10.533333333333333,119
4,18,quarter,1,ad36c3e8-4194-4e63-920f-7c50f46191a6,21,1:24,Luke Kornet offensive rebound,rebound,31,ad36c3e8-4194-4e63-920f-7c50f46191a6,basketball_play,1772760943,383,True,2026-03-06 01:35:43+00:00,1,84.0,636.0,10.6,120
4,17,quarter,1,ad36c3e8-4194-4e63-920f-7c50f46191a6,21,1:24,Luke Kornet makes two point tip layup,twopointmade,33,65569528-1888-40aa-9d62-2b0e8142a9b4,basketball_play,1772760942,382,True,2026-03-06 01:35:42+00:00,1,84.0,636.0,10.6,121
4,16,quarter,1,65569528-1888-40aa-9d62-2b0e8142a9b4,21,1:09,Tobias Harris misses two point stepback jump shot,twopointmiss,33,,basketball_play,1772760957,381,True,2026-03-06 01:35:57+00:00,1,69.0,651.0,10.85,122
4,15,quarter,1,ad36c3e8-4194-4e63-920f-7c50f46191a6,21,1:06,Carter Bryant defensive rebound,rebound,33,ad36c3e8-4194-4e63-920f-7c50f46191a6,basketball_play,1772760960,380,True,2026-03-06 01:36:00+00:00,1,66.0,654.0,10.9,123
4,14,quarter,1,ad36c3e8-4194-4e63-920f-7c50f46191a6,21,00:57.30,De'Aaron Fox makes two point pullup jump shot (Dylan Harper assists),twopointmade,35,65569528-1888-40aa-9d62-2b0e8142a9b4,basketball_play,1772760972,379,True,2026-03-06 01:36:12+00:00,1,57.3,662.7,11.045,124
4,13,quarter,1,65569528-1888-40aa-9d62-2b0e8142a9b4,21,00:43.20,Isaiah Stewart misses two point driving hook shot,twopointmiss,35,,basketball_play,1772760987,378,True,2026-03-06 01:36:27+00:00,1,43.2,676.8,11.28,125
4,12,quarter,1,ad36c3e8-4194-4e63-920f-7c50f46191a6,21,00:40.80,Carter Bryant defensive rebound,rebound,35,ad36c3e8-4194-4e63-920f-7c50f46191a6,basketball_play,1772760990,377,True,2026-03-06 01:36:30+00:00,1,40.8,679.2,11.32,126
4,11,quarter,1,ad36c3e8-4194-4e63-920f-7c50f46191a6,21,00:32.20,De'Aaron Fox makes three point pullup jump shot,threepointmade,38,65569528-1888-40aa-9d62-2b0e8142a9b4,basketball_play,1772760999,376,True,2026-03-06 01:36:39+00:00,1,32.2,687.8,11.463333333333333,127
4,10,quarter,1,65569528-1888-40aa-9d62-2b0e8142a9b4,21,00:08.80,Marcus Sasser misses two point driving finger roll layup,twopointmiss,38,,basketball_play,1772761033,375,True,2026-03-06 01:37:13+00:00,1,8.8,711.2,11.853333333333333,128
4,9,quarter,1,65569528-1888-40aa-9d62-2b0e8142a9b4,21,00:08.80,Isaiah Stewart offensive rebound,rebound,38,65569528-1888-40aa-9d62-2b0e8142a9b4,basketball_play,1772761033,374,True,2026-03-06 01:37:13+00:00,1,8.8,711.2,11.853333333333333,129
4,8,quarter,1,ad36c3e8-4194-4e63-920f-7c50f46191a6,21,00:08.80,Carter Bryant shooting foul (Isaiah Stewart draws the foul),shootingfoul,38,65569528-1888-40aa-9d62-2b0e8142a9b4,basketball_play,1772761042,373,True,2026-03-06 01:37:22+00:00,1,8.8,711.2,11.853333333333333,130
4,7,quarter,1,65569528-1888-40aa-9d62-2b0e8142a9b4,22,00:08.80,Isaiah Stewart makes regular free throw 1 of 2,freethrowmade,38,65569528-1888-40aa-9d62-2b0e8142a9b4,basketball_play,1772761058,372,True,2026-03-06 01:37:38+00:00,1,8.8,711.2,11.853333333333333,131
4,6,quarter,1,65569528-1888-40aa-9d62-2b0e8142a9b4,22,00:08.80,"Pistons lineup change (Caris LeVert, Tobias Harris, Javonte Green, Marcus Sasser, Isaiah Stewart)",lineupchange,38,,basketball_play,1772761058,371,True,2026-03-06 01:37:38+00:00,1,8.8,711.2,11.853333333333333,132
4,5,quarter,1,ad36c3e8-4194-4e63-920f-7c50f46191a6,22,00:08.80,"Spurs lineup change (Devin Vassell, De'Aaron Fox, Julian Champagnie, Keldon Johnson, Luke Kornet)",lineupchange,38,,basketball_play,1772761058,370,True,2026-03-06 01:37:38+00:00,1,8.8,711.2,11.853333333333333,133
4,4,quarter,1,65569528-1888-40aa-9d62-2b0e8142a9b4,23,00:08.80,Isaiah Stewart makes regular free throw 2 of 2,freethrowmade,38,ad36c3e8-4194-4e63-920f-7c50f46191a6,basketball_play,1772761088,369,True,2026-03-06 01:38:08+00:00,1,8.8,711.2,11.853333333333333,134
4,3,quarter,1,ad36c3e8-4194-4e63-920f-7c50f46191a6,23,00:00,De'Aaron Fox misses two point pullup jump shot,twopointmiss,38,,basketball_play,1772761101,368,True,2026-03-06 01:38:21+00:00,1,0.0,720.0,12.0,135
4,2,quarter,1,ad36c3e8-4194-4e63-920f-7c50f46191a6,23,00:00,Spurs offensive rebound,rebound,38,ad36c3e8-4194-4e63-920f-7c50f46191a6,basketball_play,1772761103,367,True,2026-03-06 01:38:23+00:00,1,0.0,720.0,12.0,136
4,1,quarter,1,,23,00:00,End of 1st Quarter.,endperiod,38,,basketball_play,1772761106,366,True,2026-03-06 01:38:26+00:00,1,0.0,720.0,12.0,137
3,121,quarter,2,65569528-1888-40aa-9d62-2b0e8142a9b4,23,12:00,"Pistons lineup change (Caris LeVert, Cade Cunningham, Javonte Green, Marcus Sasser, Isaiah Stewart)",lineupchange,38,,basketball_play,1772761200,365,True,2026-03-06 01:40:00+00:00,2,720.0,720.0,12.0,138
3,120,quarter,2,ad36c3e8-4194-4e63-920f-7c50f46191a6,23,12:00,"Spurs lineup change (De'Aaron Fox, Julian Champagnie, Keldon Johnson, Dylan Harper, Victor Wembanyama)",lineupchange,38,,basketball_play,1772761200,364,True,2026-03-06 01:40:00+00:00,2,720.0,720.0,12.0,139
3,119,quarter,2,,23,12:00,Start of 2nd Quarter,startperiod,38,,basketball_play,1772761281,363,True,2026-03-06 01:41:21+00:00,2,720.0,720.0,12.0,140
3,118,quarter,2,65569528-1888-40aa-9d62-2b0e8142a9b4,26,11:46,Cade Cunningham makes three point jump shot (Isaiah Stewart assists),threepointmade,38,ad36c3e8-4194-4e63-920f-7c50f46191a6,basketball_play,1772761294,362,True,2026-03-06 01:41:34+00:00,2,706.0,734.0,12.233333333333333,141
3,117,quarter,2,ad36c3e8-4194-4e63-920f-7c50f46191a6,26,11:43,Spurs 60 second timeout,teamtimeout,38,,basketball_play,1772761301,361,True,2026-03-06 01:41:41+00:00,2,703.0,737.0,12.283333333333333,142
3,116,quarter,2,ad36c3e8-4194-4e63-920f-7c50f46191a6,26,11:43,"Spurs lineup change (De'Aaron Fox, Julian Champagnie, Stephon Castle, Victor Wembanyama, Carter Bryant)",lineupchange,38,,basketball_play,1772761467,360,True,2026-03-06 01:44:27+00:00,2,703.0,737.0,12.283333333333333,143
3,115,quarter,2,ad36c3e8-4194-4e63-920f-7c50f46191a6,26,11:20,Stephon Castle misses two point driving floating jump shot,twopointmiss,38,,basketball_play,1772761503,359,True,2026-03-06 01:45:03+00:00,2,680.0,760.0,12.666666666666666,144
3,114,quarter,2,65569528-1888-40aa-9d62-2b0e8142a9b4,26,11:17,Cade Cunningham defensive rebound,rebound,38,65569528-1888-40aa-9d62-2b0e8142a9b4,basketball_play,1772761506,358,True,2026-03-06 01:45:06+00:00,2,677.0,763.0,12.716666666666667,145
3,113,quarter,2,65569528-1888-40aa-9d62-2b0e8142a9b4,29,11:08,Javonte Green makes three point jump shot (Cade Cunningham assists),threepointmade,38,ad36c3e8-4194-4e63-920f-7c50f46191a6,basketball_play,1772761514,357,True,2026-03-06 01:45:14+00:00,2,668.0,772.0,12.866666666666667,146
3,112,quarter,2,ad36c3e8-4194-4e63-920f-7c50f46191a6,29,10:51,De'Aaron Fox makes two point driving layup (Victor Wembanyama assists),twopointmade,40,65569528-1888-40aa-9d62-2b0e8142a9b4,basketball_play,1772761530,356,True,2026-03-06 01:45:30+00:00,2,651.0,789.0,13.15,147
3,111,quarter,2,65569528-1888-40aa-9d62-2b0e8142a9b4,29,10:32,Cade Cunningham misses three point pullup jump shot,threepointmiss,40,,basketball_play,1772761550,355,True,2026-03-06 01:45:50+00:00,2,632.0,808.0,13.466666666666667,148
3,110,quarter,2,ad36c3e8-4194-4e63-920f-7c50f46191a6,29,10:29,Carter Bryant defensive rebound,rebound,40,ad36c3e8-4194-4e63-920f-7c50f46191a6,basketball_play,1772761553,354,True,2026-03-06 01:45:53+00:00,2,629.0,811.0,13.516666666666667,149
3,109,quarter,2,ad36c3e8-4194-4e63-920f-7c50f46191a6,29,10:19,Victor Wembanyama misses three point pullup jump shot,threepointmiss,40,,basketball_play,1772761562,353,True,2026-03-06 01:46:02+00:00,2,619.0,821.0,13.683333333333334,150
3,108,quarter,2,65569528-1888-40aa-9d62-2b0e8142a9b4,29,10:19,Caris LeVert defensive rebound,rebound,40,65569528-1888-40aa-9d62-2b0e8142a9b4,basketball_play,1772761562,352,True,2026-03-06 01:46:02+00:00,2,619.0,821.0,13.683333333333334,151
3,107,quarter,2,65569528-1888-40aa-9d62-2b0e8142a9b4,31,10:15,Javonte Green makes two point running alley-oop layup (Caris LeVert assists),twopointmade,40,ad36c3e8-4194-4e63-920f-7c50f46191a6,basketball_play,1772761567,351,True,2026-03-06 01:46:07+00:00,2,615.0,825.0,13.75,152
3,106,quarter,2,ad36c3e8-4194-4e63-920f-7c50f46191a6,31,9:59,Victor Wembanyama makes two point alley-oop dunk (Stephon Castle assists),twopointmade,42,65569528-1888-40aa-9d62-2b0e8142a9b4,basketball_play,1772761583,350,True,2026-03-06 01:46:23+00:00,2,599.0,841.0,14.016666666666667,153
3,105,quarter,2,65569528-1888-40aa-9d62-2b0e8142a9b4,31,9:43,Carter Bryant blocks Caris LeVert's two point driving finger roll layup,twopointmiss,42,,basketball_play,1772761599,349,True,2026-03-06 01:46:39+00:00,2,583.0,857.0,14.283333333333333,154
3,104,quarter,2,ad36c3e8-4194-4e63-920f-7c50f46191a6,31,9:40,Carter Bryant defensive rebound,rebound,42,ad36c3e8-4194-4e63-920f-7c50f46191a6,basketball_play,1772761602,348,True,2026-03-06 01:46:42+00:00,2,580.0,860.0,14.333333333333334,155
3,103,quarter,2,ad36c3e8-4194-4e63-920f-7c50f46191a6,31,9:36,Victor Wembanyama misses two point running finger roll layup,twopointmiss,42,,basketball_play,1772761608,347,True,2026-03-06 01:46:48+00:00,2,576.0,864.0,14.4,156
3,102,quarter,2,ad36c3e8-4194-4e63-920f-7c50f46191a6,31,9:35,Victor Wembanyama offensive rebound,rebound,42,ad36c3e8-4194-4e63-920f-7c50f46191a6,basketball_play,1772761609,346,True,2026-03-06 01:46:49+00:00,2,575.0,865.0,14.416666666666666,157
3,101,quarter,2,ad36c3e8-4194-4e63-920f-7c50f46191a6,31,9:35,Victor Wembanyama makes two point tip dunk,twopointmade,44,65569528-1888-40aa-9d62-2b0e8142a9b4,basketball_play,1772761611,345,True,2026-03-06 01:46:51+00:00,2,575.0,865.0,14.416666666666666,158
3,100,quarter,2,65569528-1888-40aa-9d62-2b0e8142a9b4,31,9:35,Javonte Green shooting foul (Victor Wembanyama draws the foul),shootingfoul,44,ad36c3e8-4194-4e63-920f-7c50f46191a6,basketball_play,1772761612,344,True,2026-03-06 01:46:52+00:00,2,575.0,865.0,14.416666666666666,159
3,99,quarter,2,ad36c3e8-4194-4e63-920f-7c50f46191a6,31,9:35,Victor Wembanyama makes regular free throw 1 of 1,freethrowmade,45,,basketball_play,1772761648,343,True,2026-03-06 01:47:28+00:00,2,575.0,865.0,14.416666666666666,160
3,98,quarter,2,ad36c3e8-4194-4e63-920f-7c50f46191a6,31,9:24,Victor Wembanyama shooting foul (Isaiah Stewart draws the foul),shootingfoul,45,65569528-1888-40aa-9d62-2b0e8142a9b4,basketball_play,1772761665,342,True,2026-03-06 01:47:45+00:00,2,564.0,876.0,14.6,161
3,97,quarter,2,ad36c3e8-4194-4e63-920f-7c50f46191a6,31,9:24,Spurs 60 second timeout,teamtimeout,45,,basketball_play,1772761684,341,True,2026-03-06 01:48:04+00:00,2,564.0,876.0,14.6,162
3,96,quarter,2,,31,9:24,Instant replay (Challenge: Stands),review,45,,basketball_play,1772761687,340,True,2026-03-06 01:48:07+00:00,2,564.0,876.0,14.6,163
3,95,quarter,2,65569528-1888-40aa-9d62-2b0e8142a9b4,32,9:24,Isaiah Stewart makes regular free throw 1 of 2,freethrowmade,45,65569528-1888-40aa-9d62-2b0e8142a9b4,basketball_play,1772761870,339,True,2026-03-06 01:51:10+00:00,2,564.0,876.0,14.6,164
3,94,quarter,2,65569528-1888-40aa-9d62-2b0e8142a9b4,33,9:24,Isaiah Stewart makes regular free throw 2 of 2,freethrowmade,45,ad36c3e8-4194-4e63-920f-7c50f46191a6,basketball_play,1772761874,338,True,2026-03-06 01:51:14+00:00,2,564.0,876.0,14.6,165
3,93,quarter,2,ad36c3e8-4194-4e63-920f-7c50f46191a6,33,9:07,Carter Bryant makes two point alley-oop dunk (De'Aaron Fox assists),twopointmade,47,65569528-1888-40aa-9d62-2b0e8142a9b4,basketball_play,1772761894,337,True,2026-03-06 01:51:34+00:00,2,547.0,893.0,14.883333333333333,166
3,92,quarter,2,65569528-1888-40aa-9d62-2b0e8142a9b4,35,8:58,Cade Cunningham makes two point pullup jump shot,twopointmade,47,ad36c3e8-4194-4e63-920f-7c50f46191a6,basketball_play,1772761904,336,True,2026-03-06 01:51:44+00:00,2,538.0,902.0,15.033333333333333,167
3,91,quarter,2,ad36c3e8-4194-4e63-920f-7c50f46191a6,35,8:38,Stephon Castle makes two point driving layup,twopointmade,49,65569528-1888-40aa-9d62-2b0e8142a9b4,basketball_play,1772761925,335,True,2026-03-06 01:52:05+00:00,2,518.0,922.0,15.366666666666667,168
3,90,quarter,2,65569528-1888-40aa-9d62-2b0e8142a9b4,35,8:38,Javonte Green shooting foul (Stephon Castle draws the foul),shootingfoul,49,ad36c3e8-4194-4e63-920f-7c50f46191a6,basketball_play,1772761927,334,True,2026-03-06 01:52:07+00:00,2,518.0,922.0,15.366666666666667,169
3,89,quarter,2,65569528-1888-40aa-9d62-2b0e8142a9b4,35,8:38,"Pistons lineup change (Caris LeVert, Kevin Huerter, Jalen Duren, Cade Cunningham, Javonte Green)",lineupchange,49,,basketball_play,1772761935,333,True,2026-03-06 01:52:15+00:00,2,518.0,922.0,15.366666666666667,170
3,88,quarter,2,ad36c3e8-4194-4e63-920f-7c50f46191a6,35,8:38,Stephon Castle makes regular free throw 1 of 1,freethrowmade,50,,basketball_play,1772761965,332,True,2026-03-06 01:52:45+00:00,2,518.0,922.0,15.366666666666667,171
3,87,quarter,2,65569528-1888-40aa-9d62-2b0e8142a9b4,35,8:26,Cade Cunningham misses two point driving finger roll layup,twopointmiss,50,,basketball_play,1772761978,331,True,2026-03-06 01:52:58+00:00,2,506.0,934.0,15.566666666666666,172
3,86,quarter,2,ad36c3e8-4194-4e63-920f-7c50f46191a6,35,8:24,Victor Wembanyama defensive rebound,rebound,50,ad36c3e8-4194-4e63-920f-7c50f46191a6,basketball_play,1772761979,330,True,2026-03-06 01:52:59+00:00,2,504.0,936.0,15.6,173
3,85,quarter,2,ad36c3e8-4194-4e63-920f-7c50f46191a6,35,8:19,De'Aaron Fox makes two point running finger roll layup,twopointmade,52,65569528-1888-40aa-9d62-2b0e8142a9b4,basketball_play,1772761985,329,True,2026-03-06 01:53:05+00:00,2,499.0,941.0,15.683333333333334,174
3,84,quarter,2,ad36c3e8-4194-4e63-920f-7c50f46191a6,35,8:10,Victor Wembanyama kicked ball violation,kickball,52,65569528-1888-40aa-9d62-2b0e8142a9b4,basketball_play,1772761997,328,True,2026-03-06 01:53:17+00:00,2,490.0,950.0,15.833333333333334,175
3,83,quarter,2,ad36c3e8-4194-4e63-920f-7c50f46191a6,35,8:10,"Spurs lineup change (Devin Vassell, Stephon Castle, Dylan Harper, Victor Wembanyama, Carter Bryant)",lineupchange,52,,basketball_play,1772762002,327,True,2026-03-06 01:53:22+00:00,2,490.0,950.0,15.833333333333334,176
3,82,quarter,2,ad36c3e8-4194-4e63-920f-7c50f46191a6,35,8:01,Stephon Castle personal foul (Cade Cunningham draws the foul),personalfoul,52,65569528-1888-40aa-9d62-2b0e8142a9b4,basketball_play,1772762032,326,True,2026-03-06 01:53:52+00:00,2,481.0,959.0,15.983333333333333,177
3,81,quarter,2,65569528-1888-40aa-9d62-2b0e8142a9b4,37,7:47,Jalen Duren makes two point cutting layup (Cade Cunningham assists),twopointmade,52,ad36c3e8-4194-4e63-920f-7c50f46191a6,basketball_play,1772762068,325,True,2026-03-06 01:54:28+00:00,2,467.0,973.0,16.216666666666665,178
3,80,quarter,2,ad36c3e8-4194-4e63-920f-7c50f46191a6,37,7:47,Victor Wembanyama shooting foul (Jalen Duren draws the foul),shootingfoul,52,65569528-1888-40aa-9d62-2b0e8142a9b4,basketball_play,1772762071,324,True,2026-03-06 01:54:31+00:00,2,467.0,973.0,16.216666666666665,179
3,79,quarter,2,65569528-1888-40aa-9d62-2b0e8142a9b4,37,7:47,"Pistons lineup change (Kevin Huerter, Jalen Duren, Cade Cunningham, Javonte Green, Duncan Robinson)",lineupchange,52,,basketball_play,1772762114,323,True,2026-03-06 01:55:14+00:00,2,467.0,973.0,16.216666666666665,180
3,78,quarter,2,65569528-1888-40aa-9d62-2b0e8142a9b4,37,7:47,Jalen Duren misses regular free throw 1 of 1,freethrowmiss,52,,basketball_play,1772762114,322,True,2026-03-06 01:55:14+00:00,2,467.0,973.0,16.216666666666665,181
3,77,quarter,2,ad36c3e8-4194-4e63-920f-7c50f46191a6,37,7:44,Victor Wembanyama defensive rebound,rebound,52,ad36c3e8-4194-4e63-920f-7c50f46191a6,basketball_play,1772762117,321,True,2026-03-06 01:55:17+00:00,2,464.0,976.0,16.266666666666666,182
3,76,quarter,2,ad36c3e8-4194-4e63-920f-7c50f46191a6,37,7:31,Stephon Castle turnover (bad pass) (Kevin Huerter steals),turnover,52,65569528-1888-40aa-9d62-2b0e8142a9b4,basketball_play,1772762129,320,True,2026-03-06 01:55:29+00:00,2,451.0,989.0,16.483333333333334,183
3,75,quarter,2,65569528-1888-40aa-9d62-2b0e8142a9b4,37,7:27,Cade Cunningham turnover (out of bounds lost ball),turnover,52,ad36c3e8-4194-4e63-920f-7c50f46191a6,basketball_play,1772762137,319,True,2026-03-06 01:55:37+00:00,2,447.0,993.0,16.55,184
3,74,quarter,2,ad36c3e8-4194-4e63-920f-7c50f46191a6,37,7:06,Carter Bryant misses three point jump shot,threepointmiss,52,,basketball_play,1772762162,318,True,2026-03-06 01:56:02+00:00,2,426.0,1014.0,16.9,185
3,73,quarter,2,65569528-1888-40aa-9d62-2b0e8142a9b4,37,7:04,Jalen Duren defensive rebound,rebound,52,65569528-1888-40aa-9d62-2b0e8142a9b4,basketball_play,1772762164,317,True,2026-03-06 01:56:04+00:00,2,424.0,1016.0,16.933333333333334,186
3,72,quarter,2,65569528-1888-40aa-9d62-2b0e8142a9b4,39,6:59,Cade Cunningham makes two point stepback jump shot,twopointmade,52,ad36c3e8-4194-4e63-920f-7c50f46191a6,basketball_play,1772762170,316,True,2026-03-06 01:56:10+00:00,2,419.0,1021.0,17.016666666666666,187
3,71,quarter,2,ad36c3e8-4194-4e63-920f-7c50f46191a6,39,6:39,Dylan Harper misses two point driving layup,twopointmiss,52,,basketball_play,1772762189,315,True,2026-03-06 01:56:29+00:00,2,399.0,1041.0,17.35,188
3,70,quarter,2,65569528-1888-40aa-9d62-2b0e8142a9b4,39,6:37,Jalen Duren defensive rebound,rebound,52,65569528-1888-40aa-9d62-2b0e8142a9b4,basketball_play,1772762191,314,True,2026-03-06 01:56:31+00:00,2,397.0,1043.0,17.383333333333333,189
3,69,quarter,2,65569528-1888-40aa-9d62-2b0e8142a9b4,39,6:29,Jalen Duren misses two point pullup jump shot,twopointmiss,52,,basketball_play,1772762199,313,True,2026-03-06 01:56:39+00:00,2,389.0,1051.0,17.516666666666666,190
3,68,quarter,2,ad36c3e8-4194-4e63-920f-7c50f46191a6,39,6:26,Stephon Castle defensive rebound,rebound,52,ad36c3e8-4194-4e63-920f-7c50f46191a6,basketball_play,1772762202,312,True,2026-03-06 01:56:42+00:00,2,386.0,1054.0,17.566666666666666,191
3,67,quarter,2,65569528-1888-40aa-9d62-2b0e8142a9b4,39,6:22,Jalen Duren personal foul (Victor Wembanyama draws the foul),personalfoul,52,ad36c3e8-4194-4e63-920f-7c50f46191a6,basketball_play,1772762214,311,True,2026-03-06 01:56:54+00:00,2,382.0,1058.0,17.633333333333333,192
3,66,quarter,2,ad36c3e8-4194-4e63-920f-7c50f46191a6,39,6:22,"Spurs lineup change (Devin Vassell, Keldon Johnson, Stephon Castle, Dylan Harper, Victor Wembanyama)",lineupchange,52,,basketball_play,1772762253,310,True,2026-03-06 01:57:33+00:00,2,382.0,1058.0,17.633333333333333,193
3,65,quarter,2,65569528-1888-40aa-9d62-2b0e8142a9b4,39,6:12,Jalen Duren shooting foul (Victor Wembanyama draws the foul),shootingfoul,52,ad36c3e8-4194-4e63-920f-7c50f46191a6,basketball_play,1772762253,309,True,2026-03-06 01:57:33+00:00,2,372.0,1068.0,17.8,194
3,64,quarter,2,ad36c3e8-4194-4e63-920f-7c50f46191a6,39,6:12,Victor Wembanyama makes regular free throw 1 of 2,freethrowmade,53,ad36c3e8-4194-4e63-920f-7c50f46191a6,basketball_play,1772762283,308,True,2026-03-06 01:58:03+00:00,2,372.0,1068.0,17.8,195
3,63,quarter,2,65569528-1888-40aa-9d62-2b0e8142a9b4,39,6:12,"Pistons lineup change (Kevin Huerter, Cade Cunningham, Javonte Green, Duncan Robinson, Isaiah Stewart)",lineupchange,53,,basketball_play,1772762307,307,True,2026-03-06 01:58:27+00:00,2,372.0,1068.0,17.8,196
3,62,quarter,2,ad36c3e8-4194-4e63-920f-7c50f46191a6,39,6:12,Victor Wembanyama makes regular free throw 2 of 2,freethrowmade,54,65569528-1888-40aa-9d62-2b0e8142a9b4,basketball_play,1772762307,306,True,2026-03-06 01:58:27+00:00,2,372.0,1068.0,17.8,197
3,61,quarter,2,65569528-1888-40aa-9d62-2b0e8142a9b4,39,5:56,Javonte Green misses three point jump shot,threepointmiss,54,,basketball_play,1772762328,305,True,2026-03-06 01:58:48+00:00,2,356.0,1084.0,18.066666666666666,198
3,60,quarter,2,65569528-1888-40aa-9d62-2b0e8142a9b4,39,5:50,Duncan Robinson offensive rebound,rebound,54,65569528-1888-40aa-9d62-2b0e8142a9b4,basketball_play,1772762334,304,True,2026-03-06 01:58:54+00:00,2,350.0,1090.0,18.166666666666668,199
3,59,quarter,2,65569528-1888-40aa-9d62-2b0e8142a9b4,41,5:50,Duncan Robinson makes two point tip layup,twopointmade,54,ad36c3e8-4194-4e63-920f-7c50f46191a6,basketball_play,1772762333,303,True,2026-03-06 01:58:53+00:00,2,350.0,1090.0,18.166666666666668,200
3,58,quarter,2,ad36c3e8-4194-4e63-920f-7c50f46191a6,41,5:39,Dylan Harper makes two point driving finger roll layup (Stephon Castle assists),twopointmade,56,65569528-1888-40aa-9d62-2b0e8142a9b4,basketball_play,1772762344,302,True,2026-03-06 01:59:04+00:00,2,339.0,1101.0,18.35,201
3,57,quarter,2,65569528-1888-40aa-9d62-2b0e8142a9b4,43,5:29,Cade Cunningham makes two point fadeaway jump shot,twopointmade,56,ad36c3e8-4194-4e63-920f-7c50f46191a6,basketball_play,1772762354,301,True,2026-03-06 01:59:14+00:00,2,329.0,1111.0,18.516666666666666,202
3,56,quarter,2,ad36c3e8-4194-4e63-920f-7c50f46191a6,43,5:10,Victor Wembanyama misses two point jump shot,twopointmiss,56,,basketball_play,1772762373,300,True,2026-03-06 01:59:33+00:00,2,310.0,1130.0,18.833333333333332,203
3,55,quarter,2,65569528-1888-40aa-9d62-2b0e8142a9b4,43,5:08,Kevin Huerter defensive rebound,rebound,56,65569528-1888-40aa-9d62-2b0e8142a9b4,basketball_play,1772762375,299,True,2026-03-06 01:59:35+00:00,2,308.0,1132.0,18.866666666666667,204
3,54,quarter,2,ad36c3e8-4194-4e63-920f-7c50f46191a6,43,5:08,Dylan Harper shooting foul (Javonte Green draws the foul),shootingfoul,56,65569528-1888-40aa-9d62-2b0e8142a9b4,basketball_play,1772762379,298,True,2026-03-06 01:59:39+00:00,2,308.0,1132.0,18.866666666666667,205
3,53,quarter,2,65569528-1888-40aa-9d62-2b0e8142a9b4,44,5:08,Javonte Green makes regular free throw 1 of 2,freethrowmade,56,65569528-1888-40aa-9d62-2b0e8142a9b4,basketball_play,1772762412,297,True,2026-03-06 02:00:12+00:00,2,308.0,1132.0,18.866666666666667,206
3,52,quarter,2,65569528-1888-40aa-9d62-2b0e8142a9b4,44,5:08,"Pistons lineup change (Kevin Huerter, Javonte Green, Duncan Robinson, Isaiah Stewart, Daniss Jenkins)",lineupchange,56,,basketball_play,1772762412,296,True,2026-03-06 02:00:12+00:00,2,308.0,1132.0,18.866666666666667,207
3,51,quarter,2,ad36c3e8-4194-4e63-920f-7c50f46191a6,44,5:08,"Spurs lineup change (Devin Vassell, De'Aaron Fox, Julian Champagnie, Keldon Johnson, Luke Kornet)",lineupchange,56,,basketball_play,1772762412,295,True,2026-03-06 02:00:12+00:00,2,308.0,1132.0,18.866666666666667,208
3,50,quarter,2,65569528-1888-40aa-9d62-2b0e8142a9b4,45,5:08,Javonte Green makes regular free throw 2 of 2,freethrowmade,56,ad36c3e8-4194-4e63-920f-7c50f46191a6,basketball_play,1772762444,294,True,2026-03-06 02:00:44+00:00,2,308.0,1132.0,18.866666666666667,209
3,49,quarter,2,ad36c3e8-4194-4e63-920f-7c50f46191a6,45,4:44,Keldon Johnson misses three point jump shot,threepointmiss,56,,basketball_play,1772762471,293,True,2026-03-06 02:01:11+00:00,2,284.0,1156.0,19.266666666666666,210
