period_index,event_index,period_type,period_number,attribution,away_points,clock,description,event_type,home_points,possession,type,wall_clock,pbp_source_row,has_wall_clock,event_ts_utc,period_sequence,game_clock_seconds_remaining,game_elapsed_seconds,game_elapsed_minutes,pbp_chronological_index
3,112,quarter,2,90381a35-42a6-4975-851f-175418e4271a,39,11:44,Evan Mobley makes two point cutting dunk (Max Strus assists),twopointmade,34,00c3e69d-d9b9-4ac3-bf79-19707fe43637,basketball_play,1774399425,359,True,2026-03-25 00:43:45+00:00,2,704.0,736.0,12.266666666666667,106
3,111,quarter,2,00c3e69d-d9b9-4ac3-bf79-19707fe43637,41,11:18,Jevon Carter makes two point pullup jump shot (Noah Penda assists),twopointmade,34,90381a35-42a6-4975-851f-175418e4271a,basketball_play,1774399451,358,True,2026-03-25 00:44:11+00:00,2,678.0,762.0,12.7,107
3,110,quarter,2,90381a35-42a6-4975-851f-175418e4271a,41,11:04,Dennis Schroder makes two point driving finger roll layup,twopointmade,36,00c3e69d-d9b9-4ac3-bf79-19707fe43637,basketball_play,1774399465,357,True,2026-03-25 00:44:25+00:00,2,664.0,776.0,12.933333333333334,108
3,109,quarter,2,00c3e69d-d9b9-4ac3-bf79-19707fe43637,41,10:43,Jevon Carter misses three point stepback jump shot,threepointmiss,36,,basketball_play,1774399486,356,True,2026-03-25 00:44:46+00:00,2,643.0,797.0,13.283333333333333,109
3,108,quarter,2,00c3e69d-d9b9-4ac3-bf79-19707fe43637,41,10:43,Magic offensive rebound,rebound,36,00c3e69d-d9b9-4ac3-bf79-19707fe43637,basketball_play,1774399486,355,True,2026-03-25 00:44:46+00:00,2,643.0,797.0,13.283333333333333,110
3,107,quarter,2,90381a35-42a6-4975-851f-175418e4271a,41,10:43,Thomas Bryant personal foul (Loose ball) (Goga Bitadze draws the foul),personalfoul,36,00c3e69d-d9b9-4ac3-bf79-19707fe43637,basketball_play,1774399494,354,True,2026-03-25 00:44:54+00:00,2,643.0,797.0,13.283333333333333,111
3,106,quarter,2,00c3e69d-d9b9-4ac3-bf79-19707fe43637,41,10:38,Noah Penda turnover (bad pass) (Thomas Bryant steals),turnover,36,90381a35-42a6-4975-851f-175418e4271a,basketball_play,1774399513,353,True,2026-03-25 00:45:13+00:00,2,638.0,802.0,13.366666666666667,112
3,105,quarter,2,00c3e69d-d9b9-4ac3-bf79-19707fe43637,41,10:38,Desmond Bane personal foul (Thomas Bryant draws the foul),personalfoul,36,90381a35-42a6-4975-851f-175418e4271a,basketball_play,1774399518,352,True,2026-03-25 00:45:18+00:00,2,638.0,802.0,13.366666666666667,113
3,104,quarter,2,90381a35-42a6-4975-851f-175418e4271a,41,10:26,Thomas Bryant makes two point cutting dunk (Donovan Mitchell assists),twopointmade,38,00c3e69d-d9b9-4ac3-bf79-19707fe43637,basketball_play,1774399545,351,True,2026-03-25 00:45:45+00:00,2,626.0,814.0,13.566666666666666,114
3,103,quarter,2,00c3e69d-d9b9-4ac3-bf79-19707fe43637,41,10:26,Goga Bitadze shooting foul (Thomas Bryant draws the foul),shootingfoul,38,90381a35-42a6-4975-851f-175418e4271a,basketball_play,1774399547,350,True,2026-03-25 00:45:47+00:00,2,626.0,814.0,13.566666666666666,115
3,102,quarter,2,00c3e69d-d9b9-4ac3-bf79-19707fe43637,41,10:26,"Magic lineup change (Desmond Bane, Noah Penda, Jett Howard, Jevon Carter, Wendell Carter Jr.)",lineupchange,38,,basketball_play,1774399582,349,True,2026-03-25 00:46:22+00:00,2,626.0,814.0,13.566666666666666,116
3,101,quarter,2,90381a35-42a6-4975-851f-175418e4271a,41,10:26,Thomas Bryant makes regular free throw 1 of 1,freethrowmade,39,,basketball_play,1774399582,348,True,2026-03-25 00:46:22+00:00,2,626.0,814.0,13.566666666666666,117
3,100,quarter,2,00c3e69d-d9b9-4ac3-bf79-19707fe43637,41,10:05,Noah Penda misses three point jump shot,threepointmiss,39,,basketball_play,1774399604,347,True,2026-03-25 00:46:44+00:00,2,605.0,835.0,13.916666666666666,118
3,99,quarter,2,00c3e69d-d9b9-4ac3-bf79-19707fe43637,41,10:02,Wendell Carter Jr. offensive rebound,rebound,39,00c3e69d-d9b9-4ac3-bf79-19707fe43637,basketball_play,1774399608,346,True,2026-03-25 00:46:48+00:00,2,602.0,838.0,13.966666666666667,119
3,98,quarter,2,00c3e69d-d9b9-4ac3-bf79-19707fe43637,41,10:01,Magic turnover (shot clock violation),turnover,39,90381a35-42a6-4975-851f-175418e4271a,basketball_play,1774399611,345,True,2026-03-25 00:46:51+00:00,2,601.0,839.0,13.983333333333333,120
3,97,quarter,2,90381a35-42a6-4975-851f-175418e4271a,41,9:52,Thomas Bryant makes two point cutting dunk (Evan Mobley assists),twopointmade,41,00c3e69d-d9b9-4ac3-bf79-19707fe43637,basketball_play,1774399617,344,True,2026-03-25 00:46:57+00:00,2,592.0,848.0,14.133333333333333,121
3,96,quarter,2,00c3e69d-d9b9-4ac3-bf79-19707fe43637,41,9:41,Jevon Carter misses three point jump shot,threepointmiss,41,,basketball_play,1774399627,343,True,2026-03-25 00:47:07+00:00,2,581.0,859.0,14.316666666666666,122
3,95,quarter,2,90381a35-42a6-4975-851f-175418e4271a,41,9:41,Cavaliers defensive rebound,rebound,41,90381a35-42a6-4975-851f-175418e4271a,basketball_play,1774399627,342,True,2026-03-25 00:47:07+00:00,2,581.0,859.0,14.316666666666666,123
3,94,quarter,2,00c3e69d-d9b9-4ac3-bf79-19707fe43637,41,9:41,Noah Penda personal foul (Loose ball) (Evan Mobley draws the foul),personalfoul,41,90381a35-42a6-4975-851f-175418e4271a,basketball_play,1774399640,341,True,2026-03-25 00:47:20+00:00,2,581.0,859.0,14.316666666666666,124
3,93,quarter,2,90381a35-42a6-4975-851f-175418e4271a,41,9:41,"Cavaliers lineup change (Dennis Schroder, Donovan Mitchell, James Harden, Nae'Qwan Tomlin, Evan Mobley)",lineupchange,41,,basketball_play,1774399651,340,True,2026-03-25 00:47:31+00:00,2,581.0,859.0,14.316666666666666,125
3,92,quarter,2,90381a35-42a6-4975-851f-175418e4271a,41,9:27,Donovan Mitchell misses three point jump shot,threepointmiss,41,,basketball_play,1774399672,339,True,2026-03-25 00:47:52+00:00,2,567.0,873.0,14.55,126
3,91,quarter,2,00c3e69d-d9b9-4ac3-bf79-19707fe43637,41,9:23,Jevon Carter defensive rebound,rebound,41,00c3e69d-d9b9-4ac3-bf79-19707fe43637,basketball_play,1774399674,338,True,2026-03-25 00:47:54+00:00,2,563.0,877.0,14.616666666666667,127
3,90,quarter,2,,41,9:19,Stoppage (Out of bounds),stoppage,41,,basketball_play,1774399688,337,True,2026-03-25 00:48:08+00:00,2,559.0,881.0,14.683333333333334,128
3,89,quarter,2,00c3e69d-d9b9-4ac3-bf79-19707fe43637,41,9:19,"Magic lineup change (Desmond Bane, Jett Howard, Jevon Carter, Wendell Carter Jr., Paolo Banchero)",lineupchange,41,,basketball_play,1774399705,336,True,2026-03-25 00:48:25+00:00,2,559.0,881.0,14.683333333333334,129
3,88,quarter,2,00c3e69d-d9b9-4ac3-bf79-19707fe43637,44,9:13,Jevon Carter makes three point jump shot (Jett Howard assists),threepointmade,41,90381a35-42a6-4975-851f-175418e4271a,basketball_play,1774399705,335,True,2026-03-25 00:48:25+00:00,2,553.0,887.0,14.783333333333333,130
3,87,quarter,2,90381a35-42a6-4975-851f-175418e4271a,44,8:57,Donovan Mitchell makes two point driving layup,twopointmade,43,00c3e69d-d9b9-4ac3-bf79-19707fe43637,basketball_play,1774399722,334,True,2026-03-25 00:48:42+00:00,2,537.0,903.0,15.05,131
3,86,quarter,2,00c3e69d-d9b9-4ac3-bf79-19707fe43637,44,8:47,Wendell Carter Jr. misses three point jump shot,threepointmiss,43,,basketball_play,1774399739,333,True,2026-03-25 00:48:59+00:00,2,527.0,913.0,15.216666666666667,132
3,85,quarter,2,90381a35-42a6-4975-851f-175418e4271a,44,8:44,Donovan Mitchell defensive rebound,rebound,43,90381a35-42a6-4975-851f-175418e4271a,basketball_play,1774399742,332,True,2026-03-25 00:49:02+00:00,2,524.0,916.0,15.266666666666667,133
3,84,quarter,2,90381a35-42a6-4975-851f-175418e4271a,44,8:37,Donovan Mitchell turnover (bad pass) (Jevon Carter steals),turnover,43,00c3e69d-d9b9-4ac3-bf79-19707fe43637,basketball_play,1774399748,331,True,2026-03-25 00:49:08+00:00,2,517.0,923.0,15.383333333333333,134
3,83,quarter,2,00c3e69d-d9b9-4ac3-bf79-19707fe43637,46,8:32,Desmond Bane makes two point running layup (Jevon Carter assists),twopointmade,43,90381a35-42a6-4975-851f-175418e4271a,basketball_play,1774399753,330,True,2026-03-25 00:49:13+00:00,2,512.0,928.0,15.466666666666667,135
3,82,quarter,2,90381a35-42a6-4975-851f-175418e4271a,46,8:18,Donovan Mitchell makes three point jump shot (Evan Mobley assists),threepointmade,46,00c3e69d-d9b9-4ac3-bf79-19707fe43637,basketball_play,1774399767,329,True,2026-03-25 00:49:27+00:00,2,498.0,942.0,15.7,136
3,81,quarter,2,90381a35-42a6-4975-851f-175418e4271a,46,7:58,Cavaliers technical foul (Defensive three second),technicalfoulnonunsportsmanlike,46,00c3e69d-d9b9-4ac3-bf79-19707fe43637,basketball_play,1774399796,328,True,2026-03-25 00:49:56+00:00,2,478.0,962.0,16.033333333333335,137
3,80,quarter,2,00c3e69d-d9b9-4ac3-bf79-19707fe43637,47,7:58,Desmond Bane makes technical free throw 1 of 1,freethrowmade,46,,basketball_play,1774399832,327,True,2026-03-25 00:50:32+00:00,2,478.0,962.0,16.033333333333335,138
3,79,quarter,2,00c3e69d-d9b9-4ac3-bf79-19707fe43637,47,7:58,"Magic lineup change (Tristan da Silva, Jett Howard, Jevon Carter, Wendell Carter Jr., Paolo Banchero)",lineupchange,46,,basketball_play,1774399835,326,True,2026-03-25 00:50:35+00:00,2,478.0,962.0,16.033333333333335,139
3,78,quarter,2,90381a35-42a6-4975-851f-175418e4271a,47,7:58,"Cavaliers lineup change (James Harden, Nae'Qwan Tomlin, Dean Wade, Keon Ellis, Sam Merrill)",lineupchange,46,,basketball_play,1774399835,325,True,2026-03-25 00:50:35+00:00,2,478.0,962.0,16.033333333333335,140
3,77,quarter,2,00c3e69d-d9b9-4ac3-bf79-19707fe43637,47,7:58,"Magic lineup change (Desmond Bane, Noah Penda, Jett Howard, Jevon Carter, Wendell Carter Jr.)",lineupchange,46,,basketball_play,1774399857,324,True,2026-03-25 00:50:57+00:00,2,478.0,962.0,16.033333333333335,141
3,76,quarter,2,90381a35-42a6-4975-851f-175418e4271a,47,7:58,"Cavaliers lineup change (Dennis Schroder, Donovan Mitchell, Thomas Bryant, Evan Mobley, Max Strus)",lineupchange,46,,basketball_play,1774399857,323,True,2026-03-25 00:50:57+00:00,2,478.0,962.0,16.033333333333335,142
3,75,quarter,2,,47,7:58,Instant replay,review,46,,basketball_play,1774399857,322,True,2026-03-25 00:50:57+00:00,2,478.0,962.0,16.033333333333335,143
3,74,quarter,2,00c3e69d-d9b9-4ac3-bf79-19707fe43637,47,7:58,"Magic lineup change (Tristan da Silva, Jett Howard, Jevon Carter, Wendell Carter Jr., Paolo Banchero)",lineupchange,46,,basketball_play,1774399880,321,True,2026-03-25 00:51:20+00:00,2,478.0,962.0,16.033333333333335,144
3,73,quarter,2,90381a35-42a6-4975-851f-175418e4271a,47,7:58,"Cavaliers lineup change (James Harden, Nae'Qwan Tomlin, Dean Wade, Keon Ellis, Sam Merrill)",lineupchange,46,,basketball_play,1774399880,320,True,2026-03-25 00:51:20+00:00,2,478.0,962.0,16.033333333333335,145
3,72,quarter,2,00c3e69d-d9b9-4ac3-bf79-19707fe43637,47,7:48,Paolo Banchero turnover (double dribble),turnover,46,90381a35-42a6-4975-851f-175418e4271a,basketball_play,1774399880,319,True,2026-03-25 00:51:20+00:00,2,468.0,972.0,16.2,146
3,71,quarter,2,90381a35-42a6-4975-851f-175418e4271a,47,7:34,James Harden makes three point stepback jump shot,threepointmade,49,00c3e69d-d9b9-4ac3-bf79-19707fe43637,basketball_play,1774399902,318,True,2026-03-25 00:51:42+00:00,2,454.0,986.0,16.433333333333334,147
3,70,quarter,2,00c3e69d-d9b9-4ac3-bf79-19707fe43637,47,7:15,Paolo Banchero misses two point driving floating jump shot,twopointmiss,49,,basketball_play,1774399921,317,True,2026-03-25 00:52:01+00:00,2,435.0,1005.0,16.75,148
3,69,quarter,2,90381a35-42a6-4975-851f-175418e4271a,47,7:12,Sam Merrill defensive rebound,rebound,49,90381a35-42a6-4975-851f-175418e4271a,basketball_play,1774399924,316,True,2026-03-25 00:52:04+00:00,2,432.0,1008.0,16.8,149
3,68,quarter,2,90381a35-42a6-4975-851f-175418e4271a,47,7:05,James Harden turnover (bad pass) (Wendell Carter Jr. steals),turnover,49,00c3e69d-d9b9-4ac3-bf79-19707fe43637,basketball_play,1774399936,315,True,2026-03-25 00:52:16+00:00,2,425.0,1015.0,16.916666666666668,150
3,67,quarter,2,00c3e69d-d9b9-4ac3-bf79-19707fe43637,47,6:56,Wendell Carter Jr. misses three point jump shot,threepointmiss,49,,basketball_play,1774399940,314,True,2026-03-25 00:52:20+00:00,2,416.0,1024.0,17.066666666666666,151
3,66,quarter,2,90381a35-42a6-4975-851f-175418e4271a,47,6:53,Sam Merrill defensive rebound,rebound,49,90381a35-42a6-4975-851f-175418e4271a,basketball_play,1774399943,313,True,2026-03-25 00:52:23+00:00,2,413.0,1027.0,17.116666666666667,152
3,65,quarter,2,90381a35-42a6-4975-851f-175418e4271a,47,6:42,James Harden makes three point stepback jump shot,threepointmade,52,00c3e69d-d9b9-4ac3-bf79-19707fe43637,basketball_play,1774399954,312,True,2026-03-25 00:52:34+00:00,2,402.0,1038.0,17.3,153
3,64,quarter,2,00c3e69d-d9b9-4ac3-bf79-19707fe43637,47,6:42,Magic 60 second timeout,teamtimeout,52,,basketball_play,1774399963,311,True,2026-03-25 00:52:43+00:00,2,402.0,1038.0,17.3,154
3,63,quarter,2,00c3e69d-d9b9-4ac3-bf79-19707fe43637,47,6:42,"Magic lineup change (Tristan da Silva, Jevon Carter, Wendell Carter Jr., Jamal Cain, Paolo Banchero)",lineupchange,52,,basketball_play,1774400187,310,True,2026-03-25 00:56:27+00:00,2,402.0,1038.0,17.3,155
3,62,quarter,2,00c3e69d-d9b9-4ac3-bf79-19707fe43637,47,6:21,Nae'Qwan Tomlin blocks Jamal Cain's two point driving layup,twopointmiss,52,,basketball_play,1774400187,309,True,2026-03-25 00:56:27+00:00,2,381.0,1059.0,17.65,156
3,61,quarter,2,90381a35-42a6-4975-851f-175418e4271a,47,6:17,Keon Ellis defensive rebound,rebound,52,90381a35-42a6-4975-851f-175418e4271a,basketball_play,1774400191,308,True,2026-03-25 00:56:31+00:00,2,377.0,1063.0,17.716666666666665,157
3,60,quarter,2,90381a35-42a6-4975-851f-175418e4271a,47,6:16,James Harden misses three point running pullup jump shot,threepointmiss,52,,basketball_play,1774400193,307,True,2026-03-25 00:56:33+00:00,2,376.0,1064.0,17.733333333333334,158
3,59,quarter,2,00c3e69d-d9b9-4ac3-bf79-19707fe43637,47,6:13,Tristan da Silva defensive rebound,rebound,52,00c3e69d-d9b9-4ac3-bf79-19707fe43637,basketball_play,1774400196,306,True,2026-03-25 00:56:36+00:00,2,373.0,1067.0,17.783333333333335,159
3,58,quarter,2,00c3e69d-d9b9-4ac3-bf79-19707fe43637,49,6:10,Jamal Cain makes two point running dunk (Tristan da Silva assists),twopointmade,52,90381a35-42a6-4975-851f-175418e4271a,basketball_play,1774400199,305,True,2026-03-25 00:56:39+00:00,2,370.0,1070.0,17.833333333333332,160
3,57,quarter,2,,49,5:55,Stoppage (Out of bounds),stoppage,52,,basketball_play,1774400216,304,True,2026-03-25 00:56:56+00:00,2,355.0,1085.0,18.083333333333332,161
3,56,quarter,2,90381a35-42a6-4975-851f-175418e4271a,49,5:52,Sam Merrill makes two point cutting layup (James Harden assists),twopointmade,54,00c3e69d-d9b9-4ac3-bf79-19707fe43637,basketball_play,1774400229,303,True,2026-03-25 00:57:09+00:00,2,352.0,1088.0,18.133333333333333,162
3,55,quarter,2,00c3e69d-d9b9-4ac3-bf79-19707fe43637,51,5:31,Jevon Carter makes two point pullup jump shot (Jamal Cain assists),twopointmade,54,90381a35-42a6-4975-851f-175418e4271a,basketball_play,1774400250,302,True,2026-03-25 00:57:30+00:00,2,331.0,1109.0,18.483333333333334,163
3,54,quarter,2,90381a35-42a6-4975-851f-175418e4271a,51,5:18,Sam Merrill makes three point jump shot (James Harden assists),threepointmade,57,00c3e69d-d9b9-4ac3-bf79-19707fe43637,basketball_play,1774400262,301,True,2026-03-25 00:57:42+00:00,2,318.0,1122.0,18.7,164
3,53,quarter,2,90381a35-42a6-4975-851f-175418e4271a,51,5:06,Sam Merrill shooting foul (Paolo Banchero draws the foul),shootingfoul,57,00c3e69d-d9b9-4ac3-bf79-19707fe43637,basketball_play,1774400277,300,True,2026-03-25 00:57:57+00:00,2,306.0,1134.0,18.9,165
3,52,quarter,2,00c3e69d-d9b9-4ac3-bf79-19707fe43637,52,5:06,Paolo Banchero makes regular free throw 1 of 2,freethrowmade,57,00c3e69d-d9b9-4ac3-bf79-19707fe43637,basketball_play,1774400314,299,True,2026-03-25 00:58:34+00:00,2,306.0,1134.0,18.9,166
3,51,quarter,2,00c3e69d-d9b9-4ac3-bf79-19707fe43637,52,5:06,"Magic lineup change (Tristan da Silva, Desmond Bane, Wendell Carter Jr., Jamal Cain, Paolo Banchero)",lineupchange,57,,basketball_play,1774400333,298,True,2026-03-25 00:58:53+00:00,2,306.0,1134.0,18.9,167
3,50,quarter,2,00c3e69d-d9b9-4ac3-bf79-19707fe43637,52,5:06,Paolo Banchero misses regular free throw 2 of 2,freethrowmiss,57,,basketball_play,1774400333,297,True,2026-03-25 00:58:53+00:00,2,306.0,1134.0,18.9,168
3,49,quarter,2,90381a35-42a6-4975-851f-175418e4271a,52,5:03,Nae'Qwan Tomlin defensive rebound,rebound,57,90381a35-42a6-4975-851f-175418e4271a,basketball_play,1774400334,296,True,2026-03-25 00:58:54+00:00,2,303.0,1137.0,18.95,169
3,48,quarter,2,90381a35-42a6-4975-851f-175418e4271a,52,4:40,Dean Wade misses two point driving floating jump shot,twopointmiss,57,,basketball_play,1774400358,295,True,2026-03-25 00:59:18+00:00,2,280.0,1160.0,19.333333333333332,170
3,47,quarter,2,00c3e69d-d9b9-4ac3-bf79-19707fe43637,52,4:37,Desmond Bane defensive rebound,rebound,57,00c3e69d-d9b9-4ac3-bf79-19707fe43637,basketball_play,1774400361,294,True,2026-03-25 00:59:21+00:00,2,277.0,1163.0,19.383333333333333,171
3,46,quarter,2,00c3e69d-d9b9-4ac3-bf79-19707fe43637,52,4:33,Tristan da Silva misses two point running pullup jump shot,twopointmiss,57,,basketball_play,1774400364,293,True,2026-03-25 00:59:24+00:00,2,273.0,1167.0,19.45,172
3,45,quarter,2,00c3e69d-d9b9-4ac3-bf79-19707fe43637,52,4:33,Tristan da Silva offensive rebound,rebound,57,00c3e69d-d9b9-4ac3-bf79-19707fe43637,basketball_play,1774400364,292,True,2026-03-25 00:59:24+00:00,2,273.0,1167.0,19.45,173
3,44,quarter,2,00c3e69d-d9b9-4ac3-bf79-19707fe43637,54,4:28,Tristan da Silva makes two point putback layup,twopointmade,57,90381a35-42a6-4975-851f-175418e4271a,basketball_play,1774400369,291,True,2026-03-25 00:59:29+00:00,2,268.0,1172.0,19.533333333333335,174
3,43,quarter,2,90381a35-42a6-4975-851f-175418e4271a,54,4:14,James Harden makes two point stepback jump shot,twopointmade,59,00c3e69d-d9b9-4ac3-bf79-19707fe43637,basketball_play,1774400383,290,True,2026-03-25 00:59:43+00:00,2,254.0,1186.0,19.766666666666666,175
3,42,quarter,2,00c3e69d-d9b9-4ac3-bf79-19707fe43637,54,4:00,James Harden blocks Paolo Banchero's two point driving layup,twopointmiss,59,,basketball_play,1774400409,289,True,2026-03-25 01:00:09+00:00,2,240.0,1200.0,20.0,176
3,41,quarter,2,90381a35-42a6-4975-851f-175418e4271a,54,4:00,Sam Merrill defensive rebound,rebound,59,90381a35-42a6-4975-851f-175418e4271a,basketball_play,1774400409,288,True,2026-03-25 01:00:09+00:00,2,240.0,1200.0,20.0,177
3,40,quarter,2,90381a35-42a6-4975-851f-175418e4271a,54,3:37,James Harden misses two point stepback jump shot,twopointmiss,59,,basketball_play,1774400420,287,True,2026-03-25 01:00:20+00:00,2,217.0,1223.0,20.383333333333333,178
3,39,quarter,2,00c3e69d-d9b9-4ac3-bf79-19707fe43637,54,3:35,Paolo Banchero defensive rebound,rebound,59,00c3e69d-d9b9-4ac3-bf79-19707fe43637,basketball_play,1774400422,286,True,2026-03-25 01:00:22+00:00,2,215.0,1225.0,20.416666666666668,179
3,38,quarter,2,00c3e69d-d9b9-4ac3-bf79-19707fe43637,56,3:29,Desmond Bane makes two point driving layup (Paolo Banchero assists),twopointmade,59,90381a35-42a6-4975-851f-175418e4271a,basketball_play,1774400428,285,True,2026-03-25 01:00:28+00:00,2,209.0,1231.0,20.516666666666666,180
3,37,quarter,2,90381a35-42a6-4975-851f-175418e4271a,56,3:29,Cavaliers 60 second timeout,teamtimeout,59,,basketball_play,1774400435,284,True,2026-03-25 01:00:35+00:00,2,209.0,1231.0,20.516666666666666,181
3,36,quarter,2,90381a35-42a6-4975-851f-175418e4271a,56,3:29,"Cavaliers lineup change (Donovan Mitchell, James Harden, Evan Mobley, Sam Merrill, Max Strus)",lineupchange,59,,basketball_play,1774400445,283,True,2026-03-25 01:00:45+00:00,2,209.0,1231.0,20.516666666666666,182
3,35,quarter,2,90381a35-42a6-4975-851f-175418e4271a,56,3:16,Evan Mobley makes two point cutting dunk (James Harden assists),twopointmade,61,00c3e69d-d9b9-4ac3-bf79-19707fe43637,basketball_play,1774400652,282,True,2026-03-25 01:04:12+00:00,2,196.0,1244.0,20.733333333333334,183
3,34,quarter,2,00c3e69d-d9b9-4ac3-bf79-19707fe43637,58,2:58,Wendell Carter Jr. makes two point turnaround bank hook shot (Paolo Banchero assists),twopointmade,61,90381a35-42a6-4975-851f-175418e4271a,basketball_play,1774400670,281,True,2026-03-25 01:04:30+00:00,2,178.0,1262.0,21.033333333333335,184
3,33,quarter,2,90381a35-42a6-4975-851f-175418e4271a,58,2:39,Sam Merrill makes three point pullup jump shot (Evan Mobley assists),threepointmade,64,00c3e69d-d9b9-4ac3-bf79-19707fe43637,basketball_play,1774400689,280,True,2026-03-25 01:04:49+00:00,2,159.0,1281.0,21.35,185
3,32,quarter,2,90381a35-42a6-4975-851f-175418e4271a,58,2:23,Donovan Mitchell shooting foul (Paolo Banchero draws the foul),shootingfoul,64,00c3e69d-d9b9-4ac3-bf79-19707fe43637,basketball_play,1774400708,279,True,2026-03-25 01:05:08+00:00,2,143.0,1297.0,21.616666666666667,186
3,31,quarter,2,00c3e69d-d9b9-4ac3-bf79-19707fe43637,59,2:23,Paolo Banchero makes regular free throw 1 of 2,freethrowmade,64,00c3e69d-d9b9-4ac3-bf79-19707fe43637,basketball_play,1774400738,278,True,2026-03-25 01:05:38+00:00,2,143.0,1297.0,21.616666666666667,187
3,30,quarter,2,00c3e69d-d9b9-4ac3-bf79-19707fe43637,60,2:23,Paolo Banchero makes regular free throw 2 of 2,freethrowmade,64,90381a35-42a6-4975-851f-175418e4271a,basketball_play,1774400754,277,True,2026-03-25 01:05:54+00:00,2,143.0,1297.0,21.616666666666667,188
3,29,quarter,2,00c3e69d-d9b9-4ac3-bf79-19707fe43637,60,2:14,Wendell Carter Jr. personal foul (Evan Mobley draws the foul),personalfoul,64,90381a35-42a6-4975-851f-175418e4271a,basketball_play,1774400769,276,True,2026-03-25 01:06:09+00:00,2,134.0,1306.0,21.766666666666666,189
3,28,quarter,2,90381a35-42a6-4975-851f-175418e4271a,60,2:01,Evan Mobley turnover (lost ball) (Desmond Bane steals),turnover,64,00c3e69d-d9b9-4ac3-bf79-19707fe43637,basketball_play,1774400803,275,True,2026-03-25 01:06:43+00:00,2,121.0,1319.0,21.983333333333334,190
3,27,quarter,2,00c3e69d-d9b9-4ac3-bf79-19707fe43637,60,1:54,Paolo Banchero misses three point running pullup jump shot,threepointmiss,64,,basketball_play,1774400809,274,True,2026-03-25 01:06:49+00:00,2,114.0,1326.0,22.1,191
3,26,quarter,2,00c3e69d-d9b9-4ac3-bf79-19707fe43637,60,1:52,Jamal Cain offensive rebound,rebound,64,00c3e69d-d9b9-4ac3-bf79-19707fe43637,basketball_play,1774400812,273,True,2026-03-25 01:06:52+00:00,2,112.0,1328.0,22.133333333333333,192
3,25,quarter,2,00c3e69d-d9b9-4ac3-bf79-19707fe43637,60,1:46,Desmond Bane misses two point driving reverse layup,twopointmiss,64,,basketball_play,1774400818,272,True,2026-03-25 01:06:58+00:00,2,106.0,1334.0,22.233333333333334,193
3,24,quarter,2,00c3e69d-d9b9-4ac3-bf79-19707fe43637,60,1:43,Wendell Carter Jr. offensive rebound,rebound,64,00c3e69d-d9b9-4ac3-bf79-19707fe43637,basketball_play,1774400821,271,True,2026-03-25 01:07:01+00:00,2,103.0,1337.0,22.283333333333335,194
3,23,quarter,2,00c3e69d-d9b9-4ac3-bf79-19707fe43637,62,1:41,Wendell Carter Jr. makes two point putback layup,twopointmade,64,90381a35-42a6-4975-851f-175418e4271a,basketball_play,1774400822,270,True,2026-03-25 01:07:02+00:00,2,101.0,1339.0,22.316666666666666,195
3,22,quarter,2,90381a35-42a6-4975-851f-175418e4271a,62,1:27,Donovan Mitchell misses two point turnaround fadeaway jump shot,twopointmiss,64,,basketball_play,1774400837,269,True,2026-03-25 01:07:17+00:00,2,87.0,1353.0,22.55,196
3,21,quarter,2,00c3e69d-d9b9-4ac3-bf79-19707fe43637,62,1:25,Paolo Banchero defensive rebound,rebound,64,00c3e69d-d9b9-4ac3-bf79-19707fe43637,basketball_play,1774400839,268,True,2026-03-25 01:07:19+00:00,2,85.0,1355.0,22.583333333333332,197
3,20,quarter,2,90381a35-42a6-4975-851f-175418e4271a,62,1:15,Donovan Mitchell shooting foul (Desmond Bane draws the foul),shootingfoul,64,00c3e69d-d9b9-4ac3-bf79-19707fe43637,basketball_play,1774400854,267,True,2026-03-25 01:07:34+00:00,2,75.0,1365.0,22.75,198
3,19,quarter,2,00c3e69d-d9b9-4ac3-bf79-19707fe43637,63,1:15,Desmond Bane makes regular free throw 1 of 2,freethrowmade,64,00c3e69d-d9b9-4ac3-bf79-19707fe43637,basketball_play,1774400874,266,True,2026-03-25 01:07:54+00:00,2,75.0,1365.0,22.75,199
3,18,quarter,2,00c3e69d-d9b9-4ac3-bf79-19707fe43637,64,1:15,Desmond Bane makes regular free throw 2 of 2,freethrowmade,64,90381a35-42a6-4975-851f-175418e4271a,basketball_play,1774400892,265,True,2026-03-25 01:08:12+00:00,2,75.0,1365.0,22.75,200
3,17,quarter,2,90381a35-42a6-4975-851f-175418e4271a,64,00:59.50,Sam Merrill misses two point pullup bank jump shot,twopointmiss,64,,basketball_play,1774400910,264,True,2026-03-25 01:08:30+00:00,2,59.5,1380.5,23.008333333333333,201
3,16,quarter,2,90381a35-42a6-4975-851f-175418e4271a,64,00:59.50,Evan Mobley offensive rebound,rebound,64,90381a35-42a6-4975-851f-175418e4271a,basketball_play,1774400910,263,True,2026-03-25 01:08:30+00:00,2,59.5,1380.5,23.008333333333333,202
3,15,quarter,2,90381a35-42a6-4975-851f-175418e4271a,64,00:56.10,Evan Mobley makes two point tip dunk,twopointmade,66,00c3e69d-d9b9-4ac3-bf79-19707fe43637,basketball_play,1774400916,262,True,2026-03-25 01:08:36+00:00,2,56.1,1383.9,23.065,203
3,14,quarter,2,00c3e69d-d9b9-4ac3-bf79-19707fe43637,64,00:38.80,Tristan da Silva misses two point turnaround hook shot,twopointmiss,66,,basketball_play,1774400934,261,True,2026-03-25 01:08:54+00:00,2,38.8,1401.2,23.353333333333335,204
3,13,quarter,2,90381a35-42a6-4975-851f-175418e4271a,64,00:37.70,Evan Mobley defensive rebound,rebound,66,90381a35-42a6-4975-851f-175418e4271a,basketball_play,1774400935,260,True,2026-03-25 01:08:55+00:00,2,37.7,1402.3,23.371666666666666,205
3,12,quarter,2,90381a35-42a6-4975-851f-175418e4271a,64,00:36.90,Evan Mobley turnover (lost ball),turnover,66,00c3e69d-d9b9-4ac3-bf79-19707fe43637,basketball_play,1774400947,259,True,2026-03-25 01:09:07+00:00,2,36.9,1403.1,23.384999999999998,206
3,11,quarter,2,90381a35-42a6-4975-851f-175418e4271a,64,00:36.70,James Harden personal foul (Loose ball) (Jamal Cain draws the foul),personalfoul,66,00c3e69d-d9b9-4ac3-bf79-19707fe43637,basketball_play,1774400960,258,True,2026-03-25 01:09:20+00:00,2,36.7,1403.3,23.388333333333332,207
3,10,quarter,2,00c3e69d-d9b9-4ac3-bf79-19707fe43637,65,00:36.70,Jamal Cain makes regular free throw 1 of 2,freethrowmade,66,00c3e69d-d9b9-4ac3-bf79-19707fe43637,basketball_play,1774400976,257,True,2026-03-25 01:09:36+00:00,2,36.7,1403.3,23.388333333333332,208
