period_index,event_index,period_type,period_number,attribution,away_points,clock,description,event_type,home_points,possession,type,wall_clock,pbp_source_row,has_wall_clock,event_ts_utc,period_sequence,game_clock_seconds_remaining,game_elapsed_seconds,game_elapsed_minutes,pbp_chronological_index
4,102,quarter,1,00c3e69d-d9b9-4ac3-bf79-19707fe43637,0,12:00,"Magic lineup change (Tristan da Silva, Desmond Bane, Wendell Carter Jr., Jamal Cain, Paolo Banchero)",lineupchange,0,,basketball_play,1774397561,464,True,2026-03-25 00:12:41+00:00,1,720.0,0.0,0.0,1
4,101,quarter,1,90381a35-42a6-4975-851f-175418e4271a,0,12:00,"Cavaliers lineup change (Donovan Mitchell, James Harden, Dean Wade, Evan Mobley, Sam Merrill)",lineupchange,0,,basketball_play,1774397561,463,True,2026-03-25 00:12:41+00:00,1,720.0,0.0,0.0,2
4,100,quarter,1,,0,12:00,Start of 1st Quarter,startperiod,0,,basketball_play,1774397561,462,True,2026-03-25 00:12:41+00:00,1,720.0,0.0,0.0,3
4,99,quarter,1,00c3e69d-d9b9-4ac3-bf79-19707fe43637,0,12:00,Wendell Carter Jr. vs. Evan Mobley (Tristan da Silva gains possession),opentip,0,00c3e69d-d9b9-4ac3-bf79-19707fe43637,basketball_play,1774397565,461,True,2026-03-25 00:12:45+00:00,1,720.0,0.0,0.0,4
4,98,quarter,1,00c3e69d-d9b9-4ac3-bf79-19707fe43637,3,11:46,Desmond Bane makes three point stepback jump shot (Jamal Cain assists),threepointmade,0,90381a35-42a6-4975-851f-175418e4271a,basketball_play,1774397574,460,True,2026-03-25 00:12:54+00:00,1,706.0,14.0,0.23333333333333334,5
4,97,quarter,1,,3,11:30,Stoppage (Out of bounds),stoppage,0,,basketball_play,1774397592,459,True,2026-03-25 00:13:12+00:00,1,690.0,30.0,0.5,6
4,96,quarter,1,90381a35-42a6-4975-851f-175418e4271a,3,11:22,Donovan Mitchell misses two point turnaround jump shot,twopointmiss,0,,basketball_play,1774397637,458,True,2026-03-25 00:13:57+00:00,1,682.0,38.0,0.6333333333333333,7
4,95,quarter,1,00c3e69d-d9b9-4ac3-bf79-19707fe43637,3,11:19,Wendell Carter Jr. defensive rebound,rebound,0,00c3e69d-d9b9-4ac3-bf79-19707fe43637,basketball_play,1774397640,457,True,2026-03-25 00:14:00+00:00,1,679.0,41.0,0.6833333333333333,8
4,94,quarter,1,00c3e69d-d9b9-4ac3-bf79-19707fe43637,5,11:04,Paolo Banchero makes two point turnaround fadeaway jump shot,twopointmade,0,90381a35-42a6-4975-851f-175418e4271a,basketball_play,1774397655,456,True,2026-03-25 00:14:15+00:00,1,664.0,56.0,0.9333333333333333,9
4,93,quarter,1,90381a35-42a6-4975-851f-175418e4271a,5,10:46,Evan Mobley makes two point turnaround jump shot,twopointmade,2,00c3e69d-d9b9-4ac3-bf79-19707fe43637,basketball_play,1774397672,455,True,2026-03-25 00:14:32+00:00,1,646.0,74.0,1.2333333333333334,10
4,92,quarter,1,00c3e69d-d9b9-4ac3-bf79-19707fe43637,8,10:30,Jamal Cain makes three point pullup jump shot (Wendell Carter Jr. assists),threepointmade,2,90381a35-42a6-4975-851f-175418e4271a,basketball_play,1774397687,454,True,2026-03-25 00:14:47+00:00,1,630.0,90.0,1.5,11
4,91,quarter,1,90381a35-42a6-4975-851f-175418e4271a,8,10:21,Dean Wade misses three point jump shot,threepointmiss,2,,basketball_play,1774397697,453,True,2026-03-25 00:14:57+00:00,1,621.0,99.0,1.65,12
4,90,quarter,1,90381a35-42a6-4975-851f-175418e4271a,8,10:20,Cavaliers offensive rebound,rebound,2,90381a35-42a6-4975-851f-175418e4271a,basketball_play,1774397698,452,True,2026-03-25 00:14:58+00:00,1,620.0,100.0,1.6666666666666667,13
4,89,quarter,1,00c3e69d-d9b9-4ac3-bf79-19707fe43637,8,10:20,Wendell Carter Jr. personal foul (Loose ball) (Sam Merrill draws the foul),personalfoul,2,90381a35-42a6-4975-851f-175418e4271a,basketball_play,1774397705,451,True,2026-03-25 00:15:05+00:00,1,620.0,100.0,1.6666666666666667,14
4,88,quarter,1,90381a35-42a6-4975-851f-175418e4271a,8,10:13,Donovan Mitchell makes three point pullup jump shot (Sam Merrill assists),threepointmade,5,00c3e69d-d9b9-4ac3-bf79-19707fe43637,basketball_play,1774397728,450,True,2026-03-25 00:15:28+00:00,1,613.0,107.0,1.7833333333333334,15
4,87,quarter,1,00c3e69d-d9b9-4ac3-bf79-19707fe43637,8,9:50,Paolo Banchero misses three point stepback jump shot,threepointmiss,5,,basketball_play,1774397751,449,True,2026-03-25 00:15:51+00:00,1,590.0,130.0,2.1666666666666665,16
4,86,quarter,1,90381a35-42a6-4975-851f-175418e4271a,8,9:48,Evan Mobley defensive rebound,rebound,5,90381a35-42a6-4975-851f-175418e4271a,basketball_play,1774397753,448,True,2026-03-25 00:15:53+00:00,1,588.0,132.0,2.2,17
4,85,quarter,1,90381a35-42a6-4975-851f-175418e4271a,8,9:41,Evan Mobley makes two point driving dunk,twopointmade,7,00c3e69d-d9b9-4ac3-bf79-19707fe43637,basketball_play,1774397761,447,True,2026-03-25 00:16:01+00:00,1,581.0,139.0,2.316666666666667,18
4,84,quarter,1,90381a35-42a6-4975-851f-175418e4271a,8,9:29,Evan Mobley shooting foul (Paolo Banchero draws the foul),shootingfoul,7,00c3e69d-d9b9-4ac3-bf79-19707fe43637,basketball_play,1774397775,446,True,2026-03-25 00:16:15+00:00,1,569.0,151.0,2.5166666666666666,19
4,83,quarter,1,00c3e69d-d9b9-4ac3-bf79-19707fe43637,9,9:29,Paolo Banchero makes regular free throw 1 of 2,freethrowmade,7,00c3e69d-d9b9-4ac3-bf79-19707fe43637,basketball_play,1774397803,445,True,2026-03-25 00:16:43+00:00,1,569.0,151.0,2.5166666666666666,20
4,82,quarter,1,00c3e69d-d9b9-4ac3-bf79-19707fe43637,10,9:29,Paolo Banchero makes regular free throw 2 of 2,freethrowmade,7,90381a35-42a6-4975-851f-175418e4271a,basketball_play,1774397823,444,True,2026-03-25 00:17:03+00:00,1,569.0,151.0,2.5166666666666666,21
4,81,quarter,1,90381a35-42a6-4975-851f-175418e4271a,10,9:14,Donovan Mitchell makes two point stepback jump shot (Dean Wade assists),twopointmade,9,00c3e69d-d9b9-4ac3-bf79-19707fe43637,basketball_play,1774397842,443,True,2026-03-25 00:17:22+00:00,1,554.0,166.0,2.7666666666666666,22
4,80,quarter,1,90381a35-42a6-4975-851f-175418e4271a,10,9:04,Evan Mobley shooting foul (Wendell Carter Jr. draws the foul),shootingfoul,9,00c3e69d-d9b9-4ac3-bf79-19707fe43637,basketball_play,1774397856,442,True,2026-03-25 00:17:36+00:00,1,544.0,176.0,2.933333333333333,23
4,79,quarter,1,00c3e69d-d9b9-4ac3-bf79-19707fe43637,11,9:04,Wendell Carter Jr. makes regular free throw 1 of 2,freethrowmade,9,00c3e69d-d9b9-4ac3-bf79-19707fe43637,basketball_play,1774397887,441,True,2026-03-25 00:18:07+00:00,1,544.0,176.0,2.933333333333333,24
4,78,quarter,1,00c3e69d-d9b9-4ac3-bf79-19707fe43637,12,9:04,Wendell Carter Jr. makes regular free throw 2 of 2,freethrowmade,9,90381a35-42a6-4975-851f-175418e4271a,basketball_play,1774397909,440,True,2026-03-25 00:18:29+00:00,1,544.0,176.0,2.933333333333333,25
4,77,quarter,1,90381a35-42a6-4975-851f-175418e4271a,12,8:50,James Harden misses three point jump shot,threepointmiss,9,,basketball_play,1774397925,439,True,2026-03-25 00:18:45+00:00,1,530.0,190.0,3.1666666666666665,26
4,76,quarter,1,00c3e69d-d9b9-4ac3-bf79-19707fe43637,12,8:45,Desmond Bane defensive rebound,rebound,9,00c3e69d-d9b9-4ac3-bf79-19707fe43637,basketball_play,1774397930,438,True,2026-03-25 00:18:50+00:00,1,525.0,195.0,3.25,27
4,75,quarter,1,00c3e69d-d9b9-4ac3-bf79-19707fe43637,12,8:36,Tristan da Silva misses three point pullup jump shot,threepointmiss,9,,basketball_play,1774397938,437,True,2026-03-25 00:18:58+00:00,1,516.0,204.0,3.4,28
4,74,quarter,1,90381a35-42a6-4975-851f-175418e4271a,12,8:33,James Harden defensive rebound,rebound,9,90381a35-42a6-4975-851f-175418e4271a,basketball_play,1774397941,436,True,2026-03-25 00:19:01+00:00,1,513.0,207.0,3.45,29
4,73,quarter,1,90381a35-42a6-4975-851f-175418e4271a,12,8:31,Dean Wade makes two point running layup (James Harden assists),twopointmade,11,00c3e69d-d9b9-4ac3-bf79-19707fe43637,basketball_play,1774397944,435,True,2026-03-25 00:19:04+00:00,1,511.0,209.0,3.4833333333333334,30
4,72,quarter,1,00c3e69d-d9b9-4ac3-bf79-19707fe43637,12,8:15,Jamal Cain misses two point driving layup,twopointmiss,11,,basketball_play,1774397960,434,True,2026-03-25 00:19:20+00:00,1,495.0,225.0,3.75,31
4,71,quarter,1,90381a35-42a6-4975-851f-175418e4271a,12,8:13,Evan Mobley defensive rebound,rebound,11,90381a35-42a6-4975-851f-175418e4271a,basketball_play,1774397962,433,True,2026-03-25 00:19:22+00:00,1,493.0,227.0,3.783333333333333,32
4,70,quarter,1,90381a35-42a6-4975-851f-175418e4271a,12,8:09,Sam Merrill misses three point running jump shot,threepointmiss,11,,basketball_play,1774397965,432,True,2026-03-25 00:19:25+00:00,1,489.0,231.0,3.85,33
4,69,quarter,1,00c3e69d-d9b9-4ac3-bf79-19707fe43637,12,8:06,Tristan da Silva defensive rebound,rebound,11,00c3e69d-d9b9-4ac3-bf79-19707fe43637,basketball_play,1774397968,431,True,2026-03-25 00:19:28+00:00,1,486.0,234.0,3.9,34
4,68,quarter,1,00c3e69d-d9b9-4ac3-bf79-19707fe43637,14,8:00,Desmond Bane makes two point pullup jump shot (Tristan da Silva assists),twopointmade,11,90381a35-42a6-4975-851f-175418e4271a,basketball_play,1774397974,430,True,2026-03-25 00:19:34+00:00,1,480.0,240.0,4.0,35
4,67,quarter,1,90381a35-42a6-4975-851f-175418e4271a,14,7:35,Donovan Mitchell makes two point driving floating jump shot,twopointmade,13,00c3e69d-d9b9-4ac3-bf79-19707fe43637,basketball_play,1774398000,429,True,2026-03-25 00:20:00+00:00,1,455.0,265.0,4.416666666666667,36
4,66,quarter,1,00c3e69d-d9b9-4ac3-bf79-19707fe43637,14,7:21,Desmond Bane misses two point driving floating jump shot,twopointmiss,13,,basketball_play,1774398014,428,True,2026-03-25 00:20:14+00:00,1,441.0,279.0,4.65,37
4,65,quarter,1,90381a35-42a6-4975-851f-175418e4271a,14,7:19,Evan Mobley defensive rebound,rebound,13,90381a35-42a6-4975-851f-175418e4271a,basketball_play,1774398016,427,True,2026-03-25 00:20:16+00:00,1,439.0,281.0,4.683333333333334,38
4,64,quarter,1,90381a35-42a6-4975-851f-175418e4271a,14,7:16,James Harden makes two point running dunk (Evan Mobley assists),twopointmade,15,00c3e69d-d9b9-4ac3-bf79-19707fe43637,basketball_play,1774398019,426,True,2026-03-25 00:20:19+00:00,1,436.0,284.0,4.733333333333333,39
4,63,quarter,1,00c3e69d-d9b9-4ac3-bf79-19707fe43637,14,7:02,Jamal Cain misses three point jump shot,threepointmiss,15,,basketball_play,1774398032,425,True,2026-03-25 00:20:32+00:00,1,422.0,298.0,4.966666666666667,40
4,62,quarter,1,00c3e69d-d9b9-4ac3-bf79-19707fe43637,14,6:59,Desmond Bane offensive rebound,rebound,15,00c3e69d-d9b9-4ac3-bf79-19707fe43637,basketball_play,1774398035,424,True,2026-03-25 00:20:35+00:00,1,419.0,301.0,5.016666666666667,41
4,61,quarter,1,00c3e69d-d9b9-4ac3-bf79-19707fe43637,16,6:52,Paolo Banchero makes two point pullup jump shot,twopointmade,15,90381a35-42a6-4975-851f-175418e4271a,basketball_play,1774398042,423,True,2026-03-25 00:20:42+00:00,1,412.0,308.0,5.133333333333334,42
4,60,quarter,1,90381a35-42a6-4975-851f-175418e4271a,16,6:31,Donovan Mitchell misses two point driving finger roll layup,twopointmiss,15,,basketball_play,1774398062,422,True,2026-03-25 00:21:02+00:00,1,391.0,329.0,5.483333333333333,43
4,59,quarter,1,00c3e69d-d9b9-4ac3-bf79-19707fe43637,16,6:30,Wendell Carter Jr. defensive rebound,rebound,15,00c3e69d-d9b9-4ac3-bf79-19707fe43637,basketball_play,1774398063,421,True,2026-03-25 00:21:03+00:00,1,390.0,330.0,5.5,44
4,58,quarter,1,00c3e69d-d9b9-4ac3-bf79-19707fe43637,19,6:19,Paolo Banchero makes three point jump shot (Wendell Carter Jr. assists),threepointmade,15,90381a35-42a6-4975-851f-175418e4271a,basketball_play,1774398074,420,True,2026-03-25 00:21:14+00:00,1,379.0,341.0,5.683333333333334,45
4,57,quarter,1,90381a35-42a6-4975-851f-175418e4271a,19,6:18,Cavaliers 60 second timeout,teamtimeout,15,,basketball_play,1774398080,419,True,2026-03-25 00:21:20+00:00,1,378.0,342.0,5.7,46
4,56,quarter,1,00c3e69d-d9b9-4ac3-bf79-19707fe43637,19,6:18,"Magic lineup change (Tristan da Silva, Jevon Carter, Wendell Carter Jr., Jamal Cain, Paolo Banchero)",lineupchange,15,,basketball_play,1774398081,418,True,2026-03-25 00:21:21+00:00,1,378.0,342.0,5.7,47
4,55,quarter,1,90381a35-42a6-4975-851f-175418e4271a,19,6:18,"Cavaliers lineup change (James Harden, Evan Mobley, Keon Ellis, Sam Merrill, Max Strus)",lineupchange,15,,basketball_play,1774398081,417,True,2026-03-25 00:21:21+00:00,1,378.0,342.0,5.7,48
4,54,quarter,1,90381a35-42a6-4975-851f-175418e4271a,19,6:03,Sam Merrill misses three point pullup jump shot,threepointmiss,15,,basketball_play,1774398314,416,True,2026-03-25 00:25:14+00:00,1,363.0,357.0,5.95,49
4,53,quarter,1,00c3e69d-d9b9-4ac3-bf79-19707fe43637,19,6:00,Paolo Banchero defensive rebound,rebound,15,00c3e69d-d9b9-4ac3-bf79-19707fe43637,basketball_play,1774398317,415,True,2026-03-25 00:25:17+00:00,1,360.0,360.0,6.0,50
4,52,quarter,1,00c3e69d-d9b9-4ac3-bf79-19707fe43637,19,5:46,Jamal Cain misses two point pullup jump shot,twopointmiss,15,,basketball_play,1774398331,414,True,2026-03-25 00:25:31+00:00,1,346.0,374.0,6.233333333333333,51
4,51,quarter,1,90381a35-42a6-4975-851f-175418e4271a,19,5:44,Evan Mobley defensive rebound,rebound,15,90381a35-42a6-4975-851f-175418e4271a,basketball_play,1774398333,413,True,2026-03-25 00:25:33+00:00,1,344.0,376.0,6.266666666666667,52
4,50,quarter,1,90381a35-42a6-4975-851f-175418e4271a,19,5:36,Evan Mobley turnover (bad pass) (Paolo Banchero steals),turnover,15,00c3e69d-d9b9-4ac3-bf79-19707fe43637,basketball_play,1774398341,412,True,2026-03-25 00:25:41+00:00,1,336.0,384.0,6.4,53
4,49,quarter,1,00c3e69d-d9b9-4ac3-bf79-19707fe43637,21,5:17,Paolo Banchero makes two point turnaround fadeaway jump shot,twopointmade,15,90381a35-42a6-4975-851f-175418e4271a,basketball_play,1774398360,411,True,2026-03-25 00:26:00+00:00,1,317.0,403.0,6.716666666666667,54
4,48,quarter,1,90381a35-42a6-4975-851f-175418e4271a,21,5:01,James Harden makes two point driving finger roll layup,twopointmade,17,00c3e69d-d9b9-4ac3-bf79-19707fe43637,basketball_play,1774398375,410,True,2026-03-25 00:26:15+00:00,1,301.0,419.0,6.983333333333333,55
4,47,quarter,1,90381a35-42a6-4975-851f-175418e4271a,21,4:42,Keon Ellis personal foul (Tristan da Silva draws the foul),personalfoul,17,00c3e69d-d9b9-4ac3-bf79-19707fe43637,basketball_play,1774398399,409,True,2026-03-25 00:26:39+00:00,1,282.0,438.0,7.3,56
4,46,quarter,1,00c3e69d-d9b9-4ac3-bf79-19707fe43637,21,4:42,"Magic lineup change (Tristan da Silva, Goga Bitadze, Jett Howard, Jevon Carter, Paolo Banchero)",lineupchange,17,,basketball_play,1774398406,408,True,2026-03-25 00:26:46+00:00,1,282.0,438.0,7.3,57
4,45,quarter,1,90381a35-42a6-4975-851f-175418e4271a,21,4:42,"Cavaliers lineup change (James Harden, Thomas Bryant, Keon Ellis, Sam Merrill, Max Strus)",lineupchange,17,,basketball_play,1774398406,407,True,2026-03-25 00:26:46+00:00,1,282.0,438.0,7.3,58
4,44,quarter,1,00c3e69d-d9b9-4ac3-bf79-19707fe43637,21,4:29,Tristan da Silva turnover (bad pass) (Max Strus steals),turnover,17,90381a35-42a6-4975-851f-175418e4271a,basketball_play,1774398432,406,True,2026-03-25 00:27:12+00:00,1,269.0,451.0,7.516666666666667,59
4,43,quarter,1,90381a35-42a6-4975-851f-175418e4271a,21,4:19,James Harden makes two point driving floating jump shot,twopointmade,19,00c3e69d-d9b9-4ac3-bf79-19707fe43637,basketball_play,1774398444,405,True,2026-03-25 00:27:24+00:00,1,259.0,461.0,7.683333333333334,60
4,42,quarter,1,00c3e69d-d9b9-4ac3-bf79-19707fe43637,21,4:19,Goga Bitadze shooting foul (James Harden draws the foul),shootingfoul,19,90381a35-42a6-4975-851f-175418e4271a,basketball_play,1774398447,404,True,2026-03-25 00:27:27+00:00,1,259.0,461.0,7.683333333333334,61
4,41,quarter,1,90381a35-42a6-4975-851f-175418e4271a,21,4:19,James Harden makes regular free throw 1 of 1,freethrowmade,20,,basketball_play,1774398477,403,True,2026-03-25 00:27:57+00:00,1,259.0,461.0,7.683333333333334,62
4,40,quarter,1,00c3e69d-d9b9-4ac3-bf79-19707fe43637,24,4:07,Tristan da Silva makes three point pullup jump shot (Goga Bitadze assists),threepointmade,20,90381a35-42a6-4975-851f-175418e4271a,basketball_play,1774398491,402,True,2026-03-25 00:28:11+00:00,1,247.0,473.0,7.883333333333334,63
4,39,quarter,1,00c3e69d-d9b9-4ac3-bf79-19707fe43637,24,3:59,Jett Howard shooting foul (James Harden draws the foul),shootingfoul,20,90381a35-42a6-4975-851f-175418e4271a,basketball_play,1774398503,401,True,2026-03-25 00:28:23+00:00,1,239.0,481.0,8.016666666666667,64
4,38,quarter,1,90381a35-42a6-4975-851f-175418e4271a,24,3:59,James Harden makes regular free throw 1 of 3,freethrowmade,21,90381a35-42a6-4975-851f-175418e4271a,basketball_play,1774398532,400,True,2026-03-25 00:28:52+00:00,1,239.0,481.0,8.016666666666667,65
4,37,quarter,1,90381a35-42a6-4975-851f-175418e4271a,24,3:59,James Harden makes regular free throw 2 of 3,freethrowmade,22,90381a35-42a6-4975-851f-175418e4271a,basketball_play,1774398546,399,True,2026-03-25 00:29:06+00:00,1,239.0,481.0,8.016666666666667,66
4,36,quarter,1,90381a35-42a6-4975-851f-175418e4271a,24,3:59,"Cavaliers lineup change (Dennis Schroder, James Harden, Thomas Bryant, Keon Ellis, Max Strus)",lineupchange,22,,basketball_play,1774398565,398,True,2026-03-25 00:29:25+00:00,1,239.0,481.0,8.016666666666667,67
4,35,quarter,1,90381a35-42a6-4975-851f-175418e4271a,24,3:59,James Harden makes regular free throw 3 of 3,freethrowmade,23,00c3e69d-d9b9-4ac3-bf79-19707fe43637,basketball_play,1774398565,397,True,2026-03-25 00:29:25+00:00,1,239.0,481.0,8.016666666666667,68
4,34,quarter,1,90381a35-42a6-4975-851f-175418e4271a,24,3:45,James Harden shooting foul (Paolo Banchero draws the foul),shootingfoul,23,00c3e69d-d9b9-4ac3-bf79-19707fe43637,basketball_play,1774398585,396,True,2026-03-25 00:29:45+00:00,1,225.0,495.0,8.25,69
4,33,quarter,1,00c3e69d-d9b9-4ac3-bf79-19707fe43637,25,3:45,Paolo Banchero makes regular free throw 1 of 2,freethrowmade,23,00c3e69d-d9b9-4ac3-bf79-19707fe43637,basketball_play,1774398612,395,True,2026-03-25 00:30:12+00:00,1,225.0,495.0,8.25,70
4,32,quarter,1,00c3e69d-d9b9-4ac3-bf79-19707fe43637,25,3:45,"Magic lineup change (Desmond Bane, Goga Bitadze, Jett Howard, Jevon Carter, Paolo Banchero)",lineupchange,23,,basketball_play,1774398613,394,True,2026-03-25 00:30:13+00:00,1,225.0,495.0,8.25,71
4,31,quarter,1,90381a35-42a6-4975-851f-175418e4271a,25,3:45,"Cavaliers lineup change (Dennis Schroder, Donovan Mitchell, Thomas Bryant, Keon Ellis, Max Strus)",lineupchange,23,,basketball_play,1774398613,393,True,2026-03-25 00:30:13+00:00,1,225.0,495.0,8.25,72
4,30,quarter,1,00c3e69d-d9b9-4ac3-bf79-19707fe43637,26,3:45,Paolo Banchero makes regular free throw 2 of 2,freethrowmade,23,90381a35-42a6-4975-851f-175418e4271a,basketball_play,1774398649,392,True,2026-03-25 00:30:49+00:00,1,225.0,495.0,8.25,73
4,29,quarter,1,90381a35-42a6-4975-851f-175418e4271a,26,3:32,Donovan Mitchell turnover (lost ball) (Goga Bitadze steals),turnover,23,00c3e69d-d9b9-4ac3-bf79-19707fe43637,basketball_play,1774398662,391,True,2026-03-25 00:31:02+00:00,1,212.0,508.0,8.466666666666667,74
4,28,quarter,1,00c3e69d-d9b9-4ac3-bf79-19707fe43637,26,3:23,Paolo Banchero misses three point stepback jump shot,threepointmiss,23,,basketball_play,1774398672,390,True,2026-03-25 00:31:12+00:00,1,203.0,517.0,8.616666666666667,75
4,27,quarter,1,00c3e69d-d9b9-4ac3-bf79-19707fe43637,26,3:23,Goga Bitadze offensive rebound,rebound,23,00c3e69d-d9b9-4ac3-bf79-19707fe43637,basketball_play,1774398672,389,True,2026-03-25 00:31:12+00:00,1,203.0,517.0,8.616666666666667,76
4,26,quarter,1,00c3e69d-d9b9-4ac3-bf79-19707fe43637,29,3:13,Paolo Banchero makes three point pullup jump shot (Goga Bitadze assists),threepointmade,23,90381a35-42a6-4975-851f-175418e4271a,basketball_play,1774398681,388,True,2026-03-25 00:31:21+00:00,1,193.0,527.0,8.783333333333333,77
4,25,quarter,1,90381a35-42a6-4975-851f-175418e4271a,29,3:00,Max Strus makes three point jump shot (Dennis Schroder assists),threepointmade,26,00c3e69d-d9b9-4ac3-bf79-19707fe43637,basketball_play,1774398694,387,True,2026-03-25 00:31:34+00:00,1,180.0,540.0,9.0,78
4,24,quarter,1,00c3e69d-d9b9-4ac3-bf79-19707fe43637,29,2:43,Jevon Carter misses three point jump shot,threepointmiss,26,,basketball_play,1774398711,386,True,2026-03-25 00:31:51+00:00,1,163.0,557.0,9.283333333333333,79
4,23,quarter,1,90381a35-42a6-4975-851f-175418e4271a,29,2:40,Thomas Bryant defensive rebound,rebound,26,90381a35-42a6-4975-851f-175418e4271a,basketball_play,1774398714,385,True,2026-03-25 00:31:54+00:00,1,160.0,560.0,9.333333333333334,80
4,22,quarter,1,90381a35-42a6-4975-851f-175418e4271a,29,2:32,Max Strus misses three point jump shot,threepointmiss,26,,basketball_play,1774398722,384,True,2026-03-25 00:32:02+00:00,1,152.0,568.0,9.466666666666667,81
4,21,quarter,1,00c3e69d-d9b9-4ac3-bf79-19707fe43637,29,2:29,Goga Bitadze defensive rebound,rebound,26,00c3e69d-d9b9-4ac3-bf79-19707fe43637,basketball_play,1774398725,383,True,2026-03-25 00:32:05+00:00,1,149.0,571.0,9.516666666666667,82
4,20,quarter,1,00c3e69d-d9b9-4ac3-bf79-19707fe43637,29,2:21,Paolo Banchero turnover (bad pass) (Keon Ellis steals),turnover,26,90381a35-42a6-4975-851f-175418e4271a,basketball_play,1774398734,382,True,2026-03-25 00:32:14+00:00,1,141.0,579.0,9.65,83
4,19,quarter,1,90381a35-42a6-4975-851f-175418e4271a,29,2:18,Keon Ellis makes two point running reverse dunk (Thomas Bryant assists),twopointmade,28,00c3e69d-d9b9-4ac3-bf79-19707fe43637,basketball_play,1774398740,381,True,2026-03-25 00:32:20+00:00,1,138.0,582.0,9.7,84
4,18,quarter,1,00c3e69d-d9b9-4ac3-bf79-19707fe43637,29,2:18,Magic 60 second timeout,teamtimeout,28,,basketball_play,1774398747,380,True,2026-03-25 00:32:27+00:00,1,138.0,582.0,9.7,85
4,17,quarter,1,00c3e69d-d9b9-4ac3-bf79-19707fe43637,29,2:18,"Magic lineup change (Desmond Bane, Goga Bitadze, Noah Penda, Jett Howard, Jevon Carter)",lineupchange,28,,basketball_play,1774398974,379,True,2026-03-25 00:36:14+00:00,1,138.0,582.0,9.7,86
4,16,quarter,1,00c3e69d-d9b9-4ac3-bf79-19707fe43637,31,1:58,Jett Howard makes two point driving floating bank jump shot (Noah Penda assists),twopointmade,28,90381a35-42a6-4975-851f-175418e4271a,basketball_play,1774398974,378,True,2026-03-25 00:36:14+00:00,1,118.0,602.0,10.033333333333333,87
4,15,quarter,1,00c3e69d-d9b9-4ac3-bf79-19707fe43637,31,1:38,Noah Penda personal foul (Max Strus draws the foul),personalfoul,28,90381a35-42a6-4975-851f-175418e4271a,basketball_play,1774398997,377,True,2026-03-25 00:36:37+00:00,1,98.0,622.0,10.366666666666667,88
4,14,quarter,1,90381a35-42a6-4975-851f-175418e4271a,31,1:29,Thomas Bryant makes two point alley-oop dunk (Donovan Mitchell assists),twopointmade,30,00c3e69d-d9b9-4ac3-bf79-19707fe43637,basketball_play,1774399022,376,True,2026-03-25 00:37:02+00:00,1,89.0,631.0,10.516666666666667,89
4,13,quarter,1,00c3e69d-d9b9-4ac3-bf79-19707fe43637,31,1:19,Desmond Bane misses two point driving layup,twopointmiss,30,,basketball_play,1774399031,375,True,2026-03-25 00:37:11+00:00,1,79.0,641.0,10.683333333333334,90
4,12,quarter,1,00c3e69d-d9b9-4ac3-bf79-19707fe43637,31,1:19,Jett Howard offensive rebound,rebound,30,00c3e69d-d9b9-4ac3-bf79-19707fe43637,basketball_play,1774399031,374,True,2026-03-25 00:37:11+00:00,1,79.0,641.0,10.683333333333334,91
4,11,quarter,1,00c3e69d-d9b9-4ac3-bf79-19707fe43637,33,1:14,Goga Bitadze makes two point layup (Jett Howard assists),twopointmade,30,90381a35-42a6-4975-851f-175418e4271a,basketball_play,1774399036,373,True,2026-03-25 00:37:16+00:00,1,74.0,646.0,10.766666666666667,92
4,10,quarter,1,90381a35-42a6-4975-851f-175418e4271a,33,00:57.20,Dennis Schroder misses three point jump shot,threepointmiss,30,,basketball_play,1774399054,372,True,2026-03-25 00:37:34+00:00,1,57.2,662.8,11.046666666666665,93
4,9,quarter,1,00c3e69d-d9b9-4ac3-bf79-19707fe43637,33,00:54.40,Desmond Bane defensive rebound,rebound,30,00c3e69d-d9b9-4ac3-bf79-19707fe43637,basketball_play,1774399057,371,True,2026-03-25 00:37:37+00:00,1,54.4,665.6,11.093333333333334,94
4,8,quarter,1,00c3e69d-d9b9-4ac3-bf79-19707fe43637,36,00:31.40,Jett Howard makes three point stepback jump shot (Desmond Bane assists),threepointmade,30,90381a35-42a6-4975-851f-175418e4271a,basketball_play,1774399080,370,True,2026-03-25 00:38:00+00:00,1,31.4,688.6,11.476666666666667,95
4,7,quarter,1,00c3e69d-d9b9-4ac3-bf79-19707fe43637,36,00:21.60,Noah Penda shooting foul (Donovan Mitchell draws the foul),shootingfoul,30,90381a35-42a6-4975-851f-175418e4271a,basketball_play,1774399094,369,True,2026-03-25 00:38:14+00:00,1,21.6,698.4,11.639999999999999,96
4,6,quarter,1,90381a35-42a6-4975-851f-175418e4271a,36,00:21.60,Donovan Mitchell makes regular free throw 1 of 2,freethrowmade,31,90381a35-42a6-4975-851f-175418e4271a,basketball_play,1774399124,368,True,2026-03-25 00:38:44+00:00,1,21.6,698.4,11.639999999999999,97
4,4,quarter,1,90381a35-42a6-4975-851f-175418e4271a,36,00:21.60,Donovan Mitchell makes regular free throw 2 of 2,freethrowmade,32,00c3e69d-d9b9-4ac3-bf79-19707fe43637,basketball_play,1774399156,366,True,2026-03-25 00:39:16+00:00,1,21.6,698.4,11.639999999999999,98
4,5,quarter,1,00c3e69d-d9b9-4ac3-bf79-19707fe43637,36,00:21,"Magic lineup change (Tristan da Silva, Desmond Bane, Goga Bitadze, Jett Howard, Jevon Carter)",lineupchange,31,,basketball_play,1774399156,367,True,2026-03-25 00:39:16+00:00,1,21.0,699.0,11.65,99
4,3,quarter,1,00c3e69d-d9b9-4ac3-bf79-19707fe43637,39,00:00,Jevon Carter makes three point fadeaway jump shot (Goga Bitadze assists),threepointmade,32,90381a35-42a6-4975-851f-175418e4271a,basketball_play,1774399182,365,True,2026-03-25 00:39:42+00:00,1,0.0,720.0,12.0,100
4,2,quarter,1,,39,00:00,Instant replay (Request: Ruling Upheld),review,32,,basketball_play,1774399219,364,True,2026-03-25 00:40:19+00:00,1,0.0,720.0,12.0,101
4,1,quarter,1,,39,00:00,End of 1st Quarter.,endperiod,32,,basketball_play,1774399189,363,True,2026-03-25 00:39:49+00:00,1,0.0,720.0,12.0,102
3,115,quarter,2,00c3e69d-d9b9-4ac3-bf79-19707fe43637,39,12:00,"Magic lineup change (Desmond Bane, Goga Bitadze, Noah Penda, Jett Howard, Jevon Carter)",lineupchange,32,,basketball_play,1774399209,362,True,2026-03-25 00:40:09+00:00,2,720.0,720.0,12.0,103
3,114,quarter,2,90381a35-42a6-4975-851f-175418e4271a,39,12:00,"Cavaliers lineup change (Dennis Schroder, Donovan Mitchell, Thomas Bryant, Evan Mobley, Max Strus)",lineupchange,32,,basketball_play,1774399209,361,True,2026-03-25 00:40:09+00:00,2,720.0,720.0,12.0,104
3,113,quarter,2,,39,12:00,Start of 2nd Quarter,startperiod,32,,basketball_play,1774399410,360,True,2026-03-25 00:43:30+00:00,2,720.0,720.0,12.0,105
