period_index,event_index,period_type,period_number,attribution,away_points,clock,description,event_type,home_points,possession,type,wall_clock,pbp_source_row,has_wall_clock,event_ts_utc,period_sequence,game_clock_seconds_remaining,game_elapsed_seconds,game_elapsed_minutes,pbp_chronological_index
2,17,quarter,3,00c3e69d-d9b9-4ac3-bf79-19707fe43637,95,1:10,Paolo Banchero offensive rebound,rebound,102,00c3e69d-d9b9-4ac3-bf79-19707fe43637,basketball_play,1774403776,152,True,2026-03-25 01:56:16+00:00,3,70.0,2090.0,34.833333333333336,313
2,16,quarter,3,90381a35-42a6-4975-851f-175418e4271a,95,1:02,Jump ball. Thomas Bryant vs. Paolo Banchero (Donovan Mitchell gains possession),jumpball,102,90381a35-42a6-4975-851f-175418e4271a,basketball_play,1774403836,151,True,2026-03-25 01:57:16+00:00,3,62.0,2098.0,34.96666666666667,314
2,15,quarter,3,00c3e69d-d9b9-4ac3-bf79-19707fe43637,95,1:02,Paolo Banchero turnover (lost ball) (Thomas Bryant steals),turnover,102,90381a35-42a6-4975-851f-175418e4271a,basketball_play,1774403836,150,True,2026-03-25 01:57:16+00:00,3,62.0,2098.0,34.96666666666667,315
2,14,quarter,3,90381a35-42a6-4975-851f-175418e4271a,95,00:51.40,Donovan Mitchell misses three point stepback jump shot,threepointmiss,102,,basketball_play,1774403847,149,True,2026-03-25 01:57:27+00:00,3,51.4,2108.6,35.14333333333333,316
2,13,quarter,3,90381a35-42a6-4975-851f-175418e4271a,95,00:49,Thomas Bryant offensive rebound,rebound,102,90381a35-42a6-4975-851f-175418e4271a,basketball_play,1774403849,148,True,2026-03-25 01:57:29+00:00,3,49.0,2111.0,35.18333333333333,317
2,12,quarter,3,90381a35-42a6-4975-851f-175418e4271a,95,00:44.90,Thomas Bryant turnover (bad pass) (Desmond Bane steals),turnover,102,00c3e69d-d9b9-4ac3-bf79-19707fe43637,basketball_play,1774403853,147,True,2026-03-25 01:57:33+00:00,3,44.9,2115.1,35.251666666666665,318
2,11,quarter,3,00c3e69d-d9b9-4ac3-bf79-19707fe43637,95,00:38.90,Jett Howard misses three point running jump shot,threepointmiss,102,,basketball_play,1774403859,146,True,2026-03-25 01:57:39+00:00,3,38.9,2121.1,35.35166666666667,319
2,10,quarter,3,90381a35-42a6-4975-851f-175418e4271a,95,00:35.90,Thomas Bryant defensive rebound,rebound,102,90381a35-42a6-4975-851f-175418e4271a,basketball_play,1774403862,145,True,2026-03-25 01:57:42+00:00,3,35.9,2124.1,35.401666666666664,320
2,9,quarter,3,90381a35-42a6-4975-851f-175418e4271a,95,00:22.30,Donovan Mitchell makes two point turnaround jump shot,twopointmade,104,00c3e69d-d9b9-4ac3-bf79-19707fe43637,basketball_play,1774403877,144,True,2026-03-25 01:57:57+00:00,3,22.3,2137.7,35.62833333333333,321
2,8,quarter,3,00c3e69d-d9b9-4ac3-bf79-19707fe43637,95,00:22.30,Jett Howard shooting foul (Donovan Mitchell draws the foul),shootingfoul,104,90381a35-42a6-4975-851f-175418e4271a,basketball_play,1774403881,143,True,2026-03-25 01:58:01+00:00,3,22.3,2137.7,35.62833333333333,322
2,5,quarter,3,90381a35-42a6-4975-851f-175418e4271a,95,00:22.30,Donovan Mitchell makes regular free throw 1 of 1,freethrowmade,105,,basketball_play,1774403933,140,True,2026-03-25 01:58:53+00:00,3,22.3,2137.7,35.62833333333333,323
2,7,quarter,3,00c3e69d-d9b9-4ac3-bf79-19707fe43637,95,00:22,"Magic lineup change (Tristan da Silva, Desmond Bane, Jett Howard, Jevon Carter, Paolo Banchero)",lineupchange,104,,basketball_play,1774403908,142,True,2026-03-25 01:58:28+00:00,3,22.0,2138.0,35.63333333333333,324
2,6,quarter,3,90381a35-42a6-4975-851f-175418e4271a,95,00:22,"Cavaliers lineup change (Dennis Schroder, Donovan Mitchell, Dean Wade, Evan Mobley, Keon Ellis)",lineupchange,104,,basketball_play,1774403908,141,True,2026-03-25 01:58:28+00:00,3,22.0,2138.0,35.63333333333333,325
2,4,quarter,3,00c3e69d-d9b9-4ac3-bf79-19707fe43637,97,00:01.90,Paolo Banchero makes two point driving layup,twopointmade,105,90381a35-42a6-4975-851f-175418e4271a,basketball_play,1774403957,139,True,2026-03-25 01:59:17+00:00,3,1.9,2158.1,35.968333333333334,326
2,3,quarter,3,90381a35-42a6-4975-851f-175418e4271a,97,00:00,Cavaliers misses heave shot,heave,105,,basketball_play,1774403963,138,True,2026-03-25 01:59:23+00:00,3,0.0,2160.0,36.0,327
2,2,quarter,3,90381a35-42a6-4975-851f-175418e4271a,97,00:00,Cavaliers offensive rebound,rebound,105,90381a35-42a6-4975-851f-175418e4271a,basketball_play,1774403963,137,True,2026-03-25 01:59:23+00:00,3,0.0,2160.0,36.0,328
2,1,quarter,3,,97,00:00,End of 3rd Quarter.,endperiod,105,,basketball_play,1774403967,136,True,2026-03-25 01:59:27+00:00,3,0.0,2160.0,36.0,329
1,136,quarter,4,00c3e69d-d9b9-4ac3-bf79-19707fe43637,97,12:00,"Magic lineup change (Desmond Bane, Moritz Wagner, Jevon Carter, Wendell Carter Jr., Jamal Cain)",lineupchange,105,,basketball_play,1774404028,135,True,2026-03-25 02:00:28+00:00,4,720.0,2160.0,36.0,330
1,135,quarter,4,90381a35-42a6-4975-851f-175418e4271a,97,12:00,"Cavaliers lineup change (Dennis Schroder, Donovan Mitchell, Thomas Bryant, Evan Mobley, Max Strus)",lineupchange,105,,basketball_play,1774404028,134,True,2026-03-25 02:00:28+00:00,4,720.0,2160.0,36.0,331
1,134,quarter,4,,97,12:00,Start of 4th Quarter,startperiod,105,,basketball_play,1774404189,133,True,2026-03-25 02:03:09+00:00,4,720.0,2160.0,36.0,332
1,133,quarter,4,00c3e69d-d9b9-4ac3-bf79-19707fe43637,99,11:39,Moritz Wagner makes two point layup (Jamal Cain assists),twopointmade,105,90381a35-42a6-4975-851f-175418e4271a,basketball_play,1774404209,132,True,2026-03-25 02:03:29+00:00,4,699.0,2181.0,36.35,333
1,132,quarter,4,90381a35-42a6-4975-851f-175418e4271a,99,11:21,Max Strus makes three point jump shot (Donovan Mitchell assists),threepointmade,108,00c3e69d-d9b9-4ac3-bf79-19707fe43637,basketball_play,1774404227,131,True,2026-03-25 02:03:47+00:00,4,681.0,2199.0,36.65,334
1,131,quarter,4,00c3e69d-d9b9-4ac3-bf79-19707fe43637,99,10:56,Desmond Bane misses two point pullup jump shot,twopointmiss,108,,basketball_play,1774404251,130,True,2026-03-25 02:04:11+00:00,4,656.0,2224.0,37.06666666666667,335
1,130,quarter,4,00c3e69d-d9b9-4ac3-bf79-19707fe43637,99,10:50,Jamal Cain offensive rebound,rebound,108,00c3e69d-d9b9-4ac3-bf79-19707fe43637,basketball_play,1774404257,129,True,2026-03-25 02:04:17+00:00,4,650.0,2230.0,37.166666666666664,336
1,129,quarter,4,00c3e69d-d9b9-4ac3-bf79-19707fe43637,101,10:50,Jamal Cain makes two point tip dunk,twopointmade,108,90381a35-42a6-4975-851f-175418e4271a,basketball_play,1774404257,128,True,2026-03-25 02:04:17+00:00,4,650.0,2230.0,37.166666666666664,337
1,128,quarter,4,90381a35-42a6-4975-851f-175418e4271a,101,10:40,Max Strus misses three point jump shot,threepointmiss,108,,basketball_play,1774404269,127,True,2026-03-25 02:04:29+00:00,4,640.0,2240.0,37.333333333333336,338
1,127,quarter,4,90381a35-42a6-4975-851f-175418e4271a,101,10:38,Evan Mobley offensive rebound,rebound,108,90381a35-42a6-4975-851f-175418e4271a,basketball_play,1774404271,126,True,2026-03-25 02:04:31+00:00,4,638.0,2242.0,37.36666666666667,339
1,126,quarter,4,90381a35-42a6-4975-851f-175418e4271a,101,10:33,Donovan Mitchell misses three point pullup jump shot,threepointmiss,108,,basketball_play,1774404276,125,True,2026-03-25 02:04:36+00:00,4,633.0,2247.0,37.45,340
1,125,quarter,4,00c3e69d-d9b9-4ac3-bf79-19707fe43637,101,10:31,Moritz Wagner defensive rebound,rebound,108,00c3e69d-d9b9-4ac3-bf79-19707fe43637,basketball_play,1774404278,124,True,2026-03-25 02:04:38+00:00,4,631.0,2249.0,37.483333333333334,341
1,124,quarter,4,00c3e69d-d9b9-4ac3-bf79-19707fe43637,101,10:22,Moritz Wagner misses three point jump shot,threepointmiss,108,,basketball_play,1774404287,123,True,2026-03-25 02:04:47+00:00,4,622.0,2258.0,37.63333333333333,342
1,123,quarter,4,90381a35-42a6-4975-851f-175418e4271a,101,10:18,Max Strus defensive rebound,rebound,108,90381a35-42a6-4975-851f-175418e4271a,basketball_play,1774404291,122,True,2026-03-25 02:04:51+00:00,4,618.0,2262.0,37.7,343
1,122,quarter,4,00c3e69d-d9b9-4ac3-bf79-19707fe43637,101,10:09,Wendell Carter Jr. shooting foul (Evan Mobley draws the foul),shootingfoul,108,90381a35-42a6-4975-851f-175418e4271a,basketball_play,1774404301,121,True,2026-03-25 02:05:01+00:00,4,609.0,2271.0,37.85,344
1,121,quarter,4,90381a35-42a6-4975-851f-175418e4271a,101,10:09,Evan Mobley makes regular free throw 1 of 2,freethrowmade,109,90381a35-42a6-4975-851f-175418e4271a,basketball_play,1774404331,120,True,2026-03-25 02:05:31+00:00,4,609.0,2271.0,37.85,345
1,120,quarter,4,90381a35-42a6-4975-851f-175418e4271a,101,10:09,"Cavaliers lineup change (Dennis Schroder, Donovan Mitchell, James Harden, Dean Wade, Evan Mobley)",lineupchange,109,,basketball_play,1774404338,119,True,2026-03-25 02:05:38+00:00,4,609.0,2271.0,37.85,346
1,119,quarter,4,00c3e69d-d9b9-4ac3-bf79-19707fe43637,101,10:09,"Magic lineup change (Tristan da Silva, Desmond Bane, Moritz Wagner, Jevon Carter, Jamal Cain)",lineupchange,109,,basketball_play,1774404380,118,True,2026-03-25 02:06:20+00:00,4,609.0,2271.0,37.85,347
1,118,quarter,4,90381a35-42a6-4975-851f-175418e4271a,101,10:09,Evan Mobley makes regular free throw 2 of 2,freethrowmade,110,00c3e69d-d9b9-4ac3-bf79-19707fe43637,basketball_play,1774404380,117,True,2026-03-25 02:06:20+00:00,4,609.0,2271.0,37.85,348
1,117,quarter,4,00c3e69d-d9b9-4ac3-bf79-19707fe43637,101,9:58,Jevon Carter misses three point fadeaway jump shot,threepointmiss,110,,basketball_play,1774404392,116,True,2026-03-25 02:06:32+00:00,4,598.0,2282.0,38.03333333333333,349
1,116,quarter,4,90381a35-42a6-4975-851f-175418e4271a,101,9:55,Dennis Schroder defensive rebound,rebound,110,90381a35-42a6-4975-851f-175418e4271a,basketball_play,1774404395,115,True,2026-03-25 02:06:35+00:00,4,595.0,2285.0,38.083333333333336,350
1,115,quarter,4,90381a35-42a6-4975-851f-175418e4271a,101,9:46,Dennis Schroder makes two point pullup jump shot (James Harden assists),twopointmade,112,00c3e69d-d9b9-4ac3-bf79-19707fe43637,basketball_play,1774404403,114,True,2026-03-25 02:06:43+00:00,4,586.0,2294.0,38.233333333333334,351
1,114,quarter,4,00c3e69d-d9b9-4ac3-bf79-19707fe43637,103,9:32,Desmond Bane makes two point driving layup,twopointmade,112,90381a35-42a6-4975-851f-175418e4271a,basketball_play,1774404417,113,True,2026-03-25 02:06:57+00:00,4,572.0,2308.0,38.46666666666667,352
1,113,quarter,4,90381a35-42a6-4975-851f-175418e4271a,103,9:19,Dennis Schroder makes two point driving floating jump shot,twopointmade,114,00c3e69d-d9b9-4ac3-bf79-19707fe43637,basketball_play,1774404431,112,True,2026-03-25 02:07:11+00:00,4,559.0,2321.0,38.68333333333333,353
1,112,quarter,4,00c3e69d-d9b9-4ac3-bf79-19707fe43637,103,9:11,Evan Mobley blocks Desmond Bane's two point driving layup,twopointmiss,114,,basketball_play,1774404439,111,True,2026-03-25 02:07:19+00:00,4,551.0,2329.0,38.81666666666667,354
1,111,quarter,4,90381a35-42a6-4975-851f-175418e4271a,103,9:11,Dean Wade defensive rebound,rebound,114,90381a35-42a6-4975-851f-175418e4271a,basketball_play,1774404439,110,True,2026-03-25 02:07:19+00:00,4,551.0,2329.0,38.81666666666667,355
1,110,quarter,4,90381a35-42a6-4975-851f-175418e4271a,103,9:02,Donovan Mitchell misses two point driving floating jump shot,twopointmiss,114,,basketball_play,1774404448,109,True,2026-03-25 02:07:28+00:00,4,542.0,2338.0,38.96666666666667,356
1,109,quarter,4,00c3e69d-d9b9-4ac3-bf79-19707fe43637,103,9:00,Tristan da Silva defensive rebound,rebound,114,00c3e69d-d9b9-4ac3-bf79-19707fe43637,basketball_play,1774404450,108,True,2026-03-25 02:07:30+00:00,4,540.0,2340.0,39.0,357
1,108,quarter,4,90381a35-42a6-4975-851f-175418e4271a,103,8:57,Evan Mobley shooting foul (Tristan da Silva draws the foul),shootingfoul,114,00c3e69d-d9b9-4ac3-bf79-19707fe43637,basketball_play,1774404456,107,True,2026-03-25 02:07:36+00:00,4,537.0,2343.0,39.05,358
1,107,quarter,4,00c3e69d-d9b9-4ac3-bf79-19707fe43637,104,8:57,Tristan da Silva makes regular free throw 1 of 2,freethrowmade,114,00c3e69d-d9b9-4ac3-bf79-19707fe43637,basketball_play,1774404481,106,True,2026-03-25 02:08:01+00:00,4,537.0,2343.0,39.05,359
1,106,quarter,4,00c3e69d-d9b9-4ac3-bf79-19707fe43637,104,8:57,"Magic lineup change (Tristan da Silva, Moritz Wagner, Jevon Carter, Jamal Cain, Paolo Banchero)",lineupchange,114,,basketball_play,1774404507,105,True,2026-03-25 02:08:27+00:00,4,537.0,2343.0,39.05,360
1,105,quarter,4,00c3e69d-d9b9-4ac3-bf79-19707fe43637,105,8:57,Tristan da Silva makes regular free throw 2 of 2,freethrowmade,114,90381a35-42a6-4975-851f-175418e4271a,basketball_play,1774404507,104,True,2026-03-25 02:08:27+00:00,4,537.0,2343.0,39.05,361
1,104,quarter,4,90381a35-42a6-4975-851f-175418e4271a,105,8:32,James Harden misses two point driving floating bank jump shot,twopointmiss,114,,basketball_play,1774404533,103,True,2026-03-25 02:08:53+00:00,4,512.0,2368.0,39.46666666666667,362
1,103,quarter,4,00c3e69d-d9b9-4ac3-bf79-19707fe43637,105,8:30,Moritz Wagner defensive rebound,rebound,114,00c3e69d-d9b9-4ac3-bf79-19707fe43637,basketball_play,1774404535,102,True,2026-03-25 02:08:55+00:00,4,510.0,2370.0,39.5,363
1,102,quarter,4,90381a35-42a6-4975-851f-175418e4271a,105,8:24,James Harden personal foul (Paolo Banchero draws the foul),personalfoul,114,00c3e69d-d9b9-4ac3-bf79-19707fe43637,basketball_play,1774404546,101,True,2026-03-25 02:09:06+00:00,4,504.0,2376.0,39.6,364
1,101,quarter,4,00c3e69d-d9b9-4ac3-bf79-19707fe43637,107,8:11,Moritz Wagner makes two point driving layup (Tristan da Silva assists),twopointmade,114,90381a35-42a6-4975-851f-175418e4271a,basketball_play,1774404572,100,True,2026-03-25 02:09:32+00:00,4,491.0,2389.0,39.81666666666667,365
1,100,quarter,4,90381a35-42a6-4975-851f-175418e4271a,107,8:04,Evan Mobley makes two point cutting dunk (Dennis Schroder assists),twopointmade,116,00c3e69d-d9b9-4ac3-bf79-19707fe43637,basketball_play,1774404577,99,True,2026-03-25 02:09:37+00:00,4,484.0,2396.0,39.93333333333333,366
1,99,quarter,4,90381a35-42a6-4975-851f-175418e4271a,107,7:52,Evan Mobley shooting foul (Paolo Banchero draws the foul),shootingfoul,116,00c3e69d-d9b9-4ac3-bf79-19707fe43637,basketball_play,1774404594,98,True,2026-03-25 02:09:54+00:00,4,472.0,2408.0,40.13333333333333,367
1,98,quarter,4,00c3e69d-d9b9-4ac3-bf79-19707fe43637,108,7:52,Paolo Banchero makes regular free throw 1 of 2,freethrowmade,116,00c3e69d-d9b9-4ac3-bf79-19707fe43637,basketball_play,1774404624,97,True,2026-03-25 02:10:24+00:00,4,472.0,2408.0,40.13333333333333,368
1,97,quarter,4,90381a35-42a6-4975-851f-175418e4271a,108,7:52,"Cavaliers lineup change (Dennis Schroder, James Harden, Dean Wade, Keon Ellis, Sam Merrill)",lineupchange,116,,basketball_play,1774404625,96,True,2026-03-25 02:10:25+00:00,4,472.0,2408.0,40.13333333333333,369
1,96,quarter,4,00c3e69d-d9b9-4ac3-bf79-19707fe43637,109,7:52,Paolo Banchero makes regular free throw 2 of 2,freethrowmade,116,90381a35-42a6-4975-851f-175418e4271a,basketball_play,1774404656,95,True,2026-03-25 02:10:56+00:00,4,472.0,2408.0,40.13333333333333,370
1,95,quarter,4,90381a35-42a6-4975-851f-175418e4271a,109,7:37,Sam Merrill misses three point stepback jump shot,threepointmiss,116,,basketball_play,1774404670,94,True,2026-03-25 02:11:10+00:00,4,457.0,2423.0,40.38333333333333,371
1,94,quarter,4,00c3e69d-d9b9-4ac3-bf79-19707fe43637,109,7:35,Paolo Banchero defensive rebound,rebound,116,00c3e69d-d9b9-4ac3-bf79-19707fe43637,basketball_play,1774404672,93,True,2026-03-25 02:11:12+00:00,4,455.0,2425.0,40.416666666666664,372
1,93,quarter,4,00c3e69d-d9b9-4ac3-bf79-19707fe43637,109,7:20,Magic 60 second timeout,teamtimeout,116,,basketball_play,1774404709,92,True,2026-03-25 02:11:49+00:00,4,440.0,2440.0,40.666666666666664,373
1,92,quarter,4,,109,7:20,Instant replay (Challenge: Ruling Overturned),review,116,,basketball_play,1774404715,91,True,2026-03-25 02:11:55+00:00,4,440.0,2440.0,40.666666666666664,374
1,91,quarter,4,00c3e69d-d9b9-4ac3-bf79-19707fe43637,111,7:20,Tristan da Silva makes two point driving layup (Jevon Carter assists),twopointmade,116,90381a35-42a6-4975-851f-175418e4271a,basketball_play,1774404783,90,True,2026-03-25 02:13:03+00:00,4,440.0,2440.0,40.666666666666664,375
1,90,quarter,4,90381a35-42a6-4975-851f-175418e4271a,111,7:20,Dennis Schroder shooting foul (Tristan da Silva draws the foul),shootingfoul,116,00c3e69d-d9b9-4ac3-bf79-19707fe43637,basketball_play,1774404798,89,True,2026-03-25 02:13:18+00:00,4,440.0,2440.0,40.666666666666664,376
1,89,quarter,4,00c3e69d-d9b9-4ac3-bf79-19707fe43637,111,7:20,"Magic lineup change (Tristan da Silva, Desmond Bane, Moritz Wagner, Jamal Cain, Paolo Banchero)",lineupchange,116,,basketball_play,1774404916,88,True,2026-03-25 02:15:16+00:00,4,440.0,2440.0,40.666666666666664,377
1,88,quarter,4,00c3e69d-d9b9-4ac3-bf79-19707fe43637,112,7:20,Tristan da Silva makes regular free throw 1 of 1,freethrowmade,116,,basketball_play,1774404916,87,True,2026-03-25 02:15:16+00:00,4,440.0,2440.0,40.666666666666664,378
1,87,quarter,4,00c3e69d-d9b9-4ac3-bf79-19707fe43637,112,7:01,Paolo Banchero personal foul (James Harden draws the foul),personalfoul,116,90381a35-42a6-4975-851f-175418e4271a,basketball_play,1774404942,86,True,2026-03-25 02:15:42+00:00,4,421.0,2459.0,40.983333333333334,379
1,86,quarter,4,00c3e69d-d9b9-4ac3-bf79-19707fe43637,112,7:01,"Magic lineup change (Tristan da Silva, Desmond Bane, Jevon Carter, Jamal Cain, Paolo Banchero)",lineupchange,116,,basketball_play,1774404956,85,True,2026-03-25 02:15:56+00:00,4,421.0,2459.0,40.983333333333334,380
1,85,quarter,4,90381a35-42a6-4975-851f-175418e4271a,112,7:01,"Cavaliers lineup change (James Harden, Dean Wade, Keon Ellis, Sam Merrill, Max Strus)",lineupchange,116,,basketball_play,1774404956,84,True,2026-03-25 02:15:56+00:00,4,421.0,2459.0,40.983333333333334,381
1,84,quarter,4,90381a35-42a6-4975-851f-175418e4271a,112,6:47,Max Strus makes three point jump shot (James Harden assists),threepointmade,119,00c3e69d-d9b9-4ac3-bf79-19707fe43637,basketball_play,1774404984,83,True,2026-03-25 02:16:24+00:00,4,407.0,2473.0,41.21666666666667,382
1,83,quarter,4,00c3e69d-d9b9-4ac3-bf79-19707fe43637,114,6:32,Jamal Cain makes two point driving layup (Jevon Carter assists),twopointmade,119,90381a35-42a6-4975-851f-175418e4271a,basketball_play,1774404999,82,True,2026-03-25 02:16:39+00:00,4,392.0,2488.0,41.46666666666667,383
1,82,quarter,4,90381a35-42a6-4975-851f-175418e4271a,114,6:09,Paolo Banchero blocks James Harden's two point driving layup,twopointmiss,119,,basketball_play,1774405022,81,True,2026-03-25 02:17:02+00:00,4,369.0,2511.0,41.85,384
1,81,quarter,4,00c3e69d-d9b9-4ac3-bf79-19707fe43637,114,6:06,Jamal Cain defensive rebound,rebound,119,00c3e69d-d9b9-4ac3-bf79-19707fe43637,basketball_play,1774405025,80,True,2026-03-25 02:17:05+00:00,4,366.0,2514.0,41.9,385
1,80,quarter,4,00c3e69d-d9b9-4ac3-bf79-19707fe43637,114,6:02,Jevon Carter misses three point running jump shot,threepointmiss,119,,basketball_play,1774405028,79,True,2026-03-25 02:17:08+00:00,4,362.0,2518.0,41.96666666666667,386
1,79,quarter,4,90381a35-42a6-4975-851f-175418e4271a,114,5:59,James Harden defensive rebound,rebound,119,90381a35-42a6-4975-851f-175418e4271a,basketball_play,1774405031,78,True,2026-03-25 02:17:11+00:00,4,359.0,2521.0,42.016666666666666,387
1,78,quarter,4,00c3e69d-d9b9-4ac3-bf79-19707fe43637,114,5:55,Desmond Bane shooting foul (Sam Merrill draws the foul),shootingfoul,119,90381a35-42a6-4975-851f-175418e4271a,basketball_play,1774405039,77,True,2026-03-25 02:17:19+00:00,4,355.0,2525.0,42.083333333333336,388
1,77,quarter,4,90381a35-42a6-4975-851f-175418e4271a,114,5:55,Sam Merrill makes regular free throw 1 of 2,freethrowmade,120,90381a35-42a6-4975-851f-175418e4271a,basketball_play,1774405066,76,True,2026-03-25 02:17:46+00:00,4,355.0,2525.0,42.083333333333336,389
1,76,quarter,4,90381a35-42a6-4975-851f-175418e4271a,114,5:55,"Cavaliers lineup change (James Harden, Evan Mobley, Keon Ellis, Sam Merrill, Max Strus)",lineupchange,120,,basketball_play,1774405088,75,True,2026-03-25 02:18:08+00:00,4,355.0,2525.0,42.083333333333336,390
1,75,quarter,4,90381a35-42a6-4975-851f-175418e4271a,114,5:55,Sam Merrill makes regular free throw 2 of 2,freethrowmade,121,00c3e69d-d9b9-4ac3-bf79-19707fe43637,basketball_play,1774405066,74,True,2026-03-25 02:17:46+00:00,4,355.0,2525.0,42.083333333333336,391
1,74,quarter,4,00c3e69d-d9b9-4ac3-bf79-19707fe43637,114,5:38,Paolo Banchero misses three point stepback jump shot,threepointmiss,121,,basketball_play,1774405110,73,True,2026-03-25 02:18:30+00:00,4,338.0,2542.0,42.36666666666667,392
1,73,quarter,4,90381a35-42a6-4975-851f-175418e4271a,114,5:36,Cavaliers defensive rebound,rebound,121,90381a35-42a6-4975-851f-175418e4271a,basketball_play,1774405112,72,True,2026-03-25 02:18:32+00:00,4,336.0,2544.0,42.4,393
1,72,quarter,4,,114,5:36,Stoppage (Out of bounds),stoppage,121,,basketball_play,1774405120,71,True,2026-03-25 02:18:40+00:00,4,336.0,2544.0,42.4,394
1,71,quarter,4,90381a35-42a6-4975-851f-175418e4271a,114,5:36,"Cavaliers lineup change (Donovan Mitchell, James Harden, Evan Mobley, Sam Merrill, Max Strus)",lineupchange,121,,basketball_play,1774405146,70,True,2026-03-25 02:19:06+00:00,4,336.0,2544.0,42.4,395
1,70,quarter,4,90381a35-42a6-4975-851f-175418e4271a,114,5:19,Donovan Mitchell makes two point driving floating jump shot (Evan Mobley assists),twopointmade,123,00c3e69d-d9b9-4ac3-bf79-19707fe43637,basketball_play,1774405146,69,True,2026-03-25 02:19:06+00:00,4,319.0,2561.0,42.68333333333333,396
1,69,quarter,4,00c3e69d-d9b9-4ac3-bf79-19707fe43637,114,5:19,Magic 60 second timeout,teamtimeout,123,,basketball_play,1774405153,68,True,2026-03-25 02:19:13+00:00,4,319.0,2561.0,42.68333333333333,397
1,68,quarter,4,00c3e69d-d9b9-4ac3-bf79-19707fe43637,114,5:19,"Magic lineup change (Tristan da Silva, Desmond Bane, Wendell Carter Jr., Jamal Cain, Paolo Banchero)",lineupchange,123,,basketball_play,1774405363,67,True,2026-03-25 02:22:43+00:00,4,319.0,2561.0,42.68333333333333,398
1,67,quarter,4,00c3e69d-d9b9-4ac3-bf79-19707fe43637,114,5:09,Desmond Bane turnover (bad pass) (Sam Merrill steals),turnover,123,90381a35-42a6-4975-851f-175418e4271a,basketball_play,1774405363,66,True,2026-03-25 02:22:43+00:00,4,309.0,2571.0,42.85,399
1,66,quarter,4,90381a35-42a6-4975-851f-175418e4271a,114,5:01,Donovan Mitchell misses three point pullup jump shot,threepointmiss,123,,basketball_play,1774405371,65,True,2026-03-25 02:22:51+00:00,4,301.0,2579.0,42.983333333333334,400
1,65,quarter,4,00c3e69d-d9b9-4ac3-bf79-19707fe43637,114,5:01,Magic defensive rebound,rebound,123,00c3e69d-d9b9-4ac3-bf79-19707fe43637,basketball_play,1774405371,64,True,2026-03-25 02:22:51+00:00,4,301.0,2579.0,42.983333333333334,401
1,64,quarter,4,,114,5:01,Stoppage (Out of bounds),stoppage,123,,basketball_play,1774405386,63,True,2026-03-25 02:23:06+00:00,4,301.0,2579.0,42.983333333333334,402
1,63,quarter,4,00c3e69d-d9b9-4ac3-bf79-19707fe43637,114,4:46,Wendell Carter Jr. misses three point jump shot,threepointmiss,123,,basketball_play,1774405402,62,True,2026-03-25 02:23:22+00:00,4,286.0,2594.0,43.233333333333334,403
1,62,quarter,4,00c3e69d-d9b9-4ac3-bf79-19707fe43637,114,4:46,Jamal Cain offensive rebound,rebound,123,00c3e69d-d9b9-4ac3-bf79-19707fe43637,basketball_play,1774405408,61,True,2026-03-25 02:23:28+00:00,4,286.0,2594.0,43.233333333333334,404
1,61,quarter,4,90381a35-42a6-4975-851f-175418e4271a,114,4:46,Donovan Mitchell shooting foul (Jamal Cain draws the foul),shootingfoul,123,00c3e69d-d9b9-4ac3-bf79-19707fe43637,basketball_play,1774405409,60,True,2026-03-25 02:23:29+00:00,4,286.0,2594.0,43.233333333333334,405
1,60,quarter,4,00c3e69d-d9b9-4ac3-bf79-19707fe43637,115,4:46,Jamal Cain makes regular free throw 1 of 2,freethrowmade,123,00c3e69d-d9b9-4ac3-bf79-19707fe43637,basketball_play,1774405434,59,True,2026-03-25 02:23:54+00:00,4,286.0,2594.0,43.233333333333334,406
1,59,quarter,4,00c3e69d-d9b9-4ac3-bf79-19707fe43637,116,4:46,Jamal Cain makes regular free throw 2 of 2,freethrowmade,123,90381a35-42a6-4975-851f-175418e4271a,basketball_play,1774405450,58,True,2026-03-25 02:24:10+00:00,4,286.0,2594.0,43.233333333333334,407
1,58,quarter,4,00c3e69d-d9b9-4ac3-bf79-19707fe43637,116,4:28,Desmond Bane personal foul (Evan Mobley draws the foul),personalfoul,123,90381a35-42a6-4975-851f-175418e4271a,basketball_play,1774405470,57,True,2026-03-25 02:24:30+00:00,4,268.0,2612.0,43.53333333333333,408
1,57,quarter,4,90381a35-42a6-4975-851f-175418e4271a,116,4:19,Max Strus misses three point jump shot,threepointmiss,123,,basketball_play,1774405500,56,True,2026-03-25 02:25:00+00:00,4,259.0,2621.0,43.68333333333333,409
1,56,quarter,4,90381a35-42a6-4975-851f-175418e4271a,116,4:17,Evan Mobley offensive rebound,rebound,123,90381a35-42a6-4975-851f-175418e4271a,basketball_play,1774405501,55,True,2026-03-25 02:25:01+00:00,4,257.0,2623.0,43.71666666666667,410
1,55,quarter,4,90381a35-42a6-4975-851f-175418e4271a,116,4:12,Sam Merrill misses three point jump shot,threepointmiss,123,,basketball_play,1774405506,54,True,2026-03-25 02:25:06+00:00,4,252.0,2628.0,43.8,411
1,54,quarter,4,90381a35-42a6-4975-851f-175418e4271a,116,4:12,Max Strus offensive rebound,rebound,123,90381a35-42a6-4975-851f-175418e4271a,basketball_play,1774405506,53,True,2026-03-25 02:25:06+00:00,4,252.0,2628.0,43.8,412
1,53,quarter,4,90381a35-42a6-4975-851f-175418e4271a,116,4:11,Max Strus makes two point tip dunk,twopointmade,125,00c3e69d-d9b9-4ac3-bf79-19707fe43637,basketball_play,1774405513,52,True,2026-03-25 02:25:13+00:00,4,251.0,2629.0,43.81666666666667,413
1,52,quarter,4,90381a35-42a6-4975-851f-175418e4271a,116,4:00,Max Strus personal foul (Tristan da Silva draws the foul),personalfoul,125,00c3e69d-d9b9-4ac3-bf79-19707fe43637,basketball_play,1774405523,51,True,2026-03-25 02:25:23+00:00,4,240.0,2640.0,44.0,414
1,51,quarter,4,00c3e69d-d9b9-4ac3-bf79-19707fe43637,117,4:00,Tristan da Silva makes regular free throw 1 of 2,freethrowmade,125,00c3e69d-d9b9-4ac3-bf79-19707fe43637,basketball_play,1774405551,50,True,2026-03-25 02:25:51+00:00,4,240.0,2640.0,44.0,415
1,50,quarter,4,00c3e69d-d9b9-4ac3-bf79-19707fe43637,118,4:00,Tristan da Silva makes regular free throw 2 of 2,freethrowmade,125,90381a35-42a6-4975-851f-175418e4271a,basketball_play,1774405572,49,True,2026-03-25 02:26:12+00:00,4,240.0,2640.0,44.0,416
