period_index,event_index,period_type,period_number,attribution,away_points,clock,description,event_type,home_points,possession,type,wall_clock,pbp_source_row,has_wall_clock,event_ts_utc,period_sequence,game_clock_seconds_remaining,game_elapsed_seconds,game_elapsed_minutes,pbp_chronological_index
2,39,quarter,3,,89,3:26,Stoppage (Out of bounds),stoppage,61,,basketball_play,1774489348,153,True,2026-03-26 01:42:28+00:00,3,206.0,1954.0,32.56666666666667,315
2,38,quarter,3,ad36c3e8-4194-4e63-920f-7c50f46191a6,89,3:26,"Spurs lineup change (Keldon Johnson, Devin Vassell, Victor Wembanyama, Harrison Barnes, Julian Champagnie)",lineupchange,61,,basketball_play,1774489349,152,True,2026-03-26 01:42:29+00:00,3,206.0,1954.0,32.56666666666667,316
2,37,quarter,3,1cfe70b8-4dfc-47dc-acca-b68d4a725972,89,3:26,"Grizzlies lineup change (Walter Clayton Jr., Olivier-Maxence Prosper, Tyler Burton, GG Jackson, Cam Spencer)",lineupchange,61,,basketball_play,1774489349,151,True,2026-03-26 01:42:29+00:00,3,206.0,1954.0,32.56666666666667,317
2,36,quarter,3,ad36c3e8-4194-4e63-920f-7c50f46191a6,89,3:12,Keldon Johnson misses two point driving layup,twopointmiss,61,,basketball_play,1774489405,150,True,2026-03-26 01:43:25+00:00,3,192.0,1968.0,32.8,318
2,35,quarter,3,ad36c3e8-4194-4e63-920f-7c50f46191a6,89,3:10,Keldon Johnson offensive rebound,rebound,61,ad36c3e8-4194-4e63-920f-7c50f46191a6,basketball_play,1774489407,149,True,2026-03-26 01:43:27+00:00,3,190.0,1970.0,32.833333333333336,319
2,34,quarter,3,ad36c3e8-4194-4e63-920f-7c50f46191a6,91,3:10,Keldon Johnson makes two point putback layup,twopointmade,61,1cfe70b8-4dfc-47dc-acca-b68d4a725972,basketball_play,1774489407,148,True,2026-03-26 01:43:27+00:00,3,190.0,1970.0,32.833333333333336,320
2,33,quarter,3,1cfe70b8-4dfc-47dc-acca-b68d4a725972,91,2:56,Cam Spencer misses three point pullup jump shot,threepointmiss,61,,basketball_play,1774489420,147,True,2026-03-26 01:43:40+00:00,3,176.0,1984.0,33.06666666666667,321
2,32,quarter,3,ad36c3e8-4194-4e63-920f-7c50f46191a6,91,2:53,Harrison Barnes defensive rebound,rebound,61,ad36c3e8-4194-4e63-920f-7c50f46191a6,basketball_play,1774489423,146,True,2026-03-26 01:43:43+00:00,3,173.0,1987.0,33.11666666666667,322
2,31,quarter,3,ad36c3e8-4194-4e63-920f-7c50f46191a6,93,2:50,Keldon Johnson makes two point running dunk (Harrison Barnes assists),twopointmade,61,1cfe70b8-4dfc-47dc-acca-b68d4a725972,basketball_play,1774489427,145,True,2026-03-26 01:43:47+00:00,3,170.0,1990.0,33.166666666666664,323
2,30,quarter,3,1cfe70b8-4dfc-47dc-acca-b68d4a725972,93,2:50,Grizzlies 60 second timeout,teamtimeout,61,,basketball_play,1774489431,144,True,2026-03-26 01:43:51+00:00,3,170.0,1990.0,33.166666666666664,324
2,29,quarter,3,ad36c3e8-4194-4e63-920f-7c50f46191a6,93,2:50,"Spurs lineup change (Keldon Johnson, Victor Wembanyama, Dylan Harper, Harrison Barnes, Julian Champagnie)",lineupchange,61,,basketball_play,1774489547,143,True,2026-03-26 01:45:47+00:00,3,170.0,1990.0,33.166666666666664,325
2,28,quarter,3,1cfe70b8-4dfc-47dc-acca-b68d4a725972,93,2:39,Cam Spencer turnover (bad pass) (Victor Wembanyama steals),turnover,61,ad36c3e8-4194-4e63-920f-7c50f46191a6,basketball_play,1774489547,142,True,2026-03-26 01:45:47+00:00,3,159.0,2001.0,33.35,326
2,27,quarter,3,ad36c3e8-4194-4e63-920f-7c50f46191a6,95,2:32,Keldon Johnson makes two point driving floating jump shot (Dylan Harper assists),twopointmade,61,1cfe70b8-4dfc-47dc-acca-b68d4a725972,basketball_play,1774489554,141,True,2026-03-26 01:45:54+00:00,3,152.0,2008.0,33.46666666666667,327
2,26,quarter,3,1cfe70b8-4dfc-47dc-acca-b68d4a725972,95,2:08,Victor Wembanyama blocks Walter Clayton Jr.'s two point driving layup,twopointmiss,61,,basketball_play,1774489578,140,True,2026-03-26 01:46:18+00:00,3,128.0,2032.0,33.86666666666667,328
2,25,quarter,3,ad36c3e8-4194-4e63-920f-7c50f46191a6,95,2:05,Julian Champagnie defensive rebound,rebound,61,ad36c3e8-4194-4e63-920f-7c50f46191a6,basketball_play,1774489581,139,True,2026-03-26 01:46:21+00:00,3,125.0,2035.0,33.916666666666664,329
2,24,quarter,3,ad36c3e8-4194-4e63-920f-7c50f46191a6,95,2:01,Keldon Johnson misses three point running jump shot,threepointmiss,61,,basketball_play,1774489585,138,True,2026-03-26 01:46:25+00:00,3,121.0,2039.0,33.983333333333334,330
2,23,quarter,3,1cfe70b8-4dfc-47dc-acca-b68d4a725972,95,1:56,GG Jackson defensive rebound,rebound,61,1cfe70b8-4dfc-47dc-acca-b68d4a725972,basketball_play,1774489590,137,True,2026-03-26 01:46:30+00:00,3,116.0,2044.0,34.06666666666667,331
2,22,quarter,3,1cfe70b8-4dfc-47dc-acca-b68d4a725972,95,1:35,GG Jackson misses two point fadeaway jump shot,twopointmiss,61,,basketball_play,1774489610,136,True,2026-03-26 01:46:50+00:00,3,95.0,2065.0,34.416666666666664,332
2,21,quarter,3,ad36c3e8-4194-4e63-920f-7c50f46191a6,95,1:32,Victor Wembanyama defensive rebound,rebound,61,ad36c3e8-4194-4e63-920f-7c50f46191a6,basketball_play,1774489613,135,True,2026-03-26 01:46:53+00:00,3,92.0,2068.0,34.46666666666667,333
2,20,quarter,3,ad36c3e8-4194-4e63-920f-7c50f46191a6,95,1:20,Victor Wembanyama misses two point driving layup,twopointmiss,61,,basketball_play,1774489625,134,True,2026-03-26 01:47:05+00:00,3,80.0,2080.0,34.666666666666664,334
2,19,quarter,3,1cfe70b8-4dfc-47dc-acca-b68d4a725972,95,1:18,GG Jackson defensive rebound,rebound,61,1cfe70b8-4dfc-47dc-acca-b68d4a725972,basketball_play,1774489627,133,True,2026-03-26 01:47:07+00:00,3,78.0,2082.0,34.7,335
2,18,quarter,3,,95,1:18,Stoppage (Out of bounds),stoppage,61,,basketball_play,1774489630,132,True,2026-03-26 01:47:10+00:00,3,78.0,2082.0,34.7,336
2,17,quarter,3,1cfe70b8-4dfc-47dc-acca-b68d4a725972,95,1:18,"Grizzlies lineup change (Walter Clayton Jr., Olivier-Maxence Prosper, Taj Gibson, Cedric Coward, GG Jackson)",lineupchange,61,,basketball_play,1774489631,131,True,2026-03-26 01:47:11+00:00,3,78.0,2082.0,34.7,337
2,16,quarter,3,1cfe70b8-4dfc-47dc-acca-b68d4a725972,95,1:08,Cedric Coward misses three point pullup jump shot,threepointmiss,61,,basketball_play,1774489654,130,True,2026-03-26 01:47:34+00:00,3,68.0,2092.0,34.86666666666667,338
2,15,quarter,3,ad36c3e8-4194-4e63-920f-7c50f46191a6,95,1:05,Keldon Johnson defensive rebound,rebound,61,ad36c3e8-4194-4e63-920f-7c50f46191a6,basketball_play,1774489657,129,True,2026-03-26 01:47:37+00:00,3,65.0,2095.0,34.916666666666664,339
2,14,quarter,3,ad36c3e8-4194-4e63-920f-7c50f46191a6,95,00:59.60,GG Jackson blocks Keldon Johnson's two point driving layup,twopointmiss,61,,basketball_play,1774489663,128,True,2026-03-26 01:47:43+00:00,3,59.6,2100.4,35.00666666666667,340
2,13,quarter,3,1cfe70b8-4dfc-47dc-acca-b68d4a725972,95,00:55.90,Olivier-Maxence Prosper defensive rebound,rebound,61,1cfe70b8-4dfc-47dc-acca-b68d4a725972,basketball_play,1774489667,127,True,2026-03-26 01:47:47+00:00,3,55.9,2104.1,35.068333333333335,341
2,12,quarter,3,1cfe70b8-4dfc-47dc-acca-b68d4a725972,95,00:52,Dylan Harper blocks Walter Clayton Jr.'s two point driving finger roll layup,twopointmiss,61,,basketball_play,1774489672,126,True,2026-03-26 01:47:52+00:00,3,52.0,2108.0,35.13333333333333,342
2,11,quarter,3,1cfe70b8-4dfc-47dc-acca-b68d4a725972,95,00:52,Grizzlies offensive rebound,rebound,61,1cfe70b8-4dfc-47dc-acca-b68d4a725972,basketball_play,1774489672,125,True,2026-03-26 01:47:52+00:00,3,52.0,2108.0,35.13333333333333,343
2,10,quarter,3,,95,00:52,Stoppage (Out of bounds),stoppage,61,,basketball_play,1774489676,124,True,2026-03-26 01:47:56+00:00,3,52.0,2108.0,35.13333333333333,344
2,9,quarter,3,1cfe70b8-4dfc-47dc-acca-b68d4a725972,95,00:36.90,GG Jackson makes three point stepback jump shot,threepointmade,64,ad36c3e8-4194-4e63-920f-7c50f46191a6,basketball_play,1774489712,123,True,2026-03-26 01:48:32+00:00,3,36.9,2123.1,35.385,345
2,8,quarter,3,,95,00:35.80,Stoppage (Equipment malfunction),stoppage,64,,basketball_play,1774489728,122,True,2026-03-26 01:48:48+00:00,3,35.8,2124.2,35.40333333333333,346
2,7,quarter,3,ad36c3e8-4194-4e63-920f-7c50f46191a6,95,00:26.30,Victor Wembanyama offensive foul (Cedric Coward draws the foul),offensivefoul,64,1cfe70b8-4dfc-47dc-acca-b68d4a725972,basketball_play,1774489760,121,True,2026-03-26 01:49:20+00:00,3,26.3,2133.7,35.56166666666666,347
2,6,quarter,3,ad36c3e8-4194-4e63-920f-7c50f46191a6,95,00:26.30,Victor Wembanyama turnover (offensive foul),turnover,64,1cfe70b8-4dfc-47dc-acca-b68d4a725972,basketball_play,1774489760,120,True,2026-03-26 01:49:20+00:00,3,26.3,2133.7,35.56166666666666,348
2,5,quarter,3,1cfe70b8-4dfc-47dc-acca-b68d4a725972,95,00:06.70,Walter Clayton Jr. misses three point pullup jump shot,threepointmiss,64,,basketball_play,1774489789,119,True,2026-03-26 01:49:49+00:00,3,6.7,2153.3,35.888333333333335,349
2,4,quarter,3,ad36c3e8-4194-4e63-920f-7c50f46191a6,95,00:04.60,Julian Champagnie defensive rebound,rebound,64,ad36c3e8-4194-4e63-920f-7c50f46191a6,basketball_play,1774489791,118,True,2026-03-26 01:49:51+00:00,3,4.6,2155.4,35.92333333333333,350
2,3,quarter,3,ad36c3e8-4194-4e63-920f-7c50f46191a6,98,00:00.20,Victor Wembanyama makes three point jump shot (Dylan Harper assists),threepointmade,64,1cfe70b8-4dfc-47dc-acca-b68d4a725972,basketball_play,1774489796,117,True,2026-03-26 01:49:56+00:00,3,0.2,2159.8,35.99666666666667,351
2,2,quarter,3,,98,00:00,Instant replay (Request: Ruling Upheld),review,64,,basketball_play,1774489808,116,True,2026-03-26 01:50:08+00:00,3,0.0,2160.0,36.0,352
2,1,quarter,3,,98,00:00,End of 3rd Quarter.,endperiod,64,,basketball_play,1774489808,115,True,2026-03-26 01:50:08+00:00,3,0.0,2160.0,36.0,353
1,115,quarter,4,ad36c3e8-4194-4e63-920f-7c50f46191a6,98,12:00,"Spurs lineup change (Keldon Johnson, Jordan McLaughlin, Harrison Barnes, Carter Bryant, Mason Plumlee)",lineupchange,64,,basketball_play,1774489914,114,True,2026-03-26 01:51:54+00:00,4,720.0,2160.0,36.0,354
1,114,quarter,4,1cfe70b8-4dfc-47dc-acca-b68d4a725972,98,12:00,"Grizzlies lineup change (Taj Gibson, Cedric Coward, GG Jackson, Cam Spencer, Javon Small)",lineupchange,64,,basketball_play,1774489914,113,True,2026-03-26 01:51:54+00:00,4,720.0,2160.0,36.0,355
1,113,quarter,4,,98,12:00,Start of 4th Quarter,startperiod,64,,basketball_play,1774489964,112,True,2026-03-26 01:52:44+00:00,4,720.0,2160.0,36.0,356
1,112,quarter,4,ad36c3e8-4194-4e63-920f-7c50f46191a6,98,11:44,Mason Plumlee turnover (out of bounds lost ball),turnover,64,1cfe70b8-4dfc-47dc-acca-b68d4a725972,basketball_play,1774489981,111,True,2026-03-26 01:53:01+00:00,4,704.0,2176.0,36.266666666666666,357
1,111,quarter,4,1cfe70b8-4dfc-47dc-acca-b68d4a725972,98,11:33,Cam Spencer misses two point pullup jump shot,twopointmiss,64,,basketball_play,1774489996,110,True,2026-03-26 01:53:16+00:00,4,693.0,2187.0,36.45,358
1,110,quarter,4,1cfe70b8-4dfc-47dc-acca-b68d4a725972,98,11:30,Javon Small offensive rebound,rebound,64,1cfe70b8-4dfc-47dc-acca-b68d4a725972,basketball_play,1774490000,109,True,2026-03-26 01:53:20+00:00,4,690.0,2190.0,36.5,359
1,109,quarter,4,1cfe70b8-4dfc-47dc-acca-b68d4a725972,98,11:26,Cam Spencer misses two point jump shot,twopointmiss,64,,basketball_play,1774490004,108,True,2026-03-26 01:53:24+00:00,4,686.0,2194.0,36.56666666666667,360
1,108,quarter,4,ad36c3e8-4194-4e63-920f-7c50f46191a6,98,11:21,Harrison Barnes defensive rebound,rebound,64,ad36c3e8-4194-4e63-920f-7c50f46191a6,basketball_play,1774490009,107,True,2026-03-26 01:53:29+00:00,4,681.0,2199.0,36.65,361
1,107,quarter,4,ad36c3e8-4194-4e63-920f-7c50f46191a6,98,11:08,Keldon Johnson misses two point driving floating jump shot,twopointmiss,64,,basketball_play,1774490021,106,True,2026-03-26 01:53:41+00:00,4,668.0,2212.0,36.86666666666667,362
1,106,quarter,4,ad36c3e8-4194-4e63-920f-7c50f46191a6,98,11:05,Mason Plumlee offensive rebound,rebound,64,ad36c3e8-4194-4e63-920f-7c50f46191a6,basketball_play,1774490024,105,True,2026-03-26 01:53:44+00:00,4,665.0,2215.0,36.916666666666664,363
1,105,quarter,4,ad36c3e8-4194-4e63-920f-7c50f46191a6,100,11:05,Mason Plumlee makes two point tip layup,twopointmade,64,1cfe70b8-4dfc-47dc-acca-b68d4a725972,basketball_play,1774490024,104,True,2026-03-26 01:53:44+00:00,4,665.0,2215.0,36.916666666666664,364
1,104,quarter,4,1cfe70b8-4dfc-47dc-acca-b68d4a725972,100,10:47,Cedric Coward misses three point jump shot,threepointmiss,64,,basketball_play,1774490042,103,True,2026-03-26 01:54:02+00:00,4,647.0,2233.0,37.21666666666667,365
1,103,quarter,4,ad36c3e8-4194-4e63-920f-7c50f46191a6,100,10:42,Mason Plumlee defensive rebound,rebound,64,ad36c3e8-4194-4e63-920f-7c50f46191a6,basketball_play,1774490047,102,True,2026-03-26 01:54:07+00:00,4,642.0,2238.0,37.3,366
1,102,quarter,4,ad36c3e8-4194-4e63-920f-7c50f46191a6,103,10:32,Harrison Barnes makes three point pullup jump shot (Mason Plumlee assists),threepointmade,64,1cfe70b8-4dfc-47dc-acca-b68d4a725972,basketball_play,1774490058,101,True,2026-03-26 01:54:18+00:00,4,632.0,2248.0,37.46666666666667,367
1,101,quarter,4,1cfe70b8-4dfc-47dc-acca-b68d4a725972,103,10:19,Cedric Coward makes two point pullup bank jump shot,twopointmade,66,ad36c3e8-4194-4e63-920f-7c50f46191a6,basketball_play,1774490071,100,True,2026-03-26 01:54:31+00:00,4,619.0,2261.0,37.68333333333333,368
1,100,quarter,4,ad36c3e8-4194-4e63-920f-7c50f46191a6,103,9:59,Jordan McLaughlin misses three point jump shot,threepointmiss,66,,basketball_play,1774490091,99,True,2026-03-26 01:54:51+00:00,4,599.0,2281.0,38.016666666666666,369
1,99,quarter,4,ad36c3e8-4194-4e63-920f-7c50f46191a6,103,9:56,Keldon Johnson offensive rebound,rebound,66,ad36c3e8-4194-4e63-920f-7c50f46191a6,basketball_play,1774490094,98,True,2026-03-26 01:54:54+00:00,4,596.0,2284.0,38.06666666666667,370
1,98,quarter,4,ad36c3e8-4194-4e63-920f-7c50f46191a6,105,9:53,Keldon Johnson makes two point driving floating jump shot,twopointmade,66,1cfe70b8-4dfc-47dc-acca-b68d4a725972,basketball_play,1774490096,97,True,2026-03-26 01:54:56+00:00,4,593.0,2287.0,38.11666666666667,371
1,97,quarter,4,1cfe70b8-4dfc-47dc-acca-b68d4a725972,105,9:40,Taj Gibson makes two point turnaround jump shot (Cedric Coward assists),twopointmade,68,ad36c3e8-4194-4e63-920f-7c50f46191a6,basketball_play,1774490110,96,True,2026-03-26 01:55:10+00:00,4,580.0,2300.0,38.333333333333336,372
1,96,quarter,4,ad36c3e8-4194-4e63-920f-7c50f46191a6,105,9:29,Mason Plumlee offensive foul (Taj Gibson draws the foul),offensivefoul,68,1cfe70b8-4dfc-47dc-acca-b68d4a725972,basketball_play,1774490125,95,True,2026-03-26 01:55:25+00:00,4,569.0,2311.0,38.516666666666666,373
1,95,quarter,4,ad36c3e8-4194-4e63-920f-7c50f46191a6,105,9:29,Mason Plumlee turnover (offensive foul),turnover,68,1cfe70b8-4dfc-47dc-acca-b68d4a725972,basketball_play,1774490125,94,True,2026-03-26 01:55:25+00:00,4,569.0,2311.0,38.516666666666666,374
1,94,quarter,4,1cfe70b8-4dfc-47dc-acca-b68d4a725972,105,9:18,Taj Gibson makes two point cutting finger roll layup (Cam Spencer assists),twopointmade,70,ad36c3e8-4194-4e63-920f-7c50f46191a6,basketball_play,1774490154,93,True,2026-03-26 01:55:54+00:00,4,558.0,2322.0,38.7,375
1,93,quarter,4,ad36c3e8-4194-4e63-920f-7c50f46191a6,105,9:01,Keldon Johnson misses three point jump shot,threepointmiss,70,,basketball_play,1774490170,92,True,2026-03-26 01:56:10+00:00,4,541.0,2339.0,38.983333333333334,376
1,92,quarter,4,1cfe70b8-4dfc-47dc-acca-b68d4a725972,105,8:57,Cedric Coward defensive rebound,rebound,70,1cfe70b8-4dfc-47dc-acca-b68d4a725972,basketball_play,1774490174,91,True,2026-03-26 01:56:14+00:00,4,537.0,2343.0,39.05,377
1,91,quarter,4,ad36c3e8-4194-4e63-920f-7c50f46191a6,105,8:57,Keldon Johnson shooting foul (GG Jackson draws the foul),shootingfoul,70,1cfe70b8-4dfc-47dc-acca-b68d4a725972,basketball_play,1774490177,90,True,2026-03-26 01:56:17+00:00,4,537.0,2343.0,39.05,378
1,90,quarter,4,1cfe70b8-4dfc-47dc-acca-b68d4a725972,105,8:57,GG Jackson makes regular free throw 1 of 2,freethrowmade,71,1cfe70b8-4dfc-47dc-acca-b68d4a725972,basketball_play,1774490206,89,True,2026-03-26 01:56:46+00:00,4,537.0,2343.0,39.05,379
1,89,quarter,4,ad36c3e8-4194-4e63-920f-7c50f46191a6,105,8:57,"Spurs lineup change (Kelly Olynyk, Lindy Waters III, Bismack Biyombo, Jordan McLaughlin, Carter Bryant)",lineupchange,71,,basketball_play,1774490206,88,True,2026-03-26 01:56:46+00:00,4,537.0,2343.0,39.05,380
1,88,quarter,4,1cfe70b8-4dfc-47dc-acca-b68d4a725972,105,8:57,"Grizzlies lineup change (Cedric Coward, Taylor Hendricks, GG Jackson, Cam Spencer, Javon Small)",lineupchange,71,,basketball_play,1774490206,87,True,2026-03-26 01:56:46+00:00,4,537.0,2343.0,39.05,381
1,87,quarter,4,1cfe70b8-4dfc-47dc-acca-b68d4a725972,105,8:57,GG Jackson makes regular free throw 2 of 2,freethrowmade,72,ad36c3e8-4194-4e63-920f-7c50f46191a6,basketball_play,1774490230,86,True,2026-03-26 01:57:10+00:00,4,537.0,2343.0,39.05,382
1,86,quarter,4,ad36c3e8-4194-4e63-920f-7c50f46191a6,105,8:42,Lindy Waters III misses three point jump shot,threepointmiss,72,,basketball_play,1774490246,85,True,2026-03-26 01:57:26+00:00,4,522.0,2358.0,39.3,383
1,85,quarter,4,1cfe70b8-4dfc-47dc-acca-b68d4a725972,105,8:40,Taylor Hendricks defensive rebound,rebound,72,1cfe70b8-4dfc-47dc-acca-b68d4a725972,basketball_play,1774490248,84,True,2026-03-26 01:57:28+00:00,4,520.0,2360.0,39.333333333333336,384
1,84,quarter,4,1cfe70b8-4dfc-47dc-acca-b68d4a725972,105,8:36,GG Jackson makes two point running finger roll layup (Cam Spencer assists),twopointmade,74,ad36c3e8-4194-4e63-920f-7c50f46191a6,basketball_play,1774490254,83,True,2026-03-26 01:57:34+00:00,4,516.0,2364.0,39.4,385
1,83,quarter,4,ad36c3e8-4194-4e63-920f-7c50f46191a6,105,8:36,Bismack Biyombo shooting foul (GG Jackson draws the foul),shootingfoul,74,1cfe70b8-4dfc-47dc-acca-b68d4a725972,basketball_play,1774490259,82,True,2026-03-26 01:57:39+00:00,4,516.0,2364.0,39.4,386
1,82,quarter,4,1cfe70b8-4dfc-47dc-acca-b68d4a725972,105,8:36,GG Jackson makes regular free throw 1 of 1,freethrowmade,75,,basketball_play,1774490290,81,True,2026-03-26 01:58:10+00:00,4,516.0,2364.0,39.4,387
1,81,quarter,4,1cfe70b8-4dfc-47dc-acca-b68d4a725972,105,8:29,Cedric Coward personal foul (Lindy Waters III draws the foul),personalfoul,75,ad36c3e8-4194-4e63-920f-7c50f46191a6,basketball_play,1774490302,80,True,2026-03-26 01:58:22+00:00,4,509.0,2371.0,39.516666666666666,388
1,80,quarter,4,ad36c3e8-4194-4e63-920f-7c50f46191a6,107,8:22,Jordan McLaughlin makes two point cutting layup (Kelly Olynyk assists),twopointmade,75,1cfe70b8-4dfc-47dc-acca-b68d4a725972,basketball_play,1774490321,79,True,2026-03-26 01:58:41+00:00,4,502.0,2378.0,39.63333333333333,389
1,79,quarter,4,1cfe70b8-4dfc-47dc-acca-b68d4a725972,107,8:12,Taylor Hendricks misses three point jump shot,threepointmiss,75,,basketball_play,1774490331,78,True,2026-03-26 01:58:51+00:00,4,492.0,2388.0,39.8,390
1,78,quarter,4,ad36c3e8-4194-4e63-920f-7c50f46191a6,107,8:08,Jordan McLaughlin defensive rebound,rebound,75,ad36c3e8-4194-4e63-920f-7c50f46191a6,basketball_play,1774490335,77,True,2026-03-26 01:58:55+00:00,4,488.0,2392.0,39.86666666666667,391
1,77,quarter,4,ad36c3e8-4194-4e63-920f-7c50f46191a6,107,7:50,Kelly Olynyk turnover (bad pass) (GG Jackson steals),turnover,75,1cfe70b8-4dfc-47dc-acca-b68d4a725972,basketball_play,1774490353,76,True,2026-03-26 01:59:13+00:00,4,470.0,2410.0,40.166666666666664,392
1,76,quarter,4,1cfe70b8-4dfc-47dc-acca-b68d4a725972,107,7:42,Cedric Coward makes three point jump shot (GG Jackson assists),threepointmade,78,ad36c3e8-4194-4e63-920f-7c50f46191a6,basketball_play,1774490361,75,True,2026-03-26 01:59:21+00:00,4,462.0,2418.0,40.3,393
1,75,quarter,4,ad36c3e8-4194-4e63-920f-7c50f46191a6,109,7:21,Kelly Olynyk makes two point driving floating jump shot (Lindy Waters III assists),twopointmade,78,1cfe70b8-4dfc-47dc-acca-b68d4a725972,basketball_play,1774490382,74,True,2026-03-26 01:59:42+00:00,4,441.0,2439.0,40.65,394
1,74,quarter,4,1cfe70b8-4dfc-47dc-acca-b68d4a725972,109,7:06,Taylor Hendricks misses two point driving finger roll layup,twopointmiss,78,,basketball_play,1774490397,73,True,2026-03-26 01:59:57+00:00,4,426.0,2454.0,40.9,395
1,73,quarter,4,ad36c3e8-4194-4e63-920f-7c50f46191a6,109,7:03,Bismack Biyombo defensive rebound,rebound,78,ad36c3e8-4194-4e63-920f-7c50f46191a6,basketball_play,1774490400,72,True,2026-03-26 02:00:00+00:00,4,423.0,2457.0,40.95,396
1,72,quarter,4,ad36c3e8-4194-4e63-920f-7c50f46191a6,112,6:58,Lindy Waters III makes three point jump shot (Kelly Olynyk assists),threepointmade,78,1cfe70b8-4dfc-47dc-acca-b68d4a725972,basketball_play,1774490405,71,True,2026-03-26 02:00:05+00:00,4,418.0,2462.0,41.03333333333333,397
1,71,quarter,4,1cfe70b8-4dfc-47dc-acca-b68d4a725972,112,6:44,GG Jackson misses three point pullup jump shot,threepointmiss,78,,basketball_play,1774490419,70,True,2026-03-26 02:00:19+00:00,4,404.0,2476.0,41.266666666666666,398
1,70,quarter,4,1cfe70b8-4dfc-47dc-acca-b68d4a725972,112,6:41,Cam Spencer offensive rebound,rebound,78,1cfe70b8-4dfc-47dc-acca-b68d4a725972,basketball_play,1774490422,69,True,2026-03-26 02:00:22+00:00,4,401.0,2479.0,41.31666666666667,399
1,69,quarter,4,1cfe70b8-4dfc-47dc-acca-b68d4a725972,112,6:31,Taylor Hendricks misses three point jump shot,threepointmiss,78,,basketball_play,1774490432,68,True,2026-03-26 02:00:32+00:00,4,391.0,2489.0,41.483333333333334,400
1,68,quarter,4,1cfe70b8-4dfc-47dc-acca-b68d4a725972,112,6:30,Grizzlies offensive rebound,rebound,78,1cfe70b8-4dfc-47dc-acca-b68d4a725972,basketball_play,1774490433,67,True,2026-03-26 02:00:33+00:00,4,390.0,2490.0,41.5,401
1,67,quarter,4,ad36c3e8-4194-4e63-920f-7c50f46191a6,112,6:30,Lindy Waters III personal foul (Loose ball) (GG Jackson draws the foul),personalfoul,78,1cfe70b8-4dfc-47dc-acca-b68d4a725972,basketball_play,1774490437,66,True,2026-03-26 02:00:37+00:00,4,390.0,2490.0,41.5,402
1,66,quarter,4,1cfe70b8-4dfc-47dc-acca-b68d4a725972,112,6:30,Grizzlies 60 second timeout,teamtimeout,78,,basketball_play,1774490451,65,True,2026-03-26 02:00:51+00:00,4,390.0,2490.0,41.5,403
1,65,quarter,4,1cfe70b8-4dfc-47dc-acca-b68d4a725972,112,6:21,GG Jackson makes three point jump shot (Cedric Coward assists),threepointmade,81,ad36c3e8-4194-4e63-920f-7c50f46191a6,basketball_play,1774490625,64,True,2026-03-26 02:03:45+00:00,4,381.0,2499.0,41.65,404
1,64,quarter,4,ad36c3e8-4194-4e63-920f-7c50f46191a6,112,6:10,Lindy Waters III offensive foul (Cedric Coward draws the foul),offensivefoul,81,1cfe70b8-4dfc-47dc-acca-b68d4a725972,basketball_play,1774490640,63,True,2026-03-26 02:04:00+00:00,4,370.0,2510.0,41.833333333333336,405
1,63,quarter,4,ad36c3e8-4194-4e63-920f-7c50f46191a6,112,6:10,Lindy Waters III turnover (offensive foul),turnover,81,1cfe70b8-4dfc-47dc-acca-b68d4a725972,basketball_play,1774490640,62,True,2026-03-26 02:04:00+00:00,4,370.0,2510.0,41.833333333333336,406
1,62,quarter,4,ad36c3e8-4194-4e63-920f-7c50f46191a6,112,5:51,Spurs technical foul (Defensive three second),technicalfoulnonunsportsmanlike,81,1cfe70b8-4dfc-47dc-acca-b68d4a725972,basketball_play,1774490675,61,True,2026-03-26 02:04:35+00:00,4,351.0,2529.0,42.15,407
1,61,quarter,4,1cfe70b8-4dfc-47dc-acca-b68d4a725972,112,5:51,Cam Spencer makes technical free throw 1 of 1,freethrowmade,82,,basketball_play,1774490691,60,True,2026-03-26 02:04:51+00:00,4,351.0,2529.0,42.15,408
1,60,quarter,4,1cfe70b8-4dfc-47dc-acca-b68d4a725972,112,5:44,Cedric Coward misses three point jump shot,threepointmiss,82,,basketball_play,1774490711,59,True,2026-03-26 02:05:11+00:00,4,344.0,2536.0,42.266666666666666,409
1,59,quarter,4,ad36c3e8-4194-4e63-920f-7c50f46191a6,112,5:41,Kelly Olynyk defensive rebound,rebound,82,ad36c3e8-4194-4e63-920f-7c50f46191a6,basketball_play,1774490714,58,True,2026-03-26 02:05:14+00:00,4,341.0,2539.0,42.31666666666667,410
1,58,quarter,4,ad36c3e8-4194-4e63-920f-7c50f46191a6,112,5:23,Lindy Waters III misses three point stepback jump shot,threepointmiss,82,,basketball_play,1774490732,57,True,2026-03-26 02:05:32+00:00,4,323.0,2557.0,42.61666666666667,411
1,57,quarter,4,1cfe70b8-4dfc-47dc-acca-b68d4a725972,112,5:20,Javon Small defensive rebound,rebound,82,1cfe70b8-4dfc-47dc-acca-b68d4a725972,basketball_play,1774490735,56,True,2026-03-26 02:05:35+00:00,4,320.0,2560.0,42.666666666666664,412
1,56,quarter,4,1cfe70b8-4dfc-47dc-acca-b68d4a725972,112,5:15,Javon Small makes three point stepback jump shot,threepointmade,85,ad36c3e8-4194-4e63-920f-7c50f46191a6,basketball_play,1774490740,55,True,2026-03-26 02:05:40+00:00,4,315.0,2565.0,42.75,413
1,55,quarter,4,1cfe70b8-4dfc-47dc-acca-b68d4a725972,112,4:59,Javon Small personal foul (Jordan McLaughlin draws the foul),personalfoul,85,ad36c3e8-4194-4e63-920f-7c50f46191a6,basketball_play,1774490759,54,True,2026-03-26 02:05:59+00:00,4,299.0,2581.0,43.016666666666666,414
1,54,quarter,4,ad36c3e8-4194-4e63-920f-7c50f46191a6,112,4:53,Lindy Waters III misses three point jump shot,threepointmiss,85,,basketball_play,1774490778,53,True,2026-03-26 02:06:18+00:00,4,293.0,2587.0,43.11666666666667,415
1,53,quarter,4,1cfe70b8-4dfc-47dc-acca-b68d4a725972,112,4:51,Taylor Hendricks defensive rebound,rebound,85,1cfe70b8-4dfc-47dc-acca-b68d4a725972,basketball_play,1774490780,52,True,2026-03-26 02:06:20+00:00,4,291.0,2589.0,43.15,416
1,52,quarter,4,1cfe70b8-4dfc-47dc-acca-b68d4a725972,112,4:43,GG Jackson misses three point jump shot,threepointmiss,85,,basketball_play,1774490788,51,True,2026-03-26 02:06:28+00:00,4,283.0,2597.0,43.28333333333333,417
1,51,quarter,4,ad36c3e8-4194-4e63-920f-7c50f46191a6,112,4:39,Bismack Biyombo defensive rebound,rebound,85,ad36c3e8-4194-4e63-920f-7c50f46191a6,basketball_play,1774490792,50,True,2026-03-26 02:06:32+00:00,4,279.0,2601.0,43.35,418
1,50,quarter,4,ad36c3e8-4194-4e63-920f-7c50f46191a6,115,4:29,Kelly Olynyk makes three point jump shot (Jordan McLaughlin assists),threepointmade,85,1cfe70b8-4dfc-47dc-acca-b68d4a725972,basketball_play,1774490801,49,True,2026-03-26 02:06:41+00:00,4,269.0,2611.0,43.516666666666666,419
1,49,quarter,4,1cfe70b8-4dfc-47dc-acca-b68d4a725972,115,4:18,Taylor Hendricks misses two point floating jump shot,twopointmiss,85,,basketball_play,1774490813,48,True,2026-03-26 02:06:53+00:00,4,258.0,2622.0,43.7,420
