period_index,event_index,period_type,period_number,attribution,away_points,clock,description,event_type,home_points,possession,type,wall_clock,pbp_source_row,has_wall_clock,event_ts_utc,period_sequence,game_clock_seconds_remaining,game_elapsed_seconds,game_elapsed_minutes,pbp_chronological_index
2,40,quarter,3,2229b01e-68eb-46ad-adf4-71a9533c84fc,66,3:41,Deni Avdija makes three point pullup jump shot,threepointmade,74,ad36c3e8-4194-4e63-920f-7c50f46191a6,basketball_play,1776653689,152,True,2026-04-20 02:54:49+00:00,3,221.0,1939.0,32.31666666666667,317
2,39,quarter,3,ad36c3e8-4194-4e63-920f-7c50f46191a6,66,3:23,Luke Kornet makes two point alley-oop dunk (Stephon Castle assists),twopointmade,76,2229b01e-68eb-46ad-adf4-71a9533c84fc,basketball_play,1776653706,151,True,2026-04-20 02:55:06+00:00,3,203.0,1957.0,32.61666666666667,318
2,38,quarter,3,2229b01e-68eb-46ad-adf4-71a9533c84fc,66,3:03,Deni Avdija turnover (bad pass) (Luke Kornet steals),turnover,76,ad36c3e8-4194-4e63-920f-7c50f46191a6,basketball_play,1776653719,150,True,2026-04-20 02:55:19+00:00,3,183.0,1977.0,32.95,319
2,37,quarter,3,2229b01e-68eb-46ad-adf4-71a9533c84fc,66,3:01,Shaedon Sharpe shooting foul (Stephon Castle draws the foul),shootingfoul,76,ad36c3e8-4194-4e63-920f-7c50f46191a6,basketball_play,1776653732,149,True,2026-04-20 02:55:32+00:00,3,181.0,1979.0,32.983333333333334,320
2,36,quarter,3,ad36c3e8-4194-4e63-920f-7c50f46191a6,66,3:01,Stephon Castle makes regular free throw 1 of 2,freethrowmade,77,ad36c3e8-4194-4e63-920f-7c50f46191a6,basketball_play,1776653767,148,True,2026-04-20 02:56:07+00:00,3,181.0,1979.0,32.983333333333334,321
2,35,quarter,3,2229b01e-68eb-46ad-adf4-71a9533c84fc,66,3:01,"Trail Blazers lineup change (Jrue Holiday, Robert Williams III, Jerami Grant, Scoot Henderson, Matisse Thybulle)",lineupchange,77,,basketball_play,1776653767,147,True,2026-04-20 02:56:07+00:00,3,181.0,1979.0,32.983333333333334,322
2,34,quarter,3,ad36c3e8-4194-4e63-920f-7c50f46191a6,66,3:01,"Spurs lineup change (Stephon Castle, Dylan Harper, Luke Kornet, Julian Champagnie, Keldon Johnson)",lineupchange,77,,basketball_play,1776653767,146,True,2026-04-20 02:56:07+00:00,3,181.0,1979.0,32.983333333333334,323
2,33,quarter,3,ad36c3e8-4194-4e63-920f-7c50f46191a6,66,3:01,Stephon Castle makes regular free throw 2 of 2,freethrowmade,78,2229b01e-68eb-46ad-adf4-71a9533c84fc,basketball_play,1776653793,145,True,2026-04-20 02:56:33+00:00,3,181.0,1979.0,32.983333333333334,324
2,32,quarter,3,2229b01e-68eb-46ad-adf4-71a9533c84fc,68,2:46,Scoot Henderson makes two point pullup jump shot (Robert Williams III assists),twopointmade,78,ad36c3e8-4194-4e63-920f-7c50f46191a6,basketball_play,1776653810,144,True,2026-04-20 02:56:50+00:00,3,166.0,1994.0,33.233333333333334,325
2,31,quarter,3,ad36c3e8-4194-4e63-920f-7c50f46191a6,68,2:29,Keldon Johnson misses two point driving bank hook shot,twopointmiss,78,,basketball_play,1776653828,143,True,2026-04-20 02:57:08+00:00,3,149.0,2011.0,33.516666666666666,326
2,30,quarter,3,ad36c3e8-4194-4e63-920f-7c50f46191a6,68,2:28,Luke Kornet offensive rebound,rebound,78,ad36c3e8-4194-4e63-920f-7c50f46191a6,basketball_play,1776653829,142,True,2026-04-20 02:57:09+00:00,3,148.0,2012.0,33.53333333333333,327
2,29,quarter,3,ad36c3e8-4194-4e63-920f-7c50f46191a6,68,2:27,Luke Kornet makes two point tip dunk,twopointmade,80,2229b01e-68eb-46ad-adf4-71a9533c84fc,basketball_play,1776653832,141,True,2026-04-20 02:57:12+00:00,3,147.0,2013.0,33.55,328
2,28,quarter,3,2229b01e-68eb-46ad-adf4-71a9533c84fc,68,2:14,Jrue Holiday misses three point stepback jump shot,threepointmiss,80,,basketball_play,1776653842,140,True,2026-04-20 02:57:22+00:00,3,134.0,2026.0,33.766666666666666,329
2,27,quarter,3,ad36c3e8-4194-4e63-920f-7c50f46191a6,68,2:11,Luke Kornet defensive rebound,rebound,80,ad36c3e8-4194-4e63-920f-7c50f46191a6,basketball_play,1776653845,139,True,2026-04-20 02:57:25+00:00,3,131.0,2029.0,33.81666666666667,330
2,26,quarter,3,2229b01e-68eb-46ad-adf4-71a9533c84fc,68,2:08,Scoot Henderson shooting foul (Stephon Castle draws the foul),shootingfoul,80,ad36c3e8-4194-4e63-920f-7c50f46191a6,basketball_play,1776653851,138,True,2026-04-20 02:57:31+00:00,3,128.0,2032.0,33.86666666666667,331
2,25,quarter,3,ad36c3e8-4194-4e63-920f-7c50f46191a6,68,2:08,Stephon Castle makes regular free throw 1 of 2,freethrowmade,81,ad36c3e8-4194-4e63-920f-7c50f46191a6,basketball_play,1776653878,137,True,2026-04-20 02:57:58+00:00,3,128.0,2032.0,33.86666666666667,332
2,24,quarter,3,ad36c3e8-4194-4e63-920f-7c50f46191a6,68,2:08,"Spurs lineup change (Stephon Castle, De'Aaron Fox, Luke Kornet, Julian Champagnie, Keldon Johnson)",lineupchange,81,,basketball_play,1776653903,136,True,2026-04-20 02:58:23+00:00,3,128.0,2032.0,33.86666666666667,333
2,23,quarter,3,ad36c3e8-4194-4e63-920f-7c50f46191a6,68,2:08,Stephon Castle makes regular free throw 2 of 2,freethrowmade,82,2229b01e-68eb-46ad-adf4-71a9533c84fc,basketball_play,1776653903,135,True,2026-04-20 02:58:23+00:00,3,128.0,2032.0,33.86666666666667,334
2,22,quarter,3,2229b01e-68eb-46ad-adf4-71a9533c84fc,70,1:52,Robert Williams III makes two point alley-oop dunk (Jrue Holiday assists),twopointmade,82,ad36c3e8-4194-4e63-920f-7c50f46191a6,basketball_play,1776653921,134,True,2026-04-20 02:58:41+00:00,3,112.0,2048.0,34.13333333333333,335
2,21,quarter,3,2229b01e-68eb-46ad-adf4-71a9533c84fc,70,1:40,Scoot Henderson shooting foul (Stephon Castle draws the foul),shootingfoul,82,ad36c3e8-4194-4e63-920f-7c50f46191a6,basketball_play,1776653935,133,True,2026-04-20 02:58:55+00:00,3,100.0,2060.0,34.333333333333336,336
2,20,quarter,3,ad36c3e8-4194-4e63-920f-7c50f46191a6,70,1:40,Stephon Castle makes regular free throw 1 of 2,freethrowmade,83,ad36c3e8-4194-4e63-920f-7c50f46191a6,basketball_play,1776653962,132,True,2026-04-20 02:59:22+00:00,3,100.0,2060.0,34.333333333333336,337
2,19,quarter,3,2229b01e-68eb-46ad-adf4-71a9533c84fc,70,1:40,"Trail Blazers lineup change (Jrue Holiday, Toumani Camara, Jerami Grant, Scoot Henderson, Matisse Thybulle)",lineupchange,83,,basketball_play,1776653964,131,True,2026-04-20 02:59:24+00:00,3,100.0,2060.0,34.333333333333336,338
2,18,quarter,3,ad36c3e8-4194-4e63-920f-7c50f46191a6,70,1:40,"Spurs lineup change (Stephon Castle, De'Aaron Fox, Victor Wembanyama, Julian Champagnie, Keldon Johnson)",lineupchange,83,,basketball_play,1776653964,130,True,2026-04-20 02:59:24+00:00,3,100.0,2060.0,34.333333333333336,339
2,17,quarter,3,ad36c3e8-4194-4e63-920f-7c50f46191a6,70,1:40,Stephon Castle makes regular free throw 2 of 2,freethrowmade,84,2229b01e-68eb-46ad-adf4-71a9533c84fc,basketball_play,1776653990,129,True,2026-04-20 02:59:50+00:00,3,100.0,2060.0,34.333333333333336,340
2,16,quarter,3,2229b01e-68eb-46ad-adf4-71a9533c84fc,70,1:25,Scoot Henderson turnover (out of bounds lost ball),turnover,84,ad36c3e8-4194-4e63-920f-7c50f46191a6,basketball_play,1776654010,128,True,2026-04-20 03:00:10+00:00,3,85.0,2075.0,34.583333333333336,341
2,15,quarter,3,ad36c3e8-4194-4e63-920f-7c50f46191a6,70,1:25,"Spurs lineup change (De'Aaron Fox, Victor Wembanyama, Dylan Harper, Julian Champagnie, Keldon Johnson)",lineupchange,84,,basketball_play,1776654044,127,True,2026-04-20 03:00:44+00:00,3,85.0,2075.0,34.583333333333336,342
2,14,quarter,3,ad36c3e8-4194-4e63-920f-7c50f46191a6,70,1:11,De'Aaron Fox misses two point driving finger roll layup,twopointmiss,84,,basketball_play,1776654044,126,True,2026-04-20 03:00:44+00:00,3,71.0,2089.0,34.81666666666667,343
2,13,quarter,3,2229b01e-68eb-46ad-adf4-71a9533c84fc,70,1:10,Scoot Henderson defensive rebound,rebound,84,2229b01e-68eb-46ad-adf4-71a9533c84fc,basketball_play,1776654045,125,True,2026-04-20 03:00:45+00:00,3,70.0,2090.0,34.833333333333336,344
2,12,quarter,3,2229b01e-68eb-46ad-adf4-71a9533c84fc,70,1:03,Jerami Grant misses three point running jump shot,threepointmiss,84,,basketball_play,1776654052,124,True,2026-04-20 03:00:52+00:00,3,63.0,2097.0,34.95,345
2,11,quarter,3,ad36c3e8-4194-4e63-920f-7c50f46191a6,70,1:00,Dylan Harper defensive rebound,rebound,84,ad36c3e8-4194-4e63-920f-7c50f46191a6,basketball_play,1776654055,123,True,2026-04-20 03:00:55+00:00,3,60.0,2100.0,35.0,346
2,10,quarter,3,ad36c3e8-4194-4e63-920f-7c50f46191a6,70,00:53.10,Julian Champagnie makes three point jump shot (De'Aaron Fox assists),threepointmade,87,2229b01e-68eb-46ad-adf4-71a9533c84fc,basketball_play,1776654063,122,True,2026-04-20 03:01:03+00:00,3,53.1,2106.9,35.115,347
2,9,quarter,3,,70,00:51.80,Stoppage (Equipment malfunction),stoppage,87,,basketball_play,1776654081,121,True,2026-04-20 03:01:21+00:00,3,51.8,2108.2,35.13666666666666,348
2,8,quarter,3,2229b01e-68eb-46ad-adf4-71a9533c84fc,70,00:32.30,Jrue Holiday misses three point stepback jump shot,threepointmiss,87,,basketball_play,1776654099,120,True,2026-04-20 03:01:39+00:00,3,32.3,2127.7,35.461666666666666,349
2,7,quarter,3,ad36c3e8-4194-4e63-920f-7c50f46191a6,70,00:27.50,Keldon Johnson defensive rebound,rebound,87,ad36c3e8-4194-4e63-920f-7c50f46191a6,basketball_play,1776654104,119,True,2026-04-20 03:01:44+00:00,3,27.5,2132.5,35.541666666666664,350
2,6,quarter,3,ad36c3e8-4194-4e63-920f-7c50f46191a6,70,00:08.80,Victor Wembanyama misses two point dunk,twopointmiss,87,,basketball_play,1776654123,118,True,2026-04-20 03:02:03+00:00,3,8.8,2151.2,35.85333333333333,351
2,5,quarter,3,2229b01e-68eb-46ad-adf4-71a9533c84fc,70,00:07.80,Matisse Thybulle defensive rebound,rebound,87,2229b01e-68eb-46ad-adf4-71a9533c84fc,basketball_play,1776654124,117,True,2026-04-20 03:02:04+00:00,3,7.8,2152.2,35.87,352
2,4,quarter,3,2229b01e-68eb-46ad-adf4-71a9533c84fc,72,00:04.10,Jerami Grant makes two point running dunk (Scoot Henderson assists),twopointmade,87,ad36c3e8-4194-4e63-920f-7c50f46191a6,basketball_play,1776654129,116,True,2026-04-20 03:02:09+00:00,3,4.1,2155.9,35.931666666666665,353
2,3,quarter,3,ad36c3e8-4194-4e63-920f-7c50f46191a6,72,00:00.30,Dylan Harper misses three point pullup bank jump shot,threepointmiss,87,,basketball_play,1776654137,115,True,2026-04-20 03:02:17+00:00,3,0.3,2159.7,35.995,354
2,2,quarter,3,ad36c3e8-4194-4e63-920f-7c50f46191a6,72,00:00.10,Spurs offensive rebound,rebound,87,ad36c3e8-4194-4e63-920f-7c50f46191a6,basketball_play,1776654137,114,True,2026-04-20 03:02:17+00:00,3,0.1,2159.9,35.998333333333335,355
2,1,quarter,3,,72,00:00,End of 3rd Quarter.,endperiod,87,,basketball_play,1776654147,113,True,2026-04-20 03:02:27+00:00,3,0.0,2160.0,36.0,356
1,113,quarter,4,2229b01e-68eb-46ad-adf4-71a9533c84fc,72,12:00,"Trail Blazers lineup change (Deni Avdija, Jrue Holiday, Toumani Camara, Jerami Grant, Scoot Henderson)",lineupchange,87,,basketball_play,1776654349,112,True,2026-04-20 03:05:49+00:00,4,720.0,2160.0,36.0,357
1,112,quarter,4,ad36c3e8-4194-4e63-920f-7c50f46191a6,72,12:00,"Spurs lineup change (De'Aaron Fox, Victor Wembanyama, Harrison Barnes, Dylan Harper, Julian Champagnie)",lineupchange,87,,basketball_play,1776654349,111,True,2026-04-20 03:05:49+00:00,4,720.0,2160.0,36.0,358
1,111,quarter,4,,72,12:00,Start of 4th Quarter,startperiod,87,,basketball_play,1776654368,110,True,2026-04-20 03:06:08+00:00,4,720.0,2160.0,36.0,359
1,110,quarter,4,2229b01e-68eb-46ad-adf4-71a9533c84fc,72,11:44,Jrue Holiday shooting foul (Victor Wembanyama draws the foul),shootingfoul,87,ad36c3e8-4194-4e63-920f-7c50f46191a6,basketball_play,1776654387,109,True,2026-04-20 03:06:27+00:00,4,704.0,2176.0,36.266666666666666,360
1,109,quarter,4,ad36c3e8-4194-4e63-920f-7c50f46191a6,72,11:44,Victor Wembanyama makes regular free throw 1 of 2,freethrowmade,88,ad36c3e8-4194-4e63-920f-7c50f46191a6,basketball_play,1776654429,108,True,2026-04-20 03:07:09+00:00,4,704.0,2176.0,36.266666666666666,361
1,108,quarter,4,ad36c3e8-4194-4e63-920f-7c50f46191a6,72,11:44,Victor Wembanyama makes regular free throw 2 of 2,freethrowmade,89,2229b01e-68eb-46ad-adf4-71a9533c84fc,basketball_play,1776654450,107,True,2026-04-20 03:07:30+00:00,4,704.0,2176.0,36.266666666666666,362
1,107,quarter,4,2229b01e-68eb-46ad-adf4-71a9533c84fc,72,11:27,Deni Avdija misses three point jump shot,threepointmiss,89,,basketball_play,1776654472,106,True,2026-04-20 03:07:52+00:00,4,687.0,2193.0,36.55,363
1,106,quarter,4,ad36c3e8-4194-4e63-920f-7c50f46191a6,72,11:25,Spurs defensive rebound,rebound,89,ad36c3e8-4194-4e63-920f-7c50f46191a6,basketball_play,1776654474,105,True,2026-04-20 03:07:54+00:00,4,685.0,2195.0,36.583333333333336,364
1,105,quarter,4,2229b01e-68eb-46ad-adf4-71a9533c84fc,72,11:25,Scoot Henderson personal foul (Loose ball) (De'Aaron Fox draws the foul),personalfoul,89,ad36c3e8-4194-4e63-920f-7c50f46191a6,basketball_play,1776654483,104,True,2026-04-20 03:08:03+00:00,4,685.0,2195.0,36.583333333333336,365
1,104,quarter,4,ad36c3e8-4194-4e63-920f-7c50f46191a6,72,11:15,Dylan Harper makes two point driving finger roll layup,twopointmade,91,2229b01e-68eb-46ad-adf4-71a9533c84fc,basketball_play,1776654502,103,True,2026-04-20 03:08:22+00:00,4,675.0,2205.0,36.75,366
1,103,quarter,4,2229b01e-68eb-46ad-adf4-71a9533c84fc,72,10:53,Victor Wembanyama blocks Jerami Grant's two point driving layup,twopointmiss,91,,basketball_play,1776654524,102,True,2026-04-20 03:08:44+00:00,4,653.0,2227.0,37.11666666666667,367
1,102,quarter,4,ad36c3e8-4194-4e63-920f-7c50f46191a6,72,10:52,De'Aaron Fox defensive rebound,rebound,91,ad36c3e8-4194-4e63-920f-7c50f46191a6,basketball_play,1776654525,101,True,2026-04-20 03:08:45+00:00,4,652.0,2228.0,37.13333333333333,368
1,101,quarter,4,ad36c3e8-4194-4e63-920f-7c50f46191a6,72,10:47,Dylan Harper makes two point running layup (Julian Champagnie assists),twopointmade,93,2229b01e-68eb-46ad-adf4-71a9533c84fc,basketball_play,1776654531,100,True,2026-04-20 03:08:51+00:00,4,647.0,2233.0,37.21666666666667,369
1,100,quarter,4,2229b01e-68eb-46ad-adf4-71a9533c84fc,72,10:47,Trail Blazers 60 second timeout,teamtimeout,93,,basketball_play,1776654537,99,True,2026-04-20 03:08:57+00:00,4,647.0,2233.0,37.21666666666667,370
1,99,quarter,4,2229b01e-68eb-46ad-adf4-71a9533c84fc,72,10:47,"Trail Blazers lineup change (Deni Avdija, Jrue Holiday, Toumani Camara, Donovan Clingan, Jerami Grant)",lineupchange,93,,basketball_play,1776654745,98,True,2026-04-20 03:12:25+00:00,4,647.0,2233.0,37.21666666666667,371
1,98,quarter,4,2229b01e-68eb-46ad-adf4-71a9533c84fc,72,10:47,"Trail Blazers lineup change (Deni Avdija, Shaedon Sharpe, Jrue Holiday, Toumani Camara, Donovan Clingan)",lineupchange,93,,basketball_play,1776654769,97,True,2026-04-20 03:12:49+00:00,4,647.0,2233.0,37.21666666666667,372
1,97,quarter,4,2229b01e-68eb-46ad-adf4-71a9533c84fc,75,10:32,Toumani Camara makes three point jump shot (Shaedon Sharpe assists),threepointmade,93,ad36c3e8-4194-4e63-920f-7c50f46191a6,basketball_play,1776654769,96,True,2026-04-20 03:12:49+00:00,4,632.0,2248.0,37.46666666666667,373
1,96,quarter,4,ad36c3e8-4194-4e63-920f-7c50f46191a6,75,10:07,Victor Wembanyama makes two point turnaround hook shot,twopointmade,95,2229b01e-68eb-46ad-adf4-71a9533c84fc,basketball_play,1776654797,95,True,2026-04-20 03:13:17+00:00,4,607.0,2273.0,37.88333333333333,374
1,95,quarter,4,2229b01e-68eb-46ad-adf4-71a9533c84fc,75,10:07,Donovan Clingan shooting foul (Victor Wembanyama draws the foul),shootingfoul,95,ad36c3e8-4194-4e63-920f-7c50f46191a6,basketball_play,1776654800,94,True,2026-04-20 03:13:20+00:00,4,607.0,2273.0,37.88333333333333,375
1,94,quarter,4,ad36c3e8-4194-4e63-920f-7c50f46191a6,75,10:07,Victor Wembanyama misses regular free throw 1 of 1,freethrowmiss,95,,basketball_play,1776654832,93,True,2026-04-20 03:13:52+00:00,4,607.0,2273.0,37.88333333333333,376
1,93,quarter,4,2229b01e-68eb-46ad-adf4-71a9533c84fc,75,10:04,Deni Avdija defensive rebound,rebound,95,2229b01e-68eb-46ad-adf4-71a9533c84fc,basketball_play,1776654835,92,True,2026-04-20 03:13:55+00:00,4,604.0,2276.0,37.93333333333333,377
1,92,quarter,4,2229b01e-68eb-46ad-adf4-71a9533c84fc,77,9:51,Jrue Holiday makes two point driving layup (Deni Avdija assists),twopointmade,95,ad36c3e8-4194-4e63-920f-7c50f46191a6,basketball_play,1776654847,91,True,2026-04-20 03:14:07+00:00,4,591.0,2289.0,38.15,378
1,91,quarter,4,ad36c3e8-4194-4e63-920f-7c50f46191a6,77,9:35,Victor Wembanyama makes three point jump shot (De'Aaron Fox assists),threepointmade,98,2229b01e-68eb-46ad-adf4-71a9533c84fc,basketball_play,1776654862,90,True,2026-04-20 03:14:22+00:00,4,575.0,2305.0,38.416666666666664,379
1,90,quarter,4,2229b01e-68eb-46ad-adf4-71a9533c84fc,79,9:26,Donovan Clingan makes two point cutting dunk (Jrue Holiday assists),twopointmade,98,ad36c3e8-4194-4e63-920f-7c50f46191a6,basketball_play,1776654872,89,True,2026-04-20 03:14:32+00:00,4,566.0,2314.0,38.56666666666667,380
1,89,quarter,4,ad36c3e8-4194-4e63-920f-7c50f46191a6,79,9:01,Victor Wembanyama makes two point turnaround bank jump shot,twopointmade,100,2229b01e-68eb-46ad-adf4-71a9533c84fc,basketball_play,1776654895,88,True,2026-04-20 03:14:55+00:00,4,541.0,2339.0,38.983333333333334,381
1,88,quarter,4,2229b01e-68eb-46ad-adf4-71a9533c84fc,81,8:47,Shaedon Sharpe makes two point pullup jump shot (Jrue Holiday assists),twopointmade,100,ad36c3e8-4194-4e63-920f-7c50f46191a6,basketball_play,1776654910,87,True,2026-04-20 03:15:10+00:00,4,527.0,2353.0,39.21666666666667,382
1,87,quarter,4,ad36c3e8-4194-4e63-920f-7c50f46191a6,81,8:23,Victor Wembanyama turnover (lost ball) (Toumani Camara steals),turnover,100,2229b01e-68eb-46ad-adf4-71a9533c84fc,basketball_play,1776654935,86,True,2026-04-20 03:15:35+00:00,4,503.0,2377.0,39.61666666666667,383
1,86,quarter,4,ad36c3e8-4194-4e63-920f-7c50f46191a6,81,8:20,Julian Champagnie personal foul (Shaedon Sharpe draws the foul),personalfoul,100,2229b01e-68eb-46ad-adf4-71a9533c84fc,basketball_play,1776654944,85,True,2026-04-20 03:15:44+00:00,4,500.0,2380.0,39.666666666666664,384
1,85,quarter,4,2229b01e-68eb-46ad-adf4-71a9533c84fc,81,8:20,"Trail Blazers lineup change (Deni Avdija, Shaedon Sharpe, Jrue Holiday, Toumani Camara, Robert Williams III)",lineupchange,100,,basketball_play,1776654968,84,True,2026-04-20 03:16:08+00:00,4,500.0,2380.0,39.666666666666664,385
1,84,quarter,4,ad36c3e8-4194-4e63-920f-7c50f46191a6,81,8:20,"Spurs lineup change (Stephon Castle, Harrison Barnes, Dylan Harper, Luke Kornet, Julian Champagnie)",lineupchange,100,,basketball_play,1776654968,83,True,2026-04-20 03:16:08+00:00,4,500.0,2380.0,39.666666666666664,386
1,83,quarter,4,2229b01e-68eb-46ad-adf4-71a9533c84fc,83,8:11,Jrue Holiday makes two point driving floating jump shot,twopointmade,100,ad36c3e8-4194-4e63-920f-7c50f46191a6,basketball_play,1776654994,82,True,2026-04-20 03:16:34+00:00,4,491.0,2389.0,39.81666666666667,387
1,82,quarter,4,ad36c3e8-4194-4e63-920f-7c50f46191a6,83,7:44,Stephon Castle misses three point pullup jump shot,threepointmiss,100,,basketball_play,1776655020,81,True,2026-04-20 03:17:00+00:00,4,464.0,2416.0,40.266666666666666,388
1,81,quarter,4,2229b01e-68eb-46ad-adf4-71a9533c84fc,83,7:41,Toumani Camara defensive rebound,rebound,100,2229b01e-68eb-46ad-adf4-71a9533c84fc,basketball_play,1776655023,80,True,2026-04-20 03:17:03+00:00,4,461.0,2419.0,40.31666666666667,389
1,80,quarter,4,2229b01e-68eb-46ad-adf4-71a9533c84fc,83,7:31,Jrue Holiday misses three point pullup jump shot,threepointmiss,100,,basketball_play,1776655032,79,True,2026-04-20 03:17:12+00:00,4,451.0,2429.0,40.483333333333334,390
1,79,quarter,4,ad36c3e8-4194-4e63-920f-7c50f46191a6,83,7:29,Stephon Castle defensive rebound,rebound,100,ad36c3e8-4194-4e63-920f-7c50f46191a6,basketball_play,1776655034,78,True,2026-04-20 03:17:14+00:00,4,449.0,2431.0,40.516666666666666,391
1,78,quarter,4,ad36c3e8-4194-4e63-920f-7c50f46191a6,83,7:11,Harrison Barnes misses two point driving floating jump shot,twopointmiss,100,,basketball_play,1776655053,77,True,2026-04-20 03:17:33+00:00,4,431.0,2449.0,40.81666666666667,392
1,77,quarter,4,2229b01e-68eb-46ad-adf4-71a9533c84fc,83,7:08,Robert Williams III defensive rebound,rebound,100,2229b01e-68eb-46ad-adf4-71a9533c84fc,basketball_play,1776655056,76,True,2026-04-20 03:17:36+00:00,4,428.0,2452.0,40.86666666666667,393
1,76,quarter,4,2229b01e-68eb-46ad-adf4-71a9533c84fc,83,7:05,Shaedon Sharpe misses two point running pullup jump shot,twopointmiss,100,,basketball_play,1776655059,75,True,2026-04-20 03:17:39+00:00,4,425.0,2455.0,40.916666666666664,394
1,75,quarter,4,ad36c3e8-4194-4e63-920f-7c50f46191a6,83,7:01,Julian Champagnie defensive rebound,rebound,100,ad36c3e8-4194-4e63-920f-7c50f46191a6,basketball_play,1776655063,74,True,2026-04-20 03:17:43+00:00,4,421.0,2459.0,40.983333333333334,395
1,74,quarter,4,ad36c3e8-4194-4e63-920f-7c50f46191a6,83,7:00,Spurs 60 second timeout,teamtimeout,100,,basketball_play,1776655074,73,True,2026-04-20 03:17:54+00:00,4,420.0,2460.0,41.0,396
1,73,quarter,4,2229b01e-68eb-46ad-adf4-71a9533c84fc,83,7:00,"Trail Blazers lineup change (Deni Avdija, Shaedon Sharpe, Robert Williams III, Scoot Henderson, Matisse Thybulle)",lineupchange,100,,basketball_play,1776655264,72,True,2026-04-20 03:21:04+00:00,4,420.0,2460.0,41.0,397
1,72,quarter,4,ad36c3e8-4194-4e63-920f-7c50f46191a6,83,7:00,"Spurs lineup change (Stephon Castle, Harrison Barnes, Devin Vassell, Luke Kornet, Keldon Johnson)",lineupchange,100,,basketball_play,1776655264,71,True,2026-04-20 03:21:04+00:00,4,420.0,2460.0,41.0,398
1,71,quarter,4,ad36c3e8-4194-4e63-920f-7c50f46191a6,83,6:52,Stephon Castle misses two point pullup jump shot,twopointmiss,100,,basketball_play,1776655303,70,True,2026-04-20 03:21:43+00:00,4,412.0,2468.0,41.13333333333333,399
1,70,quarter,4,2229b01e-68eb-46ad-adf4-71a9533c84fc,83,6:50,Robert Williams III defensive rebound,rebound,100,2229b01e-68eb-46ad-adf4-71a9533c84fc,basketball_play,1776655305,69,True,2026-04-20 03:21:45+00:00,4,410.0,2470.0,41.166666666666664,400
1,69,quarter,4,2229b01e-68eb-46ad-adf4-71a9533c84fc,85,6:38,Scoot Henderson makes two point pullup jump shot (Robert Williams III assists),twopointmade,100,ad36c3e8-4194-4e63-920f-7c50f46191a6,basketball_play,1776655317,68,True,2026-04-20 03:21:57+00:00,4,398.0,2482.0,41.36666666666667,401
1,68,quarter,4,ad36c3e8-4194-4e63-920f-7c50f46191a6,85,6:18,Harrison Barnes misses three point jump shot,threepointmiss,100,,basketball_play,1776655337,67,True,2026-04-20 03:22:17+00:00,4,378.0,2502.0,41.7,402
1,67,quarter,4,2229b01e-68eb-46ad-adf4-71a9533c84fc,85,6:16,Trail Blazers defensive rebound,rebound,100,2229b01e-68eb-46ad-adf4-71a9533c84fc,basketball_play,1776655339,66,True,2026-04-20 03:22:19+00:00,4,376.0,2504.0,41.733333333333334,403
1,66,quarter,4,ad36c3e8-4194-4e63-920f-7c50f46191a6,85,6:16,Keldon Johnson personal foul (Loose ball) (Shaedon Sharpe draws the foul),personalfoul,100,2229b01e-68eb-46ad-adf4-71a9533c84fc,basketball_play,1776655345,65,True,2026-04-20 03:22:25+00:00,4,376.0,2504.0,41.733333333333334,404
1,65,quarter,4,ad36c3e8-4194-4e63-920f-7c50f46191a6,85,6:16,"Spurs lineup change (Stephon Castle, De'Aaron Fox, Victor Wembanyama, Devin Vassell, Keldon Johnson)",lineupchange,100,,basketball_play,1776655355,64,True,2026-04-20 03:22:35+00:00,4,376.0,2504.0,41.733333333333334,405
1,64,quarter,4,2229b01e-68eb-46ad-adf4-71a9533c84fc,85,6:02,Deni Avdija misses two point driving finger roll layup,twopointmiss,100,,basketball_play,1776655378,63,True,2026-04-20 03:22:58+00:00,4,362.0,2518.0,41.96666666666667,406
1,63,quarter,4,2229b01e-68eb-46ad-adf4-71a9533c84fc,85,5:59,Deni Avdija offensive rebound,rebound,100,2229b01e-68eb-46ad-adf4-71a9533c84fc,basketball_play,1776655381,62,True,2026-04-20 03:23:01+00:00,4,359.0,2521.0,42.016666666666666,407
1,62,quarter,4,2229b01e-68eb-46ad-adf4-71a9533c84fc,88,5:58,Matisse Thybulle makes three point jump shot (Deni Avdija assists),threepointmade,100,ad36c3e8-4194-4e63-920f-7c50f46191a6,basketball_play,1776655383,61,True,2026-04-20 03:23:03+00:00,4,358.0,2522.0,42.03333333333333,408
1,61,quarter,4,ad36c3e8-4194-4e63-920f-7c50f46191a6,88,5:57,Mitch Johnson technical foul,technicalfoul,100,2229b01e-68eb-46ad-adf4-71a9533c84fc,basketball_play,1776655400,60,True,2026-04-20 03:23:20+00:00,4,357.0,2523.0,42.05,409
1,60,quarter,4,2229b01e-68eb-46ad-adf4-71a9533c84fc,88,5:57,Deni Avdija misses technical free throw 1 of 1,freethrowmiss,100,,basketball_play,1776655416,59,True,2026-04-20 03:23:36+00:00,4,357.0,2523.0,42.05,410
1,59,quarter,4,ad36c3e8-4194-4e63-920f-7c50f46191a6,88,5:57,Spurs defensive rebound,rebound,100,ad36c3e8-4194-4e63-920f-7c50f46191a6,basketball_play,1776655416,58,True,2026-04-20 03:23:36+00:00,4,357.0,2523.0,42.05,411
1,58,quarter,4,ad36c3e8-4194-4e63-920f-7c50f46191a6,88,5:34,Victor Wembanyama makes three point pullup jump shot,threepointmade,103,2229b01e-68eb-46ad-adf4-71a9533c84fc,basketball_play,1776655454,57,True,2026-04-20 03:24:14+00:00,4,334.0,2546.0,42.43333333333333,412
1,57,quarter,4,ad36c3e8-4194-4e63-920f-7c50f46191a6,88,5:25,Devin Vassell personal foul (Deni Avdija draws the foul),personalfoul,103,2229b01e-68eb-46ad-adf4-71a9533c84fc,basketball_play,1776655467,56,True,2026-04-20 03:24:27+00:00,4,325.0,2555.0,42.583333333333336,413
1,56,quarter,4,2229b01e-68eb-46ad-adf4-71a9533c84fc,90,5:08,Scoot Henderson makes two point pullup jump shot (Robert Williams III assists),twopointmade,103,ad36c3e8-4194-4e63-920f-7c50f46191a6,basketball_play,1776655504,55,True,2026-04-20 03:25:04+00:00,4,308.0,2572.0,42.86666666666667,414
1,55,quarter,4,ad36c3e8-4194-4e63-920f-7c50f46191a6,90,4:49,Stephon Castle misses two point driving layup,twopointmiss,103,,basketball_play,1776655523,54,True,2026-04-20 03:25:23+00:00,4,289.0,2591.0,43.18333333333333,415
1,54,quarter,4,2229b01e-68eb-46ad-adf4-71a9533c84fc,90,4:47,Scoot Henderson defensive rebound,rebound,103,2229b01e-68eb-46ad-adf4-71a9533c84fc,basketball_play,1776655525,53,True,2026-04-20 03:25:25+00:00,4,287.0,2593.0,43.21666666666667,416
1,53,quarter,4,2229b01e-68eb-46ad-adf4-71a9533c84fc,90,4:41,Shaedon Sharpe misses two point running layup,twopointmiss,103,,basketball_play,1776655531,52,True,2026-04-20 03:25:31+00:00,4,281.0,2599.0,43.31666666666667,417
1,52,quarter,4,ad36c3e8-4194-4e63-920f-7c50f46191a6,90,4:39,Keldon Johnson defensive rebound,rebound,103,ad36c3e8-4194-4e63-920f-7c50f46191a6,basketball_play,1776655533,51,True,2026-04-20 03:25:33+00:00,4,279.0,2601.0,43.35,418
