period_index,event_index,period_type,period_number,attribution,away_points,clock,description,event_type,home_points,possession,type,wall_clock,pbp_source_row,has_wall_clock,event_ts_utc,period_sequence,game_clock_seconds_remaining,game_elapsed_seconds,game_elapsed_minutes,pbp_chronological_index
3,29,quarter,2,2229b01e-68eb-46ad-adf4-71a9533c84fc,46,2:28,Deni Avdija makes two point driving floating jump shot (Matisse Thybulle assists),twopointmade,54,ad36c3e8-4194-4e63-920f-7c50f46191a6,basketball_play,1776651166,257,True,2026-04-20 02:12:46+00:00,2,148.0,1292.0,21.533333333333335,212
3,28,quarter,2,ad36c3e8-4194-4e63-920f-7c50f46191a6,46,2:28,Keldon Johnson shooting foul (Deni Avdija draws the foul),shootingfoul,54,2229b01e-68eb-46ad-adf4-71a9533c84fc,basketball_play,1776651170,256,True,2026-04-20 02:12:50+00:00,2,148.0,1292.0,21.533333333333335,213
3,27,quarter,2,2229b01e-68eb-46ad-adf4-71a9533c84fc,47,2:28,Deni Avdija makes regular free throw 1 of 1,freethrowmade,54,,basketball_play,1776651190,255,True,2026-04-20 02:13:10+00:00,2,148.0,1292.0,21.533333333333335,214
3,26,quarter,2,ad36c3e8-4194-4e63-920f-7c50f46191a6,47,2:12,Victor Wembanyama makes two point driving finger roll layup (De'Aaron Fox assists),twopointmade,56,2229b01e-68eb-46ad-adf4-71a9533c84fc,basketball_play,1776651209,254,True,2026-04-20 02:13:29+00:00,2,132.0,1308.0,21.8,215
3,25,quarter,2,2229b01e-68eb-46ad-adf4-71a9533c84fc,47,1:56,Shaedon Sharpe misses two point pullup jump shot,twopointmiss,56,,basketball_play,1776651224,253,True,2026-04-20 02:13:44+00:00,2,116.0,1324.0,22.066666666666666,216
3,24,quarter,2,ad36c3e8-4194-4e63-920f-7c50f46191a6,47,1:54,Victor Wembanyama defensive rebound,rebound,56,ad36c3e8-4194-4e63-920f-7c50f46191a6,basketball_play,1776651226,252,True,2026-04-20 02:13:46+00:00,2,114.0,1326.0,22.1,217
3,23,quarter,2,ad36c3e8-4194-4e63-920f-7c50f46191a6,47,1:46,De'Aaron Fox misses two point turnaround jump shot,twopointmiss,56,,basketball_play,1776651235,251,True,2026-04-20 02:13:55+00:00,2,106.0,1334.0,22.233333333333334,218
3,22,quarter,2,ad36c3e8-4194-4e63-920f-7c50f46191a6,47,1:43,Keldon Johnson offensive rebound,rebound,56,ad36c3e8-4194-4e63-920f-7c50f46191a6,basketball_play,1776651238,250,True,2026-04-20 02:13:58+00:00,2,103.0,1337.0,22.283333333333335,219
3,21,quarter,2,ad36c3e8-4194-4e63-920f-7c50f46191a6,47,1:41,Victor Wembanyama makes three point pullup jump shot (Keldon Johnson assists),threepointmade,59,2229b01e-68eb-46ad-adf4-71a9533c84fc,basketball_play,1776651241,249,True,2026-04-20 02:14:01+00:00,2,101.0,1339.0,22.316666666666666,220
3,20,quarter,2,2229b01e-68eb-46ad-adf4-71a9533c84fc,47,1:30,Jrue Holiday misses two point driving hook shot,twopointmiss,59,,basketball_play,1776651251,248,True,2026-04-20 02:14:11+00:00,2,90.0,1350.0,22.5,221
3,19,quarter,2,2229b01e-68eb-46ad-adf4-71a9533c84fc,47,1:29,Robert Williams III offensive rebound,rebound,59,2229b01e-68eb-46ad-adf4-71a9533c84fc,basketball_play,1776651252,247,True,2026-04-20 02:14:12+00:00,2,89.0,1351.0,22.516666666666666,222
3,18,quarter,2,2229b01e-68eb-46ad-adf4-71a9533c84fc,49,1:28,Robert Williams III makes two point tip dunk,twopointmade,59,ad36c3e8-4194-4e63-920f-7c50f46191a6,basketball_play,1776651256,246,True,2026-04-20 02:14:16+00:00,2,88.0,1352.0,22.533333333333335,223
3,17,quarter,2,ad36c3e8-4194-4e63-920f-7c50f46191a6,49,1:08,Stephon Castle offensive foul (Jrue Holiday draws the foul),offensivefoul,59,2229b01e-68eb-46ad-adf4-71a9533c84fc,basketball_play,1776651280,245,True,2026-04-20 02:14:40+00:00,2,68.0,1372.0,22.866666666666667,224
3,16,quarter,2,ad36c3e8-4194-4e63-920f-7c50f46191a6,49,1:08,Stephon Castle turnover (offensive foul),turnover,59,2229b01e-68eb-46ad-adf4-71a9533c84fc,basketball_play,1776651280,244,True,2026-04-20 02:14:40+00:00,2,68.0,1372.0,22.866666666666667,225
3,15,quarter,2,ad36c3e8-4194-4e63-920f-7c50f46191a6,49,1:08,Spurs 60 second timeout,teamtimeout,59,,basketball_play,1776651300,243,True,2026-04-20 02:15:00+00:00,2,68.0,1372.0,22.866666666666667,226
3,14,quarter,2,,49,1:08,Instant replay (Challenge: Stands),review,59,,basketball_play,1776651315,242,True,2026-04-20 02:15:15+00:00,2,68.0,1372.0,22.866666666666667,227
3,13,quarter,2,2229b01e-68eb-46ad-adf4-71a9533c84fc,49,1:08,"Trail Blazers lineup change (Deni Avdija, Toumani Camara, Robert Williams III, Scoot Henderson, Matisse Thybulle)",lineupchange,59,,basketball_play,1776651430,241,True,2026-04-20 02:17:10+00:00,2,68.0,1372.0,22.866666666666667,228
3,12,quarter,2,ad36c3e8-4194-4e63-920f-7c50f46191a6,49,1:08,"Spurs lineup change (De'Aaron Fox, Victor Wembanyama, Devin Vassell, Julian Champagnie, Keldon Johnson)",lineupchange,59,,basketball_play,1776651430,240,True,2026-04-20 02:17:10+00:00,2,68.0,1372.0,22.866666666666667,229
3,11,quarter,2,,49,00:57.50,Stoppage (Out of bounds),stoppage,59,,basketball_play,1776651456,239,True,2026-04-20 02:17:36+00:00,2,57.5,1382.5,23.041666666666668,230
3,10,quarter,2,2229b01e-68eb-46ad-adf4-71a9533c84fc,49,00:46.50,Toumani Camara misses two point pullup jump shot,twopointmiss,59,,basketball_play,1776651478,238,True,2026-04-20 02:17:58+00:00,2,46.5,1393.5,23.225,231
3,9,quarter,2,ad36c3e8-4194-4e63-920f-7c50f46191a6,49,00:44.60,De'Aaron Fox defensive rebound,rebound,59,ad36c3e8-4194-4e63-920f-7c50f46191a6,basketball_play,1776651479,237,True,2026-04-20 02:17:59+00:00,2,44.6,1395.4,23.256666666666668,232
3,8,quarter,2,2229b01e-68eb-46ad-adf4-71a9533c84fc,49,00:44.60,Scoot Henderson personal foul (De'Aaron Fox draws the foul),personalfoul,59,ad36c3e8-4194-4e63-920f-7c50f46191a6,basketball_play,1776651483,236,True,2026-04-20 02:18:03+00:00,2,44.6,1395.4,23.256666666666668,233
3,7,quarter,2,ad36c3e8-4194-4e63-920f-7c50f46191a6,49,00:33.60,Victor Wembanyama misses three point jump shot,threepointmiss,59,,basketball_play,1776651512,235,True,2026-04-20 02:18:32+00:00,2,33.6,1406.4,23.44,234
3,6,quarter,2,ad36c3e8-4194-4e63-920f-7c50f46191a6,49,00:29.80,Keldon Johnson offensive rebound,rebound,59,ad36c3e8-4194-4e63-920f-7c50f46191a6,basketball_play,1776651516,234,True,2026-04-20 02:18:36+00:00,2,29.8,1410.2,23.503333333333334,235
3,5,quarter,2,ad36c3e8-4194-4e63-920f-7c50f46191a6,49,00:16.40,Victor Wembanyama misses two point turnaround jump shot,twopointmiss,59,,basketball_play,1776651529,233,True,2026-04-20 02:18:49+00:00,2,16.4,1423.6,23.726666666666667,236
3,4,quarter,2,2229b01e-68eb-46ad-adf4-71a9533c84fc,49,00:11.40,Matisse Thybulle defensive rebound,rebound,59,2229b01e-68eb-46ad-adf4-71a9533c84fc,basketball_play,1776651534,232,True,2026-04-20 02:18:54+00:00,2,11.4,1428.6,23.81,237
3,3,quarter,2,2229b01e-68eb-46ad-adf4-71a9533c84fc,49,00:01.30,Deni Avdija misses three point stepback jump shot,threepointmiss,59,,basketball_play,1776651544,231,True,2026-04-20 02:19:04+00:00,2,1.3,1438.7,23.978333333333335,238
3,2,quarter,2,2229b01e-68eb-46ad-adf4-71a9533c84fc,49,00:00.10,Trail Blazers offensive rebound,rebound,59,2229b01e-68eb-46ad-adf4-71a9533c84fc,basketball_play,1776651545,230,True,2026-04-20 02:19:05+00:00,2,0.1,1439.9,23.998333333333335,239
3,1,quarter,2,,49,00:00,End of 1st Half.,endperiod,59,,basketball_play,1776651553,229,True,2026-04-20 02:19:13+00:00,2,0.0,1440.0,24.0,240
2,116,quarter,3,2229b01e-68eb-46ad-adf4-71a9533c84fc,49,12:00,"Trail Blazers lineup change (Deni Avdija, Jrue Holiday, Toumani Camara, Donovan Clingan, Scoot Henderson)",lineupchange,59,,basketball_play,1776652476,228,True,2026-04-20 02:34:36+00:00,3,720.0,1440.0,24.0,241
2,115,quarter,3,ad36c3e8-4194-4e63-920f-7c50f46191a6,49,12:00,"Spurs lineup change (Stephon Castle, De'Aaron Fox, Victor Wembanyama, Devin Vassell, Julian Champagnie)",lineupchange,59,,basketball_play,1776652476,227,True,2026-04-20 02:34:36+00:00,3,720.0,1440.0,24.0,242
2,114,quarter,3,,49,12:00,Start of 3rd Quarter,startperiod,59,,basketball_play,1776652529,226,True,2026-04-20 02:35:29+00:00,3,720.0,1440.0,24.0,243
2,113,quarter,3,2229b01e-68eb-46ad-adf4-71a9533c84fc,49,11:46,Jrue Holiday misses two point driving finger roll layup,twopointmiss,59,,basketball_play,1776652542,225,True,2026-04-20 02:35:42+00:00,3,706.0,1454.0,24.233333333333334,244
2,112,quarter,3,ad36c3e8-4194-4e63-920f-7c50f46191a6,49,11:43,Victor Wembanyama defensive rebound,rebound,59,ad36c3e8-4194-4e63-920f-7c50f46191a6,basketball_play,1776652545,224,True,2026-04-20 02:35:45+00:00,3,703.0,1457.0,24.283333333333335,245
2,111,quarter,3,ad36c3e8-4194-4e63-920f-7c50f46191a6,49,11:38,De'Aaron Fox misses three point running jump shot,threepointmiss,59,,basketball_play,1776652549,223,True,2026-04-20 02:35:49+00:00,3,698.0,1462.0,24.366666666666667,246
2,110,quarter,3,ad36c3e8-4194-4e63-920f-7c50f46191a6,49,11:36,De'Aaron Fox offensive rebound,rebound,59,ad36c3e8-4194-4e63-920f-7c50f46191a6,basketball_play,1776652553,222,True,2026-04-20 02:35:53+00:00,3,696.0,1464.0,24.4,247
2,109,quarter,3,ad36c3e8-4194-4e63-920f-7c50f46191a6,49,11:35,Toumani Camara blocks De'Aaron Fox's two point driving layup,twopointmiss,59,,basketball_play,1776652555,221,True,2026-04-20 02:35:55+00:00,3,695.0,1465.0,24.416666666666668,248
2,108,quarter,3,2229b01e-68eb-46ad-adf4-71a9533c84fc,49,11:34,Donovan Clingan defensive rebound,rebound,59,2229b01e-68eb-46ad-adf4-71a9533c84fc,basketball_play,1776652556,220,True,2026-04-20 02:35:56+00:00,3,694.0,1466.0,24.433333333333334,249
2,107,quarter,3,2229b01e-68eb-46ad-adf4-71a9533c84fc,49,11:26,Scoot Henderson misses two point running pullup jump shot,twopointmiss,59,,basketball_play,1776652561,219,True,2026-04-20 02:36:01+00:00,3,686.0,1474.0,24.566666666666666,250
2,106,quarter,3,ad36c3e8-4194-4e63-920f-7c50f46191a6,49,11:26,Devin Vassell defensive rebound,rebound,59,ad36c3e8-4194-4e63-920f-7c50f46191a6,basketball_play,1776652561,218,True,2026-04-20 02:36:01+00:00,3,686.0,1474.0,24.566666666666666,251
2,105,quarter,3,ad36c3e8-4194-4e63-920f-7c50f46191a6,49,11:13,Devin Vassell misses two point stepback jump shot,twopointmiss,59,,basketball_play,1776652575,217,True,2026-04-20 02:36:15+00:00,3,673.0,1487.0,24.783333333333335,252
2,104,quarter,3,2229b01e-68eb-46ad-adf4-71a9533c84fc,49,11:10,Deni Avdija defensive rebound,rebound,59,2229b01e-68eb-46ad-adf4-71a9533c84fc,basketball_play,1776652578,216,True,2026-04-20 02:36:18+00:00,3,670.0,1490.0,24.833333333333332,253
2,103,quarter,3,2229b01e-68eb-46ad-adf4-71a9533c84fc,52,10:59,Jrue Holiday makes three point jump shot (Deni Avdija assists),threepointmade,59,ad36c3e8-4194-4e63-920f-7c50f46191a6,basketball_play,1776652589,215,True,2026-04-20 02:36:29+00:00,3,659.0,1501.0,25.016666666666666,254
2,102,quarter,3,ad36c3e8-4194-4e63-920f-7c50f46191a6,52,10:37,Stephon Castle misses two point driving layup,twopointmiss,59,,basketball_play,1776652611,214,True,2026-04-20 02:36:51+00:00,3,637.0,1523.0,25.383333333333333,255
2,101,quarter,3,2229b01e-68eb-46ad-adf4-71a9533c84fc,52,10:34,Deni Avdija defensive rebound,rebound,59,2229b01e-68eb-46ad-adf4-71a9533c84fc,basketball_play,1776652614,213,True,2026-04-20 02:36:54+00:00,3,634.0,1526.0,25.433333333333334,256
2,100,quarter,3,2229b01e-68eb-46ad-adf4-71a9533c84fc,55,10:28,Scoot Henderson makes three point stepback jump shot (Jrue Holiday assists),threepointmade,59,ad36c3e8-4194-4e63-920f-7c50f46191a6,basketball_play,1776652620,212,True,2026-04-20 02:37:00+00:00,3,628.0,1532.0,25.533333333333335,257
2,99,quarter,3,ad36c3e8-4194-4e63-920f-7c50f46191a6,55,10:02,Victor Wembanyama misses two point jump shot,twopointmiss,59,,basketball_play,1776652645,211,True,2026-04-20 02:37:25+00:00,3,602.0,1558.0,25.966666666666665,258
2,98,quarter,3,2229b01e-68eb-46ad-adf4-71a9533c84fc,55,10:00,Jrue Holiday defensive rebound,rebound,59,2229b01e-68eb-46ad-adf4-71a9533c84fc,basketball_play,1776652647,210,True,2026-04-20 02:37:27+00:00,3,600.0,1560.0,26.0,259
2,97,quarter,3,2229b01e-68eb-46ad-adf4-71a9533c84fc,55,9:58,Toumani Camara turnover (out of bounds step),turnover,59,ad36c3e8-4194-4e63-920f-7c50f46191a6,basketball_play,1776652653,209,True,2026-04-20 02:37:33+00:00,3,598.0,1562.0,26.033333333333335,260
2,96,quarter,3,ad36c3e8-4194-4e63-920f-7c50f46191a6,55,9:46,Victor Wembanyama turnover (lost ball) (Scoot Henderson steals),turnover,59,2229b01e-68eb-46ad-adf4-71a9533c84fc,basketball_play,1776652677,208,True,2026-04-20 02:37:57+00:00,3,586.0,1574.0,26.233333333333334,261
2,95,quarter,3,2229b01e-68eb-46ad-adf4-71a9533c84fc,57,9:42,Scoot Henderson makes two point running layup,twopointmade,59,ad36c3e8-4194-4e63-920f-7c50f46191a6,basketball_play,1776652681,207,True,2026-04-20 02:38:01+00:00,3,582.0,1578.0,26.3,262
2,94,quarter,3,ad36c3e8-4194-4e63-920f-7c50f46191a6,57,9:42,Spurs 60 second timeout,teamtimeout,59,,basketball_play,1776652686,206,True,2026-04-20 02:38:06+00:00,3,582.0,1578.0,26.3,263
2,93,quarter,3,ad36c3e8-4194-4e63-920f-7c50f46191a6,57,9:21,Stephon Castle makes two point alley-oop dunk (De'Aaron Fox assists),twopointmade,61,2229b01e-68eb-46ad-adf4-71a9533c84fc,basketball_play,1776652922,205,True,2026-04-20 02:42:02+00:00,3,561.0,1599.0,26.65,264
2,92,quarter,3,,57,9:20,Stoppage (Other),stoppage,61,,basketball_play,1776652933,204,True,2026-04-20 02:42:13+00:00,3,560.0,1600.0,26.666666666666668,265
2,91,quarter,3,2229b01e-68eb-46ad-adf4-71a9533c84fc,59,9:07,Scoot Henderson makes two point pullup jump shot (Jrue Holiday assists),twopointmade,61,ad36c3e8-4194-4e63-920f-7c50f46191a6,basketball_play,1776652946,203,True,2026-04-20 02:42:26+00:00,3,547.0,1613.0,26.883333333333333,266
2,90,quarter,3,ad36c3e8-4194-4e63-920f-7c50f46191a6,59,8:49,Devin Vassell misses three point jump shot,threepointmiss,61,,basketball_play,1776652964,202,True,2026-04-20 02:42:44+00:00,3,529.0,1631.0,27.183333333333334,267
2,89,quarter,3,2229b01e-68eb-46ad-adf4-71a9533c84fc,59,8:46,Donovan Clingan defensive rebound,rebound,61,2229b01e-68eb-46ad-adf4-71a9533c84fc,basketball_play,1776652967,201,True,2026-04-20 02:42:47+00:00,3,526.0,1634.0,27.233333333333334,268
2,88,quarter,3,ad36c3e8-4194-4e63-920f-7c50f46191a6,59,8:37,De'Aaron Fox personal foul (Donovan Clingan draws the foul),personalfoul,61,2229b01e-68eb-46ad-adf4-71a9533c84fc,basketball_play,1776652979,200,True,2026-04-20 02:42:59+00:00,3,517.0,1643.0,27.383333333333333,269
2,87,quarter,3,2229b01e-68eb-46ad-adf4-71a9533c84fc,59,8:24,Toumani Camara turnover (bad pass) (Julian Champagnie steals),turnover,61,ad36c3e8-4194-4e63-920f-7c50f46191a6,basketball_play,1776653006,199,True,2026-04-20 02:43:26+00:00,3,504.0,1656.0,27.6,270
2,86,quarter,3,ad36c3e8-4194-4e63-920f-7c50f46191a6,59,8:11,Stephon Castle misses three point jump shot,threepointmiss,61,,basketball_play,1776653020,198,True,2026-04-20 02:43:40+00:00,3,491.0,1669.0,27.816666666666666,271
2,85,quarter,3,2229b01e-68eb-46ad-adf4-71a9533c84fc,59,8:07,Donovan Clingan defensive rebound,rebound,61,2229b01e-68eb-46ad-adf4-71a9533c84fc,basketball_play,1776653024,197,True,2026-04-20 02:43:44+00:00,3,487.0,1673.0,27.883333333333333,272
2,84,quarter,3,2229b01e-68eb-46ad-adf4-71a9533c84fc,59,7:55,Toumani Camara misses three point jump shot,threepointmiss,61,,basketball_play,1776653036,196,True,2026-04-20 02:43:56+00:00,3,475.0,1685.0,28.083333333333332,273
2,83,quarter,3,ad36c3e8-4194-4e63-920f-7c50f46191a6,59,7:51,Julian Champagnie defensive rebound,rebound,61,ad36c3e8-4194-4e63-920f-7c50f46191a6,basketball_play,1776653040,195,True,2026-04-20 02:44:00+00:00,3,471.0,1689.0,28.15,274
2,82,quarter,3,2229b01e-68eb-46ad-adf4-71a9533c84fc,59,7:49,Deni Avdija personal foul (De'Aaron Fox draws the foul),personalfoul,61,ad36c3e8-4194-4e63-920f-7c50f46191a6,basketball_play,1776653044,194,True,2026-04-20 02:44:04+00:00,3,469.0,1691.0,28.183333333333334,275
2,81,quarter,3,ad36c3e8-4194-4e63-920f-7c50f46191a6,59,7:42,De'Aaron Fox misses two point pullup jump shot,twopointmiss,61,,basketball_play,1776653076,193,True,2026-04-20 02:44:36+00:00,3,462.0,1698.0,28.3,276
2,80,quarter,3,2229b01e-68eb-46ad-adf4-71a9533c84fc,59,7:39,Scoot Henderson defensive rebound,rebound,61,2229b01e-68eb-46ad-adf4-71a9533c84fc,basketball_play,1776653079,192,True,2026-04-20 02:44:39+00:00,3,459.0,1701.0,28.35,277
2,79,quarter,3,2229b01e-68eb-46ad-adf4-71a9533c84fc,59,7:34,Scoot Henderson turnover (out of bounds bad pass),turnover,61,ad36c3e8-4194-4e63-920f-7c50f46191a6,basketball_play,1776653086,191,True,2026-04-20 02:44:46+00:00,3,454.0,1706.0,28.433333333333334,278
2,78,quarter,3,ad36c3e8-4194-4e63-920f-7c50f46191a6,59,7:24,Julian Champagnie misses three point pullup jump shot,threepointmiss,61,,basketball_play,1776653098,190,True,2026-04-20 02:44:58+00:00,3,444.0,1716.0,28.6,279
2,77,quarter,3,2229b01e-68eb-46ad-adf4-71a9533c84fc,59,7:21,Deni Avdija defensive rebound,rebound,61,2229b01e-68eb-46ad-adf4-71a9533c84fc,basketball_play,1776653101,189,True,2026-04-20 02:45:01+00:00,3,441.0,1719.0,28.65,280
2,76,quarter,3,2229b01e-68eb-46ad-adf4-71a9533c84fc,59,7:19,Deni Avdija turnover (bad pass) (Julian Champagnie steals),turnover,61,ad36c3e8-4194-4e63-920f-7c50f46191a6,basketball_play,1776653102,188,True,2026-04-20 02:45:02+00:00,3,439.0,1721.0,28.683333333333334,281
2,75,quarter,3,ad36c3e8-4194-4e63-920f-7c50f46191a6,59,7:12,Julian Champagnie makes three point running jump shot (Devin Vassell assists),threepointmade,64,2229b01e-68eb-46ad-adf4-71a9533c84fc,basketball_play,1776653109,187,True,2026-04-20 02:45:09+00:00,3,432.0,1728.0,28.8,282
2,74,quarter,3,2229b01e-68eb-46ad-adf4-71a9533c84fc,59,6:53,Scoot Henderson turnover (out of bounds step),turnover,64,ad36c3e8-4194-4e63-920f-7c50f46191a6,basketball_play,1776653131,186,True,2026-04-20 02:45:31+00:00,3,413.0,1747.0,29.116666666666667,283
2,73,quarter,3,ad36c3e8-4194-4e63-920f-7c50f46191a6,59,6:53,"Spurs lineup change (Stephon Castle, De'Aaron Fox, Devin Vassell, Luke Kornet, Julian Champagnie)",lineupchange,64,,basketball_play,1776653168,185,True,2026-04-20 02:46:08+00:00,3,413.0,1747.0,29.116666666666667,284
2,72,quarter,3,ad36c3e8-4194-4e63-920f-7c50f46191a6,59,6:34,De'Aaron Fox makes two point pullup bank jump shot,twopointmade,66,2229b01e-68eb-46ad-adf4-71a9533c84fc,basketball_play,1776653168,184,True,2026-04-20 02:46:08+00:00,3,394.0,1766.0,29.433333333333334,285
2,71,quarter,3,2229b01e-68eb-46ad-adf4-71a9533c84fc,59,6:23,Julian Champagnie blocks Donovan Clingan's two point cutting layup,twopointmiss,66,,basketball_play,1776653178,183,True,2026-04-20 02:46:18+00:00,3,383.0,1777.0,29.616666666666667,286
2,70,quarter,3,2229b01e-68eb-46ad-adf4-71a9533c84fc,59,6:22,Donovan Clingan offensive rebound,rebound,66,2229b01e-68eb-46ad-adf4-71a9533c84fc,basketball_play,1776653179,182,True,2026-04-20 02:46:19+00:00,3,382.0,1778.0,29.633333333333333,287
2,69,quarter,3,2229b01e-68eb-46ad-adf4-71a9533c84fc,59,6:21,Devin Vassell blocks Donovan Clingan's two point floating jump shot,twopointmiss,66,,basketball_play,1776653184,181,True,2026-04-20 02:46:24+00:00,3,381.0,1779.0,29.65,288
2,68,quarter,3,ad36c3e8-4194-4e63-920f-7c50f46191a6,59,6:20,Luke Kornet defensive rebound,rebound,66,ad36c3e8-4194-4e63-920f-7c50f46191a6,basketball_play,1776653185,180,True,2026-04-20 02:46:25+00:00,3,380.0,1780.0,29.666666666666668,289
2,67,quarter,3,2229b01e-68eb-46ad-adf4-71a9533c84fc,59,6:16,Donovan Clingan personal foul (Devin Vassell draws the foul),personalfoul,66,ad36c3e8-4194-4e63-920f-7c50f46191a6,basketball_play,1776653192,179,True,2026-04-20 02:46:32+00:00,3,376.0,1784.0,29.733333333333334,290
2,66,quarter,3,2229b01e-68eb-46ad-adf4-71a9533c84fc,59,6:16,"Trail Blazers lineup change (Deni Avdija, Jrue Holiday, Toumani Camara, Donovan Clingan, Jerami Grant)",lineupchange,66,,basketball_play,1776653206,178,True,2026-04-20 02:46:46+00:00,3,376.0,1784.0,29.733333333333334,291
2,65,quarter,3,ad36c3e8-4194-4e63-920f-7c50f46191a6,59,6:16,"Spurs lineup change (Stephon Castle, Dylan Harper, Devin Vassell, Luke Kornet, Julian Champagnie)",lineupchange,66,,basketball_play,1776653206,177,True,2026-04-20 02:46:46+00:00,3,376.0,1784.0,29.733333333333334,292
2,64,quarter,3,ad36c3e8-4194-4e63-920f-7c50f46191a6,59,6:08,Stephon Castle turnover (lost ball) (Deni Avdija steals),turnover,66,2229b01e-68eb-46ad-adf4-71a9533c84fc,basketball_play,1776653221,176,True,2026-04-20 02:47:01+00:00,3,368.0,1792.0,29.866666666666667,293
2,63,quarter,3,2229b01e-68eb-46ad-adf4-71a9533c84fc,59,6:04,Devin Vassell blocks Jrue Holiday's two point running layup,twopointmiss,66,,basketball_play,1776653226,175,True,2026-04-20 02:47:06+00:00,3,364.0,1796.0,29.933333333333334,294
2,62,quarter,3,2229b01e-68eb-46ad-adf4-71a9533c84fc,59,6:04,Toumani Camara offensive rebound,rebound,66,2229b01e-68eb-46ad-adf4-71a9533c84fc,basketball_play,1776653226,174,True,2026-04-20 02:47:06+00:00,3,364.0,1796.0,29.933333333333334,295
2,61,quarter,3,ad36c3e8-4194-4e63-920f-7c50f46191a6,59,6:04,Dylan Harper shooting foul (Toumani Camara draws the foul),shootingfoul,66,2229b01e-68eb-46ad-adf4-71a9533c84fc,basketball_play,1776653248,173,True,2026-04-20 02:47:28+00:00,3,364.0,1796.0,29.933333333333334,296
2,60,quarter,3,2229b01e-68eb-46ad-adf4-71a9533c84fc,60,6:04,Toumani Camara makes regular free throw 1 of 2,freethrowmade,66,2229b01e-68eb-46ad-adf4-71a9533c84fc,basketball_play,1776653265,172,True,2026-04-20 02:47:45+00:00,3,364.0,1796.0,29.933333333333334,297
2,59,quarter,3,2229b01e-68eb-46ad-adf4-71a9533c84fc,61,6:04,Toumani Camara makes regular free throw 2 of 2,freethrowmade,66,ad36c3e8-4194-4e63-920f-7c50f46191a6,basketball_play,1776653283,171,True,2026-04-20 02:48:03+00:00,3,364.0,1796.0,29.933333333333334,298
2,58,quarter,3,ad36c3e8-4194-4e63-920f-7c50f46191a6,61,5:54,Devin Vassell makes three point jump shot (Stephon Castle assists),threepointmade,69,2229b01e-68eb-46ad-adf4-71a9533c84fc,basketball_play,1776653296,170,True,2026-04-20 02:48:16+00:00,3,354.0,1806.0,30.1,299
2,57,quarter,3,2229b01e-68eb-46ad-adf4-71a9533c84fc,61,5:39,Jerami Grant misses three point jump shot,threepointmiss,69,,basketball_play,1776653310,169,True,2026-04-20 02:48:30+00:00,3,339.0,1821.0,30.35,300
2,56,quarter,3,ad36c3e8-4194-4e63-920f-7c50f46191a6,61,5:36,Stephon Castle defensive rebound,rebound,69,ad36c3e8-4194-4e63-920f-7c50f46191a6,basketball_play,1776653313,168,True,2026-04-20 02:48:33+00:00,3,336.0,1824.0,30.4,301
2,55,quarter,3,ad36c3e8-4194-4e63-920f-7c50f46191a6,61,5:22,Devin Vassell turnover (bad pass) (Toumani Camara steals),turnover,69,2229b01e-68eb-46ad-adf4-71a9533c84fc,basketball_play,1776653327,167,True,2026-04-20 02:48:47+00:00,3,322.0,1838.0,30.633333333333333,302
2,54,quarter,3,2229b01e-68eb-46ad-adf4-71a9533c84fc,61,5:16,Toumani Camara misses three point running pullup jump shot,threepointmiss,69,,basketball_play,1776653333,166,True,2026-04-20 02:48:53+00:00,3,316.0,1844.0,30.733333333333334,303
2,53,quarter,3,ad36c3e8-4194-4e63-920f-7c50f46191a6,61,5:13,Stephon Castle defensive rebound,rebound,69,ad36c3e8-4194-4e63-920f-7c50f46191a6,basketball_play,1776653336,165,True,2026-04-20 02:48:56+00:00,3,313.0,1847.0,30.783333333333335,304
2,52,quarter,3,ad36c3e8-4194-4e63-920f-7c50f46191a6,61,5:09,Devin Vassell makes three point running jump shot (Stephon Castle assists),threepointmade,72,2229b01e-68eb-46ad-adf4-71a9533c84fc,basketball_play,1776653340,164,True,2026-04-20 02:49:00+00:00,3,309.0,1851.0,30.85,305
2,51,quarter,3,2229b01e-68eb-46ad-adf4-71a9533c84fc,61,5:08,Trail Blazers 60 second timeout,teamtimeout,72,,basketball_play,1776653346,163,True,2026-04-20 02:49:06+00:00,3,308.0,1852.0,30.866666666666667,306
2,50,quarter,3,2229b01e-68eb-46ad-adf4-71a9533c84fc,61,5:08,"Trail Blazers lineup change (Deni Avdija, Shaedon Sharpe, Robert Williams III, Jerami Grant, Matisse Thybulle)",lineupchange,72,,basketball_play,1776653533,162,True,2026-04-20 02:52:13+00:00,3,308.0,1852.0,30.866666666666667,307
2,49,quarter,3,ad36c3e8-4194-4e63-920f-7c50f46191a6,61,5:08,"Spurs lineup change (Stephon Castle, Dylan Harper, Devin Vassell, Luke Kornet, Keldon Johnson)",lineupchange,72,,basketball_play,1776653533,161,True,2026-04-20 02:52:13+00:00,3,308.0,1852.0,30.866666666666667,308
2,48,quarter,3,2229b01e-68eb-46ad-adf4-71a9533c84fc,63,4:55,Deni Avdija makes two point pullup jump shot (Robert Williams III assists),twopointmade,72,ad36c3e8-4194-4e63-920f-7c50f46191a6,basketball_play,1776653581,160,True,2026-04-20 02:53:01+00:00,3,295.0,1865.0,31.083333333333332,309
2,47,quarter,3,ad36c3e8-4194-4e63-920f-7c50f46191a6,63,4:37,Devin Vassell makes two point pullup bank jump shot (Luke Kornet assists),twopointmade,74,2229b01e-68eb-46ad-adf4-71a9533c84fc,basketball_play,1776653598,159,True,2026-04-20 02:53:18+00:00,3,277.0,1883.0,31.383333333333333,310
2,46,quarter,3,,63,4:17,Stoppage (Out of bounds),stoppage,74,,basketball_play,1776653620,158,True,2026-04-20 02:53:40+00:00,3,257.0,1903.0,31.716666666666665,311
2,45,quarter,3,2229b01e-68eb-46ad-adf4-71a9533c84fc,63,4:12,Shaedon Sharpe misses three point stepback jump shot,threepointmiss,74,,basketball_play,1776653637,157,True,2026-04-20 02:53:57+00:00,3,252.0,1908.0,31.8,312
2,44,quarter,3,ad36c3e8-4194-4e63-920f-7c50f46191a6,63,4:09,Stephon Castle defensive rebound,rebound,74,ad36c3e8-4194-4e63-920f-7c50f46191a6,basketball_play,1776653640,156,True,2026-04-20 02:54:00+00:00,3,249.0,1911.0,31.85,313
2,43,quarter,3,ad36c3e8-4194-4e63-920f-7c50f46191a6,63,4:01,Keldon Johnson misses two point driving floating jump shot,twopointmiss,74,,basketball_play,1776653650,155,True,2026-04-20 02:54:10+00:00,3,241.0,1919.0,31.983333333333334,314
2,42,quarter,3,ad36c3e8-4194-4e63-920f-7c50f46191a6,63,4:00,Spurs offensive rebound,rebound,74,ad36c3e8-4194-4e63-920f-7c50f46191a6,basketball_play,1776653651,154,True,2026-04-20 02:54:11+00:00,3,240.0,1920.0,32.0,315
2,41,quarter,3,ad36c3e8-4194-4e63-920f-7c50f46191a6,63,4:00,Keldon Johnson turnover (traveling),turnover,74,2229b01e-68eb-46ad-adf4-71a9533c84fc,basketball_play,1776653657,153,True,2026-04-20 02:54:17+00:00,3,240.0,1920.0,32.0,316
