period_index,event_index,period_type,period_number,attribution,away_points,clock,description,event_type,home_points,possession,type,wall_clock,pbp_source_row,has_wall_clock,event_ts_utc,period_sequence,game_clock_seconds_remaining,game_elapsed_seconds,game_elapsed_minutes,pbp_chronological_index
4,8,quarter,1,ad36c3e8-4194-4e63-920f-7c50f46191a6,19,00:16.40,Victor Wembanyama personal foul (Loose ball) (Shaedon Sharpe draws the foul),personalfoul,27,2229b01e-68eb-46ad-adf4-71a9533c84fc,basketball_play,1776649409,360,True,2026-04-20 01:43:29+00:00,1,16.4,703.6,11.726666666666667,109
4,7,quarter,1,2229b01e-68eb-46ad-adf4-71a9533c84fc,19,00:16,"Trail Blazers lineup change (Deni Avdija, Shaedon Sharpe, Kris Murray, Jrue Holiday, Jerami Grant)",lineupchange,27,,basketball_play,1776649439,359,True,2026-04-20 01:43:59+00:00,1,16.0,704.0,11.733333333333333,110
4,6,quarter,1,2229b01e-68eb-46ad-adf4-71a9533c84fc,19,00:16,"Trail Blazers lineup change (Deni Avdija, Shaedon Sharpe, Jrue Holiday, Jerami Grant, Scoot Henderson)",lineupchange,27,,basketball_play,1776649464,358,True,2026-04-20 01:44:24+00:00,1,16.0,704.0,11.733333333333333,111
4,5,quarter,1,2229b01e-68eb-46ad-adf4-71a9533c84fc,21,00:04.50,Deni Avdija makes two point stepback jump shot,twopointmade,27,ad36c3e8-4194-4e63-920f-7c50f46191a6,basketball_play,1776649464,357,True,2026-04-20 01:44:24+00:00,1,4.5,715.5,11.925,112
4,4,quarter,1,ad36c3e8-4194-4e63-920f-7c50f46191a6,21,00:00.40,Keldon Johnson makes three point jump shot (De'Aaron Fox assists),threepointmade,30,2229b01e-68eb-46ad-adf4-71a9533c84fc,basketball_play,1776649471,356,True,2026-04-20 01:44:31+00:00,1,0.4,719.6,11.993333333333334,113
4,3,quarter,1,,21,00:00,Instant replay (Request: Ruling Upheld),review,30,,basketball_play,1776649477,355,True,2026-04-20 01:44:37+00:00,1,0.0,720.0,12.0,114
4,2,quarter,1,,21,00:00,Instant replay,review,30,,basketball_play,1776649496,354,True,2026-04-20 01:44:56+00:00,1,0.0,720.0,12.0,115
4,1,quarter,1,,21,00:00,End of 1st Quarter.,endperiod,30,,basketball_play,1776649516,353,True,2026-04-20 01:45:16+00:00,1,0.0,720.0,12.0,116
3,124,quarter,2,2229b01e-68eb-46ad-adf4-71a9533c84fc,21,12:00,"Trail Blazers lineup change (Shaedon Sharpe, Jrue Holiday, Toumani Camara, Jerami Grant, Scoot Henderson)",lineupchange,30,,basketball_play,1776649674,352,True,2026-04-20 01:47:54+00:00,2,720.0,720.0,12.0,117
3,123,quarter,2,ad36c3e8-4194-4e63-920f-7c50f46191a6,21,12:00,"Spurs lineup change (Stephon Castle, Victor Wembanyama, Harrison Barnes, Dylan Harper, Keldon Johnson)",lineupchange,30,,basketball_play,1776649674,351,True,2026-04-20 01:47:54+00:00,2,720.0,720.0,12.0,118
3,122,quarter,2,,21,12:00,Start of 2nd Quarter,startperiod,30,,basketball_play,1776649706,350,True,2026-04-20 01:48:26+00:00,2,720.0,720.0,12.0,119
3,121,quarter,2,2229b01e-68eb-46ad-adf4-71a9533c84fc,23,11:47,Shaedon Sharpe makes two point driving finger roll layup (Scoot Henderson assists),twopointmade,30,ad36c3e8-4194-4e63-920f-7c50f46191a6,basketball_play,1776649719,349,True,2026-04-20 01:48:39+00:00,2,707.0,733.0,12.216666666666667,120
3,120,quarter,2,ad36c3e8-4194-4e63-920f-7c50f46191a6,23,11:29,Victor Wembanyama makes two point alley-oop dunk (Dylan Harper assists),twopointmade,32,2229b01e-68eb-46ad-adf4-71a9533c84fc,basketball_play,1776649736,348,True,2026-04-20 01:48:56+00:00,2,689.0,751.0,12.516666666666667,121
3,119,quarter,2,2229b01e-68eb-46ad-adf4-71a9533c84fc,26,11:21,Toumani Camara makes three point jump shot (Jrue Holiday assists),threepointmade,32,ad36c3e8-4194-4e63-920f-7c50f46191a6,basketball_play,1776649744,347,True,2026-04-20 01:49:04+00:00,2,681.0,759.0,12.65,122
3,118,quarter,2,ad36c3e8-4194-4e63-920f-7c50f46191a6,26,11:01,Stephon Castle turnover (lost ball) (Shaedon Sharpe steals),turnover,32,2229b01e-68eb-46ad-adf4-71a9533c84fc,basketball_play,1776649765,346,True,2026-04-20 01:49:25+00:00,2,661.0,779.0,12.983333333333333,123
3,117,quarter,2,2229b01e-68eb-46ad-adf4-71a9533c84fc,26,10:54,Jrue Holiday misses two point pullup jump shot,twopointmiss,32,,basketball_play,1776649772,345,True,2026-04-20 01:49:32+00:00,2,654.0,786.0,13.1,124
3,116,quarter,2,ad36c3e8-4194-4e63-920f-7c50f46191a6,26,10:51,Stephon Castle defensive rebound,rebound,32,ad36c3e8-4194-4e63-920f-7c50f46191a6,basketball_play,1776649775,344,True,2026-04-20 01:49:35+00:00,2,651.0,789.0,13.15,125
3,115,quarter,2,ad36c3e8-4194-4e63-920f-7c50f46191a6,26,10:44,Stephon Castle misses three point jump shot,threepointmiss,32,,basketball_play,1776649782,343,True,2026-04-20 01:49:42+00:00,2,644.0,796.0,13.266666666666667,126
3,114,quarter,2,ad36c3e8-4194-4e63-920f-7c50f46191a6,26,10:43,Harrison Barnes offensive rebound,rebound,32,ad36c3e8-4194-4e63-920f-7c50f46191a6,basketball_play,1776649783,342,True,2026-04-20 01:49:43+00:00,2,643.0,797.0,13.283333333333333,127
3,113,quarter,2,2229b01e-68eb-46ad-adf4-71a9533c84fc,26,10:38,Jrue Holiday shooting foul (Harrison Barnes draws the foul),shootingfoul,32,ad36c3e8-4194-4e63-920f-7c50f46191a6,basketball_play,1776649790,341,True,2026-04-20 01:49:50+00:00,2,638.0,802.0,13.366666666666667,128
3,112,quarter,2,ad36c3e8-4194-4e63-920f-7c50f46191a6,26,10:38,Harrison Barnes makes regular free throw 1 of 2,freethrowmade,33,ad36c3e8-4194-4e63-920f-7c50f46191a6,basketball_play,1776649815,340,True,2026-04-20 01:50:15+00:00,2,638.0,802.0,13.366666666666667,129
3,111,quarter,2,ad36c3e8-4194-4e63-920f-7c50f46191a6,26,10:38,"Spurs lineup change (Stephon Castle, Victor Wembanyama, Harrison Barnes, Carter Bryant, Dylan Harper)",lineupchange,33,,basketball_play,1776649839,339,True,2026-04-20 01:50:39+00:00,2,638.0,802.0,13.366666666666667,130
3,110,quarter,2,ad36c3e8-4194-4e63-920f-7c50f46191a6,26,10:38,Harrison Barnes makes regular free throw 2 of 2,freethrowmade,34,2229b01e-68eb-46ad-adf4-71a9533c84fc,basketball_play,1776649839,338,True,2026-04-20 01:50:39+00:00,2,638.0,802.0,13.366666666666667,131
3,109,quarter,2,2229b01e-68eb-46ad-adf4-71a9533c84fc,26,10:18,Shaedon Sharpe misses three point pullup jump shot,threepointmiss,34,,basketball_play,1776649860,337,True,2026-04-20 01:51:00+00:00,2,618.0,822.0,13.7,132
3,108,quarter,2,ad36c3e8-4194-4e63-920f-7c50f46191a6,26,10:16,Dylan Harper defensive rebound,rebound,34,ad36c3e8-4194-4e63-920f-7c50f46191a6,basketball_play,1776649862,336,True,2026-04-20 01:51:02+00:00,2,616.0,824.0,13.733333333333333,133
3,107,quarter,2,ad36c3e8-4194-4e63-920f-7c50f46191a6,26,10:05,Victor Wembanyama turnover (lost ball) (Jrue Holiday steals),turnover,34,2229b01e-68eb-46ad-adf4-71a9533c84fc,basketball_play,1776649874,335,True,2026-04-20 01:51:14+00:00,2,605.0,835.0,13.916666666666666,134
3,106,quarter,2,,26,10:01,Stoppage (Out of bounds),stoppage,34,,basketball_play,1776649880,334,True,2026-04-20 01:51:20+00:00,2,601.0,839.0,13.983333333333333,135
3,105,quarter,2,2229b01e-68eb-46ad-adf4-71a9533c84fc,28,9:54,Shaedon Sharpe makes two point pullup jump shot,twopointmade,34,ad36c3e8-4194-4e63-920f-7c50f46191a6,basketball_play,1776649902,333,True,2026-04-20 01:51:42+00:00,2,594.0,846.0,14.1,136
3,104,quarter,2,ad36c3e8-4194-4e63-920f-7c50f46191a6,28,9:40,Victor Wembanyama makes two point alley-oop dunk (Stephon Castle assists),twopointmade,36,2229b01e-68eb-46ad-adf4-71a9533c84fc,basketball_play,1776649915,332,True,2026-04-20 01:51:55+00:00,2,580.0,860.0,14.333333333333334,137
3,103,quarter,2,2229b01e-68eb-46ad-adf4-71a9533c84fc,31,9:26,Jerami Grant makes three point jump shot (Jrue Holiday assists),threepointmade,36,ad36c3e8-4194-4e63-920f-7c50f46191a6,basketball_play,1776649929,331,True,2026-04-20 01:52:09+00:00,2,566.0,874.0,14.566666666666666,138
3,102,quarter,2,ad36c3e8-4194-4e63-920f-7c50f46191a6,31,9:14,Dylan Harper makes two point driving finger roll layup,twopointmade,38,2229b01e-68eb-46ad-adf4-71a9533c84fc,basketball_play,1776649942,330,True,2026-04-20 01:52:22+00:00,2,554.0,886.0,14.766666666666667,139
3,101,quarter,2,2229b01e-68eb-46ad-adf4-71a9533c84fc,31,9:05,Jrue Holiday misses three point jump shot,threepointmiss,38,,basketball_play,1776649950,329,True,2026-04-20 01:52:30+00:00,2,545.0,895.0,14.916666666666666,140
3,100,quarter,2,2229b01e-68eb-46ad-adf4-71a9533c84fc,31,9:05,Trail Blazers offensive rebound,rebound,38,2229b01e-68eb-46ad-adf4-71a9533c84fc,basketball_play,1776649950,328,True,2026-04-20 01:52:30+00:00,2,545.0,895.0,14.916666666666666,141
3,99,quarter,2,ad36c3e8-4194-4e63-920f-7c50f46191a6,31,9:05,Carter Bryant personal foul (Loose ball) (Toumani Camara draws the foul),personalfoul,38,2229b01e-68eb-46ad-adf4-71a9533c84fc,basketball_play,1776649957,327,True,2026-04-20 01:52:37+00:00,2,545.0,895.0,14.916666666666666,142
3,98,quarter,2,2229b01e-68eb-46ad-adf4-71a9533c84fc,31,9:05,"Trail Blazers lineup change (Shaedon Sharpe, Toumani Camara, Robert Williams III, Jerami Grant, Scoot Henderson)",lineupchange,38,,basketball_play,1776649971,326,True,2026-04-20 01:52:51+00:00,2,545.0,895.0,14.916666666666666,143
3,97,quarter,2,ad36c3e8-4194-4e63-920f-7c50f46191a6,31,9:05,"Spurs lineup change (De'Aaron Fox, Victor Wembanyama, Harrison Barnes, Carter Bryant, Julian Champagnie)",lineupchange,38,,basketball_play,1776649971,325,True,2026-04-20 01:52:51+00:00,2,545.0,895.0,14.916666666666666,144
3,96,quarter,2,2229b01e-68eb-46ad-adf4-71a9533c84fc,31,8:51,Trail Blazers turnover (shot clock violation),turnover,38,ad36c3e8-4194-4e63-920f-7c50f46191a6,basketball_play,1776650003,324,True,2026-04-20 01:53:23+00:00,2,531.0,909.0,15.15,145
3,95,quarter,2,ad36c3e8-4194-4e63-920f-7c50f46191a6,31,8:37,Julian Champagnie turnover (bad pass) (Jerami Grant steals),turnover,38,2229b01e-68eb-46ad-adf4-71a9533c84fc,basketball_play,1776650033,323,True,2026-04-20 01:53:53+00:00,2,517.0,923.0,15.383333333333333,146
3,94,quarter,2,2229b01e-68eb-46ad-adf4-71a9533c84fc,31,8:26,Toumani Camara misses two point driving floating bank jump shot,twopointmiss,38,,basketball_play,1776650044,322,True,2026-04-20 01:54:04+00:00,2,506.0,934.0,15.566666666666666,147
3,93,quarter,2,ad36c3e8-4194-4e63-920f-7c50f46191a6,31,8:24,Carter Bryant defensive rebound,rebound,38,ad36c3e8-4194-4e63-920f-7c50f46191a6,basketball_play,1776650046,321,True,2026-04-20 01:54:06+00:00,2,504.0,936.0,15.6,148
3,92,quarter,2,,31,8:24,Stoppage (Out of bounds),stoppage,38,,basketball_play,1776650050,320,True,2026-04-20 01:54:10+00:00,2,504.0,936.0,15.6,149
3,91,quarter,2,ad36c3e8-4194-4e63-920f-7c50f46191a6,31,8:07,De'Aaron Fox misses three point jump shot,threepointmiss,38,,basketball_play,1776650070,319,True,2026-04-20 01:54:30+00:00,2,487.0,953.0,15.883333333333333,150
3,90,quarter,2,2229b01e-68eb-46ad-adf4-71a9533c84fc,31,8:04,Robert Williams III defensive rebound,rebound,38,2229b01e-68eb-46ad-adf4-71a9533c84fc,basketball_play,1776650073,318,True,2026-04-20 01:54:33+00:00,2,484.0,956.0,15.933333333333334,151
3,89,quarter,2,2229b01e-68eb-46ad-adf4-71a9533c84fc,31,7:49,Robert Williams III misses three point jump shot,threepointmiss,38,,basketball_play,1776650087,317,True,2026-04-20 01:54:47+00:00,2,469.0,971.0,16.183333333333334,152
3,88,quarter,2,2229b01e-68eb-46ad-adf4-71a9533c84fc,31,7:49,Trail Blazers offensive rebound,rebound,38,2229b01e-68eb-46ad-adf4-71a9533c84fc,basketball_play,1776650087,316,True,2026-04-20 01:54:47+00:00,2,469.0,971.0,16.183333333333334,153
3,87,quarter,2,ad36c3e8-4194-4e63-920f-7c50f46191a6,31,7:49,De'Aaron Fox personal foul (Loose ball) (Toumani Camara draws the foul),personalfoul,38,2229b01e-68eb-46ad-adf4-71a9533c84fc,basketball_play,1776650092,315,True,2026-04-20 01:54:52+00:00,2,469.0,971.0,16.183333333333334,154
3,86,quarter,2,ad36c3e8-4194-4e63-920f-7c50f46191a6,31,7:49,"Spurs lineup change (De'Aaron Fox, Victor Wembanyama, Carter Bryant, Devin Vassell, Julian Champagnie)",lineupchange,38,,basketball_play,1776650112,314,True,2026-04-20 01:55:12+00:00,2,469.0,971.0,16.183333333333334,155
3,85,quarter,2,2229b01e-68eb-46ad-adf4-71a9533c84fc,31,7:49,"Trail Blazers lineup change (Deni Avdija, Shaedon Sharpe, Toumani Camara, Donovan Clingan, Jerami Grant)",lineupchange,38,,basketball_play,1776650118,313,True,2026-04-20 01:55:18+00:00,2,469.0,971.0,16.183333333333334,156
3,84,quarter,2,ad36c3e8-4194-4e63-920f-7c50f46191a6,31,7:49,"Spurs lineup change (De'Aaron Fox, Carter Bryant, Devin Vassell, Luke Kornet, Julian Champagnie)",lineupchange,38,,basketball_play,1776650118,312,True,2026-04-20 01:55:18+00:00,2,469.0,971.0,16.183333333333334,157
3,83,quarter,2,2229b01e-68eb-46ad-adf4-71a9533c84fc,31,7:42,Donovan Clingan misses three point jump shot,threepointmiss,38,,basketball_play,1776650138,311,True,2026-04-20 01:55:38+00:00,2,462.0,978.0,16.3,158
3,82,quarter,2,2229b01e-68eb-46ad-adf4-71a9533c84fc,31,7:41,Trail Blazers offensive rebound,rebound,38,2229b01e-68eb-46ad-adf4-71a9533c84fc,basketball_play,1776650139,310,True,2026-04-20 01:55:39+00:00,2,461.0,979.0,16.316666666666666,159
3,81,quarter,2,,31,7:41,Stoppage (Out of bounds),stoppage,38,,basketball_play,1776650143,309,True,2026-04-20 01:55:43+00:00,2,461.0,979.0,16.316666666666666,160
3,80,quarter,2,2229b01e-68eb-46ad-adf4-71a9533c84fc,31,7:31,Shaedon Sharpe misses three point pullup jump shot,threepointmiss,38,,basketball_play,1776650165,308,True,2026-04-20 01:56:05+00:00,2,451.0,989.0,16.483333333333334,161
3,79,quarter,2,ad36c3e8-4194-4e63-920f-7c50f46191a6,31,7:25,Carter Bryant defensive rebound,rebound,38,ad36c3e8-4194-4e63-920f-7c50f46191a6,basketball_play,1776650171,307,True,2026-04-20 01:56:11+00:00,2,445.0,995.0,16.583333333333332,162
3,78,quarter,2,ad36c3e8-4194-4e63-920f-7c50f46191a6,31,7:23,Devin Vassell makes three point running jump shot (Julian Champagnie assists),threepointmade,41,2229b01e-68eb-46ad-adf4-71a9533c84fc,basketball_play,1776650173,306,True,2026-04-20 01:56:13+00:00,2,443.0,997.0,16.616666666666667,163
3,77,quarter,2,2229b01e-68eb-46ad-adf4-71a9533c84fc,31,7:21,Trail Blazers 60 second timeout,teamtimeout,41,,basketball_play,1776650185,305,True,2026-04-20 01:56:25+00:00,2,441.0,999.0,16.65,164
3,76,quarter,2,2229b01e-68eb-46ad-adf4-71a9533c84fc,31,7:21,"Trail Blazers lineup change (Deni Avdija, Toumani Camara, Donovan Clingan, Jerami Grant, Matisse Thybulle)",lineupchange,41,,basketball_play,1776650425,304,True,2026-04-20 02:00:25+00:00,2,441.0,999.0,16.65,165
3,75,quarter,2,ad36c3e8-4194-4e63-920f-7c50f46191a6,31,7:08,Carter Bryant personal foul (Deni Avdija draws the foul),personalfoul,41,2229b01e-68eb-46ad-adf4-71a9533c84fc,basketball_play,1776650425,303,True,2026-04-20 02:00:25+00:00,2,428.0,1012.0,16.866666666666667,166
3,74,quarter,2,ad36c3e8-4194-4e63-920f-7c50f46191a6,31,7:04,Carter Bryant shooting foul (Deni Avdija draws the foul),shootingfoul,41,2229b01e-68eb-46ad-adf4-71a9533c84fc,basketball_play,1776650447,302,True,2026-04-20 02:00:47+00:00,2,424.0,1016.0,16.933333333333334,167
3,73,quarter,2,2229b01e-68eb-46ad-adf4-71a9533c84fc,31,7:04,Deni Avdija misses regular free throw 1 of 2,freethrowmiss,41,2229b01e-68eb-46ad-adf4-71a9533c84fc,basketball_play,1776650469,301,True,2026-04-20 02:01:09+00:00,2,424.0,1016.0,16.933333333333334,168
3,72,quarter,2,2229b01e-68eb-46ad-adf4-71a9533c84fc,31,7:04,Trail Blazers offensive rebound,rebound,41,2229b01e-68eb-46ad-adf4-71a9533c84fc,basketball_play,1776650469,300,True,2026-04-20 02:01:09+00:00,2,424.0,1016.0,16.933333333333334,169
3,71,quarter,2,ad36c3e8-4194-4e63-920f-7c50f46191a6,31,7:04,"Spurs lineup change (De'Aaron Fox, Dylan Harper, Devin Vassell, Luke Kornet, Julian Champagnie)",lineupchange,41,,basketball_play,1776650491,299,True,2026-04-20 02:01:31+00:00,2,424.0,1016.0,16.933333333333334,170
3,70,quarter,2,2229b01e-68eb-46ad-adf4-71a9533c84fc,32,7:04,Deni Avdija makes regular free throw 2 of 2,freethrowmade,41,ad36c3e8-4194-4e63-920f-7c50f46191a6,basketball_play,1776650491,298,True,2026-04-20 02:01:31+00:00,2,424.0,1016.0,16.933333333333334,171
3,69,quarter,2,ad36c3e8-4194-4e63-920f-7c50f46191a6,32,6:50,De'Aaron Fox makes two point pullup jump shot,twopointmade,43,2229b01e-68eb-46ad-adf4-71a9533c84fc,basketball_play,1776650507,297,True,2026-04-20 02:01:47+00:00,2,410.0,1030.0,17.166666666666668,172
3,68,quarter,2,2229b01e-68eb-46ad-adf4-71a9533c84fc,34,6:39,Deni Avdija makes two point driving layup,twopointmade,43,ad36c3e8-4194-4e63-920f-7c50f46191a6,basketball_play,1776650519,296,True,2026-04-20 02:01:59+00:00,2,399.0,1041.0,17.35,173
3,67,quarter,2,ad36c3e8-4194-4e63-920f-7c50f46191a6,34,6:29,Luke Kornet makes two point alley-oop dunk (De'Aaron Fox assists),twopointmade,45,2229b01e-68eb-46ad-adf4-71a9533c84fc,basketball_play,1776650527,295,True,2026-04-20 02:02:07+00:00,2,389.0,1051.0,17.516666666666666,174
3,66,quarter,2,2229b01e-68eb-46ad-adf4-71a9533c84fc,34,6:10,Deni Avdija misses two point driving finger roll layup,twopointmiss,45,,basketball_play,1776650547,294,True,2026-04-20 02:02:27+00:00,2,370.0,1070.0,17.833333333333332,175
3,65,quarter,2,ad36c3e8-4194-4e63-920f-7c50f46191a6,34,6:07,Luke Kornet defensive rebound,rebound,45,ad36c3e8-4194-4e63-920f-7c50f46191a6,basketball_play,1776650550,293,True,2026-04-20 02:02:30+00:00,2,367.0,1073.0,17.883333333333333,176
3,64,quarter,2,ad36c3e8-4194-4e63-920f-7c50f46191a6,34,6:01,De'Aaron Fox makes three point pullup jump shot (Devin Vassell assists),threepointmade,48,2229b01e-68eb-46ad-adf4-71a9533c84fc,basketball_play,1776650556,292,True,2026-04-20 02:02:36+00:00,2,361.0,1079.0,17.983333333333334,177
3,63,quarter,2,2229b01e-68eb-46ad-adf4-71a9533c84fc,34,5:46,Jerami Grant turnover (bad pass) (Julian Champagnie steals),turnover,48,ad36c3e8-4194-4e63-920f-7c50f46191a6,basketball_play,1776650571,291,True,2026-04-20 02:02:51+00:00,2,346.0,1094.0,18.233333333333334,178
3,62,quarter,2,ad36c3e8-4194-4e63-920f-7c50f46191a6,34,5:41,Deni Avdija blocks Dylan Harper's two point running layup,twopointmiss,48,,basketball_play,1776650576,290,True,2026-04-20 02:02:56+00:00,2,341.0,1099.0,18.316666666666666,179
3,61,quarter,2,ad36c3e8-4194-4e63-920f-7c50f46191a6,34,5:40,Julian Champagnie offensive rebound,rebound,48,ad36c3e8-4194-4e63-920f-7c50f46191a6,basketball_play,1776650577,289,True,2026-04-20 02:02:57+00:00,2,340.0,1100.0,18.333333333333332,180
3,60,quarter,2,2229b01e-68eb-46ad-adf4-71a9533c84fc,34,5:34,Toumani Camara personal foul (Julian Champagnie draws the foul),personalfoul,48,ad36c3e8-4194-4e63-920f-7c50f46191a6,basketball_play,1776650584,288,True,2026-04-20 02:03:04+00:00,2,334.0,1106.0,18.433333333333334,181
3,59,quarter,2,2229b01e-68eb-46ad-adf4-71a9533c84fc,34,5:34,"Trail Blazers lineup change (Deni Avdija, Jrue Holiday, Toumani Camara, Donovan Clingan, Matisse Thybulle)",lineupchange,48,,basketball_play,1776650598,287,True,2026-04-20 02:03:18+00:00,2,334.0,1106.0,18.433333333333334,182
3,58,quarter,2,ad36c3e8-4194-4e63-920f-7c50f46191a6,34,5:34,"Spurs lineup change (Stephon Castle, Dylan Harper, Devin Vassell, Luke Kornet, Julian Champagnie)",lineupchange,48,,basketball_play,1776650598,286,True,2026-04-20 02:03:18+00:00,2,334.0,1106.0,18.433333333333334,183
3,57,quarter,2,ad36c3e8-4194-4e63-920f-7c50f46191a6,34,5:24,Luke Kornet makes two point alley-oop dunk (Stephon Castle assists),twopointmade,50,2229b01e-68eb-46ad-adf4-71a9533c84fc,basketball_play,1776650628,285,True,2026-04-20 02:03:48+00:00,2,324.0,1116.0,18.6,184
3,56,quarter,2,2229b01e-68eb-46ad-adf4-71a9533c84fc,36,5:10,Jrue Holiday makes two point driving layup,twopointmade,50,ad36c3e8-4194-4e63-920f-7c50f46191a6,basketball_play,1776650643,284,True,2026-04-20 02:04:03+00:00,2,310.0,1130.0,18.833333333333332,185
3,55,quarter,2,ad36c3e8-4194-4e63-920f-7c50f46191a6,36,4:50,Dylan Harper offensive foul (Charge) (Toumani Camara draws the foul),offensivefoul,50,2229b01e-68eb-46ad-adf4-71a9533c84fc,basketball_play,1776650666,283,True,2026-04-20 02:04:26+00:00,2,290.0,1150.0,19.166666666666668,186
3,54,quarter,2,ad36c3e8-4194-4e63-920f-7c50f46191a6,36,4:50,Dylan Harper turnover (offensive foul),turnover,50,2229b01e-68eb-46ad-adf4-71a9533c84fc,basketball_play,1776650666,282,True,2026-04-20 02:04:26+00:00,2,290.0,1150.0,19.166666666666668,187
3,53,quarter,2,2229b01e-68eb-46ad-adf4-71a9533c84fc,36,4:50,"Trail Blazers lineup change (Deni Avdija, Shaedon Sharpe, Jrue Holiday, Robert Williams III, Matisse Thybulle)",lineupchange,50,,basketball_play,1776650674,281,True,2026-04-20 02:04:34+00:00,2,290.0,1150.0,19.166666666666668,188
3,52,quarter,2,2229b01e-68eb-46ad-adf4-71a9533c84fc,36,4:33,Matisse Thybulle misses three point jump shot,threepointmiss,50,,basketball_play,1776650703,280,True,2026-04-20 02:05:03+00:00,2,273.0,1167.0,19.45,189
3,51,quarter,2,2229b01e-68eb-46ad-adf4-71a9533c84fc,36,4:29,Robert Williams III offensive rebound,rebound,50,2229b01e-68eb-46ad-adf4-71a9533c84fc,basketball_play,1776650707,279,True,2026-04-20 02:05:07+00:00,2,269.0,1171.0,19.516666666666666,190
3,50,quarter,2,2229b01e-68eb-46ad-adf4-71a9533c84fc,36,4:27,Shaedon Sharpe misses two point layup,twopointmiss,50,,basketball_play,1776650708,278,True,2026-04-20 02:05:08+00:00,2,267.0,1173.0,19.55,191
3,49,quarter,2,2229b01e-68eb-46ad-adf4-71a9533c84fc,36,4:26,Robert Williams III offensive rebound,rebound,50,2229b01e-68eb-46ad-adf4-71a9533c84fc,basketball_play,1776650709,277,True,2026-04-20 02:05:09+00:00,2,266.0,1174.0,19.566666666666666,192
3,48,quarter,2,2229b01e-68eb-46ad-adf4-71a9533c84fc,38,4:25,Robert Williams III makes two point tip dunk,twopointmade,50,ad36c3e8-4194-4e63-920f-7c50f46191a6,basketball_play,1776650714,276,True,2026-04-20 02:05:14+00:00,2,265.0,1175.0,19.583333333333332,193
3,47,quarter,2,ad36c3e8-4194-4e63-920f-7c50f46191a6,38,4:11,Stephon Castle misses three point stepback jump shot,threepointmiss,50,,basketball_play,1776650723,275,True,2026-04-20 02:05:23+00:00,2,251.0,1189.0,19.816666666666666,194
3,46,quarter,2,ad36c3e8-4194-4e63-920f-7c50f46191a6,38,4:10,Luke Kornet offensive rebound,rebound,50,ad36c3e8-4194-4e63-920f-7c50f46191a6,basketball_play,1776650724,274,True,2026-04-20 02:05:24+00:00,2,250.0,1190.0,19.833333333333332,195
3,45,quarter,2,ad36c3e8-4194-4e63-920f-7c50f46191a6,38,4:07,Luke Kornet makes two point putback layup,twopointmade,52,2229b01e-68eb-46ad-adf4-71a9533c84fc,basketball_play,1776650733,273,True,2026-04-20 02:05:33+00:00,2,247.0,1193.0,19.883333333333333,196
3,44,quarter,2,ad36c3e8-4194-4e63-920f-7c50f46191a6,38,3:54,Stephon Castle personal foul (Deni Avdija draws the foul),personalfoul,52,2229b01e-68eb-46ad-adf4-71a9533c84fc,basketball_play,1776650755,272,True,2026-04-20 02:05:55+00:00,2,234.0,1206.0,20.1,197
3,43,quarter,2,2229b01e-68eb-46ad-adf4-71a9533c84fc,39,3:54,Deni Avdija makes regular free throw 1 of 2,freethrowmade,52,2229b01e-68eb-46ad-adf4-71a9533c84fc,basketball_play,1776650768,271,True,2026-04-20 02:06:08+00:00,2,234.0,1206.0,20.1,198
3,42,quarter,2,ad36c3e8-4194-4e63-920f-7c50f46191a6,39,3:54,"Spurs lineup change (Stephon Castle, Devin Vassell, Luke Kornet, Julian Champagnie, Keldon Johnson)",lineupchange,52,,basketball_play,1776650794,270,True,2026-04-20 02:06:34+00:00,2,234.0,1206.0,20.1,199
3,41,quarter,2,2229b01e-68eb-46ad-adf4-71a9533c84fc,40,3:54,Deni Avdija makes regular free throw 2 of 2,freethrowmade,52,ad36c3e8-4194-4e63-920f-7c50f46191a6,basketball_play,1776650794,269,True,2026-04-20 02:06:34+00:00,2,234.0,1206.0,20.1,200
3,40,quarter,2,ad36c3e8-4194-4e63-920f-7c50f46191a6,40,3:42,Luke Kornet misses two point floating jump shot,twopointmiss,52,,basketball_play,1776650807,268,True,2026-04-20 02:06:47+00:00,2,222.0,1218.0,20.3,201
3,39,quarter,2,2229b01e-68eb-46ad-adf4-71a9533c84fc,40,3:40,Jrue Holiday defensive rebound,rebound,52,2229b01e-68eb-46ad-adf4-71a9533c84fc,basketball_play,1776650809,267,True,2026-04-20 02:06:49+00:00,2,220.0,1220.0,20.333333333333332,202
3,38,quarter,2,2229b01e-68eb-46ad-adf4-71a9533c84fc,42,3:33,Robert Williams III makes two point alley-oop dunk (Jrue Holiday assists),twopointmade,52,ad36c3e8-4194-4e63-920f-7c50f46191a6,basketball_play,1776650817,266,True,2026-04-20 02:06:57+00:00,2,213.0,1227.0,20.45,203
3,37,quarter,2,ad36c3e8-4194-4e63-920f-7c50f46191a6,42,3:33,Spurs 60 second timeout,teamtimeout,52,,basketball_play,1776650823,265,True,2026-04-20 02:07:03+00:00,2,213.0,1227.0,20.45,204
3,36,quarter,2,ad36c3e8-4194-4e63-920f-7c50f46191a6,42,3:33,"Spurs lineup change (Stephon Castle, De'Aaron Fox, Victor Wembanyama, Devin Vassell, Keldon Johnson)",lineupchange,52,,basketball_play,1776651019,264,True,2026-04-20 02:10:19+00:00,2,213.0,1227.0,20.45,205
3,35,quarter,2,ad36c3e8-4194-4e63-920f-7c50f46191a6,42,3:20,Stephon Castle makes two point cutting dunk (De'Aaron Fox assists),twopointmade,54,2229b01e-68eb-46ad-adf4-71a9533c84fc,basketball_play,1776651056,263,True,2026-04-20 02:10:56+00:00,2,200.0,1240.0,20.666666666666668,206
3,34,quarter,2,ad36c3e8-4194-4e63-920f-7c50f46191a6,42,3:04,Devin Vassell personal foul (Shaedon Sharpe draws the foul),personalfoul,54,2229b01e-68eb-46ad-adf4-71a9533c84fc,basketball_play,1776651075,262,True,2026-04-20 02:11:15+00:00,2,184.0,1256.0,20.933333333333334,207
3,33,quarter,2,2229b01e-68eb-46ad-adf4-71a9533c84fc,43,3:04,Shaedon Sharpe makes regular free throw 1 of 2,freethrowmade,54,2229b01e-68eb-46ad-adf4-71a9533c84fc,basketball_play,1776651105,261,True,2026-04-20 02:11:45+00:00,2,184.0,1256.0,20.933333333333334,208
3,32,quarter,2,2229b01e-68eb-46ad-adf4-71a9533c84fc,44,3:04,Shaedon Sharpe makes regular free throw 2 of 2,freethrowmade,54,ad36c3e8-4194-4e63-920f-7c50f46191a6,basketball_play,1776651126,260,True,2026-04-20 02:12:06+00:00,2,184.0,1256.0,20.933333333333334,209
3,31,quarter,2,ad36c3e8-4194-4e63-920f-7c50f46191a6,44,2:46,Victor Wembanyama misses two point jump shot,twopointmiss,54,,basketball_play,1776651145,259,True,2026-04-20 02:12:25+00:00,2,166.0,1274.0,21.233333333333334,210
3,30,quarter,2,2229b01e-68eb-46ad-adf4-71a9533c84fc,44,2:43,Matisse Thybulle defensive rebound,rebound,54,2229b01e-68eb-46ad-adf4-71a9533c84fc,basketball_play,1776651148,258,True,2026-04-20 02:12:28+00:00,2,163.0,1277.0,21.283333333333335,211
