period_index,event_index,period_type,period_number,attribution,away_points,clock,description,event_type,home_points,possession,type,wall_clock,pbp_source_row,has_wall_clock,event_ts_utc,period_sequence,game_clock_seconds_remaining,game_elapsed_seconds,game_elapsed_minutes,pbp_chronological_index
2,13,quarter,3,6dd427f5-fa02-40ef-aa90-cfa73e0c539e,83,00:38.20,Hugo Gonzalez misses three point jump shot,threepointmiss,80,,basketball_play,1773372127,142,True,2026-03-13 03:22:07+00:00,3,38.2,2121.8,35.36333333333334,319
2,12,quarter,3,a85f6eca-2f3b-4f61-83ab-8d049f59ce2c,83,00:34.70,Thunder defensive rebound,rebound,80,a85f6eca-2f3b-4f61-83ab-8d049f59ce2c,basketball_play,1773372130,141,True,2026-03-13 03:22:10+00:00,3,34.7,2125.3,35.42166666666667,320
2,11,quarter,3,,83,00:34.70,Stoppage (Out of bounds),stoppage,80,,basketball_play,1773372135,140,True,2026-03-13 03:22:15+00:00,3,34.7,2125.3,35.42166666666667,321
2,10,quarter,3,a85f6eca-2f3b-4f61-83ab-8d049f59ce2c,83,00:31.10,Shai Gilgeous-Alexander misses three point stepback jump shot,threepointmiss,80,,basketball_play,1773372155,139,True,2026-03-13 03:22:35+00:00,3,31.1,2128.9,35.48166666666667,322
2,9,quarter,3,6dd427f5-fa02-40ef-aa90-cfa73e0c539e,83,00:27.70,Neemias Queta defensive rebound,rebound,80,6dd427f5-fa02-40ef-aa90-cfa73e0c539e,basketball_play,1773372159,138,True,2026-03-13 03:22:39+00:00,3,27.7,2132.3,35.538333333333334,323
2,6,quarter,3,6dd427f5-fa02-40ef-aa90-cfa73e0c539e,83,00:26.40,Jump ball. Neemias Queta vs. Alex Caruso (Payton Pritchard gains possession),jumpball,80,6dd427f5-fa02-40ef-aa90-cfa73e0c539e,basketball_play,1773372212,135,True,2026-03-13 03:23:32+00:00,3,26.4,2133.6,35.559999999999995,324
2,8,quarter,3,6dd427f5-fa02-40ef-aa90-cfa73e0c539e,83,00:26,"Celtics lineup change (Jaylen Brown, Ron Harper Jr., Hugo Gonzalez, Neemias Queta, Payton Pritchard)",lineupchange,80,,basketball_play,1773372190,137,True,2026-03-13 03:23:10+00:00,3,26.0,2134.0,35.56666666666667,325
2,7,quarter,3,a85f6eca-2f3b-4f61-83ab-8d049f59ce2c,83,00:26,"Thunder lineup change (Cason Wallace, Shai Gilgeous-Alexander, Isaiah Joe, Jaylin Williams, Alex Caruso)",lineupchange,80,,basketball_play,1773372190,136,True,2026-03-13 03:23:10+00:00,3,26.0,2134.0,35.56666666666667,326
2,5,quarter,3,6dd427f5-fa02-40ef-aa90-cfa73e0c539e,83,00:01.30,Payton Pritchard misses two point pullup jump shot,twopointmiss,80,,basketball_play,1773372235,134,True,2026-03-13 03:23:55+00:00,3,1.3,2158.7,35.97833333333333,327
2,4,quarter,3,6dd427f5-fa02-40ef-aa90-cfa73e0c539e,83,00:01.30,Neemias Queta offensive rebound,rebound,80,6dd427f5-fa02-40ef-aa90-cfa73e0c539e,basketball_play,1773372235,133,True,2026-03-13 03:23:55+00:00,3,1.3,2158.7,35.97833333333333,328
2,3,quarter,3,6dd427f5-fa02-40ef-aa90-cfa73e0c539e,83,00:00.30,Neemias Queta misses two point tip layup,twopointmiss,80,,basketball_play,1773372241,132,True,2026-03-13 03:24:01+00:00,3,0.3,2159.7,35.995,329
2,2,quarter,3,6dd427f5-fa02-40ef-aa90-cfa73e0c539e,83,00:00.10,Celtics offensive rebound,rebound,80,6dd427f5-fa02-40ef-aa90-cfa73e0c539e,basketball_play,1773372241,131,True,2026-03-13 03:24:01+00:00,3,0.1,2159.9,35.998333333333335,330
2,1,quarter,3,,83,00:00,End of 3rd Quarter.,endperiod,80,,basketball_play,1773372267,130,True,2026-03-13 03:24:27+00:00,3,0.0,2160.0,36.0,331
1,130,quarter,4,6dd427f5-fa02-40ef-aa90-cfa73e0c539e,83,12:00,"Celtics lineup change (Sam Hauser, Jaylen Brown, Hugo Gonzalez, Neemias Queta, Payton Pritchard)",lineupchange,80,,basketball_play,1773372271,129,True,2026-03-13 03:24:31+00:00,4,720.0,2160.0,36.0,332
1,129,quarter,4,a85f6eca-2f3b-4f61-83ab-8d049f59ce2c,83,12:00,"Thunder lineup change (Cason Wallace, Jared McCain, Chet Holmgren, Shai Gilgeous-Alexander, Alex Caruso)",lineupchange,80,,basketball_play,1773372271,128,True,2026-03-13 03:24:31+00:00,4,720.0,2160.0,36.0,333
1,128,quarter,4,,83,12:00,Start of 4th Quarter,startperiod,80,,basketball_play,1773372454,127,True,2026-03-13 03:27:34+00:00,4,720.0,2160.0,36.0,334
1,127,quarter,4,a85f6eca-2f3b-4f61-83ab-8d049f59ce2c,83,11:39,Neemias Queta blocks Jared McCain's two point driving layup,twopointmiss,80,,basketball_play,1773372474,126,True,2026-03-13 03:27:54+00:00,4,699.0,2181.0,36.35,335
1,126,quarter,4,6dd427f5-fa02-40ef-aa90-cfa73e0c539e,83,11:33,Sam Hauser defensive rebound,rebound,80,6dd427f5-fa02-40ef-aa90-cfa73e0c539e,basketball_play,1773372480,125,True,2026-03-13 03:28:00+00:00,4,693.0,2187.0,36.45,336
1,125,quarter,4,6dd427f5-fa02-40ef-aa90-cfa73e0c539e,83,11:30,Alex Caruso blocks Jaylen Brown's two point pullup jump shot,twopointmiss,80,,basketball_play,1773372483,124,True,2026-03-13 03:28:03+00:00,4,690.0,2190.0,36.5,337
1,124,quarter,4,a85f6eca-2f3b-4f61-83ab-8d049f59ce2c,83,11:28,Shai Gilgeous-Alexander defensive rebound,rebound,80,a85f6eca-2f3b-4f61-83ab-8d049f59ce2c,basketball_play,1773372485,123,True,2026-03-13 03:28:05+00:00,4,688.0,2192.0,36.53333333333333,338
1,123,quarter,4,a85f6eca-2f3b-4f61-83ab-8d049f59ce2c,83,11:22,Shai Gilgeous-Alexander makes two point running reverse layup,twopointmade,82,6dd427f5-fa02-40ef-aa90-cfa73e0c539e,basketball_play,1773372491,122,True,2026-03-13 03:28:11+00:00,4,682.0,2198.0,36.63333333333333,339
1,122,quarter,4,6dd427f5-fa02-40ef-aa90-cfa73e0c539e,83,11:00,Payton Pritchard misses three point jump shot,threepointmiss,82,,basketball_play,1773372513,121,True,2026-03-13 03:28:33+00:00,4,660.0,2220.0,37.0,340
1,121,quarter,4,a85f6eca-2f3b-4f61-83ab-8d049f59ce2c,83,10:57,Chet Holmgren defensive rebound,rebound,82,a85f6eca-2f3b-4f61-83ab-8d049f59ce2c,basketball_play,1773372516,120,True,2026-03-13 03:28:36+00:00,4,657.0,2223.0,37.05,341
1,120,quarter,4,a85f6eca-2f3b-4f61-83ab-8d049f59ce2c,83,10:41,Cason Wallace turnover (bad pass) (Neemias Queta steals),turnover,82,6dd427f5-fa02-40ef-aa90-cfa73e0c539e,basketball_play,1773372531,119,True,2026-03-13 03:28:51+00:00,4,641.0,2239.0,37.31666666666667,342
1,119,quarter,4,6dd427f5-fa02-40ef-aa90-cfa73e0c539e,83,10:39,Payton Pritchard turnover (bad pass) (Alex Caruso steals),turnover,82,a85f6eca-2f3b-4f61-83ab-8d049f59ce2c,basketball_play,1773372535,118,True,2026-03-13 03:28:55+00:00,4,639.0,2241.0,37.35,343
1,118,quarter,4,a85f6eca-2f3b-4f61-83ab-8d049f59ce2c,83,10:36,Jared McCain makes three point running jump shot (Alex Caruso assists),threepointmade,85,6dd427f5-fa02-40ef-aa90-cfa73e0c539e,basketball_play,1773372538,117,True,2026-03-13 03:28:58+00:00,4,636.0,2244.0,37.4,344
1,117,quarter,4,a85f6eca-2f3b-4f61-83ab-8d049f59ce2c,83,10:16,Cason Wallace shooting foul (Jaylen Brown draws the foul),shootingfoul,85,6dd427f5-fa02-40ef-aa90-cfa73e0c539e,basketball_play,1773372559,116,True,2026-03-13 03:29:19+00:00,4,616.0,2264.0,37.733333333333334,345
1,116,quarter,4,6dd427f5-fa02-40ef-aa90-cfa73e0c539e,84,10:16,Jaylen Brown makes regular free throw 1 of 2,freethrowmade,85,6dd427f5-fa02-40ef-aa90-cfa73e0c539e,basketball_play,1773372584,115,True,2026-03-13 03:29:44+00:00,4,616.0,2264.0,37.733333333333334,346
1,115,quarter,4,6dd427f5-fa02-40ef-aa90-cfa73e0c539e,85,10:16,Jaylen Brown makes regular free throw 2 of 2,freethrowmade,85,a85f6eca-2f3b-4f61-83ab-8d049f59ce2c,basketball_play,1773372602,114,True,2026-03-13 03:30:02+00:00,4,616.0,2264.0,37.733333333333334,347
1,114,quarter,4,a85f6eca-2f3b-4f61-83ab-8d049f59ce2c,85,9:54,Jaylen Brown blocks Chet Holmgren's three point jump shot,threepointmiss,85,,basketball_play,1773372626,113,True,2026-03-13 03:30:26+00:00,4,594.0,2286.0,38.1,348
1,113,quarter,4,6dd427f5-fa02-40ef-aa90-cfa73e0c539e,85,9:51,Jaylen Brown defensive rebound,rebound,85,6dd427f5-fa02-40ef-aa90-cfa73e0c539e,basketball_play,1773372629,112,True,2026-03-13 03:30:29+00:00,4,591.0,2289.0,38.15,349
1,112,quarter,4,6dd427f5-fa02-40ef-aa90-cfa73e0c539e,87,9:51,Jaylen Brown makes two point running dunk,twopointmade,85,a85f6eca-2f3b-4f61-83ab-8d049f59ce2c,basketball_play,1773372630,111,True,2026-03-13 03:30:30+00:00,4,591.0,2289.0,38.15,350
1,111,quarter,4,a85f6eca-2f3b-4f61-83ab-8d049f59ce2c,87,9:25,Shai Gilgeous-Alexander makes two point driving finger roll layup (Alex Caruso assists),twopointmade,87,6dd427f5-fa02-40ef-aa90-cfa73e0c539e,basketball_play,1773372655,110,True,2026-03-13 03:30:55+00:00,4,565.0,2315.0,38.583333333333336,351
1,110,quarter,4,6dd427f5-fa02-40ef-aa90-cfa73e0c539e,87,9:12,Sam Hauser misses three point jump shot,threepointmiss,87,,basketball_play,1773372668,109,True,2026-03-13 03:31:08+00:00,4,552.0,2328.0,38.8,352
1,109,quarter,4,6dd427f5-fa02-40ef-aa90-cfa73e0c539e,87,9:09,Hugo Gonzalez offensive rebound,rebound,87,6dd427f5-fa02-40ef-aa90-cfa73e0c539e,basketball_play,1773372671,108,True,2026-03-13 03:31:11+00:00,4,549.0,2331.0,38.85,353
1,108,quarter,4,6dd427f5-fa02-40ef-aa90-cfa73e0c539e,87,9:08,Sam Hauser misses three point jump shot,threepointmiss,87,,basketball_play,1773372672,107,True,2026-03-13 03:31:12+00:00,4,548.0,2332.0,38.86666666666667,354
1,107,quarter,4,a85f6eca-2f3b-4f61-83ab-8d049f59ce2c,87,9:06,Jared McCain defensive rebound,rebound,87,a85f6eca-2f3b-4f61-83ab-8d049f59ce2c,basketball_play,1773372674,106,True,2026-03-13 03:31:14+00:00,4,546.0,2334.0,38.9,355
1,106,quarter,4,a85f6eca-2f3b-4f61-83ab-8d049f59ce2c,87,8:54,Alex Caruso misses three point jump shot,threepointmiss,87,,basketball_play,1773372685,105,True,2026-03-13 03:31:25+00:00,4,534.0,2346.0,39.1,356
1,105,quarter,4,6dd427f5-fa02-40ef-aa90-cfa73e0c539e,87,8:52,Sam Hauser defensive rebound,rebound,87,6dd427f5-fa02-40ef-aa90-cfa73e0c539e,basketball_play,1773372687,104,True,2026-03-13 03:31:27+00:00,4,532.0,2348.0,39.13333333333333,357
1,104,quarter,4,6dd427f5-fa02-40ef-aa90-cfa73e0c539e,87,8:44,Payton Pritchard misses three point stepback jump shot,threepointmiss,87,,basketball_play,1773372696,103,True,2026-03-13 03:31:36+00:00,4,524.0,2356.0,39.266666666666666,358
1,103,quarter,4,6dd427f5-fa02-40ef-aa90-cfa73e0c539e,87,8:41,Neemias Queta offensive rebound,rebound,87,6dd427f5-fa02-40ef-aa90-cfa73e0c539e,basketball_play,1773372699,102,True,2026-03-13 03:31:39+00:00,4,521.0,2359.0,39.31666666666667,359
1,102,quarter,4,6dd427f5-fa02-40ef-aa90-cfa73e0c539e,87,8:38,Neemias Queta misses two point turnaround hook shot,twopointmiss,87,,basketball_play,1773372701,101,True,2026-03-13 03:31:41+00:00,4,518.0,2362.0,39.36666666666667,360
1,101,quarter,4,a85f6eca-2f3b-4f61-83ab-8d049f59ce2c,87,8:37,Chet Holmgren defensive rebound,rebound,87,a85f6eca-2f3b-4f61-83ab-8d049f59ce2c,basketball_play,1773372702,100,True,2026-03-13 03:31:42+00:00,4,517.0,2363.0,39.38333333333333,361
1,100,quarter,4,a85f6eca-2f3b-4f61-83ab-8d049f59ce2c,87,8:36,Thunder 60 second timeout,teamtimeout,87,,basketball_play,1773372712,99,True,2026-03-13 03:31:52+00:00,4,516.0,2364.0,39.4,362
1,99,quarter,4,6dd427f5-fa02-40ef-aa90-cfa73e0c539e,87,8:36,"Celtics lineup change (Jaylen Brown, Hugo Gonzalez, Payton Pritchard, Luka Garza, Baylor Scheierman)",lineupchange,87,,basketball_play,1773372890,98,True,2026-03-13 03:34:50+00:00,4,516.0,2364.0,39.4,363
1,98,quarter,4,a85f6eca-2f3b-4f61-83ab-8d049f59ce2c,87,8:36,"Thunder lineup change (Cason Wallace, Jared McCain, Shai Gilgeous-Alexander, Jaylin Williams, Luguentz Dort)",lineupchange,87,,basketball_play,1773372890,97,True,2026-03-13 03:34:50+00:00,4,516.0,2364.0,39.4,364
1,97,quarter,4,a85f6eca-2f3b-4f61-83ab-8d049f59ce2c,87,8:21,Shai Gilgeous-Alexander makes two point stepback jump shot,twopointmade,89,6dd427f5-fa02-40ef-aa90-cfa73e0c539e,basketball_play,1773372930,96,True,2026-03-13 03:35:30+00:00,4,501.0,2379.0,39.65,365
1,96,quarter,4,6dd427f5-fa02-40ef-aa90-cfa73e0c539e,87,7:59,Luka Garza misses three point jump shot,threepointmiss,89,,basketball_play,1773372951,95,True,2026-03-13 03:35:51+00:00,4,479.0,2401.0,40.016666666666666,366
1,95,quarter,4,a85f6eca-2f3b-4f61-83ab-8d049f59ce2c,87,7:57,Thunder defensive rebound,rebound,89,a85f6eca-2f3b-4f61-83ab-8d049f59ce2c,basketball_play,1773372956,94,True,2026-03-13 03:35:56+00:00,4,477.0,2403.0,40.05,367
1,94,quarter,4,,87,7:57,Stoppage (Out of bounds),stoppage,89,,basketball_play,1773372958,93,True,2026-03-13 03:35:58+00:00,4,477.0,2403.0,40.05,368
1,93,quarter,4,a85f6eca-2f3b-4f61-83ab-8d049f59ce2c,87,7:48,Jared McCain misses three point jump shot,threepointmiss,89,,basketball_play,1773372977,92,True,2026-03-13 03:36:17+00:00,4,468.0,2412.0,40.2,369
1,92,quarter,4,6dd427f5-fa02-40ef-aa90-cfa73e0c539e,87,7:44,Baylor Scheierman defensive rebound,rebound,89,6dd427f5-fa02-40ef-aa90-cfa73e0c539e,basketball_play,1773372981,91,True,2026-03-13 03:36:21+00:00,4,464.0,2416.0,40.266666666666666,370
1,91,quarter,4,6dd427f5-fa02-40ef-aa90-cfa73e0c539e,87,7:37,Shai Gilgeous-Alexander blocks Jaylen Brown's two point pullup jump shot,twopointmiss,89,,basketball_play,1773372987,90,True,2026-03-13 03:36:27+00:00,4,457.0,2423.0,40.38333333333333,371
1,90,quarter,4,a85f6eca-2f3b-4f61-83ab-8d049f59ce2c,87,7:34,Cason Wallace defensive rebound,rebound,89,a85f6eca-2f3b-4f61-83ab-8d049f59ce2c,basketball_play,1773372990,89,True,2026-03-13 03:36:30+00:00,4,454.0,2426.0,40.43333333333333,372
1,89,quarter,4,a85f6eca-2f3b-4f61-83ab-8d049f59ce2c,87,7:28,Jaylin Williams misses three point jump shot,threepointmiss,89,,basketball_play,1773372996,88,True,2026-03-13 03:36:36+00:00,4,448.0,2432.0,40.53333333333333,373
1,88,quarter,4,6dd427f5-fa02-40ef-aa90-cfa73e0c539e,87,7:24,Hugo Gonzalez defensive rebound,rebound,89,6dd427f5-fa02-40ef-aa90-cfa73e0c539e,basketball_play,1773373000,87,True,2026-03-13 03:36:40+00:00,4,444.0,2436.0,40.6,374
1,87,quarter,4,a85f6eca-2f3b-4f61-83ab-8d049f59ce2c,87,7:14,Jaylin Williams shooting foul (Luka Garza draws the foul),shootingfoul,89,6dd427f5-fa02-40ef-aa90-cfa73e0c539e,basketball_play,1773373013,86,True,2026-03-13 03:36:53+00:00,4,434.0,2446.0,40.766666666666666,375
1,86,quarter,4,6dd427f5-fa02-40ef-aa90-cfa73e0c539e,88,7:14,Luka Garza makes regular free throw 1 of 2,freethrowmade,89,6dd427f5-fa02-40ef-aa90-cfa73e0c539e,basketball_play,1773373048,85,True,2026-03-13 03:37:28+00:00,4,434.0,2446.0,40.766666666666666,376
1,85,quarter,4,a85f6eca-2f3b-4f61-83ab-8d049f59ce2c,88,7:14,"Thunder lineup change (Cason Wallace, Ajay Mitchell, Shai Gilgeous-Alexander, Jaylin Williams, Luguentz Dort)",lineupchange,89,,basketball_play,1773373067,84,True,2026-03-13 03:37:47+00:00,4,434.0,2446.0,40.766666666666666,377
1,84,quarter,4,6dd427f5-fa02-40ef-aa90-cfa73e0c539e,89,7:14,Luka Garza makes regular free throw 2 of 2,freethrowmade,89,a85f6eca-2f3b-4f61-83ab-8d049f59ce2c,basketball_play,1773373067,83,True,2026-03-13 03:37:47+00:00,4,434.0,2446.0,40.766666666666666,378
1,83,quarter,4,a85f6eca-2f3b-4f61-83ab-8d049f59ce2c,89,7:01,Shai Gilgeous-Alexander makes two point driving finger roll layup,twopointmade,91,6dd427f5-fa02-40ef-aa90-cfa73e0c539e,basketball_play,1773373082,82,True,2026-03-13 03:38:02+00:00,4,421.0,2459.0,40.983333333333334,379
1,82,quarter,4,6dd427f5-fa02-40ef-aa90-cfa73e0c539e,89,6:51,Luka Garza offensive foul (Luguentz Dort draws the foul),offensivefoul,91,a85f6eca-2f3b-4f61-83ab-8d049f59ce2c,basketball_play,1773373095,81,True,2026-03-13 03:38:15+00:00,4,411.0,2469.0,41.15,380
1,81,quarter,4,6dd427f5-fa02-40ef-aa90-cfa73e0c539e,89,6:51,Luka Garza turnover (offensive foul),turnover,91,a85f6eca-2f3b-4f61-83ab-8d049f59ce2c,basketball_play,1773373095,80,True,2026-03-13 03:38:15+00:00,4,411.0,2469.0,41.15,381
1,80,quarter,4,a85f6eca-2f3b-4f61-83ab-8d049f59ce2c,89,6:38,Cason Wallace misses three point jump shot,threepointmiss,91,,basketball_play,1773373119,79,True,2026-03-13 03:38:39+00:00,4,398.0,2482.0,41.36666666666667,382
1,79,quarter,4,6dd427f5-fa02-40ef-aa90-cfa73e0c539e,89,6:35,Payton Pritchard defensive rebound,rebound,91,6dd427f5-fa02-40ef-aa90-cfa73e0c539e,basketball_play,1773373122,78,True,2026-03-13 03:38:42+00:00,4,395.0,2485.0,41.416666666666664,383
1,78,quarter,4,a85f6eca-2f3b-4f61-83ab-8d049f59ce2c,89,6:23,Luguentz Dort personal foul (Jaylen Brown draws the foul),personalfoul,91,6dd427f5-fa02-40ef-aa90-cfa73e0c539e,basketball_play,1773373136,77,True,2026-03-13 03:38:56+00:00,4,383.0,2497.0,41.61666666666667,384
1,77,quarter,4,6dd427f5-fa02-40ef-aa90-cfa73e0c539e,89,6:13,Jaylen Brown misses three point stepback jump shot,threepointmiss,91,,basketball_play,1773373176,76,True,2026-03-13 03:39:36+00:00,4,373.0,2507.0,41.78333333333333,385
1,76,quarter,4,6dd427f5-fa02-40ef-aa90-cfa73e0c539e,89,6:12,Celtics offensive rebound,rebound,91,6dd427f5-fa02-40ef-aa90-cfa73e0c539e,basketball_play,1773373180,75,True,2026-03-13 03:39:40+00:00,4,372.0,2508.0,41.8,386
1,75,quarter,4,,89,6:12,Stoppage (Out of bounds),stoppage,91,,basketball_play,1773373181,74,True,2026-03-13 03:39:41+00:00,4,372.0,2508.0,41.8,387
1,74,quarter,4,6dd427f5-fa02-40ef-aa90-cfa73e0c539e,91,6:06,Payton Pritchard makes two point fadeaway jump shot (Baylor Scheierman assists),twopointmade,91,a85f6eca-2f3b-4f61-83ab-8d049f59ce2c,basketball_play,1773373219,73,True,2026-03-13 03:40:19+00:00,4,366.0,2514.0,41.9,388
1,73,quarter,4,a85f6eca-2f3b-4f61-83ab-8d049f59ce2c,91,5:54,Jaylin Williams offensive foul (Payton Pritchard draws the foul),offensivefoul,91,6dd427f5-fa02-40ef-aa90-cfa73e0c539e,basketball_play,1773373228,72,True,2026-03-13 03:40:28+00:00,4,354.0,2526.0,42.1,389
1,72,quarter,4,a85f6eca-2f3b-4f61-83ab-8d049f59ce2c,91,5:54,Jaylin Williams turnover (offensive foul),turnover,91,6dd427f5-fa02-40ef-aa90-cfa73e0c539e,basketball_play,1773373228,71,True,2026-03-13 03:40:28+00:00,4,354.0,2526.0,42.1,390
1,71,quarter,4,a85f6eca-2f3b-4f61-83ab-8d049f59ce2c,91,5:54,"Thunder lineup change (Ajay Mitchell, Shai Gilgeous-Alexander, Jaylin Williams, Alex Caruso, Luguentz Dort)",lineupchange,91,,basketball_play,1773373275,70,True,2026-03-13 03:41:15+00:00,4,354.0,2526.0,42.1,391
1,70,quarter,4,6dd427f5-fa02-40ef-aa90-cfa73e0c539e,91,5:54,Celtics 60 second timeout,teamtimeout,91,,basketball_play,1773373275,69,True,2026-03-13 03:41:15+00:00,4,354.0,2526.0,42.1,392
1,69,quarter,4,a85f6eca-2f3b-4f61-83ab-8d049f59ce2c,91,5:54,"Thunder lineup change (Cason Wallace, Ajay Mitchell, Shai Gilgeous-Alexander, Jaylin Williams, Luguentz Dort)",lineupchange,91,,basketball_play,1773373292,68,True,2026-03-13 03:41:32+00:00,4,354.0,2526.0,42.1,393
1,68,quarter,4,,91,5:54,Instant replay (Challenge: Ruling Overturned),review,91,,basketball_play,1773373292,67,True,2026-03-13 03:41:32+00:00,4,354.0,2526.0,42.1,394
1,67,quarter,4,6dd427f5-fa02-40ef-aa90-cfa73e0c539e,91,5:54,"Celtics lineup change (Jaylen Brown, Hugo Gonzalez, Neemias Queta, Payton Pritchard, Baylor Scheierman)",lineupchange,91,,basketball_play,1773373467,66,True,2026-03-13 03:44:27+00:00,4,354.0,2526.0,42.1,395
1,66,quarter,4,a85f6eca-2f3b-4f61-83ab-8d049f59ce2c,91,5:54,"Thunder lineup change (Chet Holmgren, Ajay Mitchell, Shai Gilgeous-Alexander, Alex Caruso, Luguentz Dort)",lineupchange,91,,basketball_play,1773373467,65,True,2026-03-13 03:44:27+00:00,4,354.0,2526.0,42.1,396
1,65,quarter,4,6dd427f5-fa02-40ef-aa90-cfa73e0c539e,91,5:33,Jaylen Brown turnover (bad pass) (Alex Caruso steals),turnover,91,a85f6eca-2f3b-4f61-83ab-8d049f59ce2c,basketball_play,1773373504,64,True,2026-03-13 03:45:04+00:00,4,333.0,2547.0,42.45,397
1,64,quarter,4,6dd427f5-fa02-40ef-aa90-cfa73e0c539e,91,5:28,Hugo Gonzalez personal foul (Shai Gilgeous-Alexander draws the foul),personalfoul,91,a85f6eca-2f3b-4f61-83ab-8d049f59ce2c,basketball_play,1773373511,63,True,2026-03-13 03:45:11+00:00,4,328.0,2552.0,42.53333333333333,398
1,63,quarter,4,a85f6eca-2f3b-4f61-83ab-8d049f59ce2c,91,5:22,Ajay Mitchell misses two point driving layup,twopointmiss,91,,basketball_play,1773373534,62,True,2026-03-13 03:45:34+00:00,4,322.0,2558.0,42.63333333333333,399
1,62,quarter,4,6dd427f5-fa02-40ef-aa90-cfa73e0c539e,91,5:19,Neemias Queta defensive rebound,rebound,91,6dd427f5-fa02-40ef-aa90-cfa73e0c539e,basketball_play,1773373537,61,True,2026-03-13 03:45:37+00:00,4,319.0,2561.0,42.68333333333333,400
1,61,quarter,4,6dd427f5-fa02-40ef-aa90-cfa73e0c539e,91,5:12,Jaylen Brown misses two point driving layup,twopointmiss,91,,basketball_play,1773373543,60,True,2026-03-13 03:45:43+00:00,4,312.0,2568.0,42.8,401
1,60,quarter,4,a85f6eca-2f3b-4f61-83ab-8d049f59ce2c,91,5:12,Thunder defensive rebound,rebound,91,a85f6eca-2f3b-4f61-83ab-8d049f59ce2c,basketball_play,1773373547,59,True,2026-03-13 03:45:47+00:00,4,312.0,2568.0,42.8,402
1,59,quarter,4,6dd427f5-fa02-40ef-aa90-cfa73e0c539e,91,5:12,Jaylen Brown personal foul (Loose ball) (Chet Holmgren draws the foul),personalfoul,91,a85f6eca-2f3b-4f61-83ab-8d049f59ce2c,basketball_play,1773373548,58,True,2026-03-13 03:45:48+00:00,4,312.0,2568.0,42.8,403
1,58,quarter,4,6dd427f5-fa02-40ef-aa90-cfa73e0c539e,91,5:00,Neemias Queta shooting foul (Ajay Mitchell draws the foul),shootingfoul,91,a85f6eca-2f3b-4f61-83ab-8d049f59ce2c,basketball_play,1773373578,57,True,2026-03-13 03:46:18+00:00,4,300.0,2580.0,43.0,404
1,57,quarter,4,a85f6eca-2f3b-4f61-83ab-8d049f59ce2c,91,5:00,Ajay Mitchell makes regular free throw 1 of 2,freethrowmade,92,a85f6eca-2f3b-4f61-83ab-8d049f59ce2c,basketball_play,1773373610,56,True,2026-03-13 03:46:50+00:00,4,300.0,2580.0,43.0,405
1,56,quarter,4,a85f6eca-2f3b-4f61-83ab-8d049f59ce2c,91,5:00,Ajay Mitchell makes regular free throw 2 of 2,freethrowmade,93,6dd427f5-fa02-40ef-aa90-cfa73e0c539e,basketball_play,1773373610,55,True,2026-03-13 03:46:50+00:00,4,300.0,2580.0,43.0,406
1,55,quarter,4,a85f6eca-2f3b-4f61-83ab-8d049f59ce2c,91,4:44,Luguentz Dort shooting foul (Jaylen Brown draws the foul),shootingfoul,93,6dd427f5-fa02-40ef-aa90-cfa73e0c539e,basketball_play,1773373646,54,True,2026-03-13 03:47:26+00:00,4,284.0,2596.0,43.266666666666666,407
1,54,quarter,4,6dd427f5-fa02-40ef-aa90-cfa73e0c539e,92,4:44,Jaylen Brown makes regular free throw 1 of 3,freethrowmade,93,6dd427f5-fa02-40ef-aa90-cfa73e0c539e,basketball_play,1773373674,53,True,2026-03-13 03:47:54+00:00,4,284.0,2596.0,43.266666666666666,408
1,53,quarter,4,6dd427f5-fa02-40ef-aa90-cfa73e0c539e,93,4:44,Jaylen Brown makes regular free throw 2 of 3,freethrowmade,93,6dd427f5-fa02-40ef-aa90-cfa73e0c539e,basketball_play,1773373693,52,True,2026-03-13 03:48:13+00:00,4,284.0,2596.0,43.266666666666666,409
1,52,quarter,4,6dd427f5-fa02-40ef-aa90-cfa73e0c539e,94,4:44,Jaylen Brown makes regular free throw 3 of 3,freethrowmade,93,a85f6eca-2f3b-4f61-83ab-8d049f59ce2c,basketball_play,1773373712,51,True,2026-03-13 03:48:32+00:00,4,284.0,2596.0,43.266666666666666,410
1,51,quarter,4,a85f6eca-2f3b-4f61-83ab-8d049f59ce2c,94,4:32,Ajay Mitchell makes three point jump shot (Shai Gilgeous-Alexander assists),threepointmade,96,6dd427f5-fa02-40ef-aa90-cfa73e0c539e,basketball_play,1773373726,50,True,2026-03-13 03:48:46+00:00,4,272.0,2608.0,43.46666666666667,411
1,50,quarter,4,6dd427f5-fa02-40ef-aa90-cfa73e0c539e,94,4:18,Neemias Queta offensive foul (Luguentz Dort draws the foul),offensivefoul,96,a85f6eca-2f3b-4f61-83ab-8d049f59ce2c,basketball_play,1773373750,49,True,2026-03-13 03:49:10+00:00,4,258.0,2622.0,43.7,412
1,49,quarter,4,6dd427f5-fa02-40ef-aa90-cfa73e0c539e,94,4:18,Neemias Queta turnover (offensive foul),turnover,96,a85f6eca-2f3b-4f61-83ab-8d049f59ce2c,basketball_play,1773373750,48,True,2026-03-13 03:49:10+00:00,4,258.0,2622.0,43.7,413
1,48,quarter,4,a85f6eca-2f3b-4f61-83ab-8d049f59ce2c,94,4:06,Shai Gilgeous-Alexander misses two point pullup jump shot,twopointmiss,96,,basketball_play,1773373773,47,True,2026-03-13 03:49:33+00:00,4,246.0,2634.0,43.9,414
1,47,quarter,4,a85f6eca-2f3b-4f61-83ab-8d049f59ce2c,94,4:04,Alex Caruso offensive rebound,rebound,96,a85f6eca-2f3b-4f61-83ab-8d049f59ce2c,basketball_play,1773373775,46,True,2026-03-13 03:49:35+00:00,4,244.0,2636.0,43.93333333333333,415
1,46,quarter,4,a85f6eca-2f3b-4f61-83ab-8d049f59ce2c,94,4:01,Luguentz Dort misses three point jump shot,threepointmiss,96,,basketball_play,1773373778,45,True,2026-03-13 03:49:38+00:00,4,241.0,2639.0,43.983333333333334,416
1,45,quarter,4,6dd427f5-fa02-40ef-aa90-cfa73e0c539e,94,3:57,Neemias Queta defensive rebound,rebound,96,6dd427f5-fa02-40ef-aa90-cfa73e0c539e,basketball_play,1773373782,44,True,2026-03-13 03:49:42+00:00,4,237.0,2643.0,44.05,417
1,44,quarter,4,6dd427f5-fa02-40ef-aa90-cfa73e0c539e,94,3:42,Jaylen Brown misses two point driving floating jump shot,twopointmiss,96,,basketball_play,1773373796,43,True,2026-03-13 03:49:56+00:00,4,222.0,2658.0,44.3,418
1,43,quarter,4,a85f6eca-2f3b-4f61-83ab-8d049f59ce2c,94,3:39,Chet Holmgren defensive rebound,rebound,96,a85f6eca-2f3b-4f61-83ab-8d049f59ce2c,basketball_play,1773373799,42,True,2026-03-13 03:49:59+00:00,4,219.0,2661.0,44.35,419
1,42,quarter,4,a85f6eca-2f3b-4f61-83ab-8d049f59ce2c,94,3:30,Alex Caruso misses three point jump shot,threepointmiss,96,,basketball_play,1773373808,41,True,2026-03-13 03:50:08+00:00,4,210.0,2670.0,44.5,420
1,41,quarter,4,a85f6eca-2f3b-4f61-83ab-8d049f59ce2c,94,3:27,Luguentz Dort offensive rebound,rebound,96,a85f6eca-2f3b-4f61-83ab-8d049f59ce2c,basketball_play,1773373811,40,True,2026-03-13 03:50:11+00:00,4,207.0,2673.0,44.55,421
1,40,quarter,4,a85f6eca-2f3b-4f61-83ab-8d049f59ce2c,94,3:21,Shai Gilgeous-Alexander makes two point stepback jump shot,twopointmade,98,6dd427f5-fa02-40ef-aa90-cfa73e0c539e,basketball_play,1773373817,39,True,2026-03-13 03:50:17+00:00,4,201.0,2679.0,44.65,422
1,39,quarter,4,6dd427f5-fa02-40ef-aa90-cfa73e0c539e,94,3:21,Celtics 60 second timeout,teamtimeout,98,,basketball_play,1773373822,38,True,2026-03-13 03:50:22+00:00,4,201.0,2679.0,44.65,423
1,38,quarter,4,6dd427f5-fa02-40ef-aa90-cfa73e0c539e,94,3:21,"Celtics lineup change (Sam Hauser, Jaylen Brown, Hugo Gonzalez, Neemias Queta, Payton Pritchard)",lineupchange,98,,basketball_play,1773373943,37,True,2026-03-13 03:52:23+00:00,4,201.0,2679.0,44.65,424
1,37,quarter,4,a85f6eca-2f3b-4f61-83ab-8d049f59ce2c,94,3:03,Shai Gilgeous-Alexander personal foul (Neemias Queta draws the foul),personalfoul,98,6dd427f5-fa02-40ef-aa90-cfa73e0c539e,basketball_play,1773373943,36,True,2026-03-13 03:52:23+00:00,4,183.0,2697.0,44.95,425
