period_index,event_index,period_type,period_number,attribution,away_points,clock,description,event_type,home_points,possession,type,wall_clock,pbp_source_row,has_wall_clock,event_ts_utc,period_sequence,game_clock_seconds_remaining,game_elapsed_seconds,game_elapsed_minutes,pbp_chronological_index
4,111,quarter,1,6dd427f5-fa02-40ef-aa90-cfa73e0c539e,0,12:00,"Celtics lineup change (Sam Hauser, Jaylen Brown, Neemias Queta, Payton Pritchard, Baylor Scheierman)",lineupchange,0,,basketball_play,1773366154,460,True,2026-03-13 01:42:34+00:00,1,720.0,0.0,0.0,1
4,110,quarter,1,a85f6eca-2f3b-4f61-83ab-8d049f59ce2c,0,12:00,"Thunder lineup change (Cason Wallace, Chet Holmgren, Ajay Mitchell, Shai Gilgeous-Alexander, Luguentz Dort)",lineupchange,0,,basketball_play,1773366154,459,True,2026-03-13 01:42:34+00:00,1,720.0,0.0,0.0,2
4,109,quarter,1,,0,12:00,Start of 1st Quarter,startperiod,0,,basketball_play,1773366154,458,True,2026-03-13 01:42:34+00:00,1,720.0,0.0,0.0,3
4,108,quarter,1,a85f6eca-2f3b-4f61-83ab-8d049f59ce2c,0,12:00,Neemias Queta vs. Chet Holmgren (Ajay Mitchell gains possession),opentip,0,a85f6eca-2f3b-4f61-83ab-8d049f59ce2c,basketball_play,1773366156,457,True,2026-03-13 01:42:36+00:00,1,720.0,0.0,0.0,4
4,107,quarter,1,a85f6eca-2f3b-4f61-83ab-8d049f59ce2c,0,11:42,Cason Wallace misses three point jump shot,threepointmiss,0,,basketball_play,1773366170,456,True,2026-03-13 01:42:50+00:00,1,702.0,18.0,0.3,5
4,106,quarter,1,6dd427f5-fa02-40ef-aa90-cfa73e0c539e,0,11:39,Neemias Queta defensive rebound,rebound,0,6dd427f5-fa02-40ef-aa90-cfa73e0c539e,basketball_play,1773366173,455,True,2026-03-13 01:42:53+00:00,1,699.0,21.0,0.35,6
4,105,quarter,1,6dd427f5-fa02-40ef-aa90-cfa73e0c539e,2,11:31,Payton Pritchard makes two point pullup jump shot,twopointmade,0,a85f6eca-2f3b-4f61-83ab-8d049f59ce2c,basketball_play,1773366181,454,True,2026-03-13 01:43:01+00:00,1,691.0,29.0,0.48333333333333334,7
4,104,quarter,1,a85f6eca-2f3b-4f61-83ab-8d049f59ce2c,2,11:12,Cason Wallace misses two point driving layup,twopointmiss,0,,basketball_play,1773366200,453,True,2026-03-13 01:43:20+00:00,1,672.0,48.0,0.8,8
4,103,quarter,1,6dd427f5-fa02-40ef-aa90-cfa73e0c539e,2,11:11,Neemias Queta defensive rebound,rebound,0,6dd427f5-fa02-40ef-aa90-cfa73e0c539e,basketball_play,1773366201,452,True,2026-03-13 01:43:21+00:00,1,671.0,49.0,0.8166666666666667,9
4,102,quarter,1,6dd427f5-fa02-40ef-aa90-cfa73e0c539e,2,10:53,Jaylen Brown misses two point stepback jump shot,twopointmiss,0,,basketball_play,1773366219,451,True,2026-03-13 01:43:39+00:00,1,653.0,67.0,1.1166666666666667,10
4,101,quarter,1,a85f6eca-2f3b-4f61-83ab-8d049f59ce2c,2,10:51,Cason Wallace defensive rebound,rebound,0,a85f6eca-2f3b-4f61-83ab-8d049f59ce2c,basketball_play,1773366221,450,True,2026-03-13 01:43:41+00:00,1,651.0,69.0,1.15,11
4,100,quarter,1,a85f6eca-2f3b-4f61-83ab-8d049f59ce2c,2,10:43,Luguentz Dort makes three point jump shot (Cason Wallace assists),threepointmade,3,6dd427f5-fa02-40ef-aa90-cfa73e0c539e,basketball_play,1773366230,449,True,2026-03-13 01:43:50+00:00,1,643.0,77.0,1.2833333333333334,12
4,99,quarter,1,6dd427f5-fa02-40ef-aa90-cfa73e0c539e,2,10:19,Jaylen Brown misses two point pullup jump shot,twopointmiss,3,,basketball_play,1773366253,448,True,2026-03-13 01:44:13+00:00,1,619.0,101.0,1.6833333333333333,13
4,98,quarter,1,a85f6eca-2f3b-4f61-83ab-8d049f59ce2c,2,10:17,Luguentz Dort defensive rebound,rebound,3,a85f6eca-2f3b-4f61-83ab-8d049f59ce2c,basketball_play,1773366255,447,True,2026-03-13 01:44:15+00:00,1,617.0,103.0,1.7166666666666666,14
4,97,quarter,1,a85f6eca-2f3b-4f61-83ab-8d049f59ce2c,2,10:07,Chet Holmgren misses three point jump shot,threepointmiss,3,,basketball_play,1773366266,446,True,2026-03-13 01:44:26+00:00,1,607.0,113.0,1.8833333333333333,15
4,96,quarter,1,6dd427f5-fa02-40ef-aa90-cfa73e0c539e,2,10:03,Neemias Queta defensive rebound,rebound,3,6dd427f5-fa02-40ef-aa90-cfa73e0c539e,basketball_play,1773366270,445,True,2026-03-13 01:44:30+00:00,1,603.0,117.0,1.95,16
4,95,quarter,1,6dd427f5-fa02-40ef-aa90-cfa73e0c539e,4,9:50,Payton Pritchard makes two point stepback jump shot,twopointmade,3,a85f6eca-2f3b-4f61-83ab-8d049f59ce2c,basketball_play,1773366282,444,True,2026-03-13 01:44:42+00:00,1,590.0,130.0,2.1666666666666665,17
4,94,quarter,1,a85f6eca-2f3b-4f61-83ab-8d049f59ce2c,4,9:38,Shai Gilgeous-Alexander misses three point stepback jump shot,threepointmiss,3,,basketball_play,1773366294,443,True,2026-03-13 01:44:54+00:00,1,578.0,142.0,2.3666666666666667,18
4,93,quarter,1,6dd427f5-fa02-40ef-aa90-cfa73e0c539e,4,9:34,Jaylen Brown defensive rebound,rebound,3,6dd427f5-fa02-40ef-aa90-cfa73e0c539e,basketball_play,1773366298,442,True,2026-03-13 01:44:58+00:00,1,574.0,146.0,2.433333333333333,19
4,92,quarter,1,6dd427f5-fa02-40ef-aa90-cfa73e0c539e,4,9:28,Baylor Scheierman misses three point running jump shot,threepointmiss,3,,basketball_play,1773366304,441,True,2026-03-13 01:45:04+00:00,1,568.0,152.0,2.533333333333333,20
4,91,quarter,1,a85f6eca-2f3b-4f61-83ab-8d049f59ce2c,4,9:25,Chet Holmgren defensive rebound,rebound,3,a85f6eca-2f3b-4f61-83ab-8d049f59ce2c,basketball_play,1773366307,440,True,2026-03-13 01:45:07+00:00,1,565.0,155.0,2.5833333333333335,21
4,90,quarter,1,a85f6eca-2f3b-4f61-83ab-8d049f59ce2c,4,9:15,Ajay Mitchell makes two point driving layup,twopointmade,5,6dd427f5-fa02-40ef-aa90-cfa73e0c539e,basketball_play,1773366317,439,True,2026-03-13 01:45:17+00:00,1,555.0,165.0,2.75,22
4,89,quarter,1,6dd427f5-fa02-40ef-aa90-cfa73e0c539e,6,8:55,Sam Hauser makes two point pullup jump shot (Baylor Scheierman assists),twopointmade,5,a85f6eca-2f3b-4f61-83ab-8d049f59ce2c,basketball_play,1773366337,438,True,2026-03-13 01:45:37+00:00,1,535.0,185.0,3.0833333333333335,23
4,88,quarter,1,a85f6eca-2f3b-4f61-83ab-8d049f59ce2c,6,8:43,Chet Holmgren turnover (lost ball) (Sam Hauser steals),turnover,5,6dd427f5-fa02-40ef-aa90-cfa73e0c539e,basketball_play,1773366349,437,True,2026-03-13 01:45:49+00:00,1,523.0,197.0,3.283333333333333,24
4,87,quarter,1,6dd427f5-fa02-40ef-aa90-cfa73e0c539e,6,8:38,Sam Hauser misses three point running pullup jump shot,threepointmiss,5,,basketball_play,1773366355,436,True,2026-03-13 01:45:55+00:00,1,518.0,202.0,3.3666666666666667,25
4,86,quarter,1,a85f6eca-2f3b-4f61-83ab-8d049f59ce2c,6,8:36,Thunder defensive rebound,rebound,5,a85f6eca-2f3b-4f61-83ab-8d049f59ce2c,basketball_play,1773366357,435,True,2026-03-13 01:45:57+00:00,1,516.0,204.0,3.4,26
4,85,quarter,1,,6,8:36,Stoppage (Out of bounds),stoppage,5,,basketball_play,1773366360,434,True,2026-03-13 01:46:00+00:00,1,516.0,204.0,3.4,27
4,84,quarter,1,a85f6eca-2f3b-4f61-83ab-8d049f59ce2c,6,8:24,Shai Gilgeous-Alexander turnover (bad pass) (Jaylen Brown steals),turnover,5,6dd427f5-fa02-40ef-aa90-cfa73e0c539e,basketball_play,1773366378,433,True,2026-03-13 01:46:18+00:00,1,504.0,216.0,3.6,28
4,83,quarter,1,6dd427f5-fa02-40ef-aa90-cfa73e0c539e,8,8:18,Jaylen Brown makes two point running dunk (Payton Pritchard assists),twopointmade,5,a85f6eca-2f3b-4f61-83ab-8d049f59ce2c,basketball_play,1773366384,432,True,2026-03-13 01:46:24+00:00,1,498.0,222.0,3.7,29
4,82,quarter,1,a85f6eca-2f3b-4f61-83ab-8d049f59ce2c,8,7:51,Chet Holmgren makes two point cutting dunk (Cason Wallace assists),twopointmade,7,6dd427f5-fa02-40ef-aa90-cfa73e0c539e,basketball_play,1773366412,431,True,2026-03-13 01:46:52+00:00,1,471.0,249.0,4.15,30
4,81,quarter,1,6dd427f5-fa02-40ef-aa90-cfa73e0c539e,8,7:51,Neemias Queta shooting foul (Chet Holmgren draws the foul),shootingfoul,7,a85f6eca-2f3b-4f61-83ab-8d049f59ce2c,basketball_play,1773366415,430,True,2026-03-13 01:46:55+00:00,1,471.0,249.0,4.15,31
4,80,quarter,1,a85f6eca-2f3b-4f61-83ab-8d049f59ce2c,8,7:51,Chet Holmgren makes regular free throw 1 of 1,freethrowmade,8,,basketball_play,1773366451,429,True,2026-03-13 01:47:31+00:00,1,471.0,249.0,4.15,32
4,79,quarter,1,6dd427f5-fa02-40ef-aa90-cfa73e0c539e,8,7:33,Shai Gilgeous-Alexander blocks Jaylen Brown's two point pullup jump shot,twopointmiss,8,,basketball_play,1773366470,428,True,2026-03-13 01:47:50+00:00,1,453.0,267.0,4.45,33
4,78,quarter,1,a85f6eca-2f3b-4f61-83ab-8d049f59ce2c,8,7:30,Ajay Mitchell defensive rebound,rebound,8,a85f6eca-2f3b-4f61-83ab-8d049f59ce2c,basketball_play,1773366473,427,True,2026-03-13 01:47:53+00:00,1,450.0,270.0,4.5,34
4,77,quarter,1,a85f6eca-2f3b-4f61-83ab-8d049f59ce2c,8,7:24,Ajay Mitchell makes two point driving reverse layup,twopointmade,10,6dd427f5-fa02-40ef-aa90-cfa73e0c539e,basketball_play,1773366482,426,True,2026-03-13 01:48:02+00:00,1,444.0,276.0,4.6,35
4,76,quarter,1,6dd427f5-fa02-40ef-aa90-cfa73e0c539e,8,7:24,Neemias Queta shooting foul (Ajay Mitchell draws the foul),shootingfoul,10,a85f6eca-2f3b-4f61-83ab-8d049f59ce2c,basketball_play,1773366484,425,True,2026-03-13 01:48:04+00:00,1,444.0,276.0,4.6,36
4,75,quarter,1,6dd427f5-fa02-40ef-aa90-cfa73e0c539e,8,7:24,"Celtics lineup change (Sam Hauser, Jaylen Brown, Payton Pritchard, Luka Garza, Baylor Scheierman)",lineupchange,10,,basketball_play,1773366521,424,True,2026-03-13 01:48:41+00:00,1,444.0,276.0,4.6,37
4,74,quarter,1,a85f6eca-2f3b-4f61-83ab-8d049f59ce2c,8,7:24,Ajay Mitchell misses regular free throw 1 of 1,freethrowmiss,10,,basketball_play,1773366521,423,True,2026-03-13 01:48:41+00:00,1,444.0,276.0,4.6,38
4,73,quarter,1,6dd427f5-fa02-40ef-aa90-cfa73e0c539e,8,7:22,Jaylen Brown defensive rebound,rebound,10,6dd427f5-fa02-40ef-aa90-cfa73e0c539e,basketball_play,1773366523,422,True,2026-03-13 01:48:43+00:00,1,442.0,278.0,4.633333333333334,39
4,72,quarter,1,6dd427f5-fa02-40ef-aa90-cfa73e0c539e,8,7:11,Sam Hauser misses three point jump shot,threepointmiss,10,,basketball_play,1773366532,421,True,2026-03-13 01:48:52+00:00,1,431.0,289.0,4.816666666666666,40
4,71,quarter,1,6dd427f5-fa02-40ef-aa90-cfa73e0c539e,8,7:08,Baylor Scheierman offensive rebound,rebound,10,6dd427f5-fa02-40ef-aa90-cfa73e0c539e,basketball_play,1773366535,420,True,2026-03-13 01:48:55+00:00,1,428.0,292.0,4.866666666666666,41
4,70,quarter,1,6dd427f5-fa02-40ef-aa90-cfa73e0c539e,11,7:04,Sam Hauser makes three point jump shot (Jaylen Brown assists),threepointmade,10,a85f6eca-2f3b-4f61-83ab-8d049f59ce2c,basketball_play,1773366539,419,True,2026-03-13 01:48:59+00:00,1,424.0,296.0,4.933333333333334,42
4,69,quarter,1,a85f6eca-2f3b-4f61-83ab-8d049f59ce2c,11,7:02,Thunder 60 second timeout,teamtimeout,10,,basketball_play,1773366544,418,True,2026-03-13 01:49:04+00:00,1,422.0,298.0,4.966666666666667,43
4,68,quarter,1,,11,6:42,Stoppage (Out of bounds),stoppage,10,,basketball_play,1773366775,417,True,2026-03-13 01:52:55+00:00,1,402.0,318.0,5.3,44
4,67,quarter,1,a85f6eca-2f3b-4f61-83ab-8d049f59ce2c,11,6:39,Luguentz Dort misses three point stepback jump shot,threepointmiss,10,,basketball_play,1773366790,416,True,2026-03-13 01:53:10+00:00,1,399.0,321.0,5.35,45
4,66,quarter,1,a85f6eca-2f3b-4f61-83ab-8d049f59ce2c,11,6:35,Chet Holmgren offensive rebound,rebound,10,a85f6eca-2f3b-4f61-83ab-8d049f59ce2c,basketball_play,1773366794,415,True,2026-03-13 01:53:14+00:00,1,395.0,325.0,5.416666666666667,46
4,65,quarter,1,a85f6eca-2f3b-4f61-83ab-8d049f59ce2c,11,6:33,Chet Holmgren makes two point putback layup,twopointmade,12,6dd427f5-fa02-40ef-aa90-cfa73e0c539e,basketball_play,1773366796,414,True,2026-03-13 01:53:16+00:00,1,393.0,327.0,5.45,47
4,64,quarter,1,6dd427f5-fa02-40ef-aa90-cfa73e0c539e,11,6:24,Jaylen Brown turnover (lost ball) (Shai Gilgeous-Alexander steals),turnover,12,a85f6eca-2f3b-4f61-83ab-8d049f59ce2c,basketball_play,1773366805,413,True,2026-03-13 01:53:25+00:00,1,384.0,336.0,5.6,48
4,63,quarter,1,a85f6eca-2f3b-4f61-83ab-8d049f59ce2c,11,6:20,Shai Gilgeous-Alexander makes two point running layup,twopointmade,14,6dd427f5-fa02-40ef-aa90-cfa73e0c539e,basketball_play,1773366809,412,True,2026-03-13 01:53:29+00:00,1,380.0,340.0,5.666666666666667,49
4,62,quarter,1,6dd427f5-fa02-40ef-aa90-cfa73e0c539e,11,6:04,Jaylen Brown misses two point pullup jump shot,twopointmiss,14,,basketball_play,1773366825,411,True,2026-03-13 01:53:45+00:00,1,364.0,356.0,5.933333333333334,50
4,61,quarter,1,6dd427f5-fa02-40ef-aa90-cfa73e0c539e,11,6:01,Celtics offensive rebound,rebound,14,6dd427f5-fa02-40ef-aa90-cfa73e0c539e,basketball_play,1773366828,410,True,2026-03-13 01:53:48+00:00,1,361.0,359.0,5.983333333333333,51
4,60,quarter,1,,11,6:01,Stoppage (Out of bounds),stoppage,14,,basketball_play,1773366831,409,True,2026-03-13 01:53:51+00:00,1,361.0,359.0,5.983333333333333,52
4,59,quarter,1,a85f6eca-2f3b-4f61-83ab-8d049f59ce2c,11,6:01,"Thunder lineup change (Cason Wallace, Chet Holmgren, Shai Gilgeous-Alexander, Isaiah Joe, Luguentz Dort)",lineupchange,14,,basketball_play,1773366861,408,True,2026-03-13 01:54:21+00:00,1,361.0,359.0,5.983333333333333,53
4,58,quarter,1,6dd427f5-fa02-40ef-aa90-cfa73e0c539e,11,5:46,Jaylen Brown misses two point fadeaway jump shot,twopointmiss,14,,basketball_play,1773366861,407,True,2026-03-13 01:54:21+00:00,1,346.0,374.0,6.233333333333333,54
4,57,quarter,1,a85f6eca-2f3b-4f61-83ab-8d049f59ce2c,11,5:43,Chet Holmgren defensive rebound,rebound,14,a85f6eca-2f3b-4f61-83ab-8d049f59ce2c,basketball_play,1773366864,406,True,2026-03-13 01:54:24+00:00,1,343.0,377.0,6.283333333333333,55
4,56,quarter,1,a85f6eca-2f3b-4f61-83ab-8d049f59ce2c,11,5:34,Chet Holmgren makes two point cutting dunk (Shai Gilgeous-Alexander assists),twopointmade,16,6dd427f5-fa02-40ef-aa90-cfa73e0c539e,basketball_play,1773366873,405,True,2026-03-13 01:54:33+00:00,1,334.0,386.0,6.433333333333334,56
4,55,quarter,1,6dd427f5-fa02-40ef-aa90-cfa73e0c539e,11,5:34,Celtics 60 second timeout,teamtimeout,16,,basketball_play,1773366877,404,True,2026-03-13 01:54:37+00:00,1,334.0,386.0,6.433333333333334,57
4,54,quarter,1,6dd427f5-fa02-40ef-aa90-cfa73e0c539e,11,5:34,"Celtics lineup change (Jaylen Brown, Ron Harper Jr., Hugo Gonzalez, Luka Garza, Baylor Scheierman)",lineupchange,16,,basketball_play,1773367008,403,True,2026-03-13 01:56:48+00:00,1,334.0,386.0,6.433333333333334,58
4,53,quarter,1,,11,5:32,Stoppage (Out of bounds),stoppage,16,,basketball_play,1773367090,402,True,2026-03-13 01:58:10+00:00,1,332.0,388.0,6.466666666666667,59
4,52,quarter,1,6dd427f5-fa02-40ef-aa90-cfa73e0c539e,11,5:23,Ron Harper Jr. misses three point jump shot,threepointmiss,16,,basketball_play,1773367108,401,True,2026-03-13 01:58:28+00:00,1,323.0,397.0,6.616666666666666,60
4,51,quarter,1,6dd427f5-fa02-40ef-aa90-cfa73e0c539e,11,5:21,Celtics offensive rebound,rebound,16,6dd427f5-fa02-40ef-aa90-cfa73e0c539e,basketball_play,1773367110,400,True,2026-03-13 01:58:30+00:00,1,321.0,399.0,6.65,61
4,50,quarter,1,,11,5:21,Stoppage (Out of bounds),stoppage,16,,basketball_play,1773367113,399,True,2026-03-13 01:58:33+00:00,1,321.0,399.0,6.65,62
4,49,quarter,1,6dd427f5-fa02-40ef-aa90-cfa73e0c539e,13,5:10,Ron Harper Jr. makes two point driving reverse layup,twopointmade,16,a85f6eca-2f3b-4f61-83ab-8d049f59ce2c,basketball_play,1773367135,398,True,2026-03-13 01:58:55+00:00,1,310.0,410.0,6.833333333333333,63
4,48,quarter,1,a85f6eca-2f3b-4f61-83ab-8d049f59ce2c,13,4:56,Shai Gilgeous-Alexander makes three point pullup jump shot,threepointmade,19,6dd427f5-fa02-40ef-aa90-cfa73e0c539e,basketball_play,1773367148,397,True,2026-03-13 01:59:08+00:00,1,296.0,424.0,7.066666666666666,64
4,47,quarter,1,6dd427f5-fa02-40ef-aa90-cfa73e0c539e,13,4:40,Shai Gilgeous-Alexander blocks Hugo Gonzalez's two point pullup jump shot,twopointmiss,19,,basketball_play,1773367165,396,True,2026-03-13 01:59:25+00:00,1,280.0,440.0,7.333333333333333,65
4,46,quarter,1,6dd427f5-fa02-40ef-aa90-cfa73e0c539e,13,4:37,Hugo Gonzalez offensive rebound,rebound,19,6dd427f5-fa02-40ef-aa90-cfa73e0c539e,basketball_play,1773367168,395,True,2026-03-13 01:59:28+00:00,1,277.0,443.0,7.383333333333334,66
4,45,quarter,1,6dd427f5-fa02-40ef-aa90-cfa73e0c539e,15,4:37,Hugo Gonzalez makes two point putback layup,twopointmade,19,a85f6eca-2f3b-4f61-83ab-8d049f59ce2c,basketball_play,1773367168,394,True,2026-03-13 01:59:28+00:00,1,277.0,443.0,7.383333333333334,67
4,44,quarter,1,a85f6eca-2f3b-4f61-83ab-8d049f59ce2c,15,4:18,Cason Wallace misses two point driving dunk,twopointmiss,19,,basketball_play,1773367187,393,True,2026-03-13 01:59:47+00:00,1,258.0,462.0,7.7,68
4,43,quarter,1,6dd427f5-fa02-40ef-aa90-cfa73e0c539e,15,4:15,Luka Garza defensive rebound,rebound,19,6dd427f5-fa02-40ef-aa90-cfa73e0c539e,basketball_play,1773367190,392,True,2026-03-13 01:59:50+00:00,1,255.0,465.0,7.75,69
4,42,quarter,1,6dd427f5-fa02-40ef-aa90-cfa73e0c539e,17,4:11,Hugo Gonzalez makes two point running reverse layup (Jaylen Brown assists),twopointmade,19,a85f6eca-2f3b-4f61-83ab-8d049f59ce2c,basketball_play,1773367194,391,True,2026-03-13 01:59:54+00:00,1,251.0,469.0,7.816666666666666,70
4,41,quarter,1,a85f6eca-2f3b-4f61-83ab-8d049f59ce2c,17,3:48,Cason Wallace misses three point jump shot,threepointmiss,19,,basketball_play,1773367216,390,True,2026-03-13 02:00:16+00:00,1,228.0,492.0,8.2,71
4,40,quarter,1,a85f6eca-2f3b-4f61-83ab-8d049f59ce2c,17,3:46,Shai Gilgeous-Alexander offensive rebound,rebound,19,a85f6eca-2f3b-4f61-83ab-8d049f59ce2c,basketball_play,1773367218,389,True,2026-03-13 02:00:18+00:00,1,226.0,494.0,8.233333333333333,72
4,39,quarter,1,6dd427f5-fa02-40ef-aa90-cfa73e0c539e,17,3:43,Ron Harper Jr. shooting foul (Shai Gilgeous-Alexander draws the foul),shootingfoul,19,a85f6eca-2f3b-4f61-83ab-8d049f59ce2c,basketball_play,1773367225,388,True,2026-03-13 02:00:25+00:00,1,223.0,497.0,8.283333333333333,73
4,38,quarter,1,a85f6eca-2f3b-4f61-83ab-8d049f59ce2c,17,3:43,Shai Gilgeous-Alexander makes regular free throw 1 of 2,freethrowmade,20,a85f6eca-2f3b-4f61-83ab-8d049f59ce2c,basketball_play,1773367256,387,True,2026-03-13 02:00:56+00:00,1,223.0,497.0,8.283333333333333,74
4,37,quarter,1,a85f6eca-2f3b-4f61-83ab-8d049f59ce2c,17,3:43,"Thunder lineup change (Jared McCain, Shai Gilgeous-Alexander, Isaiah Joe, Jaylin Williams, Alex Caruso)",lineupchange,20,,basketball_play,1773367256,386,True,2026-03-13 02:00:56+00:00,1,223.0,497.0,8.283333333333333,75
4,36,quarter,1,a85f6eca-2f3b-4f61-83ab-8d049f59ce2c,17,3:43,Shai Gilgeous-Alexander makes regular free throw 2 of 2,freethrowmade,21,6dd427f5-fa02-40ef-aa90-cfa73e0c539e,basketball_play,1773367277,385,True,2026-03-13 02:01:17+00:00,1,223.0,497.0,8.283333333333333,76
4,35,quarter,1,6dd427f5-fa02-40ef-aa90-cfa73e0c539e,17,3:26,Baylor Scheierman misses three point jump shot,threepointmiss,21,,basketball_play,1773367296,384,True,2026-03-13 02:01:36+00:00,1,206.0,514.0,8.566666666666666,77
4,34,quarter,1,a85f6eca-2f3b-4f61-83ab-8d049f59ce2c,17,3:22,Alex Caruso defensive rebound,rebound,21,a85f6eca-2f3b-4f61-83ab-8d049f59ce2c,basketball_play,1773367300,383,True,2026-03-13 02:01:40+00:00,1,202.0,518.0,8.633333333333333,78
4,33,quarter,1,6dd427f5-fa02-40ef-aa90-cfa73e0c539e,17,3:15,Jaylen Brown shooting foul (Shai Gilgeous-Alexander draws the foul),shootingfoul,21,a85f6eca-2f3b-4f61-83ab-8d049f59ce2c,basketball_play,1773367309,382,True,2026-03-13 02:01:49+00:00,1,195.0,525.0,8.75,79
4,32,quarter,1,a85f6eca-2f3b-4f61-83ab-8d049f59ce2c,17,3:15,Shai Gilgeous-Alexander makes regular free throw 1 of 2,freethrowmade,22,a85f6eca-2f3b-4f61-83ab-8d049f59ce2c,basketball_play,1773367333,381,True,2026-03-13 02:02:13+00:00,1,195.0,525.0,8.75,80
4,31,quarter,1,6dd427f5-fa02-40ef-aa90-cfa73e0c539e,17,3:15,"Celtics lineup change (Jaylen Brown, Ron Harper Jr., Hugo Gonzalez, Jordan Walsh, Luka Garza)",lineupchange,22,,basketball_play,1773367352,380,True,2026-03-13 02:02:32+00:00,1,195.0,525.0,8.75,81
4,30,quarter,1,a85f6eca-2f3b-4f61-83ab-8d049f59ce2c,17,3:15,Shai Gilgeous-Alexander makes regular free throw 2 of 2,freethrowmade,23,6dd427f5-fa02-40ef-aa90-cfa73e0c539e,basketball_play,1773367352,379,True,2026-03-13 02:02:32+00:00,1,195.0,525.0,8.75,82
4,29,quarter,1,6dd427f5-fa02-40ef-aa90-cfa73e0c539e,17,2:58,Luka Garza misses three point jump shot,threepointmiss,23,,basketball_play,1773367373,378,True,2026-03-13 02:02:53+00:00,1,178.0,542.0,9.033333333333333,83
4,28,quarter,1,a85f6eca-2f3b-4f61-83ab-8d049f59ce2c,17,2:54,Isaiah Joe defensive rebound,rebound,23,a85f6eca-2f3b-4f61-83ab-8d049f59ce2c,basketball_play,1773367377,377,True,2026-03-13 02:02:57+00:00,1,174.0,546.0,9.1,84
4,27,quarter,1,6dd427f5-fa02-40ef-aa90-cfa73e0c539e,17,2:51,Jordan Walsh shooting foul (Shai Gilgeous-Alexander draws the foul),shootingfoul,23,a85f6eca-2f3b-4f61-83ab-8d049f59ce2c,basketball_play,1773367383,376,True,2026-03-13 02:03:03+00:00,1,171.0,549.0,9.15,85
4,26,quarter,1,a85f6eca-2f3b-4f61-83ab-8d049f59ce2c,17,2:51,Shai Gilgeous-Alexander makes regular free throw 1 of 2,freethrowmade,24,a85f6eca-2f3b-4f61-83ab-8d049f59ce2c,basketball_play,1773367406,375,True,2026-03-13 02:03:26+00:00,1,171.0,549.0,9.15,86
4,25,quarter,1,a85f6eca-2f3b-4f61-83ab-8d049f59ce2c,17,2:51,Shai Gilgeous-Alexander misses regular free throw 2 of 2,freethrowmiss,24,,basketball_play,1773367406,374,True,2026-03-13 02:03:26+00:00,1,171.0,549.0,9.15,87
4,24,quarter,1,6dd427f5-fa02-40ef-aa90-cfa73e0c539e,17,2:49,Luka Garza defensive rebound,rebound,24,6dd427f5-fa02-40ef-aa90-cfa73e0c539e,basketball_play,1773367408,373,True,2026-03-13 02:03:28+00:00,1,169.0,551.0,9.183333333333334,88
4,23,quarter,1,6dd427f5-fa02-40ef-aa90-cfa73e0c539e,19,2:36,Jaylen Brown makes two point driving floating jump shot (Ron Harper Jr. assists),twopointmade,24,a85f6eca-2f3b-4f61-83ab-8d049f59ce2c,basketball_play,1773367436,372,True,2026-03-13 02:03:56+00:00,1,156.0,564.0,9.4,89
4,22,quarter,1,a85f6eca-2f3b-4f61-83ab-8d049f59ce2c,19,2:22,Jared McCain misses three point jump shot,threepointmiss,24,,basketball_play,1773367450,371,True,2026-03-13 02:04:10+00:00,1,142.0,578.0,9.633333333333333,90
4,21,quarter,1,6dd427f5-fa02-40ef-aa90-cfa73e0c539e,19,2:18,Luka Garza defensive rebound,rebound,24,6dd427f5-fa02-40ef-aa90-cfa73e0c539e,basketball_play,1773367454,370,True,2026-03-13 02:04:14+00:00,1,138.0,582.0,9.7,91
4,20,quarter,1,a85f6eca-2f3b-4f61-83ab-8d049f59ce2c,19,2:11,Jaylin Williams shooting foul (Jaylen Brown draws the foul),shootingfoul,24,6dd427f5-fa02-40ef-aa90-cfa73e0c539e,basketball_play,1773367462,369,True,2026-03-13 02:04:22+00:00,1,131.0,589.0,9.816666666666666,92
4,19,quarter,1,6dd427f5-fa02-40ef-aa90-cfa73e0c539e,20,2:11,Jaylen Brown makes regular free throw 1 of 2,freethrowmade,24,6dd427f5-fa02-40ef-aa90-cfa73e0c539e,basketball_play,1773367495,368,True,2026-03-13 02:04:55+00:00,1,131.0,589.0,9.816666666666666,93
4,18,quarter,1,6dd427f5-fa02-40ef-aa90-cfa73e0c539e,21,2:11,Jaylen Brown makes regular free throw 2 of 2,freethrowmade,24,a85f6eca-2f3b-4f61-83ab-8d049f59ce2c,basketball_play,1773367518,367,True,2026-03-13 02:05:18+00:00,1,131.0,589.0,9.816666666666666,94
4,17,quarter,1,a85f6eca-2f3b-4f61-83ab-8d049f59ce2c,21,1:57,Shai Gilgeous-Alexander turnover (bad pass) (Jaylen Brown steals),turnover,24,6dd427f5-fa02-40ef-aa90-cfa73e0c539e,basketball_play,1773367533,366,True,2026-03-13 02:05:33+00:00,1,117.0,603.0,10.05,95
4,16,quarter,1,6dd427f5-fa02-40ef-aa90-cfa73e0c539e,23,1:53,Jaylen Brown makes two point running layup,twopointmade,24,a85f6eca-2f3b-4f61-83ab-8d049f59ce2c,basketball_play,1773367538,365,True,2026-03-13 02:05:38+00:00,1,113.0,607.0,10.116666666666667,96
4,15,quarter,1,a85f6eca-2f3b-4f61-83ab-8d049f59ce2c,23,1:39,Alex Caruso turnover (out of bounds bad pass),turnover,24,6dd427f5-fa02-40ef-aa90-cfa73e0c539e,basketball_play,1773367553,364,True,2026-03-13 02:05:53+00:00,1,99.0,621.0,10.35,97
4,14,quarter,1,a85f6eca-2f3b-4f61-83ab-8d049f59ce2c,23,1:19,Alex Caruso personal foul (Jaylen Brown draws the foul),personalfoul,24,6dd427f5-fa02-40ef-aa90-cfa73e0c539e,basketball_play,1773367583,363,True,2026-03-13 02:06:23+00:00,1,79.0,641.0,10.683333333333334,98
4,13,quarter,1,6dd427f5-fa02-40ef-aa90-cfa73e0c539e,26,1:08,Ron Harper Jr. makes three point jump shot (Jaylen Brown assists),threepointmade,24,a85f6eca-2f3b-4f61-83ab-8d049f59ce2c,basketball_play,1773367618,362,True,2026-03-13 02:06:58+00:00,1,68.0,652.0,10.866666666666667,99
4,12,quarter,1,a85f6eca-2f3b-4f61-83ab-8d049f59ce2c,26,00:56.60,Alex Caruso misses three point jump shot,threepointmiss,24,,basketball_play,1773367630,361,True,2026-03-13 02:07:10+00:00,1,56.6,663.4,11.056666666666667,100
4,11,quarter,1,a85f6eca-2f3b-4f61-83ab-8d049f59ce2c,26,00:54.20,Thunder offensive rebound,rebound,24,a85f6eca-2f3b-4f61-83ab-8d049f59ce2c,basketball_play,1773367634,360,True,2026-03-13 02:07:14+00:00,1,54.2,665.8,11.096666666666666,101
4,10,quarter,1,,26,00:54.20,Stoppage (Out of bounds),stoppage,24,,basketball_play,1773367635,359,True,2026-03-13 02:07:15+00:00,1,54.2,665.8,11.096666666666666,102
4,9,quarter,1,a85f6eca-2f3b-4f61-83ab-8d049f59ce2c,26,00:44.70,Jaylin Williams makes three point jump shot (Shai Gilgeous-Alexander assists),threepointmade,27,6dd427f5-fa02-40ef-aa90-cfa73e0c539e,basketball_play,1773367659,358,True,2026-03-13 02:07:39+00:00,1,44.7,675.3,11.254999999999999,103
4,8,quarter,1,6dd427f5-fa02-40ef-aa90-cfa73e0c539e,26,00:34.80,Jaylen Brown offensive foul (Charge) (Jaylin Williams draws the foul),offensivefoul,27,a85f6eca-2f3b-4f61-83ab-8d049f59ce2c,basketball_play,1773367674,357,True,2026-03-13 02:07:54+00:00,1,34.8,685.2,11.42,104
4,7,quarter,1,6dd427f5-fa02-40ef-aa90-cfa73e0c539e,26,00:34.80,Jaylen Brown turnover (offensive foul),turnover,27,a85f6eca-2f3b-4f61-83ab-8d049f59ce2c,basketball_play,1773367674,356,True,2026-03-13 02:07:54+00:00,1,34.8,685.2,11.42,105
4,6,quarter,1,6dd427f5-fa02-40ef-aa90-cfa73e0c539e,26,00:34.80,"Celtics lineup change (Ron Harper Jr., Hugo Gonzalez, Jordan Walsh, Luka Garza, Baylor Scheierman)",lineupchange,27,,basketball_play,1773367706,355,True,2026-03-13 02:08:26+00:00,1,34.8,685.2,11.42,106
4,5,quarter,1,a85f6eca-2f3b-4f61-83ab-8d049f59ce2c,26,00:22.20,Shai Gilgeous-Alexander turnover (lost ball) (Ron Harper Jr. steals),turnover,27,6dd427f5-fa02-40ef-aa90-cfa73e0c539e,basketball_play,1773367706,354,True,2026-03-13 02:08:26+00:00,1,22.2,697.8,11.629999999999999,107
