period_index,event_index,period_type,period_number,attribution,away_points,clock,description,event_type,home_points,possession,type,wall_clock,pbp_source_row,has_wall_clock,event_ts_utc,period_sequence,game_clock_seconds_remaining,game_elapsed_seconds,game_elapsed_minutes,pbp_chronological_index
4,113,quarter,1,29e3c04e-fadb-4006-be20-cbb8c159ce0e,0,12:00,"Timberwolves lineup change (Ayo Dosunmu, Julius Randle, Rudy Gobert, Mike Conley, Donte DiVincenzo)",lineupchange,0,,basketball_play,1775603467,461,True,2026-04-07 23:11:07+00:00,1,720.0,0.0,0.0,1
4,112,quarter,1,d059bab2-9fb5-42dd-8038-5a12474300ce,0,12:00,"Pacers lineup change (Jay Huff, Kobe Brown, Jarace Walker, Ethan Thompson, Quenton Jackson)",lineupchange,0,,basketball_play,1775603467,460,True,2026-04-07 23:11:07+00:00,1,720.0,0.0,0.0,2
4,111,quarter,1,,0,12:00,Start of 1st Quarter,startperiod,0,,basketball_play,1775603467,459,True,2026-04-07 23:11:07+00:00,1,720.0,0.0,0.0,3
4,110,quarter,1,29e3c04e-fadb-4006-be20-cbb8c159ce0e,0,12:00,Rudy Gobert vs. Jay Huff (Ayo Dosunmu gains possession),opentip,0,29e3c04e-fadb-4006-be20-cbb8c159ce0e,basketball_play,1775603470,458,True,2026-04-07 23:11:10+00:00,1,720.0,0.0,0.0,4
4,109,quarter,1,29e3c04e-fadb-4006-be20-cbb8c159ce0e,0,11:46,Ayo Dosunmu misses two point driving floating jump shot,twopointmiss,0,,basketball_play,1775603481,457,True,2026-04-07 23:11:21+00:00,1,706.0,14.0,0.23333333333333334,5
4,108,quarter,1,29e3c04e-fadb-4006-be20-cbb8c159ce0e,0,11:43,Mike Conley offensive rebound,rebound,0,29e3c04e-fadb-4006-be20-cbb8c159ce0e,basketball_play,1775603484,456,True,2026-04-07 23:11:24+00:00,1,703.0,17.0,0.2833333333333333,6
4,107,quarter,1,29e3c04e-fadb-4006-be20-cbb8c159ce0e,0,11:37,Ayo Dosunmu misses three point pullup jump shot,threepointmiss,0,,basketball_play,1775603489,455,True,2026-04-07 23:11:29+00:00,1,697.0,23.0,0.38333333333333336,7
4,106,quarter,1,d059bab2-9fb5-42dd-8038-5a12474300ce,0,11:33,Ethan Thompson defensive rebound,rebound,0,d059bab2-9fb5-42dd-8038-5a12474300ce,basketball_play,1775603493,454,True,2026-04-07 23:11:33+00:00,1,693.0,27.0,0.45,8
4,105,quarter,1,d059bab2-9fb5-42dd-8038-5a12474300ce,0,11:32,Ethan Thompson turnover (lost ball) (Mike Conley steals),turnover,0,29e3c04e-fadb-4006-be20-cbb8c159ce0e,basketball_play,1775603494,453,True,2026-04-07 23:11:34+00:00,1,692.0,28.0,0.4666666666666667,9
4,104,quarter,1,29e3c04e-fadb-4006-be20-cbb8c159ce0e,0,11:23,Mike Conley misses two point driving floating jump shot,twopointmiss,0,,basketball_play,1775603504,452,True,2026-04-07 23:11:44+00:00,1,683.0,37.0,0.6166666666666667,10
4,103,quarter,1,d059bab2-9fb5-42dd-8038-5a12474300ce,0,11:21,Jay Huff defensive rebound,rebound,0,d059bab2-9fb5-42dd-8038-5a12474300ce,basketball_play,1775603506,451,True,2026-04-07 23:11:46+00:00,1,681.0,39.0,0.65,11
4,102,quarter,1,d059bab2-9fb5-42dd-8038-5a12474300ce,0,11:08,Jay Huff makes three point jump shot (Jarace Walker assists),threepointmade,3,29e3c04e-fadb-4006-be20-cbb8c159ce0e,basketball_play,1775603519,450,True,2026-04-07 23:11:59+00:00,1,668.0,52.0,0.8666666666666667,12
4,101,quarter,1,29e3c04e-fadb-4006-be20-cbb8c159ce0e,0,10:48,Julius Randle misses two point stepback jump shot,twopointmiss,3,,basketball_play,1775603537,449,True,2026-04-07 23:12:17+00:00,1,648.0,72.0,1.2,13
4,100,quarter,1,d059bab2-9fb5-42dd-8038-5a12474300ce,0,10:47,Jarace Walker defensive rebound,rebound,3,d059bab2-9fb5-42dd-8038-5a12474300ce,basketball_play,1775603538,448,True,2026-04-07 23:12:18+00:00,1,647.0,73.0,1.2166666666666666,14
4,99,quarter,1,d059bab2-9fb5-42dd-8038-5a12474300ce,0,10:36,Jay Huff turnover (out of bounds bad pass),turnover,3,29e3c04e-fadb-4006-be20-cbb8c159ce0e,basketball_play,1775603551,447,True,2026-04-07 23:12:31+00:00,1,636.0,84.0,1.4,15
4,98,quarter,1,29e3c04e-fadb-4006-be20-cbb8c159ce0e,2,10:25,Rudy Gobert makes two point cutting dunk (Donte DiVincenzo assists),twopointmade,3,d059bab2-9fb5-42dd-8038-5a12474300ce,basketball_play,1775603574,446,True,2026-04-07 23:12:54+00:00,1,625.0,95.0,1.5833333333333333,16
4,97,quarter,1,d059bab2-9fb5-42dd-8038-5a12474300ce,2,10:25,Jay Huff shooting foul (Rudy Gobert draws the foul),shootingfoul,3,29e3c04e-fadb-4006-be20-cbb8c159ce0e,basketball_play,1775603580,445,True,2026-04-07 23:13:00+00:00,1,625.0,95.0,1.5833333333333333,17
4,96,quarter,1,29e3c04e-fadb-4006-be20-cbb8c159ce0e,3,10:25,Rudy Gobert makes regular free throw 1 of 1,freethrowmade,3,,basketball_play,1775603598,444,True,2026-04-07 23:13:18+00:00,1,625.0,95.0,1.5833333333333333,18
4,95,quarter,1,d059bab2-9fb5-42dd-8038-5a12474300ce,3,10:18,Quenton Jackson misses two point driving floating jump shot,twopointmiss,3,,basketball_play,1775603606,443,True,2026-04-07 23:13:26+00:00,1,618.0,102.0,1.7,19
4,94,quarter,1,d059bab2-9fb5-42dd-8038-5a12474300ce,3,10:16,Ethan Thompson offensive rebound,rebound,3,d059bab2-9fb5-42dd-8038-5a12474300ce,basketball_play,1775603608,442,True,2026-04-07 23:13:28+00:00,1,616.0,104.0,1.7333333333333334,20
4,93,quarter,1,d059bab2-9fb5-42dd-8038-5a12474300ce,3,10:16,Ethan Thompson makes two point tip dunk,twopointmade,5,29e3c04e-fadb-4006-be20-cbb8c159ce0e,basketball_play,1775603609,441,True,2026-04-07 23:13:29+00:00,1,616.0,104.0,1.7333333333333334,21
4,92,quarter,1,29e3c04e-fadb-4006-be20-cbb8c159ce0e,3,9:53,Julius Randle turnover (lost ball) (Jarace Walker steals),turnover,5,d059bab2-9fb5-42dd-8038-5a12474300ce,basketball_play,1775603630,440,True,2026-04-07 23:13:50+00:00,1,593.0,127.0,2.1166666666666667,22
4,91,quarter,1,d059bab2-9fb5-42dd-8038-5a12474300ce,3,9:48,Jay Huff makes two point running finger roll layup (Jarace Walker assists),twopointmade,7,29e3c04e-fadb-4006-be20-cbb8c159ce0e,basketball_play,1775603636,439,True,2026-04-07 23:13:56+00:00,1,588.0,132.0,2.2,23
4,90,quarter,1,29e3c04e-fadb-4006-be20-cbb8c159ce0e,6,9:28,Donte DiVincenzo makes three point jump shot (Julius Randle assists),threepointmade,7,d059bab2-9fb5-42dd-8038-5a12474300ce,basketball_play,1775603655,438,True,2026-04-07 23:14:15+00:00,1,568.0,152.0,2.533333333333333,24
4,89,quarter,1,d059bab2-9fb5-42dd-8038-5a12474300ce,6,9:11,Jarace Walker turnover (lost ball) (Rudy Gobert steals),turnover,7,29e3c04e-fadb-4006-be20-cbb8c159ce0e,basketball_play,1775603672,437,True,2026-04-07 23:14:32+00:00,1,551.0,169.0,2.816666666666667,25
4,88,quarter,1,29e3c04e-fadb-4006-be20-cbb8c159ce0e,9,8:56,Mike Conley makes three point jump shot (Donte DiVincenzo assists),threepointmade,7,d059bab2-9fb5-42dd-8038-5a12474300ce,basketball_play,1775603687,436,True,2026-04-07 23:14:47+00:00,1,536.0,184.0,3.066666666666667,26
4,87,quarter,1,d059bab2-9fb5-42dd-8038-5a12474300ce,9,8:44,Jarace Walker misses three point jump shot,threepointmiss,7,,basketball_play,1775603699,435,True,2026-04-07 23:14:59+00:00,1,524.0,196.0,3.2666666666666666,27
4,86,quarter,1,29e3c04e-fadb-4006-be20-cbb8c159ce0e,9,8:42,Rudy Gobert defensive rebound,rebound,7,29e3c04e-fadb-4006-be20-cbb8c159ce0e,basketball_play,1775603701,434,True,2026-04-07 23:15:01+00:00,1,522.0,198.0,3.3,28
4,85,quarter,1,29e3c04e-fadb-4006-be20-cbb8c159ce0e,12,8:30,Julius Randle makes three point jump shot (Mike Conley assists),threepointmade,7,d059bab2-9fb5-42dd-8038-5a12474300ce,basketball_play,1775603713,433,True,2026-04-07 23:15:13+00:00,1,510.0,210.0,3.5,29
4,84,quarter,1,d059bab2-9fb5-42dd-8038-5a12474300ce,12,8:27,Pacers 60 second timeout,teamtimeout,7,,basketball_play,1775603719,432,True,2026-04-07 23:15:19+00:00,1,507.0,213.0,3.55,30
4,83,quarter,1,d059bab2-9fb5-42dd-8038-5a12474300ce,12,8:08,Jay Huff misses two point driving finger roll layup,twopointmiss,7,,basketball_play,1775603915,431,True,2026-04-07 23:18:35+00:00,1,488.0,232.0,3.8666666666666667,31
4,82,quarter,1,29e3c04e-fadb-4006-be20-cbb8c159ce0e,12,8:08,Timberwolves defensive rebound,rebound,7,29e3c04e-fadb-4006-be20-cbb8c159ce0e,basketball_play,1775603915,430,True,2026-04-07 23:18:35+00:00,1,488.0,232.0,3.8666666666666667,32
4,81,quarter,1,,12,8:08,Stoppage (Out of bounds),stoppage,7,,basketball_play,1775603920,429,True,2026-04-07 23:18:40+00:00,1,488.0,232.0,3.8666666666666667,33
4,80,quarter,1,29e3c04e-fadb-4006-be20-cbb8c159ce0e,12,7:56,Ayo Dosunmu turnover (lost ball) (Jarace Walker steals),turnover,7,d059bab2-9fb5-42dd-8038-5a12474300ce,basketball_play,1775603934,428,True,2026-04-07 23:18:54+00:00,1,476.0,244.0,4.066666666666666,34
4,79,quarter,1,29e3c04e-fadb-4006-be20-cbb8c159ce0e,12,7:54,Ayo Dosunmu shooting foul (Jarace Walker draws the foul),shootingfoul,7,d059bab2-9fb5-42dd-8038-5a12474300ce,basketball_play,1775603937,427,True,2026-04-07 23:18:57+00:00,1,474.0,246.0,4.1,35
4,78,quarter,1,d059bab2-9fb5-42dd-8038-5a12474300ce,12,7:54,Jarace Walker makes regular free throw 1 of 2,freethrowmade,8,d059bab2-9fb5-42dd-8038-5a12474300ce,basketball_play,1775603967,426,True,2026-04-07 23:19:27+00:00,1,474.0,246.0,4.1,36
4,77,quarter,1,d059bab2-9fb5-42dd-8038-5a12474300ce,12,7:54,Jarace Walker makes regular free throw 2 of 2,freethrowmade,9,29e3c04e-fadb-4006-be20-cbb8c159ce0e,basketball_play,1775603985,425,True,2026-04-07 23:19:45+00:00,1,474.0,246.0,4.1,37
4,76,quarter,1,29e3c04e-fadb-4006-be20-cbb8c159ce0e,15,7:33,Julius Randle makes three point jump shot (Donte DiVincenzo assists),threepointmade,9,d059bab2-9fb5-42dd-8038-5a12474300ce,basketball_play,1775604009,424,True,2026-04-07 23:20:09+00:00,1,453.0,267.0,4.45,38
4,75,quarter,1,d059bab2-9fb5-42dd-8038-5a12474300ce,15,7:20,Kobe Brown misses three point pullup jump shot,threepointmiss,9,,basketball_play,1775604022,423,True,2026-04-07 23:20:22+00:00,1,440.0,280.0,4.666666666666667,39
4,74,quarter,1,29e3c04e-fadb-4006-be20-cbb8c159ce0e,15,7:17,Rudy Gobert defensive rebound,rebound,9,29e3c04e-fadb-4006-be20-cbb8c159ce0e,basketball_play,1775604025,422,True,2026-04-07 23:20:25+00:00,1,437.0,283.0,4.716666666666667,40
4,73,quarter,1,29e3c04e-fadb-4006-be20-cbb8c159ce0e,18,6:58,Donte DiVincenzo makes three point jump shot (Julius Randle assists),threepointmade,9,d059bab2-9fb5-42dd-8038-5a12474300ce,basketball_play,1775604043,421,True,2026-04-07 23:20:43+00:00,1,418.0,302.0,5.033333333333333,41
4,72,quarter,1,d059bab2-9fb5-42dd-8038-5a12474300ce,18,6:45,Ethan Thompson makes two point cutting layup (Jarace Walker assists),twopointmade,11,29e3c04e-fadb-4006-be20-cbb8c159ce0e,basketball_play,1775604058,420,True,2026-04-07 23:20:58+00:00,1,405.0,315.0,5.25,42
4,71,quarter,1,29e3c04e-fadb-4006-be20-cbb8c159ce0e,21,6:23,Ayo Dosunmu makes three point jump shot (Rudy Gobert assists),threepointmade,11,d059bab2-9fb5-42dd-8038-5a12474300ce,basketball_play,1775604079,419,True,2026-04-07 23:21:19+00:00,1,383.0,337.0,5.616666666666666,43
4,70,quarter,1,d059bab2-9fb5-42dd-8038-5a12474300ce,21,6:13,Quenton Jackson turnover (bad pass) (Ayo Dosunmu steals),turnover,11,29e3c04e-fadb-4006-be20-cbb8c159ce0e,basketball_play,1775604089,418,True,2026-04-07 23:21:29+00:00,1,373.0,347.0,5.783333333333333,44
4,69,quarter,1,29e3c04e-fadb-4006-be20-cbb8c159ce0e,21,6:10,Ayo Dosunmu turnover (lost ball) (Quenton Jackson steals),turnover,11,d059bab2-9fb5-42dd-8038-5a12474300ce,basketball_play,1775604092,417,True,2026-04-07 23:21:32+00:00,1,370.0,350.0,5.833333333333333,45
4,68,quarter,1,d059bab2-9fb5-42dd-8038-5a12474300ce,21,6:02,Jarace Walker misses three point jump shot,threepointmiss,11,,basketball_play,1775604100,416,True,2026-04-07 23:21:40+00:00,1,362.0,358.0,5.966666666666667,46
4,67,quarter,1,29e3c04e-fadb-4006-be20-cbb8c159ce0e,21,6:00,Donte DiVincenzo defensive rebound,rebound,11,29e3c04e-fadb-4006-be20-cbb8c159ce0e,basketball_play,1775604102,415,True,2026-04-07 23:21:42+00:00,1,360.0,360.0,6.0,47
4,66,quarter,1,29e3c04e-fadb-4006-be20-cbb8c159ce0e,21,5:45,Ayo Dosunmu turnover (traveling),turnover,11,d059bab2-9fb5-42dd-8038-5a12474300ce,basketball_play,1775604120,414,True,2026-04-07 23:22:00+00:00,1,345.0,375.0,6.25,48
4,65,quarter,1,29e3c04e-fadb-4006-be20-cbb8c159ce0e,21,5:45,"Timberwolves lineup change (Ayo Dosunmu, Julius Randle, Mike Conley, Naz Reid, Donte DiVincenzo)",lineupchange,11,,basketball_play,1775604123,413,True,2026-04-07 23:22:03+00:00,1,345.0,375.0,6.25,49
4,64,quarter,1,d059bab2-9fb5-42dd-8038-5a12474300ce,21,5:45,"Pacers lineup change (Jalen Slawson, Obi Toppin, Jay Huff, Ethan Thompson, Quenton Jackson)",lineupchange,11,,basketball_play,1775604123,412,True,2026-04-07 23:22:03+00:00,1,345.0,375.0,6.25,50
4,63,quarter,1,d059bab2-9fb5-42dd-8038-5a12474300ce,21,5:34,Quenton Jackson misses two point driving dunk,twopointmiss,11,,basketball_play,1775604162,411,True,2026-04-07 23:22:42+00:00,1,334.0,386.0,6.433333333333334,51
4,62,quarter,1,29e3c04e-fadb-4006-be20-cbb8c159ce0e,21,5:32,Donte DiVincenzo defensive rebound,rebound,11,29e3c04e-fadb-4006-be20-cbb8c159ce0e,basketball_play,1775604164,410,True,2026-04-07 23:22:44+00:00,1,332.0,388.0,6.466666666666667,52
4,61,quarter,1,29e3c04e-fadb-4006-be20-cbb8c159ce0e,21,5:24,Donte DiVincenzo misses three point jump shot,threepointmiss,11,,basketball_play,1775604172,409,True,2026-04-07 23:22:52+00:00,1,324.0,396.0,6.6,53
4,60,quarter,1,d059bab2-9fb5-42dd-8038-5a12474300ce,21,5:21,Jalen Slawson defensive rebound,rebound,11,d059bab2-9fb5-42dd-8038-5a12474300ce,basketball_play,1775604175,408,True,2026-04-07 23:22:55+00:00,1,321.0,399.0,6.65,54
4,59,quarter,1,,21,5:15,Stoppage (Out of bounds),stoppage,11,,basketball_play,1775604183,407,True,2026-04-07 23:23:03+00:00,1,315.0,405.0,6.75,55
4,58,quarter,1,29e3c04e-fadb-4006-be20-cbb8c159ce0e,21,5:15,"Timberwolves lineup change (Ayo Dosunmu, Julius Randle, Bones Hyland, Naz Reid, Donte DiVincenzo)",lineupchange,11,,basketball_play,1775604184,406,True,2026-04-07 23:23:04+00:00,1,315.0,405.0,6.75,56
4,57,quarter,1,d059bab2-9fb5-42dd-8038-5a12474300ce,21,5:15,"Pacers lineup change (Jalen Slawson, Obi Toppin, Micah Potter, Ethan Thompson, Quenton Jackson)",lineupchange,11,,basketball_play,1775604184,405,True,2026-04-07 23:23:04+00:00,1,315.0,405.0,6.75,57
4,56,quarter,1,d059bab2-9fb5-42dd-8038-5a12474300ce,21,5:15,"Pacers lineup change (Kam Jones, Jalen Slawson, Obi Toppin, Micah Potter, Ethan Thompson)",lineupchange,11,,basketball_play,1775604227,404,True,2026-04-07 23:23:47+00:00,1,315.0,405.0,6.75,58
4,55,quarter,1,d059bab2-9fb5-42dd-8038-5a12474300ce,21,5:04,Ethan Thompson misses two point driving floating jump shot,twopointmiss,11,,basketball_play,1775604227,403,True,2026-04-07 23:23:47+00:00,1,304.0,416.0,6.933333333333334,59
4,54,quarter,1,29e3c04e-fadb-4006-be20-cbb8c159ce0e,21,5:02,Naz Reid defensive rebound,rebound,11,29e3c04e-fadb-4006-be20-cbb8c159ce0e,basketball_play,1775604229,402,True,2026-04-07 23:23:49+00:00,1,302.0,418.0,6.966666666666667,60
4,53,quarter,1,29e3c04e-fadb-4006-be20-cbb8c159ce0e,21,4:55,Bones Hyland misses two point driving finger roll layup,twopointmiss,11,,basketball_play,1775604236,401,True,2026-04-07 23:23:56+00:00,1,295.0,425.0,7.083333333333333,61
4,52,quarter,1,d059bab2-9fb5-42dd-8038-5a12474300ce,21,4:54,Ethan Thompson defensive rebound,rebound,11,d059bab2-9fb5-42dd-8038-5a12474300ce,basketball_play,1775604237,400,True,2026-04-07 23:23:57+00:00,1,294.0,426.0,7.1,62
4,51,quarter,1,29e3c04e-fadb-4006-be20-cbb8c159ce0e,21,4:49,Naz Reid personal foul (Jalen Slawson draws the foul),personalfoul,11,d059bab2-9fb5-42dd-8038-5a12474300ce,basketball_play,1775604245,399,True,2026-04-07 23:24:05+00:00,1,289.0,431.0,7.183333333333334,63
4,50,quarter,1,29e3c04e-fadb-4006-be20-cbb8c159ce0e,21,4:49,"Timberwolves lineup change (Julius Randle, Bones Hyland, Kyle Anderson, Naz Reid, Donte DiVincenzo)",lineupchange,11,,basketball_play,1775604276,398,True,2026-04-07 23:24:36+00:00,1,289.0,431.0,7.183333333333334,64
4,49,quarter,1,d059bab2-9fb5-42dd-8038-5a12474300ce,21,4:41,Kam Jones misses two point driving floating jump shot,twopointmiss,11,,basketball_play,1775604276,397,True,2026-04-07 23:24:36+00:00,1,281.0,439.0,7.316666666666666,65
4,48,quarter,1,d059bab2-9fb5-42dd-8038-5a12474300ce,21,4:40,Kam Jones offensive rebound,rebound,11,d059bab2-9fb5-42dd-8038-5a12474300ce,basketball_play,1775604277,396,True,2026-04-07 23:24:37+00:00,1,280.0,440.0,7.333333333333333,66
4,47,quarter,1,d059bab2-9fb5-42dd-8038-5a12474300ce,21,4:38,Kam Jones misses two point putback layup,twopointmiss,11,,basketball_play,1775604278,395,True,2026-04-07 23:24:38+00:00,1,278.0,442.0,7.366666666666666,67
4,46,quarter,1,29e3c04e-fadb-4006-be20-cbb8c159ce0e,21,4:36,Bones Hyland defensive rebound,rebound,11,29e3c04e-fadb-4006-be20-cbb8c159ce0e,basketball_play,1775604280,394,True,2026-04-07 23:24:40+00:00,1,276.0,444.0,7.4,68
4,45,quarter,1,29e3c04e-fadb-4006-be20-cbb8c159ce0e,23,4:23,Kyle Anderson makes two point driving floating bank jump shot,twopointmade,11,d059bab2-9fb5-42dd-8038-5a12474300ce,basketball_play,1775604293,393,True,2026-04-07 23:24:53+00:00,1,263.0,457.0,7.616666666666666,69
4,44,quarter,1,d059bab2-9fb5-42dd-8038-5a12474300ce,23,4:10,Kam Jones makes two point driving layup,twopointmade,13,29e3c04e-fadb-4006-be20-cbb8c159ce0e,basketball_play,1775604307,392,True,2026-04-07 23:25:07+00:00,1,250.0,470.0,7.833333333333333,70
4,43,quarter,1,d059bab2-9fb5-42dd-8038-5a12474300ce,23,3:54,Micah Potter shooting foul (Julius Randle draws the foul),shootingfoul,13,29e3c04e-fadb-4006-be20-cbb8c159ce0e,basketball_play,1775604325,391,True,2026-04-07 23:25:25+00:00,1,234.0,486.0,8.1,71
4,42,quarter,1,29e3c04e-fadb-4006-be20-cbb8c159ce0e,24,3:54,Julius Randle makes regular free throw 1 of 2,freethrowmade,13,29e3c04e-fadb-4006-be20-cbb8c159ce0e,basketball_play,1775604348,390,True,2026-04-07 23:25:48+00:00,1,234.0,486.0,8.1,72
4,41,quarter,1,29e3c04e-fadb-4006-be20-cbb8c159ce0e,25,3:54,Julius Randle makes regular free throw 2 of 2,freethrowmade,13,d059bab2-9fb5-42dd-8038-5a12474300ce,basketball_play,1775604367,389,True,2026-04-07 23:26:07+00:00,1,234.0,486.0,8.1,73
4,40,quarter,1,d059bab2-9fb5-42dd-8038-5a12474300ce,25,3:47,Obi Toppin turnover (bad pass) (Naz Reid steals),turnover,13,29e3c04e-fadb-4006-be20-cbb8c159ce0e,basketball_play,1775604375,388,True,2026-04-07 23:26:15+00:00,1,227.0,493.0,8.216666666666667,74
4,39,quarter,1,29e3c04e-fadb-4006-be20-cbb8c159ce0e,27,3:43,Bones Hyland makes two point running layup (Naz Reid assists),twopointmade,13,d059bab2-9fb5-42dd-8038-5a12474300ce,basketball_play,1775604380,387,True,2026-04-07 23:26:20+00:00,1,223.0,497.0,8.283333333333333,75
4,38,quarter,1,29e3c04e-fadb-4006-be20-cbb8c159ce0e,27,3:36,Kyle Anderson shooting foul (Micah Potter draws the foul),shootingfoul,13,d059bab2-9fb5-42dd-8038-5a12474300ce,basketball_play,1775604393,386,True,2026-04-07 23:26:33+00:00,1,216.0,504.0,8.4,76
4,37,quarter,1,d059bab2-9fb5-42dd-8038-5a12474300ce,27,3:36,Micah Potter makes regular free throw 1 of 2,freethrowmade,14,d059bab2-9fb5-42dd-8038-5a12474300ce,basketball_play,1775604421,385,True,2026-04-07 23:27:01+00:00,1,216.0,504.0,8.4,77
4,36,quarter,1,29e3c04e-fadb-4006-be20-cbb8c159ce0e,27,3:36,"Timberwolves lineup change (Bones Hyland, Kyle Anderson, Jaylen Clark, Naz Reid, Donte DiVincenzo)",lineupchange,14,,basketball_play,1775604444,384,True,2026-04-07 23:27:24+00:00,1,216.0,504.0,8.4,78
4,35,quarter,1,d059bab2-9fb5-42dd-8038-5a12474300ce,27,3:36,Micah Potter misses regular free throw 2 of 2,freethrowmiss,14,,basketball_play,1775604421,383,True,2026-04-07 23:27:01+00:00,1,216.0,504.0,8.4,79
4,34,quarter,1,29e3c04e-fadb-4006-be20-cbb8c159ce0e,27,3:35,Timberwolves defensive rebound,rebound,14,29e3c04e-fadb-4006-be20-cbb8c159ce0e,basketball_play,1775604422,382,True,2026-04-07 23:27:02+00:00,1,215.0,505.0,8.416666666666666,80
4,33,quarter,1,,27,3:35,Stoppage (Out of bounds),stoppage,14,,basketball_play,1775604448,381,True,2026-04-07 23:27:28+00:00,1,215.0,505.0,8.416666666666666,81
4,32,quarter,1,29e3c04e-fadb-4006-be20-cbb8c159ce0e,27,3:12,Jaylen Clark misses two point driving floating jump shot,twopointmiss,14,,basketball_play,1775604478,380,True,2026-04-07 23:27:58+00:00,1,192.0,528.0,8.8,82
4,31,quarter,1,29e3c04e-fadb-4006-be20-cbb8c159ce0e,27,3:10,Naz Reid offensive rebound,rebound,14,29e3c04e-fadb-4006-be20-cbb8c159ce0e,basketball_play,1775604480,379,True,2026-04-07 23:28:00+00:00,1,190.0,530.0,8.833333333333334,83
4,30,quarter,1,29e3c04e-fadb-4006-be20-cbb8c159ce0e,29,3:10,Naz Reid makes two point putback layup,twopointmade,14,d059bab2-9fb5-42dd-8038-5a12474300ce,basketball_play,1775604482,378,True,2026-04-07 23:28:02+00:00,1,190.0,530.0,8.833333333333334,84
4,29,quarter,1,29e3c04e-fadb-4006-be20-cbb8c159ce0e,29,3:02,Donte DiVincenzo shooting foul (Obi Toppin draws the foul),shootingfoul,14,d059bab2-9fb5-42dd-8038-5a12474300ce,basketball_play,1775604490,377,True,2026-04-07 23:28:10+00:00,1,182.0,538.0,8.966666666666667,85
4,28,quarter,1,d059bab2-9fb5-42dd-8038-5a12474300ce,29,3:02,Obi Toppin makes regular free throw 1 of 2,freethrowmade,15,d059bab2-9fb5-42dd-8038-5a12474300ce,basketball_play,1775604515,376,True,2026-04-07 23:28:35+00:00,1,182.0,538.0,8.966666666666667,86
4,27,quarter,1,29e3c04e-fadb-4006-be20-cbb8c159ce0e,29,3:02,"Timberwolves lineup change (Bones Hyland, Kyle Anderson, Rudy Gobert, Jaylen Clark, Naz Reid)",lineupchange,15,,basketball_play,1775604542,375,True,2026-04-07 23:29:02+00:00,1,182.0,538.0,8.966666666666667,87
4,26,quarter,1,d059bab2-9fb5-42dd-8038-5a12474300ce,29,3:02,Obi Toppin makes regular free throw 2 of 2,freethrowmade,16,29e3c04e-fadb-4006-be20-cbb8c159ce0e,basketball_play,1775604542,374,True,2026-04-07 23:29:02+00:00,1,182.0,538.0,8.966666666666667,88
4,25,quarter,1,29e3c04e-fadb-4006-be20-cbb8c159ce0e,29,2:38,Timberwolves turnover (shot clock violation),turnover,16,d059bab2-9fb5-42dd-8038-5a12474300ce,basketball_play,1775604573,373,True,2026-04-07 23:29:33+00:00,1,158.0,562.0,9.366666666666667,89
4,24,quarter,1,29e3c04e-fadb-4006-be20-cbb8c159ce0e,29,2:38,Timberwolves 60 second timeout,teamtimeout,16,,basketball_play,1775604577,372,True,2026-04-07 23:29:37+00:00,1,158.0,562.0,9.366666666666667,90
4,23,quarter,1,d059bab2-9fb5-42dd-8038-5a12474300ce,29,2:38,"Pacers lineup change (Kam Jones, Jalen Slawson, Obi Toppin, Taelon Peter, Micah Potter)",lineupchange,16,,basketball_play,1775604768,371,True,2026-04-07 23:32:48+00:00,1,158.0,562.0,9.366666666666667,91
4,22,quarter,1,d059bab2-9fb5-42dd-8038-5a12474300ce,29,2:27,Micah Potter misses three point jump shot,threepointmiss,16,,basketball_play,1775604768,370,True,2026-04-07 23:32:48+00:00,1,147.0,573.0,9.55,92
4,21,quarter,1,29e3c04e-fadb-4006-be20-cbb8c159ce0e,29,2:23,Bones Hyland defensive rebound,rebound,16,29e3c04e-fadb-4006-be20-cbb8c159ce0e,basketball_play,1775604772,369,True,2026-04-07 23:32:52+00:00,1,143.0,577.0,9.616666666666667,93
4,20,quarter,1,29e3c04e-fadb-4006-be20-cbb8c159ce0e,29,2:16,Bones Hyland misses three point pullup jump shot,threepointmiss,16,,basketball_play,1775604778,368,True,2026-04-07 23:32:58+00:00,1,136.0,584.0,9.733333333333333,94
4,19,quarter,1,d059bab2-9fb5-42dd-8038-5a12474300ce,29,2:14,Obi Toppin defensive rebound,rebound,16,d059bab2-9fb5-42dd-8038-5a12474300ce,basketball_play,1775604780,367,True,2026-04-07 23:33:00+00:00,1,134.0,586.0,9.766666666666667,95
4,18,quarter,1,d059bab2-9fb5-42dd-8038-5a12474300ce,29,2:08,Jalen Slawson makes two point running finger roll layup (Obi Toppin assists),twopointmade,18,29e3c04e-fadb-4006-be20-cbb8c159ce0e,basketball_play,1775604786,366,True,2026-04-07 23:33:06+00:00,1,128.0,592.0,9.866666666666667,96
4,17,quarter,1,29e3c04e-fadb-4006-be20-cbb8c159ce0e,29,1:48,Naz Reid turnover (lost ball) (Taelon Peter steals),turnover,18,d059bab2-9fb5-42dd-8038-5a12474300ce,basketball_play,1775604807,365,True,2026-04-07 23:33:27+00:00,1,108.0,612.0,10.2,97
4,16,quarter,1,d059bab2-9fb5-42dd-8038-5a12474300ce,29,1:44,Micah Potter makes two point running dunk (Kam Jones assists),twopointmade,20,29e3c04e-fadb-4006-be20-cbb8c159ce0e,basketball_play,1775604811,364,True,2026-04-07 23:33:31+00:00,1,104.0,616.0,10.266666666666667,98
4,15,quarter,1,,29,1:43,Stoppage (Other),stoppage,20,,basketball_play,1775604816,363,True,2026-04-07 23:33:36+00:00,1,103.0,617.0,10.283333333333333,99
4,14,quarter,1,29e3c04e-fadb-4006-be20-cbb8c159ce0e,31,1:27,Naz Reid makes two point driving floating jump shot,twopointmade,20,d059bab2-9fb5-42dd-8038-5a12474300ce,basketball_play,1775604835,362,True,2026-04-07 23:33:55+00:00,1,87.0,633.0,10.55,100
4,13,quarter,1,29e3c04e-fadb-4006-be20-cbb8c159ce0e,31,1:10,Jaylen Clark personal foul (Micah Potter draws the foul),personalfoul,20,d059bab2-9fb5-42dd-8038-5a12474300ce,basketball_play,1775604854,361,True,2026-04-07 23:34:14+00:00,1,70.0,650.0,10.833333333333334,101
4,12,quarter,1,d059bab2-9fb5-42dd-8038-5a12474300ce,31,1:10,Micah Potter misses regular free throw 1 of 2,freethrowmiss,20,d059bab2-9fb5-42dd-8038-5a12474300ce,basketball_play,1775604889,360,True,2026-04-07 23:34:49+00:00,1,70.0,650.0,10.833333333333334,102
4,11,quarter,1,d059bab2-9fb5-42dd-8038-5a12474300ce,31,1:10,Pacers offensive rebound,rebound,20,d059bab2-9fb5-42dd-8038-5a12474300ce,basketball_play,1775604889,359,True,2026-04-07 23:34:49+00:00,1,70.0,650.0,10.833333333333334,103
4,10,quarter,1,d059bab2-9fb5-42dd-8038-5a12474300ce,31,1:10,Micah Potter makes regular free throw 2 of 2,freethrowmade,21,29e3c04e-fadb-4006-be20-cbb8c159ce0e,basketball_play,1775604911,358,True,2026-04-07 23:35:11+00:00,1,70.0,650.0,10.833333333333334,104
4,9,quarter,1,29e3c04e-fadb-4006-be20-cbb8c159ce0e,31,00:53.50,Jaylen Clark misses two point driving floating jump shot,twopointmiss,21,,basketball_play,1775604929,357,True,2026-04-07 23:35:29+00:00,1,53.5,666.5,11.108333333333333,105
4,8,quarter,1,d059bab2-9fb5-42dd-8038-5a12474300ce,31,00:52.80,Micah Potter defensive rebound,rebound,21,d059bab2-9fb5-42dd-8038-5a12474300ce,basketball_play,1775604930,356,True,2026-04-07 23:35:30+00:00,1,52.8,667.2,11.120000000000001,106
4,7,quarter,1,d059bab2-9fb5-42dd-8038-5a12474300ce,31,00:50.10,Micah Potter turnover (bad pass) (Bones Hyland steals),turnover,21,29e3c04e-fadb-4006-be20-cbb8c159ce0e,basketball_play,1775604933,355,True,2026-04-07 23:35:33+00:00,1,50.1,669.9,11.165,107
