period_index,event_index,period_type,period_number,attribution,away_points,clock,description,event_type,home_points,possession,type,wall_clock,pbp_source_row,has_wall_clock,event_ts_utc,period_sequence,game_clock_seconds_remaining,game_elapsed_seconds,game_elapsed_minutes,pbp_chronological_index
4,12,quarter,1,2229b01e-68eb-46ad-adf4-71a9533c84fc,23,1:07,Trail Blazers offensive rebound,rebound,27,2229b01e-68eb-46ad-adf4-71a9533c84fc,basketball_play,1775700389,353,True,2026-04-09 02:06:29+00:00,1,67.0,653.0,10.883333333333333,108
4,11,quarter,1,2229b01e-68eb-46ad-adf4-71a9533c84fc,23,1:07,Robert Williams III misses regular free throw 2 of 2,freethrowmiss,27,,basketball_play,1775700389,352,True,2026-04-09 02:06:29+00:00,1,67.0,653.0,10.883333333333333,109
4,10,quarter,1,ad36c3e8-4194-4e63-920f-7c50f46191a6,23,1:05,Keldon Johnson defensive rebound,rebound,27,ad36c3e8-4194-4e63-920f-7c50f46191a6,basketball_play,1775700391,351,True,2026-04-09 02:06:31+00:00,1,65.0,655.0,10.916666666666666,110
4,9,quarter,1,ad36c3e8-4194-4e63-920f-7c50f46191a6,23,00:53,Carter Bryant makes two point layup (Dylan Harper assists),twopointmade,29,2229b01e-68eb-46ad-adf4-71a9533c84fc,basketball_play,1775700419,350,True,2026-04-09 02:06:59+00:00,1,53.0,667.0,11.116666666666667,111
4,8,quarter,1,2229b01e-68eb-46ad-adf4-71a9533c84fc,23,00:33.70,Scoot Henderson misses two point driving floating jump shot,twopointmiss,29,,basketball_play,1775700442,349,True,2026-04-09 02:07:22+00:00,1,33.7,686.3,11.438333333333333,112
4,7,quarter,1,2229b01e-68eb-46ad-adf4-71a9533c84fc,23,00:32.30,Robert Williams III offensive rebound,rebound,29,2229b01e-68eb-46ad-adf4-71a9533c84fc,basketball_play,1775700443,348,True,2026-04-09 02:07:23+00:00,1,32.3,687.7,11.461666666666668,113
4,6,quarter,1,2229b01e-68eb-46ad-adf4-71a9533c84fc,23,00:32.30,Robert Williams III misses two point tip dunk,twopointmiss,29,,basketball_play,1775700446,347,True,2026-04-09 02:07:26+00:00,1,32.3,687.7,11.461666666666668,114
4,5,quarter,1,ad36c3e8-4194-4e63-920f-7c50f46191a6,23,00:29.60,Julian Champagnie defensive rebound,rebound,29,ad36c3e8-4194-4e63-920f-7c50f46191a6,basketball_play,1775700448,346,True,2026-04-09 02:07:28+00:00,1,29.6,690.4,11.506666666666666,115
4,4,quarter,1,ad36c3e8-4194-4e63-920f-7c50f46191a6,23,00:09.70,Dylan Harper makes three point stepback jump shot,threepointmade,32,2229b01e-68eb-46ad-adf4-71a9533c84fc,basketball_play,1775700465,345,True,2026-04-09 02:07:45+00:00,1,9.7,710.3,11.838333333333333,116
4,3,quarter,1,2229b01e-68eb-46ad-adf4-71a9533c84fc,23,00:00,Scoot Henderson misses three point stepback jump shot,threepointmiss,32,,basketball_play,1775700479,344,True,2026-04-09 02:07:59+00:00,1,0.0,720.0,12.0,117
4,2,quarter,1,2229b01e-68eb-46ad-adf4-71a9533c84fc,23,00:00,Trail Blazers offensive rebound,rebound,32,2229b01e-68eb-46ad-adf4-71a9533c84fc,basketball_play,1775700479,343,True,2026-04-09 02:07:59+00:00,1,0.0,720.0,12.0,118
4,1,quarter,1,,23,00:00,End of 1st Quarter.,endperiod,32,,basketball_play,1775700484,342,True,2026-04-09 02:08:04+00:00,1,0.0,720.0,12.0,119
3,130,quarter,2,2229b01e-68eb-46ad-adf4-71a9533c84fc,23,12:00,"Trail Blazers lineup change (Jrue Holiday, Robert Williams III, Scoot Henderson, Sidy Cissoko, Deni Avdija)",lineupchange,32,,basketball_play,1775700634,341,True,2026-04-09 02:10:34+00:00,2,720.0,720.0,12.0,120
3,129,quarter,2,,23,12:00,Start of 2nd Quarter,startperiod,32,,basketball_play,1775700701,340,True,2026-04-09 02:11:41+00:00,2,720.0,720.0,12.0,121
3,128,quarter,2,2229b01e-68eb-46ad-adf4-71a9533c84fc,23,11:48,Scoot Henderson misses three point jump shot,threepointmiss,32,,basketball_play,1775700714,339,True,2026-04-09 02:11:54+00:00,2,708.0,732.0,12.2,122
3,127,quarter,2,ad36c3e8-4194-4e63-920f-7c50f46191a6,23,11:46,Julian Champagnie defensive rebound,rebound,32,ad36c3e8-4194-4e63-920f-7c50f46191a6,basketball_play,1775700716,338,True,2026-04-09 02:11:56+00:00,2,706.0,734.0,12.233333333333333,123
3,126,quarter,2,ad36c3e8-4194-4e63-920f-7c50f46191a6,23,11:41,Keldon Johnson makes two point running pullup jump shot,twopointmade,34,2229b01e-68eb-46ad-adf4-71a9533c84fc,basketball_play,1775700722,337,True,2026-04-09 02:12:02+00:00,2,701.0,739.0,12.316666666666666,124
3,125,quarter,2,2229b01e-68eb-46ad-adf4-71a9533c84fc,25,11:26,Jrue Holiday makes two point driving layup,twopointmade,34,ad36c3e8-4194-4e63-920f-7c50f46191a6,basketball_play,1775700734,336,True,2026-04-09 02:12:14+00:00,2,686.0,754.0,12.566666666666666,125
3,124,quarter,2,ad36c3e8-4194-4e63-920f-7c50f46191a6,25,11:13,Keldon Johnson turnover (traveling),turnover,34,2229b01e-68eb-46ad-adf4-71a9533c84fc,basketball_play,1775700750,335,True,2026-04-09 02:12:30+00:00,2,673.0,767.0,12.783333333333333,126
3,123,quarter,2,2229b01e-68eb-46ad-adf4-71a9533c84fc,25,11:06,Jrue Holiday offensive foul (Keldon Johnson draws the foul),offensivefoul,34,ad36c3e8-4194-4e63-920f-7c50f46191a6,basketball_play,1775700770,334,True,2026-04-09 02:12:50+00:00,2,666.0,774.0,12.9,127
3,122,quarter,2,2229b01e-68eb-46ad-adf4-71a9533c84fc,25,11:06,Jrue Holiday turnover (offensive foul),turnover,34,ad36c3e8-4194-4e63-920f-7c50f46191a6,basketball_play,1775700770,333,True,2026-04-09 02:12:50+00:00,2,666.0,774.0,12.9,128
3,121,quarter,2,2229b01e-68eb-46ad-adf4-71a9533c84fc,25,11:06,"Trail Blazers lineup change (Toumani Camara, Jrue Holiday, Robert Williams III, Sidy Cissoko, Deni Avdija)",lineupchange,34,,basketball_play,1775700807,332,True,2026-04-09 02:13:27+00:00,2,666.0,774.0,12.9,129
3,120,quarter,2,2229b01e-68eb-46ad-adf4-71a9533c84fc,25,10:51,Deni Avdija shooting foul (Harrison Barnes draws the foul),shootingfoul,34,ad36c3e8-4194-4e63-920f-7c50f46191a6,basketball_play,1775700807,331,True,2026-04-09 02:13:27+00:00,2,651.0,789.0,13.15,130
3,119,quarter,2,ad36c3e8-4194-4e63-920f-7c50f46191a6,25,10:51,Harrison Barnes makes regular free throw 1 of 2,freethrowmade,35,ad36c3e8-4194-4e63-920f-7c50f46191a6,basketball_play,1775700833,330,True,2026-04-09 02:13:53+00:00,2,651.0,789.0,13.15,131
3,118,quarter,2,ad36c3e8-4194-4e63-920f-7c50f46191a6,25,10:51,Harrison Barnes makes regular free throw 2 of 2,freethrowmade,36,2229b01e-68eb-46ad-adf4-71a9533c84fc,basketball_play,1775700847,329,True,2026-04-09 02:14:07+00:00,2,651.0,789.0,13.15,132
3,117,quarter,2,ad36c3e8-4194-4e63-920f-7c50f46191a6,25,10:38,Carter Bryant shooting foul (Deni Avdija draws the foul),shootingfoul,36,2229b01e-68eb-46ad-adf4-71a9533c84fc,basketball_play,1775700863,328,True,2026-04-09 02:14:23+00:00,2,638.0,802.0,13.366666666666667,133
3,116,quarter,2,2229b01e-68eb-46ad-adf4-71a9533c84fc,25,10:38,Deni Avdija misses regular free throw 1 of 2,freethrowmiss,36,2229b01e-68eb-46ad-adf4-71a9533c84fc,basketball_play,1775700890,327,True,2026-04-09 02:14:50+00:00,2,638.0,802.0,13.366666666666667,134
3,115,quarter,2,2229b01e-68eb-46ad-adf4-71a9533c84fc,25,10:38,Trail Blazers offensive rebound,rebound,36,2229b01e-68eb-46ad-adf4-71a9533c84fc,basketball_play,1775700890,326,True,2026-04-09 02:14:50+00:00,2,638.0,802.0,13.366666666666667,135
3,114,quarter,2,2229b01e-68eb-46ad-adf4-71a9533c84fc,26,10:38,Deni Avdija makes regular free throw 2 of 2,freethrowmade,36,ad36c3e8-4194-4e63-920f-7c50f46191a6,basketball_play,1775700909,325,True,2026-04-09 02:15:09+00:00,2,638.0,802.0,13.366666666666667,136
3,113,quarter,2,ad36c3e8-4194-4e63-920f-7c50f46191a6,26,10:25,Julian Champagnie misses three point jump shot,threepointmiss,36,,basketball_play,1775700927,324,True,2026-04-09 02:15:27+00:00,2,625.0,815.0,13.583333333333334,137
3,112,quarter,2,2229b01e-68eb-46ad-adf4-71a9533c84fc,26,10:22,Toumani Camara defensive rebound,rebound,36,2229b01e-68eb-46ad-adf4-71a9533c84fc,basketball_play,1775700930,323,True,2026-04-09 02:15:30+00:00,2,622.0,818.0,13.633333333333333,138
3,111,quarter,2,2229b01e-68eb-46ad-adf4-71a9533c84fc,28,10:11,Jrue Holiday makes two point driving finger roll layup,twopointmade,36,ad36c3e8-4194-4e63-920f-7c50f46191a6,basketball_play,1775700941,322,True,2026-04-09 02:15:41+00:00,2,611.0,829.0,13.816666666666666,139
3,110,quarter,2,ad36c3e8-4194-4e63-920f-7c50f46191a6,28,9:53,Dylan Harper makes two point pullup jump shot,twopointmade,38,2229b01e-68eb-46ad-adf4-71a9533c84fc,basketball_play,1775700959,321,True,2026-04-09 02:15:59+00:00,2,593.0,847.0,14.116666666666667,140
3,109,quarter,2,2229b01e-68eb-46ad-adf4-71a9533c84fc,30,9:44,Robert Williams III makes two point alley-oop dunk (Jrue Holiday assists),twopointmade,38,ad36c3e8-4194-4e63-920f-7c50f46191a6,basketball_play,1775700969,320,True,2026-04-09 02:16:09+00:00,2,584.0,856.0,14.266666666666667,141
3,108,quarter,2,ad36c3e8-4194-4e63-920f-7c50f46191a6,30,9:27,Keldon Johnson misses two point turnaround bank jump shot,twopointmiss,38,,basketball_play,1775700988,319,True,2026-04-09 02:16:28+00:00,2,567.0,873.0,14.55,142
3,107,quarter,2,ad36c3e8-4194-4e63-920f-7c50f46191a6,30,9:24,Carter Bryant offensive rebound,rebound,38,ad36c3e8-4194-4e63-920f-7c50f46191a6,basketball_play,1775700991,318,True,2026-04-09 02:16:31+00:00,2,564.0,876.0,14.6,143
3,106,quarter,2,ad36c3e8-4194-4e63-920f-7c50f46191a6,30,9:22,Keldon Johnson misses three point pullup jump shot,threepointmiss,38,,basketball_play,1775700994,317,True,2026-04-09 02:16:34+00:00,2,562.0,878.0,14.633333333333333,144
3,105,quarter,2,ad36c3e8-4194-4e63-920f-7c50f46191a6,30,9:18,Spurs offensive rebound,rebound,38,ad36c3e8-4194-4e63-920f-7c50f46191a6,basketball_play,1775700998,316,True,2026-04-09 02:16:38+00:00,2,558.0,882.0,14.7,145
3,104,quarter,2,2229b01e-68eb-46ad-adf4-71a9533c84fc,30,9:18,Sidy Cissoko personal foul (Loose ball) (Julian Champagnie draws the foul),personalfoul,38,ad36c3e8-4194-4e63-920f-7c50f46191a6,basketball_play,1775700999,315,True,2026-04-09 02:16:39+00:00,2,558.0,882.0,14.7,146
3,103,quarter,2,2229b01e-68eb-46ad-adf4-71a9533c84fc,30,9:18,"Trail Blazers lineup change (Toumani Camara, Jrue Holiday, Donovan Clingan, Sidy Cissoko, Deni Avdija)",lineupchange,38,,basketball_play,1775701007,314,True,2026-04-09 02:16:47+00:00,2,558.0,882.0,14.7,147
3,102,quarter,2,ad36c3e8-4194-4e63-920f-7c50f46191a6,30,9:18,"Spurs lineup change (Harrison Barnes, De'Aaron Fox, Carter Bryant, Luke Kornet, Julian Champagnie)",lineupchange,38,,basketball_play,1775701007,313,True,2026-04-09 02:16:47+00:00,2,558.0,882.0,14.7,148
3,101,quarter,2,ad36c3e8-4194-4e63-920f-7c50f46191a6,30,9:07,Harrison Barnes misses three point fadeaway jump shot,threepointmiss,38,,basketball_play,1775701044,312,True,2026-04-09 02:17:24+00:00,2,547.0,893.0,14.883333333333333,149
3,100,quarter,2,2229b01e-68eb-46ad-adf4-71a9533c84fc,30,9:05,Jrue Holiday defensive rebound,rebound,38,2229b01e-68eb-46ad-adf4-71a9533c84fc,basketball_play,1775701046,311,True,2026-04-09 02:17:26+00:00,2,545.0,895.0,14.916666666666666,150
3,99,quarter,2,2229b01e-68eb-46ad-adf4-71a9533c84fc,30,8:47,Deni Avdija turnover (bad pass) (Harrison Barnes steals),turnover,38,ad36c3e8-4194-4e63-920f-7c50f46191a6,basketball_play,1775701062,310,True,2026-04-09 02:17:42+00:00,2,527.0,913.0,15.216666666666667,151
3,98,quarter,2,2229b01e-68eb-46ad-adf4-71a9533c84fc,30,8:39,Jrue Holiday shooting foul (Harrison Barnes draws the foul),shootingfoul,38,ad36c3e8-4194-4e63-920f-7c50f46191a6,basketball_play,1775701073,309,True,2026-04-09 02:17:53+00:00,2,519.0,921.0,15.35,152
3,97,quarter,2,ad36c3e8-4194-4e63-920f-7c50f46191a6,30,8:39,Harrison Barnes makes regular free throw 1 of 2,freethrowmade,39,ad36c3e8-4194-4e63-920f-7c50f46191a6,basketball_play,1775701100,308,True,2026-04-09 02:18:20+00:00,2,519.0,921.0,15.35,153
3,96,quarter,2,2229b01e-68eb-46ad-adf4-71a9533c84fc,30,8:39,"Trail Blazers lineup change (Toumani Camara, Donovan Clingan, Sidy Cissoko, Matisse Thybulle, Deni Avdija)",lineupchange,39,,basketball_play,1775701101,307,True,2026-04-09 02:18:21+00:00,2,519.0,921.0,15.35,154
3,95,quarter,2,ad36c3e8-4194-4e63-920f-7c50f46191a6,30,8:39,"Spurs lineup change (Harrison Barnes, Jordan McLaughlin, De'Aaron Fox, Carter Bryant, Luke Kornet)",lineupchange,39,,basketball_play,1775701101,306,True,2026-04-09 02:18:21+00:00,2,519.0,921.0,15.35,155
3,94,quarter,2,ad36c3e8-4194-4e63-920f-7c50f46191a6,30,8:39,Harrison Barnes makes regular free throw 2 of 2,freethrowmade,40,2229b01e-68eb-46ad-adf4-71a9533c84fc,basketball_play,1775701119,305,True,2026-04-09 02:18:39+00:00,2,519.0,921.0,15.35,156
3,93,quarter,2,2229b01e-68eb-46ad-adf4-71a9533c84fc,32,8:29,Deni Avdija makes two point driving finger roll layup,twopointmade,40,ad36c3e8-4194-4e63-920f-7c50f46191a6,basketball_play,1775701130,304,True,2026-04-09 02:18:50+00:00,2,509.0,931.0,15.516666666666667,157
3,92,quarter,2,ad36c3e8-4194-4e63-920f-7c50f46191a6,32,8:15,Harrison Barnes makes two point fadeaway jump shot (Luke Kornet assists),twopointmade,42,2229b01e-68eb-46ad-adf4-71a9533c84fc,basketball_play,1775701145,303,True,2026-04-09 02:19:05+00:00,2,495.0,945.0,15.75,158
3,91,quarter,2,2229b01e-68eb-46ad-adf4-71a9533c84fc,32,8:02,Donovan Clingan misses three point jump shot,threepointmiss,42,,basketball_play,1775701157,302,True,2026-04-09 02:19:17+00:00,2,482.0,958.0,15.966666666666667,159
3,90,quarter,2,ad36c3e8-4194-4e63-920f-7c50f46191a6,32,7:59,Jordan McLaughlin defensive rebound,rebound,42,ad36c3e8-4194-4e63-920f-7c50f46191a6,basketball_play,1775701160,301,True,2026-04-09 02:19:20+00:00,2,479.0,961.0,16.016666666666666,160
3,89,quarter,2,ad36c3e8-4194-4e63-920f-7c50f46191a6,32,7:46,Harrison Barnes turnover (bad pass) (Toumani Camara steals),turnover,42,2229b01e-68eb-46ad-adf4-71a9533c84fc,basketball_play,1775701172,300,True,2026-04-09 02:19:32+00:00,2,466.0,974.0,16.233333333333334,161
3,88,quarter,2,2229b01e-68eb-46ad-adf4-71a9533c84fc,34,7:43,Toumani Camara makes two point running alley-oop dunk (Deni Avdija assists),twopointmade,42,ad36c3e8-4194-4e63-920f-7c50f46191a6,basketball_play,1775701177,299,True,2026-04-09 02:19:37+00:00,2,463.0,977.0,16.283333333333335,162
3,87,quarter,2,2229b01e-68eb-46ad-adf4-71a9533c84fc,34,7:36,Sidy Cissoko personal foul (De'Aaron Fox draws the foul),personalfoul,42,ad36c3e8-4194-4e63-920f-7c50f46191a6,basketball_play,1775701188,298,True,2026-04-09 02:19:48+00:00,2,456.0,984.0,16.4,163
3,86,quarter,2,ad36c3e8-4194-4e63-920f-7c50f46191a6,34,7:30,De'Aaron Fox misses two point driving floating jump shot,twopointmiss,42,,basketball_play,1775701220,297,True,2026-04-09 02:20:20+00:00,2,450.0,990.0,16.5,164
3,85,quarter,2,2229b01e-68eb-46ad-adf4-71a9533c84fc,34,7:28,Trail Blazers defensive rebound,rebound,42,2229b01e-68eb-46ad-adf4-71a9533c84fc,basketball_play,1775701222,296,True,2026-04-09 02:20:22+00:00,2,448.0,992.0,16.533333333333335,165
3,84,quarter,2,ad36c3e8-4194-4e63-920f-7c50f46191a6,34,7:28,De'Aaron Fox personal foul (Loose ball) (Donovan Clingan draws the foul),personalfoul,42,2229b01e-68eb-46ad-adf4-71a9533c84fc,basketball_play,1775701226,295,True,2026-04-09 02:20:26+00:00,2,448.0,992.0,16.533333333333335,166
3,83,quarter,2,2229b01e-68eb-46ad-adf4-71a9533c84fc,34,7:12,Toumani Camara misses three point jump shot,threepointmiss,42,,basketball_play,1775701255,294,True,2026-04-09 02:20:55+00:00,2,432.0,1008.0,16.8,167
3,82,quarter,2,ad36c3e8-4194-4e63-920f-7c50f46191a6,34,7:08,De'Aaron Fox defensive rebound,rebound,42,ad36c3e8-4194-4e63-920f-7c50f46191a6,basketball_play,1775701259,293,True,2026-04-09 02:20:59+00:00,2,428.0,1012.0,16.866666666666667,168
3,81,quarter,2,ad36c3e8-4194-4e63-920f-7c50f46191a6,34,6:59,Luke Kornet makes two point reverse layup (Carter Bryant assists),twopointmade,44,2229b01e-68eb-46ad-adf4-71a9533c84fc,basketball_play,1775701269,292,True,2026-04-09 02:21:09+00:00,2,419.0,1021.0,17.016666666666666,169
3,80,quarter,2,2229b01e-68eb-46ad-adf4-71a9533c84fc,36,6:45,Deni Avdija makes two point driving finger roll layup,twopointmade,44,ad36c3e8-4194-4e63-920f-7c50f46191a6,basketball_play,1775701282,291,True,2026-04-09 02:21:22+00:00,2,405.0,1035.0,17.25,170
3,79,quarter,2,ad36c3e8-4194-4e63-920f-7c50f46191a6,36,6:35,Harrison Barnes offensive foul (Sidy Cissoko draws the foul),offensivefoul,44,2229b01e-68eb-46ad-adf4-71a9533c84fc,basketball_play,1775701299,290,True,2026-04-09 02:21:39+00:00,2,395.0,1045.0,17.416666666666668,171
3,78,quarter,2,ad36c3e8-4194-4e63-920f-7c50f46191a6,36,6:35,Harrison Barnes turnover (offensive foul),turnover,44,2229b01e-68eb-46ad-adf4-71a9533c84fc,basketball_play,1775701299,289,True,2026-04-09 02:21:39+00:00,2,395.0,1045.0,17.416666666666668,172
3,77,quarter,2,ad36c3e8-4194-4e63-920f-7c50f46191a6,36,6:35,Spurs 60 second timeout,teamtimeout,44,,basketball_play,1775701340,288,True,2026-04-09 02:22:20+00:00,2,395.0,1045.0,17.416666666666668,173
3,76,quarter,2,2229b01e-68eb-46ad-adf4-71a9533c84fc,36,6:35,"Trail Blazers lineup change (Kris Murray, Toumani Camara, Donovan Clingan, Matisse Thybulle, Deni Avdija)",lineupchange,44,,basketball_play,1775701478,287,True,2026-04-09 02:24:38+00:00,2,395.0,1045.0,17.416666666666668,174
3,75,quarter,2,ad36c3e8-4194-4e63-920f-7c50f46191a6,36,6:35,"Spurs lineup change (Harrison Barnes, Jordan McLaughlin, Devin Vassell, De'Aaron Fox, Luke Kornet)",lineupchange,44,,basketball_play,1775701478,286,True,2026-04-09 02:24:38+00:00,2,395.0,1045.0,17.416666666666668,175
3,74,quarter,2,2229b01e-68eb-46ad-adf4-71a9533c84fc,38,6:13,Deni Avdija makes two point cutting finger roll layup (Donovan Clingan assists),twopointmade,44,ad36c3e8-4194-4e63-920f-7c50f46191a6,basketball_play,1775701534,285,True,2026-04-09 02:25:34+00:00,2,373.0,1067.0,17.783333333333335,176
3,73,quarter,2,ad36c3e8-4194-4e63-920f-7c50f46191a6,38,5:53,Devin Vassell makes two point fadeaway jump shot (Luke Kornet assists),twopointmade,46,2229b01e-68eb-46ad-adf4-71a9533c84fc,basketball_play,1775701553,284,True,2026-04-09 02:25:53+00:00,2,353.0,1087.0,18.116666666666667,177
3,72,quarter,2,2229b01e-68eb-46ad-adf4-71a9533c84fc,38,5:42,Deni Avdija turnover (bad pass),turnover,46,ad36c3e8-4194-4e63-920f-7c50f46191a6,basketball_play,1775701569,283,True,2026-04-09 02:26:09+00:00,2,342.0,1098.0,18.3,178
3,71,quarter,2,2229b01e-68eb-46ad-adf4-71a9533c84fc,38,5:42,Matisse Thybulle personal foul (Loose ball) (Jordan McLaughlin draws the foul),personalfoul,46,ad36c3e8-4194-4e63-920f-7c50f46191a6,basketball_play,1775701572,282,True,2026-04-09 02:26:12+00:00,2,342.0,1098.0,18.3,179
3,70,quarter,2,ad36c3e8-4194-4e63-920f-7c50f46191a6,38,5:42,Jordan McLaughlin makes regular free throw 1 of 2,freethrowmade,47,ad36c3e8-4194-4e63-920f-7c50f46191a6,basketball_play,1775701598,281,True,2026-04-09 02:26:38+00:00,2,342.0,1098.0,18.3,180
3,69,quarter,2,2229b01e-68eb-46ad-adf4-71a9533c84fc,38,5:42,"Trail Blazers lineup change (Kris Murray, Toumani Camara, Scoot Henderson, Donovan Clingan, Matisse Thybulle)",lineupchange,47,,basketball_play,1775701599,280,True,2026-04-09 02:26:39+00:00,2,342.0,1098.0,18.3,181
3,68,quarter,2,ad36c3e8-4194-4e63-920f-7c50f46191a6,38,5:42,"Spurs lineup change (Jordan McLaughlin, Devin Vassell, De'Aaron Fox, Luke Kornet, Keldon Johnson)",lineupchange,47,,basketball_play,1775701599,279,True,2026-04-09 02:26:39+00:00,2,342.0,1098.0,18.3,182
3,67,quarter,2,ad36c3e8-4194-4e63-920f-7c50f46191a6,38,5:42,Jordan McLaughlin makes regular free throw 2 of 2,freethrowmade,48,2229b01e-68eb-46ad-adf4-71a9533c84fc,basketball_play,1775701623,278,True,2026-04-09 02:27:03+00:00,2,342.0,1098.0,18.3,183
3,66,quarter,2,2229b01e-68eb-46ad-adf4-71a9533c84fc,38,5:23,Scoot Henderson misses two point pullup jump shot,twopointmiss,48,,basketball_play,1775701599,277,True,2026-04-09 02:26:39+00:00,2,323.0,1117.0,18.616666666666667,184
3,65,quarter,2,ad36c3e8-4194-4e63-920f-7c50f46191a6,38,5:21,Devin Vassell defensive rebound,rebound,48,ad36c3e8-4194-4e63-920f-7c50f46191a6,basketball_play,1775701601,276,True,2026-04-09 02:26:41+00:00,2,321.0,1119.0,18.65,185
3,64,quarter,2,ad36c3e8-4194-4e63-920f-7c50f46191a6,38,5:14,De'Aaron Fox makes two point pullup bank jump shot,twopointmade,50,2229b01e-68eb-46ad-adf4-71a9533c84fc,basketball_play,1775701656,275,True,2026-04-09 02:27:36+00:00,2,314.0,1126.0,18.766666666666666,186
3,63,quarter,2,2229b01e-68eb-46ad-adf4-71a9533c84fc,38,5:14,Kris Murray shooting foul (De'Aaron Fox draws the foul),shootingfoul,50,ad36c3e8-4194-4e63-920f-7c50f46191a6,basketball_play,1775701658,274,True,2026-04-09 02:27:38+00:00,2,314.0,1126.0,18.766666666666666,187
3,62,quarter,2,2229b01e-68eb-46ad-adf4-71a9533c84fc,38,5:14,Trail Blazers 60 second timeout,teamtimeout,50,,basketball_play,1775701670,273,True,2026-04-09 02:27:50+00:00,2,314.0,1126.0,18.766666666666666,188
3,61,quarter,2,2229b01e-68eb-46ad-adf4-71a9533c84fc,38,5:14,"Trail Blazers lineup change (Toumani Camara, Scoot Henderson, Donovan Clingan, Blake Wesley, Matisse Thybulle)",lineupchange,50,,basketball_play,1775701880,272,True,2026-04-09 02:31:20+00:00,2,314.0,1126.0,18.766666666666666,189
3,60,quarter,2,ad36c3e8-4194-4e63-920f-7c50f46191a6,38,5:14,De'Aaron Fox makes regular free throw 1 of 1,freethrowmade,51,,basketball_play,1775701880,271,True,2026-04-09 02:31:20+00:00,2,314.0,1126.0,18.766666666666666,190
3,59,quarter,2,2229b01e-68eb-46ad-adf4-71a9533c84fc,38,4:55,Matisse Thybulle misses two point driving floating bank jump shot,twopointmiss,51,,basketball_play,1775701901,270,True,2026-04-09 02:31:41+00:00,2,295.0,1145.0,19.083333333333332,191
3,58,quarter,2,ad36c3e8-4194-4e63-920f-7c50f46191a6,38,4:53,Devin Vassell defensive rebound,rebound,51,ad36c3e8-4194-4e63-920f-7c50f46191a6,basketball_play,1775701903,269,True,2026-04-09 02:31:43+00:00,2,293.0,1147.0,19.116666666666667,192
3,57,quarter,2,ad36c3e8-4194-4e63-920f-7c50f46191a6,38,4:42,De'Aaron Fox misses two point turnaround jump shot,twopointmiss,51,,basketball_play,1775701913,268,True,2026-04-09 02:31:53+00:00,2,282.0,1158.0,19.3,193
3,56,quarter,2,ad36c3e8-4194-4e63-920f-7c50f46191a6,38,4:40,Luke Kornet offensive rebound,rebound,51,ad36c3e8-4194-4e63-920f-7c50f46191a6,basketball_play,1775701915,267,True,2026-04-09 02:31:55+00:00,2,280.0,1160.0,19.333333333333332,194
3,55,quarter,2,ad36c3e8-4194-4e63-920f-7c50f46191a6,38,4:36,Keldon Johnson misses two point driving layup,twopointmiss,51,,basketball_play,1775701920,266,True,2026-04-09 02:32:00+00:00,2,276.0,1164.0,19.4,195
3,54,quarter,2,ad36c3e8-4194-4e63-920f-7c50f46191a6,38,4:35,Keldon Johnson offensive rebound,rebound,51,ad36c3e8-4194-4e63-920f-7c50f46191a6,basketball_play,1775701921,265,True,2026-04-09 02:32:01+00:00,2,275.0,1165.0,19.416666666666668,196
3,53,quarter,2,2229b01e-68eb-46ad-adf4-71a9533c84fc,38,4:34,Donovan Clingan shooting foul (Keldon Johnson draws the foul),shootingfoul,51,ad36c3e8-4194-4e63-920f-7c50f46191a6,basketball_play,1775701926,264,True,2026-04-09 02:32:06+00:00,2,274.0,1166.0,19.433333333333334,197
3,52,quarter,2,ad36c3e8-4194-4e63-920f-7c50f46191a6,38,4:34,Keldon Johnson makes regular free throw 1 of 2,freethrowmade,52,ad36c3e8-4194-4e63-920f-7c50f46191a6,basketball_play,1775701952,263,True,2026-04-09 02:32:32+00:00,2,274.0,1166.0,19.433333333333334,198
3,51,quarter,2,ad36c3e8-4194-4e63-920f-7c50f46191a6,38,4:34,"Spurs lineup change (Devin Vassell, De'Aaron Fox, Carter Bryant, Dylan Harper, Keldon Johnson)",lineupchange,52,,basketball_play,1775701952,262,True,2026-04-09 02:32:32+00:00,2,274.0,1166.0,19.433333333333334,199
3,50,quarter,2,ad36c3e8-4194-4e63-920f-7c50f46191a6,38,4:34,Keldon Johnson makes regular free throw 2 of 2,freethrowmade,53,2229b01e-68eb-46ad-adf4-71a9533c84fc,basketball_play,1775701977,261,True,2026-04-09 02:32:57+00:00,2,274.0,1166.0,19.433333333333334,200
3,49,quarter,2,2229b01e-68eb-46ad-adf4-71a9533c84fc,40,4:24,Blake Wesley makes two point driving reverse layup (Donovan Clingan assists),twopointmade,53,ad36c3e8-4194-4e63-920f-7c50f46191a6,basketball_play,1775701988,260,True,2026-04-09 02:33:08+00:00,2,264.0,1176.0,19.6,201
3,48,quarter,2,ad36c3e8-4194-4e63-920f-7c50f46191a6,40,4:10,Devin Vassell misses three point jump shot,threepointmiss,53,,basketball_play,1775702002,259,True,2026-04-09 02:33:22+00:00,2,250.0,1190.0,19.833333333333332,202
3,47,quarter,2,2229b01e-68eb-46ad-adf4-71a9533c84fc,40,4:08,Blake Wesley defensive rebound,rebound,53,2229b01e-68eb-46ad-adf4-71a9533c84fc,basketball_play,1775702004,258,True,2026-04-09 02:33:24+00:00,2,248.0,1192.0,19.866666666666667,203
3,46,quarter,2,2229b01e-68eb-46ad-adf4-71a9533c84fc,40,4:07,Blake Wesley turnover (lost ball) (Keldon Johnson steals),turnover,53,ad36c3e8-4194-4e63-920f-7c50f46191a6,basketball_play,1775702005,257,True,2026-04-09 02:33:25+00:00,2,247.0,1193.0,19.883333333333333,204
3,45,quarter,2,ad36c3e8-4194-4e63-920f-7c50f46191a6,40,4:04,Donovan Clingan blocks Carter Bryant's two point running layup,twopointmiss,53,,basketball_play,1775702012,256,True,2026-04-09 02:33:32+00:00,2,244.0,1196.0,19.933333333333334,205
3,44,quarter,2,ad36c3e8-4194-4e63-920f-7c50f46191a6,40,4:02,Spurs offensive rebound,rebound,53,ad36c3e8-4194-4e63-920f-7c50f46191a6,basketball_play,1775702014,255,True,2026-04-09 02:33:34+00:00,2,242.0,1198.0,19.966666666666665,206
3,43,quarter,2,,40,4:02,Stoppage (Out of bounds),stoppage,53,,basketball_play,1775702016,254,True,2026-04-09 02:33:36+00:00,2,242.0,1198.0,19.966666666666665,207
3,42,quarter,2,ad36c3e8-4194-4e63-920f-7c50f46191a6,40,3:56,Carter Bryant misses two point jump shot,twopointmiss,53,,basketball_play,1775702036,253,True,2026-04-09 02:33:56+00:00,2,236.0,1204.0,20.066666666666666,208
3,41,quarter,2,2229b01e-68eb-46ad-adf4-71a9533c84fc,40,3:53,Blake Wesley defensive rebound,rebound,53,2229b01e-68eb-46ad-adf4-71a9533c84fc,basketball_play,1775702039,252,True,2026-04-09 02:33:59+00:00,2,233.0,1207.0,20.116666666666667,209
3,40,quarter,2,2229b01e-68eb-46ad-adf4-71a9533c84fc,40,3:48,Blake Wesley misses two point running layup,twopointmiss,53,,basketball_play,1775702043,251,True,2026-04-09 02:34:03+00:00,2,228.0,1212.0,20.2,210
3,39,quarter,2,ad36c3e8-4194-4e63-920f-7c50f46191a6,40,3:45,Keldon Johnson defensive rebound,rebound,53,ad36c3e8-4194-4e63-920f-7c50f46191a6,basketball_play,1775702046,250,True,2026-04-09 02:34:06+00:00,2,225.0,1215.0,20.25,211
