period_index,event_index,period_type,period_number,attribution,away_points,clock,description,event_type,home_points,possession,type,wall_clock,pbp_source_row,has_wall_clock,event_ts_utc,period_sequence,game_clock_seconds_remaining,game_elapsed_seconds,game_elapsed_minutes,pbp_chronological_index
2,31,quarter,3,ad36c3e8-4194-4e63-920f-7c50f46191a6,71,2:33,Jordan McLaughlin misses two point pullup jump shot,twopointmiss,80,,basketball_play,1775704593,143,True,2026-04-09 03:16:33+00:00,3,153.0,2007.0,33.45,318
2,30,quarter,3,2229b01e-68eb-46ad-adf4-71a9533c84fc,71,2:31,Deni Avdija defensive rebound,rebound,80,2229b01e-68eb-46ad-adf4-71a9533c84fc,basketball_play,1775704595,142,True,2026-04-09 03:16:35+00:00,3,151.0,2009.0,33.483333333333334,319
2,29,quarter,3,ad36c3e8-4194-4e63-920f-7c50f46191a6,71,2:25,Dylan Harper personal foul (Deni Avdija draws the foul),personalfoul,80,2229b01e-68eb-46ad-adf4-71a9533c84fc,basketball_play,1775704604,141,True,2026-04-09 03:16:44+00:00,3,145.0,2015.0,33.583333333333336,320
2,28,quarter,3,2229b01e-68eb-46ad-adf4-71a9533c84fc,71,2:25,"Trail Blazers lineup change (Robert Williams III, Scoot Henderson, Sidy Cissoko, Matisse Thybulle, Deni Avdija)",lineupchange,80,,basketball_play,1775704610,140,True,2026-04-09 03:16:50+00:00,3,145.0,2015.0,33.583333333333336,321
2,27,quarter,3,ad36c3e8-4194-4e63-920f-7c50f46191a6,71,2:25,"Spurs lineup change (Harrison Barnes, Carter Bryant, Dylan Harper, Julian Champagnie, Keldon Johnson)",lineupchange,80,,basketball_play,1775704610,139,True,2026-04-09 03:16:50+00:00,3,145.0,2015.0,33.583333333333336,322
2,26,quarter,3,2229b01e-68eb-46ad-adf4-71a9533c84fc,71,2:22,Deni Avdija misses two point driving layup,twopointmiss,80,,basketball_play,1775704635,138,True,2026-04-09 03:17:15+00:00,3,142.0,2018.0,33.63333333333333,323
2,25,quarter,3,ad36c3e8-4194-4e63-920f-7c50f46191a6,71,2:20,Carter Bryant defensive rebound,rebound,80,ad36c3e8-4194-4e63-920f-7c50f46191a6,basketball_play,1775704637,137,True,2026-04-09 03:17:17+00:00,3,140.0,2020.0,33.666666666666664,324
2,24,quarter,3,ad36c3e8-4194-4e63-920f-7c50f46191a6,71,2:16,Scoot Henderson blocks Dylan Harper's two point running layup,twopointmiss,80,,basketball_play,1775704641,136,True,2026-04-09 03:17:21+00:00,3,136.0,2024.0,33.733333333333334,325
2,23,quarter,3,ad36c3e8-4194-4e63-920f-7c50f46191a6,71,2:14,Keldon Johnson offensive rebound,rebound,80,ad36c3e8-4194-4e63-920f-7c50f46191a6,basketball_play,1775704643,135,True,2026-04-09 03:17:23+00:00,3,134.0,2026.0,33.766666666666666,326
2,22,quarter,3,ad36c3e8-4194-4e63-920f-7c50f46191a6,71,2:14,Keldon Johnson makes two point tip layup,twopointmade,82,2229b01e-68eb-46ad-adf4-71a9533c84fc,basketball_play,1775704646,134,True,2026-04-09 03:17:26+00:00,3,134.0,2026.0,33.766666666666666,327
2,21,quarter,3,2229b01e-68eb-46ad-adf4-71a9533c84fc,71,2:12,Trail Blazers 60 second timeout,teamtimeout,82,,basketball_play,1775704648,133,True,2026-04-09 03:17:28+00:00,3,132.0,2028.0,33.8,328
2,20,quarter,3,2229b01e-68eb-46ad-adf4-71a9533c84fc,71,2:12,"Trail Blazers lineup change (Jrue Holiday, Robert Williams III, Caleb Love, Sidy Cissoko, Matisse Thybulle)",lineupchange,82,,basketball_play,1775704740,132,True,2026-04-09 03:19:00+00:00,3,132.0,2028.0,33.8,329
2,19,quarter,3,2229b01e-68eb-46ad-adf4-71a9533c84fc,73,1:58,Sidy Cissoko makes two point cutting dunk (Robert Williams III assists),twopointmade,82,ad36c3e8-4194-4e63-920f-7c50f46191a6,basketball_play,1775704759,131,True,2026-04-09 03:19:19+00:00,3,118.0,2042.0,34.03333333333333,330
2,18,quarter,3,ad36c3e8-4194-4e63-920f-7c50f46191a6,73,1:44,Keldon Johnson makes two point driving layup (Carter Bryant assists),twopointmade,84,2229b01e-68eb-46ad-adf4-71a9533c84fc,basketball_play,1775704773,130,True,2026-04-09 03:19:33+00:00,3,104.0,2056.0,34.266666666666666,331
2,17,quarter,3,,73,1:40,Stoppage (Equipment malfunction),stoppage,84,,basketball_play,1775704788,129,True,2026-04-09 03:19:48+00:00,3,100.0,2060.0,34.333333333333336,332
2,16,quarter,3,2229b01e-68eb-46ad-adf4-71a9533c84fc,73,1:31,Julian Champagnie blocks Jrue Holiday's two point pullup jump shot,twopointmiss,84,,basketball_play,1775704807,128,True,2026-04-09 03:20:07+00:00,3,91.0,2069.0,34.483333333333334,333
2,15,quarter,3,ad36c3e8-4194-4e63-920f-7c50f46191a6,73,1:27,Dylan Harper defensive rebound,rebound,84,ad36c3e8-4194-4e63-920f-7c50f46191a6,basketball_play,1775704811,127,True,2026-04-09 03:20:11+00:00,3,87.0,2073.0,34.55,334
2,14,quarter,3,ad36c3e8-4194-4e63-920f-7c50f46191a6,73,1:20,Keldon Johnson misses three point jump shot,threepointmiss,84,,basketball_play,1775704817,126,True,2026-04-09 03:20:17+00:00,3,80.0,2080.0,34.666666666666664,335
2,13,quarter,3,2229b01e-68eb-46ad-adf4-71a9533c84fc,73,1:20,Robert Williams III defensive rebound,rebound,84,2229b01e-68eb-46ad-adf4-71a9533c84fc,basketball_play,1775704817,125,True,2026-04-09 03:20:17+00:00,3,80.0,2080.0,34.666666666666664,336
2,12,quarter,3,2229b01e-68eb-46ad-adf4-71a9533c84fc,73,1:20,Robert Williams III turnover (bad pass) (Carter Bryant steals),turnover,84,ad36c3e8-4194-4e63-920f-7c50f46191a6,basketball_play,1775704822,124,True,2026-04-09 03:20:22+00:00,3,80.0,2080.0,34.666666666666664,337
2,11,quarter,3,ad36c3e8-4194-4e63-920f-7c50f46191a6,73,1:12,Keldon Johnson makes two point driving layup (Harrison Barnes assists),twopointmade,86,2229b01e-68eb-46ad-adf4-71a9533c84fc,basketball_play,1775704828,123,True,2026-04-09 03:20:28+00:00,3,72.0,2088.0,34.8,338
2,10,quarter,3,2229b01e-68eb-46ad-adf4-71a9533c84fc,73,00:54.70,Jrue Holiday misses three point stepback jump shot,threepointmiss,86,,basketball_play,1775704843,122,True,2026-04-09 03:20:43+00:00,3,54.7,2105.3,35.08833333333334,339
2,9,quarter,3,ad36c3e8-4194-4e63-920f-7c50f46191a6,73,00:52.30,Keldon Johnson defensive rebound,rebound,86,ad36c3e8-4194-4e63-920f-7c50f46191a6,basketball_play,1775704845,121,True,2026-04-09 03:20:45+00:00,3,52.3,2107.7,35.12833333333333,340
2,8,quarter,3,ad36c3e8-4194-4e63-920f-7c50f46191a6,73,00:45.70,Keldon Johnson turnover (out of bounds lost ball),turnover,86,2229b01e-68eb-46ad-adf4-71a9533c84fc,basketball_play,1775704855,120,True,2026-04-09 03:20:55+00:00,3,45.7,2114.3,35.23833333333334,341
2,7,quarter,3,2229b01e-68eb-46ad-adf4-71a9533c84fc,73,00:32.10,Caleb Love turnover (lost ball) (Dylan Harper steals),turnover,86,ad36c3e8-4194-4e63-920f-7c50f46191a6,basketball_play,1775704879,119,True,2026-04-09 03:21:19+00:00,3,32.1,2127.9,35.465,342
2,6,quarter,3,ad36c3e8-4194-4e63-920f-7c50f46191a6,73,00:29,Dylan Harper makes two point running dunk,twopointmade,88,2229b01e-68eb-46ad-adf4-71a9533c84fc,basketball_play,1775704883,118,True,2026-04-09 03:21:23+00:00,3,29.0,2131.0,35.516666666666666,343
2,5,quarter,3,2229b01e-68eb-46ad-adf4-71a9533c84fc,73,00:03.90,Jrue Holiday misses two point stepback jump shot,twopointmiss,88,,basketball_play,1775704916,117,True,2026-04-09 03:21:56+00:00,3,3.9,2156.1,35.934999999999995,344
2,4,quarter,3,ad36c3e8-4194-4e63-920f-7c50f46191a6,73,00:01.50,Keldon Johnson defensive rebound,rebound,88,ad36c3e8-4194-4e63-920f-7c50f46191a6,basketball_play,1775704918,116,True,2026-04-09 03:21:58+00:00,3,1.5,2158.5,35.975,345
2,3,quarter,3,ad36c3e8-4194-4e63-920f-7c50f46191a6,73,00:00,Spurs misses heave shot,heave,88,,basketball_play,1775704922,115,True,2026-04-09 03:22:02+00:00,3,0.0,2160.0,36.0,346
2,2,quarter,3,ad36c3e8-4194-4e63-920f-7c50f46191a6,73,00:00,Spurs offensive rebound,rebound,88,ad36c3e8-4194-4e63-920f-7c50f46191a6,basketball_play,1775704924,114,True,2026-04-09 03:22:04+00:00,3,0.0,2160.0,36.0,347
2,1,quarter,3,,73,00:00,End of 3rd Quarter.,endperiod,88,,basketball_play,1775704926,113,True,2026-04-09 03:22:06+00:00,3,0.0,2160.0,36.0,348
1,113,quarter,4,2229b01e-68eb-46ad-adf4-71a9533c84fc,73,12:00,"Trail Blazers lineup change (Toumani Camara, Jrue Holiday, Robert Williams III, Scoot Henderson, Deni Avdija)",lineupchange,88,,basketball_play,1775705091,112,True,2026-04-09 03:24:51+00:00,4,720.0,2160.0,36.0,349
1,112,quarter,4,,73,12:00,Start of 4th Quarter,startperiod,88,,basketball_play,1775705146,111,True,2026-04-09 03:25:46+00:00,4,720.0,2160.0,36.0,350
1,111,quarter,4,ad36c3e8-4194-4e63-920f-7c50f46191a6,73,11:48,Carter Bryant misses three point jump shot,threepointmiss,88,,basketball_play,1775705158,110,True,2026-04-09 03:25:58+00:00,4,708.0,2172.0,36.2,351
1,110,quarter,4,ad36c3e8-4194-4e63-920f-7c50f46191a6,73,11:44,Keldon Johnson offensive rebound,rebound,88,ad36c3e8-4194-4e63-920f-7c50f46191a6,basketball_play,1775705161,109,True,2026-04-09 03:26:01+00:00,4,704.0,2176.0,36.266666666666666,352
1,109,quarter,4,ad36c3e8-4194-4e63-920f-7c50f46191a6,73,11:43,Julian Champagnie misses three point jump shot,threepointmiss,88,,basketball_play,1775705164,108,True,2026-04-09 03:26:04+00:00,4,703.0,2177.0,36.28333333333333,353
1,108,quarter,4,ad36c3e8-4194-4e63-920f-7c50f46191a6,73,11:41,Carter Bryant offensive rebound,rebound,88,ad36c3e8-4194-4e63-920f-7c50f46191a6,basketball_play,1775705166,107,True,2026-04-09 03:26:06+00:00,4,701.0,2179.0,36.31666666666667,354
1,107,quarter,4,ad36c3e8-4194-4e63-920f-7c50f46191a6,73,11:35,Dylan Harper misses three point stepback jump shot,threepointmiss,88,,basketball_play,1775705173,106,True,2026-04-09 03:26:13+00:00,4,695.0,2185.0,36.416666666666664,355
1,106,quarter,4,2229b01e-68eb-46ad-adf4-71a9533c84fc,73,11:32,Robert Williams III defensive rebound,rebound,88,2229b01e-68eb-46ad-adf4-71a9533c84fc,basketball_play,1775705176,105,True,2026-04-09 03:26:16+00:00,4,692.0,2188.0,36.46666666666667,356
1,105,quarter,4,2229b01e-68eb-46ad-adf4-71a9533c84fc,75,11:09,Scoot Henderson makes two point turnaround jump shot (Toumani Camara assists),twopointmade,88,ad36c3e8-4194-4e63-920f-7c50f46191a6,basketball_play,1775705196,104,True,2026-04-09 03:26:36+00:00,4,669.0,2211.0,36.85,357
1,104,quarter,4,ad36c3e8-4194-4e63-920f-7c50f46191a6,75,10:49,Carter Bryant makes three point jump shot (Harrison Barnes assists),threepointmade,91,2229b01e-68eb-46ad-adf4-71a9533c84fc,basketball_play,1775705216,103,True,2026-04-09 03:26:56+00:00,4,649.0,2231.0,37.18333333333333,358
1,103,quarter,4,ad36c3e8-4194-4e63-920f-7c50f46191a6,75,10:41,Julian Champagnie shooting foul (Scoot Henderson draws the foul),shootingfoul,91,2229b01e-68eb-46ad-adf4-71a9533c84fc,basketball_play,1775705227,102,True,2026-04-09 03:27:07+00:00,4,641.0,2239.0,37.31666666666667,359
1,102,quarter,4,2229b01e-68eb-46ad-adf4-71a9533c84fc,75,10:41,Scoot Henderson misses regular free throw 1 of 2,freethrowmiss,91,2229b01e-68eb-46ad-adf4-71a9533c84fc,basketball_play,1775705252,101,True,2026-04-09 03:27:32+00:00,4,641.0,2239.0,37.31666666666667,360
1,101,quarter,4,2229b01e-68eb-46ad-adf4-71a9533c84fc,75,10:41,Trail Blazers offensive rebound,rebound,91,2229b01e-68eb-46ad-adf4-71a9533c84fc,basketball_play,1775705252,100,True,2026-04-09 03:27:32+00:00,4,641.0,2239.0,37.31666666666667,361
1,100,quarter,4,2229b01e-68eb-46ad-adf4-71a9533c84fc,75,10:41,"Trail Blazers lineup change (Toumani Camara, Jrue Holiday, Scoot Henderson, Matisse Thybulle, Deni Avdija)",lineupchange,91,,basketball_play,1775705253,99,True,2026-04-09 03:27:33+00:00,4,641.0,2239.0,37.31666666666667,362
1,99,quarter,4,ad36c3e8-4194-4e63-920f-7c50f46191a6,75,10:41,"Spurs lineup change (Harrison Barnes, De'Aaron Fox, Carter Bryant, Julian Champagnie, Keldon Johnson)",lineupchange,91,,basketball_play,1775705253,98,True,2026-04-09 03:27:33+00:00,4,641.0,2239.0,37.31666666666667,363
1,98,quarter,4,2229b01e-68eb-46ad-adf4-71a9533c84fc,76,10:41,Scoot Henderson makes regular free throw 2 of 2,freethrowmade,91,ad36c3e8-4194-4e63-920f-7c50f46191a6,basketball_play,1775705276,97,True,2026-04-09 03:27:56+00:00,4,641.0,2239.0,37.31666666666667,364
1,97,quarter,4,ad36c3e8-4194-4e63-920f-7c50f46191a6,76,10:30,De'Aaron Fox turnover (bad pass) (Scoot Henderson steals),turnover,91,2229b01e-68eb-46ad-adf4-71a9533c84fc,basketball_play,1775705288,96,True,2026-04-09 03:28:08+00:00,4,630.0,2250.0,37.5,365
1,96,quarter,4,2229b01e-68eb-46ad-adf4-71a9533c84fc,78,10:28,Scoot Henderson makes two point running dunk,twopointmade,91,ad36c3e8-4194-4e63-920f-7c50f46191a6,basketball_play,1775705291,95,True,2026-04-09 03:28:11+00:00,4,628.0,2252.0,37.53333333333333,366
1,95,quarter,4,ad36c3e8-4194-4e63-920f-7c50f46191a6,78,10:13,De'Aaron Fox turnover (bad pass) (Scoot Henderson steals),turnover,91,2229b01e-68eb-46ad-adf4-71a9533c84fc,basketball_play,1775705306,94,True,2026-04-09 03:28:26+00:00,4,613.0,2267.0,37.78333333333333,367
1,94,quarter,4,2229b01e-68eb-46ad-adf4-71a9533c84fc,78,10:08,Deni Avdija misses two point running finger roll layup,twopointmiss,91,,basketball_play,1775705312,93,True,2026-04-09 03:28:32+00:00,4,608.0,2272.0,37.86666666666667,368
1,93,quarter,4,2229b01e-68eb-46ad-adf4-71a9533c84fc,78,10:08,Jrue Holiday offensive rebound,rebound,91,2229b01e-68eb-46ad-adf4-71a9533c84fc,basketball_play,1775705312,92,True,2026-04-09 03:28:32+00:00,4,608.0,2272.0,37.86666666666667,369
1,92,quarter,4,ad36c3e8-4194-4e63-920f-7c50f46191a6,78,10:08,Carter Bryant personal foul (Jrue Holiday draws the foul),personalfoul,91,2229b01e-68eb-46ad-adf4-71a9533c84fc,basketball_play,1775705319,91,True,2026-04-09 03:28:39+00:00,4,608.0,2272.0,37.86666666666667,370
1,91,quarter,4,2229b01e-68eb-46ad-adf4-71a9533c84fc,80,10:01,Deni Avdija makes two point turnaround jump shot (Scoot Henderson assists),twopointmade,91,ad36c3e8-4194-4e63-920f-7c50f46191a6,basketball_play,1775705337,90,True,2026-04-09 03:28:57+00:00,4,601.0,2279.0,37.983333333333334,371
1,90,quarter,4,ad36c3e8-4194-4e63-920f-7c50f46191a6,80,9:46,Keldon Johnson makes two point cutting layup (Carter Bryant assists),twopointmade,93,2229b01e-68eb-46ad-adf4-71a9533c84fc,basketball_play,1775705351,89,True,2026-04-09 03:29:11+00:00,4,586.0,2294.0,38.233333333333334,372
1,89,quarter,4,2229b01e-68eb-46ad-adf4-71a9533c84fc,83,9:37,Toumani Camara makes three point jump shot (Jrue Holiday assists),threepointmade,93,ad36c3e8-4194-4e63-920f-7c50f46191a6,basketball_play,1775705360,88,True,2026-04-09 03:29:20+00:00,4,577.0,2303.0,38.38333333333333,373
1,88,quarter,4,ad36c3e8-4194-4e63-920f-7c50f46191a6,83,9:15,Keldon Johnson misses two point turnaround jump shot,twopointmiss,93,,basketball_play,1775705385,87,True,2026-04-09 03:29:45+00:00,4,555.0,2325.0,38.75,374
1,87,quarter,4,ad36c3e8-4194-4e63-920f-7c50f46191a6,83,9:13,Keldon Johnson offensive rebound,rebound,93,ad36c3e8-4194-4e63-920f-7c50f46191a6,basketball_play,1775705387,86,True,2026-04-09 03:29:47+00:00,4,553.0,2327.0,38.78333333333333,375
1,86,quarter,4,ad36c3e8-4194-4e63-920f-7c50f46191a6,83,9:13,Keldon Johnson makes two point putback layup,twopointmade,95,2229b01e-68eb-46ad-adf4-71a9533c84fc,basketball_play,1775705389,85,True,2026-04-09 03:29:49+00:00,4,553.0,2327.0,38.78333333333333,376
1,85,quarter,4,2229b01e-68eb-46ad-adf4-71a9533c84fc,83,8:58,Jrue Holiday misses three point stepback jump shot,threepointmiss,95,,basketball_play,1775705402,84,True,2026-04-09 03:30:02+00:00,4,538.0,2342.0,39.03333333333333,377
1,84,quarter,4,ad36c3e8-4194-4e63-920f-7c50f46191a6,83,8:55,De'Aaron Fox defensive rebound,rebound,95,ad36c3e8-4194-4e63-920f-7c50f46191a6,basketball_play,1775705405,83,True,2026-04-09 03:30:05+00:00,4,535.0,2345.0,39.083333333333336,378
1,83,quarter,4,ad36c3e8-4194-4e63-920f-7c50f46191a6,83,8:48,Carter Bryant makes three point jump shot (De'Aaron Fox assists),threepointmade,98,2229b01e-68eb-46ad-adf4-71a9533c84fc,basketball_play,1775705411,82,True,2026-04-09 03:30:11+00:00,4,528.0,2352.0,39.2,379
1,82,quarter,4,2229b01e-68eb-46ad-adf4-71a9533c84fc,83,8:45,Trail Blazers 60 second timeout,teamtimeout,98,,basketball_play,1775705416,81,True,2026-04-09 03:30:16+00:00,4,525.0,2355.0,39.25,380
1,81,quarter,4,2229b01e-68eb-46ad-adf4-71a9533c84fc,83,8:45,"Trail Blazers lineup change (Kris Murray, Toumani Camara, Scoot Henderson, Matisse Thybulle, Deni Avdija)",lineupchange,98,,basketball_play,1775705635,80,True,2026-04-09 03:33:55+00:00,4,525.0,2355.0,39.25,381
1,80,quarter,4,2229b01e-68eb-46ad-adf4-71a9533c84fc,85,8:36,Deni Avdija makes two point driving dunk (Toumani Camara assists),twopointmade,98,ad36c3e8-4194-4e63-920f-7c50f46191a6,basketball_play,1775705635,79,True,2026-04-09 03:33:55+00:00,4,516.0,2364.0,39.4,382
1,79,quarter,4,ad36c3e8-4194-4e63-920f-7c50f46191a6,85,8:19,Harrison Barnes offensive foul (Toumani Camara draws the foul),offensivefoul,98,2229b01e-68eb-46ad-adf4-71a9533c84fc,basketball_play,1775705655,78,True,2026-04-09 03:34:15+00:00,4,499.0,2381.0,39.68333333333333,383
1,78,quarter,4,ad36c3e8-4194-4e63-920f-7c50f46191a6,85,8:19,Harrison Barnes turnover (offensive foul),turnover,98,2229b01e-68eb-46ad-adf4-71a9533c84fc,basketball_play,1775705655,77,True,2026-04-09 03:34:15+00:00,4,499.0,2381.0,39.68333333333333,384
1,77,quarter,4,2229b01e-68eb-46ad-adf4-71a9533c84fc,85,8:05,Deni Avdija turnover (lost ball) (De'Aaron Fox steals),turnover,98,ad36c3e8-4194-4e63-920f-7c50f46191a6,basketball_play,1775705680,76,True,2026-04-09 03:34:40+00:00,4,485.0,2395.0,39.916666666666664,385
1,76,quarter,4,ad36c3e8-4194-4e63-920f-7c50f46191a6,85,8:01,Julian Champagnie makes two point running dunk (De'Aaron Fox assists),twopointmade,100,2229b01e-68eb-46ad-adf4-71a9533c84fc,basketball_play,1775705683,75,True,2026-04-09 03:34:43+00:00,4,481.0,2399.0,39.983333333333334,386
1,75,quarter,4,2229b01e-68eb-46ad-adf4-71a9533c84fc,85,7:46,Scoot Henderson turnover (lost ball) (Keldon Johnson steals),turnover,100,ad36c3e8-4194-4e63-920f-7c50f46191a6,basketball_play,1775705699,74,True,2026-04-09 03:34:59+00:00,4,466.0,2414.0,40.233333333333334,387
1,74,quarter,4,ad36c3e8-4194-4e63-920f-7c50f46191a6,85,7:31,De'Aaron Fox makes two point driving finger roll layup,twopointmade,102,2229b01e-68eb-46ad-adf4-71a9533c84fc,basketball_play,1775705714,73,True,2026-04-09 03:35:14+00:00,4,451.0,2429.0,40.483333333333334,388
1,73,quarter,4,2229b01e-68eb-46ad-adf4-71a9533c84fc,88,7:12,Scoot Henderson makes three point jump shot (Deni Avdija assists),threepointmade,102,ad36c3e8-4194-4e63-920f-7c50f46191a6,basketball_play,1775705733,72,True,2026-04-09 03:35:33+00:00,4,432.0,2448.0,40.8,389
1,72,quarter,4,2229b01e-68eb-46ad-adf4-71a9533c84fc,88,7:00,Toumani Camara personal foul (De'Aaron Fox draws the foul),personalfoul,102,ad36c3e8-4194-4e63-920f-7c50f46191a6,basketball_play,1775705748,71,True,2026-04-09 03:35:48+00:00,4,420.0,2460.0,41.0,390
1,71,quarter,4,ad36c3e8-4194-4e63-920f-7c50f46191a6,88,7:00,"Spurs lineup change (Harrison Barnes, De'Aaron Fox, Carter Bryant, Dylan Harper, Julian Champagnie)",lineupchange,102,,basketball_play,1775705785,70,True,2026-04-09 03:36:25+00:00,4,420.0,2460.0,41.0,391
1,70,quarter,4,ad36c3e8-4194-4e63-920f-7c50f46191a6,88,6:47,Dylan Harper turnover (bad pass) (Toumani Camara steals),turnover,102,2229b01e-68eb-46ad-adf4-71a9533c84fc,basketball_play,1775705785,69,True,2026-04-09 03:36:25+00:00,4,407.0,2473.0,41.21666666666667,392
1,69,quarter,4,2229b01e-68eb-46ad-adf4-71a9533c84fc,90,6:43,Deni Avdija makes two point running dunk (Toumani Camara assists),twopointmade,102,ad36c3e8-4194-4e63-920f-7c50f46191a6,basketball_play,1775705789,68,True,2026-04-09 03:36:29+00:00,4,403.0,2477.0,41.28333333333333,393
1,68,quarter,4,ad36c3e8-4194-4e63-920f-7c50f46191a6,90,6:43,Spurs 60 second timeout,teamtimeout,102,,basketball_play,1775705795,67,True,2026-04-09 03:36:35+00:00,4,403.0,2477.0,41.28333333333333,394
1,67,quarter,4,ad36c3e8-4194-4e63-920f-7c50f46191a6,90,6:43,"Spurs lineup change (Harrison Barnes, Devin Vassell, Carter Bryant, Dylan Harper, Julian Champagnie)",lineupchange,102,,basketball_play,1775706023,66,True,2026-04-09 03:40:23+00:00,4,403.0,2477.0,41.28333333333333,395
1,66,quarter,4,2229b01e-68eb-46ad-adf4-71a9533c84fc,90,6:43,"Trail Blazers lineup change (Kris Murray, Toumani Camara, Jrue Holiday, Scoot Henderson, Deni Avdija)",lineupchange,102,,basketball_play,1775706034,65,True,2026-04-09 03:40:34+00:00,4,403.0,2477.0,41.28333333333333,396
1,65,quarter,4,ad36c3e8-4194-4e63-920f-7c50f46191a6,90,6:24,Toumani Camara blocks Dylan Harper's two point driving layup,twopointmiss,102,,basketball_play,1775706037,64,True,2026-04-09 03:40:37+00:00,4,384.0,2496.0,41.6,397
1,64,quarter,4,2229b01e-68eb-46ad-adf4-71a9533c84fc,90,6:22,Scoot Henderson defensive rebound,rebound,102,2229b01e-68eb-46ad-adf4-71a9533c84fc,basketball_play,1775706039,63,True,2026-04-09 03:40:39+00:00,4,382.0,2498.0,41.63333333333333,398
1,63,quarter,4,2229b01e-68eb-46ad-adf4-71a9533c84fc,90,6:19,Scoot Henderson misses two point running layup,twopointmiss,102,,basketball_play,1775706038,62,True,2026-04-09 03:40:38+00:00,4,379.0,2501.0,41.68333333333333,399
1,62,quarter,4,ad36c3e8-4194-4e63-920f-7c50f46191a6,90,6:18,Spurs defensive rebound,rebound,102,ad36c3e8-4194-4e63-920f-7c50f46191a6,basketball_play,1775706039,61,True,2026-04-09 03:40:39+00:00,4,378.0,2502.0,41.7,400
1,61,quarter,4,,90,6:18,Stoppage (Out of bounds),stoppage,102,,basketball_play,1775706038,60,True,2026-04-09 03:40:38+00:00,4,378.0,2502.0,41.7,401
1,60,quarter,4,2229b01e-68eb-46ad-adf4-71a9533c84fc,90,6:01,Deni Avdija shooting foul (Harrison Barnes draws the foul),shootingfoul,102,ad36c3e8-4194-4e63-920f-7c50f46191a6,basketball_play,1775706071,59,True,2026-04-09 03:41:11+00:00,4,361.0,2519.0,41.983333333333334,402
1,59,quarter,4,ad36c3e8-4194-4e63-920f-7c50f46191a6,90,6:01,Harrison Barnes makes regular free throw 1 of 2,freethrowmade,103,ad36c3e8-4194-4e63-920f-7c50f46191a6,basketball_play,1775706096,58,True,2026-04-09 03:41:36+00:00,4,361.0,2519.0,41.983333333333334,403
1,58,quarter,4,ad36c3e8-4194-4e63-920f-7c50f46191a6,90,6:01,"Spurs lineup change (Harrison Barnes, Devin Vassell, Carter Bryant, Dylan Harper, Keldon Johnson)",lineupchange,103,,basketball_play,1775706119,57,True,2026-04-09 03:41:59+00:00,4,361.0,2519.0,41.983333333333334,404
1,57,quarter,4,ad36c3e8-4194-4e63-920f-7c50f46191a6,90,6:01,Harrison Barnes misses regular free throw 2 of 2,freethrowmiss,103,,basketball_play,1775706096,56,True,2026-04-09 03:41:36+00:00,4,361.0,2519.0,41.983333333333334,405
1,56,quarter,4,2229b01e-68eb-46ad-adf4-71a9533c84fc,90,5:59,Deni Avdija defensive rebound,rebound,103,2229b01e-68eb-46ad-adf4-71a9533c84fc,basketball_play,1775706098,55,True,2026-04-09 03:41:38+00:00,4,359.0,2521.0,42.016666666666666,406
1,55,quarter,4,2229b01e-68eb-46ad-adf4-71a9533c84fc,90,5:51,Scoot Henderson misses three point jump shot,threepointmiss,103,,basketball_play,1775706128,54,True,2026-04-09 03:42:08+00:00,4,351.0,2529.0,42.15,407
1,54,quarter,4,ad36c3e8-4194-4e63-920f-7c50f46191a6,90,5:47,Devin Vassell defensive rebound,rebound,103,ad36c3e8-4194-4e63-920f-7c50f46191a6,basketball_play,1775706132,53,True,2026-04-09 03:42:12+00:00,4,347.0,2533.0,42.21666666666667,408
1,53,quarter,4,ad36c3e8-4194-4e63-920f-7c50f46191a6,90,5:28,Devin Vassell misses two point fadeaway jump shot,twopointmiss,103,,basketball_play,1775706150,52,True,2026-04-09 03:42:30+00:00,4,328.0,2552.0,42.53333333333333,409
1,52,quarter,4,2229b01e-68eb-46ad-adf4-71a9533c84fc,90,5:26,Jrue Holiday defensive rebound,rebound,103,2229b01e-68eb-46ad-adf4-71a9533c84fc,basketball_play,1775706152,51,True,2026-04-09 03:42:32+00:00,4,326.0,2554.0,42.56666666666667,410
1,51,quarter,4,2229b01e-68eb-46ad-adf4-71a9533c84fc,90,5:20,Jrue Holiday turnover (lost ball) (Dylan Harper steals),turnover,103,ad36c3e8-4194-4e63-920f-7c50f46191a6,basketball_play,1775706160,50,True,2026-04-09 03:42:40+00:00,4,320.0,2560.0,42.666666666666664,411
1,50,quarter,4,ad36c3e8-4194-4e63-920f-7c50f46191a6,90,5:07,Harrison Barnes misses three point jump shot,threepointmiss,103,,basketball_play,1775706172,49,True,2026-04-09 03:42:52+00:00,4,307.0,2573.0,42.88333333333333,412
1,49,quarter,4,2229b01e-68eb-46ad-adf4-71a9533c84fc,90,5:04,Toumani Camara defensive rebound,rebound,103,2229b01e-68eb-46ad-adf4-71a9533c84fc,basketball_play,1775706175,48,True,2026-04-09 03:42:55+00:00,4,304.0,2576.0,42.93333333333333,413
1,48,quarter,4,2229b01e-68eb-46ad-adf4-71a9533c84fc,90,5:00,Keldon Johnson blocks Deni Avdija's two point driving floating jump shot,twopointmiss,103,,basketball_play,1775706182,47,True,2026-04-09 03:43:02+00:00,4,300.0,2580.0,43.0,414
1,47,quarter,4,2229b01e-68eb-46ad-adf4-71a9533c84fc,90,4:57,Deni Avdija offensive rebound,rebound,103,2229b01e-68eb-46ad-adf4-71a9533c84fc,basketball_play,1775706185,46,True,2026-04-09 03:43:05+00:00,4,297.0,2583.0,43.05,415
1,46,quarter,4,2229b01e-68eb-46ad-adf4-71a9533c84fc,92,4:57,Deni Avdija makes two point tip layup,twopointmade,103,ad36c3e8-4194-4e63-920f-7c50f46191a6,basketball_play,1775706186,45,True,2026-04-09 03:43:06+00:00,4,297.0,2583.0,43.05,416
1,45,quarter,4,ad36c3e8-4194-4e63-920f-7c50f46191a6,92,4:37,Dylan Harper misses two point fadeaway jump shot,twopointmiss,103,,basketball_play,1775706205,44,True,2026-04-09 03:43:25+00:00,4,277.0,2603.0,43.38333333333333,417
1,44,quarter,4,2229b01e-68eb-46ad-adf4-71a9533c84fc,92,4:35,Deni Avdija defensive rebound,rebound,103,2229b01e-68eb-46ad-adf4-71a9533c84fc,basketball_play,1775706207,43,True,2026-04-09 03:43:27+00:00,4,275.0,2605.0,43.416666666666664,418
1,43,quarter,4,2229b01e-68eb-46ad-adf4-71a9533c84fc,94,4:28,Kris Murray makes two point driving layup (Jrue Holiday assists),twopointmade,103,ad36c3e8-4194-4e63-920f-7c50f46191a6,basketball_play,1775706214,42,True,2026-04-09 03:43:34+00:00,4,268.0,2612.0,43.53333333333333,419
1,42,quarter,4,ad36c3e8-4194-4e63-920f-7c50f46191a6,94,4:26,Spurs 60 second timeout,teamtimeout,103,,basketball_play,1775706338,41,True,2026-04-09 03:45:38+00:00,4,266.0,2614.0,43.56666666666667,420
1,41,quarter,4,2229b01e-68eb-46ad-adf4-71a9533c84fc,94,4:26,"Trail Blazers lineup change (Toumani Camara, Jrue Holiday, Scoot Henderson, Donovan Clingan, Matisse Thybulle)",lineupchange,103,,basketball_play,1775706296,40,True,2026-04-09 03:44:56+00:00,4,266.0,2614.0,43.56666666666667,421
