period_index,event_index,period_type,period_number,attribution,away_points,clock,description,event_type,home_points,possession,type,wall_clock,pbp_source_row,has_wall_clock,event_ts_utc,period_sequence,game_clock_seconds_remaining,game_elapsed_seconds,game_elapsed_minutes,pbp_chronological_index
2,44,quarter,3,a8625e4b-4ae6-4062-a7c1-0b6e1f4ae211,72,3:49,Kevin Durant misses three point running pullup jump shot,threepointmiss,75,,basketball_play,1773193487,156,True,2026-03-11 01:44:47+00:00,3,229.0,1931.0,32.18333333333333,314
2,43,quarter,3,96c447dd-2cdd-4c58-a151-ef0df87de981,72,3:47,Brandon Ingram defensive rebound,rebound,75,96c447dd-2cdd-4c58-a151-ef0df87de981,basketball_play,1773193489,155,True,2026-03-11 01:44:49+00:00,3,227.0,1933.0,32.21666666666667,315
2,42,quarter,3,96c447dd-2cdd-4c58-a151-ef0df87de981,72,3:36,Scottie Barnes misses three point jump shot,threepointmiss,75,,basketball_play,1773193500,154,True,2026-03-11 01:45:00+00:00,3,216.0,1944.0,32.4,316
2,41,quarter,3,a8625e4b-4ae6-4062-a7c1-0b6e1f4ae211,72,3:30,Reed Sheppard defensive rebound,rebound,75,a8625e4b-4ae6-4062-a7c1-0b6e1f4ae211,basketball_play,1773193506,153,True,2026-03-11 01:45:06+00:00,3,210.0,1950.0,32.5,317
2,40,quarter,3,a8625e4b-4ae6-4062-a7c1-0b6e1f4ae211,72,3:30,Reed Sheppard turnover (bad pass) (Jamison Battle steals),turnover,75,96c447dd-2cdd-4c58-a151-ef0df87de981,basketball_play,1773193507,152,True,2026-03-11 01:45:07+00:00,3,210.0,1950.0,32.5,318
2,39,quarter,3,96c447dd-2cdd-4c58-a151-ef0df87de981,72,3:26,Jamison Battle misses three point jump shot,threepointmiss,75,,basketball_play,1773193510,151,True,2026-03-11 01:45:10+00:00,3,206.0,1954.0,32.56666666666667,319
2,38,quarter,3,a8625e4b-4ae6-4062-a7c1-0b6e1f4ae211,72,3:23,Reed Sheppard defensive rebound,rebound,75,a8625e4b-4ae6-4062-a7c1-0b6e1f4ae211,basketball_play,1773193513,150,True,2026-03-11 01:45:13+00:00,3,203.0,1957.0,32.61666666666667,320
2,37,quarter,3,a8625e4b-4ae6-4062-a7c1-0b6e1f4ae211,72,3:09,Tari Eason makes two point driving layup (Dorian Finney-Smith assists),twopointmade,77,96c447dd-2cdd-4c58-a151-ef0df87de981,basketball_play,1773193526,149,True,2026-03-11 01:45:26+00:00,3,189.0,1971.0,32.85,321
2,36,quarter,3,96c447dd-2cdd-4c58-a151-ef0df87de981,72,3:09,Raptors 60 second timeout,teamtimeout,77,,basketball_play,1773193538,148,True,2026-03-11 01:45:38+00:00,3,189.0,1971.0,32.85,322
2,35,quarter,3,96c447dd-2cdd-4c58-a151-ef0df87de981,72,3:09,"Raptors lineup change (Brandon Ingram, Ja'Kobe Walter, Scottie Barnes, RJ Barrett, Jamal Shead)",lineupchange,77,,basketball_play,1773193608,147,True,2026-03-11 01:46:48+00:00,3,189.0,1971.0,32.85,323
2,34,quarter,3,a8625e4b-4ae6-4062-a7c1-0b6e1f4ae211,72,3:09,"Rockets lineup change (Reed Sheppard, Tari Eason, Clint Capela, Dorian Finney-Smith, Amen Thompson)",lineupchange,77,,basketball_play,1773193608,146,True,2026-03-11 01:46:48+00:00,3,189.0,1971.0,32.85,324
2,33,quarter,3,96c447dd-2cdd-4c58-a151-ef0df87de981,74,2:53,Scottie Barnes makes two point pullup jump shot,twopointmade,77,a8625e4b-4ae6-4062-a7c1-0b6e1f4ae211,basketball_play,1773193648,145,True,2026-03-11 01:47:28+00:00,3,173.0,1987.0,33.11666666666667,325
2,32,quarter,3,a8625e4b-4ae6-4062-a7c1-0b6e1f4ae211,74,2:32,Dorian Finney-Smith misses two point cutting layup,twopointmiss,77,,basketball_play,1773193669,144,True,2026-03-11 01:47:49+00:00,3,152.0,2008.0,33.46666666666667,326
2,31,quarter,3,a8625e4b-4ae6-4062-a7c1-0b6e1f4ae211,74,2:32,Clint Capela offensive rebound,rebound,77,a8625e4b-4ae6-4062-a7c1-0b6e1f4ae211,basketball_play,1773193669,143,True,2026-03-11 01:47:49+00:00,3,152.0,2008.0,33.46666666666667,327
2,30,quarter,3,a8625e4b-4ae6-4062-a7c1-0b6e1f4ae211,74,2:30,Clint Capela makes two point putback layup,twopointmade,79,96c447dd-2cdd-4c58-a151-ef0df87de981,basketball_play,1773193671,142,True,2026-03-11 01:47:51+00:00,3,150.0,2010.0,33.5,328
2,29,quarter,3,96c447dd-2cdd-4c58-a151-ef0df87de981,74,2:19,Brandon Ingram misses two point turnaround fadeaway jump shot,twopointmiss,79,,basketball_play,1773193681,141,True,2026-03-11 01:48:01+00:00,3,139.0,2021.0,33.68333333333333,329
2,28,quarter,3,a8625e4b-4ae6-4062-a7c1-0b6e1f4ae211,74,2:19,Dorian Finney-Smith defensive rebound,rebound,79,a8625e4b-4ae6-4062-a7c1-0b6e1f4ae211,basketball_play,1773193681,140,True,2026-03-11 01:48:01+00:00,3,139.0,2021.0,33.68333333333333,330
2,27,quarter,3,a8625e4b-4ae6-4062-a7c1-0b6e1f4ae211,74,2:06,Ja'Kobe Walter blocks Reed Sheppard's two point driving floating jump shot,twopointmiss,79,,basketball_play,1773193691,139,True,2026-03-11 01:48:11+00:00,3,126.0,2034.0,33.9,331
2,26,quarter,3,a8625e4b-4ae6-4062-a7c1-0b6e1f4ae211,74,2:05,Clint Capela offensive rebound,rebound,79,a8625e4b-4ae6-4062-a7c1-0b6e1f4ae211,basketball_play,1773193692,138,True,2026-03-11 01:48:12+00:00,3,125.0,2035.0,33.916666666666664,332
2,25,quarter,3,a8625e4b-4ae6-4062-a7c1-0b6e1f4ae211,74,2:02,Dorian Finney-Smith makes three point jump shot (Clint Capela assists),threepointmade,82,96c447dd-2cdd-4c58-a151-ef0df87de981,basketball_play,1773193700,137,True,2026-03-11 01:48:20+00:00,3,122.0,2038.0,33.96666666666667,333
2,24,quarter,3,a8625e4b-4ae6-4062-a7c1-0b6e1f4ae211,74,1:54,Clint Capela shooting foul (Scottie Barnes draws the foul),shootingfoul,82,96c447dd-2cdd-4c58-a151-ef0df87de981,basketball_play,1773193710,136,True,2026-03-11 01:48:30+00:00,3,114.0,2046.0,34.1,334
2,23,quarter,3,96c447dd-2cdd-4c58-a151-ef0df87de981,75,1:54,Scottie Barnes makes regular free throw 1 of 2,freethrowmade,82,96c447dd-2cdd-4c58-a151-ef0df87de981,basketball_play,1773193739,135,True,2026-03-11 01:48:59+00:00,3,114.0,2046.0,34.1,335
2,22,quarter,3,96c447dd-2cdd-4c58-a151-ef0df87de981,75,1:54,"Raptors lineup change (Ja'Kobe Walter, Scottie Barnes, RJ Barrett, Jamison Battle, Jamal Shead)",lineupchange,82,,basketball_play,1773193752,134,True,2026-03-11 01:49:12+00:00,3,114.0,2046.0,34.1,336
2,21,quarter,3,96c447dd-2cdd-4c58-a151-ef0df87de981,76,1:54,Scottie Barnes makes regular free throw 2 of 2,freethrowmade,82,a8625e4b-4ae6-4062-a7c1-0b6e1f4ae211,basketball_play,1773193752,133,True,2026-03-11 01:49:12+00:00,3,114.0,2046.0,34.1,337
2,20,quarter,3,a8625e4b-4ae6-4062-a7c1-0b6e1f4ae211,76,1:38,Reed Sheppard makes two point pullup jump shot (Clint Capela assists),twopointmade,84,96c447dd-2cdd-4c58-a151-ef0df87de981,basketball_play,1773193770,132,True,2026-03-11 01:49:30+00:00,3,98.0,2062.0,34.36666666666667,338
2,19,quarter,3,a8625e4b-4ae6-4062-a7c1-0b6e1f4ae211,76,1:20,Reed Sheppard shooting foul (Jamal Shead draws the foul),shootingfoul,84,96c447dd-2cdd-4c58-a151-ef0df87de981,basketball_play,1773193788,131,True,2026-03-11 01:49:48+00:00,3,80.0,2080.0,34.666666666666664,339
2,18,quarter,3,96c447dd-2cdd-4c58-a151-ef0df87de981,76,1:20,Jamal Shead misses regular free throw 1 of 2,freethrowmiss,84,96c447dd-2cdd-4c58-a151-ef0df87de981,basketball_play,1773193819,130,True,2026-03-11 01:50:19+00:00,3,80.0,2080.0,34.666666666666664,340
2,17,quarter,3,96c447dd-2cdd-4c58-a151-ef0df87de981,76,1:20,Raptors offensive rebound,rebound,84,96c447dd-2cdd-4c58-a151-ef0df87de981,basketball_play,1773193819,129,True,2026-03-11 01:50:19+00:00,3,80.0,2080.0,34.666666666666664,341
2,16,quarter,3,a8625e4b-4ae6-4062-a7c1-0b6e1f4ae211,76,1:20,"Rockets lineup change (Jabari Smith Jr., Reed Sheppard, Clint Capela, Dorian Finney-Smith, Amen Thompson)",lineupchange,84,,basketball_play,1773193840,128,True,2026-03-11 01:50:40+00:00,3,80.0,2080.0,34.666666666666664,342
2,15,quarter,3,96c447dd-2cdd-4c58-a151-ef0df87de981,76,1:20,Jamal Shead misses regular free throw 2 of 2,freethrowmiss,84,,basketball_play,1773193819,127,True,2026-03-11 01:50:19+00:00,3,80.0,2080.0,34.666666666666664,343
2,14,quarter,3,a8625e4b-4ae6-4062-a7c1-0b6e1f4ae211,76,1:20,Clint Capela defensive rebound,rebound,84,a8625e4b-4ae6-4062-a7c1-0b6e1f4ae211,basketball_play,1773193819,126,True,2026-03-11 01:50:19+00:00,3,80.0,2080.0,34.666666666666664,344
2,13,quarter,3,a8625e4b-4ae6-4062-a7c1-0b6e1f4ae211,76,1:14,Dorian Finney-Smith offensive foul (Jamal Shead draws the foul),offensivefoul,84,96c447dd-2cdd-4c58-a151-ef0df87de981,basketball_play,1773193850,125,True,2026-03-11 01:50:50+00:00,3,74.0,2086.0,34.766666666666666,345
2,12,quarter,3,a8625e4b-4ae6-4062-a7c1-0b6e1f4ae211,76,1:14,Dorian Finney-Smith turnover (offensive foul),turnover,84,96c447dd-2cdd-4c58-a151-ef0df87de981,basketball_play,1773193850,124,True,2026-03-11 01:50:50+00:00,3,74.0,2086.0,34.766666666666666,346
2,11,quarter,3,96c447dd-2cdd-4c58-a151-ef0df87de981,79,1:05,Ja'Kobe Walter makes three point jump shot (Jamal Shead assists),threepointmade,84,a8625e4b-4ae6-4062-a7c1-0b6e1f4ae211,basketball_play,1773193870,123,True,2026-03-11 01:51:10+00:00,3,65.0,2095.0,34.916666666666664,347
2,10,quarter,3,a8625e4b-4ae6-4062-a7c1-0b6e1f4ae211,79,1:04,Rockets 60 second timeout,teamtimeout,84,,basketball_play,1773193881,122,True,2026-03-11 01:51:21+00:00,3,64.0,2096.0,34.93333333333333,348
2,9,quarter,3,96c447dd-2cdd-4c58-a151-ef0df87de981,79,1:04,"Raptors lineup change (Ja'Kobe Walter, Scottie Barnes, Gradey Dick, Jamison Battle, Jamal Shead)",lineupchange,84,,basketball_play,1773193983,121,True,2026-03-11 01:53:03+00:00,3,64.0,2096.0,34.93333333333333,349
2,8,quarter,3,96c447dd-2cdd-4c58-a151-ef0df87de981,79,00:51.10,Ja'Kobe Walter personal foul (Amen Thompson draws the foul),personalfoul,84,a8625e4b-4ae6-4062-a7c1-0b6e1f4ae211,basketball_play,1773193983,120,True,2026-03-11 01:53:03+00:00,3,51.1,2108.9,35.14833333333333,350
2,7,quarter,3,a8625e4b-4ae6-4062-a7c1-0b6e1f4ae211,79,00:51.10,Amen Thompson makes regular free throw 1 of 2,freethrowmade,85,a8625e4b-4ae6-4062-a7c1-0b6e1f4ae211,basketball_play,1773194009,119,True,2026-03-11 01:53:29+00:00,3,51.1,2108.9,35.14833333333333,351
2,6,quarter,3,a8625e4b-4ae6-4062-a7c1-0b6e1f4ae211,79,00:51.10,Amen Thompson makes regular free throw 2 of 2,freethrowmade,86,96c447dd-2cdd-4c58-a151-ef0df87de981,basketball_play,1773194023,118,True,2026-03-11 01:53:43+00:00,3,51.1,2108.9,35.14833333333333,352
2,5,quarter,3,96c447dd-2cdd-4c58-a151-ef0df87de981,81,00:35,Jamal Shead makes two point driving floating jump shot,twopointmade,86,a8625e4b-4ae6-4062-a7c1-0b6e1f4ae211,basketball_play,1773194042,117,True,2026-03-11 01:54:02+00:00,3,35.0,2125.0,35.416666666666664,353
2,4,quarter,3,a8625e4b-4ae6-4062-a7c1-0b6e1f4ae211,81,00:15,Amen Thompson turnover (lost ball) (Ja'Kobe Walter steals),turnover,86,96c447dd-2cdd-4c58-a151-ef0df87de981,basketball_play,1773194066,116,True,2026-03-11 01:54:26+00:00,3,15.0,2145.0,35.75,354
2,3,quarter,3,96c447dd-2cdd-4c58-a151-ef0df87de981,83,00:10.70,Gradey Dick makes two point running layup,twopointmade,86,a8625e4b-4ae6-4062-a7c1-0b6e1f4ae211,basketball_play,1773194068,115,True,2026-03-11 01:54:28+00:00,3,10.7,2149.3,35.82166666666667,355
2,2,quarter,3,a8625e4b-4ae6-4062-a7c1-0b6e1f4ae211,83,00:01.30,Reed Sheppard turnover (lost ball) (Ja'Kobe Walter steals),turnover,86,96c447dd-2cdd-4c58-a151-ef0df87de981,basketball_play,1773194070,114,True,2026-03-11 01:54:30+00:00,3,1.3,2158.7,35.97833333333333,356
2,1,quarter,3,,83,00:00,End of 3rd Quarter.,endperiod,86,,basketball_play,1773194093,113,True,2026-03-11 01:54:53+00:00,3,0.0,2160.0,36.0,357
1,113,quarter,4,96c447dd-2cdd-4c58-a151-ef0df87de981,83,12:00,"Raptors lineup change (Sandro Mamukelashvili, Brandon Ingram, Ja'Kobe Walter, Immanuel Quickley, Jamal Shead)",lineupchange,86,,basketball_play,1773194222,112,True,2026-03-11 01:57:02+00:00,4,720.0,2160.0,36.0,358
1,112,quarter,4,a8625e4b-4ae6-4062-a7c1-0b6e1f4ae211,83,12:00,"Rockets lineup change (Jabari Smith Jr., Reed Sheppard, Dorian Finney-Smith, Alperen Sengun, Amen Thompson)",lineupchange,86,,basketball_play,1773194222,111,True,2026-03-11 01:57:02+00:00,4,720.0,2160.0,36.0,359
1,111,quarter,4,,83,12:00,Start of 4th Quarter,startperiod,86,,basketball_play,1773194246,110,True,2026-03-11 01:57:26+00:00,4,720.0,2160.0,36.0,360
1,110,quarter,4,a8625e4b-4ae6-4062-a7c1-0b6e1f4ae211,83,11:45,Amen Thompson makes two point cutting layup (Alperen Sengun assists),twopointmade,88,96c447dd-2cdd-4c58-a151-ef0df87de981,basketball_play,1773194260,109,True,2026-03-11 01:57:40+00:00,4,705.0,2175.0,36.25,361
1,109,quarter,4,96c447dd-2cdd-4c58-a151-ef0df87de981,83,11:22,Brandon Ingram turnover (traveling),turnover,88,a8625e4b-4ae6-4062-a7c1-0b6e1f4ae211,basketball_play,1773194288,108,True,2026-03-11 01:58:08+00:00,4,682.0,2198.0,36.63333333333333,362
1,108,quarter,4,a8625e4b-4ae6-4062-a7c1-0b6e1f4ae211,83,11:04,Reed Sheppard misses three point pullup jump shot,threepointmiss,88,,basketball_play,1773194313,107,True,2026-03-11 01:58:33+00:00,4,664.0,2216.0,36.93333333333333,363
1,107,quarter,4,96c447dd-2cdd-4c58-a151-ef0df87de981,83,11:01,Ja'Kobe Walter defensive rebound,rebound,88,96c447dd-2cdd-4c58-a151-ef0df87de981,basketball_play,1773194316,106,True,2026-03-11 01:58:36+00:00,4,661.0,2219.0,36.983333333333334,364
1,106,quarter,4,96c447dd-2cdd-4c58-a151-ef0df87de981,83,10:47,Ja'Kobe Walter misses three point jump shot,threepointmiss,88,,basketball_play,1773194330,105,True,2026-03-11 01:58:50+00:00,4,647.0,2233.0,37.21666666666667,365
1,105,quarter,4,a8625e4b-4ae6-4062-a7c1-0b6e1f4ae211,83,10:44,Alperen Sengun defensive rebound,rebound,88,a8625e4b-4ae6-4062-a7c1-0b6e1f4ae211,basketball_play,1773194333,104,True,2026-03-11 01:58:53+00:00,4,644.0,2236.0,37.266666666666666,366
1,104,quarter,4,a8625e4b-4ae6-4062-a7c1-0b6e1f4ae211,83,10:33,Jamal Shead blocks Reed Sheppard's two point pullup jump shot,twopointmiss,88,,basketball_play,1773194345,103,True,2026-03-11 01:59:05+00:00,4,633.0,2247.0,37.45,367
1,103,quarter,4,96c447dd-2cdd-4c58-a151-ef0df87de981,83,10:30,Jamal Shead defensive rebound,rebound,88,96c447dd-2cdd-4c58-a151-ef0df87de981,basketball_play,1773194348,102,True,2026-03-11 01:59:08+00:00,4,630.0,2250.0,37.5,368
1,102,quarter,4,96c447dd-2cdd-4c58-a151-ef0df87de981,83,10:27,Jamal Shead turnover (bad pass) (Dorian Finney-Smith steals),turnover,88,a8625e4b-4ae6-4062-a7c1-0b6e1f4ae211,basketball_play,1773194352,101,True,2026-03-11 01:59:12+00:00,4,627.0,2253.0,37.55,369
1,101,quarter,4,a8625e4b-4ae6-4062-a7c1-0b6e1f4ae211,83,10:22,Alperen Sengun makes two point running dunk,twopointmade,90,96c447dd-2cdd-4c58-a151-ef0df87de981,basketball_play,1773194357,100,True,2026-03-11 01:59:17+00:00,4,622.0,2258.0,37.63333333333333,370
1,100,quarter,4,96c447dd-2cdd-4c58-a151-ef0df87de981,83,10:22,Jamal Shead shooting foul (Alperen Sengun draws the foul),shootingfoul,90,a8625e4b-4ae6-4062-a7c1-0b6e1f4ae211,basketball_play,1773194371,99,True,2026-03-11 01:59:31+00:00,4,622.0,2258.0,37.63333333333333,371
1,99,quarter,4,96c447dd-2cdd-4c58-a151-ef0df87de981,83,10:22,Raptors 60 second timeout,teamtimeout,90,,basketball_play,1773194393,98,True,2026-03-11 01:59:53+00:00,4,622.0,2258.0,37.63333333333333,372
1,98,quarter,4,96c447dd-2cdd-4c58-a151-ef0df87de981,83,10:22,"Raptors lineup change (Sandro Mamukelashvili, Brandon Ingram, Ja'Kobe Walter, Scottie Barnes, Immanuel Quickley)",lineupchange,90,,basketball_play,1773194565,97,True,2026-03-11 02:02:45+00:00,4,622.0,2258.0,37.63333333333333,373
1,97,quarter,4,a8625e4b-4ae6-4062-a7c1-0b6e1f4ae211,83,10:22,Alperen Sengun makes regular free throw 1 of 1,freethrowmade,91,,basketball_play,1773194565,96,True,2026-03-11 02:02:45+00:00,4,622.0,2258.0,37.63333333333333,374
1,96,quarter,4,96c447dd-2cdd-4c58-a151-ef0df87de981,85,10:13,Scottie Barnes makes two point alley-oop dunk (Sandro Mamukelashvili assists),twopointmade,91,a8625e4b-4ae6-4062-a7c1-0b6e1f4ae211,basketball_play,1773194578,95,True,2026-03-11 02:02:58+00:00,4,613.0,2267.0,37.78333333333333,375
1,95,quarter,4,96c447dd-2cdd-4c58-a151-ef0df87de981,85,9:52,Immanuel Quickley shooting foul (Jabari Smith Jr. draws the foul),shootingfoul,91,a8625e4b-4ae6-4062-a7c1-0b6e1f4ae211,basketball_play,1773194619,94,True,2026-03-11 02:03:39+00:00,4,592.0,2288.0,38.13333333333333,376
1,94,quarter,4,a8625e4b-4ae6-4062-a7c1-0b6e1f4ae211,85,9:52,Jabari Smith Jr. makes regular free throw 1 of 2,freethrowmade,92,a8625e4b-4ae6-4062-a7c1-0b6e1f4ae211,basketball_play,1773194631,93,True,2026-03-11 02:03:51+00:00,4,592.0,2288.0,38.13333333333333,377
1,93,quarter,4,a8625e4b-4ae6-4062-a7c1-0b6e1f4ae211,85,9:52,Jabari Smith Jr. makes regular free throw 2 of 2,freethrowmade,93,96c447dd-2cdd-4c58-a151-ef0df87de981,basketball_play,1773194651,92,True,2026-03-11 02:04:11+00:00,4,592.0,2288.0,38.13333333333333,378
1,92,quarter,4,96c447dd-2cdd-4c58-a151-ef0df87de981,87,9:37,Scottie Barnes makes two point pullup jump shot (Sandro Mamukelashvili assists),twopointmade,93,a8625e4b-4ae6-4062-a7c1-0b6e1f4ae211,basketball_play,1773194674,91,True,2026-03-11 02:04:34+00:00,4,577.0,2303.0,38.38333333333333,379
1,91,quarter,4,a8625e4b-4ae6-4062-a7c1-0b6e1f4ae211,87,9:20,Reed Sheppard misses three point pullup jump shot,threepointmiss,93,,basketball_play,1773194692,90,True,2026-03-11 02:04:52+00:00,4,560.0,2320.0,38.666666666666664,380
1,90,quarter,4,96c447dd-2cdd-4c58-a151-ef0df87de981,87,9:15,Scottie Barnes defensive rebound,rebound,93,96c447dd-2cdd-4c58-a151-ef0df87de981,basketball_play,1773194697,89,True,2026-03-11 02:04:57+00:00,4,555.0,2325.0,38.75,381
1,89,quarter,4,96c447dd-2cdd-4c58-a151-ef0df87de981,87,9:09,Immanuel Quickley misses three point pullup jump shot,threepointmiss,93,,basketball_play,1773194701,88,True,2026-03-11 02:05:01+00:00,4,549.0,2331.0,38.85,382
1,88,quarter,4,a8625e4b-4ae6-4062-a7c1-0b6e1f4ae211,87,9:05,Jabari Smith Jr. defensive rebound,rebound,93,a8625e4b-4ae6-4062-a7c1-0b6e1f4ae211,basketball_play,1773194705,87,True,2026-03-11 02:05:05+00:00,4,545.0,2335.0,38.916666666666664,383
1,87,quarter,4,a8625e4b-4ae6-4062-a7c1-0b6e1f4ae211,87,8:44,Amen Thompson makes three point jump shot (Jabari Smith Jr. assists),threepointmade,96,96c447dd-2cdd-4c58-a151-ef0df87de981,basketball_play,1773194727,86,True,2026-03-11 02:05:27+00:00,4,524.0,2356.0,39.266666666666666,384
1,86,quarter,4,96c447dd-2cdd-4c58-a151-ef0df87de981,87,8:28,Sandro Mamukelashvili turnover (bad pass) (Jabari Smith Jr. steals),turnover,96,a8625e4b-4ae6-4062-a7c1-0b6e1f4ae211,basketball_play,1773194743,85,True,2026-03-11 02:05:43+00:00,4,508.0,2372.0,39.53333333333333,385
1,85,quarter,4,a8625e4b-4ae6-4062-a7c1-0b6e1f4ae211,87,8:24,Jabari Smith Jr. makes two point running dunk,twopointmade,98,96c447dd-2cdd-4c58-a151-ef0df87de981,basketball_play,1773194747,84,True,2026-03-11 02:05:47+00:00,4,504.0,2376.0,39.6,386
1,84,quarter,4,96c447dd-2cdd-4c58-a151-ef0df87de981,87,8:02,Brandon Ingram misses three point pullup jump shot,threepointmiss,98,,basketball_play,1773194770,83,True,2026-03-11 02:06:10+00:00,4,482.0,2398.0,39.96666666666667,387
1,83,quarter,4,96c447dd-2cdd-4c58-a151-ef0df87de981,87,7:59,Ja'Kobe Walter offensive rebound,rebound,98,96c447dd-2cdd-4c58-a151-ef0df87de981,basketball_play,1773194772,82,True,2026-03-11 02:06:12+00:00,4,479.0,2401.0,40.016666666666666,388
1,82,quarter,4,96c447dd-2cdd-4c58-a151-ef0df87de981,87,7:56,Brandon Ingram misses three point jump shot,threepointmiss,98,,basketball_play,1773194774,81,True,2026-03-11 02:06:14+00:00,4,476.0,2404.0,40.06666666666667,389
1,81,quarter,4,a8625e4b-4ae6-4062-a7c1-0b6e1f4ae211,87,7:54,Jabari Smith Jr. defensive rebound,rebound,98,a8625e4b-4ae6-4062-a7c1-0b6e1f4ae211,basketball_play,1773194776,80,True,2026-03-11 02:06:16+00:00,4,474.0,2406.0,40.1,390
1,80,quarter,4,a8625e4b-4ae6-4062-a7c1-0b6e1f4ae211,87,7:40,Jabari Smith Jr. makes two point driving layup (Amen Thompson assists),twopointmade,100,96c447dd-2cdd-4c58-a151-ef0df87de981,basketball_play,1773194794,79,True,2026-03-11 02:06:34+00:00,4,460.0,2420.0,40.333333333333336,391
1,79,quarter,4,96c447dd-2cdd-4c58-a151-ef0df87de981,87,7:40,Brandon Ingram shooting foul (Jabari Smith Jr. draws the foul),shootingfoul,100,a8625e4b-4ae6-4062-a7c1-0b6e1f4ae211,basketball_play,1773194801,78,True,2026-03-11 02:06:41+00:00,4,460.0,2420.0,40.333333333333336,392
1,78,quarter,4,96c447dd-2cdd-4c58-a151-ef0df87de981,87,7:40,Brandon Ingram technical foul,technicalfoul,100,a8625e4b-4ae6-4062-a7c1-0b6e1f4ae211,basketball_play,1773194823,77,True,2026-03-11 02:07:03+00:00,4,460.0,2420.0,40.333333333333336,393
1,77,quarter,4,a8625e4b-4ae6-4062-a7c1-0b6e1f4ae211,87,7:40,Jabari Smith Jr. makes technical free throw 1 of 1,freethrowmade,101,,basketball_play,1773194831,76,True,2026-03-11 02:07:11+00:00,4,460.0,2420.0,40.333333333333336,394
1,76,quarter,4,96c447dd-2cdd-4c58-a151-ef0df87de981,87,7:40,"Raptors lineup change (Sandro Mamukelashvili, Brandon Ingram, Scottie Barnes, RJ Barrett, Jamal Shead)",lineupchange,101,,basketball_play,1773194833,75,True,2026-03-11 02:07:13+00:00,4,460.0,2420.0,40.333333333333336,395
1,75,quarter,4,a8625e4b-4ae6-4062-a7c1-0b6e1f4ae211,87,7:40,"Rockets lineup change (Jabari Smith Jr., Reed Sheppard, Tari Eason, Kevin Durant, Alperen Sengun)",lineupchange,101,,basketball_play,1773194833,74,True,2026-03-11 02:07:13+00:00,4,460.0,2420.0,40.333333333333336,396
1,74,quarter,4,a8625e4b-4ae6-4062-a7c1-0b6e1f4ae211,87,7:40,Jabari Smith Jr. makes regular free throw 1 of 1,freethrowmade,102,,basketball_play,1773194861,73,True,2026-03-11 02:07:41+00:00,4,460.0,2420.0,40.333333333333336,397
1,73,quarter,4,96c447dd-2cdd-4c58-a151-ef0df87de981,90,7:27,RJ Barrett makes three point jump shot (Brandon Ingram assists),threepointmade,102,a8625e4b-4ae6-4062-a7c1-0b6e1f4ae211,basketball_play,1773194875,72,True,2026-03-11 02:07:55+00:00,4,447.0,2433.0,40.55,398
1,72,quarter,4,a8625e4b-4ae6-4062-a7c1-0b6e1f4ae211,90,7:09,RJ Barrett blocks Alperen Sengun's two point turnaround hook shot,twopointmiss,102,,basketball_play,1773194894,71,True,2026-03-11 02:08:14+00:00,4,429.0,2451.0,40.85,399
1,71,quarter,4,a8625e4b-4ae6-4062-a7c1-0b6e1f4ae211,90,7:09,Rockets offensive rebound,rebound,102,a8625e4b-4ae6-4062-a7c1-0b6e1f4ae211,basketball_play,1773194894,70,True,2026-03-11 02:08:14+00:00,4,429.0,2451.0,40.85,400
1,70,quarter,4,,90,7:09,Stoppage (Out of bounds),stoppage,102,,basketball_play,1773194900,69,True,2026-03-11 02:08:20+00:00,4,429.0,2451.0,40.85,401
1,69,quarter,4,a8625e4b-4ae6-4062-a7c1-0b6e1f4ae211,90,7:00,Alperen Sengun misses three point stepback jump shot,threepointmiss,102,,basketball_play,1773194924,68,True,2026-03-11 02:08:44+00:00,4,420.0,2460.0,41.0,402
1,68,quarter,4,96c447dd-2cdd-4c58-a151-ef0df87de981,90,7:00,Raptors defensive rebound,rebound,102,96c447dd-2cdd-4c58-a151-ef0df87de981,basketball_play,1773194924,67,True,2026-03-11 02:08:44+00:00,4,420.0,2460.0,41.0,403
1,67,quarter,4,,90,7:00,Stoppage (Out of bounds),stoppage,102,,basketball_play,1773194929,66,True,2026-03-11 02:08:49+00:00,4,420.0,2460.0,41.0,404
1,66,quarter,4,96c447dd-2cdd-4c58-a151-ef0df87de981,90,6:51,RJ Barrett misses three point jump shot,threepointmiss,102,,basketball_play,1773194947,65,True,2026-03-11 02:09:07+00:00,4,411.0,2469.0,41.15,405
1,65,quarter,4,a8625e4b-4ae6-4062-a7c1-0b6e1f4ae211,90,6:48,Alperen Sengun defensive rebound,rebound,102,a8625e4b-4ae6-4062-a7c1-0b6e1f4ae211,basketball_play,1773194950,64,True,2026-03-11 02:09:10+00:00,4,408.0,2472.0,41.2,406
1,64,quarter,4,a8625e4b-4ae6-4062-a7c1-0b6e1f4ae211,90,6:34,Jabari Smith Jr. misses three point jump shot,threepointmiss,102,,basketball_play,1773194964,63,True,2026-03-11 02:09:24+00:00,4,394.0,2486.0,41.43333333333333,407
1,63,quarter,4,96c447dd-2cdd-4c58-a151-ef0df87de981,90,6:30,Sandro Mamukelashvili defensive rebound,rebound,102,96c447dd-2cdd-4c58-a151-ef0df87de981,basketball_play,1773194968,62,True,2026-03-11 02:09:28+00:00,4,390.0,2490.0,41.5,408
1,62,quarter,4,a8625e4b-4ae6-4062-a7c1-0b6e1f4ae211,90,6:24,Alperen Sengun shooting foul (RJ Barrett draws the foul),shootingfoul,102,96c447dd-2cdd-4c58-a151-ef0df87de981,basketball_play,1773194977,61,True,2026-03-11 02:09:37+00:00,4,384.0,2496.0,41.6,409
1,61,quarter,4,96c447dd-2cdd-4c58-a151-ef0df87de981,91,6:24,RJ Barrett makes regular free throw 1 of 2,freethrowmade,102,96c447dd-2cdd-4c58-a151-ef0df87de981,basketball_play,1773195003,60,True,2026-03-11 02:10:03+00:00,4,384.0,2496.0,41.6,410
1,60,quarter,4,96c447dd-2cdd-4c58-a151-ef0df87de981,91,6:24,RJ Barrett misses regular free throw 2 of 2,freethrowmiss,102,,basketball_play,1773195003,59,True,2026-03-11 02:10:03+00:00,4,384.0,2496.0,41.6,411
1,59,quarter,4,a8625e4b-4ae6-4062-a7c1-0b6e1f4ae211,91,6:24,Tari Eason defensive rebound,rebound,102,a8625e4b-4ae6-4062-a7c1-0b6e1f4ae211,basketball_play,1773195003,58,True,2026-03-11 02:10:03+00:00,4,384.0,2496.0,41.6,412
1,58,quarter,4,a8625e4b-4ae6-4062-a7c1-0b6e1f4ae211,91,6:03,Alperen Sengun misses two point hook shot,twopointmiss,102,,basketball_play,1773195037,57,True,2026-03-11 02:10:37+00:00,4,363.0,2517.0,41.95,413
1,57,quarter,4,96c447dd-2cdd-4c58-a151-ef0df87de981,91,6:01,RJ Barrett defensive rebound,rebound,102,96c447dd-2cdd-4c58-a151-ef0df87de981,basketball_play,1773195039,56,True,2026-03-11 02:10:39+00:00,4,361.0,2519.0,41.983333333333334,414
1,56,quarter,4,96c447dd-2cdd-4c58-a151-ef0df87de981,91,5:52,Sandro Mamukelashvili misses three point jump shot,threepointmiss,102,,basketball_play,1773195047,55,True,2026-03-11 02:10:47+00:00,4,352.0,2528.0,42.13333333333333,415
1,55,quarter,4,a8625e4b-4ae6-4062-a7c1-0b6e1f4ae211,91,5:50,Kevin Durant defensive rebound,rebound,102,a8625e4b-4ae6-4062-a7c1-0b6e1f4ae211,basketball_play,1773195049,54,True,2026-03-11 02:10:49+00:00,4,350.0,2530.0,42.166666666666664,416
1,54,quarter,4,a8625e4b-4ae6-4062-a7c1-0b6e1f4ae211,91,5:41,Tari Eason makes two point driving layup (Kevin Durant assists),twopointmade,104,96c447dd-2cdd-4c58-a151-ef0df87de981,basketball_play,1773195058,53,True,2026-03-11 02:10:58+00:00,4,341.0,2539.0,42.31666666666667,417
1,53,quarter,4,96c447dd-2cdd-4c58-a151-ef0df87de981,91,5:18,Scottie Barnes misses two point turnaround hook shot,twopointmiss,104,,basketball_play,1773195082,52,True,2026-03-11 02:11:22+00:00,4,318.0,2562.0,42.7,418
