period_index,event_index,period_type,period_number,attribution,away_points,clock,description,event_type,home_points,possession,type,wall_clock,pbp_source_row,has_wall_clock,event_ts_utc,period_sequence,game_clock_seconds_remaining,game_elapsed_seconds,game_elapsed_minutes,pbp_chronological_index
4,114,quarter,1,ba2cb6be-9827-46a8-8e6f-d8661307ba77,0,12:00,"Nuggets lineup change (Jonas Valanciunas, Jamal Murray, Nikola Jokic, Christian Braun, Julian Strawther)",lineupchange,0,,basketball_play,1772503894,456,True,2026-03-03 02:11:34+00:00,1,720.0,0.0,0.0,1
4,113,quarter,1,6f60dfb1-fda1-423f-b76f-67e9d24b9644,0,12:00,"Jazz lineup change (Keyonte George, Cody Williams, Elijah Harkless, Ace Bailey, Kyle Filipowski)",lineupchange,0,,basketball_play,1772503894,455,True,2026-03-03 02:11:34+00:00,1,720.0,0.0,0.0,2
4,112,quarter,1,,0,12:00,Start of 1st Quarter,startperiod,0,,basketball_play,1772503894,454,True,2026-03-03 02:11:34+00:00,1,720.0,0.0,0.0,3
4,111,quarter,1,6f60dfb1-fda1-423f-b76f-67e9d24b9644,0,12:00,Nikola Jokic vs. Kyle Filipowski (Keyonte George gains possession),opentip,0,6f60dfb1-fda1-423f-b76f-67e9d24b9644,basketball_play,1772503897,453,True,2026-03-03 02:11:37+00:00,1,720.0,0.0,0.0,4
4,110,quarter,1,6f60dfb1-fda1-423f-b76f-67e9d24b9644,0,11:43,Ace Bailey misses three point stepback jump shot,threepointmiss,0,,basketball_play,1772503910,452,True,2026-03-03 02:11:50+00:00,1,703.0,17.0,0.2833333333333333,5
4,109,quarter,1,ba2cb6be-9827-46a8-8e6f-d8661307ba77,0,11:41,Nuggets defensive rebound,rebound,0,ba2cb6be-9827-46a8-8e6f-d8661307ba77,basketball_play,1772503912,451,True,2026-03-03 02:11:52+00:00,1,701.0,19.0,0.31666666666666665,6
4,108,quarter,1,,0,11:41,Stoppage (Out of bounds),stoppage,0,,basketball_play,1772503915,450,True,2026-03-03 02:11:55+00:00,1,701.0,19.0,0.31666666666666665,7
4,107,quarter,1,6f60dfb1-fda1-423f-b76f-67e9d24b9644,0,11:29,Kyle Filipowski personal foul (Jonas Valanciunas draws the foul),personalfoul,0,ba2cb6be-9827-46a8-8e6f-d8661307ba77,basketball_play,1772503938,449,True,2026-03-03 02:12:18+00:00,1,689.0,31.0,0.5166666666666667,8
4,106,quarter,1,6f60dfb1-fda1-423f-b76f-67e9d24b9644,0,11:25,Ace Bailey shooting foul (Jamal Murray draws the foul),shootingfoul,0,ba2cb6be-9827-46a8-8e6f-d8661307ba77,basketball_play,1772503959,448,True,2026-03-03 02:12:39+00:00,1,685.0,35.0,0.5833333333333334,9
4,105,quarter,1,ba2cb6be-9827-46a8-8e6f-d8661307ba77,1,11:25,Jamal Murray makes regular free throw 1 of 2,freethrowmade,0,ba2cb6be-9827-46a8-8e6f-d8661307ba77,basketball_play,1772503986,447,True,2026-03-03 02:13:06+00:00,1,685.0,35.0,0.5833333333333334,10
4,104,quarter,1,ba2cb6be-9827-46a8-8e6f-d8661307ba77,2,11:25,Jamal Murray makes regular free throw 2 of 2,freethrowmade,0,6f60dfb1-fda1-423f-b76f-67e9d24b9644,basketball_play,1772504005,446,True,2026-03-03 02:13:25+00:00,1,685.0,35.0,0.5833333333333334,11
4,103,quarter,1,ba2cb6be-9827-46a8-8e6f-d8661307ba77,2,11:18,Christian Braun shooting foul (Keyonte George draws the foul),shootingfoul,0,6f60dfb1-fda1-423f-b76f-67e9d24b9644,basketball_play,1772504016,445,True,2026-03-03 02:13:36+00:00,1,678.0,42.0,0.7,12
4,102,quarter,1,6f60dfb1-fda1-423f-b76f-67e9d24b9644,2,11:18,Keyonte George misses regular free throw 1 of 2,freethrowmiss,0,6f60dfb1-fda1-423f-b76f-67e9d24b9644,basketball_play,1772504046,444,True,2026-03-03 02:14:06+00:00,1,678.0,42.0,0.7,13
4,101,quarter,1,6f60dfb1-fda1-423f-b76f-67e9d24b9644,2,11:18,Jazz offensive rebound,rebound,0,6f60dfb1-fda1-423f-b76f-67e9d24b9644,basketball_play,1772504046,443,True,2026-03-03 02:14:06+00:00,1,678.0,42.0,0.7,14
4,100,quarter,1,6f60dfb1-fda1-423f-b76f-67e9d24b9644,2,11:18,Keyonte George makes regular free throw 2 of 2,freethrowmade,1,ba2cb6be-9827-46a8-8e6f-d8661307ba77,basketball_play,1772504062,442,True,2026-03-03 02:14:22+00:00,1,678.0,42.0,0.7,15
4,99,quarter,1,ba2cb6be-9827-46a8-8e6f-d8661307ba77,2,11:07,Jamal Murray turnover (bad pass) (Elijah Harkless steals),turnover,1,6f60dfb1-fda1-423f-b76f-67e9d24b9644,basketball_play,1772504075,441,True,2026-03-03 02:14:35+00:00,1,667.0,53.0,0.8833333333333333,16
4,98,quarter,1,6f60dfb1-fda1-423f-b76f-67e9d24b9644,2,11:03,Ace Bailey makes two point running layup (Cody Williams assists),twopointmade,3,ba2cb6be-9827-46a8-8e6f-d8661307ba77,basketball_play,1772504079,440,True,2026-03-03 02:14:39+00:00,1,663.0,57.0,0.95,17
4,97,quarter,1,ba2cb6be-9827-46a8-8e6f-d8661307ba77,4,10:49,Jonas Valanciunas makes two point driving layup (Julian Strawther assists),twopointmade,3,6f60dfb1-fda1-423f-b76f-67e9d24b9644,basketball_play,1772504093,439,True,2026-03-03 02:14:53+00:00,1,649.0,71.0,1.1833333333333333,18
4,96,quarter,1,6f60dfb1-fda1-423f-b76f-67e9d24b9644,4,10:33,Elijah Harkless misses three point jump shot,threepointmiss,3,,basketball_play,1772504109,438,True,2026-03-03 02:15:09+00:00,1,633.0,87.0,1.45,19
4,95,quarter,1,ba2cb6be-9827-46a8-8e6f-d8661307ba77,4,10:31,Jamal Murray defensive rebound,rebound,3,ba2cb6be-9827-46a8-8e6f-d8661307ba77,basketball_play,1772504111,437,True,2026-03-03 02:15:11+00:00,1,631.0,89.0,1.4833333333333334,20
4,94,quarter,1,ba2cb6be-9827-46a8-8e6f-d8661307ba77,4,10:22,Julian Strawther misses three point jump shot,threepointmiss,3,,basketball_play,1772504120,436,True,2026-03-03 02:15:20+00:00,1,622.0,98.0,1.6333333333333333,21
4,93,quarter,1,6f60dfb1-fda1-423f-b76f-67e9d24b9644,4,10:19,Kyle Filipowski defensive rebound,rebound,3,6f60dfb1-fda1-423f-b76f-67e9d24b9644,basketball_play,1772504123,435,True,2026-03-03 02:15:23+00:00,1,619.0,101.0,1.6833333333333333,22
4,92,quarter,1,6f60dfb1-fda1-423f-b76f-67e9d24b9644,4,10:11,Keyonte George makes two point pullup jump shot,twopointmade,5,ba2cb6be-9827-46a8-8e6f-d8661307ba77,basketball_play,1772504131,434,True,2026-03-03 02:15:31+00:00,1,611.0,109.0,1.8166666666666667,23
4,91,quarter,1,ba2cb6be-9827-46a8-8e6f-d8661307ba77,4,9:57,Julian Strawther turnover (bad pass) (Cody Williams steals),turnover,5,6f60dfb1-fda1-423f-b76f-67e9d24b9644,basketball_play,1772504145,433,True,2026-03-03 02:15:45+00:00,1,597.0,123.0,2.05,24
4,90,quarter,1,ba2cb6be-9827-46a8-8e6f-d8661307ba77,4,9:52,Julian Strawther shooting foul (Cody Williams draws the foul),shootingfoul,5,6f60dfb1-fda1-423f-b76f-67e9d24b9644,basketball_play,1772504151,432,True,2026-03-03 02:15:51+00:00,1,592.0,128.0,2.1333333333333333,25
4,89,quarter,1,6f60dfb1-fda1-423f-b76f-67e9d24b9644,4,9:52,Cody Williams makes regular free throw 1 of 2,freethrowmade,6,6f60dfb1-fda1-423f-b76f-67e9d24b9644,basketball_play,1772504185,431,True,2026-03-03 02:16:25+00:00,1,592.0,128.0,2.1333333333333333,26
4,88,quarter,1,ba2cb6be-9827-46a8-8e6f-d8661307ba77,4,9:52,"Nuggets lineup change (Jonas Valanciunas, Tim Hardaway Jr., Jamal Murray, Nikola Jokic, Christian Braun)",lineupchange,6,,basketball_play,1772504211,430,True,2026-03-03 02:16:51+00:00,1,592.0,128.0,2.1333333333333333,27
4,87,quarter,1,6f60dfb1-fda1-423f-b76f-67e9d24b9644,4,9:52,Cody Williams misses regular free throw 2 of 2,freethrowmiss,6,,basketball_play,1772504185,429,True,2026-03-03 02:16:25+00:00,1,592.0,128.0,2.1333333333333333,28
4,86,quarter,1,ba2cb6be-9827-46a8-8e6f-d8661307ba77,4,9:51,Christian Braun defensive rebound,rebound,6,ba2cb6be-9827-46a8-8e6f-d8661307ba77,basketball_play,1772504186,428,True,2026-03-03 02:16:26+00:00,1,591.0,129.0,2.15,29
4,85,quarter,1,ba2cb6be-9827-46a8-8e6f-d8661307ba77,4,9:38,Nikola Jokic misses two point jump shot,twopointmiss,6,,basketball_play,1772504224,427,True,2026-03-03 02:17:04+00:00,1,578.0,142.0,2.3666666666666667,30
4,84,quarter,1,6f60dfb1-fda1-423f-b76f-67e9d24b9644,4,9:36,Cody Williams defensive rebound,rebound,6,6f60dfb1-fda1-423f-b76f-67e9d24b9644,basketball_play,1772504226,426,True,2026-03-03 02:17:06+00:00,1,576.0,144.0,2.4,31
4,83,quarter,1,ba2cb6be-9827-46a8-8e6f-d8661307ba77,4,9:23,Jonas Valanciunas shooting foul (Kyle Filipowski draws the foul),shootingfoul,6,6f60dfb1-fda1-423f-b76f-67e9d24b9644,basketball_play,1772504242,425,True,2026-03-03 02:17:22+00:00,1,563.0,157.0,2.6166666666666667,32
4,82,quarter,1,6f60dfb1-fda1-423f-b76f-67e9d24b9644,4,9:23,Kyle Filipowski makes regular free throw 1 of 2,freethrowmade,7,6f60dfb1-fda1-423f-b76f-67e9d24b9644,basketball_play,1772504269,424,True,2026-03-03 02:17:49+00:00,1,563.0,157.0,2.6166666666666667,33
4,81,quarter,1,6f60dfb1-fda1-423f-b76f-67e9d24b9644,4,9:23,Kyle Filipowski makes regular free throw 2 of 2,freethrowmade,8,ba2cb6be-9827-46a8-8e6f-d8661307ba77,basketball_play,1772504294,423,True,2026-03-03 02:18:14+00:00,1,563.0,157.0,2.6166666666666667,34
4,80,quarter,1,ba2cb6be-9827-46a8-8e6f-d8661307ba77,6,9:06,Jamal Murray makes two point fadeaway jump shot,twopointmade,8,6f60dfb1-fda1-423f-b76f-67e9d24b9644,basketball_play,1772504313,422,True,2026-03-03 02:18:33+00:00,1,546.0,174.0,2.9,35
4,79,quarter,1,6f60dfb1-fda1-423f-b76f-67e9d24b9644,6,8:54,Keyonte George turnover (out of bounds bad pass),turnover,8,ba2cb6be-9827-46a8-8e6f-d8661307ba77,basketball_play,1772504327,421,True,2026-03-03 02:18:47+00:00,1,534.0,186.0,3.1,36
4,78,quarter,1,ba2cb6be-9827-46a8-8e6f-d8661307ba77,6,8:44,Jamal Murray misses three point pullup jump shot,threepointmiss,8,,basketball_play,1772504340,420,True,2026-03-03 02:19:00+00:00,1,524.0,196.0,3.2666666666666666,37
4,77,quarter,1,6f60dfb1-fda1-423f-b76f-67e9d24b9644,6,8:40,Kyle Filipowski defensive rebound,rebound,8,6f60dfb1-fda1-423f-b76f-67e9d24b9644,basketball_play,1772504344,419,True,2026-03-03 02:19:04+00:00,1,520.0,200.0,3.3333333333333335,38
4,76,quarter,1,6f60dfb1-fda1-423f-b76f-67e9d24b9644,6,8:35,Elijah Harkless misses two point running layup,twopointmiss,8,,basketball_play,1772504348,418,True,2026-03-03 02:19:08+00:00,1,515.0,205.0,3.4166666666666665,39
4,75,quarter,1,ba2cb6be-9827-46a8-8e6f-d8661307ba77,6,8:31,Christian Braun defensive rebound,rebound,8,ba2cb6be-9827-46a8-8e6f-d8661307ba77,basketball_play,1772504352,417,True,2026-03-03 02:19:12+00:00,1,511.0,209.0,3.4833333333333334,40
4,74,quarter,1,ba2cb6be-9827-46a8-8e6f-d8661307ba77,6,8:15,Tim Hardaway Jr. turnover (bad pass) (Ace Bailey steals),turnover,8,6f60dfb1-fda1-423f-b76f-67e9d24b9644,basketball_play,1772504368,416,True,2026-03-03 02:19:28+00:00,1,495.0,225.0,3.75,41
4,73,quarter,1,6f60dfb1-fda1-423f-b76f-67e9d24b9644,6,8:11,Cody Williams makes two point running dunk (Kyle Filipowski assists),twopointmade,10,ba2cb6be-9827-46a8-8e6f-d8661307ba77,basketball_play,1772504373,415,True,2026-03-03 02:19:33+00:00,1,491.0,229.0,3.816666666666667,42
4,72,quarter,1,ba2cb6be-9827-46a8-8e6f-d8661307ba77,6,8:11,Nuggets 60 second timeout,teamtimeout,10,,basketball_play,1772504381,414,True,2026-03-03 02:19:41+00:00,1,491.0,229.0,3.816666666666667,43
4,71,quarter,1,ba2cb6be-9827-46a8-8e6f-d8661307ba77,6,7:51,Christian Braun misses three point jump shot,threepointmiss,10,,basketball_play,1772504572,413,True,2026-03-03 02:22:52+00:00,1,471.0,249.0,4.15,44
4,70,quarter,1,ba2cb6be-9827-46a8-8e6f-d8661307ba77,6,7:48,Christian Braun offensive rebound,rebound,10,ba2cb6be-9827-46a8-8e6f-d8661307ba77,basketball_play,1772504575,412,True,2026-03-03 02:22:55+00:00,1,468.0,252.0,4.2,45
4,69,quarter,1,ba2cb6be-9827-46a8-8e6f-d8661307ba77,8,7:42,Jamal Murray makes two point driving floating bank jump shot,twopointmade,10,6f60dfb1-fda1-423f-b76f-67e9d24b9644,basketball_play,1772504580,411,True,2026-03-03 02:23:00+00:00,1,462.0,258.0,4.3,46
4,68,quarter,1,6f60dfb1-fda1-423f-b76f-67e9d24b9644,8,7:29,Keyonte George misses three point jump shot,threepointmiss,10,,basketball_play,1772504593,410,True,2026-03-03 02:23:13+00:00,1,449.0,271.0,4.516666666666667,47
4,67,quarter,1,ba2cb6be-9827-46a8-8e6f-d8661307ba77,8,7:27,Nikola Jokic defensive rebound,rebound,10,ba2cb6be-9827-46a8-8e6f-d8661307ba77,basketball_play,1772504595,409,True,2026-03-03 02:23:15+00:00,1,447.0,273.0,4.55,48
4,66,quarter,1,ba2cb6be-9827-46a8-8e6f-d8661307ba77,10,7:24,Christian Braun makes two point running finger roll layup (Nikola Jokic assists),twopointmade,10,6f60dfb1-fda1-423f-b76f-67e9d24b9644,basketball_play,1772504600,408,True,2026-03-03 02:23:20+00:00,1,444.0,276.0,4.6,49
4,65,quarter,1,6f60dfb1-fda1-423f-b76f-67e9d24b9644,10,7:22,Jazz 60 second timeout,teamtimeout,10,,basketball_play,1772504611,407,True,2026-03-03 02:23:31+00:00,1,442.0,278.0,4.633333333333334,50
4,64,quarter,1,6f60dfb1-fda1-423f-b76f-67e9d24b9644,10,7:14,Keyonte George makes two point driving floating jump shot,twopointmade,12,ba2cb6be-9827-46a8-8e6f-d8661307ba77,basketball_play,1772504782,406,True,2026-03-03 02:26:22+00:00,1,434.0,286.0,4.766666666666667,51
4,63,quarter,1,ba2cb6be-9827-46a8-8e6f-d8661307ba77,10,7:03,Jamal Murray turnover (out of bounds bad pass),turnover,12,6f60dfb1-fda1-423f-b76f-67e9d24b9644,basketball_play,1772504796,405,True,2026-03-03 02:26:36+00:00,1,423.0,297.0,4.95,52
4,62,quarter,1,6f60dfb1-fda1-423f-b76f-67e9d24b9644,10,6:56,Keyonte George turnover (bad pass) (Jonas Valanciunas steals),turnover,12,ba2cb6be-9827-46a8-8e6f-d8661307ba77,basketball_play,1772504805,404,True,2026-03-03 02:26:45+00:00,1,416.0,304.0,5.066666666666666,53
4,61,quarter,1,ba2cb6be-9827-46a8-8e6f-d8661307ba77,12,6:52,Tim Hardaway Jr. makes two point running alley-oop dunk (Christian Braun assists),twopointmade,12,6f60dfb1-fda1-423f-b76f-67e9d24b9644,basketball_play,1772504810,403,True,2026-03-03 02:26:50+00:00,1,412.0,308.0,5.133333333333334,54
4,60,quarter,1,6f60dfb1-fda1-423f-b76f-67e9d24b9644,12,6:39,Ace Bailey misses two point driving floating jump shot,twopointmiss,12,,basketball_play,1772504823,402,True,2026-03-03 02:27:03+00:00,1,399.0,321.0,5.35,55
4,59,quarter,1,6f60dfb1-fda1-423f-b76f-67e9d24b9644,12,6:38,Ace Bailey offensive rebound,rebound,12,6f60dfb1-fda1-423f-b76f-67e9d24b9644,basketball_play,1772504824,401,True,2026-03-03 02:27:04+00:00,1,398.0,322.0,5.366666666666666,56
4,58,quarter,1,6f60dfb1-fda1-423f-b76f-67e9d24b9644,12,6:38,Ace Bailey misses two point tip layup,twopointmiss,12,,basketball_play,1772504827,400,True,2026-03-03 02:27:07+00:00,1,398.0,322.0,5.366666666666666,57
4,57,quarter,1,ba2cb6be-9827-46a8-8e6f-d8661307ba77,12,6:35,Nikola Jokic defensive rebound,rebound,12,ba2cb6be-9827-46a8-8e6f-d8661307ba77,basketball_play,1772504830,399,True,2026-03-03 02:27:10+00:00,1,395.0,325.0,5.416666666666667,58
4,56,quarter,1,ba2cb6be-9827-46a8-8e6f-d8661307ba77,15,6:22,Christian Braun makes three point jump shot (Jamal Murray assists),threepointmade,12,6f60dfb1-fda1-423f-b76f-67e9d24b9644,basketball_play,1772504839,398,True,2026-03-03 02:27:19+00:00,1,382.0,338.0,5.633333333333334,59
4,55,quarter,1,6f60dfb1-fda1-423f-b76f-67e9d24b9644,15,6:10,Cody Williams turnover (bad pass) (Jamal Murray steals),turnover,12,ba2cb6be-9827-46a8-8e6f-d8661307ba77,basketball_play,1772504851,397,True,2026-03-03 02:27:31+00:00,1,370.0,350.0,5.833333333333333,60
4,54,quarter,1,6f60dfb1-fda1-423f-b76f-67e9d24b9644,15,6:07,Cody Williams shooting foul (Jamal Murray draws the foul),shootingfoul,12,ba2cb6be-9827-46a8-8e6f-d8661307ba77,basketball_play,1772504857,396,True,2026-03-03 02:27:37+00:00,1,367.0,353.0,5.883333333333334,61
4,53,quarter,1,ba2cb6be-9827-46a8-8e6f-d8661307ba77,16,6:07,Jamal Murray makes regular free throw 1 of 2,freethrowmade,12,ba2cb6be-9827-46a8-8e6f-d8661307ba77,basketball_play,1772504887,395,True,2026-03-03 02:28:07+00:00,1,367.0,353.0,5.883333333333334,62
4,52,quarter,1,ba2cb6be-9827-46a8-8e6f-d8661307ba77,16,6:07,"Nuggets lineup change (Bruce Brown, Tim Hardaway Jr., Jamal Murray, Nikola Jokic, Christian Braun)",lineupchange,12,,basketball_play,1772504889,394,True,2026-03-03 02:28:09+00:00,1,367.0,353.0,5.883333333333334,63
4,51,quarter,1,6f60dfb1-fda1-423f-b76f-67e9d24b9644,16,6:07,"Jazz lineup change (Keyonte George, John Konchar, Isaiah Collier, Ace Bailey, Kyle Filipowski)",lineupchange,12,,basketball_play,1772504889,393,True,2026-03-03 02:28:09+00:00,1,367.0,353.0,5.883333333333334,64
4,50,quarter,1,ba2cb6be-9827-46a8-8e6f-d8661307ba77,17,6:07,Jamal Murray makes regular free throw 2 of 2,freethrowmade,12,6f60dfb1-fda1-423f-b76f-67e9d24b9644,basketball_play,1772504910,392,True,2026-03-03 02:28:30+00:00,1,367.0,353.0,5.883333333333334,65
4,49,quarter,1,6f60dfb1-fda1-423f-b76f-67e9d24b9644,17,5:59,Keyonte George misses three point pullup jump shot,threepointmiss,12,,basketball_play,1772504920,391,True,2026-03-03 02:28:40+00:00,1,359.0,361.0,6.016666666666667,66
4,48,quarter,1,ba2cb6be-9827-46a8-8e6f-d8661307ba77,17,5:55,Nikola Jokic defensive rebound,rebound,12,ba2cb6be-9827-46a8-8e6f-d8661307ba77,basketball_play,1772504924,390,True,2026-03-03 02:28:44+00:00,1,355.0,365.0,6.083333333333333,67
4,47,quarter,1,ba2cb6be-9827-46a8-8e6f-d8661307ba77,20,5:40,Jamal Murray makes three point jump shot (Bruce Brown assists),threepointmade,12,6f60dfb1-fda1-423f-b76f-67e9d24b9644,basketball_play,1772504938,389,True,2026-03-03 02:28:58+00:00,1,340.0,380.0,6.333333333333333,68
4,46,quarter,1,ba2cb6be-9827-46a8-8e6f-d8661307ba77,20,5:23,Bruce Brown personal foul (Keyonte George draws the foul),personalfoul,12,6f60dfb1-fda1-423f-b76f-67e9d24b9644,basketball_play,1772504957,388,True,2026-03-03 02:29:17+00:00,1,323.0,397.0,6.616666666666666,69
4,45,quarter,1,6f60dfb1-fda1-423f-b76f-67e9d24b9644,20,5:10,Kyle Filipowski misses three point pullup jump shot,threepointmiss,12,,basketball_play,1772504989,387,True,2026-03-03 02:29:49+00:00,1,310.0,410.0,6.833333333333333,70
4,44,quarter,1,ba2cb6be-9827-46a8-8e6f-d8661307ba77,20,5:06,Tim Hardaway Jr. defensive rebound,rebound,12,ba2cb6be-9827-46a8-8e6f-d8661307ba77,basketball_play,1772504993,386,True,2026-03-03 02:29:53+00:00,1,306.0,414.0,6.9,71
4,43,quarter,1,ba2cb6be-9827-46a8-8e6f-d8661307ba77,20,4:59,Jamal Murray turnover (bad pass) (Keyonte George steals),turnover,12,6f60dfb1-fda1-423f-b76f-67e9d24b9644,basketball_play,1772505000,385,True,2026-03-03 02:30:00+00:00,1,299.0,421.0,7.016666666666667,72
4,42,quarter,1,6f60dfb1-fda1-423f-b76f-67e9d24b9644,20,4:53,John Konchar makes three point running jump shot (Kyle Filipowski assists),threepointmade,15,ba2cb6be-9827-46a8-8e6f-d8661307ba77,basketball_play,1772505006,384,True,2026-03-03 02:30:06+00:00,1,293.0,427.0,7.116666666666666,73
4,41,quarter,1,ba2cb6be-9827-46a8-8e6f-d8661307ba77,22,4:30,Tim Hardaway Jr. makes two point reverse layup (Jamal Murray assists),twopointmade,15,6f60dfb1-fda1-423f-b76f-67e9d24b9644,basketball_play,1772505029,383,True,2026-03-03 02:30:29+00:00,1,270.0,450.0,7.5,74
4,40,quarter,1,6f60dfb1-fda1-423f-b76f-67e9d24b9644,22,4:21,Ace Bailey makes three point jump shot (Isaiah Collier assists),threepointmade,18,ba2cb6be-9827-46a8-8e6f-d8661307ba77,basketball_play,1772505039,382,True,2026-03-03 02:30:39+00:00,1,261.0,459.0,7.65,75
4,39,quarter,1,ba2cb6be-9827-46a8-8e6f-d8661307ba77,22,4:03,Bruce Brown misses three point jump shot,threepointmiss,18,,basketball_play,1772505056,381,True,2026-03-03 02:30:56+00:00,1,243.0,477.0,7.95,76
4,38,quarter,1,6f60dfb1-fda1-423f-b76f-67e9d24b9644,22,3:58,Ace Bailey defensive rebound,rebound,18,6f60dfb1-fda1-423f-b76f-67e9d24b9644,basketball_play,1772505061,380,True,2026-03-03 02:31:01+00:00,1,238.0,482.0,8.033333333333333,77
4,37,quarter,1,6f60dfb1-fda1-423f-b76f-67e9d24b9644,22,3:54,John Konchar makes three point running jump shot (Isaiah Collier assists),threepointmade,21,ba2cb6be-9827-46a8-8e6f-d8661307ba77,basketball_play,1772505065,379,True,2026-03-03 02:31:05+00:00,1,234.0,486.0,8.1,78
4,36,quarter,1,6f60dfb1-fda1-423f-b76f-67e9d24b9644,22,3:40,John Konchar personal foul (Nikola Jokic draws the foul),personalfoul,21,ba2cb6be-9827-46a8-8e6f-d8661307ba77,basketball_play,1772505083,378,True,2026-03-03 02:31:23+00:00,1,220.0,500.0,8.333333333333334,79
4,35,quarter,1,ba2cb6be-9827-46a8-8e6f-d8661307ba77,22,3:40,"Nuggets lineup change (Bruce Brown, Jalen Pickett, Tim Hardaway Jr., Nikola Jokic, Julian Strawther)",lineupchange,21,,basketball_play,1772505089,377,True,2026-03-03 02:31:29+00:00,1,220.0,500.0,8.333333333333334,80
4,34,quarter,1,6f60dfb1-fda1-423f-b76f-67e9d24b9644,22,3:40,"Jazz lineup change (John Konchar, Oscar Tshiebwe, Svi Mykhailiuk, Isaiah Collier, Ace Bailey)",lineupchange,21,,basketball_play,1772505089,376,True,2026-03-03 02:31:29+00:00,1,220.0,500.0,8.333333333333334,81
4,33,quarter,1,ba2cb6be-9827-46a8-8e6f-d8661307ba77,22,3:36,John Konchar blocks Nikola Jokic's two point driving layup,twopointmiss,21,,basketball_play,1772505121,375,True,2026-03-03 02:32:01+00:00,1,216.0,504.0,8.4,82
4,32,quarter,1,6f60dfb1-fda1-423f-b76f-67e9d24b9644,22,3:36,Jazz defensive rebound,rebound,21,6f60dfb1-fda1-423f-b76f-67e9d24b9644,basketball_play,1772505121,374,True,2026-03-03 02:32:01+00:00,1,216.0,504.0,8.4,83
4,31,quarter,1,,22,3:36,Stoppage (Out of bounds),stoppage,21,,basketball_play,1772505124,373,True,2026-03-03 02:32:04+00:00,1,216.0,504.0,8.4,84
4,30,quarter,1,6f60dfb1-fda1-423f-b76f-67e9d24b9644,22,3:21,Ace Bailey makes two point driving layup,twopointmade,23,ba2cb6be-9827-46a8-8e6f-d8661307ba77,basketball_play,1772505140,372,True,2026-03-03 02:32:20+00:00,1,201.0,519.0,8.65,85
4,29,quarter,1,ba2cb6be-9827-46a8-8e6f-d8661307ba77,22,3:04,Oscar Tshiebwe blocks Nikola Jokic's two point hook shot,twopointmiss,23,,basketball_play,1772505159,371,True,2026-03-03 02:32:39+00:00,1,184.0,536.0,8.933333333333334,86
4,28,quarter,1,ba2cb6be-9827-46a8-8e6f-d8661307ba77,22,3:03,Nikola Jokic offensive rebound,rebound,23,ba2cb6be-9827-46a8-8e6f-d8661307ba77,basketball_play,1772505160,370,True,2026-03-03 02:32:40+00:00,1,183.0,537.0,8.95,87
4,27,quarter,1,ba2cb6be-9827-46a8-8e6f-d8661307ba77,24,2:59,Nikola Jokic makes two point bank hook shot,twopointmade,23,6f60dfb1-fda1-423f-b76f-67e9d24b9644,basketball_play,1772505163,369,True,2026-03-03 02:32:43+00:00,1,179.0,541.0,9.016666666666667,88
4,26,quarter,1,6f60dfb1-fda1-423f-b76f-67e9d24b9644,24,2:44,Svi Mykhailiuk misses three point pullup jump shot,threepointmiss,23,,basketball_play,1772505177,368,True,2026-03-03 02:32:57+00:00,1,164.0,556.0,9.266666666666667,89
4,25,quarter,1,ba2cb6be-9827-46a8-8e6f-d8661307ba77,24,2:39,Nikola Jokic defensive rebound,rebound,23,ba2cb6be-9827-46a8-8e6f-d8661307ba77,basketball_play,1772505182,367,True,2026-03-03 02:33:02+00:00,1,159.0,561.0,9.35,90
4,24,quarter,1,ba2cb6be-9827-46a8-8e6f-d8661307ba77,24,2:31,Nikola Jokic misses two point driving floating jump shot,twopointmiss,23,,basketball_play,1772505190,366,True,2026-03-03 02:33:10+00:00,1,151.0,569.0,9.483333333333333,91
4,23,quarter,1,ba2cb6be-9827-46a8-8e6f-d8661307ba77,24,2:29,Nikola Jokic offensive rebound,rebound,23,ba2cb6be-9827-46a8-8e6f-d8661307ba77,basketball_play,1772505192,365,True,2026-03-03 02:33:12+00:00,1,149.0,571.0,9.516666666666667,92
4,22,quarter,1,ba2cb6be-9827-46a8-8e6f-d8661307ba77,26,2:29,Nikola Jokic makes two point putback layup,twopointmade,23,6f60dfb1-fda1-423f-b76f-67e9d24b9644,basketball_play,1772505193,364,True,2026-03-03 02:33:13+00:00,1,149.0,571.0,9.516666666666667,93
4,21,quarter,1,6f60dfb1-fda1-423f-b76f-67e9d24b9644,26,2:10,Oscar Tshiebwe makes two point driving reverse layup (Svi Mykhailiuk assists),twopointmade,25,ba2cb6be-9827-46a8-8e6f-d8661307ba77,basketball_play,1772505211,363,True,2026-03-03 02:33:31+00:00,1,130.0,590.0,9.833333333333334,94
4,20,quarter,1,6f60dfb1-fda1-423f-b76f-67e9d24b9644,26,1:58,Ace Bailey shooting foul (Nikola Jokic draws the foul),shootingfoul,25,ba2cb6be-9827-46a8-8e6f-d8661307ba77,basketball_play,1772505225,362,True,2026-03-03 02:33:45+00:00,1,118.0,602.0,10.033333333333333,95
4,19,quarter,1,ba2cb6be-9827-46a8-8e6f-d8661307ba77,27,1:58,Nikola Jokic makes regular free throw 1 of 2,freethrowmade,25,ba2cb6be-9827-46a8-8e6f-d8661307ba77,basketball_play,1772505253,361,True,2026-03-03 02:34:13+00:00,1,118.0,602.0,10.033333333333333,96
4,18,quarter,1,6f60dfb1-fda1-423f-b76f-67e9d24b9644,27,1:58,"Jazz lineup change (Brice Sensabaugh, John Konchar, Oscar Tshiebwe, Svi Mykhailiuk, Isaiah Collier)",lineupchange,25,,basketball_play,1772505277,360,True,2026-03-03 02:34:37+00:00,1,118.0,602.0,10.033333333333333,97
4,17,quarter,1,ba2cb6be-9827-46a8-8e6f-d8661307ba77,28,1:58,Nikola Jokic makes regular free throw 2 of 2,freethrowmade,25,6f60dfb1-fda1-423f-b76f-67e9d24b9644,basketball_play,1772505277,359,True,2026-03-03 02:34:37+00:00,1,118.0,602.0,10.033333333333333,98
4,16,quarter,1,6f60dfb1-fda1-423f-b76f-67e9d24b9644,28,1:50,Isaiah Collier makes two point driving layup,twopointmade,27,ba2cb6be-9827-46a8-8e6f-d8661307ba77,basketball_play,1772505286,358,True,2026-03-03 02:34:46+00:00,1,110.0,610.0,10.166666666666666,99
4,15,quarter,1,ba2cb6be-9827-46a8-8e6f-d8661307ba77,31,1:38,Jalen Pickett makes three point jump shot (Nikola Jokic assists),threepointmade,27,6f60dfb1-fda1-423f-b76f-67e9d24b9644,basketball_play,1772505299,357,True,2026-03-03 02:34:59+00:00,1,98.0,622.0,10.366666666666667,100
4,14,quarter,1,6f60dfb1-fda1-423f-b76f-67e9d24b9644,31,1:16,Brice Sensabaugh misses three point jump shot,threepointmiss,27,,basketball_play,1772505320,356,True,2026-03-03 02:35:20+00:00,1,76.0,644.0,10.733333333333333,101
4,13,quarter,1,ba2cb6be-9827-46a8-8e6f-d8661307ba77,31,1:14,Tim Hardaway Jr. defensive rebound,rebound,27,ba2cb6be-9827-46a8-8e6f-d8661307ba77,basketball_play,1772505322,355,True,2026-03-03 02:35:22+00:00,1,74.0,646.0,10.766666666666667,102
4,12,quarter,1,ba2cb6be-9827-46a8-8e6f-d8661307ba77,31,1:10,Tim Hardaway Jr. misses three point running pullup jump shot,threepointmiss,27,,basketball_play,1772505327,354,True,2026-03-03 02:35:27+00:00,1,70.0,650.0,10.833333333333334,103
4,11,quarter,1,6f60dfb1-fda1-423f-b76f-67e9d24b9644,31,1:07,Oscar Tshiebwe defensive rebound,rebound,27,6f60dfb1-fda1-423f-b76f-67e9d24b9644,basketball_play,1772505330,353,True,2026-03-03 02:35:30+00:00,1,67.0,653.0,10.883333333333333,104
4,10,quarter,1,6f60dfb1-fda1-423f-b76f-67e9d24b9644,31,1:00,Isaiah Collier makes two point driving floating bank jump shot,twopointmade,29,ba2cb6be-9827-46a8-8e6f-d8661307ba77,basketball_play,1772505337,352,True,2026-03-03 02:35:37+00:00,1,60.0,660.0,11.0,105
