period_index,event_index,period_type,period_number,attribution,away_points,clock,description,event_type,home_points,possession,type,wall_clock,pbp_source_row,has_wall_clock,event_ts_utc,period_sequence,game_clock_seconds_remaining,game_elapsed_seconds,game_elapsed_minutes,pbp_chronological_index
4,123,quarter,1,00c3e69d-d9b9-4ac3-bf79-19707fe43637,0,12:00,"Magic lineup change (Franz Wagner, Paolo Banchero, Desmond Bane, Jalen Suggs, Wendell Carter Jr.)",lineupchange,0,,basketball_play,1775430632,532,True,2026-04-05 23:10:32+00:00,1,720.0,0.0,0.0,1
4,122,quarter,1,d3c8c2ac-c4a0-4d67-8b16-53cb91118dfc,0,12:00,"Pelicans lineup change (Jeremiah Fears, Yves Missi, Saddiq Bey, Zion Williamson, Herbert Jones)",lineupchange,0,,basketball_play,1775430632,531,True,2026-04-05 23:10:32+00:00,1,720.0,0.0,0.0,2
4,121,quarter,1,,0,12:00,Start of 1st Quarter,startperiod,0,,basketball_play,1775430632,530,True,2026-04-05 23:10:32+00:00,1,720.0,0.0,0.0,3
4,120,quarter,1,00c3e69d-d9b9-4ac3-bf79-19707fe43637,0,12:00,Wendell Carter Jr. vs. Yves Missi (Jalen Suggs gains possession),opentip,0,00c3e69d-d9b9-4ac3-bf79-19707fe43637,basketball_play,1775430638,529,True,2026-04-05 23:10:38+00:00,1,720.0,0.0,0.0,4
4,119,quarter,1,00c3e69d-d9b9-4ac3-bf79-19707fe43637,0,11:46,Jalen Suggs misses three point pullup jump shot,threepointmiss,0,,basketball_play,1775430646,528,True,2026-04-05 23:10:46+00:00,1,706.0,14.0,0.23333333333333334,5
4,118,quarter,1,d3c8c2ac-c4a0-4d67-8b16-53cb91118dfc,0,11:41,Herbert Jones defensive rebound,rebound,0,d3c8c2ac-c4a0-4d67-8b16-53cb91118dfc,basketball_play,1775430651,527,True,2026-04-05 23:10:51+00:00,1,701.0,19.0,0.31666666666666665,6
4,117,quarter,1,d3c8c2ac-c4a0-4d67-8b16-53cb91118dfc,0,11:24,Jeremiah Fears misses three point jump shot,threepointmiss,0,,basketball_play,1775430667,526,True,2026-04-05 23:11:07+00:00,1,684.0,36.0,0.6,7
4,116,quarter,1,00c3e69d-d9b9-4ac3-bf79-19707fe43637,0,11:21,Franz Wagner defensive rebound,rebound,0,00c3e69d-d9b9-4ac3-bf79-19707fe43637,basketball_play,1775430670,525,True,2026-04-05 23:11:10+00:00,1,681.0,39.0,0.65,8
4,115,quarter,1,00c3e69d-d9b9-4ac3-bf79-19707fe43637,2,11:17,Paolo Banchero makes two point running layup (Jalen Suggs assists),twopointmade,0,d3c8c2ac-c4a0-4d67-8b16-53cb91118dfc,basketball_play,1775430673,524,True,2026-04-05 23:11:13+00:00,1,677.0,43.0,0.7166666666666667,9
4,114,quarter,1,d3c8c2ac-c4a0-4d67-8b16-53cb91118dfc,2,10:59,Herbert Jones makes three point pullup bank jump shot (Yves Missi assists),threepointmade,3,00c3e69d-d9b9-4ac3-bf79-19707fe43637,basketball_play,1775430692,523,True,2026-04-05 23:11:32+00:00,1,659.0,61.0,1.0166666666666666,10
4,113,quarter,1,00c3e69d-d9b9-4ac3-bf79-19707fe43637,4,10:47,Wendell Carter Jr. makes two point cutting dunk (Jalen Suggs assists),twopointmade,3,d3c8c2ac-c4a0-4d67-8b16-53cb91118dfc,basketball_play,1775430704,522,True,2026-04-05 23:11:44+00:00,1,647.0,73.0,1.2166666666666666,11
4,112,quarter,1,d3c8c2ac-c4a0-4d67-8b16-53cb91118dfc,4,10:24,Saddiq Bey misses two point fadeaway jump shot,twopointmiss,3,,basketball_play,1775430727,521,True,2026-04-05 23:12:07+00:00,1,624.0,96.0,1.6,12
4,111,quarter,1,00c3e69d-d9b9-4ac3-bf79-19707fe43637,4,10:24,Franz Wagner defensive rebound,rebound,3,00c3e69d-d9b9-4ac3-bf79-19707fe43637,basketball_play,1775430727,520,True,2026-04-05 23:12:07+00:00,1,624.0,96.0,1.6,13
4,110,quarter,1,00c3e69d-d9b9-4ac3-bf79-19707fe43637,6,10:12,Wendell Carter Jr. makes two point turnaround bank hook shot,twopointmade,3,d3c8c2ac-c4a0-4d67-8b16-53cb91118dfc,basketball_play,1775430739,519,True,2026-04-05 23:12:19+00:00,1,612.0,108.0,1.8,14
4,109,quarter,1,d3c8c2ac-c4a0-4d67-8b16-53cb91118dfc,6,10:02,Zion Williamson makes two point driving floating jump shot (Jeremiah Fears assists),twopointmade,5,00c3e69d-d9b9-4ac3-bf79-19707fe43637,basketball_play,1775430753,518,True,2026-04-05 23:12:33+00:00,1,602.0,118.0,1.9666666666666666,15
4,108,quarter,1,00c3e69d-d9b9-4ac3-bf79-19707fe43637,6,10:02,Paolo Banchero shooting foul (Zion Williamson draws the foul),shootingfoul,5,d3c8c2ac-c4a0-4d67-8b16-53cb91118dfc,basketball_play,1775430758,517,True,2026-04-05 23:12:38+00:00,1,602.0,118.0,1.9666666666666666,16
4,107,quarter,1,d3c8c2ac-c4a0-4d67-8b16-53cb91118dfc,6,10:02,Zion Williamson makes regular free throw 1 of 1,freethrowmade,6,,basketball_play,1775430783,516,True,2026-04-05 23:13:03+00:00,1,602.0,118.0,1.9666666666666666,17
4,106,quarter,1,00c3e69d-d9b9-4ac3-bf79-19707fe43637,6,9:48,Jalen Suggs misses three point jump shot,threepointmiss,6,,basketball_play,1775430797,515,True,2026-04-05 23:13:17+00:00,1,588.0,132.0,2.2,18
4,105,quarter,1,d3c8c2ac-c4a0-4d67-8b16-53cb91118dfc,6,9:44,Herbert Jones defensive rebound,rebound,6,d3c8c2ac-c4a0-4d67-8b16-53cb91118dfc,basketball_play,1775430801,514,True,2026-04-05 23:13:21+00:00,1,584.0,136.0,2.2666666666666666,19
4,104,quarter,1,d3c8c2ac-c4a0-4d67-8b16-53cb91118dfc,6,9:40,Herbert Jones misses three point running pullup jump shot,threepointmiss,6,,basketball_play,1775430805,513,True,2026-04-05 23:13:25+00:00,1,580.0,140.0,2.3333333333333335,20
4,103,quarter,1,00c3e69d-d9b9-4ac3-bf79-19707fe43637,6,9:40,Magic defensive rebound,rebound,6,00c3e69d-d9b9-4ac3-bf79-19707fe43637,basketball_play,1775430805,512,True,2026-04-05 23:13:25+00:00,1,580.0,140.0,2.3333333333333335,21
4,102,quarter,1,,6,9:39,Stoppage (Out of bounds),stoppage,6,,basketball_play,1775430810,511,True,2026-04-05 23:13:30+00:00,1,579.0,141.0,2.35,22
4,101,quarter,1,00c3e69d-d9b9-4ac3-bf79-19707fe43637,8,9:27,Franz Wagner makes two point pullup jump shot (Desmond Bane assists),twopointmade,6,d3c8c2ac-c4a0-4d67-8b16-53cb91118dfc,basketball_play,1775430832,510,True,2026-04-05 23:13:52+00:00,1,567.0,153.0,2.55,23
4,100,quarter,1,d3c8c2ac-c4a0-4d67-8b16-53cb91118dfc,8,9:13,Paolo Banchero blocks Zion Williamson's two point driving layup,twopointmiss,6,,basketball_play,1775430845,509,True,2026-04-05 23:14:05+00:00,1,553.0,167.0,2.783333333333333,24
4,99,quarter,1,00c3e69d-d9b9-4ac3-bf79-19707fe43637,8,9:10,Paolo Banchero defensive rebound,rebound,6,00c3e69d-d9b9-4ac3-bf79-19707fe43637,basketball_play,1775430848,508,True,2026-04-05 23:14:08+00:00,1,550.0,170.0,2.8333333333333335,25
4,98,quarter,1,,8,9:08,Stoppage (Out of bounds),stoppage,6,,basketball_play,1775430855,507,True,2026-04-05 23:14:15+00:00,1,548.0,172.0,2.8666666666666667,26
4,97,quarter,1,00c3e69d-d9b9-4ac3-bf79-19707fe43637,10,9:00,Desmond Bane makes two point jump shot (Franz Wagner assists),twopointmade,6,d3c8c2ac-c4a0-4d67-8b16-53cb91118dfc,basketball_play,1775430871,506,True,2026-04-05 23:14:31+00:00,1,540.0,180.0,3.0,27
4,96,quarter,1,d3c8c2ac-c4a0-4d67-8b16-53cb91118dfc,10,8:44,Saddiq Bey misses two point driving layup,twopointmiss,6,,basketball_play,1775430888,505,True,2026-04-05 23:14:48+00:00,1,524.0,196.0,3.2666666666666666,28
4,95,quarter,1,00c3e69d-d9b9-4ac3-bf79-19707fe43637,10,8:42,Franz Wagner defensive rebound,rebound,6,00c3e69d-d9b9-4ac3-bf79-19707fe43637,basketball_play,1775430890,504,True,2026-04-05 23:14:50+00:00,1,522.0,198.0,3.3,29
4,94,quarter,1,d3c8c2ac-c4a0-4d67-8b16-53cb91118dfc,10,8:37,Jeremiah Fears shooting foul (Desmond Bane draws the foul),shootingfoul,6,00c3e69d-d9b9-4ac3-bf79-19707fe43637,basketball_play,1775430898,503,True,2026-04-05 23:14:58+00:00,1,517.0,203.0,3.3833333333333333,30
4,93,quarter,1,00c3e69d-d9b9-4ac3-bf79-19707fe43637,11,8:37,Desmond Bane makes regular free throw 1 of 2,freethrowmade,6,00c3e69d-d9b9-4ac3-bf79-19707fe43637,basketball_play,1775430921,502,True,2026-04-05 23:15:21+00:00,1,517.0,203.0,3.3833333333333333,31
4,92,quarter,1,00c3e69d-d9b9-4ac3-bf79-19707fe43637,11,8:37,"Magic lineup change (Paolo Banchero, Desmond Bane, Jalen Suggs, Tristan da Silva, Wendell Carter Jr.)",lineupchange,6,,basketball_play,1775430945,501,True,2026-04-05 23:15:45+00:00,1,517.0,203.0,3.3833333333333333,32
4,91,quarter,1,00c3e69d-d9b9-4ac3-bf79-19707fe43637,11,8:37,Desmond Bane misses regular free throw 2 of 2,freethrowmiss,6,,basketball_play,1775430921,500,True,2026-04-05 23:15:21+00:00,1,517.0,203.0,3.3833333333333333,33
4,90,quarter,1,d3c8c2ac-c4a0-4d67-8b16-53cb91118dfc,11,8:35,Yves Missi defensive rebound,rebound,6,d3c8c2ac-c4a0-4d67-8b16-53cb91118dfc,basketball_play,1775430923,499,True,2026-04-05 23:15:23+00:00,1,515.0,205.0,3.4166666666666665,34
4,89,quarter,1,d3c8c2ac-c4a0-4d67-8b16-53cb91118dfc,11,8:24,Herbert Jones misses three point pullup jump shot,threepointmiss,6,,basketball_play,1775430957,498,True,2026-04-05 23:15:57+00:00,1,504.0,216.0,3.6,35
4,88,quarter,1,00c3e69d-d9b9-4ac3-bf79-19707fe43637,11,8:21,Jalen Suggs defensive rebound,rebound,6,00c3e69d-d9b9-4ac3-bf79-19707fe43637,basketball_play,1775430960,497,True,2026-04-05 23:16:00+00:00,1,501.0,219.0,3.65,36
4,87,quarter,1,00c3e69d-d9b9-4ac3-bf79-19707fe43637,11,8:20,Jalen Suggs turnover (out of bounds bad pass),turnover,6,d3c8c2ac-c4a0-4d67-8b16-53cb91118dfc,basketball_play,1775430964,496,True,2026-04-05 23:16:04+00:00,1,500.0,220.0,3.6666666666666665,37
4,86,quarter,1,d3c8c2ac-c4a0-4d67-8b16-53cb91118dfc,11,8:09,Jeremiah Fears misses two point driving layup,twopointmiss,6,,basketball_play,1775430981,495,True,2026-04-05 23:16:21+00:00,1,489.0,231.0,3.85,38
4,85,quarter,1,d3c8c2ac-c4a0-4d67-8b16-53cb91118dfc,11,8:04,Yves Missi offensive rebound,rebound,6,d3c8c2ac-c4a0-4d67-8b16-53cb91118dfc,basketball_play,1775430986,494,True,2026-04-05 23:16:26+00:00,1,484.0,236.0,3.933333333333333,39
4,84,quarter,1,d3c8c2ac-c4a0-4d67-8b16-53cb91118dfc,11,7:57,Saddiq Bey misses two point driving layup,twopointmiss,6,,basketball_play,1775430993,493,True,2026-04-05 23:16:33+00:00,1,477.0,243.0,4.05,40
4,83,quarter,1,d3c8c2ac-c4a0-4d67-8b16-53cb91118dfc,11,7:56,Saddiq Bey offensive rebound,rebound,6,d3c8c2ac-c4a0-4d67-8b16-53cb91118dfc,basketball_play,1775430994,492,True,2026-04-05 23:16:34+00:00,1,476.0,244.0,4.066666666666666,41
4,82,quarter,1,d3c8c2ac-c4a0-4d67-8b16-53cb91118dfc,11,7:56,Saddiq Bey misses two point tip layup,twopointmiss,6,,basketball_play,1775430995,491,True,2026-04-05 23:16:35+00:00,1,476.0,244.0,4.066666666666666,42
4,81,quarter,1,d3c8c2ac-c4a0-4d67-8b16-53cb91118dfc,11,7:55,Saddiq Bey offensive rebound,rebound,6,d3c8c2ac-c4a0-4d67-8b16-53cb91118dfc,basketball_play,1775430996,490,True,2026-04-05 23:16:36+00:00,1,475.0,245.0,4.083333333333333,43
4,80,quarter,1,d3c8c2ac-c4a0-4d67-8b16-53cb91118dfc,11,7:54,Saddiq Bey misses two point tip layup,twopointmiss,6,,basketball_play,1775430997,489,True,2026-04-05 23:16:37+00:00,1,474.0,246.0,4.1,44
4,79,quarter,1,00c3e69d-d9b9-4ac3-bf79-19707fe43637,11,7:53,Paolo Banchero defensive rebound,rebound,6,00c3e69d-d9b9-4ac3-bf79-19707fe43637,basketball_play,1775430998,488,True,2026-04-05 23:16:38+00:00,1,473.0,247.0,4.116666666666666,45
4,78,quarter,1,00c3e69d-d9b9-4ac3-bf79-19707fe43637,13,7:37,Wendell Carter Jr. makes two point alley-oop layup (Tristan da Silva assists),twopointmade,6,d3c8c2ac-c4a0-4d67-8b16-53cb91118dfc,basketball_play,1775431013,487,True,2026-04-05 23:16:53+00:00,1,457.0,263.0,4.383333333333334,46
4,77,quarter,1,d3c8c2ac-c4a0-4d67-8b16-53cb91118dfc,13,7:26,Yves Missi makes two point alley-oop dunk (Jeremiah Fears assists),twopointmade,8,00c3e69d-d9b9-4ac3-bf79-19707fe43637,basketball_play,1775431024,486,True,2026-04-05 23:17:04+00:00,1,446.0,274.0,4.566666666666666,47
4,76,quarter,1,00c3e69d-d9b9-4ac3-bf79-19707fe43637,13,7:11,Tristan da Silva misses three point stepback jump shot,threepointmiss,8,,basketball_play,1775431040,485,True,2026-04-05 23:17:20+00:00,1,431.0,289.0,4.816666666666666,48
4,75,quarter,1,d3c8c2ac-c4a0-4d67-8b16-53cb91118dfc,13,7:07,Yves Missi defensive rebound,rebound,8,d3c8c2ac-c4a0-4d67-8b16-53cb91118dfc,basketball_play,1775431044,484,True,2026-04-05 23:17:24+00:00,1,427.0,293.0,4.883333333333334,49
4,74,quarter,1,d3c8c2ac-c4a0-4d67-8b16-53cb91118dfc,13,6:59,Zion Williamson makes two point running layup,twopointmade,10,00c3e69d-d9b9-4ac3-bf79-19707fe43637,basketball_play,1775431051,483,True,2026-04-05 23:17:31+00:00,1,419.0,301.0,5.016666666666667,50
4,73,quarter,1,00c3e69d-d9b9-4ac3-bf79-19707fe43637,13,6:53,Desmond Bane misses three point jump shot,threepointmiss,10,,basketball_play,1775431058,482,True,2026-04-05 23:17:38+00:00,1,413.0,307.0,5.116666666666666,51
4,72,quarter,1,d3c8c2ac-c4a0-4d67-8b16-53cb91118dfc,13,6:50,Herbert Jones defensive rebound,rebound,10,d3c8c2ac-c4a0-4d67-8b16-53cb91118dfc,basketball_play,1775431061,481,True,2026-04-05 23:17:41+00:00,1,410.0,310.0,5.166666666666667,52
4,71,quarter,1,00c3e69d-d9b9-4ac3-bf79-19707fe43637,13,6:48,Jalen Suggs personal foul (Herbert Jones draws the foul),personalfoul,10,d3c8c2ac-c4a0-4d67-8b16-53cb91118dfc,basketball_play,1775431066,480,True,2026-04-05 23:17:46+00:00,1,408.0,312.0,5.2,53
4,70,quarter,1,d3c8c2ac-c4a0-4d67-8b16-53cb91118dfc,13,6:48,Pelicans 60 second timeout,teamtimeout,10,,basketball_play,1775431076,479,True,2026-04-05 23:17:56+00:00,1,408.0,312.0,5.2,54
4,69,quarter,1,00c3e69d-d9b9-4ac3-bf79-19707fe43637,13,6:48,"Magic lineup change (Paolo Banchero, Jalen Suggs, Tristan da Silva, Jamal Cain, Wendell Carter Jr.)",lineupchange,10,,basketball_play,1775431215,478,True,2026-04-05 23:20:15+00:00,1,408.0,312.0,5.2,55
4,68,quarter,1,d3c8c2ac-c4a0-4d67-8b16-53cb91118dfc,13,6:48,"Pelicans lineup change (Derik Queen, Jeremiah Fears, Yves Missi, Saddiq Bey, Herbert Jones)",lineupchange,10,,basketball_play,1775431215,477,True,2026-04-05 23:20:15+00:00,1,408.0,312.0,5.2,56
4,67,quarter,1,d3c8c2ac-c4a0-4d67-8b16-53cb91118dfc,13,6:38,Yves Missi makes two point cutting layup (Herbert Jones assists),twopointmade,12,00c3e69d-d9b9-4ac3-bf79-19707fe43637,basketball_play,1775431272,476,True,2026-04-05 23:21:12+00:00,1,398.0,322.0,5.366666666666666,57
4,66,quarter,1,00c3e69d-d9b9-4ac3-bf79-19707fe43637,13,6:38,Jamal Cain shooting foul (Yves Missi draws the foul),shootingfoul,12,d3c8c2ac-c4a0-4d67-8b16-53cb91118dfc,basketball_play,1775431275,475,True,2026-04-05 23:21:15+00:00,1,398.0,322.0,5.366666666666666,58
4,65,quarter,1,d3c8c2ac-c4a0-4d67-8b16-53cb91118dfc,13,6:38,Yves Missi makes regular free throw 1 of 1,freethrowmade,13,,basketball_play,1775431295,474,True,2026-04-05 23:21:35+00:00,1,398.0,322.0,5.366666666666666,59
4,64,quarter,1,00c3e69d-d9b9-4ac3-bf79-19707fe43637,13,6:25,Jalen Suggs misses two point driving floating bank jump shot,twopointmiss,13,,basketball_play,1775431310,473,True,2026-04-05 23:21:50+00:00,1,385.0,335.0,5.583333333333333,60
4,63,quarter,1,d3c8c2ac-c4a0-4d67-8b16-53cb91118dfc,13,6:23,Yves Missi defensive rebound,rebound,13,d3c8c2ac-c4a0-4d67-8b16-53cb91118dfc,basketball_play,1775431312,472,True,2026-04-05 23:21:52+00:00,1,383.0,337.0,5.616666666666666,61
4,62,quarter,1,d3c8c2ac-c4a0-4d67-8b16-53cb91118dfc,13,6:16,Jeremiah Fears turnover (out of bounds bad pass),turnover,13,00c3e69d-d9b9-4ac3-bf79-19707fe43637,basketball_play,1775431324,471,True,2026-04-05 23:22:04+00:00,1,376.0,344.0,5.733333333333333,62
4,61,quarter,1,00c3e69d-d9b9-4ac3-bf79-19707fe43637,15,6:05,Wendell Carter Jr. makes two point turnaround hook shot (Paolo Banchero assists),twopointmade,13,d3c8c2ac-c4a0-4d67-8b16-53cb91118dfc,basketball_play,1775431339,470,True,2026-04-05 23:22:19+00:00,1,365.0,355.0,5.916666666666667,63
4,60,quarter,1,d3c8c2ac-c4a0-4d67-8b16-53cb91118dfc,15,5:56,Herbert Jones makes two point driving floating bank jump shot (Jeremiah Fears assists),twopointmade,15,00c3e69d-d9b9-4ac3-bf79-19707fe43637,basketball_play,1775431346,469,True,2026-04-05 23:22:26+00:00,1,356.0,364.0,6.066666666666666,64
4,59,quarter,1,00c3e69d-d9b9-4ac3-bf79-19707fe43637,15,5:45,Wendell Carter Jr. misses three point jump shot,threepointmiss,15,,basketball_play,1775431358,468,True,2026-04-05 23:22:38+00:00,1,345.0,375.0,6.25,65
4,58,quarter,1,d3c8c2ac-c4a0-4d67-8b16-53cb91118dfc,15,5:40,Derik Queen defensive rebound,rebound,15,d3c8c2ac-c4a0-4d67-8b16-53cb91118dfc,basketball_play,1775431363,467,True,2026-04-05 23:22:43+00:00,1,340.0,380.0,6.333333333333333,66
4,57,quarter,1,d3c8c2ac-c4a0-4d67-8b16-53cb91118dfc,15,5:37,Jeremiah Fears makes three point running pullup jump shot,threepointmade,18,00c3e69d-d9b9-4ac3-bf79-19707fe43637,basketball_play,1775431366,466,True,2026-04-05 23:22:46+00:00,1,337.0,383.0,6.383333333333334,67
4,56,quarter,1,00c3e69d-d9b9-4ac3-bf79-19707fe43637,15,5:12,Jalen Suggs misses two point driving hook shot,twopointmiss,18,,basketball_play,1775431392,465,True,2026-04-05 23:23:12+00:00,1,312.0,408.0,6.8,68
4,55,quarter,1,d3c8c2ac-c4a0-4d67-8b16-53cb91118dfc,15,5:08,Saddiq Bey defensive rebound,rebound,18,d3c8c2ac-c4a0-4d67-8b16-53cb91118dfc,basketball_play,1775431394,464,True,2026-04-05 23:23:14+00:00,1,308.0,412.0,6.866666666666666,69
4,54,quarter,1,d3c8c2ac-c4a0-4d67-8b16-53cb91118dfc,15,4:54,Yves Missi makes two point driving layup,twopointmade,20,00c3e69d-d9b9-4ac3-bf79-19707fe43637,basketball_play,1775431409,463,True,2026-04-05 23:23:29+00:00,1,294.0,426.0,7.1,70
4,53,quarter,1,00c3e69d-d9b9-4ac3-bf79-19707fe43637,17,4:37,Tristan da Silva makes two point driving floating jump shot (Jalen Suggs assists),twopointmade,20,d3c8c2ac-c4a0-4d67-8b16-53cb91118dfc,basketball_play,1775431427,462,True,2026-04-05 23:23:47+00:00,1,277.0,443.0,7.383333333333334,71
4,52,quarter,1,d3c8c2ac-c4a0-4d67-8b16-53cb91118dfc,17,4:23,Yves Missi makes two point cutting layup (Jeremiah Fears assists),twopointmade,22,00c3e69d-d9b9-4ac3-bf79-19707fe43637,basketball_play,1775431443,461,True,2026-04-05 23:24:03+00:00,1,263.0,457.0,7.616666666666666,72
4,51,quarter,1,00c3e69d-d9b9-4ac3-bf79-19707fe43637,17,4:23,Wendell Carter Jr. shooting foul (Yves Missi draws the foul),shootingfoul,22,d3c8c2ac-c4a0-4d67-8b16-53cb91118dfc,basketball_play,1775431445,460,True,2026-04-05 23:24:05+00:00,1,263.0,457.0,7.616666666666666,73
4,50,quarter,1,00c3e69d-d9b9-4ac3-bf79-19707fe43637,17,4:23,"Magic lineup change (Goga Bitadze, Paolo Banchero, Jalen Suggs, Tristan da Silva, Jamal Cain)",lineupchange,22,,basketball_play,1775431474,459,True,2026-04-05 23:24:34+00:00,1,263.0,457.0,7.616666666666666,74
4,49,quarter,1,d3c8c2ac-c4a0-4d67-8b16-53cb91118dfc,17,4:23,Yves Missi misses regular free throw 1 of 1,freethrowmiss,22,,basketball_play,1775431474,458,True,2026-04-05 23:24:34+00:00,1,263.0,457.0,7.616666666666666,75
4,48,quarter,1,00c3e69d-d9b9-4ac3-bf79-19707fe43637,17,4:20,Jamal Cain defensive rebound,rebound,22,00c3e69d-d9b9-4ac3-bf79-19707fe43637,basketball_play,1775431477,457,True,2026-04-05 23:24:37+00:00,1,260.0,460.0,7.666666666666667,76
4,47,quarter,1,00c3e69d-d9b9-4ac3-bf79-19707fe43637,17,4:06,Jalen Suggs misses three point jump shot,threepointmiss,22,,basketball_play,1775431490,456,True,2026-04-05 23:24:50+00:00,1,246.0,474.0,7.9,77
4,46,quarter,1,00c3e69d-d9b9-4ac3-bf79-19707fe43637,17,4:03,Goga Bitadze offensive rebound,rebound,22,00c3e69d-d9b9-4ac3-bf79-19707fe43637,basketball_play,1775431493,455,True,2026-04-05 23:24:53+00:00,1,243.0,477.0,7.95,78
4,45,quarter,1,d3c8c2ac-c4a0-4d67-8b16-53cb91118dfc,17,4:02,Herbert Jones personal foul (Jamal Cain draws the foul),personalfoul,22,00c3e69d-d9b9-4ac3-bf79-19707fe43637,basketball_play,1775431499,454,True,2026-04-05 23:24:59+00:00,1,242.0,478.0,7.966666666666667,79
4,44,quarter,1,00c3e69d-d9b9-4ac3-bf79-19707fe43637,17,4:02,"Magic lineup change (Goga Bitadze, Paolo Banchero, Tristan da Silva, Jamal Cain, Jevon Carter)",lineupchange,22,,basketball_play,1775431527,453,True,2026-04-05 23:25:27+00:00,1,242.0,478.0,7.966666666666667,80
4,43,quarter,1,00c3e69d-d9b9-4ac3-bf79-19707fe43637,17,3:53,Tristan da Silva misses two point turnaround hook shot,twopointmiss,22,,basketball_play,1775431527,452,True,2026-04-05 23:25:27+00:00,1,233.0,487.0,8.116666666666667,81
4,42,quarter,1,d3c8c2ac-c4a0-4d67-8b16-53cb91118dfc,17,3:51,Derik Queen defensive rebound,rebound,22,d3c8c2ac-c4a0-4d67-8b16-53cb91118dfc,basketball_play,1775431529,451,True,2026-04-05 23:25:29+00:00,1,231.0,489.0,8.15,82
4,41,quarter,1,d3c8c2ac-c4a0-4d67-8b16-53cb91118dfc,17,3:47,Saddiq Bey makes three point running jump shot (Jeremiah Fears assists),threepointmade,25,00c3e69d-d9b9-4ac3-bf79-19707fe43637,basketball_play,1775431533,450,True,2026-04-05 23:25:33+00:00,1,227.0,493.0,8.216666666666667,83
4,40,quarter,1,00c3e69d-d9b9-4ac3-bf79-19707fe43637,17,3:32,Jevon Carter misses three point jump shot,threepointmiss,25,,basketball_play,1775431548,449,True,2026-04-05 23:25:48+00:00,1,212.0,508.0,8.466666666666667,84
4,39,quarter,1,00c3e69d-d9b9-4ac3-bf79-19707fe43637,17,3:24,Goga Bitadze offensive rebound,rebound,25,00c3e69d-d9b9-4ac3-bf79-19707fe43637,basketball_play,1775431556,448,True,2026-04-05 23:25:56+00:00,1,204.0,516.0,8.6,85
4,38,quarter,1,00c3e69d-d9b9-4ac3-bf79-19707fe43637,19,3:24,Goga Bitadze makes two point tip layup,twopointmade,25,d3c8c2ac-c4a0-4d67-8b16-53cb91118dfc,basketball_play,1775431555,447,True,2026-04-05 23:25:55+00:00,1,204.0,516.0,8.6,86
4,37,quarter,1,d3c8c2ac-c4a0-4d67-8b16-53cb91118dfc,19,3:16,Saddiq Bey makes two point turnaround hook shot,twopointmade,27,00c3e69d-d9b9-4ac3-bf79-19707fe43637,basketball_play,1775431565,446,True,2026-04-05 23:26:05+00:00,1,196.0,524.0,8.733333333333333,87
4,36,quarter,1,00c3e69d-d9b9-4ac3-bf79-19707fe43637,19,3:16,Magic 60 second timeout,teamtimeout,27,,basketball_play,1775431570,445,True,2026-04-05 23:26:10+00:00,1,196.0,524.0,8.733333333333333,88
4,35,quarter,1,00c3e69d-d9b9-4ac3-bf79-19707fe43637,19,3:16,"Magic lineup change (Goga Bitadze, Franz Wagner, Desmond Bane, Jamal Cain, Jevon Carter)",lineupchange,27,,basketball_play,1775431716,444,True,2026-04-05 23:28:36+00:00,1,196.0,524.0,8.733333333333333,89
4,34,quarter,1,d3c8c2ac-c4a0-4d67-8b16-53cb91118dfc,19,3:16,"Pelicans lineup change (Derik Queen, Jeremiah Fears, Micah Peavy, Yves Missi, Saddiq Bey)",lineupchange,27,,basketball_play,1775431716,443,True,2026-04-05 23:28:36+00:00,1,196.0,524.0,8.733333333333333,90
4,33,quarter,1,00c3e69d-d9b9-4ac3-bf79-19707fe43637,19,2:54,Jevon Carter misses three point jump shot,threepointmiss,27,,basketball_play,1775431765,442,True,2026-04-05 23:29:25+00:00,1,174.0,546.0,9.1,91
4,32,quarter,1,00c3e69d-d9b9-4ac3-bf79-19707fe43637,19,2:52,Jamal Cain offensive rebound,rebound,27,00c3e69d-d9b9-4ac3-bf79-19707fe43637,basketball_play,1775431767,441,True,2026-04-05 23:29:27+00:00,1,172.0,548.0,9.133333333333333,92
4,31,quarter,1,d3c8c2ac-c4a0-4d67-8b16-53cb91118dfc,19,2:51,Derik Queen shooting foul (Jamal Cain draws the foul),shootingfoul,27,00c3e69d-d9b9-4ac3-bf79-19707fe43637,basketball_play,1775431773,440,True,2026-04-05 23:29:33+00:00,1,171.0,549.0,9.15,93
4,30,quarter,1,00c3e69d-d9b9-4ac3-bf79-19707fe43637,20,2:51,Jamal Cain makes regular free throw 1 of 2,freethrowmade,27,00c3e69d-d9b9-4ac3-bf79-19707fe43637,basketball_play,1775431795,439,True,2026-04-05 23:29:55+00:00,1,171.0,549.0,9.15,94
4,29,quarter,1,00c3e69d-d9b9-4ac3-bf79-19707fe43637,21,2:51,Jamal Cain makes regular free throw 2 of 2,freethrowmade,27,d3c8c2ac-c4a0-4d67-8b16-53cb91118dfc,basketball_play,1775431809,438,True,2026-04-05 23:30:09+00:00,1,171.0,549.0,9.15,95
4,28,quarter,1,d3c8c2ac-c4a0-4d67-8b16-53cb91118dfc,21,2:30,Micah Peavy misses two point fadeaway jump shot,twopointmiss,27,,basketball_play,1775431832,437,True,2026-04-05 23:30:32+00:00,1,150.0,570.0,9.5,96
4,27,quarter,1,00c3e69d-d9b9-4ac3-bf79-19707fe43637,21,2:26,Jevon Carter defensive rebound,rebound,27,00c3e69d-d9b9-4ac3-bf79-19707fe43637,basketball_play,1775431836,436,True,2026-04-05 23:30:36+00:00,1,146.0,574.0,9.566666666666666,97
4,26,quarter,1,00c3e69d-d9b9-4ac3-bf79-19707fe43637,23,2:14,Jevon Carter makes two point pullup jump shot (Franz Wagner assists),twopointmade,27,d3c8c2ac-c4a0-4d67-8b16-53cb91118dfc,basketball_play,1775431847,435,True,2026-04-05 23:30:47+00:00,1,134.0,586.0,9.766666666666667,98
4,25,quarter,1,d3c8c2ac-c4a0-4d67-8b16-53cb91118dfc,23,1:57,Yves Missi turnover (double dribble),turnover,27,00c3e69d-d9b9-4ac3-bf79-19707fe43637,basketball_play,1775431868,434,True,2026-04-05 23:31:08+00:00,1,117.0,603.0,10.05,99
4,24,quarter,1,d3c8c2ac-c4a0-4d67-8b16-53cb91118dfc,23,1:55,"Pelicans lineup change (Derik Queen, Hunter Dickinson, Jeremiah Fears, Micah Peavy, Zion Williamson)",lineupchange,27,,basketball_play,1775431874,433,True,2026-04-05 23:31:14+00:00,1,115.0,605.0,10.083333333333334,100
4,23,quarter,1,00c3e69d-d9b9-4ac3-bf79-19707fe43637,23,1:44,Franz Wagner misses three point pullup jump shot,threepointmiss,27,,basketball_play,1775431906,432,True,2026-04-05 23:31:46+00:00,1,104.0,616.0,10.266666666666667,101
4,22,quarter,1,d3c8c2ac-c4a0-4d67-8b16-53cb91118dfc,23,1:41,Jeremiah Fears defensive rebound,rebound,27,d3c8c2ac-c4a0-4d67-8b16-53cb91118dfc,basketball_play,1775431909,431,True,2026-04-05 23:31:49+00:00,1,101.0,619.0,10.316666666666666,102
4,21,quarter,1,00c3e69d-d9b9-4ac3-bf79-19707fe43637,23,1:37,Jevon Carter shooting foul (Jeremiah Fears draws the foul),shootingfoul,27,d3c8c2ac-c4a0-4d67-8b16-53cb91118dfc,basketball_play,1775431918,430,True,2026-04-05 23:31:58+00:00,1,97.0,623.0,10.383333333333333,103
4,20,quarter,1,d3c8c2ac-c4a0-4d67-8b16-53cb91118dfc,23,1:37,Jeremiah Fears makes regular free throw 1 of 2,freethrowmade,28,d3c8c2ac-c4a0-4d67-8b16-53cb91118dfc,basketball_play,1775431941,429,True,2026-04-05 23:32:21+00:00,1,97.0,623.0,10.383333333333333,104
4,19,quarter,1,d3c8c2ac-c4a0-4d67-8b16-53cb91118dfc,23,1:37,Jeremiah Fears misses regular free throw 2 of 2,freethrowmiss,28,,basketball_play,1775431941,428,True,2026-04-05 23:32:21+00:00,1,97.0,623.0,10.383333333333333,105
4,18,quarter,1,00c3e69d-d9b9-4ac3-bf79-19707fe43637,23,1:34,Franz Wagner defensive rebound,rebound,28,00c3e69d-d9b9-4ac3-bf79-19707fe43637,basketball_play,1775431944,427,True,2026-04-05 23:32:24+00:00,1,94.0,626.0,10.433333333333334,106
4,17,quarter,1,00c3e69d-d9b9-4ac3-bf79-19707fe43637,25,1:25,Jevon Carter makes two point pullup jump shot (Goga Bitadze assists),twopointmade,28,d3c8c2ac-c4a0-4d67-8b16-53cb91118dfc,basketball_play,1775431969,426,True,2026-04-05 23:32:49+00:00,1,85.0,635.0,10.583333333333334,107
