period_index,event_index,period_type,period_number,attribution,away_points,clock,description,event_type,home_points,possession,type,wall_clock,pbp_source_row,has_wall_clock,event_ts_utc,period_sequence,game_clock_seconds_remaining,game_elapsed_seconds,game_elapsed_minutes,pbp_chronological_index
2,71,quarter,3,65569528-1888-40aa-9d62-2b0e8142a9b4,64,7:00,Cade Cunningham makes two point driving floating jump shot (Ausar Thompson assists),twopointmade,65,00c3e69d-d9b9-4ac3-bf79-19707fe43637,basketball_play,1772412133,174,True,2026-03-02 00:42:13+00:00,3,420.0,1740.0,29.0,318
2,70,quarter,3,00c3e69d-d9b9-4ac3-bf79-19707fe43637,64,6:51,Ausar Thompson blocks Desmond Bane's two point driving layup,twopointmiss,65,,basketball_play,1772412142,173,True,2026-03-02 00:42:22+00:00,3,411.0,1749.0,29.15,319
2,69,quarter,3,65569528-1888-40aa-9d62-2b0e8142a9b4,64,6:49,Cade Cunningham defensive rebound,rebound,65,65569528-1888-40aa-9d62-2b0e8142a9b4,basketball_play,1772412144,172,True,2026-03-02 00:42:24+00:00,3,409.0,1751.0,29.183333333333334,320
2,68,quarter,3,65569528-1888-40aa-9d62-2b0e8142a9b4,67,6:44,Tobias Harris makes three point running jump shot (Cade Cunningham assists),threepointmade,65,00c3e69d-d9b9-4ac3-bf79-19707fe43637,basketball_play,1772412149,171,True,2026-03-02 00:42:29+00:00,3,404.0,1756.0,29.266666666666666,321
2,67,quarter,3,00c3e69d-d9b9-4ac3-bf79-19707fe43637,67,6:43,Magic 60 second timeout,teamtimeout,65,,basketball_play,1772412157,170,True,2026-03-02 00:42:37+00:00,3,403.0,1757.0,29.283333333333335,322
2,66,quarter,3,00c3e69d-d9b9-4ac3-bf79-19707fe43637,67,6:19,Paolo Banchero makes two point pullup jump shot,twopointmade,67,65569528-1888-40aa-9d62-2b0e8142a9b4,basketball_play,1772412368,169,True,2026-03-02 00:46:08+00:00,3,379.0,1781.0,29.683333333333334,323
2,65,quarter,3,65569528-1888-40aa-9d62-2b0e8142a9b4,67,6:00,Cade Cunningham misses two point driving layup,twopointmiss,67,,basketball_play,1772412387,168,True,2026-03-02 00:46:27+00:00,3,360.0,1800.0,30.0,324
2,64,quarter,3,00c3e69d-d9b9-4ac3-bf79-19707fe43637,67,5:58,Wendell Carter Jr. defensive rebound,rebound,67,00c3e69d-d9b9-4ac3-bf79-19707fe43637,basketball_play,1772412389,167,True,2026-03-02 00:46:29+00:00,3,358.0,1802.0,30.033333333333335,325
2,63,quarter,3,00c3e69d-d9b9-4ac3-bf79-19707fe43637,67,5:55,Paolo Banchero turnover (lost ball) (Ausar Thompson steals),turnover,67,65569528-1888-40aa-9d62-2b0e8142a9b4,basketball_play,1772412392,166,True,2026-03-02 00:46:32+00:00,3,355.0,1805.0,30.083333333333332,326
2,62,quarter,3,65569528-1888-40aa-9d62-2b0e8142a9b4,69,5:52,Ausar Thompson makes two point running layup (Cade Cunningham assists),twopointmade,67,00c3e69d-d9b9-4ac3-bf79-19707fe43637,basketball_play,1772412396,165,True,2026-03-02 00:46:36+00:00,3,352.0,1808.0,30.133333333333333,327
2,61,quarter,3,00c3e69d-d9b9-4ac3-bf79-19707fe43637,69,5:37,Tristan da Silva makes two point cutting dunk (Desmond Bane assists),twopointmade,69,65569528-1888-40aa-9d62-2b0e8142a9b4,basketball_play,1772412410,164,True,2026-03-02 00:46:50+00:00,3,337.0,1823.0,30.383333333333333,328
2,60,quarter,3,00c3e69d-d9b9-4ac3-bf79-19707fe43637,69,5:21,Wendell Carter Jr. shooting foul (Jalen Duren draws the foul),shootingfoul,69,65569528-1888-40aa-9d62-2b0e8142a9b4,basketball_play,1772412428,163,True,2026-03-02 00:47:08+00:00,3,321.0,1839.0,30.65,329
2,59,quarter,3,65569528-1888-40aa-9d62-2b0e8142a9b4,69,5:21,Jalen Duren misses regular free throw 1 of 2,freethrowmiss,69,65569528-1888-40aa-9d62-2b0e8142a9b4,basketball_play,1772412462,162,True,2026-03-02 00:47:42+00:00,3,321.0,1839.0,30.65,330
2,58,quarter,3,65569528-1888-40aa-9d62-2b0e8142a9b4,69,5:21,Pistons offensive rebound,rebound,69,65569528-1888-40aa-9d62-2b0e8142a9b4,basketball_play,1772412462,161,True,2026-03-02 00:47:42+00:00,3,321.0,1839.0,30.65,331
2,57,quarter,3,65569528-1888-40aa-9d62-2b0e8142a9b4,69,5:21,"Pistons lineup change (Ronald Holland II, Jalen Duren, Cade Cunningham, Duncan Robinson, Ausar Thompson)",lineupchange,69,,basketball_play,1772412463,160,True,2026-03-02 00:47:43+00:00,3,321.0,1839.0,30.65,332
2,56,quarter,3,00c3e69d-d9b9-4ac3-bf79-19707fe43637,69,5:21,"Magic lineup change (Wendell Carter Jr., Tristan da Silva, Jett Howard, Paolo Banchero, Jevon Carter)",lineupchange,69,,basketball_play,1772412463,159,True,2026-03-02 00:47:43+00:00,3,321.0,1839.0,30.65,333
2,55,quarter,3,65569528-1888-40aa-9d62-2b0e8142a9b4,70,5:21,Jalen Duren makes regular free throw 2 of 2,freethrowmade,69,00c3e69d-d9b9-4ac3-bf79-19707fe43637,basketball_play,1772412489,158,True,2026-03-02 00:48:09+00:00,3,321.0,1839.0,30.65,334
2,54,quarter,3,00c3e69d-d9b9-4ac3-bf79-19707fe43637,70,5:06,Wendell Carter Jr. makes two point jump shot (Jevon Carter assists),twopointmade,71,65569528-1888-40aa-9d62-2b0e8142a9b4,basketball_play,1772412505,157,True,2026-03-02 00:48:25+00:00,3,306.0,1854.0,30.9,335
2,53,quarter,3,65569528-1888-40aa-9d62-2b0e8142a9b4,73,4:54,Cade Cunningham makes three point jump shot (Jalen Duren assists),threepointmade,71,00c3e69d-d9b9-4ac3-bf79-19707fe43637,basketball_play,1772412518,156,True,2026-03-02 00:48:38+00:00,3,294.0,1866.0,31.1,336
2,52,quarter,3,00c3e69d-d9b9-4ac3-bf79-19707fe43637,73,4:42,Paolo Banchero turnover (traveling),turnover,71,65569528-1888-40aa-9d62-2b0e8142a9b4,basketball_play,1772412533,155,True,2026-03-02 00:48:53+00:00,3,282.0,1878.0,31.3,337
2,51,quarter,3,65569528-1888-40aa-9d62-2b0e8142a9b4,73,4:42,"Pistons lineup change (Ronald Holland II, Paul Reed, Cade Cunningham, Duncan Robinson, Ausar Thompson)",lineupchange,71,,basketball_play,1772412543,154,True,2026-03-02 00:49:03+00:00,3,282.0,1878.0,31.3,338
2,50,quarter,3,00c3e69d-d9b9-4ac3-bf79-19707fe43637,73,4:42,"Magic lineup change (Tristan da Silva, Jett Howard, Jonathan Isaac, Paolo Banchero, Jevon Carter)",lineupchange,71,,basketball_play,1772412576,153,True,2026-03-02 00:49:36+00:00,3,282.0,1878.0,31.3,339
2,49,quarter,3,00c3e69d-d9b9-4ac3-bf79-19707fe43637,73,4:28,Jevon Carter shooting foul (Paul Reed draws the foul),shootingfoul,71,65569528-1888-40aa-9d62-2b0e8142a9b4,basketball_play,1772412576,152,True,2026-03-02 00:49:36+00:00,3,268.0,1892.0,31.533333333333335,340
2,48,quarter,3,65569528-1888-40aa-9d62-2b0e8142a9b4,74,4:28,Paul Reed makes regular free throw 1 of 2,freethrowmade,71,65569528-1888-40aa-9d62-2b0e8142a9b4,basketball_play,1772412598,151,True,2026-03-02 00:49:58+00:00,3,268.0,1892.0,31.533333333333335,341
2,47,quarter,3,65569528-1888-40aa-9d62-2b0e8142a9b4,75,4:28,Paul Reed makes regular free throw 2 of 2,freethrowmade,71,00c3e69d-d9b9-4ac3-bf79-19707fe43637,basketball_play,1772412615,150,True,2026-03-02 00:50:15+00:00,3,268.0,1892.0,31.533333333333335,342
2,46,quarter,3,00c3e69d-d9b9-4ac3-bf79-19707fe43637,75,4:14,Jett Howard misses three point pullup jump shot,threepointmiss,71,,basketball_play,1772412634,149,True,2026-03-02 00:50:34+00:00,3,254.0,1906.0,31.766666666666666,343
2,45,quarter,3,00c3e69d-d9b9-4ac3-bf79-19707fe43637,75,4:12,Paolo Banchero offensive rebound,rebound,71,00c3e69d-d9b9-4ac3-bf79-19707fe43637,basketball_play,1772412636,148,True,2026-03-02 00:50:36+00:00,3,252.0,1908.0,31.8,344
2,44,quarter,3,00c3e69d-d9b9-4ac3-bf79-19707fe43637,75,4:06,Jevon Carter misses three point pullup jump shot,threepointmiss,71,,basketball_play,1772412641,147,True,2026-03-02 00:50:41+00:00,3,246.0,1914.0,31.9,345
2,43,quarter,3,65569528-1888-40aa-9d62-2b0e8142a9b4,75,4:03,Ausar Thompson defensive rebound,rebound,71,65569528-1888-40aa-9d62-2b0e8142a9b4,basketball_play,1772412644,146,True,2026-03-02 00:50:44+00:00,3,243.0,1917.0,31.95,346
2,42,quarter,3,65569528-1888-40aa-9d62-2b0e8142a9b4,75,3:39,Ronald Holland II misses two point driving layup,twopointmiss,71,,basketball_play,1772412665,145,True,2026-03-02 00:51:05+00:00,3,219.0,1941.0,32.35,347
2,41,quarter,3,00c3e69d-d9b9-4ac3-bf79-19707fe43637,75,3:36,Paolo Banchero defensive rebound,rebound,71,00c3e69d-d9b9-4ac3-bf79-19707fe43637,basketball_play,1772412667,144,True,2026-03-02 00:51:07+00:00,3,216.0,1944.0,32.4,348
2,40,quarter,3,00c3e69d-d9b9-4ac3-bf79-19707fe43637,75,3:31,Tristan da Silva misses three point running pullup jump shot,threepointmiss,71,,basketball_play,1772412673,143,True,2026-03-02 00:51:13+00:00,3,211.0,1949.0,32.483333333333334,349
2,39,quarter,3,65569528-1888-40aa-9d62-2b0e8142a9b4,75,3:28,Ausar Thompson defensive rebound,rebound,71,65569528-1888-40aa-9d62-2b0e8142a9b4,basketball_play,1772412676,142,True,2026-03-02 00:51:16+00:00,3,208.0,1952.0,32.53333333333333,350
2,38,quarter,3,65569528-1888-40aa-9d62-2b0e8142a9b4,75,3:24,Cade Cunningham turnover (bad pass) (Tristan da Silva steals),turnover,71,00c3e69d-d9b9-4ac3-bf79-19707fe43637,basketball_play,1772412680,141,True,2026-03-02 00:51:20+00:00,3,204.0,1956.0,32.6,351
2,37,quarter,3,65569528-1888-40aa-9d62-2b0e8142a9b4,75,3:10,Duncan Robinson personal foul (Tristan da Silva draws the foul),personalfoul,71,00c3e69d-d9b9-4ac3-bf79-19707fe43637,basketball_play,1772412697,140,True,2026-03-02 00:51:37+00:00,3,190.0,1970.0,32.833333333333336,352
2,36,quarter,3,00c3e69d-d9b9-4ac3-bf79-19707fe43637,75,3:10,"Magic lineup change (Jett Howard, Jalen Suggs, Jonathan Isaac, Paolo Banchero, Jevon Carter)",lineupchange,71,,basketball_play,1772412715,139,True,2026-03-02 00:51:55+00:00,3,190.0,1970.0,32.833333333333336,353
2,35,quarter,3,65569528-1888-40aa-9d62-2b0e8142a9b4,75,3:10,"Pistons lineup change (Ronald Holland II, Paul Reed, Caris LeVert, Cade Cunningham, Ausar Thompson)",lineupchange,71,,basketball_play,1772412744,138,True,2026-03-02 00:52:24+00:00,3,190.0,1970.0,32.833333333333336,354
2,34,quarter,3,00c3e69d-d9b9-4ac3-bf79-19707fe43637,75,2:57,Jalen Suggs misses three point pullup jump shot,threepointmiss,71,,basketball_play,1772412744,137,True,2026-03-02 00:52:24+00:00,3,177.0,1983.0,33.05,355
2,33,quarter,3,65569528-1888-40aa-9d62-2b0e8142a9b4,75,2:55,Ausar Thompson defensive rebound,rebound,71,65569528-1888-40aa-9d62-2b0e8142a9b4,basketball_play,1772412746,136,True,2026-03-02 00:52:26+00:00,3,175.0,1985.0,33.083333333333336,356
2,32,quarter,3,65569528-1888-40aa-9d62-2b0e8142a9b4,75,2:51,Pistons 60 second timeout,teamtimeout,71,,basketball_play,1772412754,135,True,2026-03-02 00:52:34+00:00,3,171.0,1989.0,33.15,357
2,31,quarter,3,65569528-1888-40aa-9d62-2b0e8142a9b4,75,2:51,"Pistons lineup change (Ronald Holland II, Paul Reed, Caris LeVert, Tobias Harris, Cade Cunningham)",lineupchange,71,,basketball_play,1772412842,134,True,2026-03-02 00:54:02+00:00,3,171.0,1989.0,33.15,358
2,30,quarter,3,00c3e69d-d9b9-4ac3-bf79-19707fe43637,75,2:51,"Magic lineup change (Jalen Suggs, Paolo Banchero, Desmond Bane, Moritz Wagner, Jevon Carter)",lineupchange,71,,basketball_play,1772412842,133,True,2026-03-02 00:54:02+00:00,3,171.0,1989.0,33.15,359
2,29,quarter,3,65569528-1888-40aa-9d62-2b0e8142a9b4,75,2:44,Tobias Harris misses three point jump shot,threepointmiss,71,,basketball_play,1772412943,132,True,2026-03-02 00:55:43+00:00,3,164.0,1996.0,33.266666666666666,360
2,28,quarter,3,65569528-1888-40aa-9d62-2b0e8142a9b4,75,2:42,Paul Reed offensive rebound,rebound,71,65569528-1888-40aa-9d62-2b0e8142a9b4,basketball_play,1772412945,131,True,2026-03-02 00:55:45+00:00,3,162.0,1998.0,33.3,361
2,27,quarter,3,65569528-1888-40aa-9d62-2b0e8142a9b4,77,2:39,Paul Reed makes two point putback layup,twopointmade,71,00c3e69d-d9b9-4ac3-bf79-19707fe43637,basketball_play,1772412948,130,True,2026-03-02 00:55:48+00:00,3,159.0,2001.0,33.35,362
2,26,quarter,3,00c3e69d-d9b9-4ac3-bf79-19707fe43637,77,2:25,Moritz Wagner offensive foul (Charge) (Paul Reed draws the foul),offensivefoul,71,65569528-1888-40aa-9d62-2b0e8142a9b4,basketball_play,1772412965,129,True,2026-03-02 00:56:05+00:00,3,145.0,2015.0,33.583333333333336,363
2,25,quarter,3,00c3e69d-d9b9-4ac3-bf79-19707fe43637,77,2:25,Moritz Wagner turnover (offensive foul),turnover,71,65569528-1888-40aa-9d62-2b0e8142a9b4,basketball_play,1772412965,128,True,2026-03-02 00:56:05+00:00,3,145.0,2015.0,33.583333333333336,364
2,24,quarter,3,65569528-1888-40aa-9d62-2b0e8142a9b4,77,2:25,"Pistons lineup change (Ronald Holland II, Paul Reed, Caris LeVert, Tobias Harris, Daniss Jenkins)",lineupchange,71,,basketball_play,1772413004,127,True,2026-03-02 00:56:44+00:00,3,145.0,2015.0,33.583333333333336,365
2,23,quarter,3,65569528-1888-40aa-9d62-2b0e8142a9b4,79,2:07,Tobias Harris makes two point turnaround fadeaway jump shot,twopointmade,71,00c3e69d-d9b9-4ac3-bf79-19707fe43637,basketball_play,1772413004,126,True,2026-03-02 00:56:44+00:00,3,127.0,2033.0,33.88333333333333,366
2,22,quarter,3,00c3e69d-d9b9-4ac3-bf79-19707fe43637,79,1:56,Jalen Suggs turnover (bad pass) (Caris LeVert steals),turnover,71,65569528-1888-40aa-9d62-2b0e8142a9b4,basketball_play,1772413014,125,True,2026-03-02 00:56:54+00:00,3,116.0,2044.0,34.06666666666667,367
2,21,quarter,3,65569528-1888-40aa-9d62-2b0e8142a9b4,81,1:52,Caris LeVert makes two point running layup,twopointmade,71,00c3e69d-d9b9-4ac3-bf79-19707fe43637,basketball_play,1772413019,124,True,2026-03-02 00:56:59+00:00,3,112.0,2048.0,34.13333333333333,368
2,20,quarter,3,00c3e69d-d9b9-4ac3-bf79-19707fe43637,81,1:35,Paul Reed blocks Moritz Wagner's two point driving layup,twopointmiss,71,,basketball_play,1772413038,123,True,2026-03-02 00:57:18+00:00,3,95.0,2065.0,34.416666666666664,369
2,19,quarter,3,65569528-1888-40aa-9d62-2b0e8142a9b4,81,1:33,Tobias Harris defensive rebound,rebound,71,65569528-1888-40aa-9d62-2b0e8142a9b4,basketball_play,1772413040,122,True,2026-03-02 00:57:20+00:00,3,93.0,2067.0,34.45,370
2,18,quarter,3,65569528-1888-40aa-9d62-2b0e8142a9b4,81,1:24,Daniss Jenkins misses three point running pullup jump shot,threepointmiss,71,,basketball_play,1772413047,121,True,2026-03-02 00:57:27+00:00,3,84.0,2076.0,34.6,371
2,17,quarter,3,00c3e69d-d9b9-4ac3-bf79-19707fe43637,81,1:20,Paolo Banchero defensive rebound,rebound,71,00c3e69d-d9b9-4ac3-bf79-19707fe43637,basketball_play,1772413051,120,True,2026-03-02 00:57:31+00:00,3,80.0,2080.0,34.666666666666664,372
2,16,quarter,3,65569528-1888-40aa-9d62-2b0e8142a9b4,81,1:10,Tobias Harris shooting foul (Paolo Banchero draws the foul),shootingfoul,71,00c3e69d-d9b9-4ac3-bf79-19707fe43637,basketball_play,1772413063,119,True,2026-03-02 00:57:43+00:00,3,70.0,2090.0,34.833333333333336,373
2,15,quarter,3,65569528-1888-40aa-9d62-2b0e8142a9b4,81,1:10,Pistons delay of game violation,delay,71,00c3e69d-d9b9-4ac3-bf79-19707fe43637,basketball_play,1772413083,118,True,2026-03-02 00:58:03+00:00,3,70.0,2090.0,34.833333333333336,374
2,14,quarter,3,00c3e69d-d9b9-4ac3-bf79-19707fe43637,81,1:10,Paolo Banchero misses regular free throw 1 of 2,freethrowmiss,71,00c3e69d-d9b9-4ac3-bf79-19707fe43637,basketball_play,1772413106,117,True,2026-03-02 00:58:26+00:00,3,70.0,2090.0,34.833333333333336,375
2,13,quarter,3,00c3e69d-d9b9-4ac3-bf79-19707fe43637,81,1:10,Magic offensive rebound,rebound,71,00c3e69d-d9b9-4ac3-bf79-19707fe43637,basketball_play,1772413106,116,True,2026-03-02 00:58:26+00:00,3,70.0,2090.0,34.833333333333336,376
2,12,quarter,3,00c3e69d-d9b9-4ac3-bf79-19707fe43637,81,1:10,Paolo Banchero makes regular free throw 2 of 2,freethrowmade,72,65569528-1888-40aa-9d62-2b0e8142a9b4,basketball_play,1772413126,115,True,2026-03-02 00:58:46+00:00,3,70.0,2090.0,34.833333333333336,377
2,11,quarter,3,65569528-1888-40aa-9d62-2b0e8142a9b4,81,00:59.10,Caris LeVert offensive foul (Charge) (Moritz Wagner draws the foul),offensivefoul,72,00c3e69d-d9b9-4ac3-bf79-19707fe43637,basketball_play,1772413143,114,True,2026-03-02 00:59:03+00:00,3,59.1,2100.9,35.015,378
2,10,quarter,3,65569528-1888-40aa-9d62-2b0e8142a9b4,81,00:59.10,Caris LeVert turnover (offensive foul),turnover,72,00c3e69d-d9b9-4ac3-bf79-19707fe43637,basketball_play,1772413143,113,True,2026-03-02 00:59:03+00:00,3,59.1,2100.9,35.015,379
2,9,quarter,3,00c3e69d-d9b9-4ac3-bf79-19707fe43637,81,00:59.10,"Magic lineup change (Tristan da Silva, Jalen Suggs, Desmond Bane, Moritz Wagner, Jevon Carter)",lineupchange,72,,basketball_play,1772413174,112,True,2026-03-02 00:59:34+00:00,3,59.1,2100.9,35.015,380
2,8,quarter,3,00c3e69d-d9b9-4ac3-bf79-19707fe43637,81,00:46.70,Jalen Suggs misses three point jump shot,threepointmiss,72,,basketball_play,1772413174,111,True,2026-03-02 00:59:34+00:00,3,46.7,2113.3,35.22166666666667,381
2,7,quarter,3,65569528-1888-40aa-9d62-2b0e8142a9b4,81,00:43.80,Paul Reed defensive rebound,rebound,72,65569528-1888-40aa-9d62-2b0e8142a9b4,basketball_play,1772413177,110,True,2026-03-02 00:59:37+00:00,3,43.8,2116.2,35.269999999999996,382
2,6,quarter,3,65569528-1888-40aa-9d62-2b0e8142a9b4,81,00:33.60,Caris LeVert misses three point pullup jump shot,threepointmiss,72,,basketball_play,1772413187,109,True,2026-03-02 00:59:47+00:00,3,33.6,2126.4,35.440000000000005,383
2,5,quarter,3,00c3e69d-d9b9-4ac3-bf79-19707fe43637,81,00:30.60,Tristan da Silva defensive rebound,rebound,72,00c3e69d-d9b9-4ac3-bf79-19707fe43637,basketball_play,1772413190,108,True,2026-03-02 00:59:50+00:00,3,30.6,2129.4,35.49,384
2,4,quarter,3,00c3e69d-d9b9-4ac3-bf79-19707fe43637,81,00:10.90,Tristan da Silva makes three point jump shot (Jevon Carter assists),threepointmade,75,65569528-1888-40aa-9d62-2b0e8142a9b4,basketball_play,1772413211,107,True,2026-03-02 01:00:11+00:00,3,10.9,2149.1,35.818333333333335,385
2,3,quarter,3,65569528-1888-40aa-9d62-2b0e8142a9b4,81,00:00,Daniss Jenkins misses three point stepback jump shot,threepointmiss,75,,basketball_play,1772413224,106,True,2026-03-02 01:00:24+00:00,3,0.0,2160.0,36.0,386
2,2,quarter,3,65569528-1888-40aa-9d62-2b0e8142a9b4,81,00:00,Pistons offensive rebound,rebound,75,65569528-1888-40aa-9d62-2b0e8142a9b4,basketball_play,1772413227,105,True,2026-03-02 01:00:27+00:00,3,0.0,2160.0,36.0,387
2,1,quarter,3,,81,00:00,End of 3rd Quarter.,endperiod,75,,basketball_play,1772413228,104,True,2026-03-02 01:00:28+00:00,3,0.0,2160.0,36.0,388
1,104,quarter,4,65569528-1888-40aa-9d62-2b0e8142a9b4,81,12:00,"Pistons lineup change (Javonte Green, Ronald Holland II, Caris LeVert, Jalen Duren, Cade Cunningham)",lineupchange,75,,basketball_play,1772413282,103,True,2026-03-02 01:01:22+00:00,4,720.0,2160.0,36.0,389
1,103,quarter,4,00c3e69d-d9b9-4ac3-bf79-19707fe43637,81,12:00,"Magic lineup change (Tristan da Silva, Jett Howard, Desmond Bane, Moritz Wagner, Jevon Carter)",lineupchange,75,,basketball_play,1772413282,102,True,2026-03-02 01:01:22+00:00,4,720.0,2160.0,36.0,390
1,102,quarter,4,,81,12:00,Start of 4th Quarter,startperiod,75,,basketball_play,1772413402,101,True,2026-03-02 01:03:22+00:00,4,720.0,2160.0,36.0,391
1,101,quarter,4,00c3e69d-d9b9-4ac3-bf79-19707fe43637,81,11:41,Moritz Wagner makes three point jump shot (Tristan da Silva assists),threepointmade,78,65569528-1888-40aa-9d62-2b0e8142a9b4,basketball_play,1772413421,100,True,2026-03-02 01:03:41+00:00,4,701.0,2179.0,36.31666666666667,392
1,100,quarter,4,65569528-1888-40aa-9d62-2b0e8142a9b4,81,11:15,Ronald Holland II misses three point jump shot,threepointmiss,78,,basketball_play,1772413446,99,True,2026-03-02 01:04:06+00:00,4,675.0,2205.0,36.75,393
1,99,quarter,4,00c3e69d-d9b9-4ac3-bf79-19707fe43637,81,11:12,Tristan da Silva defensive rebound,rebound,78,00c3e69d-d9b9-4ac3-bf79-19707fe43637,basketball_play,1772413449,98,True,2026-03-02 01:04:09+00:00,4,672.0,2208.0,36.8,394
1,98,quarter,4,65569528-1888-40aa-9d62-2b0e8142a9b4,81,11:05,Caris LeVert shooting foul (Desmond Bane draws the foul),shootingfoul,78,00c3e69d-d9b9-4ac3-bf79-19707fe43637,basketball_play,1772413458,97,True,2026-03-02 01:04:18+00:00,4,665.0,2215.0,36.916666666666664,395
1,97,quarter,4,00c3e69d-d9b9-4ac3-bf79-19707fe43637,81,11:05,Desmond Bane makes regular free throw 1 of 2,freethrowmade,79,00c3e69d-d9b9-4ac3-bf79-19707fe43637,basketball_play,1772413487,96,True,2026-03-02 01:04:47+00:00,4,665.0,2215.0,36.916666666666664,396
1,96,quarter,4,00c3e69d-d9b9-4ac3-bf79-19707fe43637,81,11:05,Desmond Bane makes regular free throw 2 of 2,freethrowmade,80,65569528-1888-40aa-9d62-2b0e8142a9b4,basketball_play,1772413503,95,True,2026-03-02 01:05:03+00:00,4,665.0,2215.0,36.916666666666664,397
1,95,quarter,4,65569528-1888-40aa-9d62-2b0e8142a9b4,81,10:53,Jalen Duren misses two point driving floating bank jump shot,twopointmiss,80,,basketball_play,1772413518,94,True,2026-03-02 01:05:18+00:00,4,653.0,2227.0,37.11666666666667,398
1,94,quarter,4,00c3e69d-d9b9-4ac3-bf79-19707fe43637,81,10:51,Tristan da Silva defensive rebound,rebound,80,00c3e69d-d9b9-4ac3-bf79-19707fe43637,basketball_play,1772413520,93,True,2026-03-02 01:05:20+00:00,4,651.0,2229.0,37.15,399
1,93,quarter,4,00c3e69d-d9b9-4ac3-bf79-19707fe43637,81,10:47,Jevon Carter misses three point running jump shot,threepointmiss,80,,basketball_play,1772413525,92,True,2026-03-02 01:05:25+00:00,4,647.0,2233.0,37.21666666666667,400
1,92,quarter,4,65569528-1888-40aa-9d62-2b0e8142a9b4,81,10:45,Jalen Duren defensive rebound,rebound,80,65569528-1888-40aa-9d62-2b0e8142a9b4,basketball_play,1772413527,91,True,2026-03-02 01:05:27+00:00,4,645.0,2235.0,37.25,401
1,91,quarter,4,65569528-1888-40aa-9d62-2b0e8142a9b4,83,10:31,Jalen Duren makes two point layup (Cade Cunningham assists),twopointmade,80,00c3e69d-d9b9-4ac3-bf79-19707fe43637,basketball_play,1772413540,90,True,2026-03-02 01:05:40+00:00,4,631.0,2249.0,37.483333333333334,402
1,90,quarter,4,00c3e69d-d9b9-4ac3-bf79-19707fe43637,83,10:12,Desmond Bane makes three point stepback jump shot,threepointmade,83,65569528-1888-40aa-9d62-2b0e8142a9b4,basketball_play,1772413557,89,True,2026-03-02 01:05:57+00:00,4,612.0,2268.0,37.8,403
1,89,quarter,4,65569528-1888-40aa-9d62-2b0e8142a9b4,85,9:58,Jalen Duren makes two point driving dunk (Caris LeVert assists),twopointmade,83,00c3e69d-d9b9-4ac3-bf79-19707fe43637,basketball_play,1772413572,88,True,2026-03-02 01:06:12+00:00,4,598.0,2282.0,38.03333333333333,404
1,88,quarter,4,00c3e69d-d9b9-4ac3-bf79-19707fe43637,85,9:41,Desmond Bane misses two point driving layup,twopointmiss,83,,basketball_play,1772413590,87,True,2026-03-02 01:06:30+00:00,4,581.0,2299.0,38.31666666666667,405
1,87,quarter,4,65569528-1888-40aa-9d62-2b0e8142a9b4,85,9:39,Jalen Duren defensive rebound,rebound,83,65569528-1888-40aa-9d62-2b0e8142a9b4,basketball_play,1772413592,86,True,2026-03-02 01:06:32+00:00,4,579.0,2301.0,38.35,406
1,86,quarter,4,65569528-1888-40aa-9d62-2b0e8142a9b4,87,9:33,Ronald Holland II makes two point driving layup (Javonte Green assists),twopointmade,83,00c3e69d-d9b9-4ac3-bf79-19707fe43637,basketball_play,1772413597,85,True,2026-03-02 01:06:37+00:00,4,573.0,2307.0,38.45,407
1,85,quarter,4,00c3e69d-d9b9-4ac3-bf79-19707fe43637,87,9:33,Magic 60 second timeout,teamtimeout,83,,basketball_play,1772413603,84,True,2026-03-02 01:06:43+00:00,4,573.0,2307.0,38.45,408
1,84,quarter,4,00c3e69d-d9b9-4ac3-bf79-19707fe43637,87,9:33,"Magic lineup change (Wendell Carter Jr., Jett Howard, Paolo Banchero, Desmond Bane, Jevon Carter)",lineupchange,83,,basketball_play,1772413704,83,True,2026-03-02 01:08:24+00:00,4,573.0,2307.0,38.45,409
1,83,quarter,4,00c3e69d-d9b9-4ac3-bf79-19707fe43637,87,9:19,Jett Howard misses three point jump shot,threepointmiss,83,,basketball_play,1772413792,82,True,2026-03-02 01:09:52+00:00,4,559.0,2321.0,38.68333333333333,410
1,82,quarter,4,65569528-1888-40aa-9d62-2b0e8142a9b4,87,9:15,Caris LeVert defensive rebound,rebound,83,65569528-1888-40aa-9d62-2b0e8142a9b4,basketball_play,1772413796,81,True,2026-03-02 01:09:56+00:00,4,555.0,2325.0,38.75,411
1,81,quarter,4,65569528-1888-40aa-9d62-2b0e8142a9b4,89,9:08,Cade Cunningham makes two point fadeaway jump shot,twopointmade,83,00c3e69d-d9b9-4ac3-bf79-19707fe43637,basketball_play,1772413802,80,True,2026-03-02 01:10:02+00:00,4,548.0,2332.0,38.86666666666667,412
1,80,quarter,4,00c3e69d-d9b9-4ac3-bf79-19707fe43637,89,8:55,Jevon Carter misses three point jump shot,threepointmiss,83,,basketball_play,1772413815,79,True,2026-03-02 01:10:15+00:00,4,535.0,2345.0,39.083333333333336,413
1,79,quarter,4,65569528-1888-40aa-9d62-2b0e8142a9b4,89,8:52,Jalen Duren defensive rebound,rebound,83,65569528-1888-40aa-9d62-2b0e8142a9b4,basketball_play,1772413818,78,True,2026-03-02 01:10:18+00:00,4,532.0,2348.0,39.13333333333333,414
1,78,quarter,4,65569528-1888-40aa-9d62-2b0e8142a9b4,91,8:47,Caris LeVert makes two point running pullup jump shot (Cade Cunningham assists),twopointmade,83,00c3e69d-d9b9-4ac3-bf79-19707fe43637,basketball_play,1772413824,77,True,2026-03-02 01:10:24+00:00,4,527.0,2353.0,39.21666666666667,415
1,77,quarter,4,00c3e69d-d9b9-4ac3-bf79-19707fe43637,91,8:32,Wendell Carter Jr. misses two point floating jump shot,twopointmiss,83,,basketball_play,1772413840,76,True,2026-03-02 01:10:40+00:00,4,512.0,2368.0,39.46666666666667,416
1,76,quarter,4,00c3e69d-d9b9-4ac3-bf79-19707fe43637,91,8:30,Wendell Carter Jr. offensive rebound,rebound,83,00c3e69d-d9b9-4ac3-bf79-19707fe43637,basketball_play,1772413842,75,True,2026-03-02 01:10:42+00:00,4,510.0,2370.0,39.5,417
1,75,quarter,4,00c3e69d-d9b9-4ac3-bf79-19707fe43637,91,8:27,Wendell Carter Jr. misses two point putback layup,twopointmiss,83,,basketball_play,1772413844,74,True,2026-03-02 01:10:44+00:00,4,507.0,2373.0,39.55,418
1,74,quarter,4,65569528-1888-40aa-9d62-2b0e8142a9b4,91,8:26,Javonte Green defensive rebound,rebound,83,65569528-1888-40aa-9d62-2b0e8142a9b4,basketball_play,1772413845,73,True,2026-03-02 01:10:45+00:00,4,506.0,2374.0,39.56666666666667,419
1,73,quarter,4,65569528-1888-40aa-9d62-2b0e8142a9b4,91,8:22,Caris LeVert misses three point running pullup jump shot,threepointmiss,83,,basketball_play,1772413849,72,True,2026-03-02 01:10:49+00:00,4,502.0,2378.0,39.63333333333333,420
1,72,quarter,4,00c3e69d-d9b9-4ac3-bf79-19707fe43637,91,8:18,Wendell Carter Jr. defensive rebound,rebound,83,00c3e69d-d9b9-4ac3-bf79-19707fe43637,basketball_play,1772413853,71,True,2026-03-02 01:10:53+00:00,4,498.0,2382.0,39.7,421
1,71,quarter,4,00c3e69d-d9b9-4ac3-bf79-19707fe43637,91,8:14,Paolo Banchero turnover (back court violation),turnover,83,65569528-1888-40aa-9d62-2b0e8142a9b4,basketball_play,1772413860,70,True,2026-03-02 01:11:00+00:00,4,494.0,2386.0,39.766666666666666,422
