period_index,event_index,period_type,period_number,attribution,away_points,clock,description,event_type,home_points,possession,type,wall_clock,pbp_source_row,has_wall_clock,event_ts_utc,period_sequence,game_clock_seconds_remaining,game_elapsed_seconds,game_elapsed_minutes,pbp_chronological_index
2,30,quarter,3,502c629b-4da7-40fd-92ab-20cb55411c35,84,2:17,"Warriors lineup change (Gui Santos, Stephen Curry, Brandin Podziemski, Gary Payton II, Kristaps Porzingis)",lineupchange,77,,basketball_play,1775447821,133,True,2026-04-06 03:57:01+00:00,3,137.0,2023.0,33.71666666666667,313
2,29,quarter,3,502c629b-4da7-40fd-92ab-20cb55411c35,84,2:17,Stephen Curry misses regular free throw 1 of 1,freethrowmiss,77,,basketball_play,1775447821,132,True,2026-04-06 03:57:01+00:00,3,137.0,2023.0,33.71666666666667,314
2,28,quarter,3,a8625e4b-4ae6-4062-a7c1-0b6e1f4ae211,84,2:15,Kevin Durant defensive rebound,rebound,77,a8625e4b-4ae6-4062-a7c1-0b6e1f4ae211,basketball_play,1775447823,131,True,2026-04-06 03:57:03+00:00,3,135.0,2025.0,33.75,315
2,27,quarter,3,a8625e4b-4ae6-4062-a7c1-0b6e1f4ae211,84,1:54,Alperen Sengun misses two point pullup jump shot,twopointmiss,77,,basketball_play,1775447843,130,True,2026-04-06 03:57:23+00:00,3,114.0,2046.0,34.1,316
2,26,quarter,3,502c629b-4da7-40fd-92ab-20cb55411c35,84,1:51,Brandin Podziemski defensive rebound,rebound,77,502c629b-4da7-40fd-92ab-20cb55411c35,basketball_play,1775447846,129,True,2026-04-06 03:57:26+00:00,3,111.0,2049.0,34.15,317
2,25,quarter,3,502c629b-4da7-40fd-92ab-20cb55411c35,84,1:43,Stephen Curry makes three point stepback jump shot,threepointmade,80,a8625e4b-4ae6-4062-a7c1-0b6e1f4ae211,basketball_play,1775447854,128,True,2026-04-06 03:57:34+00:00,3,103.0,2057.0,34.28333333333333,318
2,24,quarter,3,a8625e4b-4ae6-4062-a7c1-0b6e1f4ae211,86,1:20,Kevin Durant makes two point turnaround fadeaway jump shot (Aaron Holiday assists),twopointmade,80,502c629b-4da7-40fd-92ab-20cb55411c35,basketball_play,1775447877,127,True,2026-04-06 03:57:57+00:00,3,80.0,2080.0,34.666666666666664,319
2,23,quarter,3,a8625e4b-4ae6-4062-a7c1-0b6e1f4ae211,86,1:09,Kevin Durant personal foul (Stephen Curry draws the foul),personalfoul,80,502c629b-4da7-40fd-92ab-20cb55411c35,basketball_play,1775447890,126,True,2026-04-06 03:58:10+00:00,3,69.0,2091.0,34.85,320
2,22,quarter,3,502c629b-4da7-40fd-92ab-20cb55411c35,86,1:09,Stephen Curry makes regular free throw 1 of 2,freethrowmade,81,502c629b-4da7-40fd-92ab-20cb55411c35,basketball_play,1775447928,125,True,2026-04-06 03:58:48+00:00,3,69.0,2091.0,34.85,321
2,21,quarter,3,a8625e4b-4ae6-4062-a7c1-0b6e1f4ae211,86,1:09,"Rockets lineup change (Reed Sheppard, Kevin Durant, Alperen Sengun, Amen Thompson, Josh Okogie)",lineupchange,81,,basketball_play,1775447934,124,True,2026-04-06 03:58:54+00:00,3,69.0,2091.0,34.85,322
2,20,quarter,3,502c629b-4da7-40fd-92ab-20cb55411c35,86,1:09,"Warriors lineup change (Stephen Curry, Brandin Podziemski, Gary Payton II, Draymond Green, Kristaps Porzingis)",lineupchange,81,,basketball_play,1775447934,123,True,2026-04-06 03:58:54+00:00,3,69.0,2091.0,34.85,323
2,19,quarter,3,502c629b-4da7-40fd-92ab-20cb55411c35,86,1:09,Stephen Curry makes regular free throw 2 of 2,freethrowmade,82,a8625e4b-4ae6-4062-a7c1-0b6e1f4ae211,basketball_play,1775447956,122,True,2026-04-06 03:59:16+00:00,3,69.0,2091.0,34.85,324
2,18,quarter,3,a8625e4b-4ae6-4062-a7c1-0b6e1f4ae211,88,00:55.40,Amen Thompson makes two point cutting layup (Alperen Sengun assists),twopointmade,82,502c629b-4da7-40fd-92ab-20cb55411c35,basketball_play,1775447976,121,True,2026-04-06 03:59:36+00:00,3,55.4,2104.6,35.07666666666667,325
2,17,quarter,3,502c629b-4da7-40fd-92ab-20cb55411c35,88,00:55.40,Draymond Green shooting foul (Amen Thompson draws the foul),shootingfoul,82,a8625e4b-4ae6-4062-a7c1-0b6e1f4ae211,basketball_play,1775447982,120,True,2026-04-06 03:59:42+00:00,3,55.4,2104.6,35.07666666666667,326
2,16,quarter,3,a8625e4b-4ae6-4062-a7c1-0b6e1f4ae211,88,00:55.40,Amen Thompson misses regular free throw 1 of 1,freethrowmiss,82,,basketball_play,1775448012,119,True,2026-04-06 04:00:12+00:00,3,55.4,2104.6,35.07666666666667,327
2,15,quarter,3,502c629b-4da7-40fd-92ab-20cb55411c35,88,00:53.80,Kristaps Porzingis defensive rebound,rebound,82,502c629b-4da7-40fd-92ab-20cb55411c35,basketball_play,1775448013,118,True,2026-04-06 04:00:13+00:00,3,53.8,2106.2,35.10333333333333,328
2,14,quarter,3,502c629b-4da7-40fd-92ab-20cb55411c35,88,00:44.40,Brandin Podziemski turnover (out of bounds bad pass),turnover,82,a8625e4b-4ae6-4062-a7c1-0b6e1f4ae211,basketball_play,1775448024,117,True,2026-04-06 04:00:24+00:00,3,44.4,2115.6,35.26,329
2,13,quarter,3,502c629b-4da7-40fd-92ab-20cb55411c35,88,00:44,"Warriors lineup change (De'Anthony Melton, Brandin Podziemski, Gary Payton II, Draymond Green, Kristaps Porzingis)",lineupchange,82,,basketball_play,1775448063,116,True,2026-04-06 04:01:03+00:00,3,44.0,2116.0,35.266666666666666,330
2,12,quarter,3,a8625e4b-4ae6-4062-a7c1-0b6e1f4ae211,90,00:28.80,Amen Thompson makes two point dunk (Alperen Sengun assists),twopointmade,82,502c629b-4da7-40fd-92ab-20cb55411c35,basketball_play,1775448063,115,True,2026-04-06 04:01:03+00:00,3,28.8,2131.2,35.519999999999996,331
2,11,quarter,3,502c629b-4da7-40fd-92ab-20cb55411c35,90,00:10.40,Kevin Durant blocks Kristaps Porzingis's two point cutting layup,twopointmiss,82,,basketball_play,1775448083,114,True,2026-04-06 04:01:23+00:00,3,10.4,2149.6,35.82666666666667,332
2,10,quarter,3,502c629b-4da7-40fd-92ab-20cb55411c35,90,00:10.40,Warriors offensive rebound,rebound,82,502c629b-4da7-40fd-92ab-20cb55411c35,basketball_play,1775448083,113,True,2026-04-06 04:01:23+00:00,3,10.4,2149.6,35.82666666666667,333
2,9,quarter,3,,90,00:10.40,Stoppage (Out of bounds),stoppage,82,,basketball_play,1775448089,112,True,2026-04-06 04:01:29+00:00,3,10.4,2149.6,35.82666666666667,334
2,8,quarter,3,a8625e4b-4ae6-4062-a7c1-0b6e1f4ae211,90,00:10,"Rockets lineup change (Kevin Durant, Amen Thompson, Tari Eason, Josh Okogie, Jae'Sean Tate)",lineupchange,82,,basketball_play,1775448092,111,True,2026-04-06 04:01:32+00:00,3,10.0,2150.0,35.833333333333336,335
2,7,quarter,3,502c629b-4da7-40fd-92ab-20cb55411c35,90,00:06.50,Kevin Durant blocks Kristaps Porzingis's two point fadeaway jump shot,twopointmiss,82,,basketball_play,1775448115,110,True,2026-04-06 04:01:55+00:00,3,6.5,2153.5,35.891666666666666,336
2,6,quarter,3,a8625e4b-4ae6-4062-a7c1-0b6e1f4ae211,90,00:05.40,Kevin Durant defensive rebound,rebound,82,a8625e4b-4ae6-4062-a7c1-0b6e1f4ae211,basketball_play,1775448116,109,True,2026-04-06 04:01:56+00:00,3,5.4,2154.6,35.91,337
2,5,quarter,3,502c629b-4da7-40fd-92ab-20cb55411c35,90,00:05.40,Kristaps Porzingis personal foul (Kevin Durant draws the foul),personalfoul,82,a8625e4b-4ae6-4062-a7c1-0b6e1f4ae211,basketball_play,1775448121,108,True,2026-04-06 04:02:01+00:00,3,5.4,2154.6,35.91,338
2,4,quarter,3,a8625e4b-4ae6-4062-a7c1-0b6e1f4ae211,91,00:05.40,Kevin Durant makes regular free throw 1 of 2,freethrowmade,82,a8625e4b-4ae6-4062-a7c1-0b6e1f4ae211,basketball_play,1775448155,107,True,2026-04-06 04:02:35+00:00,3,5.4,2154.6,35.91,339
2,2,quarter,3,a8625e4b-4ae6-4062-a7c1-0b6e1f4ae211,92,00:05.40,Kevin Durant makes regular free throw 2 of 2,freethrowmade,82,502c629b-4da7-40fd-92ab-20cb55411c35,basketball_play,1775448185,105,True,2026-04-06 04:03:05+00:00,3,5.4,2154.6,35.91,340
2,3,quarter,3,502c629b-4da7-40fd-92ab-20cb55411c35,91,00:05,"Warriors lineup change (De'Anthony Melton, Stephen Curry, Brandin Podziemski, Draymond Green, Kristaps Porzingis)",lineupchange,82,,basketball_play,1775448185,106,True,2026-04-06 04:03:05+00:00,3,5.0,2155.0,35.916666666666664,341
2,1,quarter,3,,92,00:00,End of 3rd Quarter.,endperiod,82,,basketball_play,1775448202,104,True,2026-04-06 04:03:22+00:00,3,0.0,2160.0,36.0,342
1,104,quarter,4,a8625e4b-4ae6-4062-a7c1-0b6e1f4ae211,92,12:00,"Rockets lineup change (Alperen Sengun, Aaron Holiday, Amen Thompson, Josh Okogie, Jabari Smith Jr.)",lineupchange,82,,basketball_play,1775448346,103,True,2026-04-06 04:05:46+00:00,4,720.0,2160.0,36.0,343
1,103,quarter,4,502c629b-4da7-40fd-92ab-20cb55411c35,92,12:00,"Warriors lineup change (Gui Santos, Brandin Podziemski, Gary Payton II, Kristaps Porzingis, Pat Spencer)",lineupchange,82,,basketball_play,1775448346,102,True,2026-04-06 04:05:46+00:00,4,720.0,2160.0,36.0,344
1,102,quarter,4,,92,12:00,Start of 4th Quarter,startperiod,82,,basketball_play,1775448413,101,True,2026-04-06 04:06:53+00:00,4,720.0,2160.0,36.0,345
1,101,quarter,4,502c629b-4da7-40fd-92ab-20cb55411c35,92,11:43,Kristaps Porzingis misses three point jump shot,threepointmiss,82,,basketball_play,1775448430,100,True,2026-04-06 04:07:10+00:00,4,703.0,2177.0,36.28333333333333,346
1,100,quarter,4,502c629b-4da7-40fd-92ab-20cb55411c35,92,11:41,Warriors offensive rebound,rebound,82,502c629b-4da7-40fd-92ab-20cb55411c35,basketball_play,1775448433,99,True,2026-04-06 04:07:13+00:00,4,701.0,2179.0,36.31666666666667,347
1,99,quarter,4,,92,11:41,Stoppage (Out of bounds),stoppage,82,,basketball_play,1775448434,98,True,2026-04-06 04:07:14+00:00,4,701.0,2179.0,36.31666666666667,348
1,98,quarter,4,502c629b-4da7-40fd-92ab-20cb55411c35,92,11:35,Pat Spencer makes three point stepback jump shot,threepointmade,85,a8625e4b-4ae6-4062-a7c1-0b6e1f4ae211,basketball_play,1775448456,97,True,2026-04-06 04:07:36+00:00,4,695.0,2185.0,36.416666666666664,349
1,97,quarter,4,a8625e4b-4ae6-4062-a7c1-0b6e1f4ae211,92,11:17,Aaron Holiday misses three point jump shot,threepointmiss,85,,basketball_play,1775448473,96,True,2026-04-06 04:07:53+00:00,4,677.0,2203.0,36.71666666666667,350
1,96,quarter,4,502c629b-4da7-40fd-92ab-20cb55411c35,92,11:14,Kristaps Porzingis defensive rebound,rebound,85,502c629b-4da7-40fd-92ab-20cb55411c35,basketball_play,1775448476,95,True,2026-04-06 04:07:56+00:00,4,674.0,2206.0,36.766666666666666,351
1,95,quarter,4,502c629b-4da7-40fd-92ab-20cb55411c35,92,11:05,Pat Spencer misses three point pullup jump shot,threepointmiss,85,,basketball_play,1775448485,94,True,2026-04-06 04:08:05+00:00,4,665.0,2215.0,36.916666666666664,352
1,94,quarter,4,502c629b-4da7-40fd-92ab-20cb55411c35,92,11:01,Gary Payton II offensive rebound,rebound,85,502c629b-4da7-40fd-92ab-20cb55411c35,basketball_play,1775448489,93,True,2026-04-06 04:08:09+00:00,4,661.0,2219.0,36.983333333333334,353
1,93,quarter,4,502c629b-4da7-40fd-92ab-20cb55411c35,92,11:01,Gary Payton II makes two point putback layup,twopointmade,87,a8625e4b-4ae6-4062-a7c1-0b6e1f4ae211,basketball_play,1775448490,92,True,2026-04-06 04:08:10+00:00,4,661.0,2219.0,36.983333333333334,354
1,92,quarter,4,a8625e4b-4ae6-4062-a7c1-0b6e1f4ae211,94,10:42,Jabari Smith Jr. makes two point fadeaway jump shot (Alperen Sengun assists),twopointmade,87,502c629b-4da7-40fd-92ab-20cb55411c35,basketball_play,1775448508,91,True,2026-04-06 04:08:28+00:00,4,642.0,2238.0,37.3,355
1,91,quarter,4,502c629b-4da7-40fd-92ab-20cb55411c35,94,10:23,Pat Spencer misses two point pullup bank jump shot,twopointmiss,87,,basketball_play,1775448528,90,True,2026-04-06 04:08:48+00:00,4,623.0,2257.0,37.61666666666667,356
1,90,quarter,4,a8625e4b-4ae6-4062-a7c1-0b6e1f4ae211,94,10:20,Alperen Sengun defensive rebound,rebound,87,a8625e4b-4ae6-4062-a7c1-0b6e1f4ae211,basketball_play,1775448531,89,True,2026-04-06 04:08:51+00:00,4,620.0,2260.0,37.666666666666664,357
1,89,quarter,4,502c629b-4da7-40fd-92ab-20cb55411c35,94,10:13,Kristaps Porzingis shooting foul (Alperen Sengun draws the foul),shootingfoul,87,a8625e4b-4ae6-4062-a7c1-0b6e1f4ae211,basketball_play,1775448540,88,True,2026-04-06 04:09:00+00:00,4,613.0,2267.0,37.78333333333333,358
1,88,quarter,4,502c629b-4da7-40fd-92ab-20cb55411c35,94,10:13,"Warriors lineup change (Gui Santos, Brandin Podziemski, Gary Payton II, Charles Bassey, Pat Spencer)",lineupchange,87,,basketball_play,1775448585,87,True,2026-04-06 04:09:45+00:00,4,613.0,2267.0,37.78333333333333,359
1,87,quarter,4,a8625e4b-4ae6-4062-a7c1-0b6e1f4ae211,95,10:13,Alperen Sengun makes regular free throw 1 of 2,freethrowmade,87,a8625e4b-4ae6-4062-a7c1-0b6e1f4ae211,basketball_play,1775448585,86,True,2026-04-06 04:09:45+00:00,4,613.0,2267.0,37.78333333333333,360
1,86,quarter,4,a8625e4b-4ae6-4062-a7c1-0b6e1f4ae211,95,10:13,"Rockets lineup change (Reed Sheppard, Alperen Sengun, Aaron Holiday, Josh Okogie, Jabari Smith Jr.)",lineupchange,87,,basketball_play,1775448601,85,True,2026-04-06 04:10:01+00:00,4,613.0,2267.0,37.78333333333333,361
1,85,quarter,4,a8625e4b-4ae6-4062-a7c1-0b6e1f4ae211,96,10:13,Alperen Sengun makes regular free throw 2 of 2,freethrowmade,87,502c629b-4da7-40fd-92ab-20cb55411c35,basketball_play,1775448605,84,True,2026-04-06 04:10:05+00:00,4,613.0,2267.0,37.78333333333333,362
1,84,quarter,4,502c629b-4da7-40fd-92ab-20cb55411c35,96,9:50,Gui Santos misses three point jump shot,threepointmiss,87,,basketball_play,1775448629,83,True,2026-04-06 04:10:29+00:00,4,590.0,2290.0,38.166666666666664,363
1,83,quarter,4,502c629b-4da7-40fd-92ab-20cb55411c35,96,9:45,Gary Payton II offensive rebound,rebound,87,502c629b-4da7-40fd-92ab-20cb55411c35,basketball_play,1775448634,82,True,2026-04-06 04:10:34+00:00,4,585.0,2295.0,38.25,364
1,82,quarter,4,502c629b-4da7-40fd-92ab-20cb55411c35,96,9:43,Gary Payton II misses three point jump shot,threepointmiss,87,,basketball_play,1775448635,81,True,2026-04-06 04:10:35+00:00,4,583.0,2297.0,38.28333333333333,365
1,81,quarter,4,a8625e4b-4ae6-4062-a7c1-0b6e1f4ae211,96,9:43,Jabari Smith Jr. defensive rebound,rebound,87,a8625e4b-4ae6-4062-a7c1-0b6e1f4ae211,basketball_play,1775448635,80,True,2026-04-06 04:10:35+00:00,4,583.0,2297.0,38.28333333333333,366
1,80,quarter,4,502c629b-4da7-40fd-92ab-20cb55411c35,96,9:25,Warriors technical foul (Defensive three second),technicalfoulnonunsportsmanlike,87,a8625e4b-4ae6-4062-a7c1-0b6e1f4ae211,basketball_play,1775448658,79,True,2026-04-06 04:10:58+00:00,4,565.0,2315.0,38.583333333333336,367
1,79,quarter,4,a8625e4b-4ae6-4062-a7c1-0b6e1f4ae211,97,9:25,Reed Sheppard makes technical free throw 1 of 1,freethrowmade,87,,basketball_play,1775448676,78,True,2026-04-06 04:11:16+00:00,4,565.0,2315.0,38.583333333333336,368
1,78,quarter,4,502c629b-4da7-40fd-92ab-20cb55411c35,97,9:25,"Warriors lineup change (Gui Santos, Brandin Podziemski, Charles Bassey, Seth Curry, Pat Spencer)",lineupchange,87,,basketball_play,1775448701,77,True,2026-04-06 04:11:41+00:00,4,565.0,2315.0,38.583333333333336,369
1,77,quarter,4,a8625e4b-4ae6-4062-a7c1-0b6e1f4ae211,97,9:17,Charles Bassey blocks Alperen Sengun's two point turnaround hook shot,twopointmiss,87,,basketball_play,1775448701,76,True,2026-04-06 04:11:41+00:00,4,557.0,2323.0,38.71666666666667,370
1,76,quarter,4,a8625e4b-4ae6-4062-a7c1-0b6e1f4ae211,97,9:16,Alperen Sengun offensive rebound,rebound,87,a8625e4b-4ae6-4062-a7c1-0b6e1f4ae211,basketball_play,1775448702,75,True,2026-04-06 04:11:42+00:00,4,556.0,2324.0,38.733333333333334,371
1,75,quarter,4,a8625e4b-4ae6-4062-a7c1-0b6e1f4ae211,97,9:15,Charles Bassey blocks Alperen Sengun's two point turnaround hook shot,twopointmiss,87,,basketball_play,1775448705,74,True,2026-04-06 04:11:45+00:00,4,555.0,2325.0,38.75,372
1,74,quarter,4,a8625e4b-4ae6-4062-a7c1-0b6e1f4ae211,97,9:14,Aaron Holiday offensive rebound,rebound,87,a8625e4b-4ae6-4062-a7c1-0b6e1f4ae211,basketball_play,1775448706,73,True,2026-04-06 04:11:46+00:00,4,554.0,2326.0,38.766666666666666,373
1,73,quarter,4,502c629b-4da7-40fd-92ab-20cb55411c35,97,9:12,Charles Bassey shooting foul (Josh Okogie draws the foul),shootingfoul,87,a8625e4b-4ae6-4062-a7c1-0b6e1f4ae211,basketball_play,1775448714,72,True,2026-04-06 04:11:54+00:00,4,552.0,2328.0,38.8,374
1,72,quarter,4,a8625e4b-4ae6-4062-a7c1-0b6e1f4ae211,98,9:12,Josh Okogie makes regular free throw 1 of 2,freethrowmade,87,a8625e4b-4ae6-4062-a7c1-0b6e1f4ae211,basketball_play,1775448736,71,True,2026-04-06 04:12:16+00:00,4,552.0,2328.0,38.8,375
1,71,quarter,4,502c629b-4da7-40fd-92ab-20cb55411c35,98,9:12,Warriors 60 second timeout,teamtimeout,87,,basketball_play,1775448741,70,True,2026-04-06 04:12:21+00:00,4,552.0,2328.0,38.8,376
1,70,quarter,4,a8625e4b-4ae6-4062-a7c1-0b6e1f4ae211,99,9:12,Josh Okogie makes regular free throw 2 of 2,freethrowmade,87,502c629b-4da7-40fd-92ab-20cb55411c35,basketball_play,1775448951,69,True,2026-04-06 04:15:51+00:00,4,552.0,2328.0,38.8,377
1,69,quarter,4,502c629b-4da7-40fd-92ab-20cb55411c35,99,8:55,Gui Santos misses three point jump shot,threepointmiss,87,,basketball_play,1775448969,68,True,2026-04-06 04:16:09+00:00,4,535.0,2345.0,39.083333333333336,378
1,68,quarter,4,a8625e4b-4ae6-4062-a7c1-0b6e1f4ae211,99,8:52,Josh Okogie defensive rebound,rebound,87,a8625e4b-4ae6-4062-a7c1-0b6e1f4ae211,basketball_play,1775448972,67,True,2026-04-06 04:16:12+00:00,4,532.0,2348.0,39.13333333333333,379
1,67,quarter,4,a8625e4b-4ae6-4062-a7c1-0b6e1f4ae211,99,8:38,Reed Sheppard misses two point driving layup,twopointmiss,87,,basketball_play,1775448986,66,True,2026-04-06 04:16:26+00:00,4,518.0,2362.0,39.36666666666667,380
1,66,quarter,4,502c629b-4da7-40fd-92ab-20cb55411c35,99,8:37,Charles Bassey defensive rebound,rebound,87,502c629b-4da7-40fd-92ab-20cb55411c35,basketball_play,1775448987,65,True,2026-04-06 04:16:27+00:00,4,517.0,2363.0,39.38333333333333,381
1,65,quarter,4,502c629b-4da7-40fd-92ab-20cb55411c35,99,8:31,Pat Spencer makes two point driving layup (Brandin Podziemski assists),twopointmade,89,a8625e4b-4ae6-4062-a7c1-0b6e1f4ae211,basketball_play,1775448994,64,True,2026-04-06 04:16:34+00:00,4,511.0,2369.0,39.483333333333334,382
1,64,quarter,4,a8625e4b-4ae6-4062-a7c1-0b6e1f4ae211,102,8:15,Reed Sheppard makes three point pullup jump shot,threepointmade,89,502c629b-4da7-40fd-92ab-20cb55411c35,basketball_play,1775449009,63,True,2026-04-06 04:16:49+00:00,4,495.0,2385.0,39.75,383
1,63,quarter,4,502c629b-4da7-40fd-92ab-20cb55411c35,102,8:05,Brandin Podziemski makes three point stepback jump shot (Pat Spencer assists),threepointmade,92,a8625e4b-4ae6-4062-a7c1-0b6e1f4ae211,basketball_play,1775449020,62,True,2026-04-06 04:17:00+00:00,4,485.0,2395.0,39.916666666666664,384
1,62,quarter,4,502c629b-4da7-40fd-92ab-20cb55411c35,102,7:51,Charles Bassey kicked ball violation,kickball,92,a8625e4b-4ae6-4062-a7c1-0b6e1f4ae211,basketball_play,1775449035,61,True,2026-04-06 04:17:15+00:00,4,471.0,2409.0,40.15,385
1,61,quarter,4,a8625e4b-4ae6-4062-a7c1-0b6e1f4ae211,104,7:46,Jabari Smith Jr. makes two point driving dunk (Aaron Holiday assists),twopointmade,92,502c629b-4da7-40fd-92ab-20cb55411c35,basketball_play,1775449054,60,True,2026-04-06 04:17:34+00:00,4,466.0,2414.0,40.233333333333334,386
1,60,quarter,4,502c629b-4da7-40fd-92ab-20cb55411c35,104,7:34,Alperen Sengun blocks Gui Santos's two point floating jump shot,twopointmiss,92,,basketball_play,1775449066,59,True,2026-04-06 04:17:46+00:00,4,454.0,2426.0,40.43333333333333,387
1,59,quarter,4,a8625e4b-4ae6-4062-a7c1-0b6e1f4ae211,104,7:34,Jabari Smith Jr. defensive rebound,rebound,92,a8625e4b-4ae6-4062-a7c1-0b6e1f4ae211,basketball_play,1775449066,58,True,2026-04-06 04:17:46+00:00,4,454.0,2426.0,40.43333333333333,388
1,58,quarter,4,a8625e4b-4ae6-4062-a7c1-0b6e1f4ae211,106,7:21,Reed Sheppard makes two point driving bank hook shot,twopointmade,92,502c629b-4da7-40fd-92ab-20cb55411c35,basketball_play,1775449079,57,True,2026-04-06 04:17:59+00:00,4,441.0,2439.0,40.65,389
1,57,quarter,4,a8625e4b-4ae6-4062-a7c1-0b6e1f4ae211,106,6:56,Aaron Holiday shooting foul (Pat Spencer draws the foul),shootingfoul,92,502c629b-4da7-40fd-92ab-20cb55411c35,basketball_play,1775449107,56,True,2026-04-06 04:18:27+00:00,4,416.0,2464.0,41.06666666666667,390
1,56,quarter,4,502c629b-4da7-40fd-92ab-20cb55411c35,106,6:56,Pat Spencer makes regular free throw 1 of 2,freethrowmade,93,502c629b-4da7-40fd-92ab-20cb55411c35,basketball_play,1775449133,55,True,2026-04-06 04:18:53+00:00,4,416.0,2464.0,41.06666666666667,391
1,55,quarter,4,a8625e4b-4ae6-4062-a7c1-0b6e1f4ae211,106,6:56,"Rockets lineup change (Reed Sheppard, Kevin Durant, Alperen Sengun, Amen Thompson, Jabari Smith Jr.)",lineupchange,93,,basketball_play,1775449134,54,True,2026-04-06 04:18:54+00:00,4,416.0,2464.0,41.06666666666667,392
1,54,quarter,4,502c629b-4da7-40fd-92ab-20cb55411c35,106,6:56,"Warriors lineup change (De'Anthony Melton, Stephen Curry, Charles Bassey, Draymond Green, Pat Spencer)",lineupchange,93,,basketball_play,1775449134,53,True,2026-04-06 04:18:54+00:00,4,416.0,2464.0,41.06666666666667,393
1,53,quarter,4,502c629b-4da7-40fd-92ab-20cb55411c35,106,6:56,Pat Spencer makes regular free throw 2 of 2,freethrowmade,94,a8625e4b-4ae6-4062-a7c1-0b6e1f4ae211,basketball_play,1775449166,52,True,2026-04-06 04:19:26+00:00,4,416.0,2464.0,41.06666666666667,394
1,52,quarter,4,a8625e4b-4ae6-4062-a7c1-0b6e1f4ae211,106,6:41,Amen Thompson misses two point alley-oop layup,twopointmiss,94,,basketball_play,1775449177,51,True,2026-04-06 04:19:37+00:00,4,401.0,2479.0,41.31666666666667,395
1,51,quarter,4,502c629b-4da7-40fd-92ab-20cb55411c35,106,6:38,Stephen Curry defensive rebound,rebound,94,502c629b-4da7-40fd-92ab-20cb55411c35,basketball_play,1775449180,50,True,2026-04-06 04:19:40+00:00,4,398.0,2482.0,41.36666666666667,396
1,50,quarter,4,502c629b-4da7-40fd-92ab-20cb55411c35,106,6:31,Draymond Green makes two point cutting layup (Charles Bassey assists),twopointmade,96,a8625e4b-4ae6-4062-a7c1-0b6e1f4ae211,basketball_play,1775449188,49,True,2026-04-06 04:19:48+00:00,4,391.0,2489.0,41.483333333333334,397
1,49,quarter,4,a8625e4b-4ae6-4062-a7c1-0b6e1f4ae211,106,6:12,Alperen Sengun misses three point pullup jump shot,threepointmiss,96,,basketball_play,1775449206,48,True,2026-04-06 04:20:06+00:00,4,372.0,2508.0,41.8,398
1,48,quarter,4,502c629b-4da7-40fd-92ab-20cb55411c35,106,6:09,Charles Bassey defensive rebound,rebound,96,502c629b-4da7-40fd-92ab-20cb55411c35,basketball_play,1775449209,47,True,2026-04-06 04:20:09+00:00,4,369.0,2511.0,41.85,399
1,47,quarter,4,502c629b-4da7-40fd-92ab-20cb55411c35,106,6:03,De'Anthony Melton makes three point jump shot (Pat Spencer assists),threepointmade,99,a8625e4b-4ae6-4062-a7c1-0b6e1f4ae211,basketball_play,1775449215,46,True,2026-04-06 04:20:15+00:00,4,363.0,2517.0,41.95,400
1,46,quarter,4,a8625e4b-4ae6-4062-a7c1-0b6e1f4ae211,106,6:02,Rockets 60 second timeout,teamtimeout,99,,basketball_play,1775449224,45,True,2026-04-06 04:20:24+00:00,4,362.0,2518.0,41.96666666666667,401
1,45,quarter,4,a8625e4b-4ae6-4062-a7c1-0b6e1f4ae211,106,6:02,"Rockets lineup change (Reed Sheppard, Kevin Durant, Amen Thompson, Jae'Sean Tate, Jabari Smith Jr.)",lineupchange,99,,basketball_play,1775449390,44,True,2026-04-06 04:23:10+00:00,4,362.0,2518.0,41.96666666666667,402
1,44,quarter,4,502c629b-4da7-40fd-92ab-20cb55411c35,106,6:02,"Warriors lineup change (De'Anthony Melton, Stephen Curry, Gary Payton II, Draymond Green, Pat Spencer)",lineupchange,99,,basketball_play,1775449390,43,True,2026-04-06 04:23:10+00:00,4,362.0,2518.0,41.96666666666667,403
1,43,quarter,4,502c629b-4da7-40fd-92ab-20cb55411c35,106,5:51,Stephen Curry personal foul (Jae'Sean Tate draws the foul),personalfoul,99,a8625e4b-4ae6-4062-a7c1-0b6e1f4ae211,basketball_play,1775449471,42,True,2026-04-06 04:24:31+00:00,4,351.0,2529.0,42.15,404
1,42,quarter,4,a8625e4b-4ae6-4062-a7c1-0b6e1f4ae211,106,5:38,Amen Thompson turnover (out of bounds bad pass),turnover,99,502c629b-4da7-40fd-92ab-20cb55411c35,basketball_play,1775449504,41,True,2026-04-06 04:25:04+00:00,4,338.0,2542.0,42.36666666666667,405
1,41,quarter,4,502c629b-4da7-40fd-92ab-20cb55411c35,106,5:13,Gary Payton II misses three point stepback jump shot,threepointmiss,99,,basketball_play,1775449533,40,True,2026-04-06 04:25:33+00:00,4,313.0,2567.0,42.78333333333333,406
1,40,quarter,4,a8625e4b-4ae6-4062-a7c1-0b6e1f4ae211,106,5:10,Rockets defensive rebound,rebound,99,a8625e4b-4ae6-4062-a7c1-0b6e1f4ae211,basketball_play,1775449536,39,True,2026-04-06 04:25:36+00:00,4,310.0,2570.0,42.833333333333336,407
1,39,quarter,4,,106,5:10,Stoppage (Out of bounds),stoppage,99,,basketball_play,1775449539,38,True,2026-04-06 04:25:39+00:00,4,310.0,2570.0,42.833333333333336,408
1,38,quarter,4,a8625e4b-4ae6-4062-a7c1-0b6e1f4ae211,108,4:51,Amen Thompson makes two point cutting dunk (Kevin Durant assists),twopointmade,99,502c629b-4da7-40fd-92ab-20cb55411c35,basketball_play,1775449566,37,True,2026-04-06 04:26:06+00:00,4,291.0,2589.0,43.15,409
1,37,quarter,4,a8625e4b-4ae6-4062-a7c1-0b6e1f4ae211,108,4:51,"Rockets lineup change (Kevin Durant, Alperen Sengun, Amen Thompson, Jae'Sean Tate, Jabari Smith Jr.)",lineupchange,99,,basketball_play,1775449573,36,True,2026-04-06 04:26:13+00:00,4,291.0,2589.0,43.15,410
1,36,quarter,4,502c629b-4da7-40fd-92ab-20cb55411c35,108,4:51,Gary Payton II shooting foul (Amen Thompson draws the foul),shootingfoul,99,a8625e4b-4ae6-4062-a7c1-0b6e1f4ae211,basketball_play,1775449573,35,True,2026-04-06 04:26:13+00:00,4,291.0,2589.0,43.15,411
1,35,quarter,4,a8625e4b-4ae6-4062-a7c1-0b6e1f4ae211,109,4:51,Amen Thompson makes regular free throw 1 of 1,freethrowmade,99,,basketball_play,1775449600,34,True,2026-04-06 04:26:40+00:00,4,291.0,2589.0,43.15,412
1,34,quarter,4,502c629b-4da7-40fd-92ab-20cb55411c35,109,4:39,Gary Payton II makes two point driving layup (Stephen Curry assists),twopointmade,101,a8625e4b-4ae6-4062-a7c1-0b6e1f4ae211,basketball_play,1775449614,33,True,2026-04-06 04:26:54+00:00,4,279.0,2601.0,43.35,413
1,33,quarter,4,,109,4:22,Stoppage (Out of bounds),stoppage,101,,basketball_play,1775449634,32,True,2026-04-06 04:27:14+00:00,4,262.0,2618.0,43.63333333333333,414
1,32,quarter,4,,109,4:17,Stoppage (Out of bounds),stoppage,101,,basketball_play,1775449650,31,True,2026-04-06 04:27:30+00:00,4,257.0,2623.0,43.71666666666667,415
1,31,quarter,4,a8625e4b-4ae6-4062-a7c1-0b6e1f4ae211,109,4:15,Kevin Durant misses two point jump shot,twopointmiss,101,,basketball_play,1775449663,30,True,2026-04-06 04:27:43+00:00,4,255.0,2625.0,43.75,416
1,30,quarter,4,502c629b-4da7-40fd-92ab-20cb55411c35,109,4:11,Draymond Green defensive rebound,rebound,101,502c629b-4da7-40fd-92ab-20cb55411c35,basketball_play,1775449667,29,True,2026-04-06 04:27:47+00:00,4,251.0,2629.0,43.81666666666667,417
