period_index,event_index,period_type,period_number,attribution,away_points,clock,description,event_type,home_points,possession,type,wall_clock,pbp_source_row,has_wall_clock,event_ts_utc,period_sequence,game_clock_seconds_remaining,game_elapsed_seconds,game_elapsed_minutes,pbp_chronological_index
4,97,quarter,1,a8625e4b-4ae6-4062-a7c1-0b6e1f4ae211,0,12:00,"Rockets lineup change (Reed Sheppard, Kevin Durant, Alperen Sengun, Amen Thompson, Jabari Smith Jr.)",lineupchange,0,,basketball_play,1775441644,445,True,2026-04-06 02:14:04+00:00,1,720.0,0.0,0.0,1
4,96,quarter,1,502c629b-4da7-40fd-92ab-20cb55411c35,0,12:00,"Warriors lineup change (De'Anthony Melton, Gui Santos, Brandin Podziemski, Draymond Green, Kristaps Porzingis)",lineupchange,0,,basketball_play,1775441644,444,True,2026-04-06 02:14:04+00:00,1,720.0,0.0,0.0,2
4,95,quarter,1,,0,12:00,Start of 1st Quarter,startperiod,0,,basketball_play,1775441644,443,True,2026-04-06 02:14:04+00:00,1,720.0,0.0,0.0,3
4,94,quarter,1,502c629b-4da7-40fd-92ab-20cb55411c35,0,12:00,Alperen Sengun vs. Kristaps Porzingis (Draymond Green gains possession),opentip,0,502c629b-4da7-40fd-92ab-20cb55411c35,basketball_play,1775441647,442,True,2026-04-06 02:14:07+00:00,1,720.0,0.0,0.0,4
4,93,quarter,1,502c629b-4da7-40fd-92ab-20cb55411c35,0,11:46,Brandin Podziemski makes two point cutting layup (Draymond Green assists),twopointmade,2,a8625e4b-4ae6-4062-a7c1-0b6e1f4ae211,basketball_play,1775441657,441,True,2026-04-06 02:14:17+00:00,1,706.0,14.0,0.23333333333333334,5
4,92,quarter,1,a8625e4b-4ae6-4062-a7c1-0b6e1f4ae211,0,11:19,Alperen Sengun misses two point driving finger roll layup,twopointmiss,2,,basketball_play,1775441684,440,True,2026-04-06 02:14:44+00:00,1,679.0,41.0,0.6833333333333333,6
4,91,quarter,1,502c629b-4da7-40fd-92ab-20cb55411c35,0,11:16,Gui Santos defensive rebound,rebound,2,502c629b-4da7-40fd-92ab-20cb55411c35,basketball_play,1775441687,439,True,2026-04-06 02:14:47+00:00,1,676.0,44.0,0.7333333333333333,7
4,90,quarter,1,502c629b-4da7-40fd-92ab-20cb55411c35,0,10:59,Gui Santos makes two point reverse layup (De'Anthony Melton assists),twopointmade,4,a8625e4b-4ae6-4062-a7c1-0b6e1f4ae211,basketball_play,1775441705,438,True,2026-04-06 02:15:05+00:00,1,659.0,61.0,1.0166666666666666,8
4,89,quarter,1,a8625e4b-4ae6-4062-a7c1-0b6e1f4ae211,0,10:38,Reed Sheppard misses two point fadeaway jump shot,twopointmiss,4,,basketball_play,1775441725,437,True,2026-04-06 02:15:25+00:00,1,638.0,82.0,1.3666666666666667,9
4,88,quarter,1,502c629b-4da7-40fd-92ab-20cb55411c35,0,10:36,Brandin Podziemski defensive rebound,rebound,4,502c629b-4da7-40fd-92ab-20cb55411c35,basketball_play,1775441727,436,True,2026-04-06 02:15:27+00:00,1,636.0,84.0,1.4,10
4,87,quarter,1,502c629b-4da7-40fd-92ab-20cb55411c35,0,10:27,Draymond Green makes three point jump shot (Brandin Podziemski assists),threepointmade,7,a8625e4b-4ae6-4062-a7c1-0b6e1f4ae211,basketball_play,1775441737,435,True,2026-04-06 02:15:37+00:00,1,627.0,93.0,1.55,11
4,86,quarter,1,a8625e4b-4ae6-4062-a7c1-0b6e1f4ae211,2,10:14,Jabari Smith Jr. makes two point turnaround fadeaway jump shot,twopointmade,7,502c629b-4da7-40fd-92ab-20cb55411c35,basketball_play,1775441749,434,True,2026-04-06 02:15:49+00:00,1,614.0,106.0,1.7666666666666666,12
4,85,quarter,1,502c629b-4da7-40fd-92ab-20cb55411c35,2,10:03,Brandin Podziemski turnover (lost ball) (Reed Sheppard steals),turnover,7,a8625e4b-4ae6-4062-a7c1-0b6e1f4ae211,basketball_play,1775441761,433,True,2026-04-06 02:16:01+00:00,1,603.0,117.0,1.95,13
4,84,quarter,1,a8625e4b-4ae6-4062-a7c1-0b6e1f4ae211,4,9:58,Kevin Durant makes two point running dunk,twopointmade,7,502c629b-4da7-40fd-92ab-20cb55411c35,basketball_play,1775441766,432,True,2026-04-06 02:16:06+00:00,1,598.0,122.0,2.033333333333333,14
4,83,quarter,1,502c629b-4da7-40fd-92ab-20cb55411c35,4,9:45,Kristaps Porzingis misses three point jump shot,threepointmiss,7,,basketball_play,1775441778,431,True,2026-04-06 02:16:18+00:00,1,585.0,135.0,2.25,15
4,82,quarter,1,a8625e4b-4ae6-4062-a7c1-0b6e1f4ae211,4,9:43,Amen Thompson defensive rebound,rebound,7,a8625e4b-4ae6-4062-a7c1-0b6e1f4ae211,basketball_play,1775441781,430,True,2026-04-06 02:16:21+00:00,1,583.0,137.0,2.283333333333333,16
4,81,quarter,1,a8625e4b-4ae6-4062-a7c1-0b6e1f4ae211,6,9:31,Amen Thompson makes two point alley-oop layup (Reed Sheppard assists),twopointmade,7,502c629b-4da7-40fd-92ab-20cb55411c35,basketball_play,1775441792,429,True,2026-04-06 02:16:32+00:00,1,571.0,149.0,2.4833333333333334,17
4,80,quarter,1,502c629b-4da7-40fd-92ab-20cb55411c35,6,9:14,Gui Santos makes three point jump shot (De'Anthony Melton assists),threepointmade,10,a8625e4b-4ae6-4062-a7c1-0b6e1f4ae211,basketball_play,1775441809,428,True,2026-04-06 02:16:49+00:00,1,554.0,166.0,2.7666666666666666,18
4,79,quarter,1,a8625e4b-4ae6-4062-a7c1-0b6e1f4ae211,6,9:00,Jabari Smith Jr. turnover (bad pass) (Gui Santos steals),turnover,10,502c629b-4da7-40fd-92ab-20cb55411c35,basketball_play,1775441824,427,True,2026-04-06 02:17:04+00:00,1,540.0,180.0,3.0,19
4,78,quarter,1,502c629b-4da7-40fd-92ab-20cb55411c35,6,8:52,Brandin Podziemski misses three point jump shot,threepointmiss,10,,basketball_play,1775441831,426,True,2026-04-06 02:17:11+00:00,1,532.0,188.0,3.1333333333333333,20
4,77,quarter,1,502c629b-4da7-40fd-92ab-20cb55411c35,6,8:48,Kristaps Porzingis offensive rebound,rebound,10,502c629b-4da7-40fd-92ab-20cb55411c35,basketball_play,1775441836,425,True,2026-04-06 02:17:16+00:00,1,528.0,192.0,3.2,21
4,76,quarter,1,502c629b-4da7-40fd-92ab-20cb55411c35,6,8:41,Gui Santos makes three point jump shot (Kristaps Porzingis assists),threepointmade,13,a8625e4b-4ae6-4062-a7c1-0b6e1f4ae211,basketball_play,1775441843,424,True,2026-04-06 02:17:23+00:00,1,521.0,199.0,3.316666666666667,22
4,75,quarter,1,a8625e4b-4ae6-4062-a7c1-0b6e1f4ae211,6,8:38,Rockets 60 second timeout,teamtimeout,13,,basketball_play,1775441849,423,True,2026-04-06 02:17:29+00:00,1,518.0,202.0,3.3666666666666667,23
4,74,quarter,1,502c629b-4da7-40fd-92ab-20cb55411c35,6,8:38,"Warriors lineup change (De'Anthony Melton, Gary Payton II, Draymond Green, Kristaps Porzingis, Seth Curry)",lineupchange,13,,basketball_play,1775442023,422,True,2026-04-06 02:20:23+00:00,1,518.0,202.0,3.3666666666666667,24
4,73,quarter,1,a8625e4b-4ae6-4062-a7c1-0b6e1f4ae211,9,8:25,Reed Sheppard makes three point jump shot (Amen Thompson assists),threepointmade,13,502c629b-4da7-40fd-92ab-20cb55411c35,basketball_play,1775442077,421,True,2026-04-06 02:21:17+00:00,1,505.0,215.0,3.5833333333333335,25
4,72,quarter,1,502c629b-4da7-40fd-92ab-20cb55411c35,9,8:02,Seth Curry makes three point jump shot (De'Anthony Melton assists),threepointmade,16,a8625e4b-4ae6-4062-a7c1-0b6e1f4ae211,basketball_play,1775442099,420,True,2026-04-06 02:21:39+00:00,1,482.0,238.0,3.966666666666667,26
4,71,quarter,1,a8625e4b-4ae6-4062-a7c1-0b6e1f4ae211,11,7:42,Amen Thompson makes two point alley-oop dunk (Alperen Sengun assists),twopointmade,16,502c629b-4da7-40fd-92ab-20cb55411c35,basketball_play,1775442120,419,True,2026-04-06 02:22:00+00:00,1,462.0,258.0,4.3,27
4,70,quarter,1,a8625e4b-4ae6-4062-a7c1-0b6e1f4ae211,11,7:28,Jabari Smith Jr. personal foul (Draymond Green draws the foul),personalfoul,16,502c629b-4da7-40fd-92ab-20cb55411c35,basketball_play,1775442137,418,True,2026-04-06 02:22:17+00:00,1,448.0,272.0,4.533333333333333,28
4,69,quarter,1,502c629b-4da7-40fd-92ab-20cb55411c35,11,7:28,"Warriors lineup change (Gui Santos, Gary Payton II, Draymond Green, Will Richard, Seth Curry)",lineupchange,16,,basketball_play,1775442147,417,True,2026-04-06 02:22:27+00:00,1,448.0,272.0,4.533333333333333,29
4,68,quarter,1,502c629b-4da7-40fd-92ab-20cb55411c35,11,7:17,Gary Payton II makes two point driving floating jump shot,twopointmade,18,a8625e4b-4ae6-4062-a7c1-0b6e1f4ae211,basketball_play,1775442176,416,True,2026-04-06 02:22:56+00:00,1,437.0,283.0,4.716666666666667,30
4,67,quarter,1,a8625e4b-4ae6-4062-a7c1-0b6e1f4ae211,13,7:04,Alperen Sengun makes two point cutting dunk (Amen Thompson assists),twopointmade,18,502c629b-4da7-40fd-92ab-20cb55411c35,basketball_play,1775442189,415,True,2026-04-06 02:23:09+00:00,1,424.0,296.0,4.933333333333334,31
4,66,quarter,1,502c629b-4da7-40fd-92ab-20cb55411c35,13,6:52,Gary Payton II misses two point driving layup,twopointmiss,18,,basketball_play,1775442201,414,True,2026-04-06 02:23:21+00:00,1,412.0,308.0,5.133333333333334,32
4,65,quarter,1,a8625e4b-4ae6-4062-a7c1-0b6e1f4ae211,13,6:50,Jabari Smith Jr. defensive rebound,rebound,18,a8625e4b-4ae6-4062-a7c1-0b6e1f4ae211,basketball_play,1775442203,413,True,2026-04-06 02:23:23+00:00,1,410.0,310.0,5.166666666666667,33
4,64,quarter,1,502c629b-4da7-40fd-92ab-20cb55411c35,13,6:47,Gui Santos personal foul (Kevin Durant draws the foul),personalfoul,18,a8625e4b-4ae6-4062-a7c1-0b6e1f4ae211,basketball_play,1775442209,412,True,2026-04-06 02:23:29+00:00,1,407.0,313.0,5.216666666666667,34
4,63,quarter,1,a8625e4b-4ae6-4062-a7c1-0b6e1f4ae211,13,6:47,"Rockets lineup change (Reed Sheppard, Kevin Durant, Tari Eason, Clint Capela, Jabari Smith Jr.)",lineupchange,18,,basketball_play,1775442216,411,True,2026-04-06 02:23:36+00:00,1,407.0,313.0,5.216666666666667,35
4,62,quarter,1,a8625e4b-4ae6-4062-a7c1-0b6e1f4ae211,15,6:35,Kevin Durant makes two point pullup jump shot,twopointmade,18,502c629b-4da7-40fd-92ab-20cb55411c35,basketball_play,1775442248,410,True,2026-04-06 02:24:08+00:00,1,395.0,325.0,5.416666666666667,36
4,61,quarter,1,502c629b-4da7-40fd-92ab-20cb55411c35,15,6:14,Gui Santos misses three point jump shot,threepointmiss,18,,basketball_play,1775442268,409,True,2026-04-06 02:24:28+00:00,1,374.0,346.0,5.766666666666667,37
4,60,quarter,1,a8625e4b-4ae6-4062-a7c1-0b6e1f4ae211,15,6:11,Tari Eason defensive rebound,rebound,18,a8625e4b-4ae6-4062-a7c1-0b6e1f4ae211,basketball_play,1775442271,408,True,2026-04-06 02:24:31+00:00,1,371.0,349.0,5.816666666666666,38
4,59,quarter,1,a8625e4b-4ae6-4062-a7c1-0b6e1f4ae211,15,5:59,Jabari Smith Jr. misses two point turnaround fadeaway jump shot,twopointmiss,18,,basketball_play,1775442284,407,True,2026-04-06 02:24:44+00:00,1,359.0,361.0,6.016666666666667,39
4,58,quarter,1,502c629b-4da7-40fd-92ab-20cb55411c35,15,5:57,Gui Santos defensive rebound,rebound,18,502c629b-4da7-40fd-92ab-20cb55411c35,basketball_play,1775442286,406,True,2026-04-06 02:24:46+00:00,1,357.0,363.0,6.05,40
4,57,quarter,1,502c629b-4da7-40fd-92ab-20cb55411c35,15,5:49,Reed Sheppard blocks Seth Curry's three point jump shot,threepointmiss,18,,basketball_play,1775442294,405,True,2026-04-06 02:24:54+00:00,1,349.0,371.0,6.183333333333334,41
4,56,quarter,1,a8625e4b-4ae6-4062-a7c1-0b6e1f4ae211,15,5:45,Jabari Smith Jr. defensive rebound,rebound,18,a8625e4b-4ae6-4062-a7c1-0b6e1f4ae211,basketball_play,1775442298,404,True,2026-04-06 02:24:58+00:00,1,345.0,375.0,6.25,42
4,55,quarter,1,a8625e4b-4ae6-4062-a7c1-0b6e1f4ae211,15,5:39,Tari Eason misses three point jump shot,threepointmiss,18,,basketball_play,1775442304,403,True,2026-04-06 02:25:04+00:00,1,339.0,381.0,6.35,43
4,54,quarter,1,a8625e4b-4ae6-4062-a7c1-0b6e1f4ae211,15,5:36,Clint Capela offensive rebound,rebound,18,a8625e4b-4ae6-4062-a7c1-0b6e1f4ae211,basketball_play,1775442307,402,True,2026-04-06 02:25:07+00:00,1,336.0,384.0,6.4,44
4,53,quarter,1,a8625e4b-4ae6-4062-a7c1-0b6e1f4ae211,15,5:32,Tari Eason misses three point jump shot,threepointmiss,18,,basketball_play,1775442311,401,True,2026-04-06 02:25:11+00:00,1,332.0,388.0,6.466666666666667,45
4,52,quarter,1,502c629b-4da7-40fd-92ab-20cb55411c35,15,5:32,Draymond Green defensive rebound,rebound,18,502c629b-4da7-40fd-92ab-20cb55411c35,basketball_play,1775442311,400,True,2026-04-06 02:25:11+00:00,1,332.0,388.0,6.466666666666667,46
4,51,quarter,1,502c629b-4da7-40fd-92ab-20cb55411c35,15,5:12,Gui Santos makes two point cutting layup (Will Richard assists),twopointmade,20,a8625e4b-4ae6-4062-a7c1-0b6e1f4ae211,basketball_play,1775442330,399,True,2026-04-06 02:25:30+00:00,1,312.0,408.0,6.8,47
4,50,quarter,1,a8625e4b-4ae6-4062-a7c1-0b6e1f4ae211,17,4:55,Reed Sheppard makes two point driving layup (Kevin Durant assists),twopointmade,20,502c629b-4da7-40fd-92ab-20cb55411c35,basketball_play,1775442348,398,True,2026-04-06 02:25:48+00:00,1,295.0,425.0,7.083333333333333,48
4,49,quarter,1,502c629b-4da7-40fd-92ab-20cb55411c35,17,4:54,Warriors 60 second timeout,teamtimeout,20,,basketball_play,1775442356,397,True,2026-04-06 02:25:56+00:00,1,294.0,426.0,7.1,49
4,48,quarter,1,a8625e4b-4ae6-4062-a7c1-0b6e1f4ae211,17,4:54,"Rockets lineup change (Reed Sheppard, Kevin Durant, Amen Thompson, Tari Eason, Clint Capela)",lineupchange,20,,basketball_play,1775442524,396,True,2026-04-06 02:28:44+00:00,1,294.0,426.0,7.1,50
4,47,quarter,1,502c629b-4da7-40fd-92ab-20cb55411c35,17,4:54,"Warriors lineup change (Gui Santos, Stephen Curry, Charles Bassey, Draymond Green, Will Richard)",lineupchange,20,,basketball_play,1775442524,395,True,2026-04-06 02:28:44+00:00,1,294.0,426.0,7.1,51
4,46,quarter,1,a8625e4b-4ae6-4062-a7c1-0b6e1f4ae211,17,4:44,Reed Sheppard kicked ball violation,kickball,20,502c629b-4da7-40fd-92ab-20cb55411c35,basketball_play,1775442576,394,True,2026-04-06 02:29:36+00:00,1,284.0,436.0,7.266666666666667,52
4,45,quarter,1,502c629b-4da7-40fd-92ab-20cb55411c35,17,4:36,Charles Bassey makes two point cutting dunk (Stephen Curry assists),twopointmade,22,a8625e4b-4ae6-4062-a7c1-0b6e1f4ae211,basketball_play,1775442602,393,True,2026-04-06 02:30:02+00:00,1,276.0,444.0,7.4,53
4,44,quarter,1,a8625e4b-4ae6-4062-a7c1-0b6e1f4ae211,17,4:25,Reed Sheppard misses three point pullup jump shot,threepointmiss,22,,basketball_play,1775442613,392,True,2026-04-06 02:30:13+00:00,1,265.0,455.0,7.583333333333333,54
4,43,quarter,1,502c629b-4da7-40fd-92ab-20cb55411c35,17,4:23,Charles Bassey defensive rebound,rebound,22,502c629b-4da7-40fd-92ab-20cb55411c35,basketball_play,1775442615,391,True,2026-04-06 02:30:15+00:00,1,263.0,457.0,7.616666666666666,55
4,42,quarter,1,502c629b-4da7-40fd-92ab-20cb55411c35,17,4:17,Gui Santos turnover (out of bounds lost ball),turnover,22,a8625e4b-4ae6-4062-a7c1-0b6e1f4ae211,basketball_play,1775442623,390,True,2026-04-06 02:30:23+00:00,1,257.0,463.0,7.716666666666667,56
4,41,quarter,1,502c629b-4da7-40fd-92ab-20cb55411c35,17,4:06,Gui Santos shooting foul (Amen Thompson draws the foul),shootingfoul,22,a8625e4b-4ae6-4062-a7c1-0b6e1f4ae211,basketball_play,1775442642,389,True,2026-04-06 02:30:42+00:00,1,246.0,474.0,7.9,57
4,40,quarter,1,a8625e4b-4ae6-4062-a7c1-0b6e1f4ae211,17,4:06,Amen Thompson misses regular free throw 1 of 2,freethrowmiss,22,a8625e4b-4ae6-4062-a7c1-0b6e1f4ae211,basketball_play,1775442671,388,True,2026-04-06 02:31:11+00:00,1,246.0,474.0,7.9,58
4,39,quarter,1,a8625e4b-4ae6-4062-a7c1-0b6e1f4ae211,17,4:06,Rockets offensive rebound,rebound,22,a8625e4b-4ae6-4062-a7c1-0b6e1f4ae211,basketball_play,1775442671,387,True,2026-04-06 02:31:11+00:00,1,246.0,474.0,7.9,59
4,38,quarter,1,502c629b-4da7-40fd-92ab-20cb55411c35,17,4:06,"Warriors lineup change (Gui Santos, Stephen Curry, Brandin Podziemski, Charles Bassey, Draymond Green)",lineupchange,22,,basketball_play,1775442682,386,True,2026-04-06 02:31:22+00:00,1,246.0,474.0,7.9,60
4,37,quarter,1,a8625e4b-4ae6-4062-a7c1-0b6e1f4ae211,17,4:06,"Rockets lineup change (Kevin Durant, Aaron Holiday, Amen Thompson, Tari Eason, Clint Capela)",lineupchange,22,,basketball_play,1775442700,385,True,2026-04-06 02:31:40+00:00,1,246.0,474.0,7.9,61
4,36,quarter,1,a8625e4b-4ae6-4062-a7c1-0b6e1f4ae211,18,4:06,Amen Thompson makes regular free throw 2 of 2,freethrowmade,22,502c629b-4da7-40fd-92ab-20cb55411c35,basketball_play,1775442700,384,True,2026-04-06 02:31:40+00:00,1,246.0,474.0,7.9,62
4,35,quarter,1,502c629b-4da7-40fd-92ab-20cb55411c35,18,3:46,Kevin Durant blocks Stephen Curry's two point driving hook shot,twopointmiss,22,,basketball_play,1775442721,383,True,2026-04-06 02:32:01+00:00,1,226.0,494.0,8.233333333333333,63
4,34,quarter,1,a8625e4b-4ae6-4062-a7c1-0b6e1f4ae211,18,3:44,Clint Capela defensive rebound,rebound,22,a8625e4b-4ae6-4062-a7c1-0b6e1f4ae211,basketball_play,1775442723,382,True,2026-04-06 02:32:03+00:00,1,224.0,496.0,8.266666666666667,64
4,33,quarter,1,a8625e4b-4ae6-4062-a7c1-0b6e1f4ae211,18,3:40,Kevin Durant misses three point running pullup jump shot,threepointmiss,22,,basketball_play,1775442726,381,True,2026-04-06 02:32:06+00:00,1,220.0,500.0,8.333333333333334,65
4,32,quarter,1,a8625e4b-4ae6-4062-a7c1-0b6e1f4ae211,18,3:39,Tari Eason offensive rebound,rebound,22,a8625e4b-4ae6-4062-a7c1-0b6e1f4ae211,basketball_play,1775442727,380,True,2026-04-06 02:32:07+00:00,1,219.0,501.0,8.35,66
4,31,quarter,1,a8625e4b-4ae6-4062-a7c1-0b6e1f4ae211,20,3:38,Tari Eason makes two point tip layup,twopointmade,22,502c629b-4da7-40fd-92ab-20cb55411c35,basketball_play,1775442731,379,True,2026-04-06 02:32:11+00:00,1,218.0,502.0,8.366666666666667,67
4,30,quarter,1,502c629b-4da7-40fd-92ab-20cb55411c35,20,3:25,Stephen Curry turnover (traveling),turnover,22,a8625e4b-4ae6-4062-a7c1-0b6e1f4ae211,basketball_play,1775442743,378,True,2026-04-06 02:32:23+00:00,1,205.0,515.0,8.583333333333334,68
4,29,quarter,1,a8625e4b-4ae6-4062-a7c1-0b6e1f4ae211,20,3:10,Amen Thompson misses two point driving floating jump shot,twopointmiss,22,,basketball_play,1775442772,377,True,2026-04-06 02:32:52+00:00,1,190.0,530.0,8.833333333333334,69
4,28,quarter,1,502c629b-4da7-40fd-92ab-20cb55411c35,20,3:09,Gui Santos defensive rebound,rebound,22,502c629b-4da7-40fd-92ab-20cb55411c35,basketball_play,1775442773,376,True,2026-04-06 02:32:53+00:00,1,189.0,531.0,8.85,70
4,27,quarter,1,502c629b-4da7-40fd-92ab-20cb55411c35,20,2:52,Charles Bassey makes two point cutting layup (Brandin Podziemski assists),twopointmade,24,a8625e4b-4ae6-4062-a7c1-0b6e1f4ae211,basketball_play,1775442792,375,True,2026-04-06 02:33:12+00:00,1,172.0,548.0,9.133333333333333,71
4,26,quarter,1,a8625e4b-4ae6-4062-a7c1-0b6e1f4ae211,20,2:52,Tari Eason shooting foul (Charles Bassey draws the foul),shootingfoul,24,502c629b-4da7-40fd-92ab-20cb55411c35,basketball_play,1775442795,374,True,2026-04-06 02:33:15+00:00,1,172.0,548.0,9.133333333333333,72
4,25,quarter,1,a8625e4b-4ae6-4062-a7c1-0b6e1f4ae211,20,2:52,"Rockets lineup change (Kevin Durant, Alperen Sengun, Aaron Holiday, Amen Thompson, Tari Eason)",lineupchange,24,,basketball_play,1775442810,373,True,2026-04-06 02:33:30+00:00,1,172.0,548.0,9.133333333333333,73
4,24,quarter,1,502c629b-4da7-40fd-92ab-20cb55411c35,20,2:52,"Warriors lineup change (De'Anthony Melton, Stephen Curry, Brandin Podziemski, Charles Bassey, Kristaps Porzingis)",lineupchange,24,,basketball_play,1775442810,372,True,2026-04-06 02:33:30+00:00,1,172.0,548.0,9.133333333333333,74
4,23,quarter,1,502c629b-4da7-40fd-92ab-20cb55411c35,20,2:52,Charles Bassey makes regular free throw 1 of 1,freethrowmade,25,,basketball_play,1775442835,371,True,2026-04-06 02:33:55+00:00,1,172.0,548.0,9.133333333333333,75
4,22,quarter,1,a8625e4b-4ae6-4062-a7c1-0b6e1f4ae211,22,2:38,Alperen Sengun makes two point fadeaway jump shot (Kevin Durant assists),twopointmade,25,502c629b-4da7-40fd-92ab-20cb55411c35,basketball_play,1775442858,370,True,2026-04-06 02:34:18+00:00,1,158.0,562.0,9.366666666666667,76
4,21,quarter,1,502c629b-4da7-40fd-92ab-20cb55411c35,22,2:27,Kristaps Porzingis misses three point jump shot,threepointmiss,25,,basketball_play,1775442869,369,True,2026-04-06 02:34:29+00:00,1,147.0,573.0,9.55,77
4,20,quarter,1,a8625e4b-4ae6-4062-a7c1-0b6e1f4ae211,22,2:23,Kevin Durant defensive rebound,rebound,25,a8625e4b-4ae6-4062-a7c1-0b6e1f4ae211,basketball_play,1775442872,368,True,2026-04-06 02:34:32+00:00,1,143.0,577.0,9.616666666666667,78
4,19,quarter,1,a8625e4b-4ae6-4062-a7c1-0b6e1f4ae211,24,2:17,Alperen Sengun makes two point turnaround hook shot (Kevin Durant assists),twopointmade,25,502c629b-4da7-40fd-92ab-20cb55411c35,basketball_play,1775442878,367,True,2026-04-06 02:34:38+00:00,1,137.0,583.0,9.716666666666667,79
4,18,quarter,1,502c629b-4da7-40fd-92ab-20cb55411c35,24,1:54,De'Anthony Melton misses three point jump shot,threepointmiss,25,,basketball_play,1775442900,366,True,2026-04-06 02:35:00+00:00,1,114.0,606.0,10.1,80
4,17,quarter,1,502c629b-4da7-40fd-92ab-20cb55411c35,24,1:54,Charles Bassey offensive rebound,rebound,25,502c629b-4da7-40fd-92ab-20cb55411c35,basketball_play,1775442900,365,True,2026-04-06 02:35:00+00:00,1,114.0,606.0,10.1,81
4,16,quarter,1,502c629b-4da7-40fd-92ab-20cb55411c35,24,1:38,Alperen Sengun blocks Kristaps Porzingis's two point pullup jump shot,twopointmiss,25,,basketball_play,1775442917,364,True,2026-04-06 02:35:17+00:00,1,98.0,622.0,10.366666666666667,82
4,15,quarter,1,a8625e4b-4ae6-4062-a7c1-0b6e1f4ae211,24,1:35,Alperen Sengun defensive rebound,rebound,25,a8625e4b-4ae6-4062-a7c1-0b6e1f4ae211,basketball_play,1775442920,363,True,2026-04-06 02:35:20+00:00,1,95.0,625.0,10.416666666666666,83
4,14,quarter,1,a8625e4b-4ae6-4062-a7c1-0b6e1f4ae211,24,1:34,Alperen Sengun turnover (traveling),turnover,25,502c629b-4da7-40fd-92ab-20cb55411c35,basketball_play,1775442924,362,True,2026-04-06 02:35:24+00:00,1,94.0,626.0,10.433333333333334,84
4,13,quarter,1,502c629b-4da7-40fd-92ab-20cb55411c35,24,1:34,"Warriors lineup change (De'Anthony Melton, Stephen Curry, Brandin Podziemski, Gary Payton II, Kristaps Porzingis)",lineupchange,25,,basketball_play,1775442958,361,True,2026-04-06 02:35:58+00:00,1,94.0,626.0,10.433333333333334,85
4,12,quarter,1,502c629b-4da7-40fd-92ab-20cb55411c35,24,1:17,Stephen Curry misses three point jump shot,threepointmiss,25,,basketball_play,1775442958,360,True,2026-04-06 02:35:58+00:00,1,77.0,643.0,10.716666666666667,86
4,11,quarter,1,502c629b-4da7-40fd-92ab-20cb55411c35,24,1:15,Kristaps Porzingis offensive rebound,rebound,25,502c629b-4da7-40fd-92ab-20cb55411c35,basketball_play,1775442960,359,True,2026-04-06 02:36:00+00:00,1,75.0,645.0,10.75,87
4,10,quarter,1,502c629b-4da7-40fd-92ab-20cb55411c35,24,1:12,Brandin Podziemski makes three point jump shot (Kristaps Porzingis assists),threepointmade,28,a8625e4b-4ae6-4062-a7c1-0b6e1f4ae211,basketball_play,1775442964,358,True,2026-04-06 02:36:04+00:00,1,72.0,648.0,10.8,88
4,9,quarter,1,a8625e4b-4ae6-4062-a7c1-0b6e1f4ae211,24,00:57.20,Alperen Sengun offensive foul (Kristaps Porzingis draws the foul),offensivefoul,28,502c629b-4da7-40fd-92ab-20cb55411c35,basketball_play,1775442981,357,True,2026-04-06 02:36:21+00:00,1,57.2,662.8,11.046666666666665,89
4,8,quarter,1,a8625e4b-4ae6-4062-a7c1-0b6e1f4ae211,24,00:57.20,Alperen Sengun turnover (offensive foul),turnover,28,502c629b-4da7-40fd-92ab-20cb55411c35,basketball_play,1775442981,356,True,2026-04-06 02:36:21+00:00,1,57.2,662.8,11.046666666666665,90
4,7,quarter,1,502c629b-4da7-40fd-92ab-20cb55411c35,24,00:34.10,Stephen Curry makes three point jump shot (De'Anthony Melton assists),threepointmade,31,a8625e4b-4ae6-4062-a7c1-0b6e1f4ae211,basketball_play,1775443014,355,True,2026-04-06 02:36:54+00:00,1,34.1,685.9,11.431666666666667,91
4,6,quarter,1,a8625e4b-4ae6-4062-a7c1-0b6e1f4ae211,26,00:26.90,Kevin Durant makes two point fadeaway jump shot (Amen Thompson assists),twopointmade,31,502c629b-4da7-40fd-92ab-20cb55411c35,basketball_play,1775443029,354,True,2026-04-06 02:37:09+00:00,1,26.9,693.1,11.551666666666668,92
4,5,quarter,1,502c629b-4da7-40fd-92ab-20cb55411c35,26,00:04.80,Stephen Curry misses three point jump shot,threepointmiss,31,,basketball_play,1775443056,353,True,2026-04-06 02:37:36+00:00,1,4.8,715.2,11.92,93
4,4,quarter,1,a8625e4b-4ae6-4062-a7c1-0b6e1f4ae211,26,00:02.90,Kevin Durant defensive rebound,rebound,31,a8625e4b-4ae6-4062-a7c1-0b6e1f4ae211,basketball_play,1775443058,352,True,2026-04-06 02:37:38+00:00,1,2.9,717.1,11.951666666666666,94
4,3,quarter,1,a8625e4b-4ae6-4062-a7c1-0b6e1f4ae211,26,00:00.40,Rockets misses heave shot,heave,31,,basketball_play,1775443062,351,True,2026-04-06 02:37:42+00:00,1,0.4,719.6,11.993333333333334,95
4,2,quarter,1,a8625e4b-4ae6-4062-a7c1-0b6e1f4ae211,26,00:00.10,Rockets offensive rebound,rebound,31,a8625e4b-4ae6-4062-a7c1-0b6e1f4ae211,basketball_play,1775443062,350,True,2026-04-06 02:37:42+00:00,1,0.1,719.9,11.998333333333333,96
4,1,quarter,1,,26,00:00,End of 1st Quarter.,endperiod,31,,basketball_play,1775443067,349,True,2026-04-06 02:37:47+00:00,1,0.0,720.0,12.0,97
3,121,quarter,2,a8625e4b-4ae6-4062-a7c1-0b6e1f4ae211,26,12:00,"Rockets lineup change (Alperen Sengun, Aaron Holiday, Amen Thompson, Tari Eason, Jabari Smith Jr.)",lineupchange,31,,basketball_play,1775443267,348,True,2026-04-06 02:41:07+00:00,2,720.0,720.0,12.0,98
3,120,quarter,2,502c629b-4da7-40fd-92ab-20cb55411c35,26,12:00,"Warriors lineup change (De'Anthony Melton, Gui Santos, Brandin Podziemski, Kristaps Porzingis, Will Richard)",lineupchange,31,,basketball_play,1775443267,347,True,2026-04-06 02:41:07+00:00,2,720.0,720.0,12.0,99
3,119,quarter,2,,26,12:00,Start of 2nd Quarter,startperiod,31,,basketball_play,1775443282,346,True,2026-04-06 02:41:22+00:00,2,720.0,720.0,12.0,100
3,118,quarter,2,a8625e4b-4ae6-4062-a7c1-0b6e1f4ae211,26,11:37,Amen Thompson misses two point pullup jump shot,twopointmiss,31,,basketball_play,1775443305,345,True,2026-04-06 02:41:45+00:00,2,697.0,743.0,12.383333333333333,101
3,117,quarter,2,a8625e4b-4ae6-4062-a7c1-0b6e1f4ae211,26,11:34,Alperen Sengun offensive rebound,rebound,31,a8625e4b-4ae6-4062-a7c1-0b6e1f4ae211,basketball_play,1775443308,344,True,2026-04-06 02:41:48+00:00,2,694.0,746.0,12.433333333333334,102
3,116,quarter,2,a8625e4b-4ae6-4062-a7c1-0b6e1f4ae211,28,11:30,Alperen Sengun makes two point turnaround hook shot,twopointmade,31,502c629b-4da7-40fd-92ab-20cb55411c35,basketball_play,1775443312,343,True,2026-04-06 02:41:52+00:00,2,690.0,750.0,12.5,103
3,115,quarter,2,502c629b-4da7-40fd-92ab-20cb55411c35,28,11:09,Gui Santos misses two point fadeaway jump shot,twopointmiss,31,,basketball_play,1775443332,342,True,2026-04-06 02:42:12+00:00,2,669.0,771.0,12.85,104
3,114,quarter,2,a8625e4b-4ae6-4062-a7c1-0b6e1f4ae211,28,11:07,Tari Eason defensive rebound,rebound,31,a8625e4b-4ae6-4062-a7c1-0b6e1f4ae211,basketball_play,1775443334,341,True,2026-04-06 02:42:14+00:00,2,667.0,773.0,12.883333333333333,105
