period_index,event_index,period_type,period_number,attribution,away_points,clock,description,event_type,home_points,possession,type,wall_clock,pbp_source_row,has_wall_clock,event_ts_utc,period_sequence,game_clock_seconds_remaining,game_elapsed_seconds,game_elapsed_minutes,pbp_chronological_index
3,9,quarter,2,502c629b-4da7-40fd-92ab-20cb55411c35,55,00:33,"Warriors lineup change (Stephen Curry, Brandin Podziemski, Gary Payton II, Draymond Green, Kristaps Porzingis)",lineupchange,51,,basketball_play,1775445109,236,True,2026-04-06 03:11:49+00:00,2,33.0,1407.0,23.45,210
3,8,quarter,2,a8625e4b-4ae6-4062-a7c1-0b6e1f4ae211,55,00:18.90,Kevin Durant turnover (lost ball) (Draymond Green steals),turnover,51,502c629b-4da7-40fd-92ab-20cb55411c35,basketball_play,1775445109,235,True,2026-04-06 03:11:49+00:00,2,18.9,1421.1,23.685,211
3,7,quarter,2,502c629b-4da7-40fd-92ab-20cb55411c35,55,00:15.60,Brandin Podziemski makes two point running dunk (Draymond Green assists),twopointmade,53,a8625e4b-4ae6-4062-a7c1-0b6e1f4ae211,basketball_play,1775445112,234,True,2026-04-06 03:11:52+00:00,2,15.6,1424.4,23.740000000000002,212
3,6,quarter,2,a8625e4b-4ae6-4062-a7c1-0b6e1f4ae211,55,00:06.40,Aaron Holiday turnover (out of bounds bad pass),turnover,53,502c629b-4da7-40fd-92ab-20cb55411c35,basketball_play,1775445127,233,True,2026-04-06 03:12:07+00:00,2,6.4,1433.6,23.89333333333333,213
3,5,quarter,2,a8625e4b-4ae6-4062-a7c1-0b6e1f4ae211,55,00:06,"Rockets lineup change (Kevin Durant, Aaron Holiday, Amen Thompson, Tari Eason, Jae'Sean Tate)",lineupchange,53,,basketball_play,1775445139,232,True,2026-04-06 03:12:19+00:00,2,6.0,1434.0,23.9,214
3,4,quarter,2,502c629b-4da7-40fd-92ab-20cb55411c35,55,00:06,"Warriors lineup change (Stephen Curry, Brandin Podziemski, Draymond Green, Kristaps Porzingis, Seth Curry)",lineupchange,53,,basketball_play,1775445139,231,True,2026-04-06 03:12:19+00:00,2,6.0,1434.0,23.9,215
3,3,quarter,2,502c629b-4da7-40fd-92ab-20cb55411c35,55,00:00.70,Stephen Curry misses two point pullup bank jump shot,twopointmiss,53,,basketball_play,1775445172,230,True,2026-04-06 03:12:52+00:00,2,0.7,1439.3,23.988333333333333,216
3,2,quarter,2,502c629b-4da7-40fd-92ab-20cb55411c35,55,00:00.10,Warriors offensive rebound,rebound,53,502c629b-4da7-40fd-92ab-20cb55411c35,basketball_play,1775445173,229,True,2026-04-06 03:12:53+00:00,2,0.1,1439.9,23.998333333333335,217
3,1,quarter,2,,55,00:00,End of 1st Half.,endperiod,53,,basketball_play,1775445179,228,True,2026-04-06 03:12:59+00:00,2,0.0,1440.0,24.0,218
2,124,quarter,3,a8625e4b-4ae6-4062-a7c1-0b6e1f4ae211,55,12:00,"Rockets lineup change (Reed Sheppard, Kevin Durant, Alperen Sengun, Amen Thompson, Jabari Smith Jr.)",lineupchange,53,,basketball_play,1775446132,227,True,2026-04-06 03:28:52+00:00,3,720.0,1440.0,24.0,219
2,123,quarter,3,502c629b-4da7-40fd-92ab-20cb55411c35,55,12:00,"Warriors lineup change (De'Anthony Melton, Gui Santos, Brandin Podziemski, Draymond Green, Kristaps Porzingis)",lineupchange,53,,basketball_play,1775446132,226,True,2026-04-06 03:28:52+00:00,3,720.0,1440.0,24.0,220
2,122,quarter,3,,55,12:00,Start of 3rd Quarter,startperiod,53,,basketball_play,1775446158,225,True,2026-04-06 03:29:18+00:00,3,720.0,1440.0,24.0,221
2,121,quarter,3,a8625e4b-4ae6-4062-a7c1-0b6e1f4ae211,58,11:46,Kevin Durant makes three point pullup jump shot (Alperen Sengun assists),threepointmade,53,502c629b-4da7-40fd-92ab-20cb55411c35,basketball_play,1775446172,224,True,2026-04-06 03:29:32+00:00,3,706.0,1454.0,24.233333333333334,222
2,120,quarter,3,502c629b-4da7-40fd-92ab-20cb55411c35,58,11:46,Kristaps Porzingis shooting foul (Kevin Durant draws the foul),shootingfoul,53,a8625e4b-4ae6-4062-a7c1-0b6e1f4ae211,basketball_play,1775446178,223,True,2026-04-06 03:29:38+00:00,3,706.0,1454.0,24.233333333333334,223
2,119,quarter,3,a8625e4b-4ae6-4062-a7c1-0b6e1f4ae211,59,11:46,Kevin Durant makes regular free throw 1 of 1,freethrowmade,53,,basketball_play,1775446205,222,True,2026-04-06 03:30:05+00:00,3,706.0,1454.0,24.233333333333334,224
2,118,quarter,3,502c629b-4da7-40fd-92ab-20cb55411c35,59,11:34,Kristaps Porzingis makes two point cutting dunk (Draymond Green assists),twopointmade,55,a8625e4b-4ae6-4062-a7c1-0b6e1f4ae211,basketball_play,1775446220,221,True,2026-04-06 03:30:20+00:00,3,694.0,1466.0,24.433333333333334,225
2,117,quarter,3,a8625e4b-4ae6-4062-a7c1-0b6e1f4ae211,59,11:34,Kevin Durant shooting foul (Kristaps Porzingis draws the foul),shootingfoul,55,502c629b-4da7-40fd-92ab-20cb55411c35,basketball_play,1775446224,220,True,2026-04-06 03:30:24+00:00,3,694.0,1466.0,24.433333333333334,226
2,116,quarter,3,502c629b-4da7-40fd-92ab-20cb55411c35,59,11:34,Kristaps Porzingis makes regular free throw 1 of 1,freethrowmade,56,,basketball_play,1775446251,219,True,2026-04-06 03:30:51+00:00,3,694.0,1466.0,24.433333333333334,227
2,115,quarter,3,502c629b-4da7-40fd-92ab-20cb55411c35,59,11:27,Draymond Green personal foul (Kevin Durant draws the foul),personalfoul,56,a8625e4b-4ae6-4062-a7c1-0b6e1f4ae211,basketball_play,1775446261,218,True,2026-04-06 03:31:01+00:00,3,687.0,1473.0,24.55,228
2,114,quarter,3,a8625e4b-4ae6-4062-a7c1-0b6e1f4ae211,61,11:19,Amen Thompson makes two point cutting dunk (Jabari Smith Jr. assists),twopointmade,56,502c629b-4da7-40fd-92ab-20cb55411c35,basketball_play,1775446289,217,True,2026-04-06 03:31:29+00:00,3,679.0,1481.0,24.683333333333334,229
2,113,quarter,3,502c629b-4da7-40fd-92ab-20cb55411c35,61,11:04,Gui Santos misses three point jump shot,threepointmiss,56,,basketball_play,1775446303,216,True,2026-04-06 03:31:43+00:00,3,664.0,1496.0,24.933333333333334,230
2,112,quarter,3,a8625e4b-4ae6-4062-a7c1-0b6e1f4ae211,61,11:01,Jabari Smith Jr. defensive rebound,rebound,56,a8625e4b-4ae6-4062-a7c1-0b6e1f4ae211,basketball_play,1775446306,215,True,2026-04-06 03:31:46+00:00,3,661.0,1499.0,24.983333333333334,231
2,111,quarter,3,a8625e4b-4ae6-4062-a7c1-0b6e1f4ae211,63,10:51,Jabari Smith Jr. makes two point pullup jump shot (Kevin Durant assists),twopointmade,56,502c629b-4da7-40fd-92ab-20cb55411c35,basketball_play,1775446316,214,True,2026-04-06 03:31:56+00:00,3,651.0,1509.0,25.15,232
2,110,quarter,3,502c629b-4da7-40fd-92ab-20cb55411c35,63,10:34,Kristaps Porzingis makes two point cutting dunk (Gui Santos assists),twopointmade,58,a8625e4b-4ae6-4062-a7c1-0b6e1f4ae211,basketball_play,1775446334,213,True,2026-04-06 03:32:14+00:00,3,634.0,1526.0,25.433333333333334,233
2,109,quarter,3,a8625e4b-4ae6-4062-a7c1-0b6e1f4ae211,63,10:12,Reed Sheppard misses three point jump shot,threepointmiss,58,,basketball_play,1775446355,212,True,2026-04-06 03:32:35+00:00,3,612.0,1548.0,25.8,234
2,108,quarter,3,502c629b-4da7-40fd-92ab-20cb55411c35,63,10:08,Kristaps Porzingis defensive rebound,rebound,58,502c629b-4da7-40fd-92ab-20cb55411c35,basketball_play,1775446359,211,True,2026-04-06 03:32:39+00:00,3,608.0,1552.0,25.866666666666667,235
2,107,quarter,3,502c629b-4da7-40fd-92ab-20cb55411c35,63,10:04,Brandin Podziemski makes two point running reverse layup (Kristaps Porzingis assists),twopointmade,60,a8625e4b-4ae6-4062-a7c1-0b6e1f4ae211,basketball_play,1775446363,210,True,2026-04-06 03:32:43+00:00,3,604.0,1556.0,25.933333333333334,236
2,106,quarter,3,502c629b-4da7-40fd-92ab-20cb55411c35,63,9:51,Kristaps Porzingis personal foul (Alperen Sengun draws the foul),personalfoul,60,a8625e4b-4ae6-4062-a7c1-0b6e1f4ae211,basketball_play,1775446379,209,True,2026-04-06 03:32:59+00:00,3,591.0,1569.0,26.15,237
2,105,quarter,3,502c629b-4da7-40fd-92ab-20cb55411c35,63,9:51,"Warriors lineup change (De'Anthony Melton, Brandin Podziemski, Gary Payton II, Draymond Green, Kristaps Porzingis)",lineupchange,60,,basketball_play,1775446411,208,True,2026-04-06 03:33:31+00:00,3,591.0,1569.0,26.15,238
2,104,quarter,3,a8625e4b-4ae6-4062-a7c1-0b6e1f4ae211,65,9:46,Alperen Sengun makes two point driving layup (Amen Thompson assists),twopointmade,60,502c629b-4da7-40fd-92ab-20cb55411c35,basketball_play,1775446411,207,True,2026-04-06 03:33:31+00:00,3,586.0,1574.0,26.233333333333334,239
2,103,quarter,3,502c629b-4da7-40fd-92ab-20cb55411c35,65,9:31,De'Anthony Melton misses three point jump shot,threepointmiss,60,,basketball_play,1775446426,206,True,2026-04-06 03:33:46+00:00,3,571.0,1589.0,26.483333333333334,240
2,102,quarter,3,a8625e4b-4ae6-4062-a7c1-0b6e1f4ae211,65,9:29,Jabari Smith Jr. defensive rebound,rebound,60,a8625e4b-4ae6-4062-a7c1-0b6e1f4ae211,basketball_play,1775446428,205,True,2026-04-06 03:33:48+00:00,3,569.0,1591.0,26.516666666666666,241
2,101,quarter,3,a8625e4b-4ae6-4062-a7c1-0b6e1f4ae211,68,9:21,Jabari Smith Jr. makes three point jump shot (Reed Sheppard assists),threepointmade,60,502c629b-4da7-40fd-92ab-20cb55411c35,basketball_play,1775446436,204,True,2026-04-06 03:33:56+00:00,3,561.0,1599.0,26.65,242
2,100,quarter,3,502c629b-4da7-40fd-92ab-20cb55411c35,68,9:10,Draymond Green turnover (out of bounds bad pass),turnover,60,a8625e4b-4ae6-4062-a7c1-0b6e1f4ae211,basketball_play,1775446448,203,True,2026-04-06 03:34:08+00:00,3,550.0,1610.0,26.833333333333332,243
2,99,quarter,3,502c629b-4da7-40fd-92ab-20cb55411c35,68,9:00,Kristaps Porzingis personal foul (Alperen Sengun draws the foul),personalfoul,60,a8625e4b-4ae6-4062-a7c1-0b6e1f4ae211,basketball_play,1775446470,202,True,2026-04-06 03:34:30+00:00,3,540.0,1620.0,27.0,244
2,98,quarter,3,a8625e4b-4ae6-4062-a7c1-0b6e1f4ae211,68,8:54,Alperen Sengun misses three point jump shot,threepointmiss,60,,basketball_play,1775446492,201,True,2026-04-06 03:34:52+00:00,3,534.0,1626.0,27.1,245
2,97,quarter,3,502c629b-4da7-40fd-92ab-20cb55411c35,68,8:51,Kristaps Porzingis defensive rebound,rebound,60,502c629b-4da7-40fd-92ab-20cb55411c35,basketball_play,1775446495,200,True,2026-04-06 03:34:55+00:00,3,531.0,1629.0,27.15,246
2,96,quarter,3,502c629b-4da7-40fd-92ab-20cb55411c35,68,8:45,Brandin Podziemski misses three point pullup jump shot,threepointmiss,60,,basketball_play,1775446501,199,True,2026-04-06 03:35:01+00:00,3,525.0,1635.0,27.25,247
2,95,quarter,3,502c629b-4da7-40fd-92ab-20cb55411c35,68,8:42,Draymond Green offensive rebound,rebound,60,502c629b-4da7-40fd-92ab-20cb55411c35,basketball_play,1775446505,198,True,2026-04-06 03:35:05+00:00,3,522.0,1638.0,27.3,248
2,94,quarter,3,502c629b-4da7-40fd-92ab-20cb55411c35,68,8:40,Brandin Podziemski misses three point jump shot,threepointmiss,60,,basketball_play,1775446507,197,True,2026-04-06 03:35:07+00:00,3,520.0,1640.0,27.333333333333332,249
2,93,quarter,3,a8625e4b-4ae6-4062-a7c1-0b6e1f4ae211,68,8:40,Kevin Durant defensive rebound,rebound,60,a8625e4b-4ae6-4062-a7c1-0b6e1f4ae211,basketball_play,1775446507,196,True,2026-04-06 03:35:07+00:00,3,520.0,1640.0,27.333333333333332,250
2,92,quarter,3,502c629b-4da7-40fd-92ab-20cb55411c35,68,8:38,Kristaps Porzingis personal foul (Kevin Durant draws the foul),personalfoul,60,a8625e4b-4ae6-4062-a7c1-0b6e1f4ae211,basketball_play,1775446521,195,True,2026-04-06 03:35:21+00:00,3,518.0,1642.0,27.366666666666667,251
2,91,quarter,3,a8625e4b-4ae6-4062-a7c1-0b6e1f4ae211,68,8:38,Kevin Durant misses regular free throw 1 of 2,freethrowmiss,60,a8625e4b-4ae6-4062-a7c1-0b6e1f4ae211,basketball_play,1775446545,194,True,2026-04-06 03:35:45+00:00,3,518.0,1642.0,27.366666666666667,252
2,90,quarter,3,a8625e4b-4ae6-4062-a7c1-0b6e1f4ae211,68,8:38,Rockets offensive rebound,rebound,60,a8625e4b-4ae6-4062-a7c1-0b6e1f4ae211,basketball_play,1775446545,193,True,2026-04-06 03:35:45+00:00,3,518.0,1642.0,27.366666666666667,253
2,89,quarter,3,502c629b-4da7-40fd-92ab-20cb55411c35,68,8:38,Warriors 60 second timeout,teamtimeout,60,,basketball_play,1775446591,192,True,2026-04-06 03:36:31+00:00,3,518.0,1642.0,27.366666666666667,254
2,88,quarter,3,502c629b-4da7-40fd-92ab-20cb55411c35,68,8:38,"Warriors lineup change (Gui Santos, Stephen Curry, Brandin Podziemski, Charles Bassey, Draymond Green)",lineupchange,60,,basketball_play,1775446605,191,True,2026-04-06 03:36:45+00:00,3,518.0,1642.0,27.366666666666667,255
2,87,quarter,3,a8625e4b-4ae6-4062-a7c1-0b6e1f4ae211,69,8:38,Kevin Durant makes regular free throw 2 of 2,freethrowmade,60,502c629b-4da7-40fd-92ab-20cb55411c35,basketball_play,1775446769,190,True,2026-04-06 03:39:29+00:00,3,518.0,1642.0,27.366666666666667,256
2,86,quarter,3,502c629b-4da7-40fd-92ab-20cb55411c35,69,8:27,Charles Bassey turnover (out of bounds lost ball),turnover,60,a8625e4b-4ae6-4062-a7c1-0b6e1f4ae211,basketball_play,1775446785,189,True,2026-04-06 03:39:45+00:00,3,507.0,1653.0,27.55,257
2,85,quarter,3,a8625e4b-4ae6-4062-a7c1-0b6e1f4ae211,71,8:08,Alperen Sengun makes two point turnaround hook shot,twopointmade,60,502c629b-4da7-40fd-92ab-20cb55411c35,basketball_play,1775446807,188,True,2026-04-06 03:40:07+00:00,3,488.0,1672.0,27.866666666666667,258
2,84,quarter,3,502c629b-4da7-40fd-92ab-20cb55411c35,71,7:48,Stephen Curry makes two point stepback jump shot,twopointmade,62,a8625e4b-4ae6-4062-a7c1-0b6e1f4ae211,basketball_play,1775446827,187,True,2026-04-06 03:40:27+00:00,3,468.0,1692.0,28.2,259
2,83,quarter,3,a8625e4b-4ae6-4062-a7c1-0b6e1f4ae211,71,7:25,Kevin Durant misses three point jump shot,threepointmiss,62,,basketball_play,1775446850,186,True,2026-04-06 03:40:50+00:00,3,445.0,1715.0,28.583333333333332,260
2,82,quarter,3,502c629b-4da7-40fd-92ab-20cb55411c35,71,7:22,Draymond Green defensive rebound,rebound,62,502c629b-4da7-40fd-92ab-20cb55411c35,basketball_play,1775446853,185,True,2026-04-06 03:40:53+00:00,3,442.0,1718.0,28.633333333333333,261
2,81,quarter,3,502c629b-4da7-40fd-92ab-20cb55411c35,71,7:15,Stephen Curry misses two point driving reverse layup,twopointmiss,62,,basketball_play,1775446861,184,True,2026-04-06 03:41:01+00:00,3,435.0,1725.0,28.75,262
2,80,quarter,3,a8625e4b-4ae6-4062-a7c1-0b6e1f4ae211,71,7:12,Jabari Smith Jr. defensive rebound,rebound,62,a8625e4b-4ae6-4062-a7c1-0b6e1f4ae211,basketball_play,1775446864,183,True,2026-04-06 03:41:04+00:00,3,432.0,1728.0,28.8,263
2,79,quarter,3,a8625e4b-4ae6-4062-a7c1-0b6e1f4ae211,74,7:06,Jabari Smith Jr. makes three point jump shot (Kevin Durant assists),threepointmade,62,502c629b-4da7-40fd-92ab-20cb55411c35,basketball_play,1775446870,182,True,2026-04-06 03:41:10+00:00,3,426.0,1734.0,28.9,264
2,78,quarter,3,a8625e4b-4ae6-4062-a7c1-0b6e1f4ae211,74,6:52,Jabari Smith Jr. personal foul (Draymond Green draws the foul),personalfoul,62,502c629b-4da7-40fd-92ab-20cb55411c35,basketball_play,1775446886,181,True,2026-04-06 03:41:26+00:00,3,412.0,1748.0,29.133333333333333,265
2,77,quarter,3,a8625e4b-4ae6-4062-a7c1-0b6e1f4ae211,74,6:52,"Rockets lineup change (Reed Sheppard, Kevin Durant, Alperen Sengun, Amen Thompson, Tari Eason)",lineupchange,62,,basketball_play,1775446948,180,True,2026-04-06 03:42:28+00:00,3,412.0,1748.0,29.133333333333333,266
2,76,quarter,3,502c629b-4da7-40fd-92ab-20cb55411c35,74,6:48,Gui Santos makes two point cutting layup (Draymond Green assists),twopointmade,64,a8625e4b-4ae6-4062-a7c1-0b6e1f4ae211,basketball_play,1775446948,179,True,2026-04-06 03:42:28+00:00,3,408.0,1752.0,29.2,267
2,75,quarter,3,a8625e4b-4ae6-4062-a7c1-0b6e1f4ae211,76,6:36,Kevin Durant makes two point driving dunk,twopointmade,64,502c629b-4da7-40fd-92ab-20cb55411c35,basketball_play,1775446961,178,True,2026-04-06 03:42:41+00:00,3,396.0,1764.0,29.4,268
2,74,quarter,3,a8625e4b-4ae6-4062-a7c1-0b6e1f4ae211,76,6:25,Kevin Durant shooting foul (Gui Santos draws the foul),shootingfoul,64,502c629b-4da7-40fd-92ab-20cb55411c35,basketball_play,1775446974,177,True,2026-04-06 03:42:54+00:00,3,385.0,1775.0,29.583333333333332,269
2,73,quarter,3,502c629b-4da7-40fd-92ab-20cb55411c35,76,6:25,Gui Santos misses regular free throw 1 of 2,freethrowmiss,64,502c629b-4da7-40fd-92ab-20cb55411c35,basketball_play,1775447004,176,True,2026-04-06 03:43:24+00:00,3,385.0,1775.0,29.583333333333332,270
2,72,quarter,3,502c629b-4da7-40fd-92ab-20cb55411c35,76,6:25,Warriors offensive rebound,rebound,64,502c629b-4da7-40fd-92ab-20cb55411c35,basketball_play,1775447004,175,True,2026-04-06 03:43:24+00:00,3,385.0,1775.0,29.583333333333332,271
2,71,quarter,3,a8625e4b-4ae6-4062-a7c1-0b6e1f4ae211,76,6:25,"Rockets lineup change (Kevin Durant, Alperen Sengun, Aaron Holiday, Amen Thompson, Tari Eason)",lineupchange,64,,basketball_play,1775447006,174,True,2026-04-06 03:43:26+00:00,3,385.0,1775.0,29.583333333333332,272
2,70,quarter,3,502c629b-4da7-40fd-92ab-20cb55411c35,76,6:25,"Warriors lineup change (Gui Santos, Stephen Curry, Brandin Podziemski, Gary Payton II, Draymond Green)",lineupchange,64,,basketball_play,1775447006,173,True,2026-04-06 03:43:26+00:00,3,385.0,1775.0,29.583333333333332,273
2,69,quarter,3,502c629b-4da7-40fd-92ab-20cb55411c35,76,6:25,Gui Santos makes regular free throw 2 of 2,freethrowmade,65,a8625e4b-4ae6-4062-a7c1-0b6e1f4ae211,basketball_play,1775447045,172,True,2026-04-06 03:44:05+00:00,3,385.0,1775.0,29.583333333333332,274
2,68,quarter,3,a8625e4b-4ae6-4062-a7c1-0b6e1f4ae211,76,6:09,Tari Eason misses two point turnaround fadeaway jump shot,twopointmiss,65,,basketball_play,1775447067,171,True,2026-04-06 03:44:27+00:00,3,369.0,1791.0,29.85,275
2,67,quarter,3,502c629b-4da7-40fd-92ab-20cb55411c35,76,6:06,Draymond Green defensive rebound,rebound,65,502c629b-4da7-40fd-92ab-20cb55411c35,basketball_play,1775447070,170,True,2026-04-06 03:44:30+00:00,3,366.0,1794.0,29.9,276
2,66,quarter,3,a8625e4b-4ae6-4062-a7c1-0b6e1f4ae211,76,6:01,Tari Eason shooting foul (Brandin Podziemski draws the foul),shootingfoul,65,502c629b-4da7-40fd-92ab-20cb55411c35,basketball_play,1775447075,169,True,2026-04-06 03:44:35+00:00,3,361.0,1799.0,29.983333333333334,277
2,65,quarter,3,502c629b-4da7-40fd-92ab-20cb55411c35,76,6:01,Brandin Podziemski makes regular free throw 1 of 2,freethrowmade,66,502c629b-4da7-40fd-92ab-20cb55411c35,basketball_play,1775447108,168,True,2026-04-06 03:45:08+00:00,3,361.0,1799.0,29.983333333333334,278
2,64,quarter,3,502c629b-4da7-40fd-92ab-20cb55411c35,76,6:01,Brandin Podziemski makes regular free throw 2 of 2,freethrowmade,67,a8625e4b-4ae6-4062-a7c1-0b6e1f4ae211,basketball_play,1775447108,167,True,2026-04-06 03:45:08+00:00,3,361.0,1799.0,29.983333333333334,279
2,63,quarter,3,a8625e4b-4ae6-4062-a7c1-0b6e1f4ae211,79,5:49,Aaron Holiday makes three point jump shot (Amen Thompson assists),threepointmade,67,502c629b-4da7-40fd-92ab-20cb55411c35,basketball_play,1775447142,166,True,2026-04-06 03:45:42+00:00,3,349.0,1811.0,30.183333333333334,280
2,62,quarter,3,502c629b-4da7-40fd-92ab-20cb55411c35,79,5:29,Aaron Holiday blocks Gui Santos's two point driving layup,twopointmiss,67,,basketball_play,1775447161,165,True,2026-04-06 03:46:01+00:00,3,329.0,1831.0,30.516666666666666,281
2,61,quarter,3,a8625e4b-4ae6-4062-a7c1-0b6e1f4ae211,79,5:27,Aaron Holiday defensive rebound,rebound,67,a8625e4b-4ae6-4062-a7c1-0b6e1f4ae211,basketball_play,1775447163,164,True,2026-04-06 03:46:03+00:00,3,327.0,1833.0,30.55,282
2,60,quarter,3,a8625e4b-4ae6-4062-a7c1-0b6e1f4ae211,82,5:18,Kevin Durant makes three point jump shot (Aaron Holiday assists),threepointmade,67,502c629b-4da7-40fd-92ab-20cb55411c35,basketball_play,1775447172,163,True,2026-04-06 03:46:12+00:00,3,318.0,1842.0,30.7,283
2,59,quarter,3,502c629b-4da7-40fd-92ab-20cb55411c35,82,5:05,Gary Payton II makes two point reverse layup (Draymond Green assists),twopointmade,69,a8625e4b-4ae6-4062-a7c1-0b6e1f4ae211,basketball_play,1775447186,162,True,2026-04-06 03:46:26+00:00,3,305.0,1855.0,30.916666666666668,284
2,58,quarter,3,502c629b-4da7-40fd-92ab-20cb55411c35,82,5:00,Gary Payton II personal foul (Kevin Durant draws the foul),personalfoul,69,a8625e4b-4ae6-4062-a7c1-0b6e1f4ae211,basketball_play,1775447198,161,True,2026-04-06 03:46:38+00:00,3,300.0,1860.0,31.0,285
2,57,quarter,3,a8625e4b-4ae6-4062-a7c1-0b6e1f4ae211,83,5:00,Kevin Durant makes regular free throw 1 of 2,freethrowmade,69,a8625e4b-4ae6-4062-a7c1-0b6e1f4ae211,basketball_play,1775447232,160,True,2026-04-06 03:47:12+00:00,3,300.0,1860.0,31.0,286
2,56,quarter,3,a8625e4b-4ae6-4062-a7c1-0b6e1f4ae211,83,5:00,"Rockets lineup change (Kevin Durant, Aaron Holiday, Amen Thompson, Tari Eason, Jae'Sean Tate)",lineupchange,69,,basketball_play,1775447259,159,True,2026-04-06 03:47:39+00:00,3,300.0,1860.0,31.0,287
2,55,quarter,3,a8625e4b-4ae6-4062-a7c1-0b6e1f4ae211,84,5:00,Kevin Durant makes regular free throw 2 of 2,freethrowmade,69,502c629b-4da7-40fd-92ab-20cb55411c35,basketball_play,1775447259,158,True,2026-04-06 03:47:39+00:00,3,300.0,1860.0,31.0,288
2,54,quarter,3,502c629b-4da7-40fd-92ab-20cb55411c35,84,4:49,Stephen Curry misses three point jump shot,threepointmiss,69,,basketball_play,1775447272,157,True,2026-04-06 03:47:52+00:00,3,289.0,1871.0,31.183333333333334,289
2,53,quarter,3,a8625e4b-4ae6-4062-a7c1-0b6e1f4ae211,84,4:46,Amen Thompson defensive rebound,rebound,69,a8625e4b-4ae6-4062-a7c1-0b6e1f4ae211,basketball_play,1775447275,156,True,2026-04-06 03:47:55+00:00,3,286.0,1874.0,31.233333333333334,290
2,52,quarter,3,a8625e4b-4ae6-4062-a7c1-0b6e1f4ae211,84,4:36,Kevin Durant turnover (lost ball) (Stephen Curry steals),turnover,69,502c629b-4da7-40fd-92ab-20cb55411c35,basketball_play,1775447285,155,True,2026-04-06 03:48:05+00:00,3,276.0,1884.0,31.4,291
2,51,quarter,3,502c629b-4da7-40fd-92ab-20cb55411c35,84,4:33,Brandin Podziemski makes two point running layup (Stephen Curry assists),twopointmade,71,a8625e4b-4ae6-4062-a7c1-0b6e1f4ae211,basketball_play,1775447288,154,True,2026-04-06 03:48:08+00:00,3,273.0,1887.0,31.45,292
2,50,quarter,3,,84,4:29,Stoppage (Out of bounds),stoppage,71,,basketball_play,1775447293,153,True,2026-04-06 03:48:13+00:00,3,269.0,1891.0,31.516666666666666,293
2,49,quarter,3,a8625e4b-4ae6-4062-a7c1-0b6e1f4ae211,84,4:11,Tari Eason misses two point fadeaway jump shot,twopointmiss,71,,basketball_play,1775447318,152,True,2026-04-06 03:48:38+00:00,3,251.0,1909.0,31.816666666666666,294
2,48,quarter,3,502c629b-4da7-40fd-92ab-20cb55411c35,84,4:10,Warriors defensive rebound,rebound,71,502c629b-4da7-40fd-92ab-20cb55411c35,basketball_play,1775447319,151,True,2026-04-06 03:48:39+00:00,3,250.0,1910.0,31.833333333333332,295
2,47,quarter,3,,84,4:10,Stoppage (Out of bounds),stoppage,71,,basketball_play,1775447325,150,True,2026-04-06 03:48:45+00:00,3,250.0,1910.0,31.833333333333332,296
2,46,quarter,3,502c629b-4da7-40fd-92ab-20cb55411c35,84,4:10,"Warriors lineup change (Gui Santos, Stephen Curry, Gary Payton II, Draymond Green, Seth Curry)",lineupchange,71,,basketball_play,1775447356,149,True,2026-04-06 03:49:16+00:00,3,250.0,1910.0,31.833333333333332,297
2,45,quarter,3,502c629b-4da7-40fd-92ab-20cb55411c35,84,3:57,Gary Payton II misses two point driving hook shot,twopointmiss,71,,basketball_play,1775447356,148,True,2026-04-06 03:49:16+00:00,3,237.0,1923.0,32.05,298
2,44,quarter,3,a8625e4b-4ae6-4062-a7c1-0b6e1f4ae211,84,3:55,Kevin Durant defensive rebound,rebound,71,a8625e4b-4ae6-4062-a7c1-0b6e1f4ae211,basketball_play,1775447358,147,True,2026-04-06 03:49:18+00:00,3,235.0,1925.0,32.083333333333336,299
2,43,quarter,3,a8625e4b-4ae6-4062-a7c1-0b6e1f4ae211,84,3:51,Tari Eason turnover (lost ball) (Gui Santos steals),turnover,71,502c629b-4da7-40fd-92ab-20cb55411c35,basketball_play,1775447362,146,True,2026-04-06 03:49:22+00:00,3,231.0,1929.0,32.15,300
2,42,quarter,3,502c629b-4da7-40fd-92ab-20cb55411c35,84,3:32,Stephen Curry makes two point driving floating bank jump shot (Gary Payton II assists),twopointmade,73,a8625e4b-4ae6-4062-a7c1-0b6e1f4ae211,basketball_play,1775447381,145,True,2026-04-06 03:49:41+00:00,3,212.0,1948.0,32.46666666666667,301
2,41,quarter,3,a8625e4b-4ae6-4062-a7c1-0b6e1f4ae211,84,3:12,Tari Eason misses three point jump shot,threepointmiss,73,,basketball_play,1775447401,144,True,2026-04-06 03:50:01+00:00,3,192.0,1968.0,32.8,302
2,40,quarter,3,502c629b-4da7-40fd-92ab-20cb55411c35,84,3:09,Gui Santos defensive rebound,rebound,73,502c629b-4da7-40fd-92ab-20cb55411c35,basketball_play,1775447404,143,True,2026-04-06 03:50:04+00:00,3,189.0,1971.0,32.85,303
2,39,quarter,3,a8625e4b-4ae6-4062-a7c1-0b6e1f4ae211,84,3:00,Amen Thompson personal foul (Gary Payton II draws the foul),personalfoul,73,502c629b-4da7-40fd-92ab-20cb55411c35,basketball_play,1775447415,142,True,2026-04-06 03:50:15+00:00,3,180.0,1980.0,33.0,304
2,38,quarter,3,502c629b-4da7-40fd-92ab-20cb55411c35,84,3:00,Gary Payton II makes regular free throw 1 of 2,freethrowmade,74,502c629b-4da7-40fd-92ab-20cb55411c35,basketball_play,1775447457,141,True,2026-04-06 03:50:57+00:00,3,180.0,1980.0,33.0,305
2,37,quarter,3,a8625e4b-4ae6-4062-a7c1-0b6e1f4ae211,84,3:00,"Rockets lineup change (Kevin Durant, Alperen Sengun, Aaron Holiday, Tari Eason, Josh Okogie)",lineupchange,74,,basketball_play,1775447459,140,True,2026-04-06 03:50:59+00:00,3,180.0,1980.0,33.0,306
2,36,quarter,3,502c629b-4da7-40fd-92ab-20cb55411c35,84,3:00,"Warriors lineup change (Gui Santos, Stephen Curry, Gary Payton II, Kristaps Porzingis, Seth Curry)",lineupchange,74,,basketball_play,1775447459,139,True,2026-04-06 03:50:59+00:00,3,180.0,1980.0,33.0,307
2,35,quarter,3,502c629b-4da7-40fd-92ab-20cb55411c35,84,3:00,Gary Payton II makes regular free throw 2 of 2,freethrowmade,75,a8625e4b-4ae6-4062-a7c1-0b6e1f4ae211,basketball_play,1775447483,138,True,2026-04-06 03:51:23+00:00,3,180.0,1980.0,33.0,308
2,34,quarter,3,a8625e4b-4ae6-4062-a7c1-0b6e1f4ae211,84,2:36,Rockets turnover (shot clock violation),turnover,75,502c629b-4da7-40fd-92ab-20cb55411c35,basketball_play,1775447511,137,True,2026-04-06 03:51:51+00:00,3,156.0,2004.0,33.4,309
2,33,quarter,3,a8625e4b-4ae6-4062-a7c1-0b6e1f4ae211,84,2:36,Rockets 60 second timeout,teamtimeout,75,,basketball_play,1775447540,136,True,2026-04-06 03:52:20+00:00,3,156.0,2004.0,33.4,310
2,32,quarter,3,502c629b-4da7-40fd-92ab-20cb55411c35,84,2:17,Stephen Curry makes two point driving finger roll layup,twopointmade,77,a8625e4b-4ae6-4062-a7c1-0b6e1f4ae211,basketball_play,1775447767,135,True,2026-04-06 03:56:07+00:00,3,137.0,2023.0,33.71666666666667,311
2,31,quarter,3,a8625e4b-4ae6-4062-a7c1-0b6e1f4ae211,84,2:17,Alperen Sengun shooting foul (Stephen Curry draws the foul),shootingfoul,77,502c629b-4da7-40fd-92ab-20cb55411c35,basketball_play,1775447771,134,True,2026-04-06 03:56:11+00:00,3,137.0,2023.0,33.71666666666667,312
