period_index,event_index,period_type,period_number,attribution,away_points,clock,description,event_type,home_points,possession,type,wall_clock,pbp_source_row,has_wall_clock,event_ts_utc,period_sequence,game_clock_seconds_remaining,game_elapsed_seconds,game_elapsed_minutes,pbp_chronological_index
3,113,quarter,2,a8625e4b-4ae6-4062-a7c1-0b6e1f4ae211,31,10:57,Jabari Smith Jr. makes three point jump shot (Aaron Holiday assists),threepointmade,31,502c629b-4da7-40fd-92ab-20cb55411c35,basketball_play,1775443344,340,True,2026-04-06 02:42:24+00:00,2,657.0,783.0,13.05,106
3,112,quarter,2,502c629b-4da7-40fd-92ab-20cb55411c35,31,10:35,Brandin Podziemski misses three point stepback jump shot,threepointmiss,31,,basketball_play,1775443366,339,True,2026-04-06 02:42:46+00:00,2,635.0,805.0,13.416666666666666,107
3,111,quarter,2,a8625e4b-4ae6-4062-a7c1-0b6e1f4ae211,31,10:33,Alperen Sengun defensive rebound,rebound,31,a8625e4b-4ae6-4062-a7c1-0b6e1f4ae211,basketball_play,1775443368,338,True,2026-04-06 02:42:48+00:00,2,633.0,807.0,13.45,108
3,110,quarter,2,a8625e4b-4ae6-4062-a7c1-0b6e1f4ae211,34,10:27,Alperen Sengun makes three point pullup jump shot,threepointmade,31,502c629b-4da7-40fd-92ab-20cb55411c35,basketball_play,1775443375,337,True,2026-04-06 02:42:55+00:00,2,627.0,813.0,13.55,109
3,109,quarter,2,502c629b-4da7-40fd-92ab-20cb55411c35,34,10:02,Gui Santos turnover (traveling),turnover,31,a8625e4b-4ae6-4062-a7c1-0b6e1f4ae211,basketball_play,1775443399,336,True,2026-04-06 02:43:19+00:00,2,602.0,838.0,13.966666666666667,110
3,108,quarter,2,502c629b-4da7-40fd-92ab-20cb55411c35,34,10:02,"Warriors lineup change (Gui Santos, Brandin Podziemski, Kristaps Porzingis, Will Richard, Pat Spencer)",lineupchange,31,,basketball_play,1775443428,335,True,2026-04-06 02:43:48+00:00,2,602.0,838.0,13.966666666666667,111
3,107,quarter,2,a8625e4b-4ae6-4062-a7c1-0b6e1f4ae211,34,9:49,Alperen Sengun misses two point driving layup,twopointmiss,31,,basketball_play,1775443428,334,True,2026-04-06 02:43:48+00:00,2,589.0,851.0,14.183333333333334,112
3,106,quarter,2,a8625e4b-4ae6-4062-a7c1-0b6e1f4ae211,34,9:47,Alperen Sengun offensive rebound,rebound,31,a8625e4b-4ae6-4062-a7c1-0b6e1f4ae211,basketball_play,1775443431,333,True,2026-04-06 02:43:51+00:00,2,587.0,853.0,14.216666666666667,113
3,105,quarter,2,a8625e4b-4ae6-4062-a7c1-0b6e1f4ae211,37,9:46,Aaron Holiday makes three point jump shot (Alperen Sengun assists),threepointmade,31,502c629b-4da7-40fd-92ab-20cb55411c35,basketball_play,1775443432,332,True,2026-04-06 02:43:52+00:00,2,586.0,854.0,14.233333333333333,114
3,104,quarter,2,502c629b-4da7-40fd-92ab-20cb55411c35,37,9:46,Warriors 60 second timeout,teamtimeout,31,,basketball_play,1775443444,331,True,2026-04-06 02:44:04+00:00,2,586.0,854.0,14.233333333333333,115
3,103,quarter,2,502c629b-4da7-40fd-92ab-20cb55411c35,37,9:46,"Warriors lineup change (Gui Santos, Brandin Podziemski, Kristaps Porzingis, Seth Curry, Pat Spencer)",lineupchange,31,,basketball_play,1775443662,330,True,2026-04-06 02:47:42+00:00,2,586.0,854.0,14.233333333333333,116
3,102,quarter,2,a8625e4b-4ae6-4062-a7c1-0b6e1f4ae211,37,9:30,Alperen Sengun shooting foul (Gui Santos draws the foul),shootingfoul,31,502c629b-4da7-40fd-92ab-20cb55411c35,basketball_play,1775443662,329,True,2026-04-06 02:47:42+00:00,2,570.0,870.0,14.5,117
3,101,quarter,2,502c629b-4da7-40fd-92ab-20cb55411c35,37,9:30,Gui Santos makes regular free throw 1 of 2,freethrowmade,32,502c629b-4da7-40fd-92ab-20cb55411c35,basketball_play,1775443693,328,True,2026-04-06 02:48:13+00:00,2,570.0,870.0,14.5,118
3,100,quarter,2,502c629b-4da7-40fd-92ab-20cb55411c35,37,9:30,Gui Santos makes regular free throw 2 of 2,freethrowmade,33,a8625e4b-4ae6-4062-a7c1-0b6e1f4ae211,basketball_play,1775443712,327,True,2026-04-06 02:48:32+00:00,2,570.0,870.0,14.5,119
3,99,quarter,2,a8625e4b-4ae6-4062-a7c1-0b6e1f4ae211,40,9:13,Jabari Smith Jr. makes three point jump shot (Amen Thompson assists),threepointmade,33,502c629b-4da7-40fd-92ab-20cb55411c35,basketball_play,1775443732,326,True,2026-04-06 02:48:52+00:00,2,553.0,887.0,14.783333333333333,120
3,98,quarter,2,a8625e4b-4ae6-4062-a7c1-0b6e1f4ae211,40,8:51,Jabari Smith Jr. shooting foul (Kristaps Porzingis draws the foul),shootingfoul,33,502c629b-4da7-40fd-92ab-20cb55411c35,basketball_play,1775443755,325,True,2026-04-06 02:49:15+00:00,2,531.0,909.0,15.15,121
3,97,quarter,2,502c629b-4da7-40fd-92ab-20cb55411c35,40,8:51,Kristaps Porzingis makes regular free throw 1 of 2,freethrowmade,34,502c629b-4da7-40fd-92ab-20cb55411c35,basketball_play,1775443790,324,True,2026-04-06 02:49:50+00:00,2,531.0,909.0,15.15,122
3,96,quarter,2,a8625e4b-4ae6-4062-a7c1-0b6e1f4ae211,40,8:51,"Rockets lineup change (Reed Sheppard, Alperen Sengun, Amen Thompson, Josh Okogie, Jabari Smith Jr.)",lineupchange,34,,basketball_play,1775443790,323,True,2026-04-06 02:49:50+00:00,2,531.0,909.0,15.15,123
3,95,quarter,2,502c629b-4da7-40fd-92ab-20cb55411c35,40,8:51,Kristaps Porzingis makes regular free throw 2 of 2,freethrowmade,35,a8625e4b-4ae6-4062-a7c1-0b6e1f4ae211,basketball_play,1775443811,322,True,2026-04-06 02:50:11+00:00,2,531.0,909.0,15.15,124
3,94,quarter,2,a8625e4b-4ae6-4062-a7c1-0b6e1f4ae211,40,8:39,Alperen Sengun misses three point jump shot,threepointmiss,35,,basketball_play,1775443829,321,True,2026-04-06 02:50:29+00:00,2,519.0,921.0,15.35,125
3,93,quarter,2,502c629b-4da7-40fd-92ab-20cb55411c35,40,8:35,Kristaps Porzingis defensive rebound,rebound,35,502c629b-4da7-40fd-92ab-20cb55411c35,basketball_play,1775443833,320,True,2026-04-06 02:50:33+00:00,2,515.0,925.0,15.416666666666666,126
3,92,quarter,2,502c629b-4da7-40fd-92ab-20cb55411c35,40,8:28,Gui Santos misses three point jump shot,threepointmiss,35,,basketball_play,1775443840,319,True,2026-04-06 02:50:40+00:00,2,508.0,932.0,15.533333333333333,127
3,91,quarter,2,a8625e4b-4ae6-4062-a7c1-0b6e1f4ae211,40,8:24,Josh Okogie defensive rebound,rebound,35,a8625e4b-4ae6-4062-a7c1-0b6e1f4ae211,basketball_play,1775443844,318,True,2026-04-06 02:50:44+00:00,2,504.0,936.0,15.6,128
3,90,quarter,2,a8625e4b-4ae6-4062-a7c1-0b6e1f4ae211,40,8:20,Reed Sheppard turnover (bad pass) (Pat Spencer steals),turnover,35,502c629b-4da7-40fd-92ab-20cb55411c35,basketball_play,1775443848,317,True,2026-04-06 02:50:48+00:00,2,500.0,940.0,15.666666666666666,129
3,89,quarter,2,502c629b-4da7-40fd-92ab-20cb55411c35,40,8:07,Gui Santos turnover (lost ball) (Reed Sheppard steals),turnover,35,a8625e4b-4ae6-4062-a7c1-0b6e1f4ae211,basketball_play,1775443860,316,True,2026-04-06 02:51:00+00:00,2,487.0,953.0,15.883333333333333,130
3,88,quarter,2,a8625e4b-4ae6-4062-a7c1-0b6e1f4ae211,40,8:04,Jabari Smith Jr. offensive foul (Charge) (Brandin Podziemski draws the foul),offensivefoul,35,502c629b-4da7-40fd-92ab-20cb55411c35,basketball_play,1775443866,315,True,2026-04-06 02:51:06+00:00,2,484.0,956.0,15.933333333333334,131
3,87,quarter,2,a8625e4b-4ae6-4062-a7c1-0b6e1f4ae211,40,8:04,Jabari Smith Jr. turnover (offensive foul),turnover,35,502c629b-4da7-40fd-92ab-20cb55411c35,basketball_play,1775443866,314,True,2026-04-06 02:51:06+00:00,2,484.0,956.0,15.933333333333334,132
3,86,quarter,2,a8625e4b-4ae6-4062-a7c1-0b6e1f4ae211,40,8:04,"Rockets lineup change (Reed Sheppard, Alperen Sengun, Amen Thompson, Tari Eason, Josh Okogie)",lineupchange,35,,basketball_play,1775443908,313,True,2026-04-06 02:51:48+00:00,2,484.0,956.0,15.933333333333334,133
3,85,quarter,2,502c629b-4da7-40fd-92ab-20cb55411c35,40,7:50,Gui Santos misses two point driving layup,twopointmiss,35,,basketball_play,1775443908,312,True,2026-04-06 02:51:48+00:00,2,470.0,970.0,16.166666666666668,134
3,84,quarter,2,502c629b-4da7-40fd-92ab-20cb55411c35,40,7:50,Warriors offensive rebound,rebound,35,502c629b-4da7-40fd-92ab-20cb55411c35,basketball_play,1775443908,311,True,2026-04-06 02:51:48+00:00,2,470.0,970.0,16.166666666666668,135
3,83,quarter,2,,40,7:50,Stoppage (Out of bounds),stoppage,35,,basketball_play,1775443912,310,True,2026-04-06 02:51:52+00:00,2,470.0,970.0,16.166666666666668,136
3,82,quarter,2,502c629b-4da7-40fd-92ab-20cb55411c35,40,7:50,"Warriors lineup change (Gui Santos, Brandin Podziemski, Draymond Green, Seth Curry, Pat Spencer)",lineupchange,35,,basketball_play,1775443943,309,True,2026-04-06 02:52:23+00:00,2,470.0,970.0,16.166666666666668,137
3,81,quarter,2,,40,7:47,Stoppage (Out of bounds),stoppage,35,,basketball_play,1775443943,308,True,2026-04-06 02:52:23+00:00,2,467.0,973.0,16.216666666666665,138
3,80,quarter,2,a8625e4b-4ae6-4062-a7c1-0b6e1f4ae211,40,7:41,Josh Okogie shooting foul (Seth Curry draws the foul),shootingfoul,35,502c629b-4da7-40fd-92ab-20cb55411c35,basketball_play,1775443963,307,True,2026-04-06 02:52:43+00:00,2,461.0,979.0,16.316666666666666,139
3,79,quarter,2,a8625e4b-4ae6-4062-a7c1-0b6e1f4ae211,40,7:41,Rockets 60 second timeout,teamtimeout,35,,basketball_play,1775443993,306,True,2026-04-06 02:53:13+00:00,2,461.0,979.0,16.316666666666666,140
3,78,quarter,2,,40,7:41,Instant replay (Challenge: Ruling Upheld),review,35,,basketball_play,1775443997,305,True,2026-04-06 02:53:17+00:00,2,461.0,979.0,16.316666666666666,141
3,77,quarter,2,502c629b-4da7-40fd-92ab-20cb55411c35,40,7:41,Seth Curry makes regular free throw 1 of 3,freethrowmade,36,502c629b-4da7-40fd-92ab-20cb55411c35,basketball_play,1775444208,304,True,2026-04-06 02:56:48+00:00,2,461.0,979.0,16.316666666666666,142
3,76,quarter,2,502c629b-4da7-40fd-92ab-20cb55411c35,40,7:41,Seth Curry makes regular free throw 2 of 3,freethrowmade,37,502c629b-4da7-40fd-92ab-20cb55411c35,basketball_play,1775444219,303,True,2026-04-06 02:56:59+00:00,2,461.0,979.0,16.316666666666666,143
3,75,quarter,2,502c629b-4da7-40fd-92ab-20cb55411c35,40,7:41,Seth Curry makes regular free throw 3 of 3,freethrowmade,38,a8625e4b-4ae6-4062-a7c1-0b6e1f4ae211,basketball_play,1775444232,302,True,2026-04-06 02:57:12+00:00,2,461.0,979.0,16.316666666666666,144
3,74,quarter,2,a8625e4b-4ae6-4062-a7c1-0b6e1f4ae211,40,7:35,Josh Okogie turnover (lost ball) (Seth Curry steals),turnover,38,502c629b-4da7-40fd-92ab-20cb55411c35,basketball_play,1775444241,301,True,2026-04-06 02:57:21+00:00,2,455.0,985.0,16.416666666666668,145
3,73,quarter,2,502c629b-4da7-40fd-92ab-20cb55411c35,40,7:32,Seth Curry misses three point running pullup jump shot,threepointmiss,38,,basketball_play,1775444244,300,True,2026-04-06 02:57:24+00:00,2,452.0,988.0,16.466666666666665,146
3,72,quarter,2,a8625e4b-4ae6-4062-a7c1-0b6e1f4ae211,40,7:28,Tari Eason defensive rebound,rebound,38,a8625e4b-4ae6-4062-a7c1-0b6e1f4ae211,basketball_play,1775444247,299,True,2026-04-06 02:57:27+00:00,2,448.0,992.0,16.533333333333335,147
3,71,quarter,2,a8625e4b-4ae6-4062-a7c1-0b6e1f4ae211,40,7:10,Alperen Sengun misses three point stepback jump shot,threepointmiss,38,,basketball_play,1775444266,298,True,2026-04-06 02:57:46+00:00,2,430.0,1010.0,16.833333333333332,148
3,70,quarter,2,502c629b-4da7-40fd-92ab-20cb55411c35,40,7:06,Pat Spencer defensive rebound,rebound,38,502c629b-4da7-40fd-92ab-20cb55411c35,basketball_play,1775444270,297,True,2026-04-06 02:57:50+00:00,2,426.0,1014.0,16.9,149
3,69,quarter,2,502c629b-4da7-40fd-92ab-20cb55411c35,40,6:57,Draymond Green makes two point driving layup (Pat Spencer assists),twopointmade,40,a8625e4b-4ae6-4062-a7c1-0b6e1f4ae211,basketball_play,1775444279,296,True,2026-04-06 02:57:59+00:00,2,417.0,1023.0,17.05,150
3,68,quarter,2,a8625e4b-4ae6-4062-a7c1-0b6e1f4ae211,40,6:38,Tari Eason misses two point driving floating jump shot,twopointmiss,40,,basketball_play,1775444298,295,True,2026-04-06 02:58:18+00:00,2,398.0,1042.0,17.366666666666667,151
3,67,quarter,2,502c629b-4da7-40fd-92ab-20cb55411c35,40,6:35,Draymond Green defensive rebound,rebound,40,502c629b-4da7-40fd-92ab-20cb55411c35,basketball_play,1775444301,294,True,2026-04-06 02:58:21+00:00,2,395.0,1045.0,17.416666666666668,152
3,66,quarter,2,502c629b-4da7-40fd-92ab-20cb55411c35,40,6:21,Brandin Podziemski makes two point cutting layup (Draymond Green assists),twopointmade,42,a8625e4b-4ae6-4062-a7c1-0b6e1f4ae211,basketball_play,1775444315,293,True,2026-04-06 02:58:35+00:00,2,381.0,1059.0,17.65,153
3,65,quarter,2,a8625e4b-4ae6-4062-a7c1-0b6e1f4ae211,40,6:19,Rockets 60 second timeout,teamtimeout,42,,basketball_play,1775444323,292,True,2026-04-06 02:58:43+00:00,2,379.0,1061.0,17.683333333333334,154
3,64,quarter,2,a8625e4b-4ae6-4062-a7c1-0b6e1f4ae211,40,6:19,"Rockets lineup change (Reed Sheppard, Kevin Durant, Tari Eason, Josh Okogie, Jae'Sean Tate)",lineupchange,42,,basketball_play,1775444381,291,True,2026-04-06 02:59:41+00:00,2,379.0,1061.0,17.683333333333334,155
3,63,quarter,2,502c629b-4da7-40fd-92ab-20cb55411c35,40,6:19,"Warriors lineup change (Stephen Curry, Brandin Podziemski, Gary Payton II, Draymond Green, Seth Curry)",lineupchange,42,,basketball_play,1775444381,290,True,2026-04-06 02:59:41+00:00,2,379.0,1061.0,17.683333333333334,156
3,62,quarter,2,a8625e4b-4ae6-4062-a7c1-0b6e1f4ae211,40,6:03,Kevin Durant misses three point pullup jump shot,threepointmiss,42,,basketball_play,1775444458,289,True,2026-04-06 03:00:58+00:00,2,363.0,1077.0,17.95,157
3,61,quarter,2,a8625e4b-4ae6-4062-a7c1-0b6e1f4ae211,40,5:59,Jae'Sean Tate offensive rebound,rebound,42,a8625e4b-4ae6-4062-a7c1-0b6e1f4ae211,basketball_play,1775444462,288,True,2026-04-06 03:01:02+00:00,2,359.0,1081.0,18.016666666666666,158
3,60,quarter,2,a8625e4b-4ae6-4062-a7c1-0b6e1f4ae211,40,5:53,Tari Eason misses three point jump shot,threepointmiss,42,,basketball_play,1775444469,287,True,2026-04-06 03:01:09+00:00,2,353.0,1087.0,18.116666666666667,159
3,59,quarter,2,a8625e4b-4ae6-4062-a7c1-0b6e1f4ae211,40,5:48,Jae'Sean Tate offensive rebound,rebound,42,a8625e4b-4ae6-4062-a7c1-0b6e1f4ae211,basketball_play,1775444474,286,True,2026-04-06 03:01:14+00:00,2,348.0,1092.0,18.2,160
3,58,quarter,2,a8625e4b-4ae6-4062-a7c1-0b6e1f4ae211,40,5:42,Kevin Durant misses two point turnaround fadeaway jump shot,twopointmiss,42,,basketball_play,1775444479,285,True,2026-04-06 03:01:19+00:00,2,342.0,1098.0,18.3,161
3,57,quarter,2,a8625e4b-4ae6-4062-a7c1-0b6e1f4ae211,40,5:40,Rockets offensive rebound,rebound,42,a8625e4b-4ae6-4062-a7c1-0b6e1f4ae211,basketball_play,1775444481,284,True,2026-04-06 03:01:21+00:00,2,340.0,1100.0,18.333333333333332,162
3,56,quarter,2,502c629b-4da7-40fd-92ab-20cb55411c35,40,5:40,Draymond Green personal foul (Loose ball) (Josh Okogie draws the foul),personalfoul,42,a8625e4b-4ae6-4062-a7c1-0b6e1f4ae211,basketball_play,1775444491,283,True,2026-04-06 03:01:31+00:00,2,340.0,1100.0,18.333333333333332,163
3,55,quarter,2,a8625e4b-4ae6-4062-a7c1-0b6e1f4ae211,40,5:32,Jae'Sean Tate misses two point driving hook shot,twopointmiss,42,,basketball_play,1775444512,282,True,2026-04-06 03:01:52+00:00,2,332.0,1108.0,18.466666666666665,164
3,54,quarter,2,502c629b-4da7-40fd-92ab-20cb55411c35,40,5:27,Stephen Curry defensive rebound,rebound,42,502c629b-4da7-40fd-92ab-20cb55411c35,basketball_play,1775444517,281,True,2026-04-06 03:01:57+00:00,2,327.0,1113.0,18.55,165
3,53,quarter,2,502c629b-4da7-40fd-92ab-20cb55411c35,40,5:23,Seth Curry turnover (lost ball) (Tari Eason steals),turnover,42,a8625e4b-4ae6-4062-a7c1-0b6e1f4ae211,basketball_play,1775444520,280,True,2026-04-06 03:02:00+00:00,2,323.0,1117.0,18.616666666666667,166
3,52,quarter,2,502c629b-4da7-40fd-92ab-20cb55411c35,40,5:19,Draymond Green shooting foul (Kevin Durant draws the foul),shootingfoul,42,a8625e4b-4ae6-4062-a7c1-0b6e1f4ae211,basketball_play,1775444526,279,True,2026-04-06 03:02:06+00:00,2,319.0,1121.0,18.683333333333334,167
3,51,quarter,2,a8625e4b-4ae6-4062-a7c1-0b6e1f4ae211,41,5:19,Kevin Durant makes regular free throw 1 of 2,freethrowmade,42,a8625e4b-4ae6-4062-a7c1-0b6e1f4ae211,basketball_play,1775444555,278,True,2026-04-06 03:02:35+00:00,2,319.0,1121.0,18.683333333333334,168
3,50,quarter,2,a8625e4b-4ae6-4062-a7c1-0b6e1f4ae211,42,5:19,Kevin Durant makes regular free throw 2 of 2,freethrowmade,42,502c629b-4da7-40fd-92ab-20cb55411c35,basketball_play,1775444555,277,True,2026-04-06 03:02:35+00:00,2,319.0,1121.0,18.683333333333334,169
3,49,quarter,2,502c629b-4da7-40fd-92ab-20cb55411c35,42,5:19,"Warriors lineup change (De'Anthony Melton, Stephen Curry, Brandin Podziemski, Gary Payton II, Draymond Green)",lineupchange,42,,basketball_play,1775444591,276,True,2026-04-06 03:03:11+00:00,2,319.0,1121.0,18.683333333333334,170
3,48,quarter,2,502c629b-4da7-40fd-92ab-20cb55411c35,42,5:09,Stephen Curry makes three point pullup jump shot,threepointmade,45,a8625e4b-4ae6-4062-a7c1-0b6e1f4ae211,basketball_play,1775444591,275,True,2026-04-06 03:03:11+00:00,2,309.0,1131.0,18.85,171
3,47,quarter,2,a8625e4b-4ae6-4062-a7c1-0b6e1f4ae211,42,4:49,De'Anthony Melton blocks Tari Eason's two point driving layup,twopointmiss,45,,basketball_play,1775444611,274,True,2026-04-06 03:03:31+00:00,2,289.0,1151.0,19.183333333333334,172
3,46,quarter,2,502c629b-4da7-40fd-92ab-20cb55411c35,42,4:49,Warriors defensive rebound,rebound,45,502c629b-4da7-40fd-92ab-20cb55411c35,basketball_play,1775444611,273,True,2026-04-06 03:03:31+00:00,2,289.0,1151.0,19.183333333333334,173
3,45,quarter,2,,42,4:49,Stoppage (Out of bounds),stoppage,45,,basketball_play,1775444617,272,True,2026-04-06 03:03:37+00:00,2,289.0,1151.0,19.183333333333334,174
3,44,quarter,2,a8625e4b-4ae6-4062-a7c1-0b6e1f4ae211,42,4:49,"Rockets lineup change (Reed Sheppard, Kevin Durant, Amen Thompson, Tari Eason, Jae'Sean Tate)",lineupchange,45,,basketball_play,1775444640,271,True,2026-04-06 03:04:00+00:00,2,289.0,1151.0,19.183333333333334,175
3,43,quarter,2,a8625e4b-4ae6-4062-a7c1-0b6e1f4ae211,42,4:41,Amen Thompson personal foul (Gary Payton II draws the foul),personalfoul,45,502c629b-4da7-40fd-92ab-20cb55411c35,basketball_play,1775444640,270,True,2026-04-06 03:04:00+00:00,2,281.0,1159.0,19.316666666666666,176
3,42,quarter,2,a8625e4b-4ae6-4062-a7c1-0b6e1f4ae211,42,4:41,"Rockets lineup change (Reed Sheppard, Kevin Durant, Amen Thompson, Jae'Sean Tate, Jabari Smith Jr.)",lineupchange,45,,basketball_play,1775444675,269,True,2026-04-06 03:04:35+00:00,2,281.0,1159.0,19.316666666666666,177
3,41,quarter,2,502c629b-4da7-40fd-92ab-20cb55411c35,42,4:30,Stephen Curry makes two point driving finger roll layup,twopointmade,47,a8625e4b-4ae6-4062-a7c1-0b6e1f4ae211,basketball_play,1775444675,268,True,2026-04-06 03:04:35+00:00,2,270.0,1170.0,19.5,178
3,40,quarter,2,502c629b-4da7-40fd-92ab-20cb55411c35,42,4:16,Gary Payton II personal foul (Amen Thompson draws the foul),personalfoul,47,a8625e4b-4ae6-4062-a7c1-0b6e1f4ae211,basketball_play,1775444692,267,True,2026-04-06 03:04:52+00:00,2,256.0,1184.0,19.733333333333334,179
3,39,quarter,2,502c629b-4da7-40fd-92ab-20cb55411c35,42,4:16,"Warriors lineup change (De'Anthony Melton, Gui Santos, Stephen Curry, Gary Payton II, Draymond Green)",lineupchange,47,,basketball_play,1775444722,266,True,2026-04-06 03:05:22+00:00,2,256.0,1184.0,19.733333333333334,180
3,38,quarter,2,a8625e4b-4ae6-4062-a7c1-0b6e1f4ae211,45,4:08,Jabari Smith Jr. makes three point jump shot (Jae'Sean Tate assists),threepointmade,47,502c629b-4da7-40fd-92ab-20cb55411c35,basketball_play,1775444722,265,True,2026-04-06 03:05:22+00:00,2,248.0,1192.0,19.866666666666667,181
3,37,quarter,2,502c629b-4da7-40fd-92ab-20cb55411c35,45,3:56,De'Anthony Melton turnover (lost ball) (Amen Thompson steals),turnover,47,a8625e4b-4ae6-4062-a7c1-0b6e1f4ae211,basketball_play,1775444734,264,True,2026-04-06 03:05:34+00:00,2,236.0,1204.0,20.066666666666666,182
3,36,quarter,2,a8625e4b-4ae6-4062-a7c1-0b6e1f4ae211,47,3:52,Kevin Durant makes two point running jump shot (Amen Thompson assists),twopointmade,47,502c629b-4da7-40fd-92ab-20cb55411c35,basketball_play,1775444738,263,True,2026-04-06 03:05:38+00:00,2,232.0,1208.0,20.133333333333333,183
3,35,quarter,2,502c629b-4da7-40fd-92ab-20cb55411c35,47,3:38,Stephen Curry misses three point pullup jump shot,threepointmiss,47,,basketball_play,1775444752,262,True,2026-04-06 03:05:52+00:00,2,218.0,1222.0,20.366666666666667,184
3,34,quarter,2,a8625e4b-4ae6-4062-a7c1-0b6e1f4ae211,47,3:35,Jabari Smith Jr. defensive rebound,rebound,47,a8625e4b-4ae6-4062-a7c1-0b6e1f4ae211,basketball_play,1775444755,261,True,2026-04-06 03:05:55+00:00,2,215.0,1225.0,20.416666666666668,185
3,33,quarter,2,a8625e4b-4ae6-4062-a7c1-0b6e1f4ae211,49,3:25,Kevin Durant makes two point fadeaway jump shot,twopointmade,47,502c629b-4da7-40fd-92ab-20cb55411c35,basketball_play,1775444765,260,True,2026-04-06 03:06:05+00:00,2,205.0,1235.0,20.583333333333332,186
3,32,quarter,2,502c629b-4da7-40fd-92ab-20cb55411c35,49,3:04,Gary Payton II misses three point jump shot,threepointmiss,47,,basketball_play,1775444786,259,True,2026-04-06 03:06:26+00:00,2,184.0,1256.0,20.933333333333334,187
3,31,quarter,2,a8625e4b-4ae6-4062-a7c1-0b6e1f4ae211,49,3:01,Kevin Durant defensive rebound,rebound,47,a8625e4b-4ae6-4062-a7c1-0b6e1f4ae211,basketball_play,1775444789,258,True,2026-04-06 03:06:29+00:00,2,181.0,1259.0,20.983333333333334,188
3,30,quarter,2,a8625e4b-4ae6-4062-a7c1-0b6e1f4ae211,51,2:54,Amen Thompson makes two point turnaround jump shot,twopointmade,47,502c629b-4da7-40fd-92ab-20cb55411c35,basketball_play,1775444797,257,True,2026-04-06 03:06:37+00:00,2,174.0,1266.0,21.1,189
3,29,quarter,2,502c629b-4da7-40fd-92ab-20cb55411c35,51,2:53,Warriors 60 second timeout,teamtimeout,47,,basketball_play,1775444808,256,True,2026-04-06 03:06:48+00:00,2,173.0,1267.0,21.116666666666667,190
3,28,quarter,2,a8625e4b-4ae6-4062-a7c1-0b6e1f4ae211,51,2:53,"Rockets lineup change (Kevin Durant, Alperen Sengun, Amen Thompson, Jae'Sean Tate, Jabari Smith Jr.)",lineupchange,47,,basketball_play,1775444868,255,True,2026-04-06 03:07:48+00:00,2,173.0,1267.0,21.116666666666667,191
3,27,quarter,2,502c629b-4da7-40fd-92ab-20cb55411c35,51,2:53,"Warriors lineup change (Gui Santos, Stephen Curry, Brandin Podziemski, Draymond Green, Kristaps Porzingis)",lineupchange,47,,basketball_play,1775444868,254,True,2026-04-06 03:07:48+00:00,2,173.0,1267.0,21.116666666666667,192
3,26,quarter,2,502c629b-4da7-40fd-92ab-20cb55411c35,51,2:32,Stephen Curry makes two point cutting layup (Draymond Green assists),twopointmade,49,a8625e4b-4ae6-4062-a7c1-0b6e1f4ae211,basketball_play,1775444922,253,True,2026-04-06 03:08:42+00:00,2,152.0,1288.0,21.466666666666665,193
3,25,quarter,2,a8625e4b-4ae6-4062-a7c1-0b6e1f4ae211,53,2:20,Amen Thompson makes two point driving floating bank jump shot,twopointmade,49,502c629b-4da7-40fd-92ab-20cb55411c35,basketball_play,1775444934,252,True,2026-04-06 03:08:54+00:00,2,140.0,1300.0,21.666666666666668,194
3,24,quarter,2,502c629b-4da7-40fd-92ab-20cb55411c35,53,2:04,Gui Santos misses three point jump shot,threepointmiss,49,,basketball_play,1775444949,251,True,2026-04-06 03:09:09+00:00,2,124.0,1316.0,21.933333333333334,195
3,23,quarter,2,a8625e4b-4ae6-4062-a7c1-0b6e1f4ae211,53,2:01,Kevin Durant defensive rebound,rebound,49,a8625e4b-4ae6-4062-a7c1-0b6e1f4ae211,basketball_play,1775444952,250,True,2026-04-06 03:09:12+00:00,2,121.0,1319.0,21.983333333333334,196
3,22,quarter,2,a8625e4b-4ae6-4062-a7c1-0b6e1f4ae211,53,1:42,Jabari Smith Jr. misses three point jump shot,threepointmiss,49,,basketball_play,1775444971,249,True,2026-04-06 03:09:31+00:00,2,102.0,1338.0,22.3,197
3,21,quarter,2,502c629b-4da7-40fd-92ab-20cb55411c35,53,1:39,Kristaps Porzingis defensive rebound,rebound,49,502c629b-4da7-40fd-92ab-20cb55411c35,basketball_play,1775444974,248,True,2026-04-06 03:09:34+00:00,2,99.0,1341.0,22.35,198
3,20,quarter,2,502c629b-4da7-40fd-92ab-20cb55411c35,53,1:29,Draymond Green misses two point driving layup,twopointmiss,49,,basketball_play,1775444985,247,True,2026-04-06 03:09:45+00:00,2,89.0,1351.0,22.516666666666666,199
3,19,quarter,2,a8625e4b-4ae6-4062-a7c1-0b6e1f4ae211,53,1:27,Amen Thompson defensive rebound,rebound,49,a8625e4b-4ae6-4062-a7c1-0b6e1f4ae211,basketball_play,1775444987,246,True,2026-04-06 03:09:47+00:00,2,87.0,1353.0,22.55,200
3,18,quarter,2,a8625e4b-4ae6-4062-a7c1-0b6e1f4ae211,53,1:17,Kevin Durant misses two point turnaround fadeaway jump shot,twopointmiss,49,,basketball_play,1775444997,245,True,2026-04-06 03:09:57+00:00,2,77.0,1363.0,22.716666666666665,201
3,17,quarter,2,502c629b-4da7-40fd-92ab-20cb55411c35,53,1:14,Warriors defensive rebound,rebound,49,502c629b-4da7-40fd-92ab-20cb55411c35,basketball_play,1775445000,244,True,2026-04-06 03:10:00+00:00,2,74.0,1366.0,22.766666666666666,202
3,16,quarter,2,,53,1:14,Stoppage (Out of bounds),stoppage,49,,basketball_play,1775445002,243,True,2026-04-06 03:10:02+00:00,2,74.0,1366.0,22.766666666666666,203
3,15,quarter,2,a8625e4b-4ae6-4062-a7c1-0b6e1f4ae211,53,1:14,"Rockets lineup change (Kevin Durant, Alperen Sengun, Aaron Holiday, Amen Thompson, Jae'Sean Tate)",lineupchange,49,,basketball_play,1775445032,242,True,2026-04-06 03:10:32+00:00,2,74.0,1366.0,22.766666666666666,204
3,14,quarter,2,502c629b-4da7-40fd-92ab-20cb55411c35,53,1:02,Kristaps Porzingis makes two point cutting layup (Draymond Green assists),twopointmade,51,a8625e4b-4ae6-4062-a7c1-0b6e1f4ae211,basketball_play,1775445032,241,True,2026-04-06 03:10:32+00:00,2,62.0,1378.0,22.966666666666665,205
3,13,quarter,2,a8625e4b-4ae6-4062-a7c1-0b6e1f4ae211,55,00:43.90,Alperen Sengun makes two point driving hook shot,twopointmade,51,502c629b-4da7-40fd-92ab-20cb55411c35,basketball_play,1775445052,240,True,2026-04-06 03:10:52+00:00,2,43.9,1396.1,23.26833333333333,206
3,12,quarter,2,502c629b-4da7-40fd-92ab-20cb55411c35,55,00:34.70,Stephen Curry misses two point turnaround fadeaway jump shot,twopointmiss,51,,basketball_play,1775445065,239,True,2026-04-06 03:11:05+00:00,2,34.7,1405.3,23.421666666666667,207
3,11,quarter,2,a8625e4b-4ae6-4062-a7c1-0b6e1f4ae211,55,00:33,Rockets defensive rebound,rebound,51,a8625e4b-4ae6-4062-a7c1-0b6e1f4ae211,basketball_play,1775445067,238,True,2026-04-06 03:11:07+00:00,2,33.0,1407.0,23.45,208
3,10,quarter,2,502c629b-4da7-40fd-92ab-20cb55411c35,55,00:33,Gui Santos personal foul (Loose ball) (Alperen Sengun draws the foul),personalfoul,51,a8625e4b-4ae6-4062-a7c1-0b6e1f4ae211,basketball_play,1775445076,237,True,2026-04-06 03:11:16+00:00,2,33.0,1407.0,23.45,209
