period_index,event_index,period_type,period_number,attribution,away_points,clock,description,event_type,home_points,possession,type,wall_clock,pbp_source_row,has_wall_clock,event_ts_utc,period_sequence,game_clock_seconds_remaining,game_elapsed_seconds,game_elapsed_minutes,pbp_chronological_index
4,111,quarter,1,90381a35-42a6-4975-851f-175418e4271a,0,12:00,"Cavaliers lineup change (Donovan Mitchell, James Harden, Dean Wade, Sam Merrill, Evan Mobley)",lineupchange,0,,basketball_play,1773792734,460,True,2026-03-18 00:12:14+00:00,1,720.0,0.0,0.0,1
4,110,quarter,1,5dc3fe01-79a4-4f2f-a953-d922ea4a6dd3,0,12:00,"Bucks lineup change (Kevin Porter Jr., Taurean Prince, Jericho Sims, Kyle Kuzma, Ryan Rollins)",lineupchange,0,,basketball_play,1773792734,459,True,2026-03-18 00:12:14+00:00,1,720.0,0.0,0.0,2
4,109,quarter,1,,0,12:00,Start of 1st Quarter,startperiod,0,,basketball_play,1773792734,458,True,2026-03-18 00:12:14+00:00,1,720.0,0.0,0.0,3
4,108,quarter,1,5dc3fe01-79a4-4f2f-a953-d922ea4a6dd3,0,12:00,Evan Mobley vs. Jericho Sims (Ryan Rollins gains possession),opentip,0,5dc3fe01-79a4-4f2f-a953-d922ea4a6dd3,basketball_play,1773792738,457,True,2026-03-18 00:12:18+00:00,1,720.0,0.0,0.0,4
4,107,quarter,1,5dc3fe01-79a4-4f2f-a953-d922ea4a6dd3,0,11:38,Evan Mobley blocks Kevin Porter Jr.'s two point driving layup,twopointmiss,0,,basketball_play,1773792755,456,True,2026-03-18 00:12:35+00:00,1,698.0,22.0,0.36666666666666664,5
4,106,quarter,1,90381a35-42a6-4975-851f-175418e4271a,0,11:34,Evan Mobley defensive rebound,rebound,0,90381a35-42a6-4975-851f-175418e4271a,basketball_play,1773792759,455,True,2026-03-18 00:12:39+00:00,1,694.0,26.0,0.43333333333333335,6
4,105,quarter,1,90381a35-42a6-4975-851f-175418e4271a,3,11:31,James Harden makes three point running jump shot (Donovan Mitchell assists),threepointmade,0,5dc3fe01-79a4-4f2f-a953-d922ea4a6dd3,basketball_play,1773792762,454,True,2026-03-18 00:12:42+00:00,1,691.0,29.0,0.48333333333333334,7
4,104,quarter,1,5dc3fe01-79a4-4f2f-a953-d922ea4a6dd3,3,11:17,Ryan Rollins makes three point jump shot (Kevin Porter Jr. assists),threepointmade,3,90381a35-42a6-4975-851f-175418e4271a,basketball_play,1773792776,453,True,2026-03-18 00:12:56+00:00,1,677.0,43.0,0.7166666666666667,8
4,103,quarter,1,90381a35-42a6-4975-851f-175418e4271a,5,11:01,Evan Mobley makes two point cutting dunk (James Harden assists),twopointmade,3,5dc3fe01-79a4-4f2f-a953-d922ea4a6dd3,basketball_play,1773792792,452,True,2026-03-18 00:13:12+00:00,1,661.0,59.0,0.9833333333333333,9
4,102,quarter,1,5dc3fe01-79a4-4f2f-a953-d922ea4a6dd3,5,10:46,Taurean Prince misses three point jump shot,threepointmiss,3,,basketball_play,1773792807,451,True,2026-03-18 00:13:27+00:00,1,646.0,74.0,1.2333333333333334,10
4,101,quarter,1,5dc3fe01-79a4-4f2f-a953-d922ea4a6dd3,5,10:44,Jericho Sims offensive rebound,rebound,3,5dc3fe01-79a4-4f2f-a953-d922ea4a6dd3,basketball_play,1773792809,450,True,2026-03-18 00:13:29+00:00,1,644.0,76.0,1.2666666666666666,11
4,100,quarter,1,5dc3fe01-79a4-4f2f-a953-d922ea4a6dd3,5,10:41,Taurean Prince misses three point jump shot,threepointmiss,3,,basketball_play,1773792812,449,True,2026-03-18 00:13:32+00:00,1,641.0,79.0,1.3166666666666667,12
4,99,quarter,1,90381a35-42a6-4975-851f-175418e4271a,5,10:41,Donovan Mitchell defensive rebound,rebound,3,90381a35-42a6-4975-851f-175418e4271a,basketball_play,1773792812,448,True,2026-03-18 00:13:32+00:00,1,641.0,79.0,1.3166666666666667,13
4,98,quarter,1,90381a35-42a6-4975-851f-175418e4271a,7,10:22,Sam Merrill makes two point floating jump shot (James Harden assists),twopointmade,3,5dc3fe01-79a4-4f2f-a953-d922ea4a6dd3,basketball_play,1773792831,447,True,2026-03-18 00:13:51+00:00,1,622.0,98.0,1.6333333333333333,14
4,97,quarter,1,5dc3fe01-79a4-4f2f-a953-d922ea4a6dd3,7,10:07,Jericho Sims makes two point cutting dunk (Kyle Kuzma assists),twopointmade,5,90381a35-42a6-4975-851f-175418e4271a,basketball_play,1773792848,446,True,2026-03-18 00:14:08+00:00,1,607.0,113.0,1.8833333333333333,15
4,96,quarter,1,90381a35-42a6-4975-851f-175418e4271a,7,10:07,Evan Mobley shooting foul (Jericho Sims draws the foul),shootingfoul,5,5dc3fe01-79a4-4f2f-a953-d922ea4a6dd3,basketball_play,1773792853,445,True,2026-03-18 00:14:13+00:00,1,607.0,113.0,1.8833333333333333,16
4,95,quarter,1,5dc3fe01-79a4-4f2f-a953-d922ea4a6dd3,7,10:07,Jericho Sims misses regular free throw 1 of 1,freethrowmiss,5,,basketball_play,1773792880,444,True,2026-03-18 00:14:40+00:00,1,607.0,113.0,1.8833333333333333,17
4,94,quarter,1,90381a35-42a6-4975-851f-175418e4271a,7,10:04,James Harden defensive rebound,rebound,5,90381a35-42a6-4975-851f-175418e4271a,basketball_play,1773792883,443,True,2026-03-18 00:14:43+00:00,1,604.0,116.0,1.9333333333333333,18
4,93,quarter,1,90381a35-42a6-4975-851f-175418e4271a,7,9:56,Dean Wade misses three point jump shot,threepointmiss,5,,basketball_play,1773792889,442,True,2026-03-18 00:14:49+00:00,1,596.0,124.0,2.066666666666667,19
4,92,quarter,1,90381a35-42a6-4975-851f-175418e4271a,7,9:52,James Harden offensive rebound,rebound,5,90381a35-42a6-4975-851f-175418e4271a,basketball_play,1773792893,441,True,2026-03-18 00:14:53+00:00,1,592.0,128.0,2.1333333333333333,20
4,91,quarter,1,90381a35-42a6-4975-851f-175418e4271a,9,9:43,Evan Mobley makes two point cutting finger roll layup (James Harden assists),twopointmade,5,5dc3fe01-79a4-4f2f-a953-d922ea4a6dd3,basketball_play,1773792902,440,True,2026-03-18 00:15:02+00:00,1,583.0,137.0,2.283333333333333,21
4,90,quarter,1,5dc3fe01-79a4-4f2f-a953-d922ea4a6dd3,9,9:30,Taurean Prince makes three point jump shot (Kevin Porter Jr. assists),threepointmade,8,90381a35-42a6-4975-851f-175418e4271a,basketball_play,1773792916,439,True,2026-03-18 00:15:16+00:00,1,570.0,150.0,2.5,22
4,89,quarter,1,90381a35-42a6-4975-851f-175418e4271a,11,9:11,Donovan Mitchell makes two point driving floating jump shot (Evan Mobley assists),twopointmade,8,5dc3fe01-79a4-4f2f-a953-d922ea4a6dd3,basketball_play,1773792934,438,True,2026-03-18 00:15:34+00:00,1,551.0,169.0,2.816666666666667,23
4,88,quarter,1,5dc3fe01-79a4-4f2f-a953-d922ea4a6dd3,11,8:53,Taurean Prince turnover (bad pass) (James Harden steals),turnover,8,90381a35-42a6-4975-851f-175418e4271a,basketball_play,1773792954,437,True,2026-03-18 00:15:54+00:00,1,533.0,187.0,3.1166666666666667,24
4,87,quarter,1,90381a35-42a6-4975-851f-175418e4271a,13,8:47,Dean Wade makes two point running layup (Sam Merrill assists),twopointmade,8,5dc3fe01-79a4-4f2f-a953-d922ea4a6dd3,basketball_play,1773792959,436,True,2026-03-18 00:15:59+00:00,1,527.0,193.0,3.216666666666667,25
4,86,quarter,1,5dc3fe01-79a4-4f2f-a953-d922ea4a6dd3,13,8:21,Kyle Kuzma misses three point pullup jump shot,threepointmiss,8,,basketball_play,1773792985,435,True,2026-03-18 00:16:25+00:00,1,501.0,219.0,3.65,26
4,85,quarter,1,90381a35-42a6-4975-851f-175418e4271a,13,8:17,Sam Merrill defensive rebound,rebound,8,90381a35-42a6-4975-851f-175418e4271a,basketball_play,1773792989,434,True,2026-03-18 00:16:29+00:00,1,497.0,223.0,3.716666666666667,27
4,84,quarter,1,5dc3fe01-79a4-4f2f-a953-d922ea4a6dd3,13,8:15,Kyle Kuzma personal foul (James Harden draws the foul),personalfoul,8,90381a35-42a6-4975-851f-175418e4271a,basketball_play,1773792994,433,True,2026-03-18 00:16:34+00:00,1,495.0,225.0,3.75,28
4,83,quarter,1,90381a35-42a6-4975-851f-175418e4271a,13,8:09,Donovan Mitchell misses two point driving floating jump shot,twopointmiss,8,,basketball_play,1773793021,432,True,2026-03-18 00:17:01+00:00,1,489.0,231.0,3.85,29
4,82,quarter,1,90381a35-42a6-4975-851f-175418e4271a,13,8:08,Evan Mobley offensive rebound,rebound,8,90381a35-42a6-4975-851f-175418e4271a,basketball_play,1773793022,431,True,2026-03-18 00:17:02+00:00,1,488.0,232.0,3.8666666666666667,30
4,81,quarter,1,90381a35-42a6-4975-851f-175418e4271a,13,8:08,Kyle Kuzma blocks Evan Mobley's two point tip layup,twopointmiss,8,,basketball_play,1773793025,430,True,2026-03-18 00:17:05+00:00,1,488.0,232.0,3.8666666666666667,31
4,80,quarter,1,5dc3fe01-79a4-4f2f-a953-d922ea4a6dd3,13,8:06,Jericho Sims defensive rebound,rebound,8,5dc3fe01-79a4-4f2f-a953-d922ea4a6dd3,basketball_play,1773793027,429,True,2026-03-18 00:17:07+00:00,1,486.0,234.0,3.9,32
4,79,quarter,1,5dc3fe01-79a4-4f2f-a953-d922ea4a6dd3,13,7:58,Donovan Mitchell blocks Ryan Rollins's two point driving layup,twopointmiss,8,,basketball_play,1773793029,428,True,2026-03-18 00:17:09+00:00,1,478.0,242.0,4.033333333333333,33
4,78,quarter,1,90381a35-42a6-4975-851f-175418e4271a,13,7:51,Sam Merrill defensive rebound,rebound,8,90381a35-42a6-4975-851f-175418e4271a,basketball_play,1773793036,427,True,2026-03-18 00:17:16+00:00,1,471.0,249.0,4.15,34
4,77,quarter,1,90381a35-42a6-4975-851f-175418e4271a,13,7:48,Sam Merrill misses three point jump shot,threepointmiss,8,,basketball_play,1773793039,426,True,2026-03-18 00:17:19+00:00,1,468.0,252.0,4.2,35
4,76,quarter,1,5dc3fe01-79a4-4f2f-a953-d922ea4a6dd3,13,7:45,Jericho Sims defensive rebound,rebound,8,5dc3fe01-79a4-4f2f-a953-d922ea4a6dd3,basketball_play,1773793042,425,True,2026-03-18 00:17:22+00:00,1,465.0,255.0,4.25,36
4,75,quarter,1,5dc3fe01-79a4-4f2f-a953-d922ea4a6dd3,13,7:37,Jericho Sims makes two point alley-oop layup (Kyle Kuzma assists),twopointmade,10,90381a35-42a6-4975-851f-175418e4271a,basketball_play,1773793049,424,True,2026-03-18 00:17:29+00:00,1,457.0,263.0,4.383333333333334,37
4,74,quarter,1,90381a35-42a6-4975-851f-175418e4271a,13,7:24,Evan Mobley misses two point cutting layup,twopointmiss,10,,basketball_play,1773793063,423,True,2026-03-18 00:17:43+00:00,1,444.0,276.0,4.6,38
4,73,quarter,1,90381a35-42a6-4975-851f-175418e4271a,13,7:23,Evan Mobley offensive rebound,rebound,10,90381a35-42a6-4975-851f-175418e4271a,basketball_play,1773793064,422,True,2026-03-18 00:17:44+00:00,1,443.0,277.0,4.616666666666666,39
4,72,quarter,1,90381a35-42a6-4975-851f-175418e4271a,15,7:21,Evan Mobley makes two point putback dunk,twopointmade,10,5dc3fe01-79a4-4f2f-a953-d922ea4a6dd3,basketball_play,1773793066,421,True,2026-03-18 00:17:46+00:00,1,441.0,279.0,4.65,40
4,71,quarter,1,5dc3fe01-79a4-4f2f-a953-d922ea4a6dd3,15,7:05,Kevin Porter Jr. makes two point turnaround fadeaway jump shot,twopointmade,12,90381a35-42a6-4975-851f-175418e4271a,basketball_play,1773793083,420,True,2026-03-18 00:18:03+00:00,1,425.0,295.0,4.916666666666667,41
4,70,quarter,1,90381a35-42a6-4975-851f-175418e4271a,15,6:52,Ryan Rollins blocks Evan Mobley's two point driving layup,twopointmiss,12,,basketball_play,1773793111,419,True,2026-03-18 00:18:31+00:00,1,412.0,308.0,5.133333333333334,42
4,69,quarter,1,90381a35-42a6-4975-851f-175418e4271a,15,6:51,Evan Mobley offensive rebound,rebound,12,90381a35-42a6-4975-851f-175418e4271a,basketball_play,1773793112,418,True,2026-03-18 00:18:32+00:00,1,411.0,309.0,5.15,43
4,68,quarter,1,5dc3fe01-79a4-4f2f-a953-d922ea4a6dd3,15,6:50,Ryan Rollins shooting foul (Evan Mobley draws the foul),shootingfoul,12,90381a35-42a6-4975-851f-175418e4271a,basketball_play,1773793115,417,True,2026-03-18 00:18:35+00:00,1,410.0,310.0,5.166666666666667,44
4,67,quarter,1,5dc3fe01-79a4-4f2f-a953-d922ea4a6dd3,15,6:50,Bucks 60 second timeout,teamtimeout,12,,basketball_play,1773793122,416,True,2026-03-18 00:18:42+00:00,1,410.0,310.0,5.166666666666667,45
4,66,quarter,1,90381a35-42a6-4975-851f-175418e4271a,15,6:50,"Cavaliers lineup change (James Harden, Dean Wade, Sam Merrill, Keon Ellis, Evan Mobley)",lineupchange,12,,basketball_play,1773793279,415,True,2026-03-18 00:21:19+00:00,1,410.0,310.0,5.166666666666667,46
4,65,quarter,1,5dc3fe01-79a4-4f2f-a953-d922ea4a6dd3,15,6:50,"Bucks lineup change (Kevin Porter Jr., Taurean Prince, Jericho Sims, Ousmane Dieng, Kyle Kuzma)",lineupchange,12,,basketball_play,1773793279,414,True,2026-03-18 00:21:19+00:00,1,410.0,310.0,5.166666666666667,47
4,64,quarter,1,90381a35-42a6-4975-851f-175418e4271a,15,6:50,Evan Mobley misses regular free throw 1 of 2,freethrowmiss,12,90381a35-42a6-4975-851f-175418e4271a,basketball_play,1773793336,413,True,2026-03-18 00:22:16+00:00,1,410.0,310.0,5.166666666666667,48
4,63,quarter,1,90381a35-42a6-4975-851f-175418e4271a,15,6:50,Cavaliers offensive rebound,rebound,12,90381a35-42a6-4975-851f-175418e4271a,basketball_play,1773793336,412,True,2026-03-18 00:22:16+00:00,1,410.0,310.0,5.166666666666667,49
4,62,quarter,1,90381a35-42a6-4975-851f-175418e4271a,15,6:50,Evan Mobley misses regular free throw 2 of 2,freethrowmiss,12,,basketball_play,1773793336,411,True,2026-03-18 00:22:16+00:00,1,410.0,310.0,5.166666666666667,50
4,61,quarter,1,5dc3fe01-79a4-4f2f-a953-d922ea4a6dd3,15,6:46,Jericho Sims defensive rebound,rebound,12,5dc3fe01-79a4-4f2f-a953-d922ea4a6dd3,basketball_play,1773793340,410,True,2026-03-18 00:22:20+00:00,1,406.0,314.0,5.233333333333333,51
4,60,quarter,1,,15,6:35,Stoppage (Out of bounds),stoppage,12,,basketball_play,1773793362,409,True,2026-03-18 00:22:42+00:00,1,395.0,325.0,5.416666666666667,52
4,59,quarter,1,5dc3fe01-79a4-4f2f-a953-d922ea4a6dd3,15,6:26,Kyle Kuzma misses three point jump shot,threepointmiss,12,,basketball_play,1773793383,408,True,2026-03-18 00:23:03+00:00,1,386.0,334.0,5.566666666666666,53
4,58,quarter,1,90381a35-42a6-4975-851f-175418e4271a,15,6:24,Cavaliers defensive rebound,rebound,12,90381a35-42a6-4975-851f-175418e4271a,basketball_play,1773793385,407,True,2026-03-18 00:23:05+00:00,1,384.0,336.0,5.6,54
4,57,quarter,1,,15,6:24,Stoppage (Out of bounds),stoppage,12,,basketball_play,1773793391,406,True,2026-03-18 00:23:11+00:00,1,384.0,336.0,5.6,55
4,56,quarter,1,90381a35-42a6-4975-851f-175418e4271a,17,6:02,Evan Mobley makes two point dunk (Sam Merrill assists),twopointmade,12,5dc3fe01-79a4-4f2f-a953-d922ea4a6dd3,basketball_play,1773793417,405,True,2026-03-18 00:23:37+00:00,1,362.0,358.0,5.966666666666667,56
4,55,quarter,1,5dc3fe01-79a4-4f2f-a953-d922ea4a6dd3,17,5:50,Ousmane Dieng misses two point pullup jump shot,twopointmiss,12,,basketball_play,1773793428,404,True,2026-03-18 00:23:48+00:00,1,350.0,370.0,6.166666666666667,57
4,54,quarter,1,90381a35-42a6-4975-851f-175418e4271a,17,5:50,Evan Mobley defensive rebound,rebound,12,90381a35-42a6-4975-851f-175418e4271a,basketball_play,1773793428,403,True,2026-03-18 00:23:48+00:00,1,350.0,370.0,6.166666666666667,58
4,53,quarter,1,90381a35-42a6-4975-851f-175418e4271a,19,5:35,Evan Mobley makes two point turnaround hook shot,twopointmade,12,5dc3fe01-79a4-4f2f-a953-d922ea4a6dd3,basketball_play,1773793444,402,True,2026-03-18 00:24:04+00:00,1,335.0,385.0,6.416666666666667,59
4,52,quarter,1,5dc3fe01-79a4-4f2f-a953-d922ea4a6dd3,19,5:35,Bucks 60 second timeout,teamtimeout,12,,basketball_play,1773793451,401,True,2026-03-18 00:24:11+00:00,1,335.0,385.0,6.416666666666667,60
4,51,quarter,1,90381a35-42a6-4975-851f-175418e4271a,19,5:35,"Cavaliers lineup change (James Harden, Max Strus, Sam Merrill, Keon Ellis, Evan Mobley)",lineupchange,12,,basketball_play,1773793573,400,True,2026-03-18 00:26:13+00:00,1,335.0,385.0,6.416666666666667,61
4,50,quarter,1,5dc3fe01-79a4-4f2f-a953-d922ea4a6dd3,19,5:35,"Bucks lineup change (Kevin Porter Jr., Jericho Sims, AJ Green, Ousmane Dieng, Kyle Kuzma)",lineupchange,12,,basketball_play,1773793573,399,True,2026-03-18 00:26:13+00:00,1,335.0,385.0,6.416666666666667,62
4,49,quarter,1,5dc3fe01-79a4-4f2f-a953-d922ea4a6dd3,19,5:22,Evan Mobley blocks Kyle Kuzma's two point driving layup,twopointmiss,12,,basketball_play,1773793667,398,True,2026-03-18 00:27:47+00:00,1,322.0,398.0,6.633333333333334,63
4,48,quarter,1,5dc3fe01-79a4-4f2f-a953-d922ea4a6dd3,19,5:18,Jericho Sims offensive rebound,rebound,12,5dc3fe01-79a4-4f2f-a953-d922ea4a6dd3,basketball_play,1773793671,397,True,2026-03-18 00:27:51+00:00,1,318.0,402.0,6.7,64
4,47,quarter,1,5dc3fe01-79a4-4f2f-a953-d922ea4a6dd3,19,5:16,Kyle Kuzma makes three point jump shot (Kevin Porter Jr. assists),threepointmade,15,90381a35-42a6-4975-851f-175418e4271a,basketball_play,1773793674,396,True,2026-03-18 00:27:54+00:00,1,316.0,404.0,6.733333333333333,65
4,46,quarter,1,90381a35-42a6-4975-851f-175418e4271a,22,5:03,James Harden makes three point stepback jump shot,threepointmade,15,5dc3fe01-79a4-4f2f-a953-d922ea4a6dd3,basketball_play,1773793686,395,True,2026-03-18 00:28:06+00:00,1,303.0,417.0,6.95,66
4,45,quarter,1,90381a35-42a6-4975-851f-175418e4271a,22,4:55,Max Strus personal foul (Take) (Kevin Porter Jr. draws the foul),personalfoul,15,5dc3fe01-79a4-4f2f-a953-d922ea4a6dd3,basketball_play,1773793700,394,True,2026-03-18 00:28:20+00:00,1,295.0,425.0,7.083333333333333,67
4,44,quarter,1,90381a35-42a6-4975-851f-175418e4271a,22,4:55,"Cavaliers lineup change (James Harden, Max Strus, Thomas Bryant, Sam Merrill, Keon Ellis)",lineupchange,15,,basketball_play,1773793742,393,True,2026-03-18 00:29:02+00:00,1,295.0,425.0,7.083333333333333,68
4,43,quarter,1,5dc3fe01-79a4-4f2f-a953-d922ea4a6dd3,22,4:44,Ousmane Dieng makes two point driving floating jump shot (Kevin Porter Jr. assists),twopointmade,17,90381a35-42a6-4975-851f-175418e4271a,basketball_play,1773793742,392,True,2026-03-18 00:29:02+00:00,1,284.0,436.0,7.266666666666667,69
4,42,quarter,1,5dc3fe01-79a4-4f2f-a953-d922ea4a6dd3,22,4:36,Jericho Sims shooting foul (James Harden draws the foul),shootingfoul,17,90381a35-42a6-4975-851f-175418e4271a,basketball_play,1773793754,391,True,2026-03-18 00:29:14+00:00,1,276.0,444.0,7.4,70
4,41,quarter,1,90381a35-42a6-4975-851f-175418e4271a,23,4:36,James Harden makes regular free throw 1 of 3,freethrowmade,17,90381a35-42a6-4975-851f-175418e4271a,basketball_play,1773793783,390,True,2026-03-18 00:29:43+00:00,1,276.0,444.0,7.4,71
4,40,quarter,1,90381a35-42a6-4975-851f-175418e4271a,24,4:36,James Harden makes regular free throw 2 of 3,freethrowmade,17,90381a35-42a6-4975-851f-175418e4271a,basketball_play,1773793823,389,True,2026-03-18 00:30:23+00:00,1,276.0,444.0,7.4,72
4,39,quarter,1,5dc3fe01-79a4-4f2f-a953-d922ea4a6dd3,24,4:36,"Bucks lineup change (Jericho Sims, AJ Green, Bobby Portis, Ousmane Dieng, Ryan Rollins)",lineupchange,17,,basketball_play,1773793824,388,True,2026-03-18 00:30:24+00:00,1,276.0,444.0,7.4,73
4,38,quarter,1,90381a35-42a6-4975-851f-175418e4271a,25,4:36,James Harden makes regular free throw 3 of 3,freethrowmade,17,5dc3fe01-79a4-4f2f-a953-d922ea4a6dd3,basketball_play,1773793845,387,True,2026-03-18 00:30:45+00:00,1,276.0,444.0,7.4,74
4,37,quarter,1,5dc3fe01-79a4-4f2f-a953-d922ea4a6dd3,25,4:23,AJ Green makes three point jump shot (Bobby Portis assists),threepointmade,20,90381a35-42a6-4975-851f-175418e4271a,basketball_play,1773793856,386,True,2026-03-18 00:30:56+00:00,1,263.0,457.0,7.616666666666666,75
4,36,quarter,1,90381a35-42a6-4975-851f-175418e4271a,27,4:08,James Harden makes two point driving layup,twopointmade,20,5dc3fe01-79a4-4f2f-a953-d922ea4a6dd3,basketball_play,1773793874,385,True,2026-03-18 00:31:14+00:00,1,248.0,472.0,7.866666666666666,76
4,35,quarter,1,5dc3fe01-79a4-4f2f-a953-d922ea4a6dd3,27,4:08,Ousmane Dieng shooting foul (James Harden draws the foul),shootingfoul,20,90381a35-42a6-4975-851f-175418e4271a,basketball_play,1773793878,384,True,2026-03-18 00:31:18+00:00,1,248.0,472.0,7.866666666666666,77
4,34,quarter,1,90381a35-42a6-4975-851f-175418e4271a,27,4:08,"Cavaliers lineup change (James Harden, Dennis Schroder, Max Strus, Thomas Bryant, Keon Ellis)",lineupchange,20,,basketball_play,1773793908,383,True,2026-03-18 00:31:48+00:00,1,248.0,472.0,7.866666666666666,78
4,33,quarter,1,90381a35-42a6-4975-851f-175418e4271a,28,4:08,James Harden makes regular free throw 1 of 1,freethrowmade,20,,basketball_play,1773793908,382,True,2026-03-18 00:31:48+00:00,1,248.0,472.0,7.866666666666666,79
4,32,quarter,1,5dc3fe01-79a4-4f2f-a953-d922ea4a6dd3,28,3:54,Bobby Portis misses two point jump shot,twopointmiss,20,,basketball_play,1773793917,381,True,2026-03-18 00:31:57+00:00,1,234.0,486.0,8.1,80
4,31,quarter,1,90381a35-42a6-4975-851f-175418e4271a,28,3:52,Keon Ellis defensive rebound,rebound,20,90381a35-42a6-4975-851f-175418e4271a,basketball_play,1773793919,380,True,2026-03-18 00:31:59+00:00,1,232.0,488.0,8.133333333333333,81
4,30,quarter,1,90381a35-42a6-4975-851f-175418e4271a,30,3:39,James Harden makes two point driving layup,twopointmade,20,5dc3fe01-79a4-4f2f-a953-d922ea4a6dd3,basketball_play,1773793932,379,True,2026-03-18 00:32:12+00:00,1,219.0,501.0,8.35,82
4,29,quarter,1,5dc3fe01-79a4-4f2f-a953-d922ea4a6dd3,30,3:22,Ousmane Dieng misses two point pullup jump shot,twopointmiss,20,,basketball_play,1773793949,378,True,2026-03-18 00:32:29+00:00,1,202.0,518.0,8.633333333333333,83
4,28,quarter,1,90381a35-42a6-4975-851f-175418e4271a,30,3:19,Keon Ellis defensive rebound,rebound,20,90381a35-42a6-4975-851f-175418e4271a,basketball_play,1773793952,377,True,2026-03-18 00:32:32+00:00,1,199.0,521.0,8.683333333333334,84
4,27,quarter,1,90381a35-42a6-4975-851f-175418e4271a,30,3:13,James Harden misses three point pullup jump shot,threepointmiss,20,,basketball_play,1773793958,376,True,2026-03-18 00:32:38+00:00,1,193.0,527.0,8.783333333333333,85
4,26,quarter,1,5dc3fe01-79a4-4f2f-a953-d922ea4a6dd3,30,3:10,Bobby Portis defensive rebound,rebound,20,5dc3fe01-79a4-4f2f-a953-d922ea4a6dd3,basketball_play,1773793961,375,True,2026-03-18 00:32:41+00:00,1,190.0,530.0,8.833333333333334,86
4,25,quarter,1,5dc3fe01-79a4-4f2f-a953-d922ea4a6dd3,30,2:58,Bobby Portis misses two point driving floating jump shot,twopointmiss,20,,basketball_play,1773793974,374,True,2026-03-18 00:32:54+00:00,1,178.0,542.0,9.033333333333333,87
4,24,quarter,1,90381a35-42a6-4975-851f-175418e4271a,30,2:55,Max Strus defensive rebound,rebound,20,90381a35-42a6-4975-851f-175418e4271a,basketball_play,1773793977,373,True,2026-03-18 00:32:57+00:00,1,175.0,545.0,9.083333333333334,88
4,23,quarter,1,,30,2:47,Stoppage (Blood rule),stoppage,20,,basketball_play,1773793998,372,True,2026-03-18 00:33:18+00:00,1,167.0,553.0,9.216666666666667,89
4,22,quarter,1,90381a35-42a6-4975-851f-175418e4271a,30,2:47,"Cavaliers lineup change (Donovan Mitchell, Dennis Schroder, Max Strus, Thomas Bryant, Keon Ellis)",lineupchange,20,,basketball_play,1773794008,371,True,2026-03-18 00:33:28+00:00,1,167.0,553.0,9.216666666666667,90
4,21,quarter,1,5dc3fe01-79a4-4f2f-a953-d922ea4a6dd3,30,2:47,"Bucks lineup change (Pete Nance, AJ Green, Bobby Portis, Ousmane Dieng, Ryan Rollins)",lineupchange,20,,basketball_play,1773794008,370,True,2026-03-18 00:33:28+00:00,1,167.0,553.0,9.216666666666667,91
4,20,quarter,1,90381a35-42a6-4975-851f-175418e4271a,32,2:33,Keon Ellis makes two point cutting dunk (Max Strus assists),twopointmade,20,5dc3fe01-79a4-4f2f-a953-d922ea4a6dd3,basketball_play,1773794045,369,True,2026-03-18 00:34:05+00:00,1,153.0,567.0,9.45,92
4,19,quarter,1,5dc3fe01-79a4-4f2f-a953-d922ea4a6dd3,32,2:16,Bobby Portis makes two point stepback jump shot,twopointmade,22,90381a35-42a6-4975-851f-175418e4271a,basketball_play,1773794063,368,True,2026-03-18 00:34:23+00:00,1,136.0,584.0,9.733333333333333,93
4,18,quarter,1,90381a35-42a6-4975-851f-175418e4271a,32,1:53,Dennis Schroder misses three point jump shot,threepointmiss,22,,basketball_play,1773794086,367,True,2026-03-18 00:34:46+00:00,1,113.0,607.0,10.116666666666667,94
4,17,quarter,1,5dc3fe01-79a4-4f2f-a953-d922ea4a6dd3,32,1:49,Pete Nance defensive rebound,rebound,22,5dc3fe01-79a4-4f2f-a953-d922ea4a6dd3,basketball_play,1773794090,366,True,2026-03-18 00:34:50+00:00,1,109.0,611.0,10.183333333333334,95
4,16,quarter,1,5dc3fe01-79a4-4f2f-a953-d922ea4a6dd3,32,1:41,Ryan Rollins makes two point driving layup,twopointmade,24,90381a35-42a6-4975-851f-175418e4271a,basketball_play,1773794097,365,True,2026-03-18 00:34:57+00:00,1,101.0,619.0,10.316666666666666,96
4,15,quarter,1,90381a35-42a6-4975-851f-175418e4271a,34,1:29,Donovan Mitchell makes two point driving floating jump shot,twopointmade,24,5dc3fe01-79a4-4f2f-a953-d922ea4a6dd3,basketball_play,1773794110,364,True,2026-03-18 00:35:10+00:00,1,89.0,631.0,10.516666666666667,97
4,14,quarter,1,5dc3fe01-79a4-4f2f-a953-d922ea4a6dd3,34,1:28,Bobby Portis turnover (inbound),turnover,24,90381a35-42a6-4975-851f-175418e4271a,basketball_play,1773794115,363,True,2026-03-18 00:35:15+00:00,1,88.0,632.0,10.533333333333333,98
4,13,quarter,1,90381a35-42a6-4975-851f-175418e4271a,34,1:28,"Cavaliers lineup change (Donovan Mitchell, Dennis Schroder, Max Strus, Thomas Bryant, Jaylon Tyson)",lineupchange,24,,basketball_play,1773794150,362,True,2026-03-18 00:35:50+00:00,1,88.0,632.0,10.533333333333333,99
4,12,quarter,1,90381a35-42a6-4975-851f-175418e4271a,37,1:16,Thomas Bryant makes three point jump shot (Dennis Schroder assists),threepointmade,24,5dc3fe01-79a4-4f2f-a953-d922ea4a6dd3,basketball_play,1773794150,361,True,2026-03-18 00:35:50+00:00,1,76.0,644.0,10.733333333333333,100
4,11,quarter,1,5dc3fe01-79a4-4f2f-a953-d922ea4a6dd3,37,1:02,Ryan Rollins turnover (bad pass) (Donovan Mitchell steals),turnover,24,90381a35-42a6-4975-851f-175418e4271a,basketball_play,1773794163,360,True,2026-03-18 00:36:03+00:00,1,62.0,658.0,10.966666666666667,101
4,10,quarter,1,90381a35-42a6-4975-851f-175418e4271a,37,00:58.80,Jaylon Tyson misses three point running jump shot,threepointmiss,24,,basketball_play,1773794168,359,True,2026-03-18 00:36:08+00:00,1,58.8,661.2,11.020000000000001,102
4,9,quarter,1,5dc3fe01-79a4-4f2f-a953-d922ea4a6dd3,37,00:55,AJ Green defensive rebound,rebound,24,5dc3fe01-79a4-4f2f-a953-d922ea4a6dd3,basketball_play,1773794172,358,True,2026-03-18 00:36:12+00:00,1,55.0,665.0,11.083333333333334,103
4,8,quarter,1,90381a35-42a6-4975-851f-175418e4271a,37,00:40,Max Strus personal foul (Ousmane Dieng draws the foul),personalfoul,24,5dc3fe01-79a4-4f2f-a953-d922ea4a6dd3,basketball_play,1773794190,357,True,2026-03-18 00:36:30+00:00,1,40.0,680.0,11.333333333333334,104
4,7,quarter,1,5dc3fe01-79a4-4f2f-a953-d922ea4a6dd3,37,00:32.10,Ryan Rollins misses two point fadeaway jump shot,twopointmiss,24,,basketball_play,1773794216,356,True,2026-03-18 00:36:56+00:00,1,32.1,687.9,11.465,105
4,6,quarter,1,90381a35-42a6-4975-851f-175418e4271a,37,00:29.20,Max Strus defensive rebound,rebound,24,90381a35-42a6-4975-851f-175418e4271a,basketball_play,1773794219,355,True,2026-03-18 00:36:59+00:00,1,29.2,690.8,11.513333333333332,106
