period_index,event_index,period_type,period_number,attribution,away_points,clock,description,event_type,home_points,possession,type,wall_clock,pbp_source_row,has_wall_clock,event_ts_utc,period_sequence,game_clock_seconds_remaining,game_elapsed_seconds,game_elapsed_minutes,pbp_chronological_index
4,123,quarter,1,00c3e69d-d9b9-4ac3-bf79-19707fe43637,0,12:00,"Magic lineup change (Goga Bitadze, Jalen Suggs, Desmond Bane, Tristan da Silva, Paolo Banchero)",lineupchange,0,,basketball_play,1773961842,495,True,2026-03-19 23:10:42+00:00,1,720.0,0.0,0.0,1
4,122,quarter,1,7c980c51-fa76-4571-b165-242b2a00f3a1,0,12:00,"Hornets lineup change (Kon Knueppel, Miles Bridges, Moussa Diabate, LaMelo Ball, Brandon Miller)",lineupchange,0,,basketball_play,1773961842,494,True,2026-03-19 23:10:42+00:00,1,720.0,0.0,0.0,2
4,121,quarter,1,,0,12:00,Start of 1st Quarter,startperiod,0,,basketball_play,1773961842,493,True,2026-03-19 23:10:42+00:00,1,720.0,0.0,0.0,3
4,120,quarter,1,00c3e69d-d9b9-4ac3-bf79-19707fe43637,0,12:00,Goga Bitadze vs. Moussa Diabate (Tristan da Silva gains possession),opentip,0,00c3e69d-d9b9-4ac3-bf79-19707fe43637,basketball_play,1773961844,492,True,2026-03-19 23:10:44+00:00,1,720.0,0.0,0.0,4
4,119,quarter,1,00c3e69d-d9b9-4ac3-bf79-19707fe43637,2,11:48,Desmond Bane makes two point pullup jump shot (Paolo Banchero assists),twopointmade,0,7c980c51-fa76-4571-b165-242b2a00f3a1,basketball_play,1773961853,491,True,2026-03-19 23:10:53+00:00,1,708.0,12.0,0.2,5
4,118,quarter,1,7c980c51-fa76-4571-b165-242b2a00f3a1,2,11:22,Brandon Miller makes two point fadeaway jump shot,twopointmade,2,00c3e69d-d9b9-4ac3-bf79-19707fe43637,basketball_play,1773961878,490,True,2026-03-19 23:11:18+00:00,1,682.0,38.0,0.6333333333333333,6
4,117,quarter,1,00c3e69d-d9b9-4ac3-bf79-19707fe43637,2,11:13,Jalen Suggs offensive foul (Brandon Miller draws the foul),offensivefoul,2,7c980c51-fa76-4571-b165-242b2a00f3a1,basketball_play,1773961897,489,True,2026-03-19 23:11:37+00:00,1,673.0,47.0,0.7833333333333333,7
4,116,quarter,1,00c3e69d-d9b9-4ac3-bf79-19707fe43637,2,11:13,Jalen Suggs turnover (offensive foul),turnover,2,7c980c51-fa76-4571-b165-242b2a00f3a1,basketball_play,1773961897,488,True,2026-03-19 23:11:37+00:00,1,673.0,47.0,0.7833333333333333,8
4,115,quarter,1,7c980c51-fa76-4571-b165-242b2a00f3a1,2,10:53,LaMelo Ball makes three point stepback jump shot (Brandon Miller assists),threepointmade,5,00c3e69d-d9b9-4ac3-bf79-19707fe43637,basketball_play,1773961923,487,True,2026-03-19 23:12:03+00:00,1,653.0,67.0,1.1166666666666667,9
4,114,quarter,1,7c980c51-fa76-4571-b165-242b2a00f3a1,2,10:41,LaMelo Ball shooting foul (Desmond Bane draws the foul),shootingfoul,5,00c3e69d-d9b9-4ac3-bf79-19707fe43637,basketball_play,1773961937,486,True,2026-03-19 23:12:17+00:00,1,641.0,79.0,1.3166666666666667,10
4,113,quarter,1,00c3e69d-d9b9-4ac3-bf79-19707fe43637,3,10:41,Desmond Bane makes regular free throw 1 of 2,freethrowmade,5,00c3e69d-d9b9-4ac3-bf79-19707fe43637,basketball_play,1773961965,485,True,2026-03-19 23:12:45+00:00,1,641.0,79.0,1.3166666666666667,11
4,112,quarter,1,00c3e69d-d9b9-4ac3-bf79-19707fe43637,4,10:41,Desmond Bane makes regular free throw 2 of 2,freethrowmade,5,7c980c51-fa76-4571-b165-242b2a00f3a1,basketball_play,1773961979,484,True,2026-03-19 23:12:59+00:00,1,641.0,79.0,1.3166666666666667,12
4,111,quarter,1,00c3e69d-d9b9-4ac3-bf79-19707fe43637,4,10:33,Paolo Banchero shooting foul (LaMelo Ball draws the foul),shootingfoul,5,7c980c51-fa76-4571-b165-242b2a00f3a1,basketball_play,1773961991,483,True,2026-03-19 23:13:11+00:00,1,633.0,87.0,1.45,13
4,110,quarter,1,7c980c51-fa76-4571-b165-242b2a00f3a1,4,10:33,LaMelo Ball makes regular free throw 1 of 2,freethrowmade,6,7c980c51-fa76-4571-b165-242b2a00f3a1,basketball_play,1773962025,482,True,2026-03-19 23:13:45+00:00,1,633.0,87.0,1.45,14
4,109,quarter,1,7c980c51-fa76-4571-b165-242b2a00f3a1,4,10:33,LaMelo Ball makes regular free throw 2 of 2,freethrowmade,7,00c3e69d-d9b9-4ac3-bf79-19707fe43637,basketball_play,1773962042,481,True,2026-03-19 23:14:02+00:00,1,633.0,87.0,1.45,15
4,108,quarter,1,00c3e69d-d9b9-4ac3-bf79-19707fe43637,7,10:20,Jalen Suggs makes three point jump shot (Desmond Bane assists),threepointmade,7,7c980c51-fa76-4571-b165-242b2a00f3a1,basketball_play,1773962057,480,True,2026-03-19 23:14:17+00:00,1,620.0,100.0,1.6666666666666667,16
4,107,quarter,1,7c980c51-fa76-4571-b165-242b2a00f3a1,7,10:10,Miles Bridges misses three point jump shot,threepointmiss,7,,basketball_play,1773962068,479,True,2026-03-19 23:14:28+00:00,1,610.0,110.0,1.8333333333333333,17
4,106,quarter,1,00c3e69d-d9b9-4ac3-bf79-19707fe43637,7,10:08,Goga Bitadze defensive rebound,rebound,7,00c3e69d-d9b9-4ac3-bf79-19707fe43637,basketball_play,1773962070,478,True,2026-03-19 23:14:30+00:00,1,608.0,112.0,1.8666666666666667,18
4,105,quarter,1,00c3e69d-d9b9-4ac3-bf79-19707fe43637,10,9:54,Desmond Bane makes three point pullup jump shot (Jalen Suggs assists),threepointmade,7,7c980c51-fa76-4571-b165-242b2a00f3a1,basketball_play,1773962083,477,True,2026-03-19 23:14:43+00:00,1,594.0,126.0,2.1,19
4,104,quarter,1,7c980c51-fa76-4571-b165-242b2a00f3a1,10,9:39,LaMelo Ball misses three point stepback jump shot,threepointmiss,7,,basketball_play,1773962099,476,True,2026-03-19 23:14:59+00:00,1,579.0,141.0,2.35,20
4,103,quarter,1,00c3e69d-d9b9-4ac3-bf79-19707fe43637,10,9:37,Desmond Bane defensive rebound,rebound,7,00c3e69d-d9b9-4ac3-bf79-19707fe43637,basketball_play,1773962101,475,True,2026-03-19 23:15:01+00:00,1,577.0,143.0,2.3833333333333333,21
4,102,quarter,1,00c3e69d-d9b9-4ac3-bf79-19707fe43637,10,9:35,Desmond Bane turnover (bad pass) (LaMelo Ball steals),turnover,7,7c980c51-fa76-4571-b165-242b2a00f3a1,basketball_play,1773962103,474,True,2026-03-19 23:15:03+00:00,1,575.0,145.0,2.4166666666666665,22
4,101,quarter,1,7c980c51-fa76-4571-b165-242b2a00f3a1,10,9:30,Tristan da Silva blocks Moussa Diabate's two point running layup,twopointmiss,7,,basketball_play,1773962110,473,True,2026-03-19 23:15:10+00:00,1,570.0,150.0,2.5,23
4,100,quarter,1,7c980c51-fa76-4571-b165-242b2a00f3a1,10,9:27,LaMelo Ball offensive rebound,rebound,7,7c980c51-fa76-4571-b165-242b2a00f3a1,basketball_play,1773962113,472,True,2026-03-19 23:15:13+00:00,1,567.0,153.0,2.55,24
4,99,quarter,1,7c980c51-fa76-4571-b165-242b2a00f3a1,10,9:27,LaMelo Ball makes two point putback layup,twopointmade,9,00c3e69d-d9b9-4ac3-bf79-19707fe43637,basketball_play,1773962118,471,True,2026-03-19 23:15:18+00:00,1,567.0,153.0,2.55,25
4,98,quarter,1,00c3e69d-d9b9-4ac3-bf79-19707fe43637,12,9:05,Goga Bitadze makes two point dunk (Tristan da Silva assists),twopointmade,9,7c980c51-fa76-4571-b165-242b2a00f3a1,basketball_play,1773962132,470,True,2026-03-19 23:15:32+00:00,1,545.0,175.0,2.9166666666666665,26
4,97,quarter,1,7c980c51-fa76-4571-b165-242b2a00f3a1,12,8:53,LaMelo Ball misses three point pullup jump shot,threepointmiss,9,,basketball_play,1773962145,469,True,2026-03-19 23:15:45+00:00,1,533.0,187.0,3.1166666666666667,27
4,96,quarter,1,00c3e69d-d9b9-4ac3-bf79-19707fe43637,12,8:51,Paolo Banchero defensive rebound,rebound,9,00c3e69d-d9b9-4ac3-bf79-19707fe43637,basketball_play,1773962147,468,True,2026-03-19 23:15:47+00:00,1,531.0,189.0,3.15,28
4,95,quarter,1,00c3e69d-d9b9-4ac3-bf79-19707fe43637,15,8:42,Paolo Banchero makes three point stepback jump shot,threepointmade,9,7c980c51-fa76-4571-b165-242b2a00f3a1,basketball_play,1773962156,467,True,2026-03-19 23:15:56+00:00,1,522.0,198.0,3.3,29
4,94,quarter,1,7c980c51-fa76-4571-b165-242b2a00f3a1,15,8:32,Miles Bridges misses three point jump shot,threepointmiss,9,,basketball_play,1773962165,466,True,2026-03-19 23:16:05+00:00,1,512.0,208.0,3.466666666666667,30
4,93,quarter,1,00c3e69d-d9b9-4ac3-bf79-19707fe43637,15,8:31,Magic defensive rebound,rebound,9,00c3e69d-d9b9-4ac3-bf79-19707fe43637,basketball_play,1773962166,465,True,2026-03-19 23:16:06+00:00,1,511.0,209.0,3.4833333333333334,31
4,92,quarter,1,,15,8:31,Stoppage (Out of bounds),stoppage,9,,basketball_play,1773962172,464,True,2026-03-19 23:16:12+00:00,1,511.0,209.0,3.4833333333333334,32
4,91,quarter,1,00c3e69d-d9b9-4ac3-bf79-19707fe43637,17,8:14,Paolo Banchero makes two point driving layup,twopointmade,9,7c980c51-fa76-4571-b165-242b2a00f3a1,basketball_play,1773962197,463,True,2026-03-19 23:16:37+00:00,1,494.0,226.0,3.7666666666666666,33
4,90,quarter,1,7c980c51-fa76-4571-b165-242b2a00f3a1,17,8:07,Kon Knueppel turnover (traveling),turnover,9,00c3e69d-d9b9-4ac3-bf79-19707fe43637,basketball_play,1773962208,462,True,2026-03-19 23:16:48+00:00,1,487.0,233.0,3.8833333333333333,34
4,89,quarter,1,7c980c51-fa76-4571-b165-242b2a00f3a1,17,8:07,"Hornets lineup change (Sion James, Miles Bridges, Moussa Diabate, LaMelo Ball, Brandon Miller)",lineupchange,9,,basketball_play,1773962240,461,True,2026-03-19 23:17:20+00:00,1,487.0,233.0,3.8833333333333333,35
4,88,quarter,1,00c3e69d-d9b9-4ac3-bf79-19707fe43637,17,7:57,Paolo Banchero misses three point pullup jump shot,threepointmiss,9,,basketball_play,1773962240,460,True,2026-03-19 23:17:20+00:00,1,477.0,243.0,4.05,36
4,87,quarter,1,7c980c51-fa76-4571-b165-242b2a00f3a1,17,7:54,Moussa Diabate defensive rebound,rebound,9,7c980c51-fa76-4571-b165-242b2a00f3a1,basketball_play,1773962243,459,True,2026-03-19 23:17:23+00:00,1,474.0,246.0,4.1,37
4,86,quarter,1,7c980c51-fa76-4571-b165-242b2a00f3a1,17,7:47,Brandon Miller makes two point driving floating jump shot,twopointmade,11,00c3e69d-d9b9-4ac3-bf79-19707fe43637,basketball_play,1773962248,458,True,2026-03-19 23:17:28+00:00,1,467.0,253.0,4.216666666666667,38
4,85,quarter,1,00c3e69d-d9b9-4ac3-bf79-19707fe43637,19,7:39,Desmond Bane makes two point driving layup,twopointmade,11,7c980c51-fa76-4571-b165-242b2a00f3a1,basketball_play,1773962256,457,True,2026-03-19 23:17:36+00:00,1,459.0,261.0,4.35,39
4,84,quarter,1,7c980c51-fa76-4571-b165-242b2a00f3a1,19,7:39,Moussa Diabate defensive goaltending violation,defensivegoaltending,11,00c3e69d-d9b9-4ac3-bf79-19707fe43637,basketball_play,1773962270,456,True,2026-03-19 23:17:50+00:00,1,459.0,261.0,4.35,40
4,83,quarter,1,7c980c51-fa76-4571-b165-242b2a00f3a1,19,7:23,LaMelo Ball makes two point stepback jump shot,twopointmade,13,00c3e69d-d9b9-4ac3-bf79-19707fe43637,basketball_play,1773962290,455,True,2026-03-19 23:18:10+00:00,1,443.0,277.0,4.616666666666666,41
4,82,quarter,1,00c3e69d-d9b9-4ac3-bf79-19707fe43637,19,7:02,Jalen Suggs misses three point jump shot,threepointmiss,13,,basketball_play,1773962310,454,True,2026-03-19 23:18:30+00:00,1,422.0,298.0,4.966666666666667,42
4,81,quarter,1,7c980c51-fa76-4571-b165-242b2a00f3a1,19,7:00,Miles Bridges defensive rebound,rebound,13,7c980c51-fa76-4571-b165-242b2a00f3a1,basketball_play,1773962312,453,True,2026-03-19 23:18:32+00:00,1,420.0,300.0,5.0,43
4,80,quarter,1,7c980c51-fa76-4571-b165-242b2a00f3a1,19,6:55,Brandon Miller misses three point running jump shot,threepointmiss,13,,basketball_play,1773962318,452,True,2026-03-19 23:18:38+00:00,1,415.0,305.0,5.083333333333333,44
4,79,quarter,1,7c980c51-fa76-4571-b165-242b2a00f3a1,19,6:51,Brandon Miller offensive rebound,rebound,13,7c980c51-fa76-4571-b165-242b2a00f3a1,basketball_play,1773962322,451,True,2026-03-19 23:18:42+00:00,1,411.0,309.0,5.15,45
4,78,quarter,1,7c980c51-fa76-4571-b165-242b2a00f3a1,19,6:47,LaMelo Ball misses three point jump shot,threepointmiss,13,,basketball_play,1773962326,450,True,2026-03-19 23:18:46+00:00,1,407.0,313.0,5.216666666666667,46
4,77,quarter,1,00c3e69d-d9b9-4ac3-bf79-19707fe43637,19,6:45,Desmond Bane defensive rebound,rebound,13,00c3e69d-d9b9-4ac3-bf79-19707fe43637,basketball_play,1773962328,449,True,2026-03-19 23:18:48+00:00,1,405.0,315.0,5.25,47
4,76,quarter,1,00c3e69d-d9b9-4ac3-bf79-19707fe43637,19,6:40,Jalen Suggs turnover (bad pass) (LaMelo Ball steals),turnover,13,7c980c51-fa76-4571-b165-242b2a00f3a1,basketball_play,1773962333,448,True,2026-03-19 23:18:53+00:00,1,400.0,320.0,5.333333333333333,48
4,75,quarter,1,7c980c51-fa76-4571-b165-242b2a00f3a1,19,6:37,LaMelo Ball makes two point running dunk,twopointmade,15,00c3e69d-d9b9-4ac3-bf79-19707fe43637,basketball_play,1773962337,447,True,2026-03-19 23:18:57+00:00,1,397.0,323.0,5.383333333333334,49
4,74,quarter,1,00c3e69d-d9b9-4ac3-bf79-19707fe43637,19,6:37,Magic 60 second timeout,teamtimeout,15,,basketball_play,1773962355,446,True,2026-03-19 23:19:15+00:00,1,397.0,323.0,5.383333333333334,50
4,73,quarter,1,00c3e69d-d9b9-4ac3-bf79-19707fe43637,19,6:37,"Magic lineup change (Goga Bitadze, Jalen Suggs, Tristan da Silva, Jett Howard, Paolo Banchero)",lineupchange,15,,basketball_play,1773962362,445,True,2026-03-19 23:19:22+00:00,1,397.0,323.0,5.383333333333334,51
4,72,quarter,1,7c980c51-fa76-4571-b165-242b2a00f3a1,19,6:37,"Hornets lineup change (Sion James, Miles Bridges, LaMelo Ball, Ryan Kalkbrenner, Brandon Miller)",lineupchange,15,,basketball_play,1773962362,444,True,2026-03-19 23:19:22+00:00,1,397.0,323.0,5.383333333333334,52
4,71,quarter,1,00c3e69d-d9b9-4ac3-bf79-19707fe43637,19,6:20,Paolo Banchero turnover (bad pass) (LaMelo Ball steals),turnover,15,7c980c51-fa76-4571-b165-242b2a00f3a1,basketball_play,1773962542,443,True,2026-03-19 23:22:22+00:00,1,380.0,340.0,5.666666666666667,53
4,70,quarter,1,7c980c51-fa76-4571-b165-242b2a00f3a1,19,6:16,LaMelo Ball turnover (bad pass) (Paolo Banchero steals),turnover,15,00c3e69d-d9b9-4ac3-bf79-19707fe43637,basketball_play,1773962546,442,True,2026-03-19 23:22:26+00:00,1,376.0,344.0,5.733333333333333,54
4,69,quarter,1,00c3e69d-d9b9-4ac3-bf79-19707fe43637,19,6:10,Tristan da Silva misses three point running jump shot,threepointmiss,15,,basketball_play,1773962552,441,True,2026-03-19 23:22:32+00:00,1,370.0,350.0,5.833333333333333,55
4,68,quarter,1,00c3e69d-d9b9-4ac3-bf79-19707fe43637,19,6:08,Paolo Banchero offensive rebound,rebound,15,00c3e69d-d9b9-4ac3-bf79-19707fe43637,basketball_play,1773962554,440,True,2026-03-19 23:22:34+00:00,1,368.0,352.0,5.866666666666666,56
4,67,quarter,1,00c3e69d-d9b9-4ac3-bf79-19707fe43637,19,6:00,Jalen Suggs misses three point jump shot,threepointmiss,15,,basketball_play,1773962562,439,True,2026-03-19 23:22:42+00:00,1,360.0,360.0,6.0,57
4,66,quarter,1,00c3e69d-d9b9-4ac3-bf79-19707fe43637,19,5:58,Goga Bitadze offensive rebound,rebound,15,00c3e69d-d9b9-4ac3-bf79-19707fe43637,basketball_play,1773962564,438,True,2026-03-19 23:22:44+00:00,1,358.0,362.0,6.033333333333333,58
4,65,quarter,1,00c3e69d-d9b9-4ac3-bf79-19707fe43637,21,5:58,Goga Bitadze makes two point putback dunk,twopointmade,15,7c980c51-fa76-4571-b165-242b2a00f3a1,basketball_play,1773962566,437,True,2026-03-19 23:22:46+00:00,1,358.0,362.0,6.033333333333333,59
4,64,quarter,1,7c980c51-fa76-4571-b165-242b2a00f3a1,21,5:46,LaMelo Ball makes two point driving floating jump shot,twopointmade,17,00c3e69d-d9b9-4ac3-bf79-19707fe43637,basketball_play,1773962576,436,True,2026-03-19 23:22:56+00:00,1,346.0,374.0,6.233333333333333,60
4,63,quarter,1,00c3e69d-d9b9-4ac3-bf79-19707fe43637,21,5:35,Jalen Suggs technical foul,technicalfoul,17,7c980c51-fa76-4571-b165-242b2a00f3a1,basketball_play,1773962601,435,True,2026-03-19 23:23:21+00:00,1,335.0,385.0,6.416666666666667,61
4,62,quarter,1,7c980c51-fa76-4571-b165-242b2a00f3a1,21,5:35,LaMelo Ball makes technical free throw 1 of 1,freethrowmade,18,,basketball_play,1773962617,434,True,2026-03-19 23:23:37+00:00,1,335.0,385.0,6.416666666666667,62
4,61,quarter,1,00c3e69d-d9b9-4ac3-bf79-19707fe43637,21,5:35,"Magic lineup change (Jalen Suggs, Moritz Wagner, Tristan da Silva, Jett Howard, Paolo Banchero)",lineupchange,18,,basketball_play,1773962623,433,True,2026-03-19 23:23:43+00:00,1,335.0,385.0,6.416666666666667,63
4,60,quarter,1,7c980c51-fa76-4571-b165-242b2a00f3a1,21,5:35,"Hornets lineup change (Sion James, Kon Knueppel, LaMelo Ball, Ryan Kalkbrenner, Coby White)",lineupchange,18,,basketball_play,1773962623,432,True,2026-03-19 23:23:43+00:00,1,335.0,385.0,6.416666666666667,64
4,59,quarter,1,00c3e69d-d9b9-4ac3-bf79-19707fe43637,21,5:28,Tristan da Silva misses two point turnaround hook shot,twopointmiss,18,,basketball_play,1773962653,431,True,2026-03-19 23:24:13+00:00,1,328.0,392.0,6.533333333333333,65
4,58,quarter,1,7c980c51-fa76-4571-b165-242b2a00f3a1,21,5:24,Hornets defensive rebound,rebound,18,7c980c51-fa76-4571-b165-242b2a00f3a1,basketball_play,1773962657,430,True,2026-03-19 23:24:17+00:00,1,324.0,396.0,6.6,66
4,57,quarter,1,,21,5:24,Stoppage (Out of bounds),stoppage,18,,basketball_play,1773962658,429,True,2026-03-19 23:24:18+00:00,1,324.0,396.0,6.6,67
4,56,quarter,1,7c980c51-fa76-4571-b165-242b2a00f3a1,21,5:00,LaMelo Ball turnover (lost ball) (Jalen Suggs steals),turnover,18,00c3e69d-d9b9-4ac3-bf79-19707fe43637,basketball_play,1773962688,428,True,2026-03-19 23:24:48+00:00,1,300.0,420.0,7.0,68
4,55,quarter,1,00c3e69d-d9b9-4ac3-bf79-19707fe43637,23,4:54,Jalen Suggs makes two point running layup,twopointmade,18,7c980c51-fa76-4571-b165-242b2a00f3a1,basketball_play,1773962693,427,True,2026-03-19 23:24:53+00:00,1,294.0,426.0,7.1,69
4,54,quarter,1,00c3e69d-d9b9-4ac3-bf79-19707fe43637,23,4:51,Moritz Wagner shooting foul (Coby White draws the foul),shootingfoul,18,7c980c51-fa76-4571-b165-242b2a00f3a1,basketball_play,1773962702,426,True,2026-03-19 23:25:02+00:00,1,291.0,429.0,7.15,70
4,53,quarter,1,7c980c51-fa76-4571-b165-242b2a00f3a1,23,4:51,Coby White makes regular free throw 1 of 2,freethrowmade,19,7c980c51-fa76-4571-b165-242b2a00f3a1,basketball_play,1773962726,425,True,2026-03-19 23:25:26+00:00,1,291.0,429.0,7.15,71
4,52,quarter,1,00c3e69d-d9b9-4ac3-bf79-19707fe43637,23,4:51,"Magic lineup change (Jevon Carter, Moritz Wagner, Tristan da Silva, Jett Howard, Paolo Banchero)",lineupchange,19,,basketball_play,1773962742,424,True,2026-03-19 23:25:42+00:00,1,291.0,429.0,7.15,72
4,51,quarter,1,7c980c51-fa76-4571-b165-242b2a00f3a1,23,4:51,"Hornets lineup change (Kon Knueppel, Grant Williams, LaMelo Ball, Ryan Kalkbrenner, Coby White)",lineupchange,19,,basketball_play,1773962756,423,True,2026-03-19 23:25:56+00:00,1,291.0,429.0,7.15,73
4,50,quarter,1,7c980c51-fa76-4571-b165-242b2a00f3a1,23,4:51,Coby White makes regular free throw 2 of 2,freethrowmade,20,00c3e69d-d9b9-4ac3-bf79-19707fe43637,basketball_play,1773962756,422,True,2026-03-19 23:25:56+00:00,1,291.0,429.0,7.15,74
4,49,quarter,1,00c3e69d-d9b9-4ac3-bf79-19707fe43637,26,4:37,Jevon Carter makes three point pullup jump shot (Paolo Banchero assists),threepointmade,20,7c980c51-fa76-4571-b165-242b2a00f3a1,basketball_play,1773962775,421,True,2026-03-19 23:26:15+00:00,1,277.0,443.0,7.383333333333334,75
4,48,quarter,1,7c980c51-fa76-4571-b165-242b2a00f3a1,26,4:24,Paolo Banchero blocks LaMelo Ball's two point driving layup,twopointmiss,20,,basketball_play,1773962789,420,True,2026-03-19 23:26:29+00:00,1,264.0,456.0,7.6,76
4,47,quarter,1,00c3e69d-d9b9-4ac3-bf79-19707fe43637,26,4:24,Magic defensive rebound,rebound,20,00c3e69d-d9b9-4ac3-bf79-19707fe43637,basketball_play,1773962789,419,True,2026-03-19 23:26:29+00:00,1,264.0,456.0,7.6,77
4,46,quarter,1,,26,4:24,Stoppage (Out of bounds),stoppage,20,,basketball_play,1773962794,418,True,2026-03-19 23:26:34+00:00,1,264.0,456.0,7.6,78
4,45,quarter,1,00c3e69d-d9b9-4ac3-bf79-19707fe43637,26,4:24,"Magic lineup change (Jevon Carter, Moritz Wagner, Noah Penda, Jett Howard, Paolo Banchero)",lineupchange,20,,basketball_play,1773962825,417,True,2026-03-19 23:27:05+00:00,1,264.0,456.0,7.6,79
4,44,quarter,1,00c3e69d-d9b9-4ac3-bf79-19707fe43637,28,4:09,Moritz Wagner makes two point turnaround hook shot (Jevon Carter assists),twopointmade,20,7c980c51-fa76-4571-b165-242b2a00f3a1,basketball_play,1773962825,416,True,2026-03-19 23:27:05+00:00,1,249.0,471.0,7.85,80
4,43,quarter,1,7c980c51-fa76-4571-b165-242b2a00f3a1,28,3:59,Kon Knueppel makes two point jump shot (LaMelo Ball assists),twopointmade,22,00c3e69d-d9b9-4ac3-bf79-19707fe43637,basketball_play,1773962836,415,True,2026-03-19 23:27:16+00:00,1,239.0,481.0,8.016666666666667,81
4,42,quarter,1,7c980c51-fa76-4571-b165-242b2a00f3a1,28,3:46,LaMelo Ball personal foul (Jett Howard draws the foul),personalfoul,22,00c3e69d-d9b9-4ac3-bf79-19707fe43637,basketball_play,1773962860,414,True,2026-03-19 23:27:40+00:00,1,226.0,494.0,8.233333333333333,82
4,41,quarter,1,7c980c51-fa76-4571-b165-242b2a00f3a1,28,3:46,"Hornets lineup change (Josh Green, Kon Knueppel, Grant Williams, Ryan Kalkbrenner, Coby White)",lineupchange,22,,basketball_play,1773962879,413,True,2026-03-19 23:27:59+00:00,1,226.0,494.0,8.233333333333333,83
4,40,quarter,1,00c3e69d-d9b9-4ac3-bf79-19707fe43637,28,3:42,Jevon Carter misses three point stepback jump shot,threepointmiss,22,,basketball_play,1773962879,412,True,2026-03-19 23:27:59+00:00,1,222.0,498.0,8.3,84
4,39,quarter,1,7c980c51-fa76-4571-b165-242b2a00f3a1,28,3:39,Grant Williams defensive rebound,rebound,22,7c980c51-fa76-4571-b165-242b2a00f3a1,basketball_play,1773962881,411,True,2026-03-19 23:28:01+00:00,1,219.0,501.0,8.35,85
4,38,quarter,1,7c980c51-fa76-4571-b165-242b2a00f3a1,28,3:31,Kon Knueppel misses two point pullup jump shot,twopointmiss,22,,basketball_play,1773962888,410,True,2026-03-19 23:28:08+00:00,1,211.0,509.0,8.483333333333333,86
4,37,quarter,1,00c3e69d-d9b9-4ac3-bf79-19707fe43637,28,3:29,Jevon Carter defensive rebound,rebound,22,00c3e69d-d9b9-4ac3-bf79-19707fe43637,basketball_play,1773962890,409,True,2026-03-19 23:28:10+00:00,1,209.0,511.0,8.516666666666667,87
4,36,quarter,1,00c3e69d-d9b9-4ac3-bf79-19707fe43637,28,3:21,Paolo Banchero misses two point pullup jump shot,twopointmiss,22,,basketball_play,1773962899,408,True,2026-03-19 23:28:19+00:00,1,201.0,519.0,8.65,88
4,35,quarter,1,00c3e69d-d9b9-4ac3-bf79-19707fe43637,28,3:21,Magic offensive rebound,rebound,22,00c3e69d-d9b9-4ac3-bf79-19707fe43637,basketball_play,1773962899,407,True,2026-03-19 23:28:19+00:00,1,201.0,519.0,8.65,89
4,34,quarter,1,,28,3:21,Stoppage (Out of bounds),stoppage,22,,basketball_play,1773962904,406,True,2026-03-19 23:28:24+00:00,1,201.0,519.0,8.65,90
4,33,quarter,1,00c3e69d-d9b9-4ac3-bf79-19707fe43637,30,3:13,Paolo Banchero makes two point driving reverse layup (Noah Penda assists),twopointmade,22,7c980c51-fa76-4571-b165-242b2a00f3a1,basketball_play,1773962931,405,True,2026-03-19 23:28:51+00:00,1,193.0,527.0,8.783333333333333,91
4,32,quarter,1,7c980c51-fa76-4571-b165-242b2a00f3a1,30,3:12,Hornets 60 second timeout,teamtimeout,22,,basketball_play,1773962951,404,True,2026-03-19 23:29:11+00:00,1,192.0,528.0,8.8,92
4,31,quarter,1,7c980c51-fa76-4571-b165-242b2a00f3a1,30,2:58,Kon Knueppel misses three point pullup jump shot,threepointmiss,22,,basketball_play,1773963128,403,True,2026-03-19 23:32:08+00:00,1,178.0,542.0,9.033333333333333,93
4,30,quarter,1,7c980c51-fa76-4571-b165-242b2a00f3a1,30,2:56,Ryan Kalkbrenner offensive rebound,rebound,22,7c980c51-fa76-4571-b165-242b2a00f3a1,basketball_play,1773963130,402,True,2026-03-19 23:32:10+00:00,1,176.0,544.0,9.066666666666666,94
4,29,quarter,1,7c980c51-fa76-4571-b165-242b2a00f3a1,30,2:54,Ryan Kalkbrenner turnover (bad pass) (Jett Howard steals),turnover,22,00c3e69d-d9b9-4ac3-bf79-19707fe43637,basketball_play,1773963133,401,True,2026-03-19 23:32:13+00:00,1,174.0,546.0,9.1,95
4,28,quarter,1,00c3e69d-d9b9-4ac3-bf79-19707fe43637,30,2:33,Moritz Wagner misses three point jump shot,threepointmiss,22,,basketball_play,1773963151,400,True,2026-03-19 23:32:31+00:00,1,153.0,567.0,9.45,96
4,27,quarter,1,7c980c51-fa76-4571-b165-242b2a00f3a1,30,2:30,Josh Green defensive rebound,rebound,22,7c980c51-fa76-4571-b165-242b2a00f3a1,basketball_play,1773963154,399,True,2026-03-19 23:32:34+00:00,1,150.0,570.0,9.5,97
4,26,quarter,1,7c980c51-fa76-4571-b165-242b2a00f3a1,30,2:21,Ryan Kalkbrenner makes two point hook shot (Coby White assists),twopointmade,24,00c3e69d-d9b9-4ac3-bf79-19707fe43637,basketball_play,1773963163,398,True,2026-03-19 23:32:43+00:00,1,141.0,579.0,9.65,98
4,25,quarter,1,00c3e69d-d9b9-4ac3-bf79-19707fe43637,30,2:07,Moritz Wagner misses two point driving layup,twopointmiss,24,,basketball_play,1773963182,397,True,2026-03-19 23:33:02+00:00,1,127.0,593.0,9.883333333333333,99
4,24,quarter,1,00c3e69d-d9b9-4ac3-bf79-19707fe43637,30,2:05,Jevon Carter offensive rebound,rebound,24,00c3e69d-d9b9-4ac3-bf79-19707fe43637,basketball_play,1773963184,396,True,2026-03-19 23:33:04+00:00,1,125.0,595.0,9.916666666666666,100
4,23,quarter,1,00c3e69d-d9b9-4ac3-bf79-19707fe43637,30,2:04,Jevon Carter misses three point jump shot,threepointmiss,24,,basketball_play,1773963186,395,True,2026-03-19 23:33:06+00:00,1,124.0,596.0,9.933333333333334,101
4,22,quarter,1,7c980c51-fa76-4571-b165-242b2a00f3a1,30,2:02,Kon Knueppel defensive rebound,rebound,24,7c980c51-fa76-4571-b165-242b2a00f3a1,basketball_play,1773963188,394,True,2026-03-19 23:33:08+00:00,1,122.0,598.0,9.966666666666667,102
4,21,quarter,1,7c980c51-fa76-4571-b165-242b2a00f3a1,30,1:48,Coby White makes two point driving layup,twopointmade,26,00c3e69d-d9b9-4ac3-bf79-19707fe43637,basketball_play,1773963196,393,True,2026-03-19 23:33:16+00:00,1,108.0,612.0,10.2,103
4,20,quarter,1,00c3e69d-d9b9-4ac3-bf79-19707fe43637,30,1:28,Noah Penda misses three point jump shot,threepointmiss,26,,basketball_play,1773963220,392,True,2026-03-19 23:33:40+00:00,1,88.0,632.0,10.533333333333333,104
4,19,quarter,1,00c3e69d-d9b9-4ac3-bf79-19707fe43637,30,1:28,Magic offensive rebound,rebound,26,00c3e69d-d9b9-4ac3-bf79-19707fe43637,basketball_play,1773963220,391,True,2026-03-19 23:33:40+00:00,1,88.0,632.0,10.533333333333333,105
4,18,quarter,1,7c980c51-fa76-4571-b165-242b2a00f3a1,30,1:28,Coby White personal foul (Loose ball) (Moritz Wagner draws the foul),personalfoul,26,00c3e69d-d9b9-4ac3-bf79-19707fe43637,basketball_play,1773963223,390,True,2026-03-19 23:33:43+00:00,1,88.0,632.0,10.533333333333333,106
4,17,quarter,1,00c3e69d-d9b9-4ac3-bf79-19707fe43637,30,1:28,"Magic lineup change (Jevon Carter, Desmond Bane, Moritz Wagner, Noah Penda, Jett Howard)",lineupchange,26,,basketball_play,1773963254,389,True,2026-03-19 23:34:14+00:00,1,88.0,632.0,10.533333333333333,107
